{
  "id": "df88c9df-8331-43eb-9489-0e421884357b",
  "created_at": "2026-01-09T16:08:50.55882+00:00",
  "status": "completed",
  "scenario_key": "wa_onboarding_optin_yes_no_plan__simulated_plan_activation__run_1767974927727_69ca2b",
  "transcript": [
    {
      "role": "user",
      "content": "Oui",
      "agent_used": null,
      "created_at": "2026-01-09T16:08:50.938463+00:00"
    },
    {
      "role": "assistant",
      "content": "C'est not√©.\n\nMaintenant, il faut que tu ailles finaliser ton plan sur ton espace pour qu'on puisse vraiment passer √† l'action : https://sophia-coach.ai\n\nR√©ponds-moi juste \"C'est bon\" d√®s que c'est valid√© de ton c√¥t√© üòâ.",
      "agent_used": "companion",
      "created_at": "2026-01-09T16:08:59.870818+00:00"
    },
    {
      "role": "user",
      "content": "C'est bon. Et ensuite ?",
      "agent_used": null,
      "created_at": "2026-01-09T16:09:48.834008+00:00"
    },
    {
      "role": "assistant",
      "content": "Ton plan La Forge de la Clart√© est d√©sormais actif. On passe d'un √©tat de surcharge √† une structure de pr√©cision. üöÄ\n\nAvant de lancer les premi√®res actions, je dois calibrer ton engagement pour ajuster la pression du syst√®me.\n\nSur une √©chelle de 1 √† 10, quel est ton niveau de motivation pour attaquer ce grand d√©broussaillage aujourd'hui ? (Ex: 8/10)",
      "agent_used": "architect",
      "created_at": "2026-01-09T16:09:57.122482+00:00"
    },
    {
      "role": "user",
      "content": "8/10. Pr√™t √† d√©marrer.",
      "agent_used": null,
      "created_at": "2026-01-09T16:10:00.006833+00:00"
    },
    {
      "role": "assistant",
      "content": "Un 8/10 est un excellent score pour poser les premi√®res briques de ta structure. On commence imm√©diatement par ton Audit des Voleurs de Temps et d'√ânergie pour boucher les fuites.\n\nPour lancer le scan, quelle est la distraction pr√©cise (appli, notification, pens√©e) qui t'a le plus fait perdre le fil aujourd'hui ? üöÄ",
      "agent_used": "architect",
      "created_at": "2026-01-09T16:10:07.866536+00:00"
    },
    {
      "role": "user",
      "content": "Les emails pro, sans h√©siter.",
      "agent_used": null,
      "created_at": "2026-01-09T16:10:11.073435+00:00"
    },
    {
      "role": "assistant",
      "content": "Les emails pro sont des voleurs d'attention redoutables car ils fragmentent ton focus sous couvert d'urgence. C'est une fuite d'√©nergie majeure identifi√©e. üìß\n\nPour finaliser ton audit, quel impact concret ressens-tu sur tes projets les plus importants quand tu te laisses aspirer par ta bo√Æte de r√©ception toute la journ√©e ?",
      "agent_used": "architect",
      "created_at": "2026-01-09T16:10:23.647055+00:00"
    },
    {
      "role": "user",
      "content": "√áa retarde tout le reste et je me sens sous l'eau.",
      "agent_used": null,
      "created_at": "2026-01-09T16:10:28.585537+00:00"
    },
    {
      "role": "assistant",
      "content": "L'audit est maintenant int√©gr√© pour t'aider √† sortir de cette sensation d'apn√©e. Mettre des mots sur ce qui te ralentit est essentiel pour commencer √† all√©ger ta charge mentale d√®s maintenant.\n\nParmi les √©l√©ments que tu as identifi√©s, lequel p√®se le plus lourd sur tes journ√©es en ce moment ?",
      "agent_used": "architect",
      "created_at": "2026-01-09T16:10:55.0804+00:00"
    },
    {
      "role": "user",
      "content": "La sensation d'√™tre sous l'eau √† cause de tout √ßa.",
      "agent_used": null,
      "created_at": "2026-01-09T16:10:59.262215+00:00"
    },
    {
      "role": "assistant",
      "content": "Cette sensation d'asphyxie est le signal que ton syst√®me sature sous le poids des urgences subies. Pour reprendre le contr√¥le, nous devons d'abord s√©curiser tes zones de repos pour √©viter que le pro n'envahisse ton mental 24h/24. üåä\n\nOn commence par prot√©ger ta soir√©e. Es-tu pr√™te √† appliquer ton Couvre-feu Digital d√®s 21h00 ce soir, sans aucune exception pour consulter tes emails ?",
      "agent_used": "architect",
      "created_at": "2026-01-09T16:11:26.884939+00:00"
    },
    {
      "role": "user",
      "content": "Oui, je peux essayer ce soir.",
      "agent_used": null,
      "created_at": "2026-01-09T16:11:30.228745+00:00"
    },
    {
      "role": "assistant",
      "content": "L'engagement est pris. √Ä 21h00 pile, tes √©crans quittent ton champ de vision pour une autre pi√®ce. C'est le premier verrou de s√©curit√© indispensable pour prot√©ger ton √©nergie du lendemain. üîí\n\nEn attendant, concernant ton Audit des Voleurs de Temps, quelle est la distraction principale qui te fait perdre le fil quand tu es devant ton bureau ?",
      "agent_used": "architect",
      "created_at": "2026-01-09T16:11:40.028126+00:00"
    },
    {
      "role": "user",
      "content": "Les notifications du t√©l√©phone, je pense.",
      "agent_used": null,
      "created_at": "2026-01-09T16:11:44.544049+00:00"
    },
    {
      "role": "assistant",
      "content": "Le telephone est le premier levier de deconcentration. S'il est visible, ton cerveau traite l'information meme sans notification, ce qui fragmente ton attention. üì±\n\nLa solution est radicale : pendant tes phases de focus, ton telephone doit changer de piece ou etre mis hors de vue.\n\nEs-tu prete a tester le mode Avion et le rangement dans un tiroir des ta prochaine session de travail demain ? üéØ",
      "agent_used": "architect",
      "created_at": "2026-01-09T16:11:52.934136+00:00"
    },
    {
      "role": "user",
      "content": "Ok, je note pour demain. Quoi d'autre ?",
      "agent_used": null,
      "created_at": "2026-01-09T16:11:56.724805+00:00"
    },
    {
      "role": "assistant",
      "content": "L'√©tape suivante est ton Audit des Voleurs de Temps. C'est un scan impitoyable de tes journ√©es pour identifier pr√©cis√©ment o√π ton √©nergie s'√©vapore. Sans ce diagnostic, on avance √† l'aveugle. üìù\n\nUne fois cet audit compl√©t√©, nous passerons √† la pr√©paration de ton Espace de Travail Sacr√© pour sanctuariser ton focus.\n\nAs-tu 5 minutes demain matin pour remplir les premi√®res sections de cet audit sur ton tableau de bord ? ‚òï",
      "agent_used": "architect",
      "created_at": "2026-01-09T16:12:05.983464+00:00"
    },
    {
      "role": "user",
      "content": "Oui, 5 min c'est bon. C'est quoi cet audit exactement ?",
      "agent_used": null,
      "created_at": "2026-01-09T16:12:08.585747+00:00"
    },
    {
      "role": "assistant",
      "content": "C'est un diagnostic pour cartographier tes fuites d'√©nergie. On analyse tes distractions (notifications), ton d√©sordre logistique (emails, priorit√©s floues) et l'impact concret sur ton stress. L'objectif est de rendre visible l'invisible pour mieux le neutraliser. üìù\n\nL'exercice comporte trois sections simples √† remplir sur ton tableau de bord pour identifier tes saboteurs.\n\nQuelle est la distraction qui revient le plus souvent quand tu essaies de te concentrer ?",
      "agent_used": "architect",
      "created_at": "2026-01-09T16:12:15.800202+00:00"
    }
  ],
  "state_before": {
    "profile": {
      "id": "14c1fe63-3846-4e8b-ba0e-2cec9d523998",
      "email": "run-evals+d2713c0507a14a@example.com",
      "full_name": "Eval Runner",
      "trial_end": "2026-01-16T16:08:50.323+00:00",
      "phone_number": "+15552004814951",
      "phone_invalid": false,
      "whatsapp_state": null,
      "phone_verified_at": "2026-01-09T16:08:50.334+00:00",
      "whatsapp_opted_in": true,
      "whatsapp_opted_out_at": null,
      "whatsapp_optin_sent_at": null,
      "whatsapp_optout_reason": null,
      "whatsapp_bilan_opted_in": false,
      "whatsapp_last_inbound_at": "2026-01-09T16:10:59.255+00:00",
      "whatsapp_last_outbound_at": null,
      "whatsapp_state_updated_at": "2026-01-09T16:10:07.87+00:00",
      "whatsapp_optout_confirmed_at": null
    },
    "chat_state": {
      "scope": "whatsapp",
      "user_id": "14c1fe63-3846-4e8b-ba0e-2cec9d523998",
      "risk_level": 5,
      "updated_at": "2026-01-09T16:10:55.071143+00:00",
      "current_mode": "architect",
      "last_processed_at": "2026-01-09T16:08:50.953+00:00",
      "short_term_context": "",
      "investigation_state": null,
      "last_interaction_at": "2026-01-09T16:08:50.955186+00:00",
      "unprocessed_msg_count": 5
    }
  },
  "state_after": {
    "profile": {
      "id": "14c1fe63-3846-4e8b-ba0e-2cec9d523998",
      "email": "run-evals+d2713c0507a14a@example.com",
      "full_name": "Eval Runner",
      "trial_end": "2026-01-16T16:08:50.323+00:00",
      "phone_number": "+15552004814951",
      "phone_invalid": false,
      "whatsapp_state": null,
      "phone_verified_at": "2026-01-09T16:08:50.334+00:00",
      "whatsapp_opted_in": true,
      "whatsapp_opted_out_at": null,
      "whatsapp_optin_sent_at": null,
      "whatsapp_optout_reason": null,
      "whatsapp_bilan_opted_in": false,
      "whatsapp_last_inbound_at": "2026-01-09T16:12:08.58+00:00",
      "whatsapp_last_outbound_at": null,
      "whatsapp_state_updated_at": "2026-01-09T16:10:07.87+00:00",
      "whatsapp_optout_confirmed_at": null
    },
    "chat_state": {
      "scope": "whatsapp",
      "user_id": "14c1fe63-3846-4e8b-ba0e-2cec9d523998",
      "risk_level": 0,
      "updated_at": "2026-01-09T16:12:15.794204+00:00",
      "current_mode": "architect",
      "last_processed_at": "2026-01-09T16:08:50.953+00:00",
      "short_term_context": "",
      "investigation_state": null,
      "last_interaction_at": "2026-01-09T16:08:50.955186+00:00",
      "unprocessed_msg_count": 10
    }
  },
  "issues": [
    {
      "code": "looping_context_amnesia",
      "message": "The Architect repeatedly asks for the 'main distraction' (3 times) despite the user having already answered 'emails' and 'phone notifications' in the immediate context.",
      "evidence": {
        "snippet": "Quelle est la distraction qui revient le plus souvent quand tu essaies de te concentrer ?",
        "agent_used": "sophia.architect"
      },
      "severity": "high"
    },
    {
      "code": "incoherent_process_flow",
      "message": "Contradiction in flow progression: states the Audit starts 'immediately', conducts parts of it conversationally, then later claims the Audit is the 'next step' to be done tomorrow.",
      "evidence": {
        "snippet": "L'√©tape suivante est ton Audit des Voleurs de Temps. [...] On commence imm√©diatement par ton Audit",
        "agent_used": "sophia.architect"
      },
      "severity": "medium"
    }
  ],
  "suggestions": [
    {
      "action": "append",
      "rationale": "Prevents the agent from entering a loop where it restarts the questionnaire after explaining a concept, ignoring previously collected data.",
      "prompt_key": "sophia.architect",
      "context_block": "=== CONTEXT (transcript excerpt) ===\n#16 USER: Ok, je note pour demain. Quoi d'autre ?\n#17 ASSISTANT(architect): L'√©tape suivante est ton Audit des Voleurs de Temps. C'est un scan impitoyable de tes journ√©es pour identifier pr√©cis√©ment o√π ton √©nergie s'√©vapore. Sans ce diagnostic, on avance √† l'aveugle. üìù Une fois cet audit compl√©t√©, nous passerons √† la pr√©paration de ton Espace de Travail Sacr√© pour sanctuariser ton focus. As-tu 5 minutes demain matin pour remplir les premi√®res sections de cet audit sur ton tableau de bord ? ‚òï\n#18 USER: Oui, 5 min c'est bon. C'est quoi cet audit exactement ?\n#19 ASSISTANT(architect): C'est un diagnostic pour cartographier tes fuites d'√©nergie. On analyse tes distractions (notifications), ton d√©sordre logistique (emails, priorit√©s floues) et l'impact concret sur ton stress. L'objectif est de rendre visible l'invisible pour mieux le neutraliser. üìù L'exercice comporte trois sections simples √† remplir sur ton tableau de bord pour identifier tes saboteurs. Quelle est la distraction qui revient le plus souvent quand tu essaies de te concentrer ?\n\n=== APPLY ===\nprompt_key: sophia.architect\naction: append\n\nproposed_addendum:\nCONTEXT CHECK: Before asking a diagnostic question (e.g., 'what is your main distraction'), verify if the user has already provided this information in the recent conversation history. If yes, acknowledge the previous answer and proceed to the next step (solution or dashboard assignment) instead of repeating the question.",
      "proposed_addendum": "CONTEXT CHECK: Before asking a diagnostic question (e.g., 'what is your main distraction'), verify if the user has already provided this information in the recent conversation history. If yes, acknowledge the previous answer and proceed to the next step (solution or dashboard assignment) instead of repeating the question."
    }
  ],
  "metrics": {
    "cost_usd": 0.0713306,
    "request_id": "wa_onboarding_bundle:wa_onboarding_optin_yes_no_plan__simulated_plan_activation__run_1767974927727_69ca2b:i0:s1916298011:core:wa_onboarding_optin_yes_no_plan__simulated_plan_activation__run_1767974927727_69ca2b",
    "total_tokens": 150879,
    "output_tokens": 2692,
    "prompt_tokens": 115604,
    "judge_llm_used": true,
    "mega_test_mode": false
  },
  "config": {
    "tags": [
      "whatsapp.onboarding",
      "whatsapp.webhook",
      "realistic",
      "simulated_transport"
    ],
    "limits": {
      "model": "gemini-3-pro-preview",
      "user_difficulty": "mid",
      "bilan_actions_count": 0,
      "test_post_checkup_deferral": false
    },
    "channel": "whatsapp",
    "request_id": "wa_onboarding_bundle:wa_onboarding_optin_yes_no_plan__simulated_plan_activation__run_1767974927727_69ca2b:i0:s1916298011:core:wa_onboarding_optin_yes_no_plan__simulated_plan_activation__run_1767974927727_69ca2b",
    "description": "WhatsApp onboarding (webhook): accept opt-in with no plan, then simulate that a plan becomes active when user says 'C'est bon' (to test progression past onboarding finalization).",
    "plan_snapshot": {
      "plan": {
        "id": "a56afc6f-7db8-4302-a81d-06bb0b73fade",
        "title": "La Forge de la Clart√©",
        "status": "active",
        "content": {
          "phases": [
            {
              "id": 1,
              "title": "Phase 1 : Le Grand D√©broussaillage - L'√âveil de la Clart√©",
              "status": "active",
              "actions": [
                {
                  "id": "e822737e-fa94-4aed-9592-e1b3ae1a0eba",
                  "tips": "Sois honn√™te avec toi-m√™me. Observe sans juger, puis agis. Fais-le sur une journ√©e typique.",
                  "type": "framework",
                  "title": "Audit des Voleurs de Temps et d'√ânergie",
                  "status": "active",
                  "questType": "main",
                  "rationale": "Tu ne peux pas vaincre un ennemi que tu ne connais pas. Cet audit r√©v√®le tes points de fuite d'√©nergie.",
                  "targetReps": 1,
                  "description": "Identifie pr√©cis√©ment ce qui te submerge et te d√©concentre. Un scan impitoyable de tes habitudes et de ton environnement.",
                  "isCompleted": false,
                  "time_of_day": "any_time",
                  "tracking_type": "boolean",
                  "frameworkDetails": {
                    "type": "one_shot",
                    "intro": "L'objectif est de cartographier tes principales sources de distraction et de d√©sorganisation. Pense √† tes journ√©es, aux moments o√π tu te sens submerg√©e ou que tu perds le fil. Qu'est-ce qui en est la cause ? Note tout, sans filtre.",
                    "sections": [
                      {
                        "id": "s1_distraction",
                        "label": "Distractions fr√©quentes (ex: r√©seaux sociaux, notifications)",
                        "inputType": "list",
                        "placeholder": "Smartphone/Instagram"
                      },
                      {
                        "id": "s1_desorganisation",
                        "label": "Sources de d√©sorganisation (ex: email en d√©sordre, priorit√©s floues)",
                        "inputType": "list",
                        "placeholder": "Bo√Æte mail non trait√©e"
                      },
                      {
                        "id": "s1_impact",
                        "label": "Impact ressenti (court/long terme)",
                        "inputType": "textarea",
                        "placeholder": "Perte de 30 min, frustration, moins bonne qualit√© de sommeil."
                      }
                    ]
                  }
                },
                {
                  "id": "a75664eb-a02d-472b-9b33-058d5b155f34",
                  "tips": "Charge ton t√©l√©phone loin de ton lit. Trouve une activit√© relaxante alternative : lire, √©couter de la musique, discuter.",
                  "type": "habitude",
                  "title": "Le Couvre-feu Digital Solide (21h)",
                  "status": "active",
                  "questType": "side",
                  "rationale": "Le cerveau a besoin de d√©connecter de la lumi√®re bleue et de la stimulation cognitive intense pour pr√©parer un sommeil r√©parateur, essentiel √† ton √©nergie et ton focus du lendemain.",
                  "targetReps": 7,
                  "description": "√âteins tous les √©crans personnels (t√©l√©phone, tablette, TV) apr√®s 21h. Replace-les hors de ta vue, id√©alement dans une autre pi√®ce.",
                  "isCompleted": false,
                  "time_of_day": "night",
                  "tracking_type": "boolean"
                },
                {
                  "id": "76fc9dc7-f118-4972-9246-5c5b024ee614",
                  "tips": "Commence petit : un tiroir, puis ton bureau. Fais-en un rituel de fin de journ√©e.",
                  "type": "mission",
                  "title": "Pr√©parer ton Espace de Travail Sacr√©",
                  "status": "pending",
                  "questType": "side",
                  "rationale": "Un environnement ordonn√© se traduit par un esprit ordonn√©. Moins de stimuli visuels, moins de distractions, plus de focus.",
                  "description": "D√©sencombre et organise ton espace de travail principal. Une place pour chaque chose, chaque chose √† sa place. √âlimine tout ce qui n'est pas li√© √† la t√¢che en cours.",
                  "isCompleted": false,
                  "time_of_day": "any_time",
                  "tracking_type": "boolean"
                }
              ],
              "subtitle": "Semaine 1 ‚Ä¢ Poser les fondations d'un esprit net",
              "rationale": "Avant de construire, il faut d√©blayer. Cette phase vise √† identifier et neutraliser les plus grands saboteurs de ton focus pour cr√©er un terrain propice √† la concentration."
            },
            {
              "id": 2,
              "title": "Phase 2 : L'Architecture du Focus - Les Piliers du Profond",
              "status": "locked",
              "actions": [
                {
                  "id": "1e189d53-0a27-42ce-be0e-73c9edc71f29",
                  "tips": "Utilise la technique Pomodoro (ex: 25 min de travail, 5 min de pause) ou une minuterie. Informe ton entourage de ton indisponibilit√©.",
                  "type": "habitude",
                  "title": "Le Bloc de Concentration Profonde (90 min)",
                  "status": "pending",
                  "questType": "main",
                  "rationale": "La capacit√© √† se concentrer intens√©ment sur une seule t√¢che est la cl√© de la productivit√©. Ce bloc entra√Æne ton cerveau √† l'effort soutenu, r√©duisant la sensation d'√™tre submerg√©e.",
                  "targetReps": 7,
                  "description": "D√©die un bloc de 90 minutes, sans aucune interruption (t√©l√©phone en mode avion, notifications coup√©es), √† ta t√¢che la plus importante de la journ√©e.",
                  "isCompleted": false,
                  "time_of_day": "morning",
                  "tracking_type": "boolean"
                },
                {
                  "id": "b97366cc-8861-4a7b-a02b-20487415c6d5",
                  "tips": "Sois r√©aliste. Ces t√¢ches doivent √™tre SMART (Sp√©cifiques, Mesurables, Atteignables, R√©alistes, Temporellement d√©finies).",
                  "type": "framework",
                  "title": "Le Manifeste des 3 Priorit√©s Quotidiennes",
                  "status": "pending",
                  "questType": "side",
                  "rationale": "La clart√© des priorit√©s √©limine la d√©sorganisation et le sentiment d'√™tre submerg√©. Elle dirige ton √©nergie vers ce qui compte vraiment, cr√©ant un impact maximal.",
                  "targetReps": 7,
                  "description": "Chaque matin, avant de commencer, identifie et √©cris les 3 t√¢ches les plus critiques √† accomplir dans la journ√©e pour avancer vers tes objectifs majeurs.",
                  "isCompleted": false,
                  "time_of_day": "morning",
                  "tracking_type": "boolean",
                  "frameworkDetails": {
                    "type": "recurring",
                    "intro": "Chaque jour est une page blanche. Quelles sont les 3 actions qui auront le plus grand impact sur tes objectifs et ton bien-√™tre ? Ne te laisse pas distraire par le superflu. Choisis sagement.",
                    "sections": [
                      {
                        "id": "s2_prio1",
                        "label": "Priorit√© 1 (Majeure)",
                        "inputType": "text",
                        "placeholder": "Finaliser le rapport X"
                      },
                      {
                        "id": "s2_prio2",
                        "label": "Priorit√© 2 (Impact important)",
                        "inputType": "text",
                        "placeholder": "R√©pondre aux emails critiques"
                      },
                      {
                        "id": "s2_prio3",
                        "label": "Priorit√© 3 (Contribue au progr√®s)",
                        "inputType": "text",
                        "placeholder": "Planifier la semaine prochaine"
                      }
                    ]
                  }
                },
                {
                  "id": "adea1951-c3b1-4871-a450-649756a957d7",
                  "tips": "Utilise une alarme discr√®te. L'objectif est de 'd√©charger' mentalement, pas de te divertir.",
                  "type": "habitude",
                  "title": "La Micro-Pause Active",
                  "status": "pending",
                  "questType": "side",
                  "rationale": "Ces pauses r√©g√©n√®rent ta capacit√© d'attention, pr√©viennent la fatigue mentale et maintiennent un niveau d'√©nergie stable tout au long de la journ√©e, r√©duisant le risque de perdre le fil.",
                  "targetReps": 14,
                  "description": "Toutes les 60-90 minutes de travail, l√®ve-toi, √©tire-toi, bois de l'eau ou regarde par la fen√™tre pendant 5 minutes. Pas d'√©crans suppl√©mentaires.",
                  "isCompleted": false,
                  "time_of_day": "any_time",
                  "tracking_type": "boolean"
                }
              ],
              "subtitle": "Semaine 2 ‚Ä¢ B√¢tir des syst√®mes de concentration in√©branlables",
              "rationale": "Maintenant que le terrain est d√©gag√©, nous allons installer les syst√®mes qui te permettront de plonger dans des √©tats de concentration profonde et de g√©rer tes priorit√©s avec une clart√© absolue."
            },
            {
              "id": 3,
              "title": "Phase 3 : Le Ma√Ætre du Temps et de l'√ânergie - Le Flow Ininterrompu",
              "status": "locked",
              "actions": [
                {
                  "id": "5549efb3-0de8-421e-a6e5-edefb36b081b",
                  "tips": "Cr√©e une liste '√Ä faire demain'. Ne te pr√©occupe pas de leur r√©alisation, juste de les capturer.",
                  "type": "habitude",
                  "title": "Le Check-in du Soir Anti-Surcharge",
                  "status": "pending",
                  "questType": "main",
                  "rationale": "Ce rituel permet de lib√©rer ton esprit des pr√©occupations pour la nuit, am√©liore la qualit√© de ton sommeil et te pr√©pare pour une journ√©e claire et productive, r√©duisant le 'perdre le fil'.",
                  "targetReps": 7,
                  "description": "Avant de quitter ton bureau ou de te d√©connecter, prends 10 minutes pour noter les 3 priorit√©s du lendemain et vider ta t√™te de toutes les pens√©es r√©siduelles. Transf√®re-les sur papier ou dans ton syst√®me.",
                  "isCompleted": false,
                  "time_of_day": "evening",
                  "tracking_type": "boolean"
                },
                {
                  "id": "357fbbb2-b707-4b39-bcd0-23878f444f70",
                  "tips": "L'objectif est de te donner un sentiment de contr√¥le et d'ancrage d√®s le r√©veil. Choisis des actions simples et gratifiantes.",
                  "type": "mission",
                  "title": "D√©finir tes Non-N√©gociables du Matin",
                  "status": "pending",
                  "questType": "side",
                  "rationale": "Commencer la journ√©e avec intention et des actions positives renforce ta stabilit√© √©motionnelle, ton √©nergie et ta discipline, te pr√©parant mentalement pour le focus.",
                  "description": "Identifie 2-3 activit√©s courtes mais puissantes (ex: m√©ditation de 5 min, verre d'eau, √©tirements) que tu r√©aliseras chaque matin avant de consulter tout √©cran ou email.",
                  "isCompleted": false,
                  "time_of_day": "any_time",
                  "tracking_type": "boolean"
                },
                {
                  "id": "05fa199a-7c27-42d3-a509-fe4ddbd567e0",
                  "tips": "Ne juge pas la pens√©e, capture-la et passe √† autre chose. L'important est de ne pas 'suivre le fil'.",
                  "type": "habitude",
                  "title": "Le Bloc de R√©sistance √† la Distraction",
                  "status": "pending",
                  "questType": "side",
                  "rationale": "Cette technique entra√Æne ton cerveau √† reconna√Ætre les distractions sans leur donner du pouvoir. Elle renforce ta capacit√© √† maintenir le focus et √† √©viter de te sentir submerg√©e.",
                  "targetReps": 7,
                  "description": "Pendant ton bloc de concentration, si une pens√©e non pertinente ou une envie de consulter ton t√©l√©phone survient, note-la rapidement sur un carnet 'parking' sans interrompre ta t√¢che principale, puis reviens imm√©diatement √† ton travail.",
                  "isCompleted": false,
                  "time_of_day": "any_time",
                  "tracking_type": "boolean"
                }
              ],
              "subtitle": "Semaine 3 ‚Ä¢ Optimiser tes ressources internes pour une performance fluide",
              "rationale": "Avec des fondations solides, nous allons affiner ta gestion de l'√©nergie et du temps pour cultiver un √©tat de 'flow' o√π la discipline devient naturelle et le focus, in√©branlable."
            },
            {
              "id": 4,
              "title": "Phase 4 : L'Ancrage de l'Excellence - Le Sillage de la Ma√Ætrise",
              "status": "locked",
              "actions": [
                {
                  "id": "001a302c-aad2-46a3-a1da-697e5d6b1eba",
                  "tips": "Compare ton √©tat actuel √† celui d'il y a 4 semaines. Quelles sont les diff√©rences les plus frappantes ?",
                  "type": "framework",
                  "title": "La R√©trospective de Ma√Ætre : Un mois de Transformation",
                  "status": "pending",
                  "questType": "main",
                  "rationale": "La r√©flexion est un pilier de l'apprentissage et de l'ancrage comportemental. Elle solidifie les nouvelles connexions neuronales et pr√©pare le terrain pour une croissance continue.",
                  "targetReps": 1,
                  "description": "Prends le temps de r√©fl√©chir √† tes progr√®s, aux d√©fis rencontr√©s et aux syst√®mes qui ont eu le plus grand impact sur ton focus et ta discipline. C√©l√®bre tes victoires.",
                  "isCompleted": false,
                  "time_of_day": "any_time",
                  "tracking_type": "boolean",
                  "frameworkDetails": {
                    "type": "one_shot",
                    "intro": "Tu as parcouru un chemin intense en 4 semaines. Il est temps de te poser et de mesurer la distance parcourue. Qu'as-tu appris sur toi-m√™me et sur ta capacit√© √† architecturer ta vie ? Sois fi√®re de chaque pas.",
                    "sections": [
                      {
                        "id": "s4_victoires",
                        "label": "Mes 3 plus grandes victoires ce mois-ci",
                        "inputType": "list",
                        "placeholder": "J'ai r√©ussi mon premier bloc de 90 min sans interruption."
                      },
                      {
                        "id": "s4_defis",
                        "label": "Les d√©fis que j'ai surmont√©s et comment",
                        "inputType": "textarea",
                        "placeholder": "L'envie de scroller le soir √©tait forte, mais j'ai remplac√© par la lecture."
                      },
                      {
                        "id": "s4_ancrage",
                        "label": "Une habitude que je veux ancrer d√©finitivement",
                        "inputType": "text",
                        "placeholder": "Le Check-in du Soir Anti-Surcharge."
                      },
                      {
                        "id": "s4_next",
                        "label": "Mon prochain objectif focus/discipline pour le mois √† venir",
                        "inputType": "text",
                        "placeholder": "Int√©grer 2 blocs de concentration par jour."
                      }
                    ]
                  }
                },
                {
                  "id": "430d201c-13af-4ad3-a09b-a7c46f930e63",
                  "tips": "La r√©p√©tition est la m√®re de la ma√Ætrise. Ne change rien √† cette routine pendant 7 jours.",
                  "type": "habitude",
                  "title": "La Routine de Fin de Journ√©e Immuable",
                  "status": "pending",
                  "questType": "side",
                  "rationale": "Cette routine cr√©e un signal fort pour ton cerveau qu'il est temps de ralentir et de se pr√©parer au repos, optimisant la qualit√© de ton sommeil et consolidant ta discipline quotidienne.",
                  "targetReps": 7,
                  "description": "Cr√©e une s√©quence fixe de 3-4 actions apaisantes (ex: lecture, musique douce, pr√©paration des v√™tements du lendemain) que tu r√©alises chaque soir apr√®s ton couvre-feu digital et avant de te coucher.",
                  "isCompleted": false,
                  "time_of_day": "evening",
                  "tracking_type": "boolean"
                },
                {
                  "id": "c59c9269-900c-4505-9ce1-327e2fb63a88",
                  "tips": "Pense aux prochaines √©tapes de ta croissance personnelle ou professionnelle. Qu'est-ce qui te passionne ?",
                  "type": "mission",
                  "title": "Planifier ta Prochaine Qu√™te",
                  "status": "pending",
                  "questType": "side",
                  "rationale": "L'architecte ne s'arr√™te jamais de construire. Cette planification assure la continuit√© de ta transformation et maintient ta motivation √† cultiver ta clart√© et ta discipline.",
                  "description": "Utilise les enseignements de ta r√©trospective pour d√©finir un ou deux objectifs clairs et une strat√©gie pour le mois suivant, en appliquant les principes de clart√© et de discipline que tu as appris.",
                  "isCompleted": false,
                  "time_of_day": "any_time",
                  "tracking_type": "boolean"
                }
              ],
              "subtitle": "Semaine 4 ‚Ä¢ Consolider les acquis et projeter ta nouvelle r√©alit√©",
              "rationale": "Cette derni√®re phase est d√©di√©e √† l'int√©gration profonde de tes nouvelles habitudes, √† la c√©l√©bration de tes progr√®s et √† la planification de la continuit√©, pour que cette transformation soit durable."
            }
          ],
          "deepWhy": "Pour canaliser mon √©nergie avec pr√©cision, accomplir mes ambitions avec s√©r√©nit√© et vivre chaque jour avec une clart√© in√©branlable, sans me sentir submerg√©e.",
          "identity": "Je suis une Architecte de ma Concentration.",
          "strategy": "Nous allons transformer la d√©sorganisation et le manque de clart√© en syst√®mes robustes de focus, en commen√ßant par des routines √©nergisantes et en √©liminant les distractions, pour que chaque action compte.",
          "goldenRules": "1. Chaque t√¢che a sa place et son temps d√©fini, sans exception.\n2. Mon √©nergie est sacr√©e, je la prot√®ge farouchement des distractions.\n3. La clart√© pr√©c√®de l'action : je d√©finis avant d'ex√©cuter.",
          "vitalSignal": {
            "name": "T√¢ches prioritaires accomplies",
            "type": "constat",
            "unit": "t√¢ches",
            "startValue": "0",
            "description": "Nombre de t√¢ches √† haute valeur ajout√©e, d√©finies au pr√©alable, et termin√©es chaque jour. C'est ton indicateur de productivit√© cibl√©e.",
            "targetValue": "3",
            "tracking_type": "counter"
          },
          "grimoireTitle": "La Forge de la Clart√©",
          "context_problem": "Tu te sentais constamment submerg√©e par tes t√¢ches, perdant le fil de tes journ√©es et manquant de clart√© sur tes priorit√©s. Tes longues heures devant l'√©cran le soir impactaient ton sommeil, te privant de l'√©nergie n√©cessaire pour maintenir ta discipline et ta concentration. Tu √©tais prisonni√®re d'un cycle de d√©sorganisation et de fatigue qui freinait ton potentiel.",
          "sophiaKnowledge": "Tu es une jeune femme dynamique et ambitieuse, soucieuse d'optimiser sa productivit√©. Tu te sens d√©sorganis√©e et submerg√©e, perdant le fil de tes t√¢ches, notamment √† cause d'un travail sur √©cran tardif et un sommeil moyen. Malgr√© un niveau d'activit√© √©lev√©, tu cherches √† retrouver clart√©, discipline et √©nergie pour plus de stabilit√© au quotidien.",
          "maintenanceCheck": {
            "type": "surveillance",
            "question": "Quelle a √©t√© la principale source de distraction qui a menac√© ton focus cette semaine et quelles micro-actions as-tu mises en place pour la contrer ?",
            "frequency": "hebdomadaire"
          },
          "estimatedDuration": "4 semaines"
        },
        "goal_id": "ce3ad32b-26ba-4f79-a632-3a753fd45408",
        "deep_why": "Pour canaliser mon √©nergie avec pr√©cision, accomplir mes ambitions avec s√©r√©nit√© et vivre chaque jour avec une clart√© in√©branlable, sans me sentir submerg√©e.",
        "created_at": "2026-01-09T16:09:48.645392+00:00",
        "inputs_why": null,
        "current_phase": 1,
        "submission_id": "9d8f8ab4-2d17-4489-a172-20c77cdb5fd5",
        "inputs_context": null,
        "inputs_blockers": null,
        "progress_percentage": 0
      },
      "actions": [
        {
          "id": "a75664eb-a02d-472b-9b33-058d5b155f34",
          "title": "Le Couvre-feu Digital Solide (21h)",
          "status": "active",
          "created_at": "2026-01-09T16:09:48.675152+00:00",
          "description": "√âteins tous les √©crans personnels (t√©l√©phone, tablette, TV) apr√®s 21h. Replace-les hors de ta vue, id√©alement dans une autre pi√®ce.",
          "target_reps": 7,
          "time_of_day": "night",
          "current_reps": 0,
          "tracking_type": "boolean",
          "last_performed_at": "2026-01-07T16:09:48.666+00:00"
        },
        {
          "id": "9bbf1c4c-2452-4f39-9069-9dfe63f727da",
          "_kind": "framework",
          "title": "Audit des Voleurs de Temps et d'√ânergie",
          "status": "active",
          "created_at": "2026-01-09T16:09:48.714554+00:00",
          "description": "",
          "target_reps": 1,
          "time_of_day": null,
          "current_reps": 1,
          "tracking_type": "boolean",
          "framework_type": "one_shot",
          "last_performed_at": "2026-01-09T16:10:51.029+00:00"
        }
      ],
      "frameworks": [
        {
          "id": "9bbf1c4c-2452-4f39-9069-9dfe63f727da",
          "type": "one_shot",
          "title": "Audit des Voleurs de Temps et d'√ânergie",
          "status": "active",
          "created_at": "2026-01-09T16:09:48.714554+00:00",
          "target_reps": 1,
          "current_reps": 1,
          "tracking_type": "boolean",
          "last_performed_at": "2026-01-09T16:10:51.029+00:00"
        }
      ],
      "dashboard_context": "=== PLAN ACTUEL (Tableau de Bord) ===\nTitre: La Forge de la Clart√©\nStatut: active\nPhase courante (dashboard): 1\nPourquoi (Deep Why): Pour canaliser mon √©nergie avec pr√©cision, accomplir mes ambitions avec s√©r√©nit√© et vivre chaque jour avec une clart√© in√©branlable, sans me sentir submerg√©e.\nD√âTAIL COMPLET DU PLAN (Structure JSON) :\n{\n  \"phases\": [\n    {\n      \"id\": 1,\n      \"title\": \"Phase 1 : Le Grand D√©broussaillage - L'√âveil de la Clart√©\",\n      \"status\": \"active\",\n      \"actions\": [\n        {\n          \"id\": \"e822737e-fa94-4aed-9592-e1b3ae1a0eba\",\n          \"tips\": \"Sois honn√™te avec toi-m√™me. Observe sans juger, puis agis. Fais-le sur une journ√©e typique.\",\n          \"type\": \"framework\",\n          \"title\": \"Audit des Voleurs de Temps et d'√ânergie\",\n          \"status\": \"active\",\n          \"questType\": \"main\",\n          \"rationale\": \"Tu ne peux pas vaincre un ennemi que tu ne connais pas. Cet audit r√©v√®le tes points de fuite d'√©nergie.\",\n          \"targetReps\": 1,\n          \"description\": \"Identifie pr√©cis√©ment ce qui te submerge et te d√©concentre. Un scan impitoyable de tes habitudes et de ton environnement.\",\n          \"isCompleted\": false,\n          \"time_of_day\": \"any_time\",\n          \"tracking_type\": \"boolean\",\n          \"frameworkDetails\": {\n            \"type\": \"one_shot\",\n            \"intro\": \"L'objectif est de cartographier tes principales sources de distraction et de d√©sorganisation. Pense √† tes journ√©es, aux moments o√π tu te sens submerg√©e ou que tu perds le fil. Qu'est-ce qui en est la cause ? Note tout, sans filtre.\",\n            \"sections\": [\n              {\n                \"id\": \"s1_distraction\",\n                \"label\": \"Distractions fr√©quentes (ex: r√©seaux sociaux, notifications)\",\n                \"inputType\": \"list\",\n                \"placeholder\": \"Smartphone/Instagram\"\n              },\n              {\n                \"id\": \"s1_desorganisation\",\n                \"label\": \"Sources de d√©sorganisation (ex: email en d√©sordre, priorit√©s floues)\",\n                \"inputType\": \"list\",\n                \"placeholder\": \"Bo√Æte mail non trait√©e\"\n              },\n              {\n                \"id\": \"s1_impact\",\n                \"label\": \"Impact ressenti (court/long terme)\",\n                \"inputType\": \"textarea\",\n                \"placeholder\": \"Perte de 30 min, frustration, moins bonne qualit√© de sommeil.\"\n              }\n            ]\n          }\n        },\n        {\n          \"id\": \"a75664eb-a02d-472b-9b33-058d5b155f34\",\n          \"tips\": \"Charge ton t√©l√©phone loin de ton lit. Trouve une activit√© relaxante alternative : lire, √©couter de la musique, discuter.\",\n          \"type\": \"habitude\",\n          \"title\": \"Le Couvre-feu Digital Solide (21h)\",\n          \"status\": \"active\",\n          \"questType\": \"side\",\n          \"rationale\": \"Le cerveau a besoin de d√©connecter de la lumi√®re bleue et de la stimulation cognitive intense pour pr√©parer un sommeil r√©parateur, essentiel √† ton √©nergie et ton focus du lendemain.\",\n          \"targetReps\": 7,\n          \"description\": \"√âteins tous les √©crans personnels (t√©l√©phone, tablette, TV) apr√®s 21h. Replace-les hors de ta vue, id√©alement dans une autre pi√®ce.\",\n          \"isCompleted\": false,\n          \"time_of_day\": \"night\",\n          \"tracking_type\": \"boolean\"\n        },\n        {\n          \"id\": \"76fc9dc7-f118-4972-9246-5c5b024ee614\",\n          \"tips\": \"Commence petit : un tiroir, puis ton bureau. Fais-en un rituel de fin de journ√©e.\",\n          \"type\": \"mission\",\n          \"title\": \"Pr√©parer ton Espace de Travail Sacr√©\",\n          \"status\": \"pending\",\n          \"questType\": \"side\",\n          \"rationale\": \"Un environnement ordonn√© se traduit par un esprit ordonn√©. Moins de stimuli visuels, moins de distractions, plus de focus.\",\n          \"description\": \"D√©sencombre et organise ton espace de travail principal. Une place pour chaque chose, chaque chose √† sa place. √âlimine tout ce qui n'est pas li√© √† la t√¢che en cours.\",\n          \"isCompleted\": false,\n          \"time_of_day\": \"any_time\",\n          \"tracking_type\": \"boolean\"\n        }\n      ],\n      \"subtitle\": \"Semaine 1 ‚Ä¢ Poser les fondations d'un esprit net\",\n      \"rationale\": \"Avant de construire, il faut d√©blayer. Cette phase vise √† identifier et neutraliser les plus grands saboteurs de ton focus pour cr√©er un terrain propice √† la concentration.\"\n    },\n    {\n      \"id\": 2,\n      \"title\": \"Phase 2 : L'Architecture du Focus - Les Piliers du Profond\",\n      \"status\": \"locked\",\n      \"actions\": [\n        {\n          \"id\": \"1e189d53-0a27-42ce-be0e-73c9edc71f29\",\n          \"tips\": \"Utilise la technique Pomodoro (ex: 25 min de travail, 5 min de pause) ou une minuterie. Informe ton entourage de ton indisponibilit√©.\",\n          \"type\": \"habitude\",\n          \"title\": \"Le Bloc de Concentration Profonde (90 min)\",\n          \"status\": \"pending\",\n          \"questType\": \"main\",\n          \"rationale\": \"La capacit√© √† se concentrer intens√©ment sur une seule t√¢che est la cl√© de la productivit√©. Ce bloc entra√Æne ton cerveau √† l'effort soutenu, r√©duisant la sensation d'√™tre submerg√©e.\",\n          \"targetReps\": 7,\n          \"description\": \"D√©die un bloc de 90 minutes, sans aucune interruption (t√©l√©phone en mode avion, notifications coup√©es), √† ta t√¢che la plus importante de la journ√©e.\",\n          \"isCompleted\": false,\n          \"time_of_day\": \"morning\",\n          \"tracking_type\": \"boolean\"\n        },\n        {\n          \"id\": \"b97366cc-8861-4a7b-a02b-20487415c6d5\",\n          \"tips\": \"Sois r√©aliste. Ces t√¢ches doivent √™tre SMART (Sp√©cifiques, Mesurables, Atteignables, R√©alistes, Temporellement d√©finies).\",\n          \"type\": \"framework\",\n          \"title\": \"Le Manifeste des 3 Priorit√©s Quotidiennes\",\n          \"status\": \"pending\",\n          \"questType\": \"side\",\n          \"rationale\": \"La clart√© des priorit√©s √©limine la d√©sorganisation et le sentiment d'√™tre submerg√©. Elle dirige ton √©nergie vers ce qui compte vraiment, cr√©ant un impact maximal.\",\n          \"targetReps\": 7,\n          \"description\": \"Chaque matin, avant de commencer, identifie et √©cris les 3 t√¢ches les plus critiques √† accomplir dans la journ√©e pour avancer vers tes objectifs majeurs.\",\n          \"isCompleted\": false,\n          \"time_of_day\": \"morning\",\n          \"tracking_type\": \"boolean\",\n          \"frameworkDetails\": {\n            \"type\": \"recurring\",\n            \"intro\": \"Chaque jour est une page blanche. Quelles sont les 3 actions qui auront le plus grand impact sur tes objectifs et ton bien-√™tre ? Ne te laisse pas distraire par le superflu. Choisis sagement.\",\n            \"sections\": [\n              {\n                \"id\": \"s2_prio1\",\n                \"label\": \"Priorit√© 1 (Majeure)\",\n                \"inputType\": \"text\",\n                \"placeholder\": \"Finaliser le rapport X\"\n              },\n              {\n                \"id\": \"s2_prio2\",\n                \"label\": \"Priorit√© 2 (Impact important)\",\n                \"inputType\": \"text\",\n                \"placeholder\": \"R√©pondre aux emails critiques\"\n              },\n              {\n                \"id\": \"s2_prio3\",\n                \"label\": \"Priorit√© 3 (Contribue au progr√®s)\",\n                \"inputType\": \"text\",\n                \"placeholder\": \"Planifier la semaine prochaine\"\n              }\n            ]\n          }\n        },\n        {\n          \"id\": \"adea1951-c3b1-4871-a450-649756a957d7\",\n          \"tips\": \"Utilise une alarme discr√®te. L'objectif est de 'd√©charger' mentalement, pas de te divertir.\",\n          \"type\": \"habitude\",\n          \"title\": \"La Micro-Pause Active\",\n          \"status\": \"pending\",\n          \"questType\": \"side\",\n          \"rationale\": \"Ces pauses r√©g√©n√®rent ta capacit√© d'attention, pr√©viennent la fatigue mentale et maintiennent un niveau d'√©nergie stable tout au long de la journ√©e, r√©duisant le risque de perdre le fil.\",\n          \"targetReps\": 14,\n          \"description\": \"Toutes les 60-90 minutes de travail, l√®ve-toi, √©tire-toi, bois de l'eau ou regarde par la fen√™tre pendant 5 minutes. Pas d'√©crans suppl√©mentaires.\",\n          \"isCompleted\": false,\n          \"time_of_day\": \"any_time\",\n          \"tracking_type\": \"boolean\"\n        }\n      ],\n      \"subtitle\": \"Semaine 2 ‚Ä¢ B√¢tir des syst√®mes de concentration in√©branlables\",\n      \"rationale\": \"Maintenant que le terrain est d√©gag√©, nous allons installer les syst√®mes qui te permettront de plonger dans des √©tats de concentration profonde et de g√©rer tes priorit√©s avec une clart√© absolue.\"\n    },\n    {\n      \"id\": 3,\n      \"title\": \"Phase 3 : Le Ma√Ætre du Temps et de l'√ânergie - Le Flow Ininterrompu\",\n      \"status\": \"locked\",\n      \"actions\": [\n        {\n          \"id\": \"5549efb3-0de8-421e-a6e5-edefb36b081b\",\n          \"tips\": \"Cr√©e une liste '√Ä faire demain'. Ne te pr√©occupe pas de leur r√©alisation, juste de les capturer.\",\n          \"type\": \"habitude\",\n          \"title\": \"Le Check-in du Soir Anti-Surcharge\",\n          \"status\": \"pending\",\n          \"questType\": \"main\",\n          \"rationale\": \"Ce rituel permet de lib√©rer ton esprit des pr√©occupations pour la nuit, am√©liore la qualit√© de ton sommeil et te pr√©pare pour une journ√©e claire et productive, r√©duisant le 'perdre le fil'.\",\n          \"targetReps\": 7,\n          \"description\": \"Avant de quitter ton bureau ou de te d√©connecter, prends 10 minutes pour noter les 3 priorit√©s du lendemain et vider ta t√™te de toutes les pens√©es r√©siduelles. Transf√®re-les sur papier ou dans ton syst√®me.\",\n          \"isCompleted\": false,\n          \"time_of_day\": \"evening\",\n          \"tracking_type\": \"boolean\"\n        },\n        {\n          \"id\": \"357fbbb2-b707-4b39-bcd0-23878f444f70\",\n          \"tips\": \"L'objectif est de te donner un sentiment de contr√¥le et d'ancrage d√®s le r√©veil. Choisis des actions simples et gratifiantes.\",\n          \"type\": \"mission\",\n          \"title\": \"D√©finir tes Non-N√©gociables du Matin\",\n          \"status\": \"pending\",\n          \"questType\": \"side\",\n          \"rationale\": \"Commencer la journ√©e avec intention et des actions positives renforce ta stabilit√© √©motionnelle, ton √©nergie et ta discipline, te pr√©parant mentalement pour le focus.\",\n          \"description\": \"Identifie 2-3 activit√©s courtes mais puissantes (ex: m√©ditation de 5 min, verre d'eau, √©tirements) que tu r√©aliseras chaque matin avant de consulter tout √©cran ou email.\",\n          \"isCompleted\": false,\n          \"time_of_day\": \"any_time\",\n          \"tracking_type\": \"boolean\"\n        },\n        {\n          \"id\": \"05fa199a-7c27-42d3-a509-fe4ddbd567e0\",\n          \"tips\": \"Ne juge pas la pens√©e, capture-la et passe √† autre chose. L'important est de ne pas 'suivre le fil'.\",\n          \"type\": \"habitude\",\n          \"title\": \"Le Bloc de R√©sistance √† la Distraction\",\n          \"status\": \"pending\",\n          \"questType\": \"side\",\n          \"rationale\": \"Cette technique entra√Æne ton cerveau √† reconna√Ætre les distractions sans leur donner du pouvoir. Elle renforce ta capacit√© √† maintenir le focus et √† √©viter de te sentir submerg√©e.\",\n          \"targetReps\": 7,\n          \"description\": \"Pendant ton bloc de concentration, si une pens√©e non pertinente ou une envie de consulter ton t√©l√©phone survient, note-la rapidement sur un carnet 'parking' sans interrompre ta t√¢che principale, puis reviens imm√©diatement √† ton travail.\",\n          \"isCompleted\": false,\n          \"time_of_day\": \"any_time\",\n          \"tracking_type\": \"boolean\"\n        }\n      ],\n      \"subtitle\": \"Semaine 3 ‚Ä¢ Optimiser tes ressources internes pour une performance fluide\",\n      \"rationale\": \"Avec des fondations solides, nous allons affiner ta gestion de l'√©nergie et du temps pour cultiver un √©tat de 'flow' o√π la discipline devient naturelle et le focus, in√©branlable.\"\n    },\n    {\n      \"id\": 4,\n      \"title\": \"Phase 4 : L'Ancrage de l'Excellence - Le Sillage de la Ma√Ætrise\",\n      \"status\": \"locked\",\n      \"actions\": [\n        {\n          \"id\": \"001a302c-aad2-46a3-a1da-697e5d6b1eba\",\n          \"tips\": \"Compare ton √©tat actuel √† celui d'il y a 4 semaines. Quelles sont les diff√©rences les plus frappantes ?\",\n          \"type\": \"framework\",\n          \"title\": \"La R√©trospective de Ma√Ætre : Un mois de Transformation\",\n          \"status\": \"pending\",\n          \"questType\": \"main\",\n          \"rationale\": \"La r√©flexion est un pilier de l'apprentissage et de l'ancrage comportemental. Elle solidifie les nouvelles connexions neuronales et pr√©pare le terrain pour une croissance continue.\",\n          \"targetReps\": 1,\n          \"description\": \"Prends le temps de r√©fl√©chir √† tes progr√®s, aux d√©fis rencontr√©s et aux syst√®mes qui ont eu le plus grand impact sur ton focus et ta discipline. C√©l√®bre tes victoires.\",\n          \"isCompleted\": false,\n          \"time_of_day\": \"any_time\",\n          \"tracking_type\": \"boolean\",\n          \"frameworkDetails\": {\n            \"type\": \"one_shot\",\n            \"intro\": \"Tu as parcouru un chemin intense en 4 semaines. Il est temps de te poser et de mesurer la distance parcourue. Qu'as-tu appris sur toi-m√™me et sur ta capacit√© √† architecturer ta vie ? Sois fi√®re de chaque pas.\",\n            \"sections\": [\n              {\n                \"id\": \"s4_victoires\",\n                \"label\": \"Mes 3 plus grandes victoires ce mois-ci\",\n                \"inputType\": \"list\",\n                \"placeholder\": \"J'ai r√©ussi mon premier bloc de 90 min sans interruption.\"\n              },\n              {\n                \"id\": \"s4_defis\",\n                \"label\": \"Les d√©fis que j'ai surmont√©s et comment\",\n                \"inputType\": \"textarea\",\n                \"placeholder\": \"L'envie de scroller le soir √©tait forte, mais j'ai remplac√© par la lecture.\"\n              },\n              {\n                \"id\": \"s4_ancrage\",\n                \"label\": \"Une habitude que je veux ancrer d√©finitivement\",\n                \"inputType\": \"text\",\n                \"placeholder\": \"Le Check-in du Soir Anti-Surcharge.\"\n              },\n              {\n                \"id\": \"s4_next\",\n                \"label\": \"Mon prochain objectif focus/discipline pour le mois √† venir\",\n                \"inputType\": \"text\",\n                \"placeholder\": \"Int√©grer 2 blocs de concentration par jour.\"\n              }\n            ]\n          }\n        },\n        {\n          \"id\": \"430d201c-13af-4ad3-a09b-a7c46f930e63\",\n          \"tips\": \"La r√©p√©tition est la m√®re de la ma√Ætrise. Ne change rien √† cette routine pendant 7 jours.\",\n          \"type\": \"habitude\",\n          \"title\": \"La Routine de Fin de Journ√©e Immuable\",\n          \"status\": \"pending\",\n          \"questType\": \"side\",\n          \"rationale\": \"Cette routine cr√©e un signal fort pour ton cerveau qu'il est temps de ralentir et de se pr√©parer au repos, optimisant la qualit√© de ton sommeil et consolidant ta discipline quotidienne.\",\n          \"targetReps\": 7,\n          \"description\": \"Cr√©e une s√©quence fixe de 3-4 actions apaisantes (ex: lecture, musique douce, pr√©paration des v√™tements du lendemain) que tu r√©alises chaque soir apr√®s ton couvre-feu digital et avant de te coucher.\",\n          \"isCompleted\": false,\n          \"time_of_day\": \"evening\",\n          \"tracking_type\": \"boolean\"\n        },\n        {\n          \"id\": \"c59c9269-900c-4505-9ce1-327e2fb63a88\",\n          \"tips\": \"Pense aux prochaines √©tapes de ta croissance personnelle ou professionnelle. Qu'est-ce qui te passionne ?\",\n          \"type\": \"mission\",\n          \"title\": \"Planifier ta Prochaine Qu√™te\",\n          \"status\": \"pending\",\n          \"questType\": \"side\",\n          \"rationale\": \"L'architecte ne s'arr√™te jamais de construire. Cette planification assure la continuit√© de ta transformation et maintient ta motivation √† cultiver ta clart√© et ta discipline.\",\n          \"description\": \"Utilise les enseignements de ta r√©trospective pour d√©finir un ou deux objectifs clairs et une strat√©gie pour le mois suivant, en appliquant les principes de clart√© et de discipline que tu as appris.\",\n          \"isCompleted\": false,\n          \"time_of_day\": \"any_time\",\n          \"tracking_type\": \"boolean\"\n        }\n      ],\n      \"subtitle\": \"Semaine 4 ‚Ä¢ Consolider les acquis et projeter ta nouvelle r√©alit√©\",\n      \"rationale\": \"Cette derni√®re phase est d√©di√©e √† l'int√©gration profonde de tes nouvelles habitudes, √† la c√©l√©bration de tes progr√®s et √† la planification de la continuit√©, pour que cette transformation soit durable.\"\n    }\n  ],\n  \"deepWhy\": \"Pour canaliser mon √©nergie avec pr√©cision, accomplir mes ambitions avec s√©r√©nit√© et vivre chaque jour avec une clart√© in√©branlable, sans me sentir submerg√©e.\",\n  \"identity\": \"Je suis une Architecte de ma Concentration.\",\n  \"strategy\": \"Nous allons transformer la d√©sorganisation et le manque de clart√© en syst√®mes robustes de focus, en commen√ßant par des routines √©nergisantes et en √©liminant les distractions, pour que chaque action compte.\",\n  \"goldenRules\": \"1. Chaque t√¢che a sa place et son temps d√©fini, sans exception.\\n2. Mon √©nergie est sacr√©e, je la prot√®ge farouchement des distractions.\\n3. La clart√© pr√©c√®de l'action : je d√©finis avant d'ex√©cuter.\",\n  \"vitalSignal\": {\n    \"name\": \"T√¢ches prioritaires accomplies\",\n    \"type\": \"constat\",\n    \"unit\": \"t√¢ches\",\n    \"startValue\": \"0\",\n    \"description\": \"Nombre de t√¢ches √† haute valeur ajout√©e, d√©finies au pr√©alable, et termin√©es chaque jour. C'est ton indicateur de productivit√© cibl√©e.\",\n    \"targetValue\": \"3\",\n    \"tracking_type\": \"counter\"\n  },\n  \"grimoireTitle\": \"La Forge de la Clart√©\",\n  \"context_problem\": \"Tu te sentais constamment submerg√©e par tes t√¢ches, perdant le fil de tes journ√©es et manquant de clart√© sur tes priorit√©s. Tes longues heures devant l'√©cran le soir impactaient ton sommeil, te privant de l'√©nergie n√©cessaire pour maintenir ta discipline et ta concentration. Tu √©tais prisonni√®re d'un cycle de d√©sorganisation et de fatigue qui freinait ton potentiel.\",\n  \"sophiaKnowledge\": \"Tu es une jeune femme dynamique et ambitieuse, soucieuse d'optimiser sa productivit√©. Tu te sens d√©sorganis√©e et submerg√©e, perdant le fil de tes t√¢ches, notamment √† cause d'un travail sur √©cran tardif et un sommeil moyen. Malgr√© un niveau d'activit√© √©lev√©, tu cherches √† retrouver clart√©, discipline et √©nergie pour plus de stabilit√© au quotidien.\",\n  \"maintenanceCheck\": {\n    \"type\": \"surveillance\",\n    \"question\": \"Quelle a √©t√© la principale source de distraction qui a menac√© ton focus cette semaine et quelles micro-actions as-tu mises en place pour la contrer ?\",\n    \"frequency\": \"hebdomadaire\"\n  },\n  \"estimatedDuration\": \"4 semaines\"\n}\n=== ACTIONS / FRAMEWORKS (√âTAT R√âEL DB) ===\nR√àGLES IMPORTANTES:\n- Les frameworks comptent comme des actions c√¥t√© utilisateur.\n- \"active\" = activ√©e et visible comme active dans l'app. \"pending\" = pas active.\n- On n'active/d√©sactive pas via WhatsApp: la seule mani√®re d'activer/d√©sactiver, c'est depuis le dashboard.\n\nActives (2):\n- [ACTION] Le Couvre-feu Digital Solide (21h) (night)\n- [FRAMEWORK] Audit des Voleurs de Temps et d'√ânergie\n\n=== SIGNES VITAUX (√âtat Actuel) ===\n- T√¢ches prioritaires accomplies: 0 t√¢ches\n",
      "template_fingerprint": null
    },
    "scenario_target": "onboarding"
  },
  "error": null
}