{
  "id": "6f54e4ec-89c0-4288-805e-2e4905786a4a",
  "created_at": "2026-01-08T19:47:12.737083+00:00",
  "status": "completed",
  "dataset_key": "core",
  "scenario_key": "bilan_real_bundle__5733ce93d94641",
  "transcript": [
    {
      "role": "user",
      "content": "Oui",
      "agent_used": null,
      "created_at": "2026-01-08T19:47:12.74691+00:00"
    },
    {
      "role": "assistant",
      "content": "C'est parti. On commence par ton temps d'√©cran apr√®s 21h. Tu estimes √† combien de minutes ton utilisation hier soir ?",
      "agent_used": "investigator",
      "created_at": "2026-01-08T19:47:19.202768+00:00"
    },
    {
      "role": "user",
      "content": "J'ai essay√© de r√©duire, mais j'ai eu du mal hier soir. Je dirais 60 minutes. Mon organisation de la journ√©e n'√©tait pas top, on en reparlera peut-√™tre plus tard si tu veux.",
      "agent_used": null,
      "created_at": "2026-01-08T19:47:23.698553+00:00"
    },
    {
      "role": "assistant",
      "content": "C'est not√© pour tes 60 minutes, on pourra effectivement revenir sur ton organisation quand tu le souhaiteras. Concernant le Couvre-Feu Digital, est-ce que tu as r√©ussi √† couper tes √©crans une heure avant de dormir hier ?",
      "agent_used": "investigator",
      "created_at": "2026-01-08T19:47:41.569265+00:00"
    },
    {
      "role": "user",
      "content": "Oui, j'ai r√©ussi √† les couper, mais pas tout √† fait une heure avant, peut-√™tre 40 minutes. C'est d√©j√† mieux que d'habitude.",
      "agent_used": null,
      "created_at": "2026-01-08T19:47:45.244331+00:00"
    },
    {
      "role": "assistant",
      "content": "C'est d√©j√† un beau progr√®s, ces 40 minutes comptent vraiment pour ton rythme. Pour la suite, est-ce que tu as r√©ussi hier √† sanctuariser ta chambre en retirant tout ce qui n'a rien √† voir avec le sommeil ?",
      "agent_used": "investigator",
      "created_at": "2026-01-08T19:48:01.434602+00:00"
    },
    {
      "role": "user",
      "content": "J'ai fait un effort, j'ai rang√© un peu et enlev√© quelques affaires, mais pas un grand nettoyage complet. Disons que c'est en bonne voie.",
      "agent_used": null,
      "created_at": "2026-01-08T19:48:04.645232+00:00"
    },
    {
      "role": "assistant",
      "content": "C'est d√©j√† un beau premier pas pour ta chambre, l'essentiel est d'avoir commenc√©. Pour la suite du bilan d'hier, est-ce que tu as pu t'accorder tes micro-pauses conscientes ? üßò",
      "agent_used": "investigator",
      "created_at": "2026-01-08T19:48:22.780949+00:00"
    },
    {
      "role": "user",
      "content": "J'ai r√©ussi √† en faire une dans la journ√©e, mais pas les 2 ou 3 comme pr√©vu. J'ai eu une journ√©e assez charg√©e.",
      "agent_used": null,
      "created_at": "2026-01-08T19:48:28.004302+00:00"
    },
    {
      "role": "assistant",
      "content": "C'est d√©j√† un bon r√©flexe d'en avoir fait une malgr√© ton emploi du temps serr√©. On a termin√© ton bilan pour hier. Est-ce que tu veux qu'on parle de quelque chose en particulier ?",
      "agent_used": "investigator",
      "created_at": "2026-01-08T19:48:43.10973+00:00"
    }
  ],
  "state_before": {
    "scope": "web",
    "user_id": "20c3996c-0a57-407c-a74e-1321c5151ecc",
    "risk_level": 0,
    "updated_at": "2026-01-08T19:47:12.676102+00:00",
    "current_mode": "investigator",
    "last_processed_at": "2026-01-08T19:47:12.676102+00:00",
    "short_term_context": null,
    "investigation_state": {
      "status": "checking",
      "temp_memory": {
        "opening_done": false
      },
      "pending_items": [
        {
          "id": "939a9cce-a931-4bd5-b3d0-6b662a798e45",
          "type": "vital",
          "unit": "min",
          "title": "Temps d'√©cran apr√®s 21h",
          "tracking_type": "counter"
        },
        {
          "id": "3e857764-3d0e-4379-9a4b-9e39d2cc571e",
          "type": "action",
          "title": "Le Couvre-Feu Digital",
          "target": 10,
          "description": "√âteins ou mets en mode avion tous les √©crans (t√©l√©phone, tablette) au moins 60 minutes avant de dormir. Laisse-les hors de port√©e visuelle et physique de ta chambre.",
          "tracking_type": "boolean"
        },
        {
          "id": "2414a83c-fce3-4edc-a0d5-c3f0385c523f",
          "type": "action",
          "title": "Sanctuariser ta Chambre",
          "target": 1,
          "description": "Fais un grand nettoyage de ta chambre : supprime tout ce qui n'a pas sa place pour dormir (objets li√©s au travail, v√™tements en d√©sordre). Assure-toi que la pi√®ce est sombre, fra√Æche et silencieuse avant de te coucher.",
          "tracking_type": "boolean"
        },
        {
          "id": "3dce9b8d-22c0-4167-a7c6-7ed4f2a79946",
          "type": "action",
          "title": "La Micro-Pause Consciente",
          "target": 10,
          "description": "Prends 2 √† 3 fois par jour une pause de 2 minutes pour t'arr√™ter, fermer les yeux, et te concentrer uniquement sur 5 respirations profondes et lentes. Fais-le avant de ressentir le pic de stress ou de fatigue.",
          "tracking_type": "boolean"
        }
      ],
      "current_item_index": 0
    },
    "last_interaction_at": "2026-01-08T19:47:12.676102+00:00",
    "unprocessed_msg_count": 0
  },
  "state_after": {
    "scope": "web",
    "user_id": "20c3996c-0a57-407c-a74e-1321c5151ecc",
    "risk_level": 0,
    "updated_at": "2026-01-08T19:48:43.106591+00:00",
    "current_mode": "companion",
    "last_processed_at": "2026-01-08T19:47:12.676102+00:00",
    "short_term_context": null,
    "investigation_state": null,
    "last_interaction_at": "2026-01-08T19:47:12.676102+00:00",
    "unprocessed_msg_count": 5
  },
  "issues": [
    {
      "code": "rule_violation_deferred_topic",
      "message": "L'agent Investigator a √©chou√© √† proposer le sujet report√© ('organisation') √† la fin du bilan, violant la r√®gle de priorit√© des sujets mis de c√¥t√©.",
      "evidence": {
        "snippet": "On a termin√© ton bilan pour hier. Est-ce que tu veux qu'on parle de quelque chose en particulier ?",
        "agent_used": "sophia.investigator"
      },
      "severity": "high"
    }
  ],
  "suggestions": [
    {
      "action": "append",
      "rationale": "Le mod√®le a ignor√© l'instruction de rappel du sujet report√© √† la fin du flux. Cette instruction renforce la structure de sortie pour garantir la transition vers le sujet gar√©.",
      "prompt_key": "sophia.investigator",
      "context_block": "=== CONTEXT (transcript excerpt) ===\n#6 USER: J'ai fait un effort, j'ai rang√© un peu et enlev√© quelques affaires, mais pas un grand nettoyage complet. Disons que c'est en bonne voie.\n#7 ASSISTANT(investigator): C'est d√©j√† un beau premier pas pour ta chambre, l'essentiel est d'avoir commenc√©. Pour la suite du bilan d'hier, est-ce que tu as pu t'accorder tes micro-pauses conscientes ? üßò\n#8 USER: J'ai r√©ussi √† en faire une dans la journ√©e, mais pas les 2 ou 3 comme pr√©vu. J'ai eu une journ√©e assez charg√©e.\n#9 ASSISTANT(investigator): C'est d√©j√† un bon r√©flexe d'en avoir fait une malgr√© ton emploi du temps serr√©. On a termin√© ton bilan pour hier. Est-ce que tu veux qu'on parle de quelque chose en particulier ?\n\n=== APPLY ===\nprompt_key: sophia.investigator\naction: append\n\nproposed_addendum:\nFIN DE BILAN (PRIORIT√â ABSOLUE)\n- Si un sujet a √©t√© mis de c√¥t√© (ex: 'on en reparle plus tard'), tu DOIS l'adresser imm√©diatement apr√®s la derni√®re question du bilan.\n- Structure impos√©e : 'Le bilan est termin√©. Tu voulais qu'on revienne sur [sujet report√©], on s'y met ?'\n- Ne pose JAMAIS de question ouverte ('autre chose ?') tant que le sujet report√© n'est pas trait√©.",
      "proposed_addendum": "FIN DE BILAN (PRIORIT√â ABSOLUE)\n- Si un sujet a √©t√© mis de c√¥t√© (ex: 'on en reparle plus tard'), tu DOIS l'adresser imm√©diatement apr√®s la derni√®re question du bilan.\n- Structure impos√©e : 'Le bilan est termin√©. Tu voulais qu'on revienne sur [sujet report√©], on s'y met ?'\n- Ne pose JAMAIS de question ouverte ('autre chose ?') tant que le sujet report√© n'est pas trait√©."
    }
  ],
  "metrics": {
    "cost_usd": 0.009572,
    "request_id": "bilan_eval_bundle:bilan_real_bundle__5733ce93d94641:core:bilan_real_bundle__5733ce93d94641",
    "total_tokens": 57154,
    "output_tokens": 1248,
    "prompt_tokens": 41941,
    "judge_llm_used": true,
    "mega_test_mode": false
  },
  "config": {
    "tags": [
      "sophia.investigator"
    ],
    "limits": {
      "model": "gemini-3-pro-preview",
      "user_difficulty": "mid",
      "bilan_actions_count": 3,
      "test_post_checkup_deferral": true
    },
    "request_id": "bilan_eval_bundle:bilan_real_bundle__5733ce93d94641:core:bilan_real_bundle__5733ce93d94641",
    "description": "Bilan real (simulate-user) bundle run: capture full logs + full transcript.",
    "plan_snapshot": {
      "plan": {
        "id": "f5ad5709-39d8-486b-b672-6c5b50e3e8ec",
        "title": "Le Protocole S√©r√©nit√©",
        "status": "active",
        "content": {
          "phases": [
            {
              "id": 1,
              "title": "Phase 1 : L'Ancrage Nocturne",
              "status": "active",
              "actions": [
                {
                  "id": "3e857764-3d0e-4379-9a4b-9e39d2cc571e",
                  "tips": "Utilise un r√©veil analogique. Trouve une activit√© relaxante alternative : lecture papier, musique douce, discussion l√©g√®re.",
                  "type": "habitude",
                  "title": "Le Couvre-Feu Digital",
                  "status": "active",
                  "questType": "main",
                  "rationale": "La lumi√®re bleue et la stimulation mentale des √©crans bloquent la production de m√©latonine, l'hormone du sommeil. Rompre avec ce cycle permet √† ton cerveau de se pr√©parer naturellement au repos.",
                  "targetReps": 10,
                  "description": "√âteins ou mets en mode avion tous les √©crans (t√©l√©phone, tablette) au moins 60 minutes avant de dormir. Laisse-les hors de port√©e visuelle et physique de ta chambre.",
                  "isCompleted": false,
                  "time_of_day": "night",
                  "tracking_type": "boolean"
                },
                {
                  "id": "2414a83c-fce3-4edc-a0d5-c3f0385c523f",
                  "tips": "Investis dans des rideaux occultants, des boules Quies ou un masque de sommeil si n√©cessaire. Une temp√©rature id√©ale se situe entre 18 et 20¬∞C.",
                  "type": "mission",
                  "title": "Sanctuariser ta Chambre",
                  "status": "active",
                  "questType": "side",
                  "rationale": "Un environnement propre et d√©di√© au sommeil envoie un signal fort √† ton cerveau : cet espace est sacr√© pour le repos, et non pour l'activit√© ou le stress. Cela favorise une association positive et rapide avec l'endormissement.",
                  "description": "Fais un grand nettoyage de ta chambre : supprime tout ce qui n'a pas sa place pour dormir (objets li√©s au travail, v√™tements en d√©sordre). Assure-toi que la pi√®ce est sombre, fra√Æche et silencieuse avant de te coucher.",
                  "isCompleted": false,
                  "time_of_day": "evening",
                  "tracking_type": "boolean"
                }
              ],
              "subtitle": "Semaines 1-2 ‚Ä¢ Reconstruire le socle du repos",
              "rationale": "Avant de g√©rer le stress diurne, il est imp√©ratif de stopper l'h√©morragie √©nerg√©tique nocturne. Un sommeil de qualit√© est la fondation de toute stabilit√© √©motionnelle et mentale. Cette phase vise √† d√©samorcer les habitudes qui sabotent ton repos."
            },
            {
              "id": 2,
              "title": "Phase 2 : Le Souffle R√©cup√©rateur",
              "status": "locked",
              "actions": [
                {
                  "id": "3dce9b8d-22c0-4167-a7c6-7ed4f2a79946",
                  "tips": "D√©finis des rappels discrets sur ton t√©l√©phone. Choisis des moments charni√®res : avant de commencer une t√¢che complexe, apr√®s un appel difficile, avant de rentrer chez toi.",
                  "type": "habitude",
                  "title": "La Micro-Pause Consciente",
                  "status": "active",
                  "questType": "main",
                  "rationale": "Ces micro-pauses activent le syst√®me nerveux parasympathique, r√©duisant le cortisol et l'adr√©naline. Elles rompent le cycle du stress accumul√© et t'offrent des mini-r√©initialisations neuronales, augmentant ta capacit√© √† g√©rer les irritants sans exploser.",
                  "targetReps": 10,
                  "description": "Prends 2 √† 3 fois par jour une pause de 2 minutes pour t'arr√™ter, fermer les yeux, et te concentrer uniquement sur 5 respirations profondes et lentes. Fais-le avant de ressentir le pic de stress ou de fatigue.",
                  "isCompleted": false,
                  "time_of_day": "any_time",
                  "tracking_type": "boolean"
                },
                {
                  "id": "23041d5d-ed8a-40a8-b6e8-243b48fda3d3",
                  "tips": "Utilise un carnet et un stylo d√©di√©s. Ne relis pas imm√©diatement. L'objectif est de 'd√©poser' les pens√©es hors de ta t√™te.",
                  "type": "framework",
                  "title": "Le Carnet des Pens√©es",
                  "status": "pending",
                  "questType": "side",
                  "rationale": "Ce 'brain dump' externalise la charge mentale, r√©duisant le fardeau cognitif et l'hyperactivit√© pr√©-sommeil. Il aide √† lib√©rer l'esprit des ruminations, favorisant un endormissement plus rapide et un sommeil plus profond. C'est une habitude qui combat directement la charge mentale.",
                  "targetReps": 10,
                  "description": "Chaque soir, 30 minutes avant de te coucher, √©cris pendant 5 √† 10 minutes tout ce qui te pr√©occupe, te stresse, ou les pens√©es qui tournent en boucle. Ne te censure pas.",
                  "isCompleted": false,
                  "time_of_day": "evening",
                  "tracking_type": "counter",
                  "frameworkDetails": {
                    "type": "recurring",
                    "intro": "L'objectif est de vider ta t√™te de tout ce qui la sature. Qu'il s'agisse de t√¢ches √† faire, de pr√©occupations, d'√©motions non exprim√©es ou de pens√©es al√©atoires, d√©charge-les ici. Fais-le rapidement, sans jugement.",
                    "sections": [
                      {
                        "id": "s1",
                        "label": "Toutes les pens√©es et pr√©occupations qui me viennent √† l'esprit :",
                        "inputType": "textarea",
                        "placeholder": "Je pense √† ma r√©union de demain... J'ai oubli√© d'appeler X... Je suis agac√© par..."
                      },
                      {
                        "id": "s2",
                        "label": "√âmotion dominante ressentie apr√®s l'√©criture (1-10, 1=calme, 10=stress√©) :",
                        "inputType": "scale",
                        "placeholder": "5"
                      }
                    ]
                  }
                }
              ],
              "subtitle": "Semaines 3-4 ‚Ä¢ Apaiser l'esprit, d√©charger la charge",
              "rationale": "Maintenant que les bases du sommeil sont pos√©es, il est temps de t'√©quiper d'outils pour g√©rer la charge mentale et l'irritabilit√© au quotidien. Cette phase introduit des pratiques qui calment le syst√®me nerveux et permettent de vider le 'cache mental' avant qu'il ne s'emballe."
            },
            {
              "id": 3,
              "title": "Phase 3 : La Reconnexion √ânerg√©tique",
              "status": "locked",
              "actions": [
                {
                  "id": "bcde5cdd-8c49-46f8-a62c-e6e06882fcc3",
                  "tips": "Utilise les escaliers. Fais le tour du p√¢t√© de maisons. Colle un post-it 'MOVE!' sur ton √©cran. L'objectif n'est pas l'intensit√©, mais la r√©gularit√© du mouvement.",
                  "type": "habitude",
                  "title": "La Pause Active",
                  "status": "pending",
                  "questType": "main",
                  "rationale": "Le mouvement lib√®re des endorphines, r√©duit le cortisol et am√©liore la circulation sanguine vers le cerveau, augmentant la clart√© mentale et l'√©nergie. Ces micro-pauses physiques rompent les sch√©mas de s√©dentarit√© li√©s au travail sur √©cran et pr√©viennent l'accumulation de tension physique et mentale.",
                  "targetReps": 10,
                  "description": "Int√®gre 2 √† 3 pauses de 10 minutes d'activit√© physique l√©g√®re (marche rapide, √©tirements, quelques flexions/pompes) pendant ta journ√©e de travail. Sors de ton environnement de bureau.",
                  "isCompleted": false,
                  "time_of_day": "afternoon",
                  "tracking_type": "boolean"
                },
                {
                  "id": "f013fd56-7b4d-48ba-bec1-8b465881e1cc",
                  "tips": "Commence par 15 minutes cibl√©es. Utilise la r√®gle 'une place pour chaque chose'.",
                  "type": "mission",
                  "title": "L'Optimisation de l'Espace Mental",
                  "status": "pending",
                  "questType": "side",
                  "rationale": "Un environnement d√©sordonn√© est une source constante de distraction et de charge cognitive, augmentant subtilement ton niveau de stress. Un espace de travail √©pur√© et organis√© favorise la concentration, r√©duit les sollicitations visuelles et mentales, et te procure un sentiment de contr√¥le, diminuant l'irritabilit√©.",
                  "description": "D√©sencombre ton espace de travail physique et num√©rique : classe les documents, supprime les fichiers inutiles, organise tes ic√¥nes. Cr√©e un fond d'√©cran simple et apaisant.",
                  "isCompleted": false,
                  "time_of_day": "any_time",
                  "tracking_type": "boolean"
                }
              ],
              "subtitle": "Semaines 5-6 ‚Ä¢ Recharger le corps, oxyg√©ner l'esprit",
              "rationale": "Un niveau d'activit√© faible et un travail s√©dentaire contribuent √† la fatigue et au stress. Cette phase vise √† r√©introduire du mouvement et de l'oxyg√®ne pour stimuler l'√©nergie, briser la s√©dentarit√© et am√©liorer la capacit√© de gestion du stress sur le long terme."
            },
            {
              "id": 4,
              "title": "Phase 4 : Le Ma√Ætre de la Coh√©rence",
              "status": "locked",
              "actions": [
                {
                  "id": "61f3787f-b303-45a3-877e-37a9294fa6ca",
                  "tips": "Sois honn√™te avec toi-m√™me. Mets l'accent sur les progr√®s, m√™me minimes. Formule des intentions claires pour l'avenir.",
                  "type": "framework",
                  "title": "Bilan des Victoires et D√©fis",
                  "status": "pending",
                  "questType": "main",
                  "rationale": "Analyser ton parcours permet de renforcer les circuits neuronaux associ√©s aux r√©ussites (syst√®me de r√©compense) et d'identifier les points faibles avec une approche proactive. Cette introspection est cruciale pour la maintenance √† long terme et pour cultiver un sentiment d'auto-efficacit√©, combattant le manque de constance li√© √† la fatigue.",
                  "targetReps": 1,
                  "description": "Fais un bilan de ton parcours : quels sont les changements majeurs que tu as observ√©s ? Quelles habitudes sont ancr√©es ? Quels d√©fis persistent et comment peux-tu les aborder ?",
                  "isCompleted": false,
                  "time_of_day": "any_time",
                  "tracking_type": "boolean",
                  "frameworkDetails": {
                    "type": "one_shot",
                    "intro": "Il est temps de prendre du recul et d'observer le chemin parcouru. Quels ont √©t√© les moments cl√©s ? Qu'est-ce qui a le mieux fonctionn√© ? O√π ressens-tu encore des frottements ? Cette introspection est essentielle pour ancrer tes progr√®s.",
                    "sections": [
                      {
                        "id": "s1",
                        "label": "Les 3 plus grandes victoires ou changements positifs observ√©s :",
                        "inputType": "list",
                        "placeholder": "Mon sommeil est plus profond|Je me sens moins irritable le matin"
                      },
                      {
                        "id": "s2",
                        "label": "Les habitudes qui sont d√©sormais ancr√©es dans mon quotidien :",
                        "inputType": "list",
                        "placeholder": "Le couvre-feu digital|La pause active"
                      },
                      {
                        "id": "s3",
                        "label": "Les d√©fis qui persistent ou les moments o√π je 'd√©croche' encore (et pourquoi, selon moi) :",
                        "inputType": "textarea",
                        "placeholder": "Quand j'ai une deadline tr√®s serr√©e, je sacrifie mon sommeil..."
                      },
                      {
                        "id": "s4",
                        "label": "Ma strat√©gie pour maintenir ces acquis et aborder les d√©fis restants :",
                        "inputType": "textarea",
                        "placeholder": "Je vais planifier mes pauses actives √† l'avance..."
                      }
                    ]
                  }
                },
                {
                  "id": "b9d816c6-8c9b-47db-9ebb-b86976cadf4a",
                  "tips": "Commence petit : la chaleur de ta couverture, le caf√© du matin, le calme. Ne force pas, laisse venir naturellement.",
                  "type": "habitude",
                  "title": "Le Rituel de Gratitude Matinal",
                  "status": "pending",
                  "questType": "side",
                  "rationale": "La gratitude est un puissant antidote √† l'irritabilit√© et au stress. Elle d√©place l'attention du manque vers l'abondance, activant les circuits de r√©compense et augmentant le bien-√™tre g√©n√©ral. Ce rituel matinal programme ton cerveau pour la positivit√© d√®s le d√©but de la journ√©e, renfor√ßant ta r√©silience √©motionnelle et ta stabilit√©.",
                  "targetReps": 10,
                  "description": "Chaque matin, au r√©veil ou pendant le petit-d√©jeuner, prends 2 minutes pour identifier et ressentir sinc√®rement 3 choses pour lesquelles tu es reconnaissant. Tu peux les noter ou juste y penser.",
                  "isCompleted": false,
                  "time_of_day": "morning",
                  "tracking_type": "boolean"
                }
              ],
              "subtitle": "Semaines 7-8 ‚Ä¢ Ancrer les acquis, cultiver la r√©silience",
              "rationale": "Apr√®s avoir mis en place les fondations du repos et les outils de gestion du stress, cette derni√®re phase vise √† consolider tes nouvelles habitudes et √† d√©velopper une r√©silience durable. Il s'agit de cultiver la constance et de c√©l√©brer les progr√®s pour maintenir cette transformation √† long terme."
            }
          ],
          "deepWhy": "Pour retrouver une √©nergie in√©branlable, √™tre plus patient et pr√©sent pour mes proches, et vivre une vie √©quilibr√©e o√π le stress ne dicte plus mes r√©actions.",
          "identity": "Je suis l'Ancre de mon Calme et le Gardien de mon √ânergie.",
          "strategy": "Face √† la charge mentale et √† l'irritabilit√©, notre priorit√© est de restaurer la qualit√© de ton sommeil et de construire des routines de d√©compression robustes. On va apaiser ton syst√®me nerveux en d√©samor√ßant les d√©clencheurs de stress, brique par brique.",
          "goldenRules": "1. Le soir, le travail et les √©crans intenses n'ont plus leur place.\n2. L'apaisement avant tout : je priorise ma d√©connexion.\n3. La constance est ma force, m√™me par petits pas.",
          "vitalSignal": {
            "name": "Temps d'√©cran apr√®s 21h",
            "type": "constat",
            "unit": "min",
            "startValue": "90",
            "description": "Mesure le temps pass√© devant un √©cran (t√©l√©phone, tablette, ordinateur, TV) apr√®s 21h chaque soir.",
            "targetValue": "0",
            "time_of_day": "night",
            "tracking_type": "counter"
          },
          "grimoireTitle": "Le Protocole S√©r√©nit√©",
          "context_problem": "√âpuis√© par des journ√©es intenses et des nuits hach√©es, tu te sentais pi√©g√© dans un cycle d'irritabilit√© et de manque d'√©nergie. Le travail tardif sur √©cran et une difficult√© √† te d√©connecter te privaient d'un repos r√©parateur, rendant la constance impossible. Ton principal blocage √©tait la fatigue elle-m√™me, qui sapait ta motivation.",
          "sophiaKnowledge": "Tu es un homme n√© en 1992, confront√© √† un stress √©lev√© et une charge mentale qui te rendent irritable. Ton travail sur √©cran se termine tard, perturbant ton sommeil, qui est de mauvaise qualit√©. Tu manques de constance, surtout quand la fatigue s'installe, ce qui t'emp√™che de maintenir de nouvelles habitudes. Ton niveau d'activit√© physique est faible.",
          "maintenanceCheck": {
            "type": "surveillance",
            "question": "Quel a √©t√© ton niveau d'irritabilit√© moyen cette semaine (√©chelle de 1 √† 10) ?",
            "frequency": "hebdomadaire",
            "tracking_type": "scale"
          },
          "estimatedDuration": "8 semaines"
        },
        "goal_id": "55537d10-821f-4bb4-8805-47c3f7c2a7a4",
        "deep_why": "Pour retrouver une √©nergie in√©branlable, √™tre plus patient et pr√©sent pour mes proches, et vivre une vie √©quilibr√©e o√π le stress ne dicte plus mes r√©actions.",
        "created_at": "2026-01-08T19:47:12.635384+00:00",
        "inputs_why": null,
        "current_phase": 1,
        "submission_id": "567ded7e-9ea7-42cc-8bcf-2491f16e022a",
        "inputs_context": null,
        "inputs_blockers": null,
        "progress_percentage": 0
      },
      "actions": [
        {
          "id": "3e857764-3d0e-4379-9a4b-9e39d2cc571e",
          "title": "Le Couvre-Feu Digital",
          "status": "active",
          "created_at": "2026-01-08T19:47:12.647971+00:00",
          "description": "√âteins ou mets en mode avion tous les √©crans (t√©l√©phone, tablette) au moins 60 minutes avant de dormir. Laisse-les hors de port√©e visuelle et physique de ta chambre.",
          "target_reps": 10,
          "time_of_day": "night",
          "current_reps": 0,
          "tracking_type": "boolean",
          "last_performed_at": "2026-01-06T19:47:12.643+00:00"
        },
        {
          "id": "2414a83c-fce3-4edc-a0d5-c3f0385c523f",
          "title": "Sanctuariser ta Chambre",
          "status": "active",
          "created_at": "2026-01-08T19:47:12.647971+00:00",
          "description": "Fais un grand nettoyage de ta chambre : supprime tout ce qui n'a pas sa place pour dormir (objets li√©s au travail, v√™tements en d√©sordre). Assure-toi que la pi√®ce est sombre, fra√Æche et silencieuse avant de te coucher.",
          "target_reps": 1,
          "time_of_day": "evening",
          "current_reps": 0,
          "tracking_type": "boolean",
          "last_performed_at": "2026-01-06T19:47:12.643+00:00"
        },
        {
          "id": "3dce9b8d-22c0-4167-a7c6-7ed4f2a79946",
          "title": "La Micro-Pause Consciente",
          "status": "active",
          "created_at": "2026-01-08T19:47:12.647971+00:00",
          "description": "Prends 2 √† 3 fois par jour une pause de 2 minutes pour t'arr√™ter, fermer les yeux, et te concentrer uniquement sur 5 respirations profondes et lentes. Fais-le avant de ressentir le pic de stress ou de fatigue.",
          "target_reps": 10,
          "time_of_day": "any_time",
          "current_reps": 0,
          "tracking_type": "boolean",
          "last_performed_at": "2026-01-06T19:47:12.643+00:00"
        }
      ],
      "frameworks": [],
      "dashboard_context": "=== PLAN ACTUEL (Tableau de Bord) ===\nTitre: Le Protocole S√©r√©nit√©\nStatut: active\nPhase courante (dashboard): 1\nPourquoi (Deep Why): Pour retrouver une √©nergie in√©branlable, √™tre plus patient et pr√©sent pour mes proches, et vivre une vie √©quilibr√©e o√π le stress ne dicte plus mes r√©actions.\nD√âTAIL COMPLET DU PLAN (Structure JSON) :\n{\n  \"phases\": [\n    {\n      \"id\": 1,\n      \"title\": \"Phase 1 : L'Ancrage Nocturne\",\n      \"status\": \"active\",\n      \"actions\": [\n        {\n          \"id\": \"3e857764-3d0e-4379-9a4b-9e39d2cc571e\",\n          \"tips\": \"Utilise un r√©veil analogique. Trouve une activit√© relaxante alternative : lecture papier, musique douce, discussion l√©g√®re.\",\n          \"type\": \"habitude\",\n          \"title\": \"Le Couvre-Feu Digital\",\n          \"status\": \"active\",\n          \"questType\": \"main\",\n          \"rationale\": \"La lumi√®re bleue et la stimulation mentale des √©crans bloquent la production de m√©latonine, l'hormone du sommeil. Rompre avec ce cycle permet √† ton cerveau de se pr√©parer naturellement au repos.\",\n          \"targetReps\": 10,\n          \"description\": \"√âteins ou mets en mode avion tous les √©crans (t√©l√©phone, tablette) au moins 60 minutes avant de dormir. Laisse-les hors de port√©e visuelle et physique de ta chambre.\",\n          \"isCompleted\": false,\n          \"time_of_day\": \"night\",\n          \"tracking_type\": \"boolean\"\n        },\n        {\n          \"id\": \"2414a83c-fce3-4edc-a0d5-c3f0385c523f\",\n          \"tips\": \"Investis dans des rideaux occultants, des boules Quies ou un masque de sommeil si n√©cessaire. Une temp√©rature id√©ale se situe entre 18 et 20¬∞C.\",\n          \"type\": \"mission\",\n          \"title\": \"Sanctuariser ta Chambre\",\n          \"status\": \"active\",\n          \"questType\": \"side\",\n          \"rationale\": \"Un environnement propre et d√©di√© au sommeil envoie un signal fort √† ton cerveau : cet espace est sacr√© pour le repos, et non pour l'activit√© ou le stress. Cela favorise une association positive et rapide avec l'endormissement.\",\n          \"description\": \"Fais un grand nettoyage de ta chambre : supprime tout ce qui n'a pas sa place pour dormir (objets li√©s au travail, v√™tements en d√©sordre). Assure-toi que la pi√®ce est sombre, fra√Æche et silencieuse avant de te coucher.\",\n          \"isCompleted\": false,\n          \"time_of_day\": \"evening\",\n          \"tracking_type\": \"boolean\"\n        }\n      ],\n      \"subtitle\": \"Semaines 1-2 ‚Ä¢ Reconstruire le socle du repos\",\n      \"rationale\": \"Avant de g√©rer le stress diurne, il est imp√©ratif de stopper l'h√©morragie √©nerg√©tique nocturne. Un sommeil de qualit√© est la fondation de toute stabilit√© √©motionnelle et mentale. Cette phase vise √† d√©samorcer les habitudes qui sabotent ton repos.\"\n    },\n    {\n      \"id\": 2,\n      \"title\": \"Phase 2 : Le Souffle R√©cup√©rateur\",\n      \"status\": \"locked\",\n      \"actions\": [\n        {\n          \"id\": \"3dce9b8d-22c0-4167-a7c6-7ed4f2a79946\",\n          \"tips\": \"D√©finis des rappels discrets sur ton t√©l√©phone. Choisis des moments charni√®res : avant de commencer une t√¢che complexe, apr√®s un appel difficile, avant de rentrer chez toi.\",\n          \"type\": \"habitude\",\n          \"title\": \"La Micro-Pause Consciente\",\n          \"status\": \"active\",\n          \"questType\": \"main\",\n          \"rationale\": \"Ces micro-pauses activent le syst√®me nerveux parasympathique, r√©duisant le cortisol et l'adr√©naline. Elles rompent le cycle du stress accumul√© et t'offrent des mini-r√©initialisations neuronales, augmentant ta capacit√© √† g√©rer les irritants sans exploser.\",\n          \"targetReps\": 10,\n          \"description\": \"Prends 2 √† 3 fois par jour une pause de 2 minutes pour t'arr√™ter, fermer les yeux, et te concentrer uniquement sur 5 respirations profondes et lentes. Fais-le avant de ressentir le pic de stress ou de fatigue.\",\n          \"isCompleted\": false,\n          \"time_of_day\": \"any_time\",\n          \"tracking_type\": \"boolean\"\n        },\n        {\n          \"id\": \"23041d5d-ed8a-40a8-b6e8-243b48fda3d3\",\n          \"tips\": \"Utilise un carnet et un stylo d√©di√©s. Ne relis pas imm√©diatement. L'objectif est de 'd√©poser' les pens√©es hors de ta t√™te.\",\n          \"type\": \"framework\",\n          \"title\": \"Le Carnet des Pens√©es\",\n          \"status\": \"pending\",\n          \"questType\": \"side\",\n          \"rationale\": \"Ce 'brain dump' externalise la charge mentale, r√©duisant le fardeau cognitif et l'hyperactivit√© pr√©-sommeil. Il aide √† lib√©rer l'esprit des ruminations, favorisant un endormissement plus rapide et un sommeil plus profond. C'est une habitude qui combat directement la charge mentale.\",\n          \"targetReps\": 10,\n          \"description\": \"Chaque soir, 30 minutes avant de te coucher, √©cris pendant 5 √† 10 minutes tout ce qui te pr√©occupe, te stresse, ou les pens√©es qui tournent en boucle. Ne te censure pas.\",\n          \"isCompleted\": false,\n          \"time_of_day\": \"evening\",\n          \"tracking_type\": \"counter\",\n          \"frameworkDetails\": {\n            \"type\": \"recurring\",\n            \"intro\": \"L'objectif est de vider ta t√™te de tout ce qui la sature. Qu'il s'agisse de t√¢ches √† faire, de pr√©occupations, d'√©motions non exprim√©es ou de pens√©es al√©atoires, d√©charge-les ici. Fais-le rapidement, sans jugement.\",\n            \"sections\": [\n              {\n                \"id\": \"s1\",\n                \"label\": \"Toutes les pens√©es et pr√©occupations qui me viennent √† l'esprit :\",\n                \"inputType\": \"textarea\",\n                \"placeholder\": \"Je pense √† ma r√©union de demain... J'ai oubli√© d'appeler X... Je suis agac√© par...\"\n              },\n              {\n                \"id\": \"s2\",\n                \"label\": \"√âmotion dominante ressentie apr√®s l'√©criture (1-10, 1=calme, 10=stress√©) :\",\n                \"inputType\": \"scale\",\n                \"placeholder\": \"5\"\n              }\n            ]\n          }\n        }\n      ],\n      \"subtitle\": \"Semaines 3-4 ‚Ä¢ Apaiser l'esprit, d√©charger la charge\",\n      \"rationale\": \"Maintenant que les bases du sommeil sont pos√©es, il est temps de t'√©quiper d'outils pour g√©rer la charge mentale et l'irritabilit√© au quotidien. Cette phase introduit des pratiques qui calment le syst√®me nerveux et permettent de vider le 'cache mental' avant qu'il ne s'emballe.\"\n    },\n    {\n      \"id\": 3,\n      \"title\": \"Phase 3 : La Reconnexion √ânerg√©tique\",\n      \"status\": \"locked\",\n      \"actions\": [\n        {\n          \"id\": \"bcde5cdd-8c49-46f8-a62c-e6e06882fcc3\",\n          \"tips\": \"Utilise les escaliers. Fais le tour du p√¢t√© de maisons. Colle un post-it 'MOVE!' sur ton √©cran. L'objectif n'est pas l'intensit√©, mais la r√©gularit√© du mouvement.\",\n          \"type\": \"habitude\",\n          \"title\": \"La Pause Active\",\n          \"status\": \"pending\",\n          \"questType\": \"main\",\n          \"rationale\": \"Le mouvement lib√®re des endorphines, r√©duit le cortisol et am√©liore la circulation sanguine vers le cerveau, augmentant la clart√© mentale et l'√©nergie. Ces micro-pauses physiques rompent les sch√©mas de s√©dentarit√© li√©s au travail sur √©cran et pr√©viennent l'accumulation de tension physique et mentale.\",\n          \"targetReps\": 10,\n          \"description\": \"Int√®gre 2 √† 3 pauses de 10 minutes d'activit√© physique l√©g√®re (marche rapide, √©tirements, quelques flexions/pompes) pendant ta journ√©e de travail. Sors de ton environnement de bureau.\",\n          \"isCompleted\": false,\n          \"time_of_day\": \"afternoon\",\n          \"tracking_type\": \"boolean\"\n        },\n        {\n          \"id\": \"f013fd56-7b4d-48ba-bec1-8b465881e1cc\",\n          \"tips\": \"Commence par 15 minutes cibl√©es. Utilise la r√®gle 'une place pour chaque chose'.\",\n          \"type\": \"mission\",\n          \"title\": \"L'Optimisation de l'Espace Mental\",\n          \"status\": \"pending\",\n          \"questType\": \"side\",\n          \"rationale\": \"Un environnement d√©sordonn√© est une source constante de distraction et de charge cognitive, augmentant subtilement ton niveau de stress. Un espace de travail √©pur√© et organis√© favorise la concentration, r√©duit les sollicitations visuelles et mentales, et te procure un sentiment de contr√¥le, diminuant l'irritabilit√©.\",\n          \"description\": \"D√©sencombre ton espace de travail physique et num√©rique : classe les documents, supprime les fichiers inutiles, organise tes ic√¥nes. Cr√©e un fond d'√©cran simple et apaisant.\",\n          \"isCompleted\": false,\n          \"time_of_day\": \"any_time\",\n          \"tracking_type\": \"boolean\"\n        }\n      ],\n      \"subtitle\": \"Semaines 5-6 ‚Ä¢ Recharger le corps, oxyg√©ner l'esprit\",\n      \"rationale\": \"Un niveau d'activit√© faible et un travail s√©dentaire contribuent √† la fatigue et au stress. Cette phase vise √† r√©introduire du mouvement et de l'oxyg√®ne pour stimuler l'√©nergie, briser la s√©dentarit√© et am√©liorer la capacit√© de gestion du stress sur le long terme.\"\n    },\n    {\n      \"id\": 4,\n      \"title\": \"Phase 4 : Le Ma√Ætre de la Coh√©rence\",\n      \"status\": \"locked\",\n      \"actions\": [\n        {\n          \"id\": \"61f3787f-b303-45a3-877e-37a9294fa6ca\",\n          \"tips\": \"Sois honn√™te avec toi-m√™me. Mets l'accent sur les progr√®s, m√™me minimes. Formule des intentions claires pour l'avenir.\",\n          \"type\": \"framework\",\n          \"title\": \"Bilan des Victoires et D√©fis\",\n          \"status\": \"pending\",\n          \"questType\": \"main\",\n          \"rationale\": \"Analyser ton parcours permet de renforcer les circuits neuronaux associ√©s aux r√©ussites (syst√®me de r√©compense) et d'identifier les points faibles avec une approche proactive. Cette introspection est cruciale pour la maintenance √† long terme et pour cultiver un sentiment d'auto-efficacit√©, combattant le manque de constance li√© √† la fatigue.\",\n          \"targetReps\": 1,\n          \"description\": \"Fais un bilan de ton parcours : quels sont les changements majeurs que tu as observ√©s ? Quelles habitudes sont ancr√©es ? Quels d√©fis persistent et comment peux-tu les aborder ?\",\n          \"isCompleted\": false,\n          \"time_of_day\": \"any_time\",\n          \"tracking_type\": \"boolean\",\n          \"frameworkDetails\": {\n            \"type\": \"one_shot\",\n            \"intro\": \"Il est temps de prendre du recul et d'observer le chemin parcouru. Quels ont √©t√© les moments cl√©s ? Qu'est-ce qui a le mieux fonctionn√© ? O√π ressens-tu encore des frottements ? Cette introspection est essentielle pour ancrer tes progr√®s.\",\n            \"sections\": [\n              {\n                \"id\": \"s1\",\n                \"label\": \"Les 3 plus grandes victoires ou changements positifs observ√©s :\",\n                \"inputType\": \"list\",\n                \"placeholder\": \"Mon sommeil est plus profond|Je me sens moins irritable le matin\"\n              },\n              {\n                \"id\": \"s2\",\n                \"label\": \"Les habitudes qui sont d√©sormais ancr√©es dans mon quotidien :\",\n                \"inputType\": \"list\",\n                \"placeholder\": \"Le couvre-feu digital|La pause active\"\n              },\n              {\n                \"id\": \"s3\",\n                \"label\": \"Les d√©fis qui persistent ou les moments o√π je 'd√©croche' encore (et pourquoi, selon moi) :\",\n                \"inputType\": \"textarea\",\n                \"placeholder\": \"Quand j'ai une deadline tr√®s serr√©e, je sacrifie mon sommeil...\"\n              },\n              {\n                \"id\": \"s4\",\n                \"label\": \"Ma strat√©gie pour maintenir ces acquis et aborder les d√©fis restants :\",\n                \"inputType\": \"textarea\",\n                \"placeholder\": \"Je vais planifier mes pauses actives √† l'avance...\"\n              }\n            ]\n          }\n        },\n        {\n          \"id\": \"b9d816c6-8c9b-47db-9ebb-b86976cadf4a\",\n          \"tips\": \"Commence petit : la chaleur de ta couverture, le caf√© du matin, le calme. Ne force pas, laisse venir naturellement.\",\n          \"type\": \"habitude\",\n          \"title\": \"Le Rituel de Gratitude Matinal\",\n          \"status\": \"pending\",\n          \"questType\": \"side\",\n          \"rationale\": \"La gratitude est un puissant antidote √† l'irritabilit√© et au stress. Elle d√©place l'attention du manque vers l'abondance, activant les circuits de r√©compense et augmentant le bien-√™tre g√©n√©ral. Ce rituel matinal programme ton cerveau pour la positivit√© d√®s le d√©but de la journ√©e, renfor√ßant ta r√©silience √©motionnelle et ta stabilit√©.\",\n          \"targetReps\": 10,\n          \"description\": \"Chaque matin, au r√©veil ou pendant le petit-d√©jeuner, prends 2 minutes pour identifier et ressentir sinc√®rement 3 choses pour lesquelles tu es reconnaissant. Tu peux les noter ou juste y penser.\",\n          \"isCompleted\": false,\n          \"time_of_day\": \"morning\",\n          \"tracking_type\": \"boolean\"\n        }\n      ],\n      \"subtitle\": \"Semaines 7-8 ‚Ä¢ Ancrer les acquis, cultiver la r√©silience\",\n      \"rationale\": \"Apr√®s avoir mis en place les fondations du repos et les outils de gestion du stress, cette derni√®re phase vise √† consolider tes nouvelles habitudes et √† d√©velopper une r√©silience durable. Il s'agit de cultiver la constance et de c√©l√©brer les progr√®s pour maintenir cette transformation √† long terme.\"\n    }\n  ],\n  \"deepWhy\": \"Pour retrouver une √©nergie in√©branlable, √™tre plus patient et pr√©sent pour mes proches, et vivre une vie √©quilibr√©e o√π le stress ne dicte plus mes r√©actions.\",\n  \"identity\": \"Je suis l'Ancre de mon Calme et le Gardien de mon √ânergie.\",\n  \"strategy\": \"Face √† la charge mentale et √† l'irritabilit√©, notre priorit√© est de restaurer la qualit√© de ton sommeil et de construire des routines de d√©compression robustes. On va apaiser ton syst√®me nerveux en d√©samor√ßant les d√©clencheurs de stress, brique par brique.\",\n  \"goldenRules\": \"1. Le soir, le travail et les √©crans intenses n'ont plus leur place.\\n2. L'apaisement avant tout : je priorise ma d√©connexion.\\n3. La constance est ma force, m√™me par petits pas.\",\n  \"vitalSignal\": {\n    \"name\": \"Temps d'√©cran apr√®s 21h\",\n    \"type\": \"constat\",\n    \"unit\": \"min\",\n    \"startValue\": \"90\",\n    \"description\": \"Mesure le temps pass√© devant un √©cran (t√©l√©phone, tablette, ordinateur, TV) apr√®s 21h chaque soir.\",\n    \"targetValue\": \"0\",\n    \"time_of_day\": \"night\",\n    \"tracking_type\": \"counter\"\n  },\n  \"grimoireTitle\": \"Le Protocole S√©r√©nit√©\",\n  \"context_problem\": \"√âpuis√© par des journ√©es intenses et des nuits hach√©es, tu te sentais pi√©g√© dans un cycle d'irritabilit√© et de manque d'√©nergie. Le travail tardif sur √©cran et une difficult√© √† te d√©connecter te privaient d'un repos r√©parateur, rendant la constance impossible. Ton principal blocage √©tait la fatigue elle-m√™me, qui sapait ta motivation.\",\n  \"sophiaKnowledge\": \"Tu es un homme n√© en 1992, confront√© √† un stress √©lev√© et une charge mentale qui te rendent irritable. Ton travail sur √©cran se termine tard, perturbant ton sommeil, qui est de mauvaise qualit√©. Tu manques de constance, surtout quand la fatigue s'installe, ce qui t'emp√™che de maintenir de nouvelles habitudes. Ton niveau d'activit√© physique est faible.\",\n  \"maintenanceCheck\": {\n    \"type\": \"surveillance\",\n    \"question\": \"Quel a √©t√© ton niveau d'irritabilit√© moyen cette semaine (√©chelle de 1 √† 10) ?\",\n    \"frequency\": \"hebdomadaire\",\n    \"tracking_type\": \"scale\"\n  },\n  \"estimatedDuration\": \"8 semaines\"\n}\n=== ACTIONS / FRAMEWORKS (√âTAT R√âEL DB) ===\nR√àGLES IMPORTANTES:\n- Les frameworks comptent comme des actions c√¥t√© utilisateur.\n- \"active\" = activ√©e et visible comme active dans l'app. \"pending\" = pas active.\n- On n'active/d√©sactive pas via WhatsApp: la seule mani√®re d'activer/d√©sactiver, c'est depuis le dashboard.\n\nActives (3):\n- [ACTION] Le Couvre-Feu Digital (night)\n- [ACTION] Sanctuariser ta Chambre (evening)\n- [ACTION] La Micro-Pause Consciente (any_time)\n\n=== SIGNES VITAUX (√âtat Actuel) ===\n- Temps d'√©cran apr√®s 21h: 90 min\n",
      "template_fingerprint": "f2be296b07bd6d33"
    },
    "scenario_target": "bilan"
  },
  "error": null
}