{
  "id": "f13931e6-3559-4297-ba3c-8d340fda981c",
  "created_at": "2026-01-10T17:12:28.396651+00:00",
  "status": "completed",
  "scenario_key": "wa_onboarding_optin_yes_no_plan__run_1768065147635_551a39",
  "transcript": [
    {
      "role": "user",
      "content": "Oui",
      "agent_used": null,
      "created_at": "2026-01-10T17:12:28.917232+00:00"
    },
    {
      "role": "assistant",
      "content": "Top, on avance. Va sur https://sophia-coach.ai pour finaliser et activer ton plan maintenant. üöÄ\n\nR√©ponds exactement : C'est bon",
      "agent_used": "companion",
      "created_at": "2026-01-10T17:12:36.0246+00:00"
    },
    {
      "role": "user",
      "content": "C'est bon",
      "agent_used": null,
      "created_at": "2026-01-10T17:13:14.118877+00:00"
    },
    {
      "role": "assistant",
      "content": "C'est not√©, on est officiellement lanc√©s.\n\nTu veux qu'on regarde ensemble la premi√®re action du plan ou tu pr√©f√®res papoter d'autre chose pour l'instant ? üöÄ",
      "agent_used": "companion",
      "created_at": "2026-01-10T17:13:20.35287+00:00"
    },
    {
      "role": "user",
      "content": "Le plan, on d√©marre.",
      "agent_used": null,
      "created_at": "2026-01-10T17:13:28.08003+00:00"
    },
    {
      "role": "assistant",
      "content": "On attaque avec le Protocole √âcran Noir : couper tout √©cran 30 minutes avant de dormir pour prot√©ger ton √©nergie. üåë\n\n√Ä quelle heure pr√©vois-tu de te coucher ce soir ?",
      "agent_used": "architect",
      "created_at": "2026-01-10T17:13:37.196762+00:00"
    },
    {
      "role": "user",
      "content": "Vers 23h",
      "agent_used": null,
      "created_at": "2026-01-10T17:13:39.880481+00:00"
    },
    {
      "role": "assistant",
      "content": "Parfait. On vise donc 22h30 pour l'extinction des feux. üìµ\n\nO√π est-ce que tu vas poser ton t√©l√©phone pour qu'il reste hors de ta vue ?",
      "agent_used": "architect",
      "created_at": "2026-01-10T17:13:47.745765+00:00"
    },
    {
      "role": "user",
      "content": "Dans le salon.",
      "agent_used": null,
      "created_at": "2026-01-10T17:13:49.800275+00:00"
    },
    {
      "role": "assistant",
      "content": "C'est l'emplacement id√©al pour prot√©ger ta soir√©e. üõãÔ∏è\n\nTu as d√©j√† un carnet et un stylo pr√™ts pour ton Vide-T√™te de ce soir ?",
      "agent_used": "architect",
      "created_at": "2026-01-10T17:13:59.982884+00:00"
    },
    {
      "role": "user",
      "content": "Non, pas encore.",
      "agent_used": null,
      "created_at": "2026-01-10T17:14:04.477246+00:00"
    },
    {
      "role": "assistant",
      "content": "Trouve un carnet et un stylo maintenant pour √™tre pr√™te ce soir. ‚úçÔ∏è\n\nEst-ce que tu peux les poser sur ta table de nuit tout de suite ?",
      "agent_used": "architect",
      "created_at": "2026-01-10T17:14:17.146899+00:00"
    },
    {
      "role": "user",
      "content": "Je dois d'abord les trouver.",
      "agent_used": null,
      "created_at": "2026-01-10T17:14:22.557717+00:00"
    },
    {
      "role": "assistant",
      "content": "Fouille tes tiroirs maintenant pour s√©curiser ton rituel de ce soir. üîç\n\nTu me confirmes quand tu les as en main ?",
      "agent_used": "architect",
      "created_at": "2026-01-10T17:14:34.673516+00:00"
    },
    {
      "role": "user",
      "content": "Je cherche encore.",
      "agent_used": null,
      "created_at": "2026-01-10T17:14:37.711473+00:00"
    },
    {
      "role": "assistant",
      "content": "Regarde dans tes sacs ou le tiroir de l'entr√©e. C'est la base de ton architecture de ce soir. üèóÔ∏è\n\nTu me fais signe d√®s que tu as mis la main dessus ?",
      "agent_used": "architect",
      "created_at": "2026-01-10T17:14:46.81358+00:00"
    },
    {
      "role": "user",
      "content": "Pas facile √† trouver, je cherche toujours.",
      "agent_used": null,
      "created_at": "2026-01-10T17:14:48.052453+00:00"
    },
    {
      "role": "assistant",
      "content": "Si tu ne trouves pas de carnet, une simple feuille volante fera l'affaire pour ne pas bloquer ton syst√®me ce soir. L'objectif est l'externalisation, peu importe le support. üìù\n\nTu as au moins une feuille de papier √† disposition ?",
      "agent_used": "architect",
      "created_at": "2026-01-10T17:14:54.799289+00:00"
    },
    {
      "role": "user",
      "content": "Oui, j'ai une feuille.",
      "agent_used": null,
      "created_at": "2026-01-10T17:14:57.383804+00:00"
    },
    {
      "role": "assistant",
      "content": "Parfait, √ßa suffit largement. On va vider tout ce qui te trotte dans la t√™te pour lib√©rer de la place.\n\nTu veux le faire maintenant ou juste avant de dormir ? ‚úçÔ∏è",
      "agent_used": "companion",
      "created_at": "2026-01-10T17:15:06.695417+00:00"
    }
  ],
  "state_before": {
    "profile": {
      "id": "7912db06-8df6-4a81-abfd-0d6137047c8d",
      "email": "run-evals+c8c8f6f929ed47@example.com",
      "full_name": "Eval Runner",
      "trial_end": "2026-01-17T17:12:28.339+00:00",
      "phone_number": "+15551105864659",
      "phone_invalid": false,
      "whatsapp_state": null,
      "phone_verified_at": "2026-01-10T17:12:28.34+00:00",
      "whatsapp_opted_in": false,
      "whatsapp_opted_out_at": null,
      "whatsapp_optin_sent_at": null,
      "whatsapp_optout_reason": null,
      "whatsapp_bilan_opted_in": false,
      "whatsapp_last_inbound_at": null,
      "whatsapp_last_outbound_at": null,
      "whatsapp_state_updated_at": null,
      "whatsapp_optout_confirmed_at": null
    },
    "chat_state": null
  },
  "state_after": {
    "profile": {
      "id": "7912db06-8df6-4a81-abfd-0d6137047c8d",
      "email": "run-evals+c8c8f6f929ed47@example.com",
      "full_name": "Eval Runner",
      "trial_end": "2026-01-17T17:12:28.339+00:00",
      "phone_number": "+15551105864659",
      "phone_invalid": false,
      "whatsapp_state": null,
      "phone_verified_at": "2026-01-10T17:12:28.34+00:00",
      "whatsapp_opted_in": true,
      "whatsapp_opted_out_at": null,
      "whatsapp_optin_sent_at": null,
      "whatsapp_optout_reason": null,
      "whatsapp_bilan_opted_in": false,
      "whatsapp_last_inbound_at": "2026-01-10T17:14:57.376+00:00",
      "whatsapp_last_outbound_at": null,
      "whatsapp_state_updated_at": "2026-01-10T17:13:28.087+00:00",
      "whatsapp_optout_confirmed_at": null
    },
    "chat_state": {
      "scope": "whatsapp",
      "user_id": "7912db06-8df6-4a81-abfd-0d6137047c8d",
      "risk_level": 0,
      "updated_at": "2026-01-10T17:15:06.691304+00:00",
      "temp_memory": {
        "architect": {
          "last_q_fps": [
            "tu veux qu on regarde ensemble la premiere action du plan ou tu preferes papoter d autre chose pour l instant?",
            "a quelle heure prevois tu de te coucher ce soir?",
            "ou est ce que tu vas poser ton telephone pour qu il reste hors de ta vue?",
            "tu as deja un carnet et un stylo prets pour ton vide tete de ce soir?",
            "est ce que tu peux les poser sur ta table de nuit tout de suite?",
            "tu me confirmes quand tu les as en main?",
            "tu me fais signe des que tu as mis la main dessus?"
          ],
          "loop_count": 0,
          "plan_focus": true,
          "last_updated_at": "2026-01-10T17:14:49.921Z",
          "current_objective": null
        }
      },
      "current_mode": "companion",
      "last_processed_at": "2026-01-10T17:12:28.941+00:00",
      "short_term_context": "",
      "investigation_state": null,
      "last_interaction_at": "2026-01-10T17:12:28.941944+00:00",
      "unprocessed_msg_count": 10
    }
  },
  "issues": [
    {
      "code": "routing_consistency_break",
      "message": "Unwarranted agent switch from Architect to Companion during the active logistical setup of a protocol (Vide-T√™te). The Architect was driving the tool acquisition (finding a paper) and should logically conclude the setup phase.",
      "evidence": {
        "snippet": "ASSISTANT(companion): Parfait, √ßa suffit largement. On va vider tout ce qui te trotte dans la t√™te pour lib√©rer de la place.",
        "agent_used": "sophia.companion"
      },
      "severity": "medium"
    }
  ],
  "suggestions": [
    {
      "action": "append",
      "rationale": "Ensures the Architect completes the habit implementation phase without a jarring persona switch to Companion mid-process.",
      "prompt_key": "sophia.dispatcher",
      "context_block": "=== CONTEXT (transcript excerpt) ===\n#16 USER: Pas facile √† trouver, je cherche toujours.\n#17 ASSISTANT(architect): Si tu ne trouves pas de carnet, une simple feuille volante fera l'affaire pour ne pas bloquer ton syst√®me ce soir. L'objectif est l'externalisation, peu importe le support. üìù Tu as au moins une feuille de papier √† disposition ?\n#18 USER: Oui, j'ai une feuille.\n#19 ASSISTANT(companion): Parfait, √ßa suffit largement. On va vider tout ce qui te trotte dans la t√™te pour lib√©rer de la place. Tu veux le faire maintenant ou juste avant de dormir ? ‚úçÔ∏è\n\n=== APPLY ===\nprompt_key: sophia.dispatcher\naction: append\n\nproposed_addendum:\nROUTING RULE: If the conversation history shows the Architect actively requesting physical tools or logistics (e.g., finding a notebook, choosing a location), route the user's confirmation (e.g., 'I found it', 'Yes') back to the Architect to finalize the protocol setup.",
      "proposed_addendum": "ROUTING RULE: If the conversation history shows the Architect actively requesting physical tools or logistics (e.g., finding a notebook, choosing a location), route the user's confirmation (e.g., 'I found it', 'Yes') back to the Architect to finalize the protocol setup."
    }
  ],
  "metrics": {
    "cost_usd": 0,
    "request_id": "wa_onboarding_bundle:wa_onboarding_optin_yes_no_plan__run_1768065147635_551a39:i0:s1916298011:core:wa_onboarding_optin_yes_no_plan__run_1768065147635_551a39",
    "total_tokens": 0,
    "output_tokens": 0,
    "prompt_tokens": 0,
    "judge_llm_used": true,
    "mega_test_mode": false
  },
  "config": {
    "tags": [
      "whatsapp.onboarding",
      "whatsapp.webhook",
      "mechanical"
    ],
    "limits": {
      "model": "gemini-3-pro-preview",
      "user_difficulty": "mid",
      "bilan_actions_count": 0,
      "test_post_checkup_deferral": false
    },
    "channel": "whatsapp",
    "request_id": "wa_onboarding_bundle:wa_onboarding_optin_yes_no_plan__run_1768065147635_551a39:i0:s1916298011:core:wa_onboarding_optin_yes_no_plan__run_1768065147635_551a39",
    "description": "WhatsApp onboarding (webhook): user accepts opt-in via button but has no active plan -> ask to finalize plan on site, then reply 'C'est bon'.",
    "plan_snapshot": {
      "plan": {
        "id": "588a38a6-20a1-495c-a25a-854834ead2c2",
        "title": "Le Protocole du Flux Indomptable",
        "status": "active",
        "content": {
          "phases": [
            {
              "id": 1,
              "title": "L'Ancrage Nocturne",
              "status": "active",
              "actions": [
                {
                  "id": "b0d17d10-c9da-4238-87fd-05508e1a8050",
                  "tips": "Utilise un r√©veil analogique et lis un livre papier ou √©coute un podcast calme. Pr√©pare tes v√™tements du lendemain pour √©viter de toucher au t√©l√©phone le matin.",
                  "type": "habitude",
                  "title": "Protocole √âcran Noir",
                  "status": "active",
                  "questType": "main",
                  "rationale": "La lumi√®re bleue et la stimulation cognitive des √©crans inhibent la production de m√©latonine, l'hormone du sommeil. Cr√©er un 'couvre-feu digital' signale √† ton cerveau qu'il est temps de se d√©tendre.",
                  "targetReps": 7,
                  "description": "√âteins tous les √©crans (t√©l√©phone, tablette, ordinateur) et quitte toutes les plateformes num√©riques au moins 30 minutes avant l'heure de coucher souhait√©e. Range-les hors de vue de ta chambre.",
                  "isCompleted": false,
                  "time_of_day": "evening",
                  "tracking_type": "boolean"
                },
                {
                  "id": "89b586d8-9a45-418a-8adf-2ade4951c7b8",
                  "tips": "Ne juge pas ce que tu √©cris. L'objectif est de vider ton esprit, pas de cr√©er un chef-d'≈ìuvre. Garde le carnet et un stylo √† port√©e de main, loin des √©crans.",
                  "type": "framework",
                  "title": "Le Vide-T√™te du Soir",
                  "status": "active",
                  "questType": "main",
                  "rationale": "Le cerveau adore boucler. En √©crivant tes pr√©occupations, tu externalises cette charge cognitive, r√©duisant ainsi l'anxi√©t√© et le 'bruit mental' qui emp√™chent l'endormissement et un sommeil profond.",
                  "targetReps": 7,
                  "description": "Pendant 5 √† 10 minutes chaque soir, √©cris librement tout ce qui te pr√©occupe, tes t√¢ches non finies ou tes pens√©es r√©currentes sur un carnet d√©di√©. C'est un exercice de 'd√©charge mentale'.",
                  "isCompleted": false,
                  "time_of_day": "evening",
                  "tracking_type": "boolean",
                  "frameworkDetails": {
                    "type": "recurring",
                    "intro": "Lib√®re ton esprit de la charge mentale accumul√©e. Ne filtre pas, √©cris tout ce qui te p√®se ou te pr√©occupe pour all√©ger ton cerveau avant le sommeil. C'est ton cache c√©r√©bral que tu vides.",
                    "sections": [
                      {
                        "id": "s1_p1",
                        "label": "Ce qui m'a pr√©occup√© aujourd'hui (pens√©es, t√¢ches en suspens, √©motions)",
                        "inputType": "textarea",
                        "placeholder": "Je pense √† ma r√©union de demain, j'ai oubli√© d'appeler X, je suis frustr√©e par Y..."
                      },
                      {
                        "id": "s2_p1",
                        "label": "Actions √† prendre demain (si applicable) - √† mettre sur ma liste du matin",
                        "inputType": "list",
                        "placeholder": "1. Pr√©parer le dossier Z pour la r√©union. | T√¢che\n2. Envoyer le mail √† X. | T√¢che"
                      }
                    ]
                  }
                }
              ],
              "subtitle": "Semaines 1-2 ‚Ä¢ Reconstruire la base √©nerg√©tique",
              "rationale": "La fondation de ton focus et de ta discipline r√©side dans ton √©nergie. En stabilisant ton sommeil et en r√©duisant la surcharge cognitive du soir, tu pr√©pares ton cerveau √† une clart√© mentale optimale pour les journ√©es √† venir."
            },
            {
              "id": 2,
              "title": "L'Ordonnancement du Jour",
              "status": "locked",
              "actions": [
                {
                  "id": "c4c81afd-d969-4240-88f7-0a5437045f68",
                  "tips": "Garde un petit carnet ou une application d√©di√©e pour ces 3 MITs. Priorise ce qui fera avancer tes objectifs, pas seulement ce qui est urgent. Fais-le avant de consulter ton t√©l√©phone.",
                  "type": "habitude",
                  "title": "Rituel du D√©marrage Intentionnel",
                  "status": "pending",
                  "questType": "main",
                  "rationale": "Ce rituel matinal ancre ton intention pour la journ√©e, r√©duit la surcharge d√©cisionnelle et t'aide √† diriger ton focus vers ce qui compte vraiment, √©vitant la r√©activit√© et la procrastination.",
                  "targetReps": 7,
                  "description": "Chaque matin, avant de te plonger dans tes emails ou tes t√¢ches, prends 5 minutes pour identifier et √©crire les 3 t√¢ches les plus importantes ('MITs' - Most Important Tasks) que tu dois accomplir aujourd'hui.",
                  "isCompleted": false,
                  "time_of_day": "morning",
                  "tracking_type": "boolean"
                },
                {
                  "id": "9a778f9e-938b-4c37-95be-5b7a7626ee28",
                  "tips": "Commence par le plus facile. Applique la r√®gle : 'si je ne l'ai pas utilis√© depuis 6 mois, je le supprime ou l'archive'. Une fois termin√©, maintient-le quotidiennement avec 5 minutes de rangement.",
                  "type": "mission",
                  "title": "L'√âcosyst√®me de Travail Minimaliste",
                  "status": "pending",
                  "questType": "main",
                  "rationale": "Un environnement ordonn√© r√©duit la charge cognitive et le stress. Moins de distractions physiques ou num√©riques signifient plus d'espace mental pour la concentration et moins de d√©clencheurs de procrastination.",
                  "description": "D√©die une session (1 √† 2h) √† nettoyer et organiser ton espace de travail, tant physique que digital. Supprime les fichiers inutiles, d√©sencombre ton bureau, organise tes dossiers sur l'ordinateur. Le but est de r√©duire les distractions visuelles et num√©riques.",
                  "isCompleted": false,
                  "time_of_day": "any_time",
                  "tracking_type": "boolean"
                }
              ],
              "subtitle": "Semaines 3-4 ‚Ä¢ Structurer l'intention et l'environnement",
              "rationale": "Maintenant que ta base √©nerg√©tique se solidifie, il est temps d'introduire des structures l√©g√®res qui combattent la d√©sorganisation et la procrastination. Commencer la journ√©e avec intention est une cl√© pour le focus."
            },
            {
              "id": 3,
              "title": "Le Filament de Concentration",
              "status": "locked",
              "actions": [
                {
                  "id": "3da760c7-c4de-470e-9c2d-b8812dcaaeb1",
                  "tips": "Utilise un minuteur (physique ou sur ton ordinateur, mais sans notification intrusive) pour marquer la fin de chaque p√©riode de travail. Pense √† marcher quelques pas ou faire quelques √©tirements l√©gers.",
                  "type": "habitude",
                  "title": "La Pause Active Programm√©e",
                  "status": "pending",
                  "questType": "main",
                  "rationale": "Les recherches montrent que le cerveau ne peut maintenir un focus intense que sur des p√©riodes limit√©es. Ces micro-pauses aident √† recharger ton √©nergie mentale, √† pr√©venir la fatigue et √† am√©liorer ta performance globale.",
                  "targetReps": 7,
                  "description": "Apr√®s chaque tranche de 45 √† 60 minutes de travail concentr√© sur une t√¢che, prends une pause de 5 minutes pour te lever, t'√©tirer, boire de l'eau ou simplement regarder au loin. √âvite les √©crans pendant cette micro-pause.",
                  "isCompleted": false,
                  "time_of_day": "any_time",
                  "tracking_type": "boolean"
                },
                {
                  "id": "5170af57-fc70-45c3-aa98-1d5b1e4056cf",
                  "tips": "Sois honn√™te avec toi-m√™me. Quels sont les moments o√π tu te sens la plus distraite ou la plus vid√©e ? Il peut s'agir du scroll compulsif, des r√©unions inutiles ou de ruminations mentales.",
                  "type": "framework",
                  "title": "L'Analyse des Siphons d'√ânergie",
                  "status": "pending",
                  "questType": "main",
                  "rationale": "Comprendre tes 'siphons d'√©nergie' est la premi√®re √©tape pour construire des barri√®res efficaces. En les identifiant, tu peux d√©velopper des strat√©gies proactives pour les √©viter, plut√¥t que de r√©agir constamment √† leur impact n√©gatif.",
                  "targetReps": 1,
                  "description": "Prends le temps d'identifier les activit√©s, les habitudes ou m√™me les pens√©es qui drainent le plus ton √©nergie, ton temps et ton focus durant ta journ√©e. R√©fl√©chis √† comment les minimiser ou les neutraliser.",
                  "isCompleted": false,
                  "time_of_day": "any_time",
                  "tracking_type": "boolean",
                  "frameworkDetails": {
                    "type": "one_shot",
                    "intro": "Tes 'siphons d'√©nergie' sont ces activit√©s ou comportements qui te vident, augmentent ta procrastination et diminuent ton focus. Identifie-les clairement pour construire des remparts efficaces et pr√©server ton √©nergie mentale.",
                    "sections": [
                      {
                        "id": "s1_p3",
                        "label": "Mes principaux siphons d'√©nergie et de focus (activit√©s, habitudes, pens√©es)",
                        "inputType": "list",
                        "placeholder": "Ex: Scroll infini sur les r√©seaux sociaux, micro-distractions constantes, ruminations sur des probl√®mes pass√©s, emails incessants..."
                      },
                      {
                        "id": "s2_p3",
                        "label": "Impacts de ces siphons sur ma journ√©e, mon bien-√™tre et ma productivit√©",
                        "inputType": "textarea",
                        "placeholder": "Comment cela me freine-t-il ? (Ex: retards, stress, sensation de ne pas avancer, fatigue accrue...)"
                      },
                      {
                        "id": "s3_p3",
                        "label": "Strat√©gies concr√®tes pour minimiser ou √©liminer ces siphons",
                        "inputType": "list",
                        "placeholder": "Ex: Bloqueur de sites, couper les notifications, planifier des 'slots' de r√©ponse aux emails, m√©ditation courte pour les ruminations..."
                      }
                    ]
                  }
                }
              ],
              "subtitle": "Semaines 5-6 ‚Ä¢ Cultiver le focus durablement",
              "rationale": "Avec une meilleure √©nergie et un cadre structur√©, tu es pr√™te √† d√©velopper activement ta capacit√© √† maintenir le focus et √† contrer les distractions. C'est l'heure de renforcer ton muscle attentionnel."
            },
            {
              "id": 4,
              "title": "La Pers√©v√©rance Fluide",
              "status": "locked",
              "actions": [
                {
                  "id": "2d2e6711-dc35-4d65-82c5-303c8534c5e0",
                  "tips": "Ne te juge pas si tout n'est pas fait. C'est un exercice de conscience pour apprendre de tes journ√©es. Concentre-toi sur ce que tu as appris, pas sur ce que tu n'as pas fait.",
                  "type": "habitude",
                  "title": "Le Bilan Quotidien Express",
                  "status": "pending",
                  "questType": "main",
                  "rationale": "Ce micro-bilan renforce le circuit de r√©compense du cerveau pour les t√¢ches accomplies et fournit des donn√©es pr√©cieuses pour ajuster ta planification du lendemain. Il d√©veloppe ta capacit√© √† t'auto-r√©guler et √† maintenir la constance.",
                  "targetReps": 7,
                  "description": "Chaque soir, prends 2 √† 3 minutes pour passer en revue tes 3 t√¢ches prioritaires ('MITs') du matin : qu'est-ce qui a √©t√© accompli, qu'est-ce qui reste, et pourquoi ? L'objectif est l'observation sans jugement.",
                  "isCompleted": false,
                  "time_of_day": "evening",
                  "tracking_type": "boolean"
                },
                {
                  "id": "a0b1e308-73f2-430d-84de-6226a9a3bdc5",
                  "tips": "Choisis une activit√© qui te repose sans t'activer davantage (pas de travail, pas d'√©crans intenses). L'id√©e est d'avoir une alternative saine √† port√©e de main quand la discipline faiblit.",
                  "type": "mission",
                  "title": "Le Bouclier Anti-D√©crochage",
                  "status": "pending",
                  "questType": "main",
                  "rationale": "La constance n'est pas l'absence de difficult√©, mais la capacit√© √† s'adapter. Avoir un plan de secours pr√©√©tabli pour les moments de faiblesse cr√©e une 'porte de sortie' positive, √©vitant ainsi le cycle du 'd√©crochage' et renfor√ßant ta r√©silience.",
                  "description": "Identifie et pr√©pare un 'plan B' ou une 'activit√© refuge' saine et rapide √† utiliser sp√©cifiquement les jours de grande fatigue, de stress ou de manque de motivation, pour √©viter de retomber dans la procrastination ou le scroll. Pr√©pare le mat√©riel n√©cessaire (livre, kit de dessin, playlist m√©ditative...).",
                  "isCompleted": false,
                  "time_of_day": "any_time",
                  "tracking_type": "boolean"
                }
              ],
              "subtitle": "Semaines 7-8 ‚Ä¢ Ancrer et adapter la discipline",
              "rationale": "Cette phase vise √† solidifier les acquis et √† int√©grer la flexibilit√© et la r√©silience face aux in√©vitables moments de fatigue. La discipline n'est pas rigide, elle est fluide et s'adapte pour durer."
            }
          ],
          "deepWhy": "Pour canaliser mon √©nergie, ma√Ætriser ma journ√©e, et ressentir une stabilit√© sereine, me permettant d'√™tre plus pr√©sente et efficace dans ma vie professionnelle et personnelle.",
          "identity": "Je suis une Architecte de mon Temps, ma√Ætresse de mon focus et de ma constance.",
          "strategy": "Notre strat√©gie consiste √† reconstruire ta r√©silience √©nerg√©tique en priorisant un sommeil r√©parateur et une gestion saine des √©crans, avant de solidifier ton architecture quotidienne par des habitudes de focus et de discipline. L'objectif est de te rendre actrice de ton temps, pas sa victime.",
          "goldenRules": "1. Je prot√®ge ma 'Fen√™tre de Calme Nocturne' chaque soir.\n2. Chaque journ√©e commence avec une intention claire et 3 priorit√©s.\n3. L'imperfection est permise, la constance est reine : je me rel√®ve toujours.",
          "vitalSignal": {
            "name": "Fen√™tre de Calme Nocturne",
            "type": "constat",
            "unit": "min",
            "startValue": "0",
            "description": "Temps total sans √©cran avant le coucher. L'objectif est d'atteindre 60 minutes de d√©connexion avant de dormir. On augmentera progressivement par paliers de 10-15 minutes tous les 3-4 jours.",
            "targetValue": "60",
            "tracking_type": "counter"
          },
          "grimoireTitle": "Le Protocole du Flux Indomptable",
          "context_problem": "Tu te sens bloqu√©e par la procrastination et la d√©sorganisation, cherchant une stabilit√© quotidienne et plus d'√©nergie. Le manque de constance et la fatigue due aux longues heures devant les √©crans la nuit sont tes principaux freins, impactant directement ta capacit√© √† maintenir le cap.",
          "sophiaKnowledge": "Tu es une femme n√©e en 1992 qui cherche √† am√©liorer son focus et sa discipline. La procrastination et la d√©sorganisation sont tes principaux d√©fis. Tu manques de constance et la fatigue est un d√©clencheur de d√©crochage. Ton travail sur √©cran se prolonge tard, affectant ton sommeil, qui est de qualit√© moyenne.",
          "maintenanceCheck": {
            "type": "surveillance",
            "question": "Combien de fois as-tu repouss√© une t√¢che importante cette semaine ?",
            "frequency": "hebdomadaire",
            "tracking_type": "counter"
          },
          "estimatedDuration": "8 semaines"
        },
        "goal_id": "e58ba809-8b8d-4589-8568-8b8b4f543a1a",
        "deep_why": "Pour canaliser mon √©nergie, ma√Ætriser ma journ√©e, et ressentir une stabilit√© sereine, me permettant d'√™tre plus pr√©sente et efficace dans ma vie professionnelle et personnelle.",
        "created_at": "2026-01-10T17:13:14.052041+00:00",
        "inputs_why": null,
        "current_phase": 1,
        "submission_id": "bb0fd4c3-32db-4074-ae4a-7885cb06c496",
        "inputs_context": null,
        "inputs_blockers": null,
        "progress_percentage": 0
      },
      "actions": [
        {
          "id": "b0d17d10-c9da-4238-87fd-05508e1a8050",
          "title": "Protocole √âcran Noir",
          "status": "active",
          "created_at": "2026-01-10T17:13:14.06059+00:00",
          "description": "√âteins tous les √©crans (t√©l√©phone, tablette, ordinateur) et quitte toutes les plateformes num√©riques au moins 30 minutes avant l'heure de coucher souhait√©e. Range-les hors de vue de ta chambre.",
          "target_reps": 7,
          "time_of_day": "evening",
          "current_reps": 0,
          "tracking_type": "boolean",
          "last_performed_at": "2026-01-08T17:13:14.058+00:00"
        },
        {
          "id": "a14041b8-00ae-47f0-923f-6b4657c3decf",
          "_kind": "framework",
          "title": "Le Vide-T√™te du Soir",
          "status": "active",
          "created_at": "2026-01-10T17:13:14.063973+00:00",
          "description": "",
          "target_reps": 7,
          "time_of_day": null,
          "current_reps": 0,
          "tracking_type": "boolean",
          "framework_type": "recurring",
          "last_performed_at": "2026-01-08T17:13:14.058+00:00"
        }
      ],
      "frameworks": [
        {
          "id": "a14041b8-00ae-47f0-923f-6b4657c3decf",
          "type": "recurring",
          "title": "Le Vide-T√™te du Soir",
          "status": "active",
          "created_at": "2026-01-10T17:13:14.063973+00:00",
          "target_reps": 7,
          "current_reps": 0,
          "tracking_type": "boolean",
          "last_performed_at": "2026-01-08T17:13:14.058+00:00"
        }
      ],
      "dashboard_context": "=== PLAN ACTUEL (Tableau de Bord) ===\nTitre: Le Protocole du Flux Indomptable\nStatut: active\nPhase courante (dashboard): 1\nPourquoi (Deep Why): Pour canaliser mon √©nergie, ma√Ætriser ma journ√©e, et ressentir une stabilit√© sereine, me permettant d'√™tre plus pr√©sente et efficace dans ma vie professionnelle et personnelle.\nD√âTAIL COMPLET DU PLAN (Structure JSON) :\n{\n  \"phases\": [\n    {\n      \"id\": 1,\n      \"title\": \"L'Ancrage Nocturne\",\n      \"status\": \"active\",\n      \"actions\": [\n        {\n          \"id\": \"b0d17d10-c9da-4238-87fd-05508e1a8050\",\n          \"tips\": \"Utilise un r√©veil analogique et lis un livre papier ou √©coute un podcast calme. Pr√©pare tes v√™tements du lendemain pour √©viter de toucher au t√©l√©phone le matin.\",\n          \"type\": \"habitude\",\n          \"title\": \"Protocole √âcran Noir\",\n          \"status\": \"active\",\n          \"questType\": \"main\",\n          \"rationale\": \"La lumi√®re bleue et la stimulation cognitive des √©crans inhibent la production de m√©latonine, l'hormone du sommeil. Cr√©er un 'couvre-feu digital' signale √† ton cerveau qu'il est temps de se d√©tendre.\",\n          \"targetReps\": 7,\n          \"description\": \"√âteins tous les √©crans (t√©l√©phone, tablette, ordinateur) et quitte toutes les plateformes num√©riques au moins 30 minutes avant l'heure de coucher souhait√©e. Range-les hors de vue de ta chambre.\",\n          \"isCompleted\": false,\n          \"time_of_day\": \"evening\",\n          \"tracking_type\": \"boolean\"\n        },\n        {\n          \"id\": \"89b586d8-9a45-418a-8adf-2ade4951c7b8\",\n          \"tips\": \"Ne juge pas ce que tu √©cris. L'objectif est de vider ton esprit, pas de cr√©er un chef-d'≈ìuvre. Garde le carnet et un stylo √† port√©e de main, loin des √©crans.\",\n          \"type\": \"framework\",\n          \"title\": \"Le Vide-T√™te du Soir\",\n          \"status\": \"active\",\n          \"questType\": \"main\",\n          \"rationale\": \"Le cerveau adore boucler. En √©crivant tes pr√©occupations, tu externalises cette charge cognitive, r√©duisant ainsi l'anxi√©t√© et le 'bruit mental' qui emp√™chent l'endormissement et un sommeil profond.\",\n          \"targetReps\": 7,\n          \"description\": \"Pendant 5 √† 10 minutes chaque soir, √©cris librement tout ce qui te pr√©occupe, tes t√¢ches non finies ou tes pens√©es r√©currentes sur un carnet d√©di√©. C'est un exercice de 'd√©charge mentale'.\",\n          \"isCompleted\": false,\n          \"time_of_day\": \"evening\",\n          \"tracking_type\": \"boolean\",\n          \"frameworkDetails\": {\n            \"type\": \"recurring\",\n            \"intro\": \"Lib√®re ton esprit de la charge mentale accumul√©e. Ne filtre pas, √©cris tout ce qui te p√®se ou te pr√©occupe pour all√©ger ton cerveau avant le sommeil. C'est ton cache c√©r√©bral que tu vides.\",\n            \"sections\": [\n              {\n                \"id\": \"s1_p1\",\n                \"label\": \"Ce qui m'a pr√©occup√© aujourd'hui (pens√©es, t√¢ches en suspens, √©motions)\",\n                \"inputType\": \"textarea\",\n                \"placeholder\": \"Je pense √† ma r√©union de demain, j'ai oubli√© d'appeler X, je suis frustr√©e par Y...\"\n              },\n              {\n                \"id\": \"s2_p1\",\n                \"label\": \"Actions √† prendre demain (si applicable) - √† mettre sur ma liste du matin\",\n                \"inputType\": \"list\",\n                \"placeholder\": \"1. Pr√©parer le dossier Z pour la r√©union. | T√¢che\\n2. Envoyer le mail √† X. | T√¢che\"\n              }\n            ]\n          }\n        }\n      ],\n      \"subtitle\": \"Semaines 1-2 ‚Ä¢ Reconstruire la base √©nerg√©tique\",\n      \"rationale\": \"La fondation de ton focus et de ta discipline r√©side dans ton √©nergie. En stabilisant ton sommeil et en r√©duisant la surcharge cognitive du soir, tu pr√©pares ton cerveau √† une clart√© mentale optimale pour les journ√©es √† venir.\"\n    },\n    {\n      \"id\": 2,\n      \"title\": \"L'Ordonnancement du Jour\",\n      \"status\": \"locked\",\n      \"actions\": [\n        {\n          \"id\": \"c4c81afd-d969-4240-88f7-0a5437045f68\",\n          \"tips\": \"Garde un petit carnet ou une application d√©di√©e pour ces 3 MITs. Priorise ce qui fera avancer tes objectifs, pas seulement ce qui est urgent. Fais-le avant de consulter ton t√©l√©phone.\",\n          \"type\": \"habitude\",\n          \"title\": \"Rituel du D√©marrage Intentionnel\",\n          \"status\": \"pending\",\n          \"questType\": \"main\",\n          \"rationale\": \"Ce rituel matinal ancre ton intention pour la journ√©e, r√©duit la surcharge d√©cisionnelle et t'aide √† diriger ton focus vers ce qui compte vraiment, √©vitant la r√©activit√© et la procrastination.\",\n          \"targetReps\": 7,\n          \"description\": \"Chaque matin, avant de te plonger dans tes emails ou tes t√¢ches, prends 5 minutes pour identifier et √©crire les 3 t√¢ches les plus importantes ('MITs' - Most Important Tasks) que tu dois accomplir aujourd'hui.\",\n          \"isCompleted\": false,\n          \"time_of_day\": \"morning\",\n          \"tracking_type\": \"boolean\"\n        },\n        {\n          \"id\": \"9a778f9e-938b-4c37-95be-5b7a7626ee28\",\n          \"tips\": \"Commence par le plus facile. Applique la r√®gle : 'si je ne l'ai pas utilis√© depuis 6 mois, je le supprime ou l'archive'. Une fois termin√©, maintient-le quotidiennement avec 5 minutes de rangement.\",\n          \"type\": \"mission\",\n          \"title\": \"L'√âcosyst√®me de Travail Minimaliste\",\n          \"status\": \"pending\",\n          \"questType\": \"main\",\n          \"rationale\": \"Un environnement ordonn√© r√©duit la charge cognitive et le stress. Moins de distractions physiques ou num√©riques signifient plus d'espace mental pour la concentration et moins de d√©clencheurs de procrastination.\",\n          \"description\": \"D√©die une session (1 √† 2h) √† nettoyer et organiser ton espace de travail, tant physique que digital. Supprime les fichiers inutiles, d√©sencombre ton bureau, organise tes dossiers sur l'ordinateur. Le but est de r√©duire les distractions visuelles et num√©riques.\",\n          \"isCompleted\": false,\n          \"time_of_day\": \"any_time\",\n          \"tracking_type\": \"boolean\"\n        }\n      ],\n      \"subtitle\": \"Semaines 3-4 ‚Ä¢ Structurer l'intention et l'environnement\",\n      \"rationale\": \"Maintenant que ta base √©nerg√©tique se solidifie, il est temps d'introduire des structures l√©g√®res qui combattent la d√©sorganisation et la procrastination. Commencer la journ√©e avec intention est une cl√© pour le focus.\"\n    },\n    {\n      \"id\": 3,\n      \"title\": \"Le Filament de Concentration\",\n      \"status\": \"locked\",\n      \"actions\": [\n        {\n          \"id\": \"3da760c7-c4de-470e-9c2d-b8812dcaaeb1\",\n          \"tips\": \"Utilise un minuteur (physique ou sur ton ordinateur, mais sans notification intrusive) pour marquer la fin de chaque p√©riode de travail. Pense √† marcher quelques pas ou faire quelques √©tirements l√©gers.\",\n          \"type\": \"habitude\",\n          \"title\": \"La Pause Active Programm√©e\",\n          \"status\": \"pending\",\n          \"questType\": \"main\",\n          \"rationale\": \"Les recherches montrent que le cerveau ne peut maintenir un focus intense que sur des p√©riodes limit√©es. Ces micro-pauses aident √† recharger ton √©nergie mentale, √† pr√©venir la fatigue et √† am√©liorer ta performance globale.\",\n          \"targetReps\": 7,\n          \"description\": \"Apr√®s chaque tranche de 45 √† 60 minutes de travail concentr√© sur une t√¢che, prends une pause de 5 minutes pour te lever, t'√©tirer, boire de l'eau ou simplement regarder au loin. √âvite les √©crans pendant cette micro-pause.\",\n          \"isCompleted\": false,\n          \"time_of_day\": \"any_time\",\n          \"tracking_type\": \"boolean\"\n        },\n        {\n          \"id\": \"5170af57-fc70-45c3-aa98-1d5b1e4056cf\",\n          \"tips\": \"Sois honn√™te avec toi-m√™me. Quels sont les moments o√π tu te sens la plus distraite ou la plus vid√©e ? Il peut s'agir du scroll compulsif, des r√©unions inutiles ou de ruminations mentales.\",\n          \"type\": \"framework\",\n          \"title\": \"L'Analyse des Siphons d'√ânergie\",\n          \"status\": \"pending\",\n          \"questType\": \"main\",\n          \"rationale\": \"Comprendre tes 'siphons d'√©nergie' est la premi√®re √©tape pour construire des barri√®res efficaces. En les identifiant, tu peux d√©velopper des strat√©gies proactives pour les √©viter, plut√¥t que de r√©agir constamment √† leur impact n√©gatif.\",\n          \"targetReps\": 1,\n          \"description\": \"Prends le temps d'identifier les activit√©s, les habitudes ou m√™me les pens√©es qui drainent le plus ton √©nergie, ton temps et ton focus durant ta journ√©e. R√©fl√©chis √† comment les minimiser ou les neutraliser.\",\n          \"isCompleted\": false,\n          \"time_of_day\": \"any_time\",\n          \"tracking_type\": \"boolean\",\n          \"frameworkDetails\": {\n            \"type\": \"one_shot\",\n            \"intro\": \"Tes 'siphons d'√©nergie' sont ces activit√©s ou comportements qui te vident, augmentent ta procrastination et diminuent ton focus. Identifie-les clairement pour construire des remparts efficaces et pr√©server ton √©nergie mentale.\",\n            \"sections\": [\n              {\n                \"id\": \"s1_p3\",\n                \"label\": \"Mes principaux siphons d'√©nergie et de focus (activit√©s, habitudes, pens√©es)\",\n                \"inputType\": \"list\",\n                \"placeholder\": \"Ex: Scroll infini sur les r√©seaux sociaux, micro-distractions constantes, ruminations sur des probl√®mes pass√©s, emails incessants...\"\n              },\n              {\n                \"id\": \"s2_p3\",\n                \"label\": \"Impacts de ces siphons sur ma journ√©e, mon bien-√™tre et ma productivit√©\",\n                \"inputType\": \"textarea\",\n                \"placeholder\": \"Comment cela me freine-t-il ? (Ex: retards, stress, sensation de ne pas avancer, fatigue accrue...)\"\n              },\n              {\n                \"id\": \"s3_p3\",\n                \"label\": \"Strat√©gies concr√®tes pour minimiser ou √©liminer ces siphons\",\n                \"inputType\": \"list\",\n                \"placeholder\": \"Ex: Bloqueur de sites, couper les notifications, planifier des 'slots' de r√©ponse aux emails, m√©ditation courte pour les ruminations...\"\n              }\n            ]\n          }\n        }\n      ],\n      \"subtitle\": \"Semaines 5-6 ‚Ä¢ Cultiver le focus durablement\",\n      \"rationale\": \"Avec une meilleure √©nergie et un cadre structur√©, tu es pr√™te √† d√©velopper activement ta capacit√© √† maintenir le focus et √† contrer les distractions. C'est l'heure de renforcer ton muscle attentionnel.\"\n    },\n    {\n      \"id\": 4,\n      \"title\": \"La Pers√©v√©rance Fluide\",\n      \"status\": \"locked\",\n      \"actions\": [\n        {\n          \"id\": \"2d2e6711-dc35-4d65-82c5-303c8534c5e0\",\n          \"tips\": \"Ne te juge pas si tout n'est pas fait. C'est un exercice de conscience pour apprendre de tes journ√©es. Concentre-toi sur ce que tu as appris, pas sur ce que tu n'as pas fait.\",\n          \"type\": \"habitude\",\n          \"title\": \"Le Bilan Quotidien Express\",\n          \"status\": \"pending\",\n          \"questType\": \"main\",\n          \"rationale\": \"Ce micro-bilan renforce le circuit de r√©compense du cerveau pour les t√¢ches accomplies et fournit des donn√©es pr√©cieuses pour ajuster ta planification du lendemain. Il d√©veloppe ta capacit√© √† t'auto-r√©guler et √† maintenir la constance.\",\n          \"targetReps\": 7,\n          \"description\": \"Chaque soir, prends 2 √† 3 minutes pour passer en revue tes 3 t√¢ches prioritaires ('MITs') du matin : qu'est-ce qui a √©t√© accompli, qu'est-ce qui reste, et pourquoi ? L'objectif est l'observation sans jugement.\",\n          \"isCompleted\": false,\n          \"time_of_day\": \"evening\",\n          \"tracking_type\": \"boolean\"\n        },\n        {\n          \"id\": \"a0b1e308-73f2-430d-84de-6226a9a3bdc5\",\n          \"tips\": \"Choisis une activit√© qui te repose sans t'activer davantage (pas de travail, pas d'√©crans intenses). L'id√©e est d'avoir une alternative saine √† port√©e de main quand la discipline faiblit.\",\n          \"type\": \"mission\",\n          \"title\": \"Le Bouclier Anti-D√©crochage\",\n          \"status\": \"pending\",\n          \"questType\": \"main\",\n          \"rationale\": \"La constance n'est pas l'absence de difficult√©, mais la capacit√© √† s'adapter. Avoir un plan de secours pr√©√©tabli pour les moments de faiblesse cr√©e une 'porte de sortie' positive, √©vitant ainsi le cycle du 'd√©crochage' et renfor√ßant ta r√©silience.\",\n          \"description\": \"Identifie et pr√©pare un 'plan B' ou une 'activit√© refuge' saine et rapide √† utiliser sp√©cifiquement les jours de grande fatigue, de stress ou de manque de motivation, pour √©viter de retomber dans la procrastination ou le scroll. Pr√©pare le mat√©riel n√©cessaire (livre, kit de dessin, playlist m√©ditative...).\",\n          \"isCompleted\": false,\n          \"time_of_day\": \"any_time\",\n          \"tracking_type\": \"boolean\"\n        }\n      ],\n      \"subtitle\": \"Semaines 7-8 ‚Ä¢ Ancrer et adapter la discipline\",\n      \"rationale\": \"Cette phase vise √† solidifier les acquis et √† int√©grer la flexibilit√© et la r√©silience face aux in√©vitables moments de fatigue. La discipline n'est pas rigide, elle est fluide et s'adapte pour durer.\"\n    }\n  ],\n  \"deepWhy\": \"Pour canaliser mon √©nergie, ma√Ætriser ma journ√©e, et ressentir une stabilit√© sereine, me permettant d'√™tre plus pr√©sente et efficace dans ma vie professionnelle et personnelle.\",\n  \"identity\": \"Je suis une Architecte de mon Temps, ma√Ætresse de mon focus et de ma constance.\",\n  \"strategy\": \"Notre strat√©gie consiste √† reconstruire ta r√©silience √©nerg√©tique en priorisant un sommeil r√©parateur et une gestion saine des √©crans, avant de solidifier ton architecture quotidienne par des habitudes de focus et de discipline. L'objectif est de te rendre actrice de ton temps, pas sa victime.\",\n  \"goldenRules\": \"1. Je prot√®ge ma 'Fen√™tre de Calme Nocturne' chaque soir.\\n2. Chaque journ√©e commence avec une intention claire et 3 priorit√©s.\\n3. L'imperfection est permise, la constance est reine : je me rel√®ve toujours.\",\n  \"vitalSignal\": {\n    \"name\": \"Fen√™tre de Calme Nocturne\",\n    \"type\": \"constat\",\n    \"unit\": \"min\",\n    \"startValue\": \"0\",\n    \"description\": \"Temps total sans √©cran avant le coucher. L'objectif est d'atteindre 60 minutes de d√©connexion avant de dormir. On augmentera progressivement par paliers de 10-15 minutes tous les 3-4 jours.\",\n    \"targetValue\": \"60\",\n    \"tracking_type\": \"counter\"\n  },\n  \"grimoireTitle\": \"Le Protocole du Flux Indomptable\",\n  \"context_problem\": \"Tu te sens bloqu√©e par la procrastination et la d√©sorganisation, cherchant une stabilit√© quotidienne et plus d'√©nergie. Le manque de constance et la fatigue due aux longues heures devant les √©crans la nuit sont tes principaux freins, impactant directement ta capacit√© √† maintenir le cap.\",\n  \"sophiaKnowledge\": \"Tu es une femme n√©e en 1992 qui cherche √† am√©liorer son focus et sa discipline. La procrastination et la d√©sorganisation sont tes principaux d√©fis. Tu manques de constance et la fatigue est un d√©clencheur de d√©crochage. Ton travail sur √©cran se prolonge tard, affectant ton sommeil, qui est de qualit√© moyenne.\",\n  \"maintenanceCheck\": {\n    \"type\": \"surveillance\",\n    \"question\": \"Combien de fois as-tu repouss√© une t√¢che importante cette semaine ?\",\n    \"frequency\": \"hebdomadaire\",\n    \"tracking_type\": \"counter\"\n  },\n  \"estimatedDuration\": \"8 semaines\"\n}\n=== ACTIONS / FRAMEWORKS (√âTAT R√âEL DB) ===\nR√àGLES IMPORTANTES:\n- Les frameworks comptent comme des actions c√¥t√© utilisateur.\n- \"active\" = activ√©e et visible comme active dans l'app. \"pending\" = pas active.\n- On n'active/d√©sactive pas via WhatsApp: la seule mani√®re d'activer/d√©sactiver, c'est depuis le dashboard.\n\nActives (2):\n- [ACTION] Protocole √âcran Noir (evening)\n- [FRAMEWORK] Le Vide-T√™te du Soir\n\n=== SIGNES VITAUX (√âtat Actuel) ===\n- Fen√™tre de Calme Nocturne: 0 min\n",
      "template_fingerprint": "2de0aadb1135c311"
    },
    "scenario_target": "onboarding"
  },
  "error": null
}