{
  "id": "fb1569a8-a858-4925-8c77-aa779deb0a8b",
  "created_at": "2026-01-10T17:01:43.034556+00:00",
  "status": "completed",
  "scenario_key": "wa_onboarding_optin_yes_no_plan__run_1768064502458_be2dd1",
  "transcript": [
    {
      "role": "user",
      "content": "Oui",
      "agent_used": null,
      "created_at": "2026-01-10T17:01:43.294552+00:00"
    },
    {
      "role": "assistant",
      "content": "√áa marche. Pour qu'on puisse avancer, il faut que tu actives ton plan sur le site l√† tout de suite.\n\nC'est par ici : https://sophia-coach.ai\n\nR√©ponds exactement : C'est bon quand c'est fait. üöÄ",
      "agent_used": "companion",
      "created_at": "2026-01-10T17:01:48.922562+00:00"
    },
    {
      "role": "user",
      "content": "C'est bon",
      "agent_used": null,
      "created_at": "2026-01-10T17:02:36.545297+00:00"
    },
    {
      "role": "assistant",
      "content": "Top, on est lanc√©s.\n\nTu veux qu‚Äôon parle du plan pour que je te guide sur la suite, ou tu veux parler d‚Äôautre chose d‚Äôabord ? ‚ö°",
      "agent_used": "companion",
      "created_at": "2026-01-10T17:02:45.353353+00:00"
    },
    {
      "role": "user",
      "content": "Oui, parlons du plan.",
      "agent_used": null,
      "created_at": "2026-01-10T17:02:47.419452+00:00"
    },
    {
      "role": "assistant",
      "content": "On d√©marre avec Le Protocole Lynx. L'objectif de cette premi√®re phase est de reprendre le contr√¥le sur tes r√©flexes num√©riques pour prot√©ger ton attention.\n\nTa premi√®re mission concr√®te est Le Silence Dor√© : il s'agit de d√©sactiver toutes les notifications non essentielles sur tes appareils pour stopper les micro-interruptions.\n\nEst-ce que tu as 2 minutes pour faire ce tri dans tes r√©glages maintenant ? ‚ö°",
      "agent_used": "architect",
      "created_at": "2026-01-10T17:02:54.67703+00:00"
    },
    {
      "role": "user",
      "content": "Oui, je peux regarder √ßa. C'est quoi la suite apr√®s ?",
      "agent_used": null,
      "created_at": "2026-01-10T17:03:00.957561+00:00"
    },
    {
      "role": "assistant",
      "content": "Parfait. La suite, c'est Le Gardien du Matin et du Soir : sanctuariser la premi√®re et la derni√®re heure de ta journ√©e sans aucun √©cran pour stabiliser ton √©nergie. üõ°Ô∏è\n\nMais d'abord, on s√©curise ton attention imm√©diate avec Le Silence Dor√© pour √©liminer les micro-interruptions.\n\nParmi tes applications, laquelle est la plus bavarde et te coupe le plus souvent dans ton √©lan ?",
      "agent_used": "architect",
      "created_at": "2026-01-10T17:03:12.363241+00:00"
    },
    {
      "role": "user",
      "content": "Instagram, je dirais. Une fois que j'ai fait √ßa, on passe au Gardien du Matin ?",
      "agent_used": null,
      "created_at": "2026-01-10T17:03:17.480307+00:00"
    },
    {
      "role": "assistant",
      "content": "C'est not√© pour Instagram. Une fois ces alertes coup√©es, tu ne subiras plus l'appel du scroll. üìµ\n\nLe Gardien du Matin et du Soir est d√©j√† actif dans ton plan. C'est ton rempart contre la fatigue mentale et le pilier de ta structure.\n\n√Ä quelle heure pr√©vois-tu de poser ton t√©l√©phone ce soir pour respecter ta derni√®re heure sans √©cran avant le coucher ?",
      "agent_used": "architect",
      "created_at": "2026-01-10T17:03:30.31984+00:00"
    },
    {
      "role": "user",
      "content": "Je vais essayer 22h.",
      "agent_used": null,
      "created_at": "2026-01-10T17:03:33.094165+00:00"
    },
    {
      "role": "assistant",
      "content": "22h, c'est not√©. C'est une cible claire pour prot√©ger ton sommeil et ton √©nergie de demain. üåô\n\nPour √©viter de craquer par r√©flexe, o√π vas-tu brancher ton t√©l√©phone ce soir pour qu'il soit physiquement hors de port√©e de ton lit ?",
      "agent_used": "architect",
      "created_at": "2026-01-10T17:03:41.475009+00:00"
    },
    {
      "role": "user",
      "content": "Dans le salon, je pense.",
      "agent_used": null,
      "created_at": "2026-01-10T17:03:44.040617+00:00"
    },
    {
      "role": "assistant",
      "content": "Le salon est parfait. Isoler physiquement l'appareil est la strat√©gie la plus efficace pour briser le cycle du scroll nocturne et prot√©ger ton attention. üõãÔ∏è\n\nPour demain matin, as-tu un r√©veil classique chez toi pour √©viter d'utiliser ton t√©l√©phone d√®s l'ouverture des yeux ?",
      "agent_used": "architect",
      "created_at": "2026-01-10T17:03:58.883202+00:00"
    },
    {
      "role": "user",
      "content": "Oui, j'ai un r√©veil classique.",
      "agent_used": null,
      "created_at": "2026-01-10T17:04:00.942591+00:00"
    },
    {
      "role": "assistant",
      "content": "Excellent. Ton environnement est maintenant s√©curis√© pour ce soir et demain matin. üõ°Ô∏è\n\nConcernant ta deuxi√®me action active, Le Silence Dor√© : as-tu d√©j√† pris 2 minutes pour d√©sactiver toutes les notifications non-essentielles sur ton t√©l√©phone ?",
      "agent_used": "architect",
      "created_at": "2026-01-10T17:04:10.636266+00:00"
    },
    {
      "role": "user",
      "content": "Pas encore, je suis en train de regarder √ßa. C'est beaucoup d'apps!",
      "agent_used": null,
      "created_at": "2026-01-10T17:04:14.425592+00:00"
    },
    {
      "role": "assistant",
      "content": "C'est le pi√®ge classique du bruit num√©rique. Pour √™tre efficace, ne traite pas les apps une par une : utilise la m√©thode radicale. üîá\n\nCoupe absolument tout par d√©faut dans tes r√©glages. Ne garde que les appels et les SMS pour les urgences r√©elles.\n\nEs-tu pr√™t √† tenter cette d√©connexion totale pour voir la diff√©rence demain matin ?",
      "agent_used": "architect",
      "created_at": "2026-01-10T17:04:22.279386+00:00"
    },
    {
      "role": "user",
      "content": "Oui, je vais essayer de faire √ßa. √áa va √™tre bizarre au d√©but je pense.",
      "agent_used": null,
      "created_at": "2026-01-10T17:04:25.852338+00:00"
    },
    {
      "role": "assistant",
      "content": "C'est le signe que le sevrage commence. Ce vide est n√©cessaire pour laisser place √† ta propre pens√©e plut√¥t qu'aux sollicitations externes. üßò\n\nFais-le maintenant, sans r√©fl√©chir. C'est l'action la plus rentable de ta soir√©e pour prot√©ger ton focus et ton sommeil.\n\nC'est bon pour toi, toutes les notifications inutiles sont officiellement coup√©es ?",
      "agent_used": "architect",
      "created_at": "2026-01-10T17:04:38.270987+00:00"
    }
  ],
  "state_before": {
    "profile": {
      "id": "7feed785-63f5-4d0c-ad63-c97836103cc1",
      "email": "run-evals+9cfc4dc8dcc24f@example.com",
      "full_name": "Eval Runner",
      "trial_end": "2026-01-17T17:01:42.994+00:00",
      "phone_number": "+15551506682849",
      "phone_invalid": false,
      "whatsapp_state": null,
      "phone_verified_at": "2026-01-10T17:01:42.995+00:00",
      "whatsapp_opted_in": false,
      "whatsapp_opted_out_at": null,
      "whatsapp_optin_sent_at": null,
      "whatsapp_optout_reason": null,
      "whatsapp_bilan_opted_in": false,
      "whatsapp_last_inbound_at": null,
      "whatsapp_last_outbound_at": null,
      "whatsapp_state_updated_at": null,
      "whatsapp_optout_confirmed_at": null
    },
    "chat_state": null
  },
  "state_after": {
    "profile": {
      "id": "7feed785-63f5-4d0c-ad63-c97836103cc1",
      "email": "run-evals+9cfc4dc8dcc24f@example.com",
      "full_name": "Eval Runner",
      "trial_end": "2026-01-17T17:01:42.994+00:00",
      "phone_number": "+15551506682849",
      "phone_invalid": false,
      "whatsapp_state": null,
      "phone_verified_at": "2026-01-10T17:01:42.995+00:00",
      "whatsapp_opted_in": true,
      "whatsapp_opted_out_at": null,
      "whatsapp_optin_sent_at": null,
      "whatsapp_optout_reason": null,
      "whatsapp_bilan_opted_in": false,
      "whatsapp_last_inbound_at": "2026-01-10T17:04:25.844+00:00",
      "whatsapp_last_outbound_at": null,
      "whatsapp_state_updated_at": "2026-01-10T17:02:47.427+00:00",
      "whatsapp_optout_confirmed_at": null
    },
    "chat_state": {
      "scope": "whatsapp",
      "user_id": "7feed785-63f5-4d0c-ad63-c97836103cc1",
      "risk_level": 0,
      "updated_at": "2026-01-10T17:04:38.265562+00:00",
      "temp_memory": {
        "architect": {
          "last_q_fps": [
            "tu veux qu on parle du plan pour que je te guide sur la suite ou tu veux parler d autre chose d abord?",
            "est ce que tu as 2 minutes pour faire ce tri dans tes reglages maintenant?",
            "parmi tes applications laquelle est la plus bavarde et te coupe le plus souvent dans ton elan?",
            "a quelle heure prevois tu de poser ton telephone ce soir pour respecter ta derniere heure sans ecran avant le coucher?",
            "pour eviter de craquer par reflexe ou vas tu brancher ton telephone ce soir pour qu il soit physiquement hors de portee ",
            "pour demain matin as tu un reveil classique chez toi pour eviter d utiliser ton telephone des l ouverture des yeux?",
            "concernant ta deuxieme action active le silence dore as tu deja pris 2 minutes pour desactiver toutes les notifications ",
            "es tu pret a tenter cette deconnexion totale pour voir la difference demain matin?"
          ],
          "loop_count": 4,
          "plan_focus": true,
          "last_updated_at": "2026-01-10T17:04:27.387Z",
          "current_objective": null
        }
      },
      "current_mode": "architect",
      "last_processed_at": "2026-01-10T17:01:43.304+00:00",
      "short_term_context": "",
      "investigation_state": null,
      "last_interaction_at": "2026-01-10T17:01:43.304788+00:00",
      "unprocessed_msg_count": 10
    }
  },
  "issues": [
    {
      "code": "flow_discontinuity",
      "message": "The Architect allows the user to switch topics from Mission 1 (Silence Dor√©) to Mission 2 (Gardien) before Mission 1 is resolved, completes the setup for Mission 2, and then abruptly loops back to Mission 1. This creates a disjointed, non-linear experience.",
      "evidence": {
        "snippet": "Concernant ta deuxi√®me action active, Le Silence Dor√© : as-tu d√©j√† pris 2 minutes pour d√©sactiver toutes les notifications...",
        "agent_used": "sophia.architect"
      },
      "severity": "medium"
    },
    {
      "code": "inconsistent_state_reference",
      "message": "The assistant initially introduces 'Le Silence Dor√©' as the 'premi√®re mission', but later refers to it as the 'deuxi√®me action active' without context justifying the change.",
      "evidence": {
        "snippet": "Ta premi√®re mission concr√®te est Le Silence Dor√© [...] Concernant ta deuxi√®me action active, Le Silence Dor√©",
        "agent_used": "sophia.architect"
      },
      "severity": "low"
    }
  ],
  "suggestions": [
    {
      "action": "append",
      "rationale": "Prevents the assistant from leaving tasks 'open' and awkwardly backtracking later, ensuring a structured and authoritative coaching flow.",
      "prompt_key": "sophia.architect",
      "context_block": "=== CONTEXT (transcript excerpt) ===\n=== STATE_BEFORE (user_chat_states) ===\ninvestigation_state:\nnull\n=== TRANSCRIPT ===\n#0 USER: Oui\n#1 ASSISTANT(companion): √áa marche. Pour qu'on puisse avancer, il faut que tu actives ton plan sur le site l√† tout de suite. C'est par ici : https://sophia-coach.ai R√©ponds exactement : C'est bon quand c'est fait. üöÄ\n#2 USER: C'est bon\n#3 ASSISTANT(companion): Top, on est lanc√©s. Tu veux qu‚Äôon parle du plan pour que je te guide sur la suite, ou tu veux parler d‚Äôautre chose d‚Äôabord ? ‚ö°\n#4 USER: Oui, parlons du plan.\n#5 ASSISTANT(architect): On d√©marre avec Le Protocole Lynx. L'objectif de cette premi√®re phase est de reprendre le contr√¥le sur tes r√©flexes num√©riques pour prot√©ger ton attention. Ta premi√®re mission concr√®te est Le Silence Dor√© : il s'agit de d√©sactiver toutes les notifications non essentielles sur tes appareils pour stopper les micro-interruptions. Est-ce que tu as 2 minutes pour faire ce tri dans tes r√©glages maintenant ? ‚ö°\n\n=== APPLY ===\nprompt_key: sophia.architect\naction: append\n\nproposed_addendum:\nWhen guiding the user through a plan, strictly maintain focus on the current step until it is validated or explicitly postponed. If the user asks about a future step, answer briefly but immediately redirect the conversation back to completing the current action to ensure linear progression.",
      "proposed_addendum": "When guiding the user through a plan, strictly maintain focus on the current step until it is validated or explicitly postponed. If the user asks about a future step, answer briefly but immediately redirect the conversation back to completing the current action to ensure linear progression."
    }
  ],
  "metrics": {
    "cost_usd": 0,
    "request_id": "wa_onboarding_bundle:wa_onboarding_optin_yes_no_plan__run_1768064502458_be2dd1:i0:s1916298011:core:wa_onboarding_optin_yes_no_plan__run_1768064502458_be2dd1",
    "total_tokens": 0,
    "output_tokens": 0,
    "prompt_tokens": 0,
    "judge_llm_used": true,
    "mega_test_mode": false
  },
  "config": {
    "tags": [
      "whatsapp.onboarding",
      "whatsapp.webhook",
      "mechanical"
    ],
    "limits": {
      "model": "gemini-3-pro-preview",
      "user_difficulty": "mid",
      "bilan_actions_count": 0,
      "test_post_checkup_deferral": false
    },
    "channel": "whatsapp",
    "request_id": "wa_onboarding_bundle:wa_onboarding_optin_yes_no_plan__run_1768064502458_be2dd1:i0:s1916298011:core:wa_onboarding_optin_yes_no_plan__run_1768064502458_be2dd1",
    "description": "WhatsApp onboarding (webhook): user accepts opt-in via button but has no active plan -> ask to finalize plan on site, then reply 'C'est bon'.",
    "plan_snapshot": {
      "plan": {
        "id": "c9f75ec5-2292-4f1e-a36e-5448132f85d0",
        "title": "Le Protocole Lynx",
        "status": "active",
        "content": {
          "phases": [
            {
              "id": 1,
              "title": "Le Grand R√©veil Num√©rique",
              "status": "active",
              "actions": [
                {
                  "id": "22a7055c-b7c1-4a93-803e-13ffdcccb672",
                  "tips": "Utilise un r√©veil non-connect√©. Pr√©pare tes activit√©s du matin la veille. Trouve une alternative au scroll (lecture, m√©ditation).",
                  "type": "habitude",
                  "title": "Le Gardien du Matin & du Soir",
                  "status": "active",
                  "questType": "main",
                  "rationale": "Cr√©e des bulles de tranquillit√© pour le cerveau, r√©duisant l'activation du syst√®me de r√©compense et permettant une meilleure transition entre les √©tats de conscience.",
                  "targetReps": 14,
                  "description": "Pas d'√©cran (t√©l√©phone, tablette, ordinateur) durant la premi√®re heure apr√®s le r√©veil et la derni√®re heure avant le coucher.",
                  "isCompleted": false,
                  "time_of_day": "morning",
                  "tracking_type": "boolean"
                },
                {
                  "id": "35a75427-8c78-44d4-9e08-4a072469891c",
                  "tips": "Fais-le pour le t√©l√©phone et l'ordinateur. R√©fl√©chis √† ce qui est VRAIMENT urgent. Utilise des modes 'Ne pas d√©ranger'.",
                  "type": "mission",
                  "title": "Le Silence Dor√©",
                  "status": "active",
                  "questType": "side",
                  "rationale": "Chaque notification est une micro-interruption qui fragmente l'attention et co√ªte de l'√©nergie mentale √† chaque fois que tu dois revenir √† ta t√¢che.",
                  "description": "D√©sactiver toutes les notifications non essentielles (visuelles, sonores, vibrations) sur tes appareils. Ne garde que celles qui demandent une action imm√©diate et critique.",
                  "isCompleted": false,
                  "time_of_day": "any_time",
                  "tracking_type": "boolean"
                },
                {
                  "id": "7f14d00e-6956-4d1a-b1f9-d4c238348b1d",
                  "tips": "La TJI est la seule chose qui COMPTE. Si tu ne fais que √ßa, ta journ√©e est r√©ussie. Sois r√©aliste.",
                  "type": "framework",
                  "title": "Ma Boussole Quotidienne",
                  "status": "pending",
                  "questType": "side",
                  "rationale": "Combat le sentiment d'√™tre submerg√© par une clart√© radicale sur ce qui est essentiel, √©vitant la surcharge cognitive et la paralysie de la d√©cision.",
                  "targetReps": 7,
                  "description": "Chaque matin, identifier la 'T√¢che du Jour Incontournable' (TJI) et 2-3 'T√¢ches Secondaires'.",
                  "isCompleted": false,
                  "time_of_day": "morning",
                  "tracking_type": "counter",
                  "frameworkDetails": {
                    "type": "recurring",
                    "intro": "Chaque matin, avant de commencer ta journ√©e, prends quelques minutes pour identifier clairement tes objectifs. Ne te laisse pas noyer par la liste interminable. Concentre-toi sur l'impact.",
                    "sections": [
                      {
                        "id": "tji",
                        "label": "La T√¢che du Jour Incontournable (TJI)",
                        "inputType": "text",
                        "placeholder": "Ex: Finaliser le rapport X"
                      },
                      {
                        "id": "secondary_tasks",
                        "label": "Mes 2-3 T√¢ches Secondaires",
                        "inputType": "list",
                        "placeholder": "Ex: R√©pondre aux emails importants"
                      }
                    ]
                  }
                }
              ],
              "subtitle": "Semaine 1 ‚Ä¢ Reprendre le contr√¥le du cerveau reptilien",
              "rationale": "Le premier pas vers le focus est de d√©sactiver les interrupteurs de la distraction pour calmer l'esprit et restaurer la clart√© initiale. C'est l'assaut frontal contre tes blocages."
            },
            {
              "id": 2,
              "title": "L'Ancrage de l'Attention",
              "status": "locked",
              "actions": [
                {
                  "id": "54e42904-78d8-4245-944b-0a8b7baf9d14",
                  "tips": "Commence par 30 minutes si 60-90 est trop. Utilise un minuteur. Choisis la t√¢che la plus complexe ou importante pour ce bloc.",
                  "type": "habitude",
                  "title": "La Bulle de Concentration Profonde",
                  "status": "pending",
                  "questType": "main",
                  "rationale": "D√©veloppe ta capacit√© √† maintenir l'attention sur la dur√©e, renfor√ßant les circuits neuronaux du focus et la production d'ac√©tylcholine.",
                  "targetReps": 7,
                  "description": "D√©dier au moins 60-90 minutes par jour √† une seule t√¢che, sans aucune interruption (t√©l√©phone en mode avion/silencieux, porte ferm√©e).",
                  "isCompleted": false,
                  "time_of_day": "morning",
                  "tracking_type": "boolean"
                },
                {
                  "id": "8c93e455-2fb6-4031-ba28-365dfb875f84",
                  "tips": "Ach√®te un chargeur suppl√©mentaire pour ce lieu. Visualise ce lieu comme une 'zone de silence'.",
                  "type": "habitude",
                  "title": "Le Sas Digital",
                  "status": "pending",
                  "questType": "side",
                  "rationale": "Cr√©e une barri√®re physique et psychologique pour limiter l'acc√®s impulsif, r√©duisant l'impact de la lumi√®re bleue et favorisant une transition plus sereine vers le sommeil.",
                  "targetReps": 7,
                  "description": "D√©signe un lieu sp√©cifique dans ta maison (hors chambre) o√π ton t√©l√©phone 'dort' pendant la nuit et au moins 1 heure avant le coucher.",
                  "isCompleted": false,
                  "time_of_day": "night",
                  "tracking_type": "boolean"
                },
                {
                  "id": "52371497-84b6-4907-b461-7fd81fc16008",
                  "tips": "Pas besoin d'√™tre un artiste. L'objectif est de visualiser les liens et de sortir tout de ta t√™te. Utilise du papier et des feutres.",
                  "type": "framework",
                  "title": "La Carte de mon Chaos Mental",
                  "status": "pending",
                  "questType": "side",
                  "rationale": "Externaliser le 'bruit' interne r√©duit la charge cognitive, lib√©rant de l'espace mental pour le focus et la r√©solution de probl√®mes. Aide √† voir les interconnexions et les priorit√©s.",
                  "targetReps": 1,
                  "description": "Une fois par semaine, faire une 'd√©charge mentale' visuelle sous forme de carte mentale pour organiser tes pens√©es, projets et pr√©occupations.",
                  "isCompleted": false,
                  "time_of_day": "any_time",
                  "tracking_type": "boolean",
                  "frameworkDetails": {
                    "type": "one_shot",
                    "intro": "Prends une grande feuille et un stylo. Au centre, √©cris 'Mon Esprit'. Ensuite, rayonne avec tes principaux domaines de vie (Travail, Famille, Perso, Probl√®mes, Id√©es...). Pour chaque branche, ajoute des sous-branches. Ne filtre rien, vide tout.",
                    "sections": [
                      {
                        "id": "mind_map_notes",
                        "label": "Mes observations cl√©s de cette carte mentale",
                        "inputType": "textarea",
                        "placeholder": "J'ai r√©alis√© que..."
                      },
                      {
                        "id": "main_distractions",
                        "label": "Les 3 principales sources de 'bruit' identifi√©es",
                        "inputType": "list",
                        "placeholder": "Ex: Projet X, Email Y, Notification Z"
                      }
                    ]
                  }
                }
              ],
              "subtitle": "Semaine 2 ‚Ä¢ B√¢tir des blocs de concentration",
              "rationale": "Maintenant que les distractions externes sont r√©duites, il est temps de cr√©er activement des espaces mentaux pour un focus profond et ininterrompu. C'est l√† que l'endurance mentale se forge."
            },
            {
              "id": 3,
              "title": "La Forge de la Discipline",
              "status": "locked",
              "actions": [
                {
                  "id": "9b312a2d-bf5b-4fb8-9ca0-c83b587d3aad",
                  "tips": "Commence petit. Choisis 2-3 activit√©s simples que tu peux tenir. √âvite les informations n√©gatives ou stressantes.",
                  "type": "habitude",
                  "title": "Mon Rituel d'√âveil Strat√©gique",
                  "status": "pending",
                  "questType": "main",
                  "rationale": "Conditionne ton cerveau √† d√©marrer la journ√©e avec intention et calme, augmentant la stabilit√© √©motionnelle et la capacit√© de concentration pour les heures √† venir.",
                  "targetReps": 7,
                  "description": "Mettre en place un court rituel matinal (15-20 minutes) sans √©cran qui stimule la clart√© et l'√©nergie : Ex: Hydratation, Mouvement l√©ger, Lecture inspirante.",
                  "isCompleted": false,
                  "time_of_day": "morning",
                  "tracking_type": "boolean"
                },
                {
                  "id": "faaa43b5-f94e-477c-859a-1a216ded2468",
                  "tips": "C'est un investissement pour ton cerveau. Pense aux √©couteurs √† r√©duction de bruit ou m√™me des bouchons d'oreilles. D√©sencombre visuellement ton bureau.",
                  "type": "mission",
                  "title": "Le Sanctuaire de l'Attention",
                  "status": "pending",
                  "questType": "side",
                  "rationale": "Les stimuli externes constants sont des 'voleurs d'attention'. Minimiser les interruptions permet au cerveau de rester en mode 'flow' plus longtemps, r√©duisant la fatigue mentale.",
                  "description": "Identifier et mettre en place des solutions pour r√©duire le bruit et les interruptions visuelles dans ton espace de travail principal (casque anti-bruit, r√©am√©nagement).",
                  "isCompleted": false,
                  "time_of_day": "any_time",
                  "tracking_type": "boolean"
                },
                {
                  "id": "ef9729e0-7599-4100-b890-c0522b18f243",
                  "tips": "√âvite les √©crans pendant ces pauses. L√®ve-toi, √©tire-toi. Utilise une alarme discr√®te.",
                  "type": "habitude",
                  "title": "L'Art de la Pause R√©g√©n√©ratrice",
                  "status": "pending",
                  "questType": "side",
                  "rationale": "Les pauses r√©guli√®res pr√©viennent la fatigue de l'attention et rechargent les ressources cognitives, am√©liorant la concentration et la productivit√© sur le long terme.",
                  "targetReps": 14,
                  "description": "Prendre une micro-pause de 5 minutes toutes les heures de travail intense. Le but est de te d√©connecter totalement : regarde par la fen√™tre, bois un verre d'eau, respire.",
                  "isCompleted": false,
                  "time_of_day": "afternoon",
                  "tracking_type": "counter"
                }
              ],
              "subtitle": "Semaine 3 ‚Ä¢ Optimiser l'√©nergie et la r√©silience",
              "rationale": "Le focus n'est pas qu'une question de volont√©, mais aussi d'√©nergie physique et mentale. Cette phase vise √† soutenir ta r√©silience interne et ta vitalit√©."
            },
            {
              "id": 4,
              "title": "Le Ma√Ætre du Temps",
              "status": "locked",
              "actions": [
                {
                  "id": "606fdcfe-7d5f-454c-a537-1d0ab1d35331",
                  "tips": "Sois honn√™te avec toi-m√™me. Le but est d'apprendre, pas de te juger. C'est un processus d'am√©lioration continue.",
                  "type": "habitude",
                  "title": "Le Bilan de l'Architecte",
                  "status": "pending",
                  "questType": "main",
                  "rationale": "La m√©ta-cognition permet d'ancrer les apprentissages, d'identifier les blocages r√©siduels et d'ajuster ta strat√©gie en temps r√©el, renfor√ßant ton sens de l'autonomie et de la discipline.",
                  "targetReps": 7,
                  "description": "Chaque soir (5-10 minutes), faire le point sur la journ√©e : Qu'est-ce qui a bien fonctionn√© ? Qu'est-ce qui a √©t√© difficile ? Pr√©parer la TJI du lendemain.",
                  "isCompleted": false,
                  "time_of_day": "evening",
                  "tracking_type": "boolean"
                },
                {
                  "id": "fcce027b-e625-446f-8f80-121465ae8ad0",
                  "tips": "Ne t'√©parpille pas. Choisis-en un que tu testeras pendant quelques jours avant d'envisager un autre. La simplicit√© est cl√©.",
                  "type": "mission",
                  "title": "L'Arsenal du Focus",
                  "status": "pending",
                  "questType": "side",
                  "rationale": "Une fois les bases comportementales √©tablies, les bons outils peuvent amplifier ton efficacit√© sans cr√©er de d√©pendance ni de distraction suppl√©mentaire.",
                  "description": "Rechercher et exp√©rimenter un ou deux outils/applications qui peuvent soutenir ton focus et ta gestion du temps (ex: bloqueur de site, pomodoro app, gestionnaire de t√¢ches l√©ger).",
                  "isCompleted": false,
                  "time_of_day": "any_time",
                  "tracking_type": "boolean"
                },
                {
                  "id": "199a00dd-5a80-4514-866c-7c3e65a25c9e",
                  "tips": "Relis tes notes. Reconnais tes progr√®s. Imagine ta vie dans 3 mois avec ces habitudes ancr√©es.",
                  "type": "framework",
                  "title": "Mon Manifeste du Ma√Ætre du Flux",
                  "status": "pending",
                  "questType": "side",
                  "rationale": "La r√©trospection est cruciale pour consolider les acquis et projeter une vision √† long terme, transformant les comportements en une identit√© solide.",
                  "targetReps": 1,
                  "description": "Faire un bilan complet des 4 semaines : Qu'est-ce que j'ai appris ? O√π suis-je plus fort ? Quelles sont mes prochaines √©tapes pour maintenir cette discipline ?",
                  "isCompleted": false,
                  "time_of_day": "evening",
                  "tracking_type": "boolean",
                  "frameworkDetails": {
                    "type": "one_shot",
                    "intro": "Tu as travers√© 4 semaines intenses de transformation. Prends le temps de c√©l√©brer tes victoires et d'ancrer ce nouveau toi. Ce manifeste est la preuve de ton parcours et le plan pour ton avenir.",
                    "sections": [
                      {
                        "id": "achievements",
                        "label": "Mes 3 plus grandes victoires de ces 4 semaines",
                        "inputType": "list",
                        "placeholder": "Ex: Moins de scrolling, plus de travail profond"
                      },
                      {
                        "id": "challenges_overcome",
                        "label": "Comment j'ai surmont√© les d√©fis majeurs",
                        "inputType": "textarea",
                        "placeholder": "J'ai appris √†..."
                      },
                      {
                        "id": "next_steps",
                        "label": "Mes 2 prochaines habitudes √† consolider/int√©grer",
                        "inputType": "list",
                        "placeholder": "Ex: M√©ditation quotidienne, sport r√©gulier"
                      }
                    ]
                  }
                }
              ],
              "subtitle": "Semaine 4 ‚Ä¢ Int√©gration et vision √† long terme",
              "rationale": "Apr√®s avoir construit les fondations, cette phase te permet d'int√©grer pleinement ces syst√®mes et de d√©velopper une approche proactive de ta productivit√©. C'est l'ascension finale vers la ma√Ætrise."
            }
          ],
          "deepWhy": "Pour retrouver une √©nergie constante, une paix mentale et √™tre in√©branlable face aux d√©fis quotidiens, me permettant d'√™tre stable et performant.",
          "identity": "Je suis un Ma√Ætre du Flux.",
          "strategy": "Nous allons d√©samorcer les distractions num√©riques et les surcharges cognitives pour forger une concentration in√©branlable et une √©nergie constante. Le chemin sera radical, les r√©sultats imm√©diats.",
          "goldenRules": "1. Mon t√©l√©phone est un outil, pas un ma√Ætre.\n2. Une t√¢che √† la fois, un focus total.\n3. Je prot√®ge ma clart√© mentale comme un tr√©sor.",
          "vitalSignal": {
            "name": "Temps d'√©cran apps de distraction",
            "type": "constat",
            "unit": "min",
            "startValue": "180",
            "description": "R√©duire drastiquement le temps pass√© sur les applications jug√©es distrayantes ou chronophages.",
            "targetValue": "60",
            "tracking_type": "counter"
          },
          "grimoireTitle": "Le Protocole Lynx",
          "context_problem": "√âpuis√© par des journ√©es sans structure et des distractions constantes, tu perds le fil de tes t√¢ches, te sentant submerg√©. L'usage compensatoire du t√©l√©phone aggrave ta fatigue et t'emp√™che d'atteindre la clart√© et la discipline souhait√©es.",
          "sophiaKnowledge": "Tu es un homme d'environ 35 ans qui lutte contre le manque de focus et les distractions num√©riques, surtout √† cause de journ√©es irr√©guli√®res et de la fatigue. Tu te sens submerg√© et tu compenses le stress par l'usage excessif du t√©l√©phone, ce qui te prive d'√©nergie et de stabilit√©.",
          "maintenanceCheck": {
            "type": "surveillance",
            "question": "Combien de fois cette semaine me suis-je retrouv√© 'perdu' dans mon t√©l√©phone sans intention claire ?",
            "frequency": "hebdomadaire"
          },
          "estimatedDuration": "4 semaines"
        },
        "goal_id": "c67af286-8cbb-4902-83ae-1994142b9a19",
        "deep_why": "Pour retrouver une √©nergie constante, une paix mentale et √™tre in√©branlable face aux d√©fis quotidiens, me permettant d'√™tre stable et performant.",
        "created_at": "2026-01-10T17:02:36.503122+00:00",
        "inputs_why": null,
        "current_phase": 1,
        "submission_id": "e0d73f19-969e-4e3c-9bdc-47c73ca515c5",
        "inputs_context": null,
        "inputs_blockers": null,
        "progress_percentage": 0
      },
      "actions": [
        {
          "id": "22a7055c-b7c1-4a93-803e-13ffdcccb672",
          "title": "Le Gardien du Matin & du Soir",
          "status": "active",
          "created_at": "2026-01-10T17:02:36.512971+00:00",
          "description": "Pas d'√©cran (t√©l√©phone, tablette, ordinateur) durant la premi√®re heure apr√®s le r√©veil et la derni√®re heure avant le coucher.",
          "target_reps": 14,
          "time_of_day": "morning",
          "current_reps": 0,
          "tracking_type": "boolean",
          "last_performed_at": "2026-01-08T17:02:36.51+00:00"
        },
        {
          "id": "35a75427-8c78-44d4-9e08-4a072469891c",
          "title": "Le Silence Dor√©",
          "status": "active",
          "created_at": "2026-01-10T17:02:36.512971+00:00",
          "description": "D√©sactiver toutes les notifications non essentielles (visuelles, sonores, vibrations) sur tes appareils. Ne garde que celles qui demandent une action imm√©diate et critique.",
          "target_reps": 1,
          "time_of_day": "any_time",
          "current_reps": 0,
          "tracking_type": "boolean",
          "last_performed_at": "2026-01-08T17:02:36.51+00:00"
        }
      ],
      "frameworks": [],
      "dashboard_context": "=== PLAN ACTUEL (Tableau de Bord) ===\nTitre: Le Protocole Lynx\nStatut: active\nPhase courante (dashboard): 1\nPourquoi (Deep Why): Pour retrouver une √©nergie constante, une paix mentale et √™tre in√©branlable face aux d√©fis quotidiens, me permettant d'√™tre stable et performant.\nD√âTAIL COMPLET DU PLAN (Structure JSON) :\n{\n  \"phases\": [\n    {\n      \"id\": 1,\n      \"title\": \"Le Grand R√©veil Num√©rique\",\n      \"status\": \"active\",\n      \"actions\": [\n        {\n          \"id\": \"22a7055c-b7c1-4a93-803e-13ffdcccb672\",\n          \"tips\": \"Utilise un r√©veil non-connect√©. Pr√©pare tes activit√©s du matin la veille. Trouve une alternative au scroll (lecture, m√©ditation).\",\n          \"type\": \"habitude\",\n          \"title\": \"Le Gardien du Matin & du Soir\",\n          \"status\": \"active\",\n          \"questType\": \"main\",\n          \"rationale\": \"Cr√©e des bulles de tranquillit√© pour le cerveau, r√©duisant l'activation du syst√®me de r√©compense et permettant une meilleure transition entre les √©tats de conscience.\",\n          \"targetReps\": 14,\n          \"description\": \"Pas d'√©cran (t√©l√©phone, tablette, ordinateur) durant la premi√®re heure apr√®s le r√©veil et la derni√®re heure avant le coucher.\",\n          \"isCompleted\": false,\n          \"time_of_day\": \"morning\",\n          \"tracking_type\": \"boolean\"\n        },\n        {\n          \"id\": \"35a75427-8c78-44d4-9e08-4a072469891c\",\n          \"tips\": \"Fais-le pour le t√©l√©phone et l'ordinateur. R√©fl√©chis √† ce qui est VRAIMENT urgent. Utilise des modes 'Ne pas d√©ranger'.\",\n          \"type\": \"mission\",\n          \"title\": \"Le Silence Dor√©\",\n          \"status\": \"active\",\n          \"questType\": \"side\",\n          \"rationale\": \"Chaque notification est une micro-interruption qui fragmente l'attention et co√ªte de l'√©nergie mentale √† chaque fois que tu dois revenir √† ta t√¢che.\",\n          \"description\": \"D√©sactiver toutes les notifications non essentielles (visuelles, sonores, vibrations) sur tes appareils. Ne garde que celles qui demandent une action imm√©diate et critique.\",\n          \"isCompleted\": false,\n          \"time_of_day\": \"any_time\",\n          \"tracking_type\": \"boolean\"\n        },\n        {\n          \"id\": \"7f14d00e-6956-4d1a-b1f9-d4c238348b1d\",\n          \"tips\": \"La TJI est la seule chose qui COMPTE. Si tu ne fais que √ßa, ta journ√©e est r√©ussie. Sois r√©aliste.\",\n          \"type\": \"framework\",\n          \"title\": \"Ma Boussole Quotidienne\",\n          \"status\": \"pending\",\n          \"questType\": \"side\",\n          \"rationale\": \"Combat le sentiment d'√™tre submerg√© par une clart√© radicale sur ce qui est essentiel, √©vitant la surcharge cognitive et la paralysie de la d√©cision.\",\n          \"targetReps\": 7,\n          \"description\": \"Chaque matin, identifier la 'T√¢che du Jour Incontournable' (TJI) et 2-3 'T√¢ches Secondaires'.\",\n          \"isCompleted\": false,\n          \"time_of_day\": \"morning\",\n          \"tracking_type\": \"counter\",\n          \"frameworkDetails\": {\n            \"type\": \"recurring\",\n            \"intro\": \"Chaque matin, avant de commencer ta journ√©e, prends quelques minutes pour identifier clairement tes objectifs. Ne te laisse pas noyer par la liste interminable. Concentre-toi sur l'impact.\",\n            \"sections\": [\n              {\n                \"id\": \"tji\",\n                \"label\": \"La T√¢che du Jour Incontournable (TJI)\",\n                \"inputType\": \"text\",\n                \"placeholder\": \"Ex: Finaliser le rapport X\"\n              },\n              {\n                \"id\": \"secondary_tasks\",\n                \"label\": \"Mes 2-3 T√¢ches Secondaires\",\n                \"inputType\": \"list\",\n                \"placeholder\": \"Ex: R√©pondre aux emails importants\"\n              }\n            ]\n          }\n        }\n      ],\n      \"subtitle\": \"Semaine 1 ‚Ä¢ Reprendre le contr√¥le du cerveau reptilien\",\n      \"rationale\": \"Le premier pas vers le focus est de d√©sactiver les interrupteurs de la distraction pour calmer l'esprit et restaurer la clart√© initiale. C'est l'assaut frontal contre tes blocages.\"\n    },\n    {\n      \"id\": 2,\n      \"title\": \"L'Ancrage de l'Attention\",\n      \"status\": \"locked\",\n      \"actions\": [\n        {\n          \"id\": \"54e42904-78d8-4245-944b-0a8b7baf9d14\",\n          \"tips\": \"Commence par 30 minutes si 60-90 est trop. Utilise un minuteur. Choisis la t√¢che la plus complexe ou importante pour ce bloc.\",\n          \"type\": \"habitude\",\n          \"title\": \"La Bulle de Concentration Profonde\",\n          \"status\": \"pending\",\n          \"questType\": \"main\",\n          \"rationale\": \"D√©veloppe ta capacit√© √† maintenir l'attention sur la dur√©e, renfor√ßant les circuits neuronaux du focus et la production d'ac√©tylcholine.\",\n          \"targetReps\": 7,\n          \"description\": \"D√©dier au moins 60-90 minutes par jour √† une seule t√¢che, sans aucune interruption (t√©l√©phone en mode avion/silencieux, porte ferm√©e).\",\n          \"isCompleted\": false,\n          \"time_of_day\": \"morning\",\n          \"tracking_type\": \"boolean\"\n        },\n        {\n          \"id\": \"8c93e455-2fb6-4031-ba28-365dfb875f84\",\n          \"tips\": \"Ach√®te un chargeur suppl√©mentaire pour ce lieu. Visualise ce lieu comme une 'zone de silence'.\",\n          \"type\": \"habitude\",\n          \"title\": \"Le Sas Digital\",\n          \"status\": \"pending\",\n          \"questType\": \"side\",\n          \"rationale\": \"Cr√©e une barri√®re physique et psychologique pour limiter l'acc√®s impulsif, r√©duisant l'impact de la lumi√®re bleue et favorisant une transition plus sereine vers le sommeil.\",\n          \"targetReps\": 7,\n          \"description\": \"D√©signe un lieu sp√©cifique dans ta maison (hors chambre) o√π ton t√©l√©phone 'dort' pendant la nuit et au moins 1 heure avant le coucher.\",\n          \"isCompleted\": false,\n          \"time_of_day\": \"night\",\n          \"tracking_type\": \"boolean\"\n        },\n        {\n          \"id\": \"52371497-84b6-4907-b461-7fd81fc16008\",\n          \"tips\": \"Pas besoin d'√™tre un artiste. L'objectif est de visualiser les liens et de sortir tout de ta t√™te. Utilise du papier et des feutres.\",\n          \"type\": \"framework\",\n          \"title\": \"La Carte de mon Chaos Mental\",\n          \"status\": \"pending\",\n          \"questType\": \"side\",\n          \"rationale\": \"Externaliser le 'bruit' interne r√©duit la charge cognitive, lib√©rant de l'espace mental pour le focus et la r√©solution de probl√®mes. Aide √† voir les interconnexions et les priorit√©s.\",\n          \"targetReps\": 1,\n          \"description\": \"Une fois par semaine, faire une 'd√©charge mentale' visuelle sous forme de carte mentale pour organiser tes pens√©es, projets et pr√©occupations.\",\n          \"isCompleted\": false,\n          \"time_of_day\": \"any_time\",\n          \"tracking_type\": \"boolean\",\n          \"frameworkDetails\": {\n            \"type\": \"one_shot\",\n            \"intro\": \"Prends une grande feuille et un stylo. Au centre, √©cris 'Mon Esprit'. Ensuite, rayonne avec tes principaux domaines de vie (Travail, Famille, Perso, Probl√®mes, Id√©es...). Pour chaque branche, ajoute des sous-branches. Ne filtre rien, vide tout.\",\n            \"sections\": [\n              {\n                \"id\": \"mind_map_notes\",\n                \"label\": \"Mes observations cl√©s de cette carte mentale\",\n                \"inputType\": \"textarea\",\n                \"placeholder\": \"J'ai r√©alis√© que...\"\n              },\n              {\n                \"id\": \"main_distractions\",\n                \"label\": \"Les 3 principales sources de 'bruit' identifi√©es\",\n                \"inputType\": \"list\",\n                \"placeholder\": \"Ex: Projet X, Email Y, Notification Z\"\n              }\n            ]\n          }\n        }\n      ],\n      \"subtitle\": \"Semaine 2 ‚Ä¢ B√¢tir des blocs de concentration\",\n      \"rationale\": \"Maintenant que les distractions externes sont r√©duites, il est temps de cr√©er activement des espaces mentaux pour un focus profond et ininterrompu. C'est l√† que l'endurance mentale se forge.\"\n    },\n    {\n      \"id\": 3,\n      \"title\": \"La Forge de la Discipline\",\n      \"status\": \"locked\",\n      \"actions\": [\n        {\n          \"id\": \"9b312a2d-bf5b-4fb8-9ca0-c83b587d3aad\",\n          \"tips\": \"Commence petit. Choisis 2-3 activit√©s simples que tu peux tenir. √âvite les informations n√©gatives ou stressantes.\",\n          \"type\": \"habitude\",\n          \"title\": \"Mon Rituel d'√âveil Strat√©gique\",\n          \"status\": \"pending\",\n          \"questType\": \"main\",\n          \"rationale\": \"Conditionne ton cerveau √† d√©marrer la journ√©e avec intention et calme, augmentant la stabilit√© √©motionnelle et la capacit√© de concentration pour les heures √† venir.\",\n          \"targetReps\": 7,\n          \"description\": \"Mettre en place un court rituel matinal (15-20 minutes) sans √©cran qui stimule la clart√© et l'√©nergie : Ex: Hydratation, Mouvement l√©ger, Lecture inspirante.\",\n          \"isCompleted\": false,\n          \"time_of_day\": \"morning\",\n          \"tracking_type\": \"boolean\"\n        },\n        {\n          \"id\": \"faaa43b5-f94e-477c-859a-1a216ded2468\",\n          \"tips\": \"C'est un investissement pour ton cerveau. Pense aux √©couteurs √† r√©duction de bruit ou m√™me des bouchons d'oreilles. D√©sencombre visuellement ton bureau.\",\n          \"type\": \"mission\",\n          \"title\": \"Le Sanctuaire de l'Attention\",\n          \"status\": \"pending\",\n          \"questType\": \"side\",\n          \"rationale\": \"Les stimuli externes constants sont des 'voleurs d'attention'. Minimiser les interruptions permet au cerveau de rester en mode 'flow' plus longtemps, r√©duisant la fatigue mentale.\",\n          \"description\": \"Identifier et mettre en place des solutions pour r√©duire le bruit et les interruptions visuelles dans ton espace de travail principal (casque anti-bruit, r√©am√©nagement).\",\n          \"isCompleted\": false,\n          \"time_of_day\": \"any_time\",\n          \"tracking_type\": \"boolean\"\n        },\n        {\n          \"id\": \"ef9729e0-7599-4100-b890-c0522b18f243\",\n          \"tips\": \"√âvite les √©crans pendant ces pauses. L√®ve-toi, √©tire-toi. Utilise une alarme discr√®te.\",\n          \"type\": \"habitude\",\n          \"title\": \"L'Art de la Pause R√©g√©n√©ratrice\",\n          \"status\": \"pending\",\n          \"questType\": \"side\",\n          \"rationale\": \"Les pauses r√©guli√®res pr√©viennent la fatigue de l'attention et rechargent les ressources cognitives, am√©liorant la concentration et la productivit√© sur le long terme.\",\n          \"targetReps\": 14,\n          \"description\": \"Prendre une micro-pause de 5 minutes toutes les heures de travail intense. Le but est de te d√©connecter totalement : regarde par la fen√™tre, bois un verre d'eau, respire.\",\n          \"isCompleted\": false,\n          \"time_of_day\": \"afternoon\",\n          \"tracking_type\": \"counter\"\n        }\n      ],\n      \"subtitle\": \"Semaine 3 ‚Ä¢ Optimiser l'√©nergie et la r√©silience\",\n      \"rationale\": \"Le focus n'est pas qu'une question de volont√©, mais aussi d'√©nergie physique et mentale. Cette phase vise √† soutenir ta r√©silience interne et ta vitalit√©.\"\n    },\n    {\n      \"id\": 4,\n      \"title\": \"Le Ma√Ætre du Temps\",\n      \"status\": \"locked\",\n      \"actions\": [\n        {\n          \"id\": \"606fdcfe-7d5f-454c-a537-1d0ab1d35331\",\n          \"tips\": \"Sois honn√™te avec toi-m√™me. Le but est d'apprendre, pas de te juger. C'est un processus d'am√©lioration continue.\",\n          \"type\": \"habitude\",\n          \"title\": \"Le Bilan de l'Architecte\",\n          \"status\": \"pending\",\n          \"questType\": \"main\",\n          \"rationale\": \"La m√©ta-cognition permet d'ancrer les apprentissages, d'identifier les blocages r√©siduels et d'ajuster ta strat√©gie en temps r√©el, renfor√ßant ton sens de l'autonomie et de la discipline.\",\n          \"targetReps\": 7,\n          \"description\": \"Chaque soir (5-10 minutes), faire le point sur la journ√©e : Qu'est-ce qui a bien fonctionn√© ? Qu'est-ce qui a √©t√© difficile ? Pr√©parer la TJI du lendemain.\",\n          \"isCompleted\": false,\n          \"time_of_day\": \"evening\",\n          \"tracking_type\": \"boolean\"\n        },\n        {\n          \"id\": \"fcce027b-e625-446f-8f80-121465ae8ad0\",\n          \"tips\": \"Ne t'√©parpille pas. Choisis-en un que tu testeras pendant quelques jours avant d'envisager un autre. La simplicit√© est cl√©.\",\n          \"type\": \"mission\",\n          \"title\": \"L'Arsenal du Focus\",\n          \"status\": \"pending\",\n          \"questType\": \"side\",\n          \"rationale\": \"Une fois les bases comportementales √©tablies, les bons outils peuvent amplifier ton efficacit√© sans cr√©er de d√©pendance ni de distraction suppl√©mentaire.\",\n          \"description\": \"Rechercher et exp√©rimenter un ou deux outils/applications qui peuvent soutenir ton focus et ta gestion du temps (ex: bloqueur de site, pomodoro app, gestionnaire de t√¢ches l√©ger).\",\n          \"isCompleted\": false,\n          \"time_of_day\": \"any_time\",\n          \"tracking_type\": \"boolean\"\n        },\n        {\n          \"id\": \"199a00dd-5a80-4514-866c-7c3e65a25c9e\",\n          \"tips\": \"Relis tes notes. Reconnais tes progr√®s. Imagine ta vie dans 3 mois avec ces habitudes ancr√©es.\",\n          \"type\": \"framework\",\n          \"title\": \"Mon Manifeste du Ma√Ætre du Flux\",\n          \"status\": \"pending\",\n          \"questType\": \"side\",\n          \"rationale\": \"La r√©trospection est cruciale pour consolider les acquis et projeter une vision √† long terme, transformant les comportements en une identit√© solide.\",\n          \"targetReps\": 1,\n          \"description\": \"Faire un bilan complet des 4 semaines : Qu'est-ce que j'ai appris ? O√π suis-je plus fort ? Quelles sont mes prochaines √©tapes pour maintenir cette discipline ?\",\n          \"isCompleted\": false,\n          \"time_of_day\": \"evening\",\n          \"tracking_type\": \"boolean\",\n          \"frameworkDetails\": {\n            \"type\": \"one_shot\",\n            \"intro\": \"Tu as travers√© 4 semaines intenses de transformation. Prends le temps de c√©l√©brer tes victoires et d'ancrer ce nouveau toi. Ce manifeste est la preuve de ton parcours et le plan pour ton avenir.\",\n            \"sections\": [\n              {\n                \"id\": \"achievements\",\n                \"label\": \"Mes 3 plus grandes victoires de ces 4 semaines\",\n                \"inputType\": \"list\",\n                \"placeholder\": \"Ex: Moins de scrolling, plus de travail profond\"\n              },\n              {\n                \"id\": \"challenges_overcome\",\n                \"label\": \"Comment j'ai surmont√© les d√©fis majeurs\",\n                \"inputType\": \"textarea\",\n                \"placeholder\": \"J'ai appris √†...\"\n              },\n              {\n                \"id\": \"next_steps\",\n                \"label\": \"Mes 2 prochaines habitudes √† consolider/int√©grer\",\n                \"inputType\": \"list\",\n                \"placeholder\": \"Ex: M√©ditation quotidienne, sport r√©gulier\"\n              }\n            ]\n          }\n        }\n      ],\n      \"subtitle\": \"Semaine 4 ‚Ä¢ Int√©gration et vision √† long terme\",\n      \"rationale\": \"Apr√®s avoir construit les fondations, cette phase te permet d'int√©grer pleinement ces syst√®mes et de d√©velopper une approche proactive de ta productivit√©. C'est l'ascension finale vers la ma√Ætrise.\"\n    }\n  ],\n  \"deepWhy\": \"Pour retrouver une √©nergie constante, une paix mentale et √™tre in√©branlable face aux d√©fis quotidiens, me permettant d'√™tre stable et performant.\",\n  \"identity\": \"Je suis un Ma√Ætre du Flux.\",\n  \"strategy\": \"Nous allons d√©samorcer les distractions num√©riques et les surcharges cognitives pour forger une concentration in√©branlable et une √©nergie constante. Le chemin sera radical, les r√©sultats imm√©diats.\",\n  \"goldenRules\": \"1. Mon t√©l√©phone est un outil, pas un ma√Ætre.\\n2. Une t√¢che √† la fois, un focus total.\\n3. Je prot√®ge ma clart√© mentale comme un tr√©sor.\",\n  \"vitalSignal\": {\n    \"name\": \"Temps d'√©cran apps de distraction\",\n    \"type\": \"constat\",\n    \"unit\": \"min\",\n    \"startValue\": \"180\",\n    \"description\": \"R√©duire drastiquement le temps pass√© sur les applications jug√©es distrayantes ou chronophages.\",\n    \"targetValue\": \"60\",\n    \"tracking_type\": \"counter\"\n  },\n  \"grimoireTitle\": \"Le Protocole Lynx\",\n  \"context_problem\": \"√âpuis√© par des journ√©es sans structure et des distractions constantes, tu perds le fil de tes t√¢ches, te sentant submerg√©. L'usage compensatoire du t√©l√©phone aggrave ta fatigue et t'emp√™che d'atteindre la clart√© et la discipline souhait√©es.\",\n  \"sophiaKnowledge\": \"Tu es un homme d'environ 35 ans qui lutte contre le manque de focus et les distractions num√©riques, surtout √† cause de journ√©es irr√©guli√®res et de la fatigue. Tu te sens submerg√© et tu compenses le stress par l'usage excessif du t√©l√©phone, ce qui te prive d'√©nergie et de stabilit√©.\",\n  \"maintenanceCheck\": {\n    \"type\": \"surveillance\",\n    \"question\": \"Combien de fois cette semaine me suis-je retrouv√© 'perdu' dans mon t√©l√©phone sans intention claire ?\",\n    \"frequency\": \"hebdomadaire\"\n  },\n  \"estimatedDuration\": \"4 semaines\"\n}\n=== ACTIONS / FRAMEWORKS (√âTAT R√âEL DB) ===\nR√àGLES IMPORTANTES:\n- Les frameworks comptent comme des actions c√¥t√© utilisateur.\n- \"active\" = activ√©e et visible comme active dans l'app. \"pending\" = pas active.\n- On n'active/d√©sactive pas via WhatsApp: la seule mani√®re d'activer/d√©sactiver, c'est depuis le dashboard.\n\nActives (2):\n- [ACTION] Le Gardien du Matin & du Soir (morning)\n- [ACTION] Le Silence Dor√© (any_time)\n\n=== SIGNES VITAUX (√âtat Actuel) ===\n- Temps d'√©cran apps de distraction: 180 min\n",
      "template_fingerprint": "d81d0925093d7499"
    },
    "scenario_target": "onboarding"
  },
  "error": null
}