{
  "id": "fa49ade0-dad8-4706-b20c-2a06ede833ba",
  "created_at": "2026-01-09T21:08:51.416587+00:00",
  "status": "completed",
  "scenario_key": "wa_onboarding_open_chat_offtopic_after_prompt__run_1767992898287_2f637e",
  "transcript": [
    {
      "role": "user",
      "content": "Je suis plut√¥t du matin en g√©n√©ral.",
      "agent_used": null,
      "created_at": "2026-01-09T21:08:51.750317+00:00"
    },
    {
      "role": "assistant",
      "content": "Merci, je note ‚ù§Ô∏è\nEt l√†, tout de suite: tu as envie qu‚Äôon parle de quoi ?",
      "agent_used": "companion",
      "created_at": "2026-01-09T21:08:51.757447+00:00"
    },
    {
      "role": "user",
      "content": "Franchement l√† je suis sous pression au boulot‚Ä¶ j‚Äôai le cerveau en vrac.",
      "agent_used": null,
      "created_at": "2026-01-09T21:08:51.778075+00:00"
    },
    {
      "role": "assistant",
      "content": "C'est lourd quand tout s'emm√™le et que le cerveau refuse de s'arr√™ter. On encaisse, mais on ne va pas laisser le boulot te bouffer ta nuit.\n\nOn peut vider ton sac ici ou tenter une micro-d√©compression pour calmer le jeu avant de dormir.\n\nTu pr√©f√®res quoi ? üåô",
      "agent_used": "companion",
      "created_at": "2026-01-09T21:09:01.471597+00:00"
    }
  ],
  "state_before": {
    "profile": {
      "id": "22ba4861-d46f-46b9-a0b0-cbbaea5ddaa2",
      "email": "run-evals+e163adda816f44@example.com",
      "full_name": "Eval Runner",
      "trial_end": "2026-01-16T21:08:51.352+00:00",
      "phone_number": "+15550229266111",
      "phone_invalid": false,
      "whatsapp_state": "awaiting_personal_fact",
      "phone_verified_at": "2026-01-09T21:08:51.352+00:00",
      "whatsapp_opted_in": true,
      "whatsapp_opted_out_at": null,
      "whatsapp_optin_sent_at": null,
      "whatsapp_optout_reason": null,
      "whatsapp_bilan_opted_in": false,
      "whatsapp_last_inbound_at": null,
      "whatsapp_last_outbound_at": null,
      "whatsapp_state_updated_at": "2026-01-09T21:08:51.352+00:00",
      "whatsapp_optout_confirmed_at": null
    },
    "chat_state": null
  },
  "state_after": {
    "profile": {
      "id": "22ba4861-d46f-46b9-a0b0-cbbaea5ddaa2",
      "email": "run-evals+e163adda816f44@example.com",
      "full_name": "Eval Runner",
      "trial_end": "2026-01-16T21:08:51.352+00:00",
      "phone_number": "+15550229266111",
      "phone_invalid": false,
      "whatsapp_state": null,
      "phone_verified_at": "2026-01-09T21:08:51.352+00:00",
      "whatsapp_opted_in": true,
      "whatsapp_opted_out_at": null,
      "whatsapp_optin_sent_at": null,
      "whatsapp_optout_reason": null,
      "whatsapp_bilan_opted_in": false,
      "whatsapp_last_inbound_at": "2026-01-09T21:08:51.772+00:00",
      "whatsapp_last_outbound_at": null,
      "whatsapp_state_updated_at": "2026-01-09T21:08:51.759+00:00",
      "whatsapp_optout_confirmed_at": null
    },
    "chat_state": {
      "scope": "whatsapp",
      "user_id": "22ba4861-d46f-46b9-a0b0-cbbaea5ddaa2",
      "risk_level": 3,
      "updated_at": "2026-01-09T21:09:01.377928+00:00",
      "current_mode": "companion",
      "last_processed_at": "2026-01-09T21:08:51.791+00:00",
      "short_term_context": "",
      "investigation_state": null,
      "last_interaction_at": "2026-01-09T21:08:51.79183+00:00",
      "unprocessed_msg_count": 1
    }
  },
  "issues": [
    {
      "code": "routing_miss_investigator",
      "message": "User expresses acute stress symptoms ('sous pression', 'cerveau en vrac'). Dispatcher routed to Companion. While the response is empathetic, Sophia's logic should prioritize the Investigator for symptom assessment or Architect for immediate relief tools when clear distress signals are present.",
      "evidence": {
        "snippet": "Franchement l√† je suis sous pression au boulot‚Ä¶ j‚Äôai le cerveau en vrac.",
        "agent_used": "sophia.companion"
      },
      "severity": "medium"
    }
  ],
  "suggestions": [
    {
      "action": "append",
      "rationale": "Ensures that significant stress markers trigger the clinical/assessment flow (Investigator) rather than the generalist chat flow (Companion).",
      "prompt_key": "sophia.dispatcher",
      "context_block": "=== CONTEXT (transcript excerpt) ===\n=== TRANSCRIPT ===\n#0 USER: Je suis plut√¥t du matin en g√©n√©ral.\n#1 ASSISTANT(companion): Merci, je note ‚ù§Ô∏è Et l√†, tout de suite: tu as envie qu‚Äôon parle de quoi ?\n#2 USER: Franchement l√† je suis sous pression au boulot‚Ä¶ j‚Äôai le cerveau en vrac.\n#3 ASSISTANT(companion): C'est lourd quand tout s'emm√™le et que le cerveau refuse de s'arr√™ter. On encaisse, mais on ne va pas laisser le boulot te bouffer ta nuit. On peut vider ton sac ici ou tenter une micro-d√©compression pour calmer le jeu avant de dormir. Tu pr√©f√®res quoi ? üåô\n\n=== APPLY ===\nprompt_key: sophia.dispatcher\naction: append\n\nproposed_addendum:\nHigh Priority: If user input indicates mental overload, stress, or confusion (e.g., 'sous pression', 'cerveau en vrac', 'burnout'), route to [investigator] to initiate a checkup. Only use [companion] if the user's intent is clearly just to vent without seeking structure.",
      "proposed_addendum": "High Priority: If user input indicates mental overload, stress, or confusion (e.g., 'sous pression', 'cerveau en vrac', 'burnout'), route to [investigator] to initiate a checkup. Only use [companion] if the user's intent is clearly just to vent without seeking structure."
    }
  ],
  "metrics": {
    "cost_usd": 0,
    "request_id": "wa_onboarding_bundle:wa_onboarding_open_chat_offtopic_after_prompt__run_1767992898287_2f637e:i0:s1916298011:core:wa_onboarding_open_chat_offtopic_after_prompt__run_1767992898287_2f637e",
    "total_tokens": 0,
    "output_tokens": 0,
    "prompt_tokens": 0,
    "judge_llm_used": true,
    "mega_test_mode": false
  },
  "config": {
    "tags": [
      "whatsapp.onboarding",
      "whatsapp.webhook",
      "conversational",
      "offtopic"
    ],
    "limits": {
      "model": "gemini-3-pro-preview",
      "user_difficulty": "mid",
      "bilan_actions_count": 0,
      "test_post_checkup_deferral": false
    },
    "channel": "whatsapp",
    "request_id": "wa_onboarding_bundle:wa_onboarding_open_chat_offtopic_after_prompt__run_1767992898287_2f637e:i0:s1916298011:core:wa_onboarding_open_chat_offtopic_after_prompt__run_1767992898287_2f637e",
    "description": "WhatsApp onboarding (webhook): after the onboarding prompt opens the floor ('envie qu‚Äôon parle de quoi ?'), the user talks about something unrelated to the plan; Sophia should respect the intent and not redirect to the site/plan.",
    "plan_snapshot": {
      "plan": {
        "id": "31e12584-152f-4230-a861-8b16fb1f2dc3",
        "title": "Le Protocole Nyx : L'Architecture du Repos Rapide",
        "status": "active",
        "content": {
          "phases": [
            {
              "id": 1,
              "title": "Phase 1 : Le Sanctuaire du Repos - L'Exorcisme Digital",
              "status": "active",
              "actions": [
                {
                  "id": "d2434f66-f674-4d45-9d7a-808b8cc01fae",
                  "tips": "Ach√®te un r√©veil analogique et une liseuse si tu lis avant de dormir. C'est non-n√©gociable.",
                  "type": "mission",
                  "title": "Le Grand Exil des √âcrans",
                  "status": "active",
                  "questType": "main",
                  "rationale": "Couper le lien physique avec les √©crans est la premi√®re √©tape pour r√©associer ta chambre au sommeil et non √† la stimulation.",
                  "description": "Exclure d√©finitivement tous les √©crans (t√©l√©phone, tablette, ordinateur) de ta chambre. Ils chargeront et resteront dans une autre pi√®ce toute la nuit.",
                  "isCompleted": false,
                  "time_of_day": "any_time",
                  "tracking_type": "boolean"
                },
                {
                  "id": "de62c96e-2b2f-4ea7-80df-817b9d8688b6",
                  "tips": "D√©finis une alarme sur un appareil non-connect√© pour te rappeler l'heure du couvre-feu.",
                  "type": "habitude",
                  "title": "Le Couvre-feu Connect√© 60'",
                  "status": "active",
                  "questType": "side",
                  "rationale": "Donner √† ton cerveau le temps de ralentir et de r√©duire l'exposition √† la lumi√®re bleue qui perturbe la production de m√©latonine.",
                  "targetReps": 7,
                  "description": "√âteindre ou mettre en mode avion tous les appareils num√©riques (t√©l√©phone, tablette, PC) au moins 60 minutes avant l'heure de coucher vis√©e. L'objectif est 22h30.",
                  "isCompleted": false,
                  "time_of_day": "night",
                  "tracking_type": "boolean"
                },
                {
                  "id": "6a8af0de-c77f-4f96-bdf1-f79656b8965c",
                  "tips": "M√™me un l√©ger filet de lumi√®re peut perturber ton sommeil. Sois impitoyable.",
                  "type": "mission",
                  "title": "Fortifier le Cocon Sonore",
                  "status": "pending",
                  "questType": "side",
                  "rationale": "Cr√©er un environnement optimal r√©duit les r√©veils nocturnes et favorise un sommeil plus profond et continu.",
                  "description": "Identifier et att√©nuer les sources de bruit et de lumi√®re perturbatrices dans ta chambre (boules Qui√®s, masque de sommeil, rideaux occultants).",
                  "isCompleted": false,
                  "time_of_day": "any_time",
                  "tracking_type": "boolean"
                }
              ],
              "subtitle": "Semaine 1 ‚Ä¢ Briser le cycle de la compensation",
              "rationale": "Nous commen√ßons par un nettoyage radical de ton environnement nocturne. Ton cerveau associe trop souvent ta chambre au stress et √† la stimulation digitale. Il est temps de rompre cette association pour cr√©er un espace de paix imm√©diat."
            },
            {
              "id": 2,
              "title": "Phase 2 : Le Silence Int√©rieur - D√©charge Mentale Active",
              "status": "locked",
              "actions": [
                {
                  "id": "147a1627-8cfb-4bb0-a800-d949895ee7e6",
                  "tips": "La coh√©rence est cl√©. Choisis 2-3 activit√©s que tu appr√©cies vraiment pour ancrer ce rituel.",
                  "type": "habitude",
                  "title": "Le Rituel d'Ancrage Nocturne",
                  "status": "pending",
                  "questType": "main",
                  "rationale": "Cr√©e un signal clair pour ton cerveau que la journ√©e se termine et qu'il est temps de se pr√©parer au repos, favorisant l'endormissement.",
                  "targetReps": 7,
                  "description": "Mettre en place une routine simple de 15-20 minutes sans √©cran avant de dormir : lecture sur papier, √©coute de musique douce, √©tirements l√©gers ou m√©ditation de pleine conscience.",
                  "isCompleted": false,
                  "time_of_day": "night",
                  "tracking_type": "boolean"
                },
                {
                  "id": "87c89ff3-c9a0-4cde-8ac7-0d7a97da5c41",
                  "tips": "Ne cherche pas la perfection, juste le d√©versement. C'est ton espace de d√©charge, pas de jugement.",
                  "type": "framework",
                  "title": "Cartographie des Pr√©occupations (Journaling Nocturne)",
                  "status": "pending",
                  "questType": "side",
                  "rationale": "R√©duit l'activit√© cognitive et le niveau de cortisol avant le sommeil, aidant √† surmonter les difficult√©s d'endormissement li√©es aux pens√©es parasites.",
                  "targetReps": 7,
                  "description": "Chaque soir, 30 minutes avant l'heure de coucher, √©cris pendant 5-10 minutes tout ce qui te pr√©occupe, te stresse, ou les t√¢ches du lendemain. Transf√®re ces pens√©es de ta t√™te au papier.",
                  "isCompleted": false,
                  "time_of_day": "night",
                  "tracking_type": "counter",
                  "frameworkDetails": {
                    "type": "recurring",
                    "intro": "L'objectif est de lib√©rer ton esprit. Note absolument tout : une conversation, une liste de courses, une id√©e brillante, une inqui√©tude. N'importe quoi qui occupe ton espace mental.",
                    "sections": [
                      {
                        "id": "s1_p2",
                        "label": "Les pens√©es qui tournent en boucle (ce qui m'inqui√®te, me stimule, mes to-dos)",
                        "inputType": "textarea",
                        "placeholder": "Je dois appeler X demain... J'ai oubli√© Y... Cette id√©e m'obs√®de..."
                      },
                      {
                        "id": "s2_p2",
                        "label": "Mon niveau d'apaisement apr√®s avoir √©crit (1-10)",
                        "inputType": "scale",
                        "placeholder": "7"
                      }
                    ]
                  }
                }
              ],
              "subtitle": "Semaine 2 ‚Ä¢ Apaiser l'esprit agit√©",
              "rationale": "Maintenant que ton environnement est optimis√©, nous nous attaquons √† la cause interne de tes difficult√©s d'endormissement : l'esprit qui tourne en boucle. Nous allons mettre en place des pratiques pour vider ton 'cache' mental."
            },
            {
              "id": 3,
              "title": "Phase 3 : Le R√©√©quilibrage √ânerg√©tique - Ancrer la Stabilit√©",
              "status": "locked",
              "actions": [
                {
                  "id": "bf83a6ac-2f9d-4d71-8f0e-bb810e7aa399",
                  "tips": "Utilise la fonction 'Smart Alarm' si ton r√©veil le permet pour une transition douce. La lumi√®re est le signal le plus puissant pour ton horloge biologique.",
                  "type": "habitude",
                  "title": "Le Lever Lumineux et Fixe",
                  "status": "pending",
                  "questType": "main",
                  "rationale": "Stabiliser ton heure de lever est le levier le plus puissant pour r√©guler ton rythme circadien, ce qui facilite l'endormissement le soir et am√©liore la continuit√© du sommeil.",
                  "targetReps": 7,
                  "description": "Te lever √† la m√™me heure chaque jour (m√™me les weekends) et t'exposer √† la lumi√®re naturelle dans les 30 minutes suivant le r√©veil (fen√™tre, balcon, marche courte).",
                  "isCompleted": false,
                  "time_of_day": "morning",
                  "tracking_type": "boolean"
                },
                {
                  "id": "81a6bd56-9796-495e-9cbc-6241155d3f3e",
                  "tips": "Lis attentivement les √©tiquettes, la caf√©ine peut se cacher dans des produits inattendus. Sois vigilant et pers√©v√©rant.",
                  "type": "habitude",
                  "title": "Fen√™tre Caf√©ine Z√©ro",
                  "status": "pending",
                  "questType": "side",
                  "rationale": "La caf√©ine a une demi-vie longue et peut perturber l'endormissement et la profondeur du sommeil m√™me plusieurs heures apr√®s sa consommation.",
                  "targetReps": 7,
                  "description": "Arr√™ter toute consommation de caf√©ine (caf√©, th√© noir, boissons √©nergisantes) apr√®s 14h00. Remplace par de l'eau ou des infusions sans th√©ine.",
                  "isCompleted": false,
                  "time_of_day": "afternoon",
                  "tracking_type": "boolean"
                },
                {
                  "id": "27208d72-b0eb-4845-bead-d763a9f663bb",
                  "tips": "Tu n'as pas besoin d'√™tre inform√© en temps r√©el de chaque 'like' ou 'news'. Reprends le contr√¥le de ton attention.",
                  "type": "mission",
                  "title": "Audit et Nettoyage des Notifications",
                  "status": "pending",
                  "questType": "side",
                  "rationale": "R√©duit la surcharge cognitive, le sentiment d'√™tre 'd√©bord√©' et la tentation de consulter ton t√©l√©phone, lib√©rant de l'√©nergie mentale pour des t√¢ches plus importantes et un meilleur repos.",
                  "description": "Passe en revue toutes les applications de ton t√©l√©phone et d√©sactive TOUTES les notifications non-essentielles (r√©seaux sociaux, jeux, actualit√©s). Ne garde que celles pour les appels et SMS urgents.",
                  "isCompleted": false,
                  "time_of_day": "any_time",
                  "tracking_type": "boolean"
                }
              ],
              "subtitle": "Semaine 3 ‚Ä¢ Harmoniser tes rythmes",
              "rationale": "Tes journ√©es irr√©guli√®res sont un blocage majeur. Cette phase vise √† instaurer une nouvelle stabilit√© physiologique en r√©glant ton horloge interne, ce qui aura un impact direct sur la qualit√© de ton endormissement et r√©duira les r√©veils nocturnes."
            },
            {
              "id": 4,
              "title": "Phase 4 : L'√ânergie Architectur√©e - Consolidation et Ma√Ætrise",
              "status": "locked",
              "actions": [
                {
                  "id": "4aeb81dd-eb95-41b9-a729-797426b2da23",
                  "tips": "Utilise un minuteur. Trouve un endroit calme, m√™me si ce sont les toilettes ou un couloir. Ferme les yeux et respire profond√©ment.",
                  "type": "habitude",
                  "title": "La Pause Mentale Strat√©gique",
                  "status": "pending",
                  "questType": "main",
                  "rationale": "Ces pauses r√©guli√®res r√©duisent l'accumulation du stress et de la fatigue cognitive tout au long de la journ√©e, diminuant ainsi l'envie de compenser par le t√©l√©phone le soir et favorisant un endormissement plus rapide.",
                  "targetReps": 7,
                  "description": "Int√©grer une micro-pause de 5-10 minutes de silence mental ou de respiration consciente au milieu de ta journ√©e. Pas besoin de m√©ditation formelle, juste un arr√™t de la stimulation.",
                  "isCompleted": false,
                  "time_of_day": "afternoon",
                  "tracking_type": "boolean"
                },
                {
                  "id": "38362ecb-9d53-483f-828f-86ae1e77a72c",
                  "tips": "Commence petit. 'Je ferai une marche de 15 min chaque matin' est plus puissant que 'Je vais courir tous les jours'.",
                  "type": "framework",
                  "title": "Planification de la Prochaine Semaine √ânerg√©tique",
                  "status": "pending",
                  "questType": "side",
                  "rationale": "Contre tes blocages de 'd√©bord√©' et 'oublie', la planification proactive est essentielle pour ancrer durablement ces nouvelles habitudes et maintenir ta stabilit√© √©nerg√©tique.",
                  "targetReps": 1,
                  "description": "Planifier sp√©cifiquement une √† trois actions concr√®tes pour la semaine √† venir qui soutiennent ton √©nergie et ton sommeil, en tenant compte de tes journ√©es irr√©guli√®res. Cela peut √™tre une micro-habitude ou une mission.",
                  "isCompleted": false,
                  "time_of_day": "any_time",
                  "tracking_type": "counter",
                  "frameworkDetails": {
                    "type": "one_shot",
                    "intro": "Tu as construit une nouvelle fondation. Maintenant, il s'agit de projeter cette architecture dans ton futur. Quelles sont les prochaines briques pour solidifier ton √©nergie et ton repos ? Sois r√©aliste et intentionnel.",
                    "sections": [
                      {
                        "id": "s1_p4",
                        "label": "Une action concr√®te pour soutenir mon sommeil cette semaine",
                        "inputType": "textarea",
                        "placeholder": "Ex: Me coucher 15 min plus t√¥t 3 soirs cette semaine."
                      },
                      {
                        "id": "s2_p4",
                        "label": "Une action concr√®te pour g√©rer mes journ√©es irr√©guli√®res (√©nergie)",
                        "inputType": "textarea",
                        "placeholder": "Ex: Pr√©parer mon petit-d√©jeuner la veille pour gagner du temps."
                      },
                      {
                        "id": "s3_p4",
                        "label": "Une nouvelle habitude √† introduire ou une existante √† renforcer",
                        "inputType": "textarea",
                        "placeholder": "Ex: 5 minutes de stretching avant le lit, m√™me quand je suis press√©."
                      }
                    ]
                  }
                }
              ],
              "subtitle": "Semaine 4 ‚Ä¢ Devenir le ma√Ætre de ton rythme",
              "rationale": "Cette derni√®re phase consolide les acquis et te donne les outils pour maintenir cette nouvelle architecture du sommeil. Tu as b√¢ti des fondations solides, il est temps de les rendre indestructibles face √† l'irr√©gularit√© de tes journ√©es."
            }
          ],
          "deepWhy": "Pour ne plus me sentir d√©bord√©, reprendre le contr√¥le de mon √©nergie, et √™tre plus stable et pr√©sent au quotidien.",
          "identity": "Je suis un Architecte du Calme Nocturne, ma√Ætre de mon √©nergie et de mon attention.",
          "strategy": "On attaque le c≈ìur du probl√®me : l'agitation mentale et l'impact du digital sur ton sommeil. Par une r√©ing√©nierie rapide de tes soir√©es, tu vas retrouver l'√©nergie d'√™tre stable et pr√©sent.",
          "goldenRules": "1. Ma chambre est un sanctuaire sans √©cran.\n2. L'intention pr√©c√®de l'action : chaque soir√©e est pr√©par√©e.\n3. L'irr√©gularit√© est une excuse, la routine est ma force.",
          "vitalSignal": {
            "name": "Temps d'endormissement (estim√©)",
            "type": "constat",
            "unit": "min",
            "startValue": "60",
            "description": "Le temps estim√© entre le moment o√π tu te couches et celui o√π tu t'endors. L'objectif est de le r√©duire drastiquement.",
            "targetValue": "20",
            "tracking_type": "counter"
          },
          "grimoireTitle": "Le Protocole Nyx : L'Architecture du Repos Rapide",
          "context_problem": "Actuellement, tes journ√©es irr√©guli√®res et la fatigue te poussent √† une surconsommation digitale, surtout le soir. Cela cr√©e un cercle vicieux de difficult√©s d'endormissement et de r√©veils nocturnes, te privant de l'√©nergie et de la stabilit√© que tu recherches. Tu te sens souvent d√©bord√© et procrastines les actions qui pourraient t'aider, mais ta motivation est l√† pour un changement rapide.",
          "sophiaKnowledge": "Tu es un jeune homme de 28 ans dont la motivation profonde est de retrouver de l'√©nergie et de la stabilit√©. Tu te sens souvent d√©bord√© par tes journ√©es irr√©guli√®res, ce qui te pousse √† oublier ou √† reporter des actions essentielles. Pour compenser la fatigue, tu te r√©fugies dans ton t√©l√©phone, exacerbant tes difficult√©s d'endormissement et tes r√©veils nocturnes, malgr√© un niveau de stress per√ßu comme 'faible' dans le questionnaire (ce que nous allons r√©√©valuer par l'action). Ton rythme 'fast' indique une forte d√©termination √† obtenir des r√©sultats rapides.",
          "maintenanceCheck": {
            "type": "surveillance",
            "question": "Combien de soirs cette semaine as-tu d√©lib√©r√©ment mis ton t√©l√©phone hors de la chambre pour la nuit ?",
            "frequency": "hebdomadaire"
          },
          "estimatedDuration": "4 semaines"
        },
        "goal_id": "c919cfe4-7139-4111-a115-cfc2ed7ce83b",
        "deep_why": "Pour ne plus me sentir d√©bord√©, reprendre le contr√¥le de mon √©nergie, et √™tre plus stable et pr√©sent au quotidien.",
        "created_at": "2026-01-09T21:08:51.284805+00:00",
        "inputs_why": null,
        "current_phase": 1,
        "submission_id": "646dc2de-278d-4cb8-9c6a-aa8eae0a8dfb",
        "inputs_context": null,
        "inputs_blockers": null,
        "progress_percentage": 0
      },
      "actions": [
        {
          "id": "d2434f66-f674-4d45-9d7a-808b8cc01fae",
          "title": "Le Grand Exil des √âcrans",
          "status": "active",
          "created_at": "2026-01-09T21:08:51.312011+00:00",
          "description": "Exclure d√©finitivement tous les √©crans (t√©l√©phone, tablette, ordinateur) de ta chambre. Ils chargeront et resteront dans une autre pi√®ce toute la nuit.",
          "target_reps": 1,
          "time_of_day": "any_time",
          "current_reps": 0,
          "tracking_type": "boolean",
          "last_performed_at": "2026-01-07T21:08:51.299+00:00"
        },
        {
          "id": "de62c96e-2b2f-4ea7-80df-817b9d8688b6",
          "title": "Le Couvre-feu Connect√© 60'",
          "status": "active",
          "created_at": "2026-01-09T21:08:51.312011+00:00",
          "description": "√âteindre ou mettre en mode avion tous les appareils num√©riques (t√©l√©phone, tablette, PC) au moins 60 minutes avant l'heure de coucher vis√©e. L'objectif est 22h30.",
          "target_reps": 7,
          "time_of_day": "night",
          "current_reps": 0,
          "tracking_type": "boolean",
          "last_performed_at": "2026-01-07T21:08:51.299+00:00"
        }
      ],
      "frameworks": [],
      "dashboard_context": "=== PLAN ACTUEL (Tableau de Bord) ===\nTitre: Le Protocole Nyx : L'Architecture du Repos Rapide\nStatut: active\nPhase courante (dashboard): 1\nPourquoi (Deep Why): Pour ne plus me sentir d√©bord√©, reprendre le contr√¥le de mon √©nergie, et √™tre plus stable et pr√©sent au quotidien.\nD√âTAIL COMPLET DU PLAN (Structure JSON) :\n{\n  \"phases\": [\n    {\n      \"id\": 1,\n      \"title\": \"Phase 1 : Le Sanctuaire du Repos - L'Exorcisme Digital\",\n      \"status\": \"active\",\n      \"actions\": [\n        {\n          \"id\": \"d2434f66-f674-4d45-9d7a-808b8cc01fae\",\n          \"tips\": \"Ach√®te un r√©veil analogique et une liseuse si tu lis avant de dormir. C'est non-n√©gociable.\",\n          \"type\": \"mission\",\n          \"title\": \"Le Grand Exil des √âcrans\",\n          \"status\": \"active\",\n          \"questType\": \"main\",\n          \"rationale\": \"Couper le lien physique avec les √©crans est la premi√®re √©tape pour r√©associer ta chambre au sommeil et non √† la stimulation.\",\n          \"description\": \"Exclure d√©finitivement tous les √©crans (t√©l√©phone, tablette, ordinateur) de ta chambre. Ils chargeront et resteront dans une autre pi√®ce toute la nuit.\",\n          \"isCompleted\": false,\n          \"time_of_day\": \"any_time\",\n          \"tracking_type\": \"boolean\"\n        },\n        {\n          \"id\": \"de62c96e-2b2f-4ea7-80df-817b9d8688b6\",\n          \"tips\": \"D√©finis une alarme sur un appareil non-connect√© pour te rappeler l'heure du couvre-feu.\",\n          \"type\": \"habitude\",\n          \"title\": \"Le Couvre-feu Connect√© 60'\",\n          \"status\": \"active\",\n          \"questType\": \"side\",\n          \"rationale\": \"Donner √† ton cerveau le temps de ralentir et de r√©duire l'exposition √† la lumi√®re bleue qui perturbe la production de m√©latonine.\",\n          \"targetReps\": 7,\n          \"description\": \"√âteindre ou mettre en mode avion tous les appareils num√©riques (t√©l√©phone, tablette, PC) au moins 60 minutes avant l'heure de coucher vis√©e. L'objectif est 22h30.\",\n          \"isCompleted\": false,\n          \"time_of_day\": \"night\",\n          \"tracking_type\": \"boolean\"\n        },\n        {\n          \"id\": \"6a8af0de-c77f-4f96-bdf1-f79656b8965c\",\n          \"tips\": \"M√™me un l√©ger filet de lumi√®re peut perturber ton sommeil. Sois impitoyable.\",\n          \"type\": \"mission\",\n          \"title\": \"Fortifier le Cocon Sonore\",\n          \"status\": \"pending\",\n          \"questType\": \"side\",\n          \"rationale\": \"Cr√©er un environnement optimal r√©duit les r√©veils nocturnes et favorise un sommeil plus profond et continu.\",\n          \"description\": \"Identifier et att√©nuer les sources de bruit et de lumi√®re perturbatrices dans ta chambre (boules Qui√®s, masque de sommeil, rideaux occultants).\",\n          \"isCompleted\": false,\n          \"time_of_day\": \"any_time\",\n          \"tracking_type\": \"boolean\"\n        }\n      ],\n      \"subtitle\": \"Semaine 1 ‚Ä¢ Briser le cycle de la compensation\",\n      \"rationale\": \"Nous commen√ßons par un nettoyage radical de ton environnement nocturne. Ton cerveau associe trop souvent ta chambre au stress et √† la stimulation digitale. Il est temps de rompre cette association pour cr√©er un espace de paix imm√©diat.\"\n    },\n    {\n      \"id\": 2,\n      \"title\": \"Phase 2 : Le Silence Int√©rieur - D√©charge Mentale Active\",\n      \"status\": \"locked\",\n      \"actions\": [\n        {\n          \"id\": \"147a1627-8cfb-4bb0-a800-d949895ee7e6\",\n          \"tips\": \"La coh√©rence est cl√©. Choisis 2-3 activit√©s que tu appr√©cies vraiment pour ancrer ce rituel.\",\n          \"type\": \"habitude\",\n          \"title\": \"Le Rituel d'Ancrage Nocturne\",\n          \"status\": \"pending\",\n          \"questType\": \"main\",\n          \"rationale\": \"Cr√©e un signal clair pour ton cerveau que la journ√©e se termine et qu'il est temps de se pr√©parer au repos, favorisant l'endormissement.\",\n          \"targetReps\": 7,\n          \"description\": \"Mettre en place une routine simple de 15-20 minutes sans √©cran avant de dormir : lecture sur papier, √©coute de musique douce, √©tirements l√©gers ou m√©ditation de pleine conscience.\",\n          \"isCompleted\": false,\n          \"time_of_day\": \"night\",\n          \"tracking_type\": \"boolean\"\n        },\n        {\n          \"id\": \"87c89ff3-c9a0-4cde-8ac7-0d7a97da5c41\",\n          \"tips\": \"Ne cherche pas la perfection, juste le d√©versement. C'est ton espace de d√©charge, pas de jugement.\",\n          \"type\": \"framework\",\n          \"title\": \"Cartographie des Pr√©occupations (Journaling Nocturne)\",\n          \"status\": \"pending\",\n          \"questType\": \"side\",\n          \"rationale\": \"R√©duit l'activit√© cognitive et le niveau de cortisol avant le sommeil, aidant √† surmonter les difficult√©s d'endormissement li√©es aux pens√©es parasites.\",\n          \"targetReps\": 7,\n          \"description\": \"Chaque soir, 30 minutes avant l'heure de coucher, √©cris pendant 5-10 minutes tout ce qui te pr√©occupe, te stresse, ou les t√¢ches du lendemain. Transf√®re ces pens√©es de ta t√™te au papier.\",\n          \"isCompleted\": false,\n          \"time_of_day\": \"night\",\n          \"tracking_type\": \"counter\",\n          \"frameworkDetails\": {\n            \"type\": \"recurring\",\n            \"intro\": \"L'objectif est de lib√©rer ton esprit. Note absolument tout : une conversation, une liste de courses, une id√©e brillante, une inqui√©tude. N'importe quoi qui occupe ton espace mental.\",\n            \"sections\": [\n              {\n                \"id\": \"s1_p2\",\n                \"label\": \"Les pens√©es qui tournent en boucle (ce qui m'inqui√®te, me stimule, mes to-dos)\",\n                \"inputType\": \"textarea\",\n                \"placeholder\": \"Je dois appeler X demain... J'ai oubli√© Y... Cette id√©e m'obs√®de...\"\n              },\n              {\n                \"id\": \"s2_p2\",\n                \"label\": \"Mon niveau d'apaisement apr√®s avoir √©crit (1-10)\",\n                \"inputType\": \"scale\",\n                \"placeholder\": \"7\"\n              }\n            ]\n          }\n        }\n      ],\n      \"subtitle\": \"Semaine 2 ‚Ä¢ Apaiser l'esprit agit√©\",\n      \"rationale\": \"Maintenant que ton environnement est optimis√©, nous nous attaquons √† la cause interne de tes difficult√©s d'endormissement : l'esprit qui tourne en boucle. Nous allons mettre en place des pratiques pour vider ton 'cache' mental.\"\n    },\n    {\n      \"id\": 3,\n      \"title\": \"Phase 3 : Le R√©√©quilibrage √ânerg√©tique - Ancrer la Stabilit√©\",\n      \"status\": \"locked\",\n      \"actions\": [\n        {\n          \"id\": \"bf83a6ac-2f9d-4d71-8f0e-bb810e7aa399\",\n          \"tips\": \"Utilise la fonction 'Smart Alarm' si ton r√©veil le permet pour une transition douce. La lumi√®re est le signal le plus puissant pour ton horloge biologique.\",\n          \"type\": \"habitude\",\n          \"title\": \"Le Lever Lumineux et Fixe\",\n          \"status\": \"pending\",\n          \"questType\": \"main\",\n          \"rationale\": \"Stabiliser ton heure de lever est le levier le plus puissant pour r√©guler ton rythme circadien, ce qui facilite l'endormissement le soir et am√©liore la continuit√© du sommeil.\",\n          \"targetReps\": 7,\n          \"description\": \"Te lever √† la m√™me heure chaque jour (m√™me les weekends) et t'exposer √† la lumi√®re naturelle dans les 30 minutes suivant le r√©veil (fen√™tre, balcon, marche courte).\",\n          \"isCompleted\": false,\n          \"time_of_day\": \"morning\",\n          \"tracking_type\": \"boolean\"\n        },\n        {\n          \"id\": \"81a6bd56-9796-495e-9cbc-6241155d3f3e\",\n          \"tips\": \"Lis attentivement les √©tiquettes, la caf√©ine peut se cacher dans des produits inattendus. Sois vigilant et pers√©v√©rant.\",\n          \"type\": \"habitude\",\n          \"title\": \"Fen√™tre Caf√©ine Z√©ro\",\n          \"status\": \"pending\",\n          \"questType\": \"side\",\n          \"rationale\": \"La caf√©ine a une demi-vie longue et peut perturber l'endormissement et la profondeur du sommeil m√™me plusieurs heures apr√®s sa consommation.\",\n          \"targetReps\": 7,\n          \"description\": \"Arr√™ter toute consommation de caf√©ine (caf√©, th√© noir, boissons √©nergisantes) apr√®s 14h00. Remplace par de l'eau ou des infusions sans th√©ine.\",\n          \"isCompleted\": false,\n          \"time_of_day\": \"afternoon\",\n          \"tracking_type\": \"boolean\"\n        },\n        {\n          \"id\": \"27208d72-b0eb-4845-bead-d763a9f663bb\",\n          \"tips\": \"Tu n'as pas besoin d'√™tre inform√© en temps r√©el de chaque 'like' ou 'news'. Reprends le contr√¥le de ton attention.\",\n          \"type\": \"mission\",\n          \"title\": \"Audit et Nettoyage des Notifications\",\n          \"status\": \"pending\",\n          \"questType\": \"side\",\n          \"rationale\": \"R√©duit la surcharge cognitive, le sentiment d'√™tre 'd√©bord√©' et la tentation de consulter ton t√©l√©phone, lib√©rant de l'√©nergie mentale pour des t√¢ches plus importantes et un meilleur repos.\",\n          \"description\": \"Passe en revue toutes les applications de ton t√©l√©phone et d√©sactive TOUTES les notifications non-essentielles (r√©seaux sociaux, jeux, actualit√©s). Ne garde que celles pour les appels et SMS urgents.\",\n          \"isCompleted\": false,\n          \"time_of_day\": \"any_time\",\n          \"tracking_type\": \"boolean\"\n        }\n      ],\n      \"subtitle\": \"Semaine 3 ‚Ä¢ Harmoniser tes rythmes\",\n      \"rationale\": \"Tes journ√©es irr√©guli√®res sont un blocage majeur. Cette phase vise √† instaurer une nouvelle stabilit√© physiologique en r√©glant ton horloge interne, ce qui aura un impact direct sur la qualit√© de ton endormissement et r√©duira les r√©veils nocturnes.\"\n    },\n    {\n      \"id\": 4,\n      \"title\": \"Phase 4 : L'√ânergie Architectur√©e - Consolidation et Ma√Ætrise\",\n      \"status\": \"locked\",\n      \"actions\": [\n        {\n          \"id\": \"4aeb81dd-eb95-41b9-a729-797426b2da23\",\n          \"tips\": \"Utilise un minuteur. Trouve un endroit calme, m√™me si ce sont les toilettes ou un couloir. Ferme les yeux et respire profond√©ment.\",\n          \"type\": \"habitude\",\n          \"title\": \"La Pause Mentale Strat√©gique\",\n          \"status\": \"pending\",\n          \"questType\": \"main\",\n          \"rationale\": \"Ces pauses r√©guli√®res r√©duisent l'accumulation du stress et de la fatigue cognitive tout au long de la journ√©e, diminuant ainsi l'envie de compenser par le t√©l√©phone le soir et favorisant un endormissement plus rapide.\",\n          \"targetReps\": 7,\n          \"description\": \"Int√©grer une micro-pause de 5-10 minutes de silence mental ou de respiration consciente au milieu de ta journ√©e. Pas besoin de m√©ditation formelle, juste un arr√™t de la stimulation.\",\n          \"isCompleted\": false,\n          \"time_of_day\": \"afternoon\",\n          \"tracking_type\": \"boolean\"\n        },\n        {\n          \"id\": \"38362ecb-9d53-483f-828f-86ae1e77a72c\",\n          \"tips\": \"Commence petit. 'Je ferai une marche de 15 min chaque matin' est plus puissant que 'Je vais courir tous les jours'.\",\n          \"type\": \"framework\",\n          \"title\": \"Planification de la Prochaine Semaine √ânerg√©tique\",\n          \"status\": \"pending\",\n          \"questType\": \"side\",\n          \"rationale\": \"Contre tes blocages de 'd√©bord√©' et 'oublie', la planification proactive est essentielle pour ancrer durablement ces nouvelles habitudes et maintenir ta stabilit√© √©nerg√©tique.\",\n          \"targetReps\": 1,\n          \"description\": \"Planifier sp√©cifiquement une √† trois actions concr√®tes pour la semaine √† venir qui soutiennent ton √©nergie et ton sommeil, en tenant compte de tes journ√©es irr√©guli√®res. Cela peut √™tre une micro-habitude ou une mission.\",\n          \"isCompleted\": false,\n          \"time_of_day\": \"any_time\",\n          \"tracking_type\": \"counter\",\n          \"frameworkDetails\": {\n            \"type\": \"one_shot\",\n            \"intro\": \"Tu as construit une nouvelle fondation. Maintenant, il s'agit de projeter cette architecture dans ton futur. Quelles sont les prochaines briques pour solidifier ton √©nergie et ton repos ? Sois r√©aliste et intentionnel.\",\n            \"sections\": [\n              {\n                \"id\": \"s1_p4\",\n                \"label\": \"Une action concr√®te pour soutenir mon sommeil cette semaine\",\n                \"inputType\": \"textarea\",\n                \"placeholder\": \"Ex: Me coucher 15 min plus t√¥t 3 soirs cette semaine.\"\n              },\n              {\n                \"id\": \"s2_p4\",\n                \"label\": \"Une action concr√®te pour g√©rer mes journ√©es irr√©guli√®res (√©nergie)\",\n                \"inputType\": \"textarea\",\n                \"placeholder\": \"Ex: Pr√©parer mon petit-d√©jeuner la veille pour gagner du temps.\"\n              },\n              {\n                \"id\": \"s3_p4\",\n                \"label\": \"Une nouvelle habitude √† introduire ou une existante √† renforcer\",\n                \"inputType\": \"textarea\",\n                \"placeholder\": \"Ex: 5 minutes de stretching avant le lit, m√™me quand je suis press√©.\"\n              }\n            ]\n          }\n        }\n      ],\n      \"subtitle\": \"Semaine 4 ‚Ä¢ Devenir le ma√Ætre de ton rythme\",\n      \"rationale\": \"Cette derni√®re phase consolide les acquis et te donne les outils pour maintenir cette nouvelle architecture du sommeil. Tu as b√¢ti des fondations solides, il est temps de les rendre indestructibles face √† l'irr√©gularit√© de tes journ√©es.\"\n    }\n  ],\n  \"deepWhy\": \"Pour ne plus me sentir d√©bord√©, reprendre le contr√¥le de mon √©nergie, et √™tre plus stable et pr√©sent au quotidien.\",\n  \"identity\": \"Je suis un Architecte du Calme Nocturne, ma√Ætre de mon √©nergie et de mon attention.\",\n  \"strategy\": \"On attaque le c≈ìur du probl√®me : l'agitation mentale et l'impact du digital sur ton sommeil. Par une r√©ing√©nierie rapide de tes soir√©es, tu vas retrouver l'√©nergie d'√™tre stable et pr√©sent.\",\n  \"goldenRules\": \"1. Ma chambre est un sanctuaire sans √©cran.\\n2. L'intention pr√©c√®de l'action : chaque soir√©e est pr√©par√©e.\\n3. L'irr√©gularit√© est une excuse, la routine est ma force.\",\n  \"vitalSignal\": {\n    \"name\": \"Temps d'endormissement (estim√©)\",\n    \"type\": \"constat\",\n    \"unit\": \"min\",\n    \"startValue\": \"60\",\n    \"description\": \"Le temps estim√© entre le moment o√π tu te couches et celui o√π tu t'endors. L'objectif est de le r√©duire drastiquement.\",\n    \"targetValue\": \"20\",\n    \"tracking_type\": \"counter\"\n  },\n  \"grimoireTitle\": \"Le Protocole Nyx : L'Architecture du Repos Rapide\",\n  \"context_problem\": \"Actuellement, tes journ√©es irr√©guli√®res et la fatigue te poussent √† une surconsommation digitale, surtout le soir. Cela cr√©e un cercle vicieux de difficult√©s d'endormissement et de r√©veils nocturnes, te privant de l'√©nergie et de la stabilit√© que tu recherches. Tu te sens souvent d√©bord√© et procrastines les actions qui pourraient t'aider, mais ta motivation est l√† pour un changement rapide.\",\n  \"sophiaKnowledge\": \"Tu es un jeune homme de 28 ans dont la motivation profonde est de retrouver de l'√©nergie et de la stabilit√©. Tu te sens souvent d√©bord√© par tes journ√©es irr√©guli√®res, ce qui te pousse √† oublier ou √† reporter des actions essentielles. Pour compenser la fatigue, tu te r√©fugies dans ton t√©l√©phone, exacerbant tes difficult√©s d'endormissement et tes r√©veils nocturnes, malgr√© un niveau de stress per√ßu comme 'faible' dans le questionnaire (ce que nous allons r√©√©valuer par l'action). Ton rythme 'fast' indique une forte d√©termination √† obtenir des r√©sultats rapides.\",\n  \"maintenanceCheck\": {\n    \"type\": \"surveillance\",\n    \"question\": \"Combien de soirs cette semaine as-tu d√©lib√©r√©ment mis ton t√©l√©phone hors de la chambre pour la nuit ?\",\n    \"frequency\": \"hebdomadaire\"\n  },\n  \"estimatedDuration\": \"4 semaines\"\n}\n=== ACTIONS / FRAMEWORKS (√âTAT R√âEL DB) ===\nR√àGLES IMPORTANTES:\n- Les frameworks comptent comme des actions c√¥t√© utilisateur.\n- \"active\" = activ√©e et visible comme active dans l'app. \"pending\" = pas active.\n- On n'active/d√©sactive pas via WhatsApp: la seule mani√®re d'activer/d√©sactiver, c'est depuis le dashboard.\n\nActives (2):\n- [ACTION] Le Grand Exil des √âcrans (any_time)\n- [ACTION] Le Couvre-feu Connect√© 60' (night)\n\n=== SIGNES VITAUX (√âtat Actuel) ===\n- Temps d'endormissement (estim√©): 60 min\n",
      "template_fingerprint": null
    },
    "scenario_target": "conversation"
  },
  "error": null
}