{
  "id": "42c73c4b-0fbd-4600-82ba-44570b2172e4",
  "created_at": "2026-01-08T22:38:19.929985+00:00",
  "status": "completed",
  "dataset_key": "core",
  "scenario_key": "bilan_real_bundle__92eed855463140",
  "transcript": [
    {
      "role": "user",
      "content": "Oui",
      "agent_used": null,
      "created_at": "2026-01-08T22:38:19.94299+00:00"
    },
    {
      "role": "assistant",
      "content": "C'est parti. On commence par ton activit√© physique : combien de minutes de mouvement conscient hors travail as-tu fait hier ? üèÉ",
      "agent_used": "investigator",
      "created_at": "2026-01-08T22:38:26.13922+00:00"
    },
    {
      "role": "user",
      "content": "Hier, j'ai fait environ 15 minutes, je crois. J'ai essay√© de bouger un peu plus que d'habitude.",
      "agent_used": null,
      "created_at": "2026-01-08T22:38:29.656868+00:00"
    },
    {
      "role": "assistant",
      "content": "C'est super d'avoir cherch√© √† bouger un peu plus. Pour ce qui est de tes heures de bureau hier, est-ce que tu as r√©ussi √† faire tes micro-pauses actives ? üèÉ",
      "agent_used": "investigator",
      "created_at": "2026-01-08T22:38:43.470042+00:00"
    },
    {
      "role": "user",
      "content": "Pas vraiment toutes les heures. J'ai fait quelques pauses, mais j'ai √©t√© un peu d√©bord√©e par le travail. On pourrait reparler de mon organisation plus tard si tu veux.",
      "agent_used": null,
      "created_at": "2026-01-08T22:38:46.940895+00:00"
    },
    {
      "role": "assistant",
      "content": "Je comprends tout √† fait, quand on est dans le jus, s'arr√™ter para√Æt presque contre-productif alors que c'est souvent l'inverse. On en reparlera pour ton organisation juste apr√®s le bilan, c'est promis. \n\nEst-ce que tu as senti que ces quelques pauses t'ont quand m√™me fait un peu de bien, m√™me si elles √©taient rares ? üåø",
      "agent_used": "investigator",
      "created_at": "2026-01-08T22:39:01.361479+00:00"
    },
    {
      "role": "user",
      "content": "Oui, m√™me si c'√©tait rapide, √ßa m'a fait du bien de me lever un peu. √áa m'a aid√© √† me sentir moins raide.",
      "agent_used": null,
      "created_at": "2026-01-08T22:39:03.922869+00:00"
    },
    {
      "role": "assistant",
      "content": "C'est d√©j√† un bon point si √ßa a r√©duit ta raideur sur le moment. Pour ce qui est de ton rituel matinal d'√©tirement, tu as r√©ussi √† prendre ces quelques minutes hier matin ?",
      "agent_used": "investigator",
      "created_at": "2026-01-08T22:39:16.765406+00:00"
    },
    {
      "role": "user",
      "content": "Pas vraiment, j'ai eu du mal √† me lever plus t√¥t. J'ai juste fait quelques √©tirements rapides au lit.",
      "agent_used": null,
      "created_at": "2026-01-08T22:39:22.395857+00:00"
    },
    {
      "role": "assistant",
      "content": "C'est d√©j√† un bon r√©flexe d'avoir fait ces √©tirements sans sortir de sous la couette. Concernant ton scan corporel des tensions, est-ce que tu as pris un moment pour le faire hier ?",
      "agent_used": "investigator",
      "created_at": "2026-01-08T22:39:35.224608+00:00"
    },
    {
      "role": "user",
      "content": "J'ai essay√© de le faire, mais je me suis endormie avant de vraiment finir. J'ai juste pens√© √† mes √©paules rapidement.",
      "agent_used": null,
      "created_at": "2026-01-08T22:39:38.413698+00:00"
    },
    {
      "role": "assistant",
      "content": "Ok, on a fini le bilan.\n\nTu m'avais dit qu'on reparlerait de : \"mon organisation\".\nTu veux qu'on commence par √ßa ?",
      "agent_used": "investigator",
      "created_at": "2026-01-08T22:40:02.834625+00:00"
    },
    {
      "role": "user",
      "content": "Oui, on peut en parler. Je me sens souvent d√©bord√©e.",
      "agent_used": null,
      "created_at": "2026-01-08T22:40:07.147226+00:00"
    },
    {
      "role": "assistant",
      "content": "Je comprends que tu te sentes d√©bord√©e. C'est un sujet important, celui de ton organisation. Dis-moi, qu'est-ce qui te p√®se le plus ?",
      "agent_used": "companion",
      "created_at": "2026-01-08T22:41:02.448332+00:00"
    }
  ],
  "state_before": {
    "scope": "web",
    "user_id": "e2121ef5-0a0d-4e63-b9cf-41aaa4eb68a4",
    "risk_level": 0,
    "updated_at": "2026-01-08T22:38:19.793736+00:00",
    "current_mode": "investigator",
    "last_processed_at": "2026-01-08T22:38:19.793736+00:00",
    "short_term_context": null,
    "investigation_state": {
      "status": "checking",
      "temp_memory": {
        "opening_done": false
      },
      "pending_items": [
        {
          "id": "5e18b90f-82e2-4c36-b595-ab281d0847f5",
          "type": "vital",
          "unit": "min",
          "title": "Minutes de mouvement conscient hors travail",
          "tracking_type": "counter"
        },
        {
          "id": "74055c73-b490-4f92-8066-ee6939a8a2ed",
          "type": "action",
          "title": "Micro-pauses actives",
          "target": 7,
          "description": "Toutes les heures de travail sur √©cran, l√®ve-toi, √©tire-toi l√©g√®rement, marche 1 minute ou fais quelques flexions/rotations douces. Mets un rappel si besoin.",
          "tracking_type": "boolean"
        },
        {
          "id": "a796b89e-d247-4818-80e1-15595bf77c5d",
          "type": "action",
          "title": "Rituel matinal d'√©tirement",
          "target": 7,
          "description": "Chaque matin, avant de commencer ta journ√©e, effectue une courte routine d'√©tirements doux (5-10 minutes) pour r√©veiller ton corps. Concentre-toi sur les zones identifi√©es comme raides.",
          "tracking_type": "boolean"
        },
        {
          "id": "a6b5cfe0-9826-4e59-9dac-adf43d0e5d5d",
          "type": "framework",
          "title": "Scan corporel des tensions",
          "tracking_type": "boolean"
        }
      ],
      "current_item_index": 0
    },
    "last_interaction_at": "2026-01-08T22:38:19.793736+00:00",
    "unprocessed_msg_count": 0
  },
  "state_after": {
    "scope": "web",
    "user_id": "e2121ef5-0a0d-4e63-b9cf-41aaa4eb68a4",
    "risk_level": 0,
    "updated_at": "2026-01-08T22:41:02.40864+00:00",
    "current_mode": "companion",
    "last_processed_at": "2026-01-08T22:38:19.793736+00:00",
    "short_term_context": null,
    "investigation_state": {
      "status": "post_checkup_done",
      "temp_memory": {
        "finished_at": "2026-01-08T22:40:11.546Z",
        "deferred_topics": [
          "mon organisation"
        ],
        "current_topic_index": 1
      }
    },
    "last_interaction_at": "2026-01-08T22:38:19.793736+00:00",
    "unprocessed_msg_count": 7
  },
  "issues": [
    {
      "code": "conversational_flow",
      "message": "The investigator failed to acknowledge the user's specific answer to the final question (falling asleep during body scan) and closed the session abruptly without a transition.",
      "evidence": {
        "snippet": "USER: ...je me suis endormie avant de vraiment finir... ASSISTANT(investigator): Ok, on a fini le bilan.",
        "agent_used": "sophia.investigator"
      },
      "severity": "medium"
    }
  ],
  "suggestions": [
    {
      "action": "append",
      "rationale": "Prevents a robotic interaction where the last answer is ignored simply because the logic state switched to 'finished'.",
      "prompt_key": "sophia.investigator",
      "context_block": "=== CONTEXT (transcript excerpt) ===\n=== STATE_BEFORE (user_chat_states) ===\ncurrent_mode: investigator\nrisk_level: 0\ninvestigation_state:\n{\n  \"status\": \"checking\",\n  \"temp_memory\": {\n    \"opening_done\": false\n  },\n  \"pending_items\": [\n    {\n      \"id\": \"5e18b90f-82e2-4c36-b595-ab281d0847f5\",\n      \"type\": \"vital\",\n      \"unit\": \"min\",\n      \"title\": \"Minutes de mouvement conscient hors travail\",\n      \"tracking_type\": \"counter\"\n    },\n    {\n      \"id\": \"74055c73-b490-4f92-8066-ee6939a8a2ed\",\n      \"type\": \"action\",\n      \"title\": \"Micro-pauses actives\",\n      \"target\": 7,\n      \"description\": \"Toutes les heures de travail sur √©cran, l√®ve-toi, √©tire-toi l√©g√®rement, marche 1 minute ou fais quelques flexions/rotations douces. Mets un rappel si besoin.\",\n      \"tracking_type\": \"boolean\"\n    },\n    {\n      \"id\": \"a796b89e-d247-4818-80e1-15595bf77c5d\",\n      \"type\": \"action\",\n      \"title\": \"Rituel matinal d'√©tirement\",\n      \"target\": 7,\n      \"description\": \"Chaque matin, avant de commencer ta journ√©e, effectue une courte routine d'√©tirements doux (5-10 minutes) pour r√©veiller ton corps. Concentre-toi sur les zones identifi√©es comme raides.\",\n      \"tracking_type\": \"boolean\"\n    },\n    {\n      \"id\": \"a6b5cfe0-9826-4e59-9dac-adf43d0e5d5d\",\n      \"type\": \"framework\",\n      \"title\": \"Scan corporel des tensions\",\n      \"tracking_type\": \"boolean\"\n    }\n  ],\n  \"current_item_index\": 0\n}\n=== TRANSCRIPT ===\n#0 USER: Oui\n#1 ASSISTANT(investigator): C'est parti. On commence par ton activit√© physique : combien de minutes de mouvement conscient hors travail as-tu fait hier ? üèÉ\n#2 USER: Hier, j'ai fait environ 15 minutes, je crois. J'ai essay√© de bouger un peu plus que d'habitude.\n#3 ASSISTANT(investigator): C'est super d'avoir cherch√© √† bouger un peu plus. Pour ce qui est de tes heures de bureau hier, est-ce que tu as r√©ussi √† faire tes micro-pauses actives ? üèÉ\n\n=== APPLY ===\nprompt_key: sophia.investigator\naction: append\n\nproposed_addendum:\nCRITICAL: Even when reaching the end of the question list, you MUST acknowledge or validate the user's answer to the final question specifically before declaring the checkup finished.",
      "proposed_addendum": "CRITICAL: Even when reaching the end of the question list, you MUST acknowledge or validate the user's answer to the final question specifically before declaring the checkup finished."
    }
  ],
  "metrics": {
    "cost_usd": 0.0165816,
    "request_id": "bilan_eval_bundle:bilan_real_bundle__92eed855463140:core:bilan_real_bundle__92eed855463140",
    "total_tokens": 99054,
    "output_tokens": 1495,
    "prompt_tokens": 72401,
    "judge_llm_used": true,
    "mega_test_mode": false
  },
  "config": {
    "tags": [
      "sophia.investigator"
    ],
    "limits": {
      "model": "gemini-3-pro-preview",
      "user_difficulty": "mid",
      "bilan_actions_count": 3,
      "test_post_checkup_deferral": true
    },
    "channel": "web",
    "request_id": "bilan_eval_bundle:bilan_real_bundle__92eed855463140:core:bilan_real_bundle__92eed855463140",
    "description": "Bilan real (simulate-user) bundle run: capture full logs + full transcript.",
    "plan_snapshot": {
      "plan": {
        "id": "bd44e2e9-a3d3-4900-99f1-cc03cdb36be1",
        "title": "L'√âveil du Corps Ancr√©",
        "status": "active",
        "content": {
          "phases": [
            {
              "id": 1,
              "title": "Phase 1 : L'Ancrage Postural",
              "status": "active",
              "actions": [
                {
                  "id": "74055c73-b490-4f92-8066-ee6939a8a2ed",
                  "tips": "Utilise une application de timer ou ton calendrier pour des alertes r√©guli√®res. L'objectif n'est pas l'intensit√©, mais la r√©gularit√© et la rupture de la s√©dentarit√©.",
                  "type": "habitude",
                  "title": "Micro-pauses actives",
                  "status": "active",
                  "questType": "main",
                  "rationale": "Fragmenter les p√©riodes s√©dentaires aide √† pr√©venir les raideurs et √† am√©liorer la circulation, r√©duisant la fatigue mentale et physique.",
                  "targetReps": 7,
                  "description": "Toutes les heures de travail sur √©cran, l√®ve-toi, √©tire-toi l√©g√®rement, marche 1 minute ou fais quelques flexions/rotations douces. Mets un rappel si besoin.",
                  "isCompleted": false,
                  "time_of_day": "any_time",
                  "tracking_type": "boolean"
                },
                {
                  "id": "4fc5be9f-f26d-4a69-9edc-ccef1350f22f",
                  "tips": "Fais-le allong√©(e) dans ton lit. N'essaie pas de changer quoi que ce soit, juste d'observer sans jugement.",
                  "type": "framework",
                  "title": "Scan corporel des tensions",
                  "status": "active",
                  "questType": "side",
                  "rationale": "D√©velopper une conscience proprioceptive permet d'identifier les zones de stress avant qu'elles ne deviennent des douleurs chroniques et de mieux comprendre l'impact de ta journ√©e sur ton corps.",
                  "targetReps": 7,
                  "description": "Chaque soir, avant de te coucher, prends 5 minutes pour scanner ton corps de la t√™te aux pieds et identifier les zones de tension. Note ce que tu ressens.",
                  "isCompleted": false,
                  "time_of_day": "evening",
                  "tracking_type": "boolean",
                  "frameworkDetails": {
                    "type": "recurring",
                    "intro": "L'objectif est d'√©couter ton corps. Chaque soir, explore les sensations, les points de pression, les raideurs √©ventuelles. C'est une conversation intime avec toi-m√™me.",
                    "sections": [
                      {
                        "id": "p1s1",
                        "label": "O√π ressens-tu des tensions ou des sensations inhabituelles ?",
                        "inputType": "list",
                        "placeholder": "Nuque, √©paules lourdes, bas du dos tendu..."
                      },
                      {
                        "id": "p1s2",
                        "label": "Niveau de tension global ressenti (1-10)",
                        "inputType": "scale",
                        "placeholder": "5"
                      }
                    ]
                  }
                }
              ],
              "subtitle": "Semaines 1-2 ‚Ä¢ Reconnecter avec la sensation",
              "rationale": "Nous commen√ßons par la conscience de ton corps et des micro-corrections pour briser la s√©dentarit√© subtile et pr√©parer le terrain √† plus de mouvement."
            },
            {
              "id": 2,
              "title": "Phase 2 : L'√âveil Doux",
              "status": "locked",
              "actions": [
                {
                  "id": "a796b89e-d247-4818-80e1-15595bf77c5d",
                  "tips": "Cherche des routines d'√©tirement doux en ligne (yoga doux, √©tirements pour le dos/les √©paules) ou fais simplement ce qui te fait du bien. La r√©gularit√© prime sur l'intensit√©.",
                  "type": "habitude",
                  "title": "Rituel matinal d'√©tirement",
                  "status": "active",
                  "questType": "main",
                  "rationale": "Le matin est le moment id√©al pour d√©faire les raideurs nocturnes et pr√©parer tes articulations et muscles √† la journ√©e, am√©liorant ta flexibilit√© et r√©duisant les douleurs.",
                  "targetReps": 7,
                  "description": "Chaque matin, avant de commencer ta journ√©e, effectue une courte routine d'√©tirements doux (5-10 minutes) pour r√©veiller ton corps. Concentre-toi sur les zones identifi√©es comme raides.",
                  "isCompleted": false,
                  "time_of_day": "morning",
                  "tracking_type": "boolean"
                },
                {
                  "id": "67841c73-566f-487d-8ab8-76aa3acec2b1",
                  "tips": "Cet espace n'a pas besoin d'√™tre grand, juste suffisant pour t'√©tirer ou faire quelques mouvements sans te sentir √† l'√©troit.",
                  "type": "mission",
                  "title": "Am√©nager l'espace de mouvement",
                  "status": "pending",
                  "questType": "side",
                  "rationale": "Cr√©er un espace d√©di√© r√©duit les frictions et les excuses, facilitant l'int√©gration des nouvelles habitudes de mouvement dans ton environnement quotidien.",
                  "description": "D√©sencombre un petit espace chez toi o√π tu pourras te sentir libre de bouger. Si possible, pr√©vois un tapis de sol confortable ou une couverture.",
                  "isCompleted": false,
                  "time_of_day": "any_time",
                  "tracking_type": "boolean"
                }
              ],
              "subtitle": "Semaines 3-4 ‚Ä¢ Fluidit√© et Pr√©paration",
              "rationale": "Nous allons int√©grer la fluidit√© et des √©tirements doux pour adresser sp√©cifiquement les raideurs et pr√©parer ton corps √† plus de mouvement sans contrainte."
            },
            {
              "id": 3,
              "title": "Phase 3 : La Respiration Vivante",
              "status": "locked",
              "actions": [
                {
                  "id": "b7357c57-2f7d-4a5c-80d9-4d7fa7984834",
                  "tips": "Tu peux le faire assis(e) ou allong√©(e), avec une main sur ton ventre pour sentir le mouvement. Commence par 2-3 minutes si 5 te semblent trop longues.",
                  "type": "habitude",
                  "title": "5 minutes de respiration diaphragmatique",
                  "status": "pending",
                  "questType": "main",
                  "rationale": "La respiration diaphragmatique active le syst√®me nerveux parasympathique, r√©duisant le stress, am√©liorant la qualit√© du sommeil et favorisant la d√©tente musculaire.",
                  "targetReps": 7,
                  "description": "Chaque jour, prends 5 minutes pour pratiquer la respiration abdominale profonde. Concentre-toi sur le mouvement de ton ventre √† l'inspiration et √† l'expiration.",
                  "isCompleted": false,
                  "time_of_day": "evening",
                  "tracking_type": "boolean"
                },
                {
                  "id": "1208657b-de9a-4604-9dcd-17189d61fc18",
                  "tips": "Ne juge pas, observe juste. Y a-t-il des patterns ? Comment ton travail sur √©cran ou ton alimentation influencent-ils ton √©nergie ?",
                  "type": "framework",
                  "title": "Mon agenda de l'√©nergie",
                  "status": "pending",
                  "questType": "side",
                  "rationale": "Comprendre tes rythmes √©nerg√©tiques te permettra de placer les activit√©s qui n√©cessitent de l'√©nergie pendant tes pics, et les activit√©s douces ou de r√©cup√©ration pendant tes baisses, optimisant ta vitalit√©.",
                  "targetReps": 1,
                  "description": "Sur une semaine, observe et note tes pics et baisses d'√©nergie, ainsi que les activit√©s qui les influencent. R√©fl√©chis √† comment adapter tes journ√©es.",
                  "isCompleted": false,
                  "time_of_day": "any_time",
                  "tracking_type": "boolean",
                  "frameworkDetails": {
                    "type": "one_shot",
                    "intro": "Pour optimiser ton √©nergie, tu dois d'abord comprendre son flux naturel. Observe une semaine compl√®te tes hauts et tes bas. C'est une cartographie pr√©cieuse de ton corps.",
                    "sections": [
                      {
                        "id": "p3s1",
                        "label": "Mes moments de pic d'√©nergie dans la journ√©e",
                        "inputType": "list",
                        "placeholder": "Matin apr√®s caf√©, fin d'apr√®s-midi avant d√Æner"
                      },
                      {
                        "id": "p3s2",
                        "label": "Mes moments de baisse d'√©nergie ou de fatigue",
                        "inputType": "list",
                        "placeholder": "Post-repas de midi, milieu de matin√©e"
                      },
                      {
                        "id": "p3s3",
                        "label": "Comment puis-je adapter mes activit√©s (travail, mouvement, repos) √† ces cycles ?",
                        "inputType": "textarea",
                        "placeholder": "Mouvements doux pendant les baisses, activit√©s plus intenses pendant les pics..."
                      }
                    ]
                  }
                }
              ],
              "subtitle": "Semaines 5-6 ‚Ä¢ Oxyg√©nation et Calme",
              "rationale": "Nous allons connecter le mouvement √† la respiration pour r√©duire le stress, am√©liorer l'oxyg√©nation de tes tissus et cultiver un sentiment de calme qui soutiendra ta vitalit√©."
            },
            {
              "id": 4,
              "title": "Phase 4 : Le Pas Conscient",
              "status": "locked",
              "actions": [
                {
                  "id": "ef7aae66-1ab1-4ce7-98ae-5de4db6208e6",
                  "tips": "Laisse ton t√©l√©phone √† la maison ou en mode avion. C'est un moment pour toi, une pause mentale et physique. Choisis un moment o√π tu peux √™tre tranquille.",
                  "type": "habitude",
                  "title": "Marche consciente de 15 min",
                  "status": "pending",
                  "questType": "main",
                  "rationale": "La marche est l'un des mouvements les plus naturels et b√©n√©fiques. Pratiqu√©e en pleine conscience, elle r√©duit le stress, am√©liore l'humeur et renforce le corps sans effort excessif.",
                  "targetReps": 7,
                  "description": "Int√®gre une marche consciente de 15 minutes chaque jour. Concentre-toi sur tes sensations, le contact de tes pieds avec le sol, ta respiration et les √©l√©ments autour de toi.",
                  "isCompleted": false,
                  "time_of_day": "afternoon",
                  "tracking_type": "boolean"
                },
                {
                  "id": "8a9538bf-603e-441f-aacc-63139023ffaa",
                  "tips": "Prends 10-15 minutes pour explorer les environs ou utiliser une carte pour trouver des lieux 'verts' ou calmes.",
                  "type": "mission",
                  "title": "Identifier un parcours inspirant",
                  "status": "pending",
                  "questType": "side",
                  "rationale": "Avoir un parcours d√©fini et appr√©ci√© augmente la probabilit√© de maintenir l'habitude. Un environnement agr√©able enrichit l'exp√©rience de la marche consciente.",
                  "description": "Rep√®re un ou deux endroits agr√©ables pr√®s de chez toi ou de ton travail o√π tu pourrais faire ta marche quotidienne. Cherche un lieu o√π tu te sens bien (parc, rue calme, bord de rivi√®re).",
                  "isCompleted": false,
                  "time_of_day": "any_time",
                  "tracking_type": "boolean"
                }
              ],
              "subtitle": "Semaines 7-8 ‚Ä¢ Mettre le corps en marche",
              "rationale": "Nous allons augmenter l'activit√© physique avec une intention de pleine conscience, transformant la marche en une m√©ditation en mouvement pour nourrir ton corps et ton esprit."
            },
            {
              "id": 5,
              "title": "Phase 5 : La R√©cup√©ration Profonde",
              "status": "locked",
              "actions": [
                {
                  "id": "d3787cbd-3517-48f7-9c3d-5a7ca59f2d0d",
                  "tips": "Choisis 2-3 activit√©s apaisantes et respecte-les chaque soir. L'obscurit√© et le calme sont tes meilleurs alli√©s.",
                  "type": "habitude",
                  "title": "Rituel de d√©tente pr√©-sommeil",
                  "status": "pending",
                  "questType": "main",
                  "rationale": "Un rituel pr√©-sommeil signale √† ton cerveau qu'il est temps de ralentir, favorisant un endormissement plus facile et un sommeil plus profond et r√©parateur, essentiel pour la r√©cup√©ration physique.",
                  "targetReps": 7,
                  "description": "Instaure un rituel de d√©tente d'au moins 30 minutes avant d'aller au lit : lecture, musique douce, bain chaud, exercices de respiration. √âvite les √©crans.",
                  "isCompleted": false,
                  "time_of_day": "night",
                  "tracking_type": "boolean"
                },
                {
                  "id": "fc5c5428-40fe-46ca-99ce-d4958eeab3cc",
                  "tips": "Sois honn√™te avec toi-m√™me. Le 'dors mal' que tu ressens peut venir de facteurs subtils. Ce n'est pas seulement la quantit√©, mais la qualit√©.",
                  "type": "framework",
                  "title": "Le bilan de mon sommeil",
                  "status": "pending",
                  "questType": "side",
                  "rationale": "Analyser et comprendre les facteurs qui influencent ton sommeil te donnera les cl√©s pour des ajustements cibl√©s et une am√©lioration durable de ta vitalit√©.",
                  "targetReps": 1,
                  "description": "Prends un moment pour r√©fl√©chir √† tes nuits. Comment te sens-tu au r√©veil ? Y a-t-il des √©l√©ments qui nuisent ou am√©liorent ton repos ?",
                  "isCompleted": false,
                  "time_of_day": "morning",
                  "tracking_type": "boolean",
                  "frameworkDetails": {
                    "type": "one_shot",
                    "intro": "Tu as dit 'je dors mal', et c'est un signal crucial. Ce bilan n'est pas l√† pour juger, mais pour √©clairer les patterns et les pistes d'am√©lioration. Tes nuits sont le laboratoire de ton √©nergie.",
                    "sections": [
                      {
                        "id": "p5s1",
                        "label": "Comment te sens-tu au r√©veil en g√©n√©ral (1-10, 10=tr√®s repos√© et plein d'√©nergie) ?",
                        "inputType": "scale",
                        "placeholder": "6"
                      },
                      {
                        "id": "p5s2",
                        "label": "Y a-t-il eu des interruptions de sommeil, des difficult√©s √† t'endormir, ou d'autres probl√®mes r√©currents ?",
                        "inputType": "textarea",
                        "placeholder": "Oui, r√©veil fr√©quent vers 3h / Non, sommeil continu mais l√©ger"
                      },
                      {
                        "id": "p5s3",
                        "label": "Quelles hypoth√®ses peux-tu faire sur les causes ou les am√©liorations possibles de ton sommeil ?",
                        "inputType": "textarea",
                        "placeholder": "Trop d'√©crans le soir / Repas trop lourd / Stress accumul√© / Manque de mouvement"
                      }
                    ]
                  }
                }
              ],
              "subtitle": "Semaines 9-10 ‚Ä¢ Optimiser le repos et le sommeil",
              "rationale": "Nous allons optimiser tes routines de sommeil et de r√©cup√©ration, car un repos de qualit√© est la cl√© de l'√©nergie renouvel√©e et d'une r√©duction durable des douleurs physiques."
            },
            {
              "id": 6,
              "title": "Phase 6 : L'Int√©gration Fluide",
              "status": "locked",
              "actions": [
                {
                  "id": "b0e3de49-ec8a-4e72-8b27-41ab4e7ec721",
                  "tips": "Tu es l'experte de ton corps. Construis cette routine avec ce qui te fait le plus de bien. Elle peut √©voluer !.",
                  "type": "habitude",
                  "title": "La routine anti-douleur personnalis√©e",
                  "status": "pending",
                  "questType": "main",
                  "rationale": "Avoir une routine personnalis√©e et flexible garantit que tu continues √† prendre soin de tes besoins sp√©cifiques, pr√©venant la r√©apparition des douleurs et maintenant ta mobilit√©.",
                  "targetReps": 7,
                  "description": "Cr√©e et pratique une routine quotidienne de 10-15 minutes combinant √©tirements cibl√©s, respiration et mouvements doux, bas√©e sur ce que tu as appris sur tes zones de raideur et tes pics d'√©nergie.",
                  "isCompleted": false,
                  "time_of_day": "any_time",
                  "tracking_type": "boolean"
                },
                {
                  "id": "71ef7e40-a0e6-42a4-9884-1e5b13bb854d",
                  "tips": "Sois r√©aliste et flexible. L'important est de maintenir une intention de mouvement r√©gulier. Pr√©vois des jours de repos.",
                  "type": "mission",
                  "title": "Planifier mon mois de mouvement",
                  "status": "pending",
                  "questType": "side",
                  "rationale": "La planification proactive est une strat√©gie puissante pour √©viter la procrastination et assurer la p√©rennit√© de tes nouvelles habitudes de mouvement et de vitalit√©.",
                  "description": "Sur un calendrier, planifie tes activit√©s de mouvement pour le mois √† venir : tes marches, tes routines d'√©tirement, et pourquoi pas une nouvelle activit√© qui t'attire.",
                  "isCompleted": false,
                  "time_of_day": "any_time",
                  "tracking_type": "boolean"
                }
              ],
              "subtitle": "Semaines 11-12 ‚Ä¢ Faire du mouvement une seconde nature",
              "rationale": "Nous allons consolider tous les acquis et faire du mouvement conscient une partie int√©grante et naturelle de ton identit√©, ancrant ces nouvelles habitudes pour une vitalit√© durable."
            }
          ],
          "deepWhy": "Pour cultiver une √©nergie douce et stable, √™tre pr√©sente pour moi-m√™me et mon corps chaque jour, et vivre sans la contrainte des raideurs.",
          "identity": "Je suis le Corps en Mouvement Libre.",
          "strategy": "Nous allons restaurer ta relation avec ton corps par des micro-mouvements conscients et des ancrages doux, d√©bloquant l'√©nergie et la fluidit√© pas √† pas. L'objectif est de dissoudre la s√©dentarit√© et les raideurs en int√©grant la conscience corporelle dans ton quotidien tr√©pidant.",
          "goldenRules": "1. Chaque heure, un mouvement conscient est une victoire.\n2. Mon corps est mon alli√©, non un fardeau √† ignorer.\n3. La douceur est ma force, la constance ma victoire sur l'inertie.",
          "vitalSignal": {
            "name": "Minutes de mouvement conscient hors travail",
            "type": "constat",
            "unit": "min",
            "startValue": "0",
            "description": "Augmentation progressive du temps de mouvement intentionnel et doux, int√©gr√© dans ta journ√©e, au-del√† de ton temps de travail sur √©cran.",
            "targetValue": "30",
            "tracking_type": "counter"
          },
          "grimoireTitle": "L'√âveil du Corps Ancr√©",
          "context_problem": "√âpuis√©e par de longues heures devant l'√©cran et des nuits per√ßues comme peu r√©paratrices, tu te sentais pi√©g√©e dans la s√©dentarit√© et les douleurs. Ton d√©sir profond de retrouver √©nergie et stabilit√© √©tait constamment frein√© par le sentiment d'√™tre d√©bord√©e et la tendance √† remettre tes besoins physiques √† plus tard.",
          "sophiaKnowledge": "Tu es une femme de 35 ans (n√©e en 1988) qui travaille sur √©cran, ce qui entra√Æne une s√©dentarit√© et des douleurs. Bien que ton questionnaire indique une bonne qualit√© de sommeil, tu ressens une fatigue qui te fait dire 'je dors mal', t'emp√™chant de retrouver l'√©nergie et la stabilit√© souhait√©es. Tu te sens souvent d√©bord√©e, ce qui alimente la procrastination de tes besoins physiques.",
          "maintenanceCheck": {
            "type": "surveillance",
            "question": "Combien de fois cette semaine as-tu ressenti une raideur significative au r√©veil ?",
            "frequency": "hebdomadaire"
          },
          "estimatedDuration": "12 semaines"
        },
        "goal_id": "11d69590-e37a-4941-bd01-5e868a588da7",
        "deep_why": "Pour cultiver une √©nergie douce et stable, √™tre pr√©sente pour moi-m√™me et mon corps chaque jour, et vivre sans la contrainte des raideurs.",
        "created_at": "2026-01-08T22:38:19.696317+00:00",
        "inputs_why": null,
        "current_phase": 1,
        "submission_id": "b592d4fc-6330-4ec7-99b0-4d9ce07885a3",
        "inputs_context": null,
        "inputs_blockers": null,
        "progress_percentage": 0
      },
      "actions": [
        {
          "id": "74055c73-b490-4f92-8066-ee6939a8a2ed",
          "title": "Micro-pauses actives",
          "status": "active",
          "created_at": "2026-01-08T22:38:19.736916+00:00",
          "description": "Toutes les heures de travail sur √©cran, l√®ve-toi, √©tire-toi l√©g√®rement, marche 1 minute ou fais quelques flexions/rotations douces. Mets un rappel si besoin.",
          "target_reps": 7,
          "time_of_day": "any_time",
          "current_reps": 0,
          "tracking_type": "boolean",
          "last_performed_at": "2026-01-06T22:38:19.729+00:00"
        },
        {
          "id": "a796b89e-d247-4818-80e1-15595bf77c5d",
          "title": "Rituel matinal d'√©tirement",
          "status": "active",
          "created_at": "2026-01-08T22:38:19.736916+00:00",
          "description": "Chaque matin, avant de commencer ta journ√©e, effectue une courte routine d'√©tirements doux (5-10 minutes) pour r√©veiller ton corps. Concentre-toi sur les zones identifi√©es comme raides.",
          "target_reps": 7,
          "time_of_day": "morning",
          "current_reps": 0,
          "tracking_type": "boolean",
          "last_performed_at": "2026-01-06T22:38:19.729+00:00"
        },
        {
          "id": "a6b5cfe0-9826-4e59-9dac-adf43d0e5d5d",
          "_kind": "framework",
          "title": "Scan corporel des tensions",
          "status": "active",
          "created_at": "2026-01-08T22:38:19.758315+00:00",
          "description": "",
          "target_reps": 7,
          "time_of_day": null,
          "current_reps": 0,
          "tracking_type": "boolean",
          "framework_type": "recurring",
          "last_performed_at": "2026-01-06T22:38:19.729+00:00"
        }
      ],
      "frameworks": [
        {
          "id": "a6b5cfe0-9826-4e59-9dac-adf43d0e5d5d",
          "type": "recurring",
          "title": "Scan corporel des tensions",
          "status": "active",
          "created_at": "2026-01-08T22:38:19.758315+00:00",
          "target_reps": 7,
          "current_reps": 0,
          "tracking_type": "boolean",
          "last_performed_at": "2026-01-06T22:38:19.729+00:00"
        }
      ],
      "dashboard_context": "=== PLAN ACTUEL (Tableau de Bord) ===\nTitre: L'√âveil du Corps Ancr√©\nStatut: active\nPhase courante (dashboard): 1\nPourquoi (Deep Why): Pour cultiver une √©nergie douce et stable, √™tre pr√©sente pour moi-m√™me et mon corps chaque jour, et vivre sans la contrainte des raideurs.\nD√âTAIL COMPLET DU PLAN (Structure JSON) :\n{\n  \"phases\": [\n    {\n      \"id\": 1,\n      \"title\": \"Phase 1 : L'Ancrage Postural\",\n      \"status\": \"active\",\n      \"actions\": [\n        {\n          \"id\": \"74055c73-b490-4f92-8066-ee6939a8a2ed\",\n          \"tips\": \"Utilise une application de timer ou ton calendrier pour des alertes r√©guli√®res. L'objectif n'est pas l'intensit√©, mais la r√©gularit√© et la rupture de la s√©dentarit√©.\",\n          \"type\": \"habitude\",\n          \"title\": \"Micro-pauses actives\",\n          \"status\": \"active\",\n          \"questType\": \"main\",\n          \"rationale\": \"Fragmenter les p√©riodes s√©dentaires aide √† pr√©venir les raideurs et √† am√©liorer la circulation, r√©duisant la fatigue mentale et physique.\",\n          \"targetReps\": 7,\n          \"description\": \"Toutes les heures de travail sur √©cran, l√®ve-toi, √©tire-toi l√©g√®rement, marche 1 minute ou fais quelques flexions/rotations douces. Mets un rappel si besoin.\",\n          \"isCompleted\": false,\n          \"time_of_day\": \"any_time\",\n          \"tracking_type\": \"boolean\"\n        },\n        {\n          \"id\": \"4fc5be9f-f26d-4a69-9edc-ccef1350f22f\",\n          \"tips\": \"Fais-le allong√©(e) dans ton lit. N'essaie pas de changer quoi que ce soit, juste d'observer sans jugement.\",\n          \"type\": \"framework\",\n          \"title\": \"Scan corporel des tensions\",\n          \"status\": \"active\",\n          \"questType\": \"side\",\n          \"rationale\": \"D√©velopper une conscience proprioceptive permet d'identifier les zones de stress avant qu'elles ne deviennent des douleurs chroniques et de mieux comprendre l'impact de ta journ√©e sur ton corps.\",\n          \"targetReps\": 7,\n          \"description\": \"Chaque soir, avant de te coucher, prends 5 minutes pour scanner ton corps de la t√™te aux pieds et identifier les zones de tension. Note ce que tu ressens.\",\n          \"isCompleted\": false,\n          \"time_of_day\": \"evening\",\n          \"tracking_type\": \"boolean\",\n          \"frameworkDetails\": {\n            \"type\": \"recurring\",\n            \"intro\": \"L'objectif est d'√©couter ton corps. Chaque soir, explore les sensations, les points de pression, les raideurs √©ventuelles. C'est une conversation intime avec toi-m√™me.\",\n            \"sections\": [\n              {\n                \"id\": \"p1s1\",\n                \"label\": \"O√π ressens-tu des tensions ou des sensations inhabituelles ?\",\n                \"inputType\": \"list\",\n                \"placeholder\": \"Nuque, √©paules lourdes, bas du dos tendu...\"\n              },\n              {\n                \"id\": \"p1s2\",\n                \"label\": \"Niveau de tension global ressenti (1-10)\",\n                \"inputType\": \"scale\",\n                \"placeholder\": \"5\"\n              }\n            ]\n          }\n        }\n      ],\n      \"subtitle\": \"Semaines 1-2 ‚Ä¢ Reconnecter avec la sensation\",\n      \"rationale\": \"Nous commen√ßons par la conscience de ton corps et des micro-corrections pour briser la s√©dentarit√© subtile et pr√©parer le terrain √† plus de mouvement.\"\n    },\n    {\n      \"id\": 2,\n      \"title\": \"Phase 2 : L'√âveil Doux\",\n      \"status\": \"locked\",\n      \"actions\": [\n        {\n          \"id\": \"a796b89e-d247-4818-80e1-15595bf77c5d\",\n          \"tips\": \"Cherche des routines d'√©tirement doux en ligne (yoga doux, √©tirements pour le dos/les √©paules) ou fais simplement ce qui te fait du bien. La r√©gularit√© prime sur l'intensit√©.\",\n          \"type\": \"habitude\",\n          \"title\": \"Rituel matinal d'√©tirement\",\n          \"status\": \"active\",\n          \"questType\": \"main\",\n          \"rationale\": \"Le matin est le moment id√©al pour d√©faire les raideurs nocturnes et pr√©parer tes articulations et muscles √† la journ√©e, am√©liorant ta flexibilit√© et r√©duisant les douleurs.\",\n          \"targetReps\": 7,\n          \"description\": \"Chaque matin, avant de commencer ta journ√©e, effectue une courte routine d'√©tirements doux (5-10 minutes) pour r√©veiller ton corps. Concentre-toi sur les zones identifi√©es comme raides.\",\n          \"isCompleted\": false,\n          \"time_of_day\": \"morning\",\n          \"tracking_type\": \"boolean\"\n        },\n        {\n          \"id\": \"67841c73-566f-487d-8ab8-76aa3acec2b1\",\n          \"tips\": \"Cet espace n'a pas besoin d'√™tre grand, juste suffisant pour t'√©tirer ou faire quelques mouvements sans te sentir √† l'√©troit.\",\n          \"type\": \"mission\",\n          \"title\": \"Am√©nager l'espace de mouvement\",\n          \"status\": \"pending\",\n          \"questType\": \"side\",\n          \"rationale\": \"Cr√©er un espace d√©di√© r√©duit les frictions et les excuses, facilitant l'int√©gration des nouvelles habitudes de mouvement dans ton environnement quotidien.\",\n          \"description\": \"D√©sencombre un petit espace chez toi o√π tu pourras te sentir libre de bouger. Si possible, pr√©vois un tapis de sol confortable ou une couverture.\",\n          \"isCompleted\": false,\n          \"time_of_day\": \"any_time\",\n          \"tracking_type\": \"boolean\"\n        }\n      ],\n      \"subtitle\": \"Semaines 3-4 ‚Ä¢ Fluidit√© et Pr√©paration\",\n      \"rationale\": \"Nous allons int√©grer la fluidit√© et des √©tirements doux pour adresser sp√©cifiquement les raideurs et pr√©parer ton corps √† plus de mouvement sans contrainte.\"\n    },\n    {\n      \"id\": 3,\n      \"title\": \"Phase 3 : La Respiration Vivante\",\n      \"status\": \"locked\",\n      \"actions\": [\n        {\n          \"id\": \"b7357c57-2f7d-4a5c-80d9-4d7fa7984834\",\n          \"tips\": \"Tu peux le faire assis(e) ou allong√©(e), avec une main sur ton ventre pour sentir le mouvement. Commence par 2-3 minutes si 5 te semblent trop longues.\",\n          \"type\": \"habitude\",\n          \"title\": \"5 minutes de respiration diaphragmatique\",\n          \"status\": \"pending\",\n          \"questType\": \"main\",\n          \"rationale\": \"La respiration diaphragmatique active le syst√®me nerveux parasympathique, r√©duisant le stress, am√©liorant la qualit√© du sommeil et favorisant la d√©tente musculaire.\",\n          \"targetReps\": 7,\n          \"description\": \"Chaque jour, prends 5 minutes pour pratiquer la respiration abdominale profonde. Concentre-toi sur le mouvement de ton ventre √† l'inspiration et √† l'expiration.\",\n          \"isCompleted\": false,\n          \"time_of_day\": \"evening\",\n          \"tracking_type\": \"boolean\"\n        },\n        {\n          \"id\": \"1208657b-de9a-4604-9dcd-17189d61fc18\",\n          \"tips\": \"Ne juge pas, observe juste. Y a-t-il des patterns ? Comment ton travail sur √©cran ou ton alimentation influencent-ils ton √©nergie ?\",\n          \"type\": \"framework\",\n          \"title\": \"Mon agenda de l'√©nergie\",\n          \"status\": \"pending\",\n          \"questType\": \"side\",\n          \"rationale\": \"Comprendre tes rythmes √©nerg√©tiques te permettra de placer les activit√©s qui n√©cessitent de l'√©nergie pendant tes pics, et les activit√©s douces ou de r√©cup√©ration pendant tes baisses, optimisant ta vitalit√©.\",\n          \"targetReps\": 1,\n          \"description\": \"Sur une semaine, observe et note tes pics et baisses d'√©nergie, ainsi que les activit√©s qui les influencent. R√©fl√©chis √† comment adapter tes journ√©es.\",\n          \"isCompleted\": false,\n          \"time_of_day\": \"any_time\",\n          \"tracking_type\": \"boolean\",\n          \"frameworkDetails\": {\n            \"type\": \"one_shot\",\n            \"intro\": \"Pour optimiser ton √©nergie, tu dois d'abord comprendre son flux naturel. Observe une semaine compl√®te tes hauts et tes bas. C'est une cartographie pr√©cieuse de ton corps.\",\n            \"sections\": [\n              {\n                \"id\": \"p3s1\",\n                \"label\": \"Mes moments de pic d'√©nergie dans la journ√©e\",\n                \"inputType\": \"list\",\n                \"placeholder\": \"Matin apr√®s caf√©, fin d'apr√®s-midi avant d√Æner\"\n              },\n              {\n                \"id\": \"p3s2\",\n                \"label\": \"Mes moments de baisse d'√©nergie ou de fatigue\",\n                \"inputType\": \"list\",\n                \"placeholder\": \"Post-repas de midi, milieu de matin√©e\"\n              },\n              {\n                \"id\": \"p3s3\",\n                \"label\": \"Comment puis-je adapter mes activit√©s (travail, mouvement, repos) √† ces cycles ?\",\n                \"inputType\": \"textarea\",\n                \"placeholder\": \"Mouvements doux pendant les baisses, activit√©s plus intenses pendant les pics...\"\n              }\n            ]\n          }\n        }\n      ],\n      \"subtitle\": \"Semaines 5-6 ‚Ä¢ Oxyg√©nation et Calme\",\n      \"rationale\": \"Nous allons connecter le mouvement √† la respiration pour r√©duire le stress, am√©liorer l'oxyg√©nation de tes tissus et cultiver un sentiment de calme qui soutiendra ta vitalit√©.\"\n    },\n    {\n      \"id\": 4,\n      \"title\": \"Phase 4 : Le Pas Conscient\",\n      \"status\": \"locked\",\n      \"actions\": [\n        {\n          \"id\": \"ef7aae66-1ab1-4ce7-98ae-5de4db6208e6\",\n          \"tips\": \"Laisse ton t√©l√©phone √† la maison ou en mode avion. C'est un moment pour toi, une pause mentale et physique. Choisis un moment o√π tu peux √™tre tranquille.\",\n          \"type\": \"habitude\",\n          \"title\": \"Marche consciente de 15 min\",\n          \"status\": \"pending\",\n          \"questType\": \"main\",\n          \"rationale\": \"La marche est l'un des mouvements les plus naturels et b√©n√©fiques. Pratiqu√©e en pleine conscience, elle r√©duit le stress, am√©liore l'humeur et renforce le corps sans effort excessif.\",\n          \"targetReps\": 7,\n          \"description\": \"Int√®gre une marche consciente de 15 minutes chaque jour. Concentre-toi sur tes sensations, le contact de tes pieds avec le sol, ta respiration et les √©l√©ments autour de toi.\",\n          \"isCompleted\": false,\n          \"time_of_day\": \"afternoon\",\n          \"tracking_type\": \"boolean\"\n        },\n        {\n          \"id\": \"8a9538bf-603e-441f-aacc-63139023ffaa\",\n          \"tips\": \"Prends 10-15 minutes pour explorer les environs ou utiliser une carte pour trouver des lieux 'verts' ou calmes.\",\n          \"type\": \"mission\",\n          \"title\": \"Identifier un parcours inspirant\",\n          \"status\": \"pending\",\n          \"questType\": \"side\",\n          \"rationale\": \"Avoir un parcours d√©fini et appr√©ci√© augmente la probabilit√© de maintenir l'habitude. Un environnement agr√©able enrichit l'exp√©rience de la marche consciente.\",\n          \"description\": \"Rep√®re un ou deux endroits agr√©ables pr√®s de chez toi ou de ton travail o√π tu pourrais faire ta marche quotidienne. Cherche un lieu o√π tu te sens bien (parc, rue calme, bord de rivi√®re).\",\n          \"isCompleted\": false,\n          \"time_of_day\": \"any_time\",\n          \"tracking_type\": \"boolean\"\n        }\n      ],\n      \"subtitle\": \"Semaines 7-8 ‚Ä¢ Mettre le corps en marche\",\n      \"rationale\": \"Nous allons augmenter l'activit√© physique avec une intention de pleine conscience, transformant la marche en une m√©ditation en mouvement pour nourrir ton corps et ton esprit.\"\n    },\n    {\n      \"id\": 5,\n      \"title\": \"Phase 5 : La R√©cup√©ration Profonde\",\n      \"status\": \"locked\",\n      \"actions\": [\n        {\n          \"id\": \"d3787cbd-3517-48f7-9c3d-5a7ca59f2d0d\",\n          \"tips\": \"Choisis 2-3 activit√©s apaisantes et respecte-les chaque soir. L'obscurit√© et le calme sont tes meilleurs alli√©s.\",\n          \"type\": \"habitude\",\n          \"title\": \"Rituel de d√©tente pr√©-sommeil\",\n          \"status\": \"pending\",\n          \"questType\": \"main\",\n          \"rationale\": \"Un rituel pr√©-sommeil signale √† ton cerveau qu'il est temps de ralentir, favorisant un endormissement plus facile et un sommeil plus profond et r√©parateur, essentiel pour la r√©cup√©ration physique.\",\n          \"targetReps\": 7,\n          \"description\": \"Instaure un rituel de d√©tente d'au moins 30 minutes avant d'aller au lit : lecture, musique douce, bain chaud, exercices de respiration. √âvite les √©crans.\",\n          \"isCompleted\": false,\n          \"time_of_day\": \"night\",\n          \"tracking_type\": \"boolean\"\n        },\n        {\n          \"id\": \"fc5c5428-40fe-46ca-99ce-d4958eeab3cc\",\n          \"tips\": \"Sois honn√™te avec toi-m√™me. Le 'dors mal' que tu ressens peut venir de facteurs subtils. Ce n'est pas seulement la quantit√©, mais la qualit√©.\",\n          \"type\": \"framework\",\n          \"title\": \"Le bilan de mon sommeil\",\n          \"status\": \"pending\",\n          \"questType\": \"side\",\n          \"rationale\": \"Analyser et comprendre les facteurs qui influencent ton sommeil te donnera les cl√©s pour des ajustements cibl√©s et une am√©lioration durable de ta vitalit√©.\",\n          \"targetReps\": 1,\n          \"description\": \"Prends un moment pour r√©fl√©chir √† tes nuits. Comment te sens-tu au r√©veil ? Y a-t-il des √©l√©ments qui nuisent ou am√©liorent ton repos ?\",\n          \"isCompleted\": false,\n          \"time_of_day\": \"morning\",\n          \"tracking_type\": \"boolean\",\n          \"frameworkDetails\": {\n            \"type\": \"one_shot\",\n            \"intro\": \"Tu as dit 'je dors mal', et c'est un signal crucial. Ce bilan n'est pas l√† pour juger, mais pour √©clairer les patterns et les pistes d'am√©lioration. Tes nuits sont le laboratoire de ton √©nergie.\",\n            \"sections\": [\n              {\n                \"id\": \"p5s1\",\n                \"label\": \"Comment te sens-tu au r√©veil en g√©n√©ral (1-10, 10=tr√®s repos√© et plein d'√©nergie) ?\",\n                \"inputType\": \"scale\",\n                \"placeholder\": \"6\"\n              },\n              {\n                \"id\": \"p5s2\",\n                \"label\": \"Y a-t-il eu des interruptions de sommeil, des difficult√©s √† t'endormir, ou d'autres probl√®mes r√©currents ?\",\n                \"inputType\": \"textarea\",\n                \"placeholder\": \"Oui, r√©veil fr√©quent vers 3h / Non, sommeil continu mais l√©ger\"\n              },\n              {\n                \"id\": \"p5s3\",\n                \"label\": \"Quelles hypoth√®ses peux-tu faire sur les causes ou les am√©liorations possibles de ton sommeil ?\",\n                \"inputType\": \"textarea\",\n                \"placeholder\": \"Trop d'√©crans le soir / Repas trop lourd / Stress accumul√© / Manque de mouvement\"\n              }\n            ]\n          }\n        }\n      ],\n      \"subtitle\": \"Semaines 9-10 ‚Ä¢ Optimiser le repos et le sommeil\",\n      \"rationale\": \"Nous allons optimiser tes routines de sommeil et de r√©cup√©ration, car un repos de qualit√© est la cl√© de l'√©nergie renouvel√©e et d'une r√©duction durable des douleurs physiques.\"\n    },\n    {\n      \"id\": 6,\n      \"title\": \"Phase 6 : L'Int√©gration Fluide\",\n      \"status\": \"locked\",\n      \"actions\": [\n        {\n          \"id\": \"b0e3de49-ec8a-4e72-8b27-41ab4e7ec721\",\n          \"tips\": \"Tu es l'experte de ton corps. Construis cette routine avec ce qui te fait le plus de bien. Elle peut √©voluer !.\",\n          \"type\": \"habitude\",\n          \"title\": \"La routine anti-douleur personnalis√©e\",\n          \"status\": \"pending\",\n          \"questType\": \"main\",\n          \"rationale\": \"Avoir une routine personnalis√©e et flexible garantit que tu continues √† prendre soin de tes besoins sp√©cifiques, pr√©venant la r√©apparition des douleurs et maintenant ta mobilit√©.\",\n          \"targetReps\": 7,\n          \"description\": \"Cr√©e et pratique une routine quotidienne de 10-15 minutes combinant √©tirements cibl√©s, respiration et mouvements doux, bas√©e sur ce que tu as appris sur tes zones de raideur et tes pics d'√©nergie.\",\n          \"isCompleted\": false,\n          \"time_of_day\": \"any_time\",\n          \"tracking_type\": \"boolean\"\n        },\n        {\n          \"id\": \"71ef7e40-a0e6-42a4-9884-1e5b13bb854d\",\n          \"tips\": \"Sois r√©aliste et flexible. L'important est de maintenir une intention de mouvement r√©gulier. Pr√©vois des jours de repos.\",\n          \"type\": \"mission\",\n          \"title\": \"Planifier mon mois de mouvement\",\n          \"status\": \"pending\",\n          \"questType\": \"side\",\n          \"rationale\": \"La planification proactive est une strat√©gie puissante pour √©viter la procrastination et assurer la p√©rennit√© de tes nouvelles habitudes de mouvement et de vitalit√©.\",\n          \"description\": \"Sur un calendrier, planifie tes activit√©s de mouvement pour le mois √† venir : tes marches, tes routines d'√©tirement, et pourquoi pas une nouvelle activit√© qui t'attire.\",\n          \"isCompleted\": false,\n          \"time_of_day\": \"any_time\",\n          \"tracking_type\": \"boolean\"\n        }\n      ],\n      \"subtitle\": \"Semaines 11-12 ‚Ä¢ Faire du mouvement une seconde nature\",\n      \"rationale\": \"Nous allons consolider tous les acquis et faire du mouvement conscient une partie int√©grante et naturelle de ton identit√©, ancrant ces nouvelles habitudes pour une vitalit√© durable.\"\n    }\n  ],\n  \"deepWhy\": \"Pour cultiver une √©nergie douce et stable, √™tre pr√©sente pour moi-m√™me et mon corps chaque jour, et vivre sans la contrainte des raideurs.\",\n  \"identity\": \"Je suis le Corps en Mouvement Libre.\",\n  \"strategy\": \"Nous allons restaurer ta relation avec ton corps par des micro-mouvements conscients et des ancrages doux, d√©bloquant l'√©nergie et la fluidit√© pas √† pas. L'objectif est de dissoudre la s√©dentarit√© et les raideurs en int√©grant la conscience corporelle dans ton quotidien tr√©pidant.\",\n  \"goldenRules\": \"1. Chaque heure, un mouvement conscient est une victoire.\\n2. Mon corps est mon alli√©, non un fardeau √† ignorer.\\n3. La douceur est ma force, la constance ma victoire sur l'inertie.\",\n  \"vitalSignal\": {\n    \"name\": \"Minutes de mouvement conscient hors travail\",\n    \"type\": \"constat\",\n    \"unit\": \"min\",\n    \"startValue\": \"0\",\n    \"description\": \"Augmentation progressive du temps de mouvement intentionnel et doux, int√©gr√© dans ta journ√©e, au-del√† de ton temps de travail sur √©cran.\",\n    \"targetValue\": \"30\",\n    \"tracking_type\": \"counter\"\n  },\n  \"grimoireTitle\": \"L'√âveil du Corps Ancr√©\",\n  \"context_problem\": \"√âpuis√©e par de longues heures devant l'√©cran et des nuits per√ßues comme peu r√©paratrices, tu te sentais pi√©g√©e dans la s√©dentarit√© et les douleurs. Ton d√©sir profond de retrouver √©nergie et stabilit√© √©tait constamment frein√© par le sentiment d'√™tre d√©bord√©e et la tendance √† remettre tes besoins physiques √† plus tard.\",\n  \"sophiaKnowledge\": \"Tu es une femme de 35 ans (n√©e en 1988) qui travaille sur √©cran, ce qui entra√Æne une s√©dentarit√© et des douleurs. Bien que ton questionnaire indique une bonne qualit√© de sommeil, tu ressens une fatigue qui te fait dire 'je dors mal', t'emp√™chant de retrouver l'√©nergie et la stabilit√© souhait√©es. Tu te sens souvent d√©bord√©e, ce qui alimente la procrastination de tes besoins physiques.\",\n  \"maintenanceCheck\": {\n    \"type\": \"surveillance\",\n    \"question\": \"Combien de fois cette semaine as-tu ressenti une raideur significative au r√©veil ?\",\n    \"frequency\": \"hebdomadaire\"\n  },\n  \"estimatedDuration\": \"12 semaines\"\n}\n=== ACTIONS / FRAMEWORKS (√âTAT R√âEL DB) ===\nR√àGLES IMPORTANTES:\n- Les frameworks comptent comme des actions c√¥t√© utilisateur.\n- \"active\" = activ√©e et visible comme active dans l'app. \"pending\" = pas active.\n- On n'active/d√©sactive pas via WhatsApp: la seule mani√®re d'activer/d√©sactiver, c'est depuis le dashboard.\n\nActives (3):\n- [ACTION] Micro-pauses actives (any_time)\n- [ACTION] Rituel matinal d'√©tirement (morning)\n- [FRAMEWORK] Scan corporel des tensions\n\n=== SIGNES VITAUX (√âtat Actuel) ===\n- Minutes de mouvement conscient hors travail: 0 min\n",
      "template_fingerprint": "b1e8d47c74e7a86d"
    },
    "scenario_target": "bilan"
  },
  "error": null
}