{
  "id": "6d22d3dd-c02b-4cd9-8810-a9df907eb4e7",
  "created_at": "2026-01-09T21:38:03.763832+00:00",
  "status": "completed",
  "scenario_key": "wa_onboarding_open_chat_offtopic_after_prompt__run_1767994656804_2d2ef5",
  "transcript": [
    {
      "role": "user",
      "content": "Je suis plut√¥t du matin en g√©n√©ral.",
      "agent_used": null,
      "created_at": "2026-01-09T21:38:04.011999+00:00"
    },
    {
      "role": "assistant",
      "content": "Merci, je note ‚ù§Ô∏è\nEt l√†, tout de suite: tu as envie qu‚Äôon parle de quoi ?",
      "agent_used": "companion",
      "created_at": "2026-01-09T21:38:04.020296+00:00"
    },
    {
      "role": "user",
      "content": "Franchement l√† je suis sous pression au boulot‚Ä¶ j‚Äôai le cerveau en vrac.",
      "agent_used": null,
      "created_at": "2026-01-09T21:38:04.035587+00:00"
    },
    {
      "role": "assistant",
      "content": "C'est souvent dans ces moments de saturation qu'on perd le fil. Malgr√© ce rush au boulot, combien de minutes as-tu pass√© sur ton temps d'√©cran libre aujourd'hui ? üß†",
      "agent_used": "investigator",
      "created_at": "2026-01-09T21:38:12.069309+00:00"
    }
  ],
  "state_before": {
    "profile": {
      "id": "e448b378-3cc2-4213-9bfb-45376bfac4f1",
      "email": "run-evals+e92615d2ae324a@example.com",
      "full_name": "Eval Runner",
      "trial_end": "2026-01-16T21:38:03.73+00:00",
      "phone_number": "+15558809796652",
      "phone_invalid": false,
      "whatsapp_state": "awaiting_personal_fact",
      "phone_verified_at": "2026-01-09T21:38:03.73+00:00",
      "whatsapp_opted_in": true,
      "whatsapp_opted_out_at": null,
      "whatsapp_optin_sent_at": null,
      "whatsapp_optout_reason": null,
      "whatsapp_bilan_opted_in": false,
      "whatsapp_last_inbound_at": null,
      "whatsapp_last_outbound_at": null,
      "whatsapp_state_updated_at": "2026-01-09T21:38:03.73+00:00",
      "whatsapp_optout_confirmed_at": null
    },
    "chat_state": null
  },
  "state_after": {
    "profile": {
      "id": "e448b378-3cc2-4213-9bfb-45376bfac4f1",
      "email": "run-evals+e92615d2ae324a@example.com",
      "full_name": "Eval Runner",
      "trial_end": "2026-01-16T21:38:03.73+00:00",
      "phone_number": "+15558809796652",
      "phone_invalid": false,
      "whatsapp_state": null,
      "phone_verified_at": "2026-01-09T21:38:03.73+00:00",
      "whatsapp_opted_in": true,
      "whatsapp_opted_out_at": null,
      "whatsapp_optin_sent_at": null,
      "whatsapp_optout_reason": null,
      "whatsapp_bilan_opted_in": false,
      "whatsapp_last_inbound_at": "2026-01-09T21:38:04.032+00:00",
      "whatsapp_last_outbound_at": null,
      "whatsapp_state_updated_at": "2026-01-09T21:38:04.021+00:00",
      "whatsapp_optout_confirmed_at": null
    },
    "chat_state": {
      "scope": "whatsapp",
      "user_id": "e448b378-3cc2-4213-9bfb-45376bfac4f1",
      "risk_level": 3,
      "updated_at": "2026-01-09T21:38:12.063671+00:00",
      "temp_memory": {},
      "current_mode": "investigator",
      "last_processed_at": "2026-01-09T21:38:04.046+00:00",
      "short_term_context": "",
      "investigation_state": {
        "status": "checking",
        "temp_memory": {
          "day_scope": "today",
          "opening_done": true,
          "locked_pending_items": true
        },
        "pending_items": [
          {
            "id": "162b8c00-46cf-4b2a-a95d-787ca19298ae",
            "type": "vital",
            "unit": "min",
            "title": "Temps d'√©cran libre",
            "tracking_type": "counter"
          },
          {
            "id": "5d1cd0bf-1cc2-451a-8733-9ed4642ac969",
            "type": "action",
            "title": "Le Couvre-feu Digital Sacr√©",
            "target": 7,
            "description": "Mettre ton t√©l√©phone en mode 'Ne pas d√©ranger' ou en mode avion 90 minutes avant de dormir, et le laisser hors de port√©e.",
            "tracking_type": "boolean"
          },
          {
            "id": "2f30da2f-9e43-4c8a-be10-a9ece8145574",
            "type": "framework",
            "title": "Inventaire des Voleurs de Temps",
            "tracking_type": "boolean"
          }
        ],
        "current_item_index": 0
      },
      "last_interaction_at": "2026-01-09T21:38:04.046788+00:00",
      "unprocessed_msg_count": 1
    }
  },
  "issues": [
    {
      "code": "tone_deaf_transition",
      "message": "The transition from the user's expression of acute stress ('cerveau en vrac') to the specific 'screen time' metric is abrupt. While the agent acknowledges the 'rush', pivoting immediately to a specific numeric question feels robotic and invalidates the user's emotional state.",
      "evidence": {
        "snippet": "Malgr√© ce rush au boulot, combien de minutes as-tu pass√© sur ton temps d'√©cran libre aujourd'hui ?",
        "agent_used": "sophia.investigator"
      },
      "severity": "medium"
    }
  ],
  "suggestions": [
    {
      "action": "append",
      "rationale": "Improves empathy. Prevents the user from feeling like they are just filling out a form when they are vulnerable.",
      "prompt_key": "sophia.investigator",
      "context_block": "=== CONTEXT (transcript excerpt) ===\n#0 USER: Je suis plut√¥t du matin en g√©n√©ral.\n#1 ASSISTANT(companion): Merci, je note ‚ù§Ô∏è Et l√†, tout de suite: tu as envie qu‚Äôon parle de quoi ?\n#2 USER: Franchement l√† je suis sous pression au boulot‚Ä¶ j‚Äôai le cerveau en vrac.\n#3 ASSISTANT(investigator): C'est souvent dans ces moments de saturation qu'on perd le fil. Malgr√© ce rush au boulot, combien de minutes as-tu pass√© sur ton temps d'√©cran libre aujourd'hui ? üß†\n\n=== APPLY ===\nprompt_key: sophia.investigator\naction: append\n\nproposed_addendum:\nIf the user enters the checkup expressing distress, stress, or fatigue, do not jump straight to the first metric. Briefly validate their feeling and explain that checking the data might help understand the cause, then ask the question.",
      "proposed_addendum": "If the user enters the checkup expressing distress, stress, or fatigue, do not jump straight to the first metric. Briefly validate their feeling and explain that checking the data might help understand the cause, then ask the question."
    }
  ],
  "metrics": {
    "cost_usd": 0,
    "request_id": "wa_onboarding_bundle:wa_onboarding_open_chat_offtopic_after_prompt__run_1767994656804_2d2ef5:i0:s1916298011:core:wa_onboarding_open_chat_offtopic_after_prompt__run_1767994656804_2d2ef5",
    "total_tokens": 0,
    "output_tokens": 0,
    "prompt_tokens": 0,
    "judge_llm_used": true,
    "mega_test_mode": false
  },
  "config": {
    "tags": [
      "whatsapp.onboarding",
      "whatsapp.webhook",
      "conversational",
      "offtopic"
    ],
    "limits": {
      "model": "gemini-3-pro-preview",
      "user_difficulty": "mid",
      "bilan_actions_count": 0,
      "test_post_checkup_deferral": false
    },
    "channel": "whatsapp",
    "request_id": "wa_onboarding_bundle:wa_onboarding_open_chat_offtopic_after_prompt__run_1767994656804_2d2ef5:i0:s1916298011:core:wa_onboarding_open_chat_offtopic_after_prompt__run_1767994656804_2d2ef5",
    "description": "WhatsApp onboarding (webhook): after the onboarding prompt opens the floor ('envie qu‚Äôon parle de quoi ?'), the user talks about something unrelated to the plan; Sophia should respect the intent and not redirect to the site/plan.",
    "plan_snapshot": {
      "plan": {
        "id": "6516627c-d212-46b6-9a57-41a20f65439e",
        "title": "Le Protocole du Ma√Ætre du Temps",
        "status": "active",
        "content": {
          "phases": [
            {
              "id": 1,
              "title": "Phase 1 : Le Grand D√©tox Digital",
              "status": "active",
              "actions": [
                {
                  "id": "5d1cd0bf-1cc2-451a-8733-9ed4642ac969",
                  "tips": "Utilise un r√©veil analogique et lis un livre ou √©coute un podcast relaxant. Place ton t√©l√©phone dans une autre pi√®ce.",
                  "type": "habitude",
                  "title": "Le Couvre-feu Digital Sacr√©",
                  "status": "active",
                  "questType": "main",
                  "rationale": "R√©duit l'exposition √† la lumi√®re bleue et aux sollicitations tardives, favorisant un endormissement plus rapide et un sommeil de meilleure qualit√©.",
                  "targetReps": 7,
                  "description": "Mettre ton t√©l√©phone en mode 'Ne pas d√©ranger' ou en mode avion 90 minutes avant de dormir, et le laisser hors de port√©e.",
                  "isCompleted": false,
                  "time_of_day": "night",
                  "tracking_type": "boolean"
                },
                {
                  "id": "f2e8d10e-ac45-441f-a55d-32c27cda5416",
                  "tips": "Sois honn√™te avec toi-m√™me. Le but n'est pas de juger, mais de comprendre.",
                  "type": "framework",
                  "title": "Inventaire des Voleurs de Temps",
                  "status": "active",
                  "questType": "side",
                  "rationale": "Prendre conscience de tes sch√©mas de distraction est la premi√®re √©tape pour les modifier. Cela ancre la discipline par la compr√©hension.",
                  "targetReps": 2,
                  "description": "Identifier les moments, lieux et applications qui aspirent le plus ton attention et ton √©nergie au quotidien.",
                  "isCompleted": false,
                  "time_of_day": "any_time",
                  "tracking_type": "counter",
                  "frameworkDetails": {
                    "type": "recurring",
                    "intro": "Pendant les deux prochaines semaines, observe-toi attentivement. Quand et comment ton t√©l√©phone (ou d'autres distractions) te 'vole' du temps ? Note les d√©clencheurs, les applications et les sentiments associ√©s.",
                    "sections": [
                      {
                        "id": "s1_p1a2",
                        "label": "D√©clencheur et Contexte",
                        "inputType": "text",
                        "placeholder": "Ex: Pause caf√©, en attendant une r√©ponse, apr√®s avoir d√©pos√© les enfants..."
                      },
                      {
                        "id": "s2_p1a2",
                        "label": "Application/Activit√© Consumant du Temps",
                        "inputType": "text",
                        "placeholder": "Ex: Instagram, TikTok, les news, une t√¢che de rangement non-prioritaire..."
                      },
                      {
                        "id": "s3_p1a2",
                        "label": "√âmotion ou Besoin Sous-jacent",
                        "inputType": "text",
                        "placeholder": "Ex: Ennui, stress, recherche d'√©vasion, besoin de se sentir connect√©e..."
                      }
                    ]
                  }
                }
              ],
              "subtitle": "Semaines 1-2 ‚Ä¢ Reprendre le contr√¥le de ton attention",
              "rationale": "Avant de construire une nouvelle discipline, il est crucial de d√©samorcer les sources majeures de distraction et d'√©puisement. Cette phase cible l'usage excessif du t√©l√©phone, principal perturbateur de ton focus et de ton √©nergie."
            },
            {
              "id": 2,
              "title": "Phase 2 : Ancrage √ânerg√©tique",
              "status": "locked",
              "actions": [
                {
                  "id": "2134c233-4e1c-472a-9adb-de0042f3a6ca",
                  "tips": "Pr√©pare tes affaires la veille. Commence par 5 minutes si 15 semblent trop. L'essentiel est la constance.",
                  "type": "habitude",
                  "title": "Le Rituel Matinal de l'Architecte (15 min)",
                  "status": "pending",
                  "questType": "main",
                  "rationale": "Ancre la journ√©e avec intention, r√©duit le stress et aligne ton rythme circadien, boostant ton √©nergie et ta clart√© mentale.",
                  "targetReps": 7,
                  "description": "Mettre en place une routine matinale de 15 minutes sans √©cran : hydratation, quelques √©tirements ou respirations profondes, et exposition √† la lumi√®re naturelle.",
                  "isCompleted": false,
                  "time_of_day": "morning",
                  "tracking_type": "boolean"
                },
                {
                  "id": "28842df5-7f89-40e3-934c-05f28b57ab39",
                  "tips": "Commence petit. Un tiroir, puis le bureau. Investis dans une plante ou un objet inspirant.",
                  "type": "mission",
                  "title": "Optimisation du Cocon de Travail",
                  "status": "pending",
                  "questType": "side",
                  "rationale": "Un environnement physique ordonn√© refl√®te et soutient un esprit ordonn√©, r√©duisant les distractions visuelles et mentales qui nourrissent la d√©sorganisation.",
                  "description": "D√©sencombrer et organiser ton espace de travail. Rends-le fonctionnel, esth√©tique et propice √† la concentration (moins de 3 objets superflus sur le bureau).",
                  "isCompleted": false,
                  "time_of_day": "any_time",
                  "tracking_type": "boolean"
                }
              ],
              "subtitle": "Semaines 3-4 ‚Ä¢ Reconstruire une base solide",
              "rationale": "Avec moins de distractions digitales, il est temps de stabiliser ton √©nergie. Des routines simples et impactantes jetteront les bases d'une meilleure r√©silience physique et mentale, essentielle pour la concentration."
            },
            {
              "id": 3,
              "title": "Phase 3 : Le Cadran du Focus",
              "status": "locked",
              "actions": [
                {
                  "id": "1edeaaa8-afc0-44c7-ab7b-bc333261ada8",
                  "tips": "Commence par 25 minutes et augmente progressivement. Ferme toutes les notifications et onglets inutiles. Informe ton entourage de ton 'mode focus'.",
                  "type": "habitude",
                  "title": "Session Focus Immersion (25-45 min)",
                  "status": "pending",
                  "questType": "main",
                  "rationale": "Entra√Æne ton cerveau √† soutenir l'attention sur la dur√©e, brisant le cycle de la procrastination et augmentant l'efficacit√©.",
                  "targetReps": 10,
                  "description": "Engager une p√©riode de travail ininterrompu sur une seule t√¢che, sans distraction. Utilise un minuteur (type Pomodoro ou autre).",
                  "isCompleted": false,
                  "time_of_day": "any_time",
                  "tracking_type": "counter"
                },
                {
                  "id": "41138db8-10e7-4ed2-ae50-26ab7222d54f",
                  "tips": "Fais cet exercice le dimanche soir pour la semaine √† venir, ou chaque matin pour la journ√©e.",
                  "type": "framework",
                  "title": "La Matrice du Discernement Simplifi√©e",
                  "status": "pending",
                  "questType": "side",
                  "rationale": "Offre une clart√© imm√©diate sur ce qui m√©rite ton √©nergie, r√©duisant le sentiment de d√©bordement et guidant l'action.",
                  "targetReps": 2,
                  "description": "Appliquer une version simplifi√©e de la Matrice d'Eisenhower pour prioriser tes t√¢ches quotidiennes et hebdomadaires : Urgentes/Importantes, Importantes (non urgentes), Urgentes (non importantes), Ni l'un ni l'autre.",
                  "isCompleted": false,
                  "time_of_day": "any_time",
                  "tracking_type": "counter",
                  "frameworkDetails": {
                    "type": "recurring",
                    "intro": "L'objectif est de te donner une vision claire de tes priorit√©s. Pour chaque t√¢che, demande-toi : Est-ce Urgent ? Est-ce Important ? Utilise les quatre cat√©gories pour classer.",
                    "sections": [
                      {
                        "id": "s1_p3a2",
                        "label": "Liste de toutes les t√¢ches √† faire",
                        "inputType": "list",
                        "placeholder": "Ex: R√©diger le rapport, Appeler la banque, Pr√©parer le repas"
                      },
                      {
                        "id": "s2_p3a2",
                        "label": "Priorisation (T√¢che | Cat√©gorie)",
                        "inputType": "categorized_list",
                        "placeholder": "Ex: R√©diger rapport | Important et Urgent"
                      }
                    ]
                  }
                }
              ],
              "subtitle": "Semaines 5-6 ‚Ä¢ Ma√Ætriser l'art de l'attention",
              "rationale": "Tes fondations √©nerg√©tiques √©tant pos√©es, cette phase t'√©quipe des outils pour t'attaquer directement √† la procrastination et √† la d√©sorganisation. Tu apprendras √† d√©couper tes t√¢ches et √† prioriser avec discernement."
            },
            {
              "id": 4,
              "title": "Phase 4 : L'Architecte au Quotidien",
              "status": "locked",
              "actions": [
                {
                  "id": "375171f4-fbb6-4e0e-9db1-86bc8f7d7fe8",
                  "tips": "Utilise un carnet d√©di√©. Ne cherche pas la perfection, juste la r√©gularit√©. C√©l√®bre les petites victoires.",
                  "type": "habitude",
                  "title": "La Revue de Fin de Journ√©e (10 min)",
                  "status": "pending",
                  "questType": "main",
                  "rationale": "Structure la journ√©e suivante, ancre un sentiment d'ach√®vement et renforce la conscience de tes progr√®s, consolidant ainsi la discipline.",
                  "targetReps": 7,
                  "description": "Prendre 10 minutes chaque soir pour planifier la t√¢che principale du lendemain et noter une r√©ussite ou un d√©fi de la journ√©e.",
                  "isCompleted": false,
                  "time_of_day": "evening",
                  "tracking_type": "boolean"
                },
                {
                  "id": "c4803faa-3c4b-452a-b5c5-e3c804549d01",
                  "tips": "Choisis des actions qui te sont propres et qui ont d√©j√† fait leurs preuves. Garde cette liste √† port√©e de main.",
                  "type": "mission",
                  "title": "Cr√©er ma Trousse de Secours Anti-Procrastination",
                  "status": "pending",
                  "questType": "side",
                  "rationale": "Fournit des outils concrets et imm√©diats pour briser l'inertie de la procrastination, te redonnant le contr√¥le de tes actions.",
                  "description": "Identifier et lister 3 √† 5 actions rapides et simples √† r√©aliser lorsque la procrastination menace (ex: marcher 5 min, boire un verre d'eau, lancer un timer de 5 min sur une t√¢che).",
                  "isCompleted": false,
                  "time_of_day": "any_time",
                  "tracking_type": "boolean"
                }
              ],
              "subtitle": "Semaines 7-8 ‚Ä¢ Consolider et s'adapter",
              "rationale": "Ayant construit des fondations solides et affin√© ton focus, cette derni√®re phase vise √† int√©grer ces syst√®mes dans ton quotidien, √† g√©rer les impr√©vus et √† cr√©er une boucle de r√©troaction positive pour une discipline durable."
            }
          ],
          "deepWhy": "Retrouver une √©nergie stable pour une vie quotidienne sereine et √™tre pleinement pr√©sente √† mes engagements, sans le poids du d√©bordement et de la procrastination.",
          "identity": "Je suis une Architecte de ma Journ√©e.",
          "strategy": "On stabilise l'√©nergie et l'environnement pour b√¢tir un socle de discipline in√©branlable, permettant de surmonter la d√©sorganisation et la procrastination.",
          "goldenRules": "1. Priorit√© √† l'√©nergie : Mon corps est mon temple.\n2. Une chose √† la fois : Le focus est ma boussole.\n3. L'impr√©vu est mon ami : Je m'adapte, je ne panique pas.",
          "vitalSignal": {
            "name": "Temps d'√©cran libre",
            "type": "constat",
            "unit": "min",
            "startValue": "240",
            "description": "Mesure le temps pass√© sur des applications non essentielles (hors travail), afin de r√©duire la distraction et la fatigue mentale.",
            "targetValue": "60",
            "time_of_day": "evening",
            "tracking_type": "counter"
          },
          "grimoireTitle": "Le Protocole du Ma√Ætre du Temps",
          "context_problem": "Tu te sentais constamment sous l'eau, avec une difficult√© √† organiser tes t√¢ches et √† les mener √† bien. L'√©puisement et la distraction par ton t√©l√©phone √©taient devenus des cercles vicieux, t'emp√™chant de retrouver l'√©quilibre et la s√©r√©nit√© que tu souhaitais au quotidien. Cette situation entra√Ænait une baisse d'√©nergie et une instabilit√© quotidienne.",
          "sophiaKnowledge": "Tu es une femme de 28 ans (n√©e en janvier 1996) qui se sent d√©bord√©e et fatigu√©e par des journ√©es irr√©guli√®res. Ton manque de focus et de discipline se manifeste par de la d√©sorganisation et de la procrastination, souvent compens√© par l'usage du t√©l√©phone. Tu as une mauvaise qualit√© de sommeil, un niveau de stress √©lev√© et une faible activit√© physique. Tu cherches √† retrouver de l'√©nergie et de la stabilit√© pour une vie quotidienne plus sereine.",
          "maintenanceCheck": {
            "type": "surveillance",
            "question": "Sur 7 jours, combien de fois as-tu r√©alis√© ta t√¢che prioritaire du jour ?",
            "frequency": "hebdomadaire"
          },
          "estimatedDuration": "8 semaines"
        },
        "goal_id": "f794aa79-26d4-4df9-b5f6-b62264842388",
        "deep_why": "Retrouver une √©nergie stable pour une vie quotidienne sereine et √™tre pleinement pr√©sente √† mes engagements, sans le poids du d√©bordement et de la procrastination.",
        "created_at": "2026-01-09T21:38:03.697954+00:00",
        "inputs_why": null,
        "current_phase": 1,
        "submission_id": "2e801b7f-59eb-446c-ada5-e244a31322fc",
        "inputs_context": null,
        "inputs_blockers": null,
        "progress_percentage": 0
      },
      "actions": [
        {
          "id": "5d1cd0bf-1cc2-451a-8733-9ed4642ac969",
          "title": "Le Couvre-feu Digital Sacr√©",
          "status": "active",
          "created_at": "2026-01-09T21:38:03.710953+00:00",
          "description": "Mettre ton t√©l√©phone en mode 'Ne pas d√©ranger' ou en mode avion 90 minutes avant de dormir, et le laisser hors de port√©e.",
          "target_reps": 7,
          "time_of_day": "night",
          "current_reps": 0,
          "tracking_type": "boolean",
          "last_performed_at": "2026-01-07T21:38:03.708+00:00"
        },
        {
          "id": "2f30da2f-9e43-4c8a-be10-a9ece8145574",
          "_kind": "framework",
          "title": "Inventaire des Voleurs de Temps",
          "status": "active",
          "created_at": "2026-01-09T21:38:03.718787+00:00",
          "description": "",
          "target_reps": 2,
          "time_of_day": null,
          "current_reps": 0,
          "tracking_type": "counter",
          "framework_type": "recurring",
          "last_performed_at": "2026-01-07T21:38:03.708+00:00"
        }
      ],
      "frameworks": [
        {
          "id": "2f30da2f-9e43-4c8a-be10-a9ece8145574",
          "type": "recurring",
          "title": "Inventaire des Voleurs de Temps",
          "status": "active",
          "created_at": "2026-01-09T21:38:03.718787+00:00",
          "target_reps": 2,
          "current_reps": 0,
          "tracking_type": "counter",
          "last_performed_at": "2026-01-07T21:38:03.708+00:00"
        }
      ],
      "dashboard_context": "=== PLAN ACTUEL (Tableau de Bord) ===\nTitre: Le Protocole du Ma√Ætre du Temps\nStatut: active\nPhase courante (dashboard): 1\nPourquoi (Deep Why): Retrouver une √©nergie stable pour une vie quotidienne sereine et √™tre pleinement pr√©sente √† mes engagements, sans le poids du d√©bordement et de la procrastination.\nD√âTAIL COMPLET DU PLAN (Structure JSON) :\n{\n  \"phases\": [\n    {\n      \"id\": 1,\n      \"title\": \"Phase 1 : Le Grand D√©tox Digital\",\n      \"status\": \"active\",\n      \"actions\": [\n        {\n          \"id\": \"5d1cd0bf-1cc2-451a-8733-9ed4642ac969\",\n          \"tips\": \"Utilise un r√©veil analogique et lis un livre ou √©coute un podcast relaxant. Place ton t√©l√©phone dans une autre pi√®ce.\",\n          \"type\": \"habitude\",\n          \"title\": \"Le Couvre-feu Digital Sacr√©\",\n          \"status\": \"active\",\n          \"questType\": \"main\",\n          \"rationale\": \"R√©duit l'exposition √† la lumi√®re bleue et aux sollicitations tardives, favorisant un endormissement plus rapide et un sommeil de meilleure qualit√©.\",\n          \"targetReps\": 7,\n          \"description\": \"Mettre ton t√©l√©phone en mode 'Ne pas d√©ranger' ou en mode avion 90 minutes avant de dormir, et le laisser hors de port√©e.\",\n          \"isCompleted\": false,\n          \"time_of_day\": \"night\",\n          \"tracking_type\": \"boolean\"\n        },\n        {\n          \"id\": \"f2e8d10e-ac45-441f-a55d-32c27cda5416\",\n          \"tips\": \"Sois honn√™te avec toi-m√™me. Le but n'est pas de juger, mais de comprendre.\",\n          \"type\": \"framework\",\n          \"title\": \"Inventaire des Voleurs de Temps\",\n          \"status\": \"active\",\n          \"questType\": \"side\",\n          \"rationale\": \"Prendre conscience de tes sch√©mas de distraction est la premi√®re √©tape pour les modifier. Cela ancre la discipline par la compr√©hension.\",\n          \"targetReps\": 2,\n          \"description\": \"Identifier les moments, lieux et applications qui aspirent le plus ton attention et ton √©nergie au quotidien.\",\n          \"isCompleted\": false,\n          \"time_of_day\": \"any_time\",\n          \"tracking_type\": \"counter\",\n          \"frameworkDetails\": {\n            \"type\": \"recurring\",\n            \"intro\": \"Pendant les deux prochaines semaines, observe-toi attentivement. Quand et comment ton t√©l√©phone (ou d'autres distractions) te 'vole' du temps ? Note les d√©clencheurs, les applications et les sentiments associ√©s.\",\n            \"sections\": [\n              {\n                \"id\": \"s1_p1a2\",\n                \"label\": \"D√©clencheur et Contexte\",\n                \"inputType\": \"text\",\n                \"placeholder\": \"Ex: Pause caf√©, en attendant une r√©ponse, apr√®s avoir d√©pos√© les enfants...\"\n              },\n              {\n                \"id\": \"s2_p1a2\",\n                \"label\": \"Application/Activit√© Consumant du Temps\",\n                \"inputType\": \"text\",\n                \"placeholder\": \"Ex: Instagram, TikTok, les news, une t√¢che de rangement non-prioritaire...\"\n              },\n              {\n                \"id\": \"s3_p1a2\",\n                \"label\": \"√âmotion ou Besoin Sous-jacent\",\n                \"inputType\": \"text\",\n                \"placeholder\": \"Ex: Ennui, stress, recherche d'√©vasion, besoin de se sentir connect√©e...\"\n              }\n            ]\n          }\n        }\n      ],\n      \"subtitle\": \"Semaines 1-2 ‚Ä¢ Reprendre le contr√¥le de ton attention\",\n      \"rationale\": \"Avant de construire une nouvelle discipline, il est crucial de d√©samorcer les sources majeures de distraction et d'√©puisement. Cette phase cible l'usage excessif du t√©l√©phone, principal perturbateur de ton focus et de ton √©nergie.\"\n    },\n    {\n      \"id\": 2,\n      \"title\": \"Phase 2 : Ancrage √ânerg√©tique\",\n      \"status\": \"locked\",\n      \"actions\": [\n        {\n          \"id\": \"2134c233-4e1c-472a-9adb-de0042f3a6ca\",\n          \"tips\": \"Pr√©pare tes affaires la veille. Commence par 5 minutes si 15 semblent trop. L'essentiel est la constance.\",\n          \"type\": \"habitude\",\n          \"title\": \"Le Rituel Matinal de l'Architecte (15 min)\",\n          \"status\": \"pending\",\n          \"questType\": \"main\",\n          \"rationale\": \"Ancre la journ√©e avec intention, r√©duit le stress et aligne ton rythme circadien, boostant ton √©nergie et ta clart√© mentale.\",\n          \"targetReps\": 7,\n          \"description\": \"Mettre en place une routine matinale de 15 minutes sans √©cran : hydratation, quelques √©tirements ou respirations profondes, et exposition √† la lumi√®re naturelle.\",\n          \"isCompleted\": false,\n          \"time_of_day\": \"morning\",\n          \"tracking_type\": \"boolean\"\n        },\n        {\n          \"id\": \"28842df5-7f89-40e3-934c-05f28b57ab39\",\n          \"tips\": \"Commence petit. Un tiroir, puis le bureau. Investis dans une plante ou un objet inspirant.\",\n          \"type\": \"mission\",\n          \"title\": \"Optimisation du Cocon de Travail\",\n          \"status\": \"pending\",\n          \"questType\": \"side\",\n          \"rationale\": \"Un environnement physique ordonn√© refl√®te et soutient un esprit ordonn√©, r√©duisant les distractions visuelles et mentales qui nourrissent la d√©sorganisation.\",\n          \"description\": \"D√©sencombrer et organiser ton espace de travail. Rends-le fonctionnel, esth√©tique et propice √† la concentration (moins de 3 objets superflus sur le bureau).\",\n          \"isCompleted\": false,\n          \"time_of_day\": \"any_time\",\n          \"tracking_type\": \"boolean\"\n        }\n      ],\n      \"subtitle\": \"Semaines 3-4 ‚Ä¢ Reconstruire une base solide\",\n      \"rationale\": \"Avec moins de distractions digitales, il est temps de stabiliser ton √©nergie. Des routines simples et impactantes jetteront les bases d'une meilleure r√©silience physique et mentale, essentielle pour la concentration.\"\n    },\n    {\n      \"id\": 3,\n      \"title\": \"Phase 3 : Le Cadran du Focus\",\n      \"status\": \"locked\",\n      \"actions\": [\n        {\n          \"id\": \"1edeaaa8-afc0-44c7-ab7b-bc333261ada8\",\n          \"tips\": \"Commence par 25 minutes et augmente progressivement. Ferme toutes les notifications et onglets inutiles. Informe ton entourage de ton 'mode focus'.\",\n          \"type\": \"habitude\",\n          \"title\": \"Session Focus Immersion (25-45 min)\",\n          \"status\": \"pending\",\n          \"questType\": \"main\",\n          \"rationale\": \"Entra√Æne ton cerveau √† soutenir l'attention sur la dur√©e, brisant le cycle de la procrastination et augmentant l'efficacit√©.\",\n          \"targetReps\": 10,\n          \"description\": \"Engager une p√©riode de travail ininterrompu sur une seule t√¢che, sans distraction. Utilise un minuteur (type Pomodoro ou autre).\",\n          \"isCompleted\": false,\n          \"time_of_day\": \"any_time\",\n          \"tracking_type\": \"counter\"\n        },\n        {\n          \"id\": \"41138db8-10e7-4ed2-ae50-26ab7222d54f\",\n          \"tips\": \"Fais cet exercice le dimanche soir pour la semaine √† venir, ou chaque matin pour la journ√©e.\",\n          \"type\": \"framework\",\n          \"title\": \"La Matrice du Discernement Simplifi√©e\",\n          \"status\": \"pending\",\n          \"questType\": \"side\",\n          \"rationale\": \"Offre une clart√© imm√©diate sur ce qui m√©rite ton √©nergie, r√©duisant le sentiment de d√©bordement et guidant l'action.\",\n          \"targetReps\": 2,\n          \"description\": \"Appliquer une version simplifi√©e de la Matrice d'Eisenhower pour prioriser tes t√¢ches quotidiennes et hebdomadaires : Urgentes/Importantes, Importantes (non urgentes), Urgentes (non importantes), Ni l'un ni l'autre.\",\n          \"isCompleted\": false,\n          \"time_of_day\": \"any_time\",\n          \"tracking_type\": \"counter\",\n          \"frameworkDetails\": {\n            \"type\": \"recurring\",\n            \"intro\": \"L'objectif est de te donner une vision claire de tes priorit√©s. Pour chaque t√¢che, demande-toi : Est-ce Urgent ? Est-ce Important ? Utilise les quatre cat√©gories pour classer.\",\n            \"sections\": [\n              {\n                \"id\": \"s1_p3a2\",\n                \"label\": \"Liste de toutes les t√¢ches √† faire\",\n                \"inputType\": \"list\",\n                \"placeholder\": \"Ex: R√©diger le rapport, Appeler la banque, Pr√©parer le repas\"\n              },\n              {\n                \"id\": \"s2_p3a2\",\n                \"label\": \"Priorisation (T√¢che | Cat√©gorie)\",\n                \"inputType\": \"categorized_list\",\n                \"placeholder\": \"Ex: R√©diger rapport | Important et Urgent\"\n              }\n            ]\n          }\n        }\n      ],\n      \"subtitle\": \"Semaines 5-6 ‚Ä¢ Ma√Ætriser l'art de l'attention\",\n      \"rationale\": \"Tes fondations √©nerg√©tiques √©tant pos√©es, cette phase t'√©quipe des outils pour t'attaquer directement √† la procrastination et √† la d√©sorganisation. Tu apprendras √† d√©couper tes t√¢ches et √† prioriser avec discernement.\"\n    },\n    {\n      \"id\": 4,\n      \"title\": \"Phase 4 : L'Architecte au Quotidien\",\n      \"status\": \"locked\",\n      \"actions\": [\n        {\n          \"id\": \"375171f4-fbb6-4e0e-9db1-86bc8f7d7fe8\",\n          \"tips\": \"Utilise un carnet d√©di√©. Ne cherche pas la perfection, juste la r√©gularit√©. C√©l√®bre les petites victoires.\",\n          \"type\": \"habitude\",\n          \"title\": \"La Revue de Fin de Journ√©e (10 min)\",\n          \"status\": \"pending\",\n          \"questType\": \"main\",\n          \"rationale\": \"Structure la journ√©e suivante, ancre un sentiment d'ach√®vement et renforce la conscience de tes progr√®s, consolidant ainsi la discipline.\",\n          \"targetReps\": 7,\n          \"description\": \"Prendre 10 minutes chaque soir pour planifier la t√¢che principale du lendemain et noter une r√©ussite ou un d√©fi de la journ√©e.\",\n          \"isCompleted\": false,\n          \"time_of_day\": \"evening\",\n          \"tracking_type\": \"boolean\"\n        },\n        {\n          \"id\": \"c4803faa-3c4b-452a-b5c5-e3c804549d01\",\n          \"tips\": \"Choisis des actions qui te sont propres et qui ont d√©j√† fait leurs preuves. Garde cette liste √† port√©e de main.\",\n          \"type\": \"mission\",\n          \"title\": \"Cr√©er ma Trousse de Secours Anti-Procrastination\",\n          \"status\": \"pending\",\n          \"questType\": \"side\",\n          \"rationale\": \"Fournit des outils concrets et imm√©diats pour briser l'inertie de la procrastination, te redonnant le contr√¥le de tes actions.\",\n          \"description\": \"Identifier et lister 3 √† 5 actions rapides et simples √† r√©aliser lorsque la procrastination menace (ex: marcher 5 min, boire un verre d'eau, lancer un timer de 5 min sur une t√¢che).\",\n          \"isCompleted\": false,\n          \"time_of_day\": \"any_time\",\n          \"tracking_type\": \"boolean\"\n        }\n      ],\n      \"subtitle\": \"Semaines 7-8 ‚Ä¢ Consolider et s'adapter\",\n      \"rationale\": \"Ayant construit des fondations solides et affin√© ton focus, cette derni√®re phase vise √† int√©grer ces syst√®mes dans ton quotidien, √† g√©rer les impr√©vus et √† cr√©er une boucle de r√©troaction positive pour une discipline durable.\"\n    }\n  ],\n  \"deepWhy\": \"Retrouver une √©nergie stable pour une vie quotidienne sereine et √™tre pleinement pr√©sente √† mes engagements, sans le poids du d√©bordement et de la procrastination.\",\n  \"identity\": \"Je suis une Architecte de ma Journ√©e.\",\n  \"strategy\": \"On stabilise l'√©nergie et l'environnement pour b√¢tir un socle de discipline in√©branlable, permettant de surmonter la d√©sorganisation et la procrastination.\",\n  \"goldenRules\": \"1. Priorit√© √† l'√©nergie : Mon corps est mon temple.\\n2. Une chose √† la fois : Le focus est ma boussole.\\n3. L'impr√©vu est mon ami : Je m'adapte, je ne panique pas.\",\n  \"vitalSignal\": {\n    \"name\": \"Temps d'√©cran libre\",\n    \"type\": \"constat\",\n    \"unit\": \"min\",\n    \"startValue\": \"240\",\n    \"description\": \"Mesure le temps pass√© sur des applications non essentielles (hors travail), afin de r√©duire la distraction et la fatigue mentale.\",\n    \"targetValue\": \"60\",\n    \"time_of_day\": \"evening\",\n    \"tracking_type\": \"counter\"\n  },\n  \"grimoireTitle\": \"Le Protocole du Ma√Ætre du Temps\",\n  \"context_problem\": \"Tu te sentais constamment sous l'eau, avec une difficult√© √† organiser tes t√¢ches et √† les mener √† bien. L'√©puisement et la distraction par ton t√©l√©phone √©taient devenus des cercles vicieux, t'emp√™chant de retrouver l'√©quilibre et la s√©r√©nit√© que tu souhaitais au quotidien. Cette situation entra√Ænait une baisse d'√©nergie et une instabilit√© quotidienne.\",\n  \"sophiaKnowledge\": \"Tu es une femme de 28 ans (n√©e en janvier 1996) qui se sent d√©bord√©e et fatigu√©e par des journ√©es irr√©guli√®res. Ton manque de focus et de discipline se manifeste par de la d√©sorganisation et de la procrastination, souvent compens√© par l'usage du t√©l√©phone. Tu as une mauvaise qualit√© de sommeil, un niveau de stress √©lev√© et une faible activit√© physique. Tu cherches √† retrouver de l'√©nergie et de la stabilit√© pour une vie quotidienne plus sereine.\",\n  \"maintenanceCheck\": {\n    \"type\": \"surveillance\",\n    \"question\": \"Sur 7 jours, combien de fois as-tu r√©alis√© ta t√¢che prioritaire du jour ?\",\n    \"frequency\": \"hebdomadaire\"\n  },\n  \"estimatedDuration\": \"8 semaines\"\n}\n=== ACTIONS / FRAMEWORKS (√âTAT R√âEL DB) ===\nR√àGLES IMPORTANTES:\n- Les frameworks comptent comme des actions c√¥t√© utilisateur.\n- \"active\" = activ√©e et visible comme active dans l'app. \"pending\" = pas active.\n- On n'active/d√©sactive pas via WhatsApp: la seule mani√®re d'activer/d√©sactiver, c'est depuis le dashboard.\n\nActives (2):\n- [ACTION] Le Couvre-feu Digital Sacr√© (night)\n- [FRAMEWORK] Inventaire des Voleurs de Temps\n\n=== SIGNES VITAUX (√âtat Actuel) ===\n- Temps d'√©cran libre: 240 min\n",
      "template_fingerprint": null
    },
    "scenario_target": "conversation"
  },
  "error": null
}