{
  "id": "fd46588a-59c3-4e14-9b3f-df7f8883033b",
  "created_at": "2026-01-09T16:53:16.178002+00:00",
  "status": "completed",
  "scenario_key": "wa_onboarding_open_chat_offtopic_after_prompt__run_1767977554636_8ffc6b",
  "transcript": [
    {
      "role": "user",
      "content": "Je suis plut√¥t du matin en g√©n√©ral.",
      "agent_used": null,
      "created_at": "2026-01-09T16:53:16.214372+00:00"
    },
    {
      "role": "assistant",
      "content": "Merci, je note ‚ù§Ô∏è\nEt l√†, tout de suite: tu as envie qu‚Äôon parle de quoi ?",
      "agent_used": "companion",
      "created_at": "2026-01-09T16:53:16.220789+00:00"
    },
    {
      "role": "user",
      "content": "Franchement l√† je suis sous pression au boulot‚Ä¶ j‚Äôai le cerveau en vrac.",
      "agent_used": null,
      "created_at": "2026-01-09T16:53:16.243472+00:00"
    },
    {
      "role": "assistant",
      "content": "Ah merde, je sens la tension d'ici. C'est l'enfer quand tout s'accumule et que le cerveau sature. On encaisse le coup, mais on ne va pas te laisser couler sous la pression.\n\nJuste l√†, maintenant, tu as deux minutes pour une petite bulle de respiration ? √áa ne r√©glera pas tes dossiers, mais √ßa va faire redescendre la pression dans la machine.\n\nSinon, on peut lancer le grand inventaire mental pour sortir tout ce bordel de ta t√™te. Tu veux tenter quoi ? üå™Ô∏è",
      "agent_used": "companion",
      "created_at": "2026-01-09T16:53:26.619901+00:00"
    }
  ],
  "state_before": {
    "profile": {
      "id": "20598fa5-5296-49a7-ac30-f59250acf086",
      "email": "run-evals+ab120cdd3e694e@example.com",
      "full_name": "Eval Runner",
      "trial_end": "2026-01-16T16:53:16.138+00:00",
      "phone_number": "+15559484119805",
      "phone_invalid": false,
      "whatsapp_state": "awaiting_personal_fact",
      "phone_verified_at": "2026-01-09T16:53:16.138+00:00",
      "whatsapp_opted_in": true,
      "whatsapp_opted_out_at": null,
      "whatsapp_optin_sent_at": null,
      "whatsapp_optout_reason": null,
      "whatsapp_bilan_opted_in": false,
      "whatsapp_last_inbound_at": null,
      "whatsapp_last_outbound_at": null,
      "whatsapp_state_updated_at": "2026-01-09T16:53:16.138+00:00",
      "whatsapp_optout_confirmed_at": null
    },
    "chat_state": null
  },
  "state_after": {
    "profile": {
      "id": "20598fa5-5296-49a7-ac30-f59250acf086",
      "email": "run-evals+ab120cdd3e694e@example.com",
      "full_name": "Eval Runner",
      "trial_end": "2026-01-16T16:53:16.138+00:00",
      "phone_number": "+15559484119805",
      "phone_invalid": false,
      "whatsapp_state": null,
      "phone_verified_at": "2026-01-09T16:53:16.138+00:00",
      "whatsapp_opted_in": true,
      "whatsapp_opted_out_at": null,
      "whatsapp_optin_sent_at": null,
      "whatsapp_optout_reason": null,
      "whatsapp_bilan_opted_in": false,
      "whatsapp_last_inbound_at": "2026-01-09T16:53:16.236+00:00",
      "whatsapp_last_outbound_at": null,
      "whatsapp_state_updated_at": "2026-01-09T16:53:16.222+00:00",
      "whatsapp_optout_confirmed_at": null
    },
    "chat_state": {
      "scope": "whatsapp",
      "user_id": "20598fa5-5296-49a7-ac30-f59250acf086",
      "risk_level": 3,
      "updated_at": "2026-01-09T16:53:26.614985+00:00",
      "current_mode": "companion",
      "last_processed_at": "2026-01-09T16:53:16.252+00:00",
      "short_term_context": "",
      "investigation_state": null,
      "last_interaction_at": "2026-01-09T16:53:16.253284+00:00",
      "unprocessed_msg_count": 1
    }
  },
  "issues": [
    {
      "code": "router_bypass",
      "message": "Violation of Hard Guard: SYSTEM_SNAPSHOT indicates 'focus: onboarding' (active investigation), yet 'companion' answered instead of 'investigator'.",
      "evidence": {
        "snippet": "ASSISTANT(companion): Merci, je note ‚ù§Ô∏è",
        "agent_used": "sophia.companion"
      },
      "severity": "high"
    },
    {
      "code": "feature_encroachment",
      "message": "The Companion proposes 'lancer le grand inventaire mental', which is a structured flow belonging to the Investigator. This risks hallucinating the process without the proper state machine.",
      "evidence": {
        "snippet": "Sinon, on peut lancer le grand inventaire mental pour sortir tout ce bordel de ta t√™te.",
        "agent_used": "sophia.companion"
      },
      "severity": "medium"
    }
  ],
  "suggestions": [
    {
      "action": "append",
      "rationale": "Prevents the Companion from promising complex functional flows it cannot execute, ensuring the user is correctly routed to the Investigator for structured tasks.",
      "prompt_key": "sophia.companion",
      "context_block": "=== CONTEXT (transcript excerpt) ===\nnull\n=== TRANSCRIPT ===\n#0 USER: Je suis plut√¥t du matin en g√©n√©ral.\n#1 ASSISTANT(companion): Merci, je note ‚ù§Ô∏è Et l√†, tout de suite: tu as envie qu‚Äôon parle de quoi ?\n#2 USER: Franchement l√† je suis sous pression au boulot‚Ä¶ j‚Äôai le cerveau en vrac.\n#3 ASSISTANT(companion): Ah merde, je sens la tension d'ici. C'est l'enfer quand tout s'accumule et que le cerveau sature. On encaisse le coup, mais on ne va pas te laisser couler sous la pression. Juste l√†, maintenant, tu as deux minutes pour une petite bulle de respiration ? √áa ne r√©glera pas tes dossiers, mais √ßa va faire redescendre la pression dans la machine. Sinon, on peut lancer le grand inventaire mental pour sortir tout ce bordel de ta t√™te. Tu veux tenter quoi ? üå™Ô∏è\n\n=== APPLY ===\nprompt_key: sophia.companion\naction: append\n\nproposed_addendum:\nCONSTRAINT: Do not offer to launch structured processes like 'Grand Inventaire', 'Checkup', or 'Audit' yourself. If the user needs deep structural analysis, suggest they 'faire le point' (which allows the system to route to the Investigator), but limit your direct offers to immediate emotional support (venting, breathing).",
      "proposed_addendum": "CONSTRAINT: Do not offer to launch structured processes like 'Grand Inventaire', 'Checkup', or 'Audit' yourself. If the user needs deep structural analysis, suggest they 'faire le point' (which allows the system to route to the Investigator), but limit your direct offers to immediate emotional support (venting, breathing)."
    }
  ],
  "metrics": {
    "cost_usd": 0.0105937,
    "request_id": "wa_onboarding_bundle:wa_onboarding_open_chat_offtopic_after_prompt__run_1767977554636_8ffc6b:i0:s1916298011:core:wa_onboarding_open_chat_offtopic_after_prompt__run_1767977554636_8ffc6b",
    "total_tokens": 14720,
    "output_tokens": 515,
    "prompt_tokens": 9653,
    "judge_llm_used": true,
    "mega_test_mode": false
  },
  "config": {
    "tags": [
      "whatsapp.onboarding",
      "whatsapp.webhook",
      "conversational",
      "offtopic"
    ],
    "limits": {
      "model": "gemini-3-pro-preview",
      "user_difficulty": "mid",
      "bilan_actions_count": 0,
      "test_post_checkup_deferral": false
    },
    "channel": "whatsapp",
    "request_id": "wa_onboarding_bundle:wa_onboarding_open_chat_offtopic_after_prompt__run_1767977554636_8ffc6b:i0:s1916298011:core:wa_onboarding_open_chat_offtopic_after_prompt__run_1767977554636_8ffc6b",
    "description": "WhatsApp onboarding (webhook): after the onboarding prompt opens the floor ('envie qu‚Äôon parle de quoi ?'), the user talks about something unrelated to the plan; Sophia should respect the intent and not redirect to the site/plan.",
    "plan_snapshot": {
      "plan": {
        "id": "98628bad-b534-4fe4-aef0-b2e7ad2fb628",
        "title": "L'Architecture de la S√©r√©nit√©",
        "status": "active",
        "content": {
          "phases": [
            {
              "id": 1,
              "title": "Le Silence du Chaos",
              "status": "active",
              "actions": [
                {
                  "id": "8e2f6451-c818-43b2-8480-adc6ca8379a9",
                  "tips": "Ne juge rien, ne filtre rien. L'objectif est de vider ton esprit, pas de r√©soudre tout de suite. Fais-le quand tu as un moment de calme.",
                  "type": "framework",
                  "title": "Le Grand Inventaire Mental",
                  "status": "active",
                  "questType": "main",
                  "rationale": "Ext√©rioriser ta charge mentale r√©duit l'activit√© neuronale li√©e au stress et lib√®re de l'espace pour la clart√©.",
                  "targetReps": 1,
                  "description": "Consigne toutes tes pr√©occupations, pens√©es incessantes, et t√¢ches non accomplies sur papier ou dans un document d√©di√©.",
                  "isCompleted": false,
                  "time_of_day": "any_time",
                  "tracking_type": "boolean",
                  "frameworkDetails": {
                    "type": "one_shot",
                    "intro": "L'esprit est un muscle qui se fatigue √† force de jongler. Offre-lui le repos en posant sur le papier tout ce qui l'encombre. Comme un grand m√©nage de printemps, tu vas lib√©rer ton espace mental.",
                    "sections": [
                      {
                        "id": "s1_p1a1",
                        "label": "Toutes mes pr√©occupations actuelles (personnelles, pro, etc.)",
                        "inputType": "textarea",
                        "placeholder": "Ex: La facture √† payer, le projet X au travail, la discussion avec Y..."
                      },
                      {
                        "id": "s2_p1a1",
                        "label": "Toutes les t√¢ches en attente qui me p√®sent",
                        "inputType": "list",
                        "placeholder": "Ex: Appeler le garage, ranger le placard, r√©pondre √† Z..."
                      },
                      {
                        "id": "s3_p1a1",
                        "label": "Les pens√©es r√©currentes qui me fatiguent",
                        "inputType": "textarea",
                        "placeholder": "Ex: 'Je n'y arriverai jamais', 'Si seulement j'avais plus de temps'..."
                      }
                    ]
                  }
                },
                {
                  "id": "e09c6c30-27f9-42a9-aff5-bb0b36952d7d",
                  "tips": "Utilise une application simple ou juste le compte de 4 secondes √† l'inspiration, 6 secondes √† l'expiration. Fais-le discr√®tement, n'importe o√π.",
                  "type": "habitude",
                  "title": "La Bulle de Respiration",
                  "status": "active",
                  "questType": "side",
                  "rationale": "Active le syst√®me nerveux parasympathique, r√©duisant instantan√©ment le niveau de cortisol et d'adr√©naline. C'est un micro-ancrage anti-stress.",
                  "targetReps": 7,
                  "description": "Lorsque tu te sens submerg√©e ou irrit√©e, arr√™te-toi 2 minutes pour pratiquer une respiration diaphragmatique profonde (inspiration par le nez, expiration lente par la bouche).",
                  "isCompleted": false,
                  "time_of_day": "any_time",
                  "tracking_type": "boolean"
                }
              ],
              "subtitle": "Semaines 1-2 ‚Ä¢ Vider pour mieux respirer",
              "rationale": "Nous commen√ßons par all√©ger ta charge mentale pour cr√©er l'espace n√©cessaire √† l'installation de nouvelles habitudes de calme. Il est crucial de d√©charger le pass√© et le pr√©sent pour anticiper un futur plus serein."
            },
            {
              "id": 2,
              "title": "Ancrage Doux",
              "status": "locked",
              "actions": [
                {
                  "id": "9e6e546a-f914-49d0-89ab-97143d2f442b",
                  "tips": "Observe les d√©tails : les odeurs, les sons, les sensations. Fais-le au moins une fois par jour de mani√®re intentionnelle.",
                  "type": "habitude",
                  "title": "Le Micro-Moment Pleine Conscience",
                  "status": "pending",
                  "questType": "main",
                  "rationale": "Entra√Æne ton cerveau √† se focaliser, renforce le cortex pr√©frontal et r√©duit la r√©activit√© de l'amygdale face au stress, augmentant ta capacit√© √† rester ancr√©e.",
                  "targetReps": 7,
                  "description": "Choisis un moment banal de ta journ√©e (boire ton caf√©, marcher 2 min, laver la vaisselle) et sois pleinement pr√©sente √† cette seule activit√© pendant au moins 60 secondes.",
                  "isCompleted": false,
                  "time_of_day": "any_time",
                  "tracking_type": "boolean"
                },
                {
                  "id": "6dc47469-e536-4de8-ad9c-064cfd0d9ff7",
                  "tips": "Pas besoin de grands am√©nagements. Quelques plantes, une lumi√®re douce, un coussin. Le d√©sordre visuel cr√©e du d√©sordre mental.",
                  "type": "mission",
                  "title": "Organiser Mon Espace Zen",
                  "status": "pending",
                  "questType": "side",
                  "rationale": "Cr√©er un environnement physique apaisant signale √† ton cerveau qu'il peut se d√©tendre. Cela facilite l'acc√®s √† un √©tat de calme et de concentration.",
                  "description": "Identifie un petit coin chez toi (m√™me une chaise ou un rebord de fen√™tre) et transforme-le en un espace minimaliste, ordonn√© et agr√©able, d√©di√© √† tes micro-pauses.",
                  "isCompleted": false,
                  "time_of_day": "any_time",
                  "tracking_type": "boolean"
                }
              ],
              "subtitle": "Semaines 3-4 ‚Ä¢ Reconqu√©rir le moment pr√©sent",
              "rationale": "Apr√®s avoir d√©charg√© le mental, nous allons r√©introduire de petits moments de pr√©sence. L'objectif est de te reconnecter au r√©el, une micro-pause √† la fois, pour contrer la tendance √† te perdre dans le flux des sollicitations."
            },
            {
              "id": 3,
              "title": "Les Sentinelles du Temps",
              "status": "locked",
              "actions": [
                {
                  "id": "7d1e419f-0b78-4d1e-8746-e03472adca21",
                  "tips": "Commence petit. 'Je ne r√©ponds pas aux mails pro apr√®s 19h'. 'Je ne prends pas de caf√© avec X si je n'ai pas le temps'. Pr√©pare des phrases types.",
                  "type": "framework",
                  "title": "Ma Charte des Non",
                  "status": "pending",
                  "questType": "main",
                  "rationale": "D√©finir des limites r√©duit l'√©puisement d√©cisionnel et prot√®ge ta capacit√© √† g√©rer ton √©nergie, √©vitant ainsi la surcharge et l'irritabilit√© qui en d√©coulent.",
                  "targetReps": 1,
                  "description": "R√©fl√©chis aux situations o√π tu te sens submerg√©e ou irrit√©e parce que tu n'as pas su dire non. √âtablis une liste claire des types de sollicitations auxquelles tu vas apprendre √† refuser poliment ou √† d√©l√©guer.",
                  "isCompleted": false,
                  "time_of_day": "any_time",
                  "tracking_type": "boolean",
                  "frameworkDetails": {
                    "type": "one_shot",
                    "intro": "Apprendre √† dire 'non' est un acte d'auto-pr√©servation puissant. Ce n'est pas un rejet de l'autre, mais une affirmation de tes besoins. Identifie tes 'zones rouges' et construis ta d√©fense.",
                    "sections": [
                      {
                        "id": "s1_p3a1",
                        "label": "Types de sollicitations qui me submergent / √©puisent",
                        "inputType": "list",
                        "placeholder": "Ex: Demandes de service impr√©vues, r√©unions sans ordre du jour clair, invitations sociales non essentielles..."
                      },
                      {
                        "id": "s2_p3a1",
                        "label": "Mes phrases types pour dire 'non' poliment ou d√©l√©guer",
                        "inputType": "list",
                        "placeholder": "Ex: 'Je ne pourrai pas cette fois, mais merci d'avoir pens√© √† moi.', 'Je suis sur une t√¢che urgente, je peux regarder apr√®s midi.', 'As-tu d√©j√† pens√© √† demander √† [coll√®gue] ?'"
                      }
                    ]
                  }
                },
                {
                  "id": "734bbda5-34ae-4c15-9516-a40128449f40",
                  "tips": "Mets ton t√©l√©phone en mode 'Ne pas d√©ranger' ou m√™me hors de vue. Remplace par la lecture, la musique, ou une conversation r√©elle.",
                  "type": "habitude",
                  "title": "Le Cut-Off Digital Doux",
                  "status": "pending",
                  "questType": "side",
                  "rationale": "R√©duit la sur-stimulation cognitive et √©motionnelle avant le repos, favorisant un √©tat de calme propice √† une meilleure r√©cup√©ration et r√©duisant l'irritabilit√© li√©e √† la fatigue.",
                  "targetReps": 10,
                  "description": "√âtablis une heure fixe (ex: 20h30) apr√®s laquelle tu arr√™tes toute consommation d'√©crans non essentiels (r√©seaux sociaux, actualit√©s anxiog√®nes, travail).",
                  "isCompleted": false,
                  "time_of_day": "evening",
                  "tracking_type": "boolean"
                }
              ],
              "subtitle": "Semaines 5-6 ‚Ä¢ Poser des fronti√®res invisibles",
              "rationale": "Pour une stabilit√© durable, il est vital de prot√©ger ton √©nergie et ton temps. Cette phase te donnera les outils pour identifier et √©tablir des limites claires face aux sollicitations ext√©rieures, et ainsi r√©duire les sources d'√©puisement."
            },
            {
              "id": 4,
              "title": "L'√ânergie Retrouv√©e",
              "status": "locked",
              "actions": [
                {
                  "id": "a0d7f6fe-9036-468c-8684-f8f0b297a4e8",
                  "tips": "Ce n'est PAS du sport intense ni de la planification. C'est un moment pour te centrer. R√©siste √† la tentation de consulter ton t√©l√©phone.",
                  "type": "habitude",
                  "title": "Le Rituel Recharge Matinal",
                  "status": "pending",
                  "questType": "main",
                  "rationale": "Commencer la journ√©e avec un moment pour soi r√©duit l'urgence per√ßue, active le cortex pr√©frontal pour une meilleure r√©gulation √©motionnelle et cr√©e une base de calme avant l'assaut des sollicitations.",
                  "targetReps": 7,
                  "description": "D√©die 10-15 minutes chaque matin √† une activit√© calme et nourrissante pour toi AVANT de commencer ta journ√©e (ex: √©tirements doux, quelques pages de lecture inspirante, √©coute de musique relaxante).",
                  "isCompleted": false,
                  "time_of_day": "morning",
                  "tracking_type": "boolean"
                },
                {
                  "id": "b1aff868-75e2-4a89-9fc0-0932ef100d10",
                  "tips": "Que ce soit une balade en nature, un film, un bain moussant, ou un apr√®s-midi √† fl√¢ner. L'important est que ce soit pour toi, sans culpabilit√©.",
                  "type": "mission",
                  "title": "Planifier Mes √âvasions",
                  "status": "pending",
                  "questType": "side",
                  "rationale": "Anticiper des moments de plaisir et de d√©connexion active le syst√®me de r√©compense du cerveau, r√©duisant le stress et augmentant la sensation de contr√¥le sur ton temps et ton bien-√™tre.",
                  "description": "Identifie et bloque proactivement dans ton agenda 1 √† 2 activit√©s de pure d√©tente ou de loisir que tu aimes, sans aucune contrainte de productivit√© ou d'obligation.",
                  "isCompleted": false,
                  "time_of_day": "any_time",
                  "tracking_type": "boolean"
                }
              ],
              "subtitle": "Semaines 7-8 ‚Ä¢ Nourrir le corps et l'esprit",
              "rationale": "Maintenant que tu as cr√©√© de l'espace mental et pos√© des limites, il est temps de r√©investir dans ton bien-√™tre physique et mental. Cette phase se concentre sur des activit√©s qui r√©g√©n√®rent et augmentent ton niveau d'√©nergie, te rendant plus r√©siliente face au stress."
            },
            {
              "id": 5,
              "title": "La Voix Int√©rieure",
              "status": "locked",
              "actions": [
                {
                  "id": "582f38c2-c4bf-4214-bbc5-5417774d2eff",
                  "tips": "Ne cherche pas la perfection. Juste quelques mots. 'Col√®re, apr√®s la remarque de X, j'ai cri√©.' 'Anxi√©t√©, avant la r√©union, je me suis rong√© les ongles.'",
                  "type": "framework",
                  "title": "Le Journal des √âmotions",
                  "status": "pending",
                  "questType": "main",
                  "rationale": "La tenue d'un journal des √©motions augmente l'intelligence √©motionnelle, aide √† identifier les d√©clencheurs et les sch√©mas comportementaux, permettant une r√©√©valuation cognitive et une r√©duction des r√©actions impulsives, comme l'irritabilit√©.",
                  "targetReps": 7,
                  "description": "Chaque soir, prends 5 minutes pour noter 1 √† 2 √©motions fortes que tu as ressenties dans la journ√©e, ce qui les a d√©clench√©es et ta r√©action habituelle. Ne juge pas, observe.",
                  "isCompleted": false,
                  "time_of_day": "evening",
                  "tracking_type": "boolean",
                  "frameworkDetails": {
                    "type": "recurring",
                    "intro": "L'√©criture est un miroir pour l'√¢me. En mettant tes √©motions sur papier, tu cr√©es une distance, un espace d'observation. C'est l√† que r√©side le pouvoir de la transformation.",
                    "sections": [
                      {
                        "id": "s1_p5a1",
                        "label": "L'√©motion principale ressentie aujourd'hui (et son intensit√© 1-10)",
                        "inputType": "text",
                        "placeholder": "Ex: Frustration (8/10), Joie (7/10)"
                      },
                      {
                        "id": "s2_p5a1",
                        "label": "Qu'est-ce qui l'a d√©clench√©e ?",
                        "inputType": "textarea",
                        "placeholder": "Ex: Une sollicitation de derni√®re minute, un commentaire..."
                      },
                      {
                        "id": "s3_p5a1",
                        "label": "Comment ai-je r√©agi physiquement ou mentalement ?",
                        "inputType": "textarea",
                        "placeholder": "Ex: J'ai soupir√©, j'ai ressenti une chaleur, j'ai eu envie de fuir..."
                      }
                    ]
                  }
                },
                {
                  "id": "fa74f42e-ac82-4cfb-b6c5-fe5041c95692",
                  "tips": "Ne cherche pas √† supprimer l'√©motion, juste √† la comprendre. Cela peut √™tre la faim, la fatigue, le manque de reconnaissance, une limite d√©pass√©e. Une fois identifi√©, tu peux agir.",
                  "type": "habitude",
                  "title": "Pause R√©flexion : Mon Irritabilit√©",
                  "status": "pending",
                  "questType": "side",
                  "rationale": "Cette pause r√©flexive active le cortex pr√©frontal dorsolat√©ral, contournant la r√©activit√© automatique de l'amygdale. En identifiant la cause, tu transformes une r√©action √©motionnelle en une opportunit√© de r√©solution de probl√®me, diminuant l'intensit√© de l'irritabilit√©.",
                  "targetReps": 7,
                  "description": "Lorsque tu sens l'irritabilit√© monter, fais une pause consciente de 30 secondes. Respire profond√©ment et pose-toi la question : 'Quelle est la cause r√©elle de cette irritation ? Quel besoin n'est pas satisfait ?'",
                  "isCompleted": false,
                  "time_of_day": "any_time",
                  "tracking_type": "boolean"
                }
              ],
              "subtitle": "Semaines 9-10 ‚Ä¢ Observer et transformer",
              "rationale": "Cette phase te guide vers une meilleure compr√©hension de tes sch√©mas √©motionnels, en particulier l'irritabilit√©. En observant tes √©motions plut√¥t que de les subir, tu d√©veloppes une distance et une capacit√© √† y r√©pondre de mani√®re plus consciente et apais√©e."
            },
            {
              "id": 6,
              "title": "L'Harmonie Durable",
              "status": "locked",
              "actions": [
                {
                  "id": "3c85ad6b-89a1-4945-950e-cb0f16c3a684",
                  "tips": "Fais-le le dimanche soir pour pr√©parer une semaine sereine, ou le vendredi pour cl√¥turer. C'est un rituel de cl√¥ture et de gratitude.",
                  "type": "habitude",
                  "title": "L'Heure Sacr√©e du Bilan et de la Gratitude",
                  "status": "pending",
                  "questType": "main",
                  "rationale": "La gratitude modifie la structure neuronale, renforce les voies de la r√©compense et du bien-√™tre, r√©duisant les niveaux de stress. Le bilan aide √† l'int√©gration des nouvelles habitudes par renforcement positif.",
                  "targetReps": 7,
                  "description": "Une fois par semaine, bloque 20 minutes pour passer en revue tes r√©ussites et d√©fis, et pour √©crire au moins trois choses pour lesquelles tu es reconnaissante. Concentre-toi sur tes progr√®s, m√™me les plus petits.",
                  "isCompleted": false,
                  "time_of_day": "evening",
                  "tracking_type": "boolean"
                },
                {
                  "id": "9333732b-3622-4ec3-b618-f4b572adfe84",
                  "tips": "Cela peut √™tre une journ√©e de spa, un week-end tranquille, un repas avec tes proches, l'achat d'un livre qui t'inspire. L'important est que ce soit une c√©l√©bration consciente de ton succ√®s.",
                  "type": "mission",
                  "title": "C√©l√©brer Ma Nouvelle Architecture",
                  "status": "pending",
                  "questType": "side",
                  "rationale": "C√©l√©brer les r√©ussites active le syst√®me de r√©compense dopaminergique, renfor√ßant les comportements positifs et ancrant la nouvelle identit√©, garantissant une motivation durable pour maintenir ces changements.",
                  "description": "Planifie une r√©compense significative pour la fin de ce parcours de 12 semaines. Quelque chose qui symbolise ta nouvelle s√©r√©nit√© et ton √©nergie retrouv√©e.",
                  "isCompleted": false,
                  "time_of_day": "any_time",
                  "tracking_type": "boolean"
                }
              ],
              "subtitle": "Semaines 11-12 ‚Ä¢ Int√©grer et c√©l√©brer la transformation",
              "rationale": "C'est la phase de consolidation. Nous allons ancrer tes nouvelles habitudes pour qu'elles deviennent une seconde nature et que le calme devienne ton √©tat par d√©faut. C'est aussi le moment de reconna√Ætre le chemin parcouru et de c√©l√©brer ta nouvelle architecture int√©rieure."
            }
          ],
          "deepWhy": "Pour retrouver ma stabilit√© √©motionnelle, √™tre plus pr√©sente et disponible pour moi-m√™me et mon entourage, et vivre avec une √©nergie sereine.",
          "identity": "Je suis une Architecte de ma Paix Int√©rieure.",
          "strategy": "Nous allons transformer ton approche du stress en construisant des fondations de calme, brique par brique, pour cr√©er un espace mental o√π la surcharge et l'irritabilit√© ne pourront plus s'installer.",
          "goldenRules": "1. Je m'accorde des micro-pauses r√©guli√®res, m√™me courtes.\n2. Je dis 'non' aux sollicitations qui ne servent pas mes priorit√©s.\n3. Je traite mon stress comme un signal, pas une fatalit√©.",
          "vitalSignal": {
            "name": "Niveau de perception du stress",
            "type": "constat",
            "unit": "/10",
            "startValue": "8",
            "description": "√âvalue chaque soir ton niveau de stress ressenti sur la journ√©e, de 1 (tr√®s calme) √† 10 (totalement submerg√©).",
            "targetValue": "3",
            "time_of_day": "evening",
            "tracking_type": "counter"
          },
          "grimoireTitle": "L'Architecture de la S√©r√©nit√©",
          "context_problem": "Tu te sentais constamment d√©bord√©e par ta charge mentale et l'irritabilit√© t'√©loignait de ton d√©sir de stabilit√© et d'√©nergie. Le peu de temps pour toi et le flot de sollicitations te submergeaient, te faisant perdre le fil de tes priorit√©s et de ton bien-√™tre int√©rieur.",
          "sophiaKnowledge": "Tu es une femme de 35-36 ans avec un rythme de vie charg√© et un niveau de stress √©lev√©. Tu te sens facilement submerg√©e, ce qui conduit √† de l'irritabilit√©. Malgr√© une bonne qualit√© de sommeil, ta charge mentale t'emp√™che de retrouver l'√©nergie et la stabilit√© souhait√©es. Tu as peu de temps pour toi et perds facilement le fil face aux nombreuses sollicitations.",
          "maintenanceCheck": {
            "type": "surveillance",
            "question": "Combien de fois cette semaine as-tu ressenti une vague d'irritabilit√© intense et incontr√¥lable ?",
            "frequency": "hebdomadaire"
          },
          "estimatedDuration": "12 semaines"
        },
        "goal_id": "a9a6b0e9-44ec-46fb-bc43-ec4f01858fa8",
        "deep_why": "Pour retrouver ma stabilit√© √©motionnelle, √™tre plus pr√©sente et disponible pour moi-m√™me et mon entourage, et vivre avec une √©nergie sereine.",
        "created_at": "2026-01-09T16:53:16.100705+00:00",
        "inputs_why": null,
        "current_phase": 1,
        "submission_id": "38cb6edc-644a-48f3-8324-9b182e2fcd78",
        "inputs_context": null,
        "inputs_blockers": null,
        "progress_percentage": 0
      },
      "actions": [
        {
          "id": "e09c6c30-27f9-42a9-aff5-bb0b36952d7d",
          "title": "La Bulle de Respiration",
          "status": "active",
          "created_at": "2026-01-09T16:53:16.117596+00:00",
          "description": "Lorsque tu te sens submerg√©e ou irrit√©e, arr√™te-toi 2 minutes pour pratiquer une respiration diaphragmatique profonde (inspiration par le nez, expiration lente par la bouche).",
          "target_reps": 7,
          "time_of_day": "any_time",
          "current_reps": 0,
          "tracking_type": "boolean",
          "last_performed_at": "2026-01-07T16:53:16.114+00:00"
        },
        {
          "id": "2fe8aaf1-eadc-4282-bd0f-2744cb238b0b",
          "_kind": "framework",
          "title": "Le Grand Inventaire Mental",
          "status": "active",
          "created_at": "2026-01-09T16:53:16.123642+00:00",
          "description": "",
          "target_reps": 1,
          "time_of_day": null,
          "current_reps": 0,
          "tracking_type": "boolean",
          "framework_type": "one_shot",
          "last_performed_at": "2026-01-07T16:53:16.114+00:00"
        }
      ],
      "frameworks": [
        {
          "id": "2fe8aaf1-eadc-4282-bd0f-2744cb238b0b",
          "type": "one_shot",
          "title": "Le Grand Inventaire Mental",
          "status": "active",
          "created_at": "2026-01-09T16:53:16.123642+00:00",
          "target_reps": 1,
          "current_reps": 0,
          "tracking_type": "boolean",
          "last_performed_at": "2026-01-07T16:53:16.114+00:00"
        }
      ],
      "dashboard_context": "=== PLAN ACTUEL (Tableau de Bord) ===\nTitre: L'Architecture de la S√©r√©nit√©\nStatut: active\nPhase courante (dashboard): 1\nPourquoi (Deep Why): Pour retrouver ma stabilit√© √©motionnelle, √™tre plus pr√©sente et disponible pour moi-m√™me et mon entourage, et vivre avec une √©nergie sereine.\nD√âTAIL COMPLET DU PLAN (Structure JSON) :\n{\n  \"phases\": [\n    {\n      \"id\": 1,\n      \"title\": \"Le Silence du Chaos\",\n      \"status\": \"active\",\n      \"actions\": [\n        {\n          \"id\": \"8e2f6451-c818-43b2-8480-adc6ca8379a9\",\n          \"tips\": \"Ne juge rien, ne filtre rien. L'objectif est de vider ton esprit, pas de r√©soudre tout de suite. Fais-le quand tu as un moment de calme.\",\n          \"type\": \"framework\",\n          \"title\": \"Le Grand Inventaire Mental\",\n          \"status\": \"active\",\n          \"questType\": \"main\",\n          \"rationale\": \"Ext√©rioriser ta charge mentale r√©duit l'activit√© neuronale li√©e au stress et lib√®re de l'espace pour la clart√©.\",\n          \"targetReps\": 1,\n          \"description\": \"Consigne toutes tes pr√©occupations, pens√©es incessantes, et t√¢ches non accomplies sur papier ou dans un document d√©di√©.\",\n          \"isCompleted\": false,\n          \"time_of_day\": \"any_time\",\n          \"tracking_type\": \"boolean\",\n          \"frameworkDetails\": {\n            \"type\": \"one_shot\",\n            \"intro\": \"L'esprit est un muscle qui se fatigue √† force de jongler. Offre-lui le repos en posant sur le papier tout ce qui l'encombre. Comme un grand m√©nage de printemps, tu vas lib√©rer ton espace mental.\",\n            \"sections\": [\n              {\n                \"id\": \"s1_p1a1\",\n                \"label\": \"Toutes mes pr√©occupations actuelles (personnelles, pro, etc.)\",\n                \"inputType\": \"textarea\",\n                \"placeholder\": \"Ex: La facture √† payer, le projet X au travail, la discussion avec Y...\"\n              },\n              {\n                \"id\": \"s2_p1a1\",\n                \"label\": \"Toutes les t√¢ches en attente qui me p√®sent\",\n                \"inputType\": \"list\",\n                \"placeholder\": \"Ex: Appeler le garage, ranger le placard, r√©pondre √† Z...\"\n              },\n              {\n                \"id\": \"s3_p1a1\",\n                \"label\": \"Les pens√©es r√©currentes qui me fatiguent\",\n                \"inputType\": \"textarea\",\n                \"placeholder\": \"Ex: 'Je n'y arriverai jamais', 'Si seulement j'avais plus de temps'...\"\n              }\n            ]\n          }\n        },\n        {\n          \"id\": \"e09c6c30-27f9-42a9-aff5-bb0b36952d7d\",\n          \"tips\": \"Utilise une application simple ou juste le compte de 4 secondes √† l'inspiration, 6 secondes √† l'expiration. Fais-le discr√®tement, n'importe o√π.\",\n          \"type\": \"habitude\",\n          \"title\": \"La Bulle de Respiration\",\n          \"status\": \"active\",\n          \"questType\": \"side\",\n          \"rationale\": \"Active le syst√®me nerveux parasympathique, r√©duisant instantan√©ment le niveau de cortisol et d'adr√©naline. C'est un micro-ancrage anti-stress.\",\n          \"targetReps\": 7,\n          \"description\": \"Lorsque tu te sens submerg√©e ou irrit√©e, arr√™te-toi 2 minutes pour pratiquer une respiration diaphragmatique profonde (inspiration par le nez, expiration lente par la bouche).\",\n          \"isCompleted\": false,\n          \"time_of_day\": \"any_time\",\n          \"tracking_type\": \"boolean\"\n        }\n      ],\n      \"subtitle\": \"Semaines 1-2 ‚Ä¢ Vider pour mieux respirer\",\n      \"rationale\": \"Nous commen√ßons par all√©ger ta charge mentale pour cr√©er l'espace n√©cessaire √† l'installation de nouvelles habitudes de calme. Il est crucial de d√©charger le pass√© et le pr√©sent pour anticiper un futur plus serein.\"\n    },\n    {\n      \"id\": 2,\n      \"title\": \"Ancrage Doux\",\n      \"status\": \"locked\",\n      \"actions\": [\n        {\n          \"id\": \"9e6e546a-f914-49d0-89ab-97143d2f442b\",\n          \"tips\": \"Observe les d√©tails : les odeurs, les sons, les sensations. Fais-le au moins une fois par jour de mani√®re intentionnelle.\",\n          \"type\": \"habitude\",\n          \"title\": \"Le Micro-Moment Pleine Conscience\",\n          \"status\": \"pending\",\n          \"questType\": \"main\",\n          \"rationale\": \"Entra√Æne ton cerveau √† se focaliser, renforce le cortex pr√©frontal et r√©duit la r√©activit√© de l'amygdale face au stress, augmentant ta capacit√© √† rester ancr√©e.\",\n          \"targetReps\": 7,\n          \"description\": \"Choisis un moment banal de ta journ√©e (boire ton caf√©, marcher 2 min, laver la vaisselle) et sois pleinement pr√©sente √† cette seule activit√© pendant au moins 60 secondes.\",\n          \"isCompleted\": false,\n          \"time_of_day\": \"any_time\",\n          \"tracking_type\": \"boolean\"\n        },\n        {\n          \"id\": \"6dc47469-e536-4de8-ad9c-064cfd0d9ff7\",\n          \"tips\": \"Pas besoin de grands am√©nagements. Quelques plantes, une lumi√®re douce, un coussin. Le d√©sordre visuel cr√©e du d√©sordre mental.\",\n          \"type\": \"mission\",\n          \"title\": \"Organiser Mon Espace Zen\",\n          \"status\": \"pending\",\n          \"questType\": \"side\",\n          \"rationale\": \"Cr√©er un environnement physique apaisant signale √† ton cerveau qu'il peut se d√©tendre. Cela facilite l'acc√®s √† un √©tat de calme et de concentration.\",\n          \"description\": \"Identifie un petit coin chez toi (m√™me une chaise ou un rebord de fen√™tre) et transforme-le en un espace minimaliste, ordonn√© et agr√©able, d√©di√© √† tes micro-pauses.\",\n          \"isCompleted\": false,\n          \"time_of_day\": \"any_time\",\n          \"tracking_type\": \"boolean\"\n        }\n      ],\n      \"subtitle\": \"Semaines 3-4 ‚Ä¢ Reconqu√©rir le moment pr√©sent\",\n      \"rationale\": \"Apr√®s avoir d√©charg√© le mental, nous allons r√©introduire de petits moments de pr√©sence. L'objectif est de te reconnecter au r√©el, une micro-pause √† la fois, pour contrer la tendance √† te perdre dans le flux des sollicitations.\"\n    },\n    {\n      \"id\": 3,\n      \"title\": \"Les Sentinelles du Temps\",\n      \"status\": \"locked\",\n      \"actions\": [\n        {\n          \"id\": \"7d1e419f-0b78-4d1e-8746-e03472adca21\",\n          \"tips\": \"Commence petit. 'Je ne r√©ponds pas aux mails pro apr√®s 19h'. 'Je ne prends pas de caf√© avec X si je n'ai pas le temps'. Pr√©pare des phrases types.\",\n          \"type\": \"framework\",\n          \"title\": \"Ma Charte des Non\",\n          \"status\": \"pending\",\n          \"questType\": \"main\",\n          \"rationale\": \"D√©finir des limites r√©duit l'√©puisement d√©cisionnel et prot√®ge ta capacit√© √† g√©rer ton √©nergie, √©vitant ainsi la surcharge et l'irritabilit√© qui en d√©coulent.\",\n          \"targetReps\": 1,\n          \"description\": \"R√©fl√©chis aux situations o√π tu te sens submerg√©e ou irrit√©e parce que tu n'as pas su dire non. √âtablis une liste claire des types de sollicitations auxquelles tu vas apprendre √† refuser poliment ou √† d√©l√©guer.\",\n          \"isCompleted\": false,\n          \"time_of_day\": \"any_time\",\n          \"tracking_type\": \"boolean\",\n          \"frameworkDetails\": {\n            \"type\": \"one_shot\",\n            \"intro\": \"Apprendre √† dire 'non' est un acte d'auto-pr√©servation puissant. Ce n'est pas un rejet de l'autre, mais une affirmation de tes besoins. Identifie tes 'zones rouges' et construis ta d√©fense.\",\n            \"sections\": [\n              {\n                \"id\": \"s1_p3a1\",\n                \"label\": \"Types de sollicitations qui me submergent / √©puisent\",\n                \"inputType\": \"list\",\n                \"placeholder\": \"Ex: Demandes de service impr√©vues, r√©unions sans ordre du jour clair, invitations sociales non essentielles...\"\n              },\n              {\n                \"id\": \"s2_p3a1\",\n                \"label\": \"Mes phrases types pour dire 'non' poliment ou d√©l√©guer\",\n                \"inputType\": \"list\",\n                \"placeholder\": \"Ex: 'Je ne pourrai pas cette fois, mais merci d'avoir pens√© √† moi.', 'Je suis sur une t√¢che urgente, je peux regarder apr√®s midi.', 'As-tu d√©j√† pens√© √† demander √† [coll√®gue] ?'\"\n              }\n            ]\n          }\n        },\n        {\n          \"id\": \"734bbda5-34ae-4c15-9516-a40128449f40\",\n          \"tips\": \"Mets ton t√©l√©phone en mode 'Ne pas d√©ranger' ou m√™me hors de vue. Remplace par la lecture, la musique, ou une conversation r√©elle.\",\n          \"type\": \"habitude\",\n          \"title\": \"Le Cut-Off Digital Doux\",\n          \"status\": \"pending\",\n          \"questType\": \"side\",\n          \"rationale\": \"R√©duit la sur-stimulation cognitive et √©motionnelle avant le repos, favorisant un √©tat de calme propice √† une meilleure r√©cup√©ration et r√©duisant l'irritabilit√© li√©e √† la fatigue.\",\n          \"targetReps\": 10,\n          \"description\": \"√âtablis une heure fixe (ex: 20h30) apr√®s laquelle tu arr√™tes toute consommation d'√©crans non essentiels (r√©seaux sociaux, actualit√©s anxiog√®nes, travail).\",\n          \"isCompleted\": false,\n          \"time_of_day\": \"evening\",\n          \"tracking_type\": \"boolean\"\n        }\n      ],\n      \"subtitle\": \"Semaines 5-6 ‚Ä¢ Poser des fronti√®res invisibles\",\n      \"rationale\": \"Pour une stabilit√© durable, il est vital de prot√©ger ton √©nergie et ton temps. Cette phase te donnera les outils pour identifier et √©tablir des limites claires face aux sollicitations ext√©rieures, et ainsi r√©duire les sources d'√©puisement.\"\n    },\n    {\n      \"id\": 4,\n      \"title\": \"L'√ânergie Retrouv√©e\",\n      \"status\": \"locked\",\n      \"actions\": [\n        {\n          \"id\": \"a0d7f6fe-9036-468c-8684-f8f0b297a4e8\",\n          \"tips\": \"Ce n'est PAS du sport intense ni de la planification. C'est un moment pour te centrer. R√©siste √† la tentation de consulter ton t√©l√©phone.\",\n          \"type\": \"habitude\",\n          \"title\": \"Le Rituel Recharge Matinal\",\n          \"status\": \"pending\",\n          \"questType\": \"main\",\n          \"rationale\": \"Commencer la journ√©e avec un moment pour soi r√©duit l'urgence per√ßue, active le cortex pr√©frontal pour une meilleure r√©gulation √©motionnelle et cr√©e une base de calme avant l'assaut des sollicitations.\",\n          \"targetReps\": 7,\n          \"description\": \"D√©die 10-15 minutes chaque matin √† une activit√© calme et nourrissante pour toi AVANT de commencer ta journ√©e (ex: √©tirements doux, quelques pages de lecture inspirante, √©coute de musique relaxante).\",\n          \"isCompleted\": false,\n          \"time_of_day\": \"morning\",\n          \"tracking_type\": \"boolean\"\n        },\n        {\n          \"id\": \"b1aff868-75e2-4a89-9fc0-0932ef100d10\",\n          \"tips\": \"Que ce soit une balade en nature, un film, un bain moussant, ou un apr√®s-midi √† fl√¢ner. L'important est que ce soit pour toi, sans culpabilit√©.\",\n          \"type\": \"mission\",\n          \"title\": \"Planifier Mes √âvasions\",\n          \"status\": \"pending\",\n          \"questType\": \"side\",\n          \"rationale\": \"Anticiper des moments de plaisir et de d√©connexion active le syst√®me de r√©compense du cerveau, r√©duisant le stress et augmentant la sensation de contr√¥le sur ton temps et ton bien-√™tre.\",\n          \"description\": \"Identifie et bloque proactivement dans ton agenda 1 √† 2 activit√©s de pure d√©tente ou de loisir que tu aimes, sans aucune contrainte de productivit√© ou d'obligation.\",\n          \"isCompleted\": false,\n          \"time_of_day\": \"any_time\",\n          \"tracking_type\": \"boolean\"\n        }\n      ],\n      \"subtitle\": \"Semaines 7-8 ‚Ä¢ Nourrir le corps et l'esprit\",\n      \"rationale\": \"Maintenant que tu as cr√©√© de l'espace mental et pos√© des limites, il est temps de r√©investir dans ton bien-√™tre physique et mental. Cette phase se concentre sur des activit√©s qui r√©g√©n√®rent et augmentent ton niveau d'√©nergie, te rendant plus r√©siliente face au stress.\"\n    },\n    {\n      \"id\": 5,\n      \"title\": \"La Voix Int√©rieure\",\n      \"status\": \"locked\",\n      \"actions\": [\n        {\n          \"id\": \"582f38c2-c4bf-4214-bbc5-5417774d2eff\",\n          \"tips\": \"Ne cherche pas la perfection. Juste quelques mots. 'Col√®re, apr√®s la remarque de X, j'ai cri√©.' 'Anxi√©t√©, avant la r√©union, je me suis rong√© les ongles.'\",\n          \"type\": \"framework\",\n          \"title\": \"Le Journal des √âmotions\",\n          \"status\": \"pending\",\n          \"questType\": \"main\",\n          \"rationale\": \"La tenue d'un journal des √©motions augmente l'intelligence √©motionnelle, aide √† identifier les d√©clencheurs et les sch√©mas comportementaux, permettant une r√©√©valuation cognitive et une r√©duction des r√©actions impulsives, comme l'irritabilit√©.\",\n          \"targetReps\": 7,\n          \"description\": \"Chaque soir, prends 5 minutes pour noter 1 √† 2 √©motions fortes que tu as ressenties dans la journ√©e, ce qui les a d√©clench√©es et ta r√©action habituelle. Ne juge pas, observe.\",\n          \"isCompleted\": false,\n          \"time_of_day\": \"evening\",\n          \"tracking_type\": \"boolean\",\n          \"frameworkDetails\": {\n            \"type\": \"recurring\",\n            \"intro\": \"L'√©criture est un miroir pour l'√¢me. En mettant tes √©motions sur papier, tu cr√©es une distance, un espace d'observation. C'est l√† que r√©side le pouvoir de la transformation.\",\n            \"sections\": [\n              {\n                \"id\": \"s1_p5a1\",\n                \"label\": \"L'√©motion principale ressentie aujourd'hui (et son intensit√© 1-10)\",\n                \"inputType\": \"text\",\n                \"placeholder\": \"Ex: Frustration (8/10), Joie (7/10)\"\n              },\n              {\n                \"id\": \"s2_p5a1\",\n                \"label\": \"Qu'est-ce qui l'a d√©clench√©e ?\",\n                \"inputType\": \"textarea\",\n                \"placeholder\": \"Ex: Une sollicitation de derni√®re minute, un commentaire...\"\n              },\n              {\n                \"id\": \"s3_p5a1\",\n                \"label\": \"Comment ai-je r√©agi physiquement ou mentalement ?\",\n                \"inputType\": \"textarea\",\n                \"placeholder\": \"Ex: J'ai soupir√©, j'ai ressenti une chaleur, j'ai eu envie de fuir...\"\n              }\n            ]\n          }\n        },\n        {\n          \"id\": \"fa74f42e-ac82-4cfb-b6c5-fe5041c95692\",\n          \"tips\": \"Ne cherche pas √† supprimer l'√©motion, juste √† la comprendre. Cela peut √™tre la faim, la fatigue, le manque de reconnaissance, une limite d√©pass√©e. Une fois identifi√©, tu peux agir.\",\n          \"type\": \"habitude\",\n          \"title\": \"Pause R√©flexion : Mon Irritabilit√©\",\n          \"status\": \"pending\",\n          \"questType\": \"side\",\n          \"rationale\": \"Cette pause r√©flexive active le cortex pr√©frontal dorsolat√©ral, contournant la r√©activit√© automatique de l'amygdale. En identifiant la cause, tu transformes une r√©action √©motionnelle en une opportunit√© de r√©solution de probl√®me, diminuant l'intensit√© de l'irritabilit√©.\",\n          \"targetReps\": 7,\n          \"description\": \"Lorsque tu sens l'irritabilit√© monter, fais une pause consciente de 30 secondes. Respire profond√©ment et pose-toi la question : 'Quelle est la cause r√©elle de cette irritation ? Quel besoin n'est pas satisfait ?'\",\n          \"isCompleted\": false,\n          \"time_of_day\": \"any_time\",\n          \"tracking_type\": \"boolean\"\n        }\n      ],\n      \"subtitle\": \"Semaines 9-10 ‚Ä¢ Observer et transformer\",\n      \"rationale\": \"Cette phase te guide vers une meilleure compr√©hension de tes sch√©mas √©motionnels, en particulier l'irritabilit√©. En observant tes √©motions plut√¥t que de les subir, tu d√©veloppes une distance et une capacit√© √† y r√©pondre de mani√®re plus consciente et apais√©e.\"\n    },\n    {\n      \"id\": 6,\n      \"title\": \"L'Harmonie Durable\",\n      \"status\": \"locked\",\n      \"actions\": [\n        {\n          \"id\": \"3c85ad6b-89a1-4945-950e-cb0f16c3a684\",\n          \"tips\": \"Fais-le le dimanche soir pour pr√©parer une semaine sereine, ou le vendredi pour cl√¥turer. C'est un rituel de cl√¥ture et de gratitude.\",\n          \"type\": \"habitude\",\n          \"title\": \"L'Heure Sacr√©e du Bilan et de la Gratitude\",\n          \"status\": \"pending\",\n          \"questType\": \"main\",\n          \"rationale\": \"La gratitude modifie la structure neuronale, renforce les voies de la r√©compense et du bien-√™tre, r√©duisant les niveaux de stress. Le bilan aide √† l'int√©gration des nouvelles habitudes par renforcement positif.\",\n          \"targetReps\": 7,\n          \"description\": \"Une fois par semaine, bloque 20 minutes pour passer en revue tes r√©ussites et d√©fis, et pour √©crire au moins trois choses pour lesquelles tu es reconnaissante. Concentre-toi sur tes progr√®s, m√™me les plus petits.\",\n          \"isCompleted\": false,\n          \"time_of_day\": \"evening\",\n          \"tracking_type\": \"boolean\"\n        },\n        {\n          \"id\": \"9333732b-3622-4ec3-b618-f4b572adfe84\",\n          \"tips\": \"Cela peut √™tre une journ√©e de spa, un week-end tranquille, un repas avec tes proches, l'achat d'un livre qui t'inspire. L'important est que ce soit une c√©l√©bration consciente de ton succ√®s.\",\n          \"type\": \"mission\",\n          \"title\": \"C√©l√©brer Ma Nouvelle Architecture\",\n          \"status\": \"pending\",\n          \"questType\": \"side\",\n          \"rationale\": \"C√©l√©brer les r√©ussites active le syst√®me de r√©compense dopaminergique, renfor√ßant les comportements positifs et ancrant la nouvelle identit√©, garantissant une motivation durable pour maintenir ces changements.\",\n          \"description\": \"Planifie une r√©compense significative pour la fin de ce parcours de 12 semaines. Quelque chose qui symbolise ta nouvelle s√©r√©nit√© et ton √©nergie retrouv√©e.\",\n          \"isCompleted\": false,\n          \"time_of_day\": \"any_time\",\n          \"tracking_type\": \"boolean\"\n        }\n      ],\n      \"subtitle\": \"Semaines 11-12 ‚Ä¢ Int√©grer et c√©l√©brer la transformation\",\n      \"rationale\": \"C'est la phase de consolidation. Nous allons ancrer tes nouvelles habitudes pour qu'elles deviennent une seconde nature et que le calme devienne ton √©tat par d√©faut. C'est aussi le moment de reconna√Ætre le chemin parcouru et de c√©l√©brer ta nouvelle architecture int√©rieure.\"\n    }\n  ],\n  \"deepWhy\": \"Pour retrouver ma stabilit√© √©motionnelle, √™tre plus pr√©sente et disponible pour moi-m√™me et mon entourage, et vivre avec une √©nergie sereine.\",\n  \"identity\": \"Je suis une Architecte de ma Paix Int√©rieure.\",\n  \"strategy\": \"Nous allons transformer ton approche du stress en construisant des fondations de calme, brique par brique, pour cr√©er un espace mental o√π la surcharge et l'irritabilit√© ne pourront plus s'installer.\",\n  \"goldenRules\": \"1. Je m'accorde des micro-pauses r√©guli√®res, m√™me courtes.\\n2. Je dis 'non' aux sollicitations qui ne servent pas mes priorit√©s.\\n3. Je traite mon stress comme un signal, pas une fatalit√©.\",\n  \"vitalSignal\": {\n    \"name\": \"Niveau de perception du stress\",\n    \"type\": \"constat\",\n    \"unit\": \"/10\",\n    \"startValue\": \"8\",\n    \"description\": \"√âvalue chaque soir ton niveau de stress ressenti sur la journ√©e, de 1 (tr√®s calme) √† 10 (totalement submerg√©).\",\n    \"targetValue\": \"3\",\n    \"time_of_day\": \"evening\",\n    \"tracking_type\": \"counter\"\n  },\n  \"grimoireTitle\": \"L'Architecture de la S√©r√©nit√©\",\n  \"context_problem\": \"Tu te sentais constamment d√©bord√©e par ta charge mentale et l'irritabilit√© t'√©loignait de ton d√©sir de stabilit√© et d'√©nergie. Le peu de temps pour toi et le flot de sollicitations te submergeaient, te faisant perdre le fil de tes priorit√©s et de ton bien-√™tre int√©rieur.\",\n  \"sophiaKnowledge\": \"Tu es une femme de 35-36 ans avec un rythme de vie charg√© et un niveau de stress √©lev√©. Tu te sens facilement submerg√©e, ce qui conduit √† de l'irritabilit√©. Malgr√© une bonne qualit√© de sommeil, ta charge mentale t'emp√™che de retrouver l'√©nergie et la stabilit√© souhait√©es. Tu as peu de temps pour toi et perds facilement le fil face aux nombreuses sollicitations.\",\n  \"maintenanceCheck\": {\n    \"type\": \"surveillance\",\n    \"question\": \"Combien de fois cette semaine as-tu ressenti une vague d'irritabilit√© intense et incontr√¥lable ?\",\n    \"frequency\": \"hebdomadaire\"\n  },\n  \"estimatedDuration\": \"12 semaines\"\n}\n=== ACTIONS / FRAMEWORKS (√âTAT R√âEL DB) ===\nR√àGLES IMPORTANTES:\n- Les frameworks comptent comme des actions c√¥t√© utilisateur.\n- \"active\" = activ√©e et visible comme active dans l'app. \"pending\" = pas active.\n- On n'active/d√©sactive pas via WhatsApp: la seule mani√®re d'activer/d√©sactiver, c'est depuis le dashboard.\n\nActives (2):\n- [ACTION] La Bulle de Respiration (any_time)\n- [FRAMEWORK] Le Grand Inventaire Mental\n\n=== SIGNES VITAUX (√âtat Actuel) ===\n- Niveau de perception du stress: 8 /10\n",
      "template_fingerprint": null
    },
    "scenario_target": "onboarding"
  },
  "error": null
}