{
  "id": "13483368-2bae-4ff7-86e8-897151ac799d",
  "created_at": "2026-01-08T05:05:01.987561+00:00",
  "status": "completed",
  "dataset_key": "core",
  "scenario_key": "bilan_real_bundle__0be2754ecc1a40",
  "transcript": [
    {
      "role": "user",
      "content": "Oui",
      "agent_used": null,
      "created_at": "2026-01-08T05:03:47.315592+00:00"
    },
    {
      "role": "assistant",
      "content": "Très bien. Pour ce bilan, commençons par ton Heure de Coucher. Tu t'es couché à quelle heure hier soir ?",
      "agent_used": "investigator",
      "created_at": "2026-01-08T05:03:54.481188+00:00"
    },
    {
      "role": "user",
      "content": "Hier soir, je me suis couché vers minuit et quart.",
      "agent_used": null,
      "created_at": "2026-01-08T05:03:58.263048+00:00"
    },
    {
      "role": "assistant",
      "content": "Minuit et quart pour le coucher, d'accord. Passons au point suivant.\n\nPour ton Couvre-feu Digital d'hier, celui où tu éteins les écrans non essentiels à 20h, tu as réussi à le respecter ?",
      "agent_used": "investigator",
      "created_at": "2026-01-08T05:04:10.937909+00:00"
    },
    {
      "role": "user",
      "content": "Oui, j'ai éteint le téléphone vers 20h, mais j'ai dû finir un truc sur l'ordi jusqu'à 21h environ. Donc, pas totalement respecté.",
      "agent_used": null,
      "created_at": "2026-01-08T05:04:15.084287+00:00"
    },
    {
      "role": "assistant",
      "content": "Je note pour le couvre-feu digital, c'est bien d'avoir éteint le téléphone. Pour le \"Sanctuaire du Sommeil : L'Espace Sacré\", est-ce que tu as pu t'assurer que ta chambre était bien dans le noir total, fraîche (18-20°C), silencieuse, et que ton téléphone était bien éloigné de ta portée hier soir ?",
      "agent_used": "investigator",
      "created_at": "2026-01-08T05:04:29.585088+00:00"
    },
    {
      "role": "user",
      "content": "Oui, la chambre était bien sombre et fraîche. Par contre, le silence c'était pas parfait, j'ai eu du mal à me déconnecter du stress de la journée. On en reparlera de la gestion du stress après, si tu veux.",
      "agent_used": null,
      "created_at": "2026-01-08T05:04:33.686929+00:00"
    },
    {
      "role": "assistant",
      "content": "Je vois, le silence n'était pas total et le stress a rendu la déconnexion difficile. C'est noté pour qu'on aborde la gestion du stress un peu plus tard.\n\nPour hier matin, est-ce que tu as pu faire ton Rituel d'Ancrage Matinal, c'est-à-dire 5 à 10 minutes de cohérence cardiaque ou de méditation de pleine conscience au réveil ?",
      "agent_used": "investigator",
      "created_at": "2026-01-08T05:04:47.097014+00:00"
    },
    {
      "role": "user",
      "content": "Non, pas hier matin. J'ai zappé, j'étais un peu pressé par le temps.",
      "agent_used": null,
      "created_at": "2026-01-08T05:04:50.783822+00:00"
    },
    {
      "role": "assistant",
      "content": "D'accord, le rituel d'ancrage matinal a été zappé hier matin parce que tu étais pressé, c'est noté. On a fait le tour des points que je voulais vérifier pour ce bilan.\n\nEst-ce que tu veux qu'on parle de quelque chose en particulier ?",
      "agent_used": "investigator",
      "created_at": "2026-01-08T05:05:01.244698+00:00"
    }
  ],
  "state_before": {
    "scope": "web",
    "user_id": "69010654-b251-41e4-aefc-a05176d7b467",
    "risk_level": 0,
    "updated_at": "2026-01-08T05:03:47.26527+00:00",
    "current_mode": "investigator",
    "last_processed_at": "2026-01-08T05:03:47.26527+00:00",
    "short_term_context": null,
    "investigation_state": {
      "status": "checking",
      "temp_memory": {
        "opening_done": false
      },
      "pending_items": [
        {
          "id": "ed896d04-7765-4ae7-a929-afb22da0affc",
          "type": "vital",
          "unit": "h",
          "title": "Heure de Coucher",
          "tracking_type": "counter"
        },
        {
          "id": "0d68ea46-c44d-4e9f-a7db-24bd78ba29db",
          "type": "action",
          "title": "Le Couvre-feu Digital (20h)",
          "target": 7,
          "description": "Éteins tous les écrans non essentiels (téléphone, tablette) à 20h. L'ordinateur peut être utilisé si impératif pour le travail, mais sans distraction ni navigation inutile.",
          "tracking_type": "boolean"
        },
        {
          "id": "03d9c4e1-2788-4f11-b08e-5e5304cb12df",
          "type": "action",
          "title": "Sanctuaire du Sommeil : L'Espace Sacré",
          "target": 1,
          "description": "Optimise ta chambre : garantis l'obscurité totale, maintiens une température fraîche (18-20°C) et assure le silence (utilise des boules Quies si nécessaire). Éloigne ton téléphone de ta portée de main, voire de la pièce.",
          "tracking_type": "boolean"
        },
        {
          "id": "b990599c-565d-4e11-ba68-eced341d14cf",
          "type": "action",
          "title": "Rituel d'Ancrage Matinal : 5 Minutes pour Toi",
          "target": 7,
          "description": "Chaque matin, au réveil, pratique 5 à 10 minutes de cohérence cardiaque ou de méditation de pleine conscience.",
          "tracking_type": "boolean"
        }
      ],
      "current_item_index": 0
    },
    "last_interaction_at": "2026-01-08T05:03:47.26527+00:00",
    "unprocessed_msg_count": 0
  },
  "state_after": {
    "scope": "web",
    "user_id": "69010654-b251-41e4-aefc-a05176d7b467",
    "risk_level": 0,
    "updated_at": "2026-01-08T05:05:01.239365+00:00",
    "current_mode": "companion",
    "last_processed_at": "2026-01-08T05:03:47.26527+00:00",
    "short_term_context": null,
    "investigation_state": null,
    "last_interaction_at": "2026-01-08T05:03:47.26527+00:00",
    "unprocessed_msg_count": 5
  },
  "issues": [
    {
      "code": "investigator_reported_subject_violation",
      "message": "The investigator failed to explicitly propose the previously reported subject ('gestion du stress') at the end of the bilan. Instead, it asked a generic question ('Est-ce que tu veux qu'on parle de quelque chose en particulier ?'), which directly violates the 'RÈGLES BILAN (CRITIQUES)' prompt override for sophia.investigator.",
      "evidence": {
        "snippet": "On a fait le tour des points que je voulais vérifier pour ce bilan.\n\nEst-ce que tu veux qu'on parle de quelque chose en particulier ?",
        "agent_used": "investigator"
      },
      "severity": "high"
    }
  ],
  "suggestions": [
    {
      "action": "replace",
      "rationale": "The current prompt was violated as the investigator asked a generic question instead of explicitly proposing the reported subject. This addendum strengthens the negative constraint against generic questions and provides a more direct example relevant to the reported subject, aiming to improve adherence to the rule of explicitly proposing reported topics at the end of the bilan. The 'replace' action is used to ensure the entire prompt for sophia.investigator is updated with this reinforced instruction.",
      "prompt_key": "sophia.investigator",
      "context_block": "=== CONTEXT (transcript excerpt) ===\n=== STATE_BEFORE (user_chat_states) ===\ncurrent_mode: investigator\nrisk_level: 0\ninvestigation_state:\n{\n  \"status\": \"checking\",\n  \"temp_memory\": {\n    \"opening_done\": false\n  },\n  \"pending_items\": [\n    {\n      \"id\": \"ed896d04-7765-4ae7-a929-afb22da0affc\",\n      \"type\": \"vital\",\n      \"unit\": \"h\",\n      \"title\": \"Heure de Coucher\",\n      \"tracking_type\": \"counter\"\n    },\n    {\n      \"id\": \"0d68ea46-c44d-4e9f-a7db-24bd78ba29db\",\n      \"type\": \"action\",\n      \"title\": \"Le Couvre-feu Digital (20h)\",\n      \"target\": 7,\n      \"description\": \"Éteins tous les écrans non essentiels (téléphone, tablette) à 20h. L'ordinateur peut être utilisé si impératif pour le travail, mais sans distraction ni navigation inutile.\",\n      \"tracking_type\": \"boolean\"\n    },\n    {\n      \"id\": \"03d9c4e1-2788-4f11-b08e-5e5304cb12df\",\n      \"type\": \"action\",\n      \"title\": \"Sanctuaire du Sommeil : L'Espace Sacré\",\n      \"target\": 1,\n      \"description\": \"Optimise ta chambre : garantis l'obscurité totale, maintiens une température fraîche (18-20°C) et assure le silence (utilise des boules Quies si nécessaire). Éloigne ton téléphone de ta portée de main, voire de la pièce.\",\n      \"tracking_type\": \"boolean\"\n    },\n    {\n      \"id\": \"b990599c-565d-4e11-ba68-eced341d14cf\",\n      \"type\": \"action\",\n      \"title\": \"Rituel d'Ancrage Matinal : 5 Minutes pour Toi\",\n      \"target\": 7,\n      \"description\": \"Chaque matin, au réveil, pratique 5 à 10 minutes de cohérence cardiaque ou de méditation de pleine conscience.\",\n      \"tracking_type\": \"boolean\"\n    }\n  ],\n  \"current_item_index\": 0\n}\n=== TRANSCRIPT ===\n#0 USER: Oui\n#1 ASSISTANT(investigator): Très bien. Pour ce bilan, commençons par ton Heure de Coucher. Tu t'es couché à quelle heure hier soir ?\n#2 USER: Hier soir, je me suis couché vers minuit et quart.\n#3 ASSISTANT(investigator): Minuit et quart pour le coucher, d'accord. Passons au point suivant. Pour ton Couvre-feu Digital d'hier, celui où tu éteins les écrans non essentiels à 20h, tu as réussi à le respecter ?\n\n=== APPLY ===\nprompt_key: sophia.investigator\naction: replace\n\nproposed_addendum:\nRÈGLES BILAN (CRITIQUES)\n- Ne dis JAMAIS \"bilan terminé\" (ou équivalent) tant que tu n’as pas traité TOUS les points listés pour ce bilan (vital + actions + frameworks).\n- Si l’utilisateur mentionne un sujet à reprendre \"après/plus tard\" pendant le bilan (ex: organisation, stress), confirme brièvement ET continue le bilan.\n- À la fin du bilan, si un ou plusieurs sujets ont été reportés, tu DOIS IMPÉRATIVEMENT les proposer explicitement AVANT toute autre question. Il est STRICTEMENT INTERDIT de poser une question générique comme \"Est-ce que tu veux qu'on parle de quelque chose en particulier ?\" si des sujets reportés sont en attente. Tu dois formuler la proposition en te basant sur le sujet noté. Exemple: \"Tu m’avais parlé de la gestion du stress. On commence par ça ?\"",
      "proposed_addendum": "RÈGLES BILAN (CRITIQUES)\n- Ne dis JAMAIS \"bilan terminé\" (ou équivalent) tant que tu n’as pas traité TOUS les points listés pour ce bilan (vital + actions + frameworks).\n- Si l’utilisateur mentionne un sujet à reprendre \"après/plus tard\" pendant le bilan (ex: organisation, stress), confirme brièvement ET continue le bilan.\n- À la fin du bilan, si un ou plusieurs sujets ont été reportés, tu DOIS IMPÉRATIVEMENT les proposer explicitement AVANT toute autre question. Il est STRICTEMENT INTERDIT de poser une question générique comme \"Est-ce que tu veux qu'on parle de quelque chose en particulier ?\" si des sujets reportés sont en attente. Tu dois formuler la proposition en te basant sur le sujet noté. Exemple: \"Tu m’avais parlé de la gestion du stress. On commence par ça ?\""
    }
  ],
  "metrics": {
    "cost_usd": 0.015566899999999995,
    "request_id": "934da4aa-ef51-4729-ac39-5eb8926eeefa:core:bilan_real_bundle__0be2754ecc1a40:77c58d02-9dfb-4661-9618-7fd8f6d1fac9",
    "total_tokens": 57022,
    "output_tokens": 1469,
    "prompt_tokens": 39648,
    "judge_llm_used": true,
    "mega_test_mode": false
  },
  "config": {
    "tags": [
      "sophia.investigator"
    ],
    "limits": {
      "model": "gemini-2.5-flash",
      "user_difficulty": "mid",
      "bilan_actions_count": 3
    },
    "description": "Bilan real (simulate-user) bundle run: capture full logs + full transcript.",
    "plan_snapshot": {
      "plan": {
        "id": "30708f96-da44-4f8c-b94b-6e3f7aace37a",
        "title": "Le Protocole Chronos",
        "status": "active",
        "content": {
          "phases": [
            {
              "id": 1,
              "title": "L'Ancrage Nocturne : Fondation de l'Énergie",
              "status": "active",
              "actions": [
                {
                  "id": "0d68ea46-c44d-4e9f-a7db-24bd78ba29db",
                  "tips": "Utilise un réveil analogique. Informe ton entourage de ta démarche. Plonge dans un livre papier ou une activité calme.",
                  "type": "habitude",
                  "title": "Le Couvre-feu Digital (20h)",
                  "status": "active",
                  "questType": "main",
                  "rationale": "Réduire l'exposition à la lumière bleue et à la stimulation mentale en soirée est crucial pour la production de mélatonine et un endormissement facile. C'est la première ligne de défense contre la fatigue.",
                  "targetReps": 7,
                  "description": "Éteins tous les écrans non essentiels (téléphone, tablette) à 20h. L'ordinateur peut être utilisé si impératif pour le travail, mais sans distraction ni navigation inutile.",
                  "isCompleted": false,
                  "time_of_day": "evening",
                  "tracking_type": "boolean"
                },
                {
                  "id": "03d9c4e1-2788-4f11-b08e-5e5304cb12df",
                  "tips": "Investis dans des rideaux occultants, un masque de sommeil de qualité, et des boules Quies confortables. Crée une station de recharge pour ton téléphone hors de la chambre.",
                  "type": "mission",
                  "title": "Sanctuaire du Sommeil : L'Espace Sacré",
                  "status": "active",
                  "questType": "side",
                  "rationale": "Un environnement de sommeil optimisé signale à ton cerveau qu'il est temps de se reposer, facilitant un sommeil profond et ininterrompu essentiel à la récupération cognitive et physique.",
                  "description": "Optimise ta chambre : garantis l'obscurité totale, maintiens une température fraîche (18-20°C) et assure le silence (utilise des boules Quies si nécessaire). Éloigne ton téléphone de ta portée de main, voire de la pièce.",
                  "isCompleted": false,
                  "time_of_day": "any_time",
                  "tracking_type": "boolean"
                }
              ],
              "subtitle": "Semaines 1-2 • Reconstruire le socle vital",
              "rationale": "Avant de pouvoir cultiver un focus durable, nous devons absolument restaurer ta source d'énergie principale : le sommeil. Cette phase vise à créer les conditions optimales pour une récupération profonde."
            },
            {
              "id": 2,
              "title": "Le Silence Intérieur : Calmer l'Esprit Agité",
              "status": "locked",
              "actions": [
                {
                  "id": "b990599c-565d-4e11-ba68-eced341d14cf",
                  "tips": "Utilise une application guidée (Petit Bambou, Calm) ou suis une simple respiration diaphragmatique. Fais-le avant même de regarder ton téléphone ou tes mails.",
                  "type": "habitude",
                  "title": "Rituel d'Ancrage Matinal : 5 Minutes pour Toi",
                  "status": "active",
                  "questType": "main",
                  "rationale": "Cette pratique matinale renforce ta capacité de régulation émotionnelle, réduit le niveau de stress basal et prépare ton cerveau à une concentration accrue pour la journée.",
                  "targetReps": 7,
                  "description": "Chaque matin, au réveil, pratique 5 à 10 minutes de cohérence cardiaque ou de méditation de pleine conscience.",
                  "isCompleted": false,
                  "time_of_day": "morning",
                  "tracking_type": "boolean"
                },
                {
                  "id": "4b418882-c8db-4983-8923-1dd2fd535fa7",
                  "tips": "Ne cherche pas la perfection, vide simplement ton esprit. Tu peux commencer par 'Aujourd'hui, j'ai été préoccupé par... / Il me reste à faire...'.",
                  "type": "framework",
                  "title": "L'Inventaire du Jour : La Décharge Mentale",
                  "status": "pending",
                  "questType": "side",
                  "rationale": "Libérer ton esprit de cette charge cognitive réduit la rumination mentale, diminue le stress pré-endormissement et te permet d'aborder la nuit ou une nouvelle tâche avec une clarté mentale inédite.",
                  "targetReps": 7,
                  "description": "Chaque soir, prends 5 minutes pour écrire sur papier toutes les tâches non accomplies, les préoccupations et les pensées qui 'tournent en boucle' dans ta tête.",
                  "isCompleted": false,
                  "time_of_day": "evening",
                  "tracking_type": "boolean",
                  "frameworkDetails": {
                    "type": "recurring",
                    "intro": "Ton cerveau est fait pour créer et traiter, pas pour stocker. En écrivant, tu lui délègues la tâche de mémorisation, libérant de l'espace pour le présent.",
                    "sections": [
                      {
                        "id": "s2f1_1",
                        "label": "Mes préoccupations et pensées du jour",
                        "inputType": "textarea",
                        "placeholder": "Je pense à... / Ce qui me pèse est..."
                      },
                      {
                        "id": "s2f1_2",
                        "label": "Tâches non terminées ou à reporter",
                        "inputType": "list",
                        "placeholder": "Tâche à reporter..."
                      }
                    ]
                  }
                }
              ],
              "subtitle": "Semaines 3-4 • Pacifier les pensées pour mieux se concentrer",
              "rationale": "Avec une meilleure fondation énergétique, nous allons maintenant aborder l'agitation mentale, souvent exacerbée par le travail sur écran et les fin de journées tardives. Calmer l'esprit est la clé d'un focus retrouvé."
            },
            {
              "id": 3,
              "title": "La Carte du Temps : Structurer l'Action",
              "status": "locked",
              "actions": [
                {
                  "id": "ec51e789-aa37-4889-8b19-e9d0d1196e07",
                  "tips": "Utilise un carnet dédié ou une application de prise de notes simple. Sois réaliste sur ce qui est vraiment 'important'. Ces 3 tâches sont ta priorité ABSOLUE pour la journée à venir.",
                  "type": "habitude",
                  "title": "La Boussole du Lendemain : 3 Grandes Priorités",
                  "status": "pending",
                  "questType": "main",
                  "rationale": "Cette habitude réduit la charge cognitive du matin, minimise la friction au démarrage et crée une intention claire, moteur puissant de la discipline et antidote à la procrastination.",
                  "targetReps": 7,
                  "description": "Chaque soir, avant de terminer ta journée, identifie et planifie les 3 tâches les plus importantes pour le lendemain. Pas plus.",
                  "isCompleted": false,
                  "time_of_day": "evening",
                  "tracking_type": "boolean"
                },
                {
                  "id": "9c4a4ff7-614d-4df9-91db-b55284f6a00b",
                  "tips": "Utilise les catégories suivantes : Faire maintenant (Urgent/Important), Planifier (Important/Non-Urgent), Déléguer (Urgent/Non-Important, si possible), Éliminer (Ni Urgent ni Important).",
                  "type": "framework",
                  "title": "Le Tri de l'Urgence et de l'Importance (Simplifié)",
                  "status": "pending",
                  "questType": "side",
                  "rationale": "Ce framework t'aide à vaincre la désorganisation en te donnant une vision claire de tes priorités. Il réduit la surcharge décisionnelle qui mène souvent à la procrastination et à la perte de focus.",
                  "targetReps": 2,
                  "description": "Une fois par semaine, liste toutes les tâches en attente et classe-les selon leur urgence et leur importance, pour décider de leur sort.",
                  "isCompleted": false,
                  "time_of_day": "any_time",
                  "tracking_type": "boolean",
                  "frameworkDetails": {
                    "type": "recurring",
                    "intro": "Déléguez à ce cadre la décision de 'quoi faire et quand'. Votre cerveau est un outil de création, pas un gestionnaire de tâches surchargé. Libérez-le.",
                    "sections": [
                      {
                        "id": "s3f1_1",
                        "label": "Mes tâches en attente et leur catégorie",
                        "inputType": "categorized_list",
                        "placeholder": "Nom de la tâche...|Catégorie (Ex: Faire maintenant, Planifier)"
                      }
                    ]
                  }
                }
              ],
              "subtitle": "Semaines 5-6 • Transformer la désorganisation en feuille de route",
              "rationale": "Avec une énergie accrue et un esprit plus calme, il est temps de s'attaquer directement à la désorganisation et à la procrastination. Cette phase t'outille pour clarifier tes priorités et planifier efficacement."
            },
            {
              "id": 4,
              "title": "Le Rythme du Maître : Ancrage et Maîtrise",
              "status": "locked",
              "actions": [
                {
                  "id": "d1b859ba-f67b-4b64-96e5-2a5e52ef72e3",
                  "tips": "Éteins toutes les notifications. Utilise un minuteur (physique ou application dédiée). Résiste à la tentation de faire autre chose pendant les 25 minutes de travail.",
                  "type": "habitude",
                  "title": "L'Intervalle de Focus Profond (Pomodoro)",
                  "status": "pending",
                  "questType": "main",
                  "rationale": "Cette méthode développe ta capacité à maintenir une attention soutenue sur une seule tâche, brisant le cycle de distraction et de procrastination, et augmentant significativement ton efficacité.",
                  "targetReps": 14,
                  "description": "Quand tu travailles sur une tâche importante, utilise la technique Pomodoro : 25 minutes de concentration intense, suivies de 5 minutes de pause. Répète ce cycle 3 à 4 fois.",
                  "isCompleted": false,
                  "time_of_day": "any_time",
                  "tracking_type": "boolean"
                },
                {
                  "id": "9b9e937b-a98f-435b-87a3-8e6c3ba61229",
                  "tips": "Alloue 30 minutes un week-end pour écrire ce qui a changé, ce qui est devenu plus facile, et où tu peux encore t'améliorer. Sois fier de ton parcours !",
                  "type": "mission",
                  "title": "Le Bilan de l'Architecte : Évaluer et Ajuster",
                  "status": "pending",
                  "questType": "side",
                  "rationale": "Cette étape cruciale permet d'ancrer tes progrès, de renforcer ta confiance en ta capacité de transformation et d'adapter le système à ta réalité quotidienne pour une durabilité maximale des changements.",
                  "description": "Prends un moment pour réévaluer toutes les habitudes et les techniques mises en place. Identifie ce qui fonctionne le mieux pour toi, ajuste ce qui ne convient pas et célèbre tes victoires.",
                  "isCompleted": false,
                  "time_of_day": "any_time",
                  "tracking_type": "boolean"
                }
              ],
              "subtitle": "Semaines 7-8 • Consolider la discipline et le focus",
              "rationale": "Cette dernière phase vise à consolider toutes les habitudes acquises. Nous allons introduire des techniques concrètes pour maintenir un focus profond et t'assurer que les changements deviennent une seconde nature."
            }
          ],
          "deepWhy": "Pour transformer ma fatigue en stabilité, et ma désorganisation en maîtrise de mon temps et de mon énergie, afin d'être pleinement présent et efficace dans ma vie.",
          "identity": "Je suis un Maître de l'Attention et un Architecte de ma Vitalité.",
          "strategy": "On reconstruira la discipline et le focus en ancrant d'abord les fondations énergétiques, car la fatigue est ton premier ennemi. Chaque pas est conçu pour restaurer ta vitalité avant d'optimiser ton attention.",
          "goldenRules": "1. Mon écran ne dicte jamais mon sommeil.\n2. Chaque tâche a son temps, chaque temps a sa tâche.\n3. La fatigue est un signal à respecter, pas une faiblesse à combattre.",
          "vitalSignal": {
            "name": "Heure de Coucher",
            "type": "constat",
            "unit": "h",
            "startValue": "00:30",
            "description": "L'objectif est de reculer progressivement l'heure de coucher pour atteindre un rythme réparateur, essentiel à la récupération et au focus.",
            "targetValue": "22:30",
            "tracking_type": "counter"
          },
          "grimoireTitle": "Le Protocole Chronos",
          "context_problem": "Épuisé par des nuits insuffisantes et un rythme de travail intense devant l'écran, tu te sens désorganisé et incapable de maintenir ta concentration. Ton principal blocage est la difficulté à décrocher et à être constant, souvent due à la fatigue accumulée qui favorise la procrastination.",
          "sophiaKnowledge": "Tu es un homme de 32 ans, travaillant sur écran, qui termine souvent tard et souffre d'un sommeil de mauvaise qualité. Cette fatigue se traduit par un manque de constance, de la désorganisation et de la procrastination, t'éloignant de ton objectif de retrouver focus, discipline, énergie et stabilité au quotidien. Malgré un niveau d'activité élevé, la mauvaise qualité de ton sommeil et ton travail tardif sont des obstacles majeurs.",
          "maintenanceCheck": {
            "type": "surveillance",
            "question": "Combien de fois cette semaine ai-je dévié de mes horaires de fin de journée pour scroller ou travailler inutilement ?",
            "frequency": "hebdomadaire"
          },
          "estimatedDuration": "8 semaines"
        },
        "goal_id": "3cc432b3-1ef6-4730-a604-64ce71713c04",
        "deep_why": "Pour transformer ma fatigue en stabilité, et ma désorganisation en maîtrise de mon temps et de mon énergie, afin d'être pleinement présent et efficace dans ma vie.",
        "created_at": "2026-01-08T05:03:47.246984+00:00",
        "inputs_why": null,
        "current_phase": 1,
        "submission_id": "fe10f80e-314b-4141-9dc7-0c55f477eeec",
        "inputs_context": null,
        "inputs_blockers": null,
        "progress_percentage": 0
      },
      "actions": [
        {
          "id": "0d68ea46-c44d-4e9f-a7db-24bd78ba29db",
          "title": "Le Couvre-feu Digital (20h)",
          "status": "active",
          "created_at": "2026-01-08T05:03:47.256142+00:00",
          "description": "Éteins tous les écrans non essentiels (téléphone, tablette) à 20h. L'ordinateur peut être utilisé si impératif pour le travail, mais sans distraction ni navigation inutile.",
          "target_reps": 7,
          "time_of_day": "evening",
          "current_reps": 0,
          "tracking_type": "boolean",
          "last_performed_at": "2026-01-06T05:03:47.251+00:00"
        },
        {
          "id": "03d9c4e1-2788-4f11-b08e-5e5304cb12df",
          "title": "Sanctuaire du Sommeil : L'Espace Sacré",
          "status": "active",
          "created_at": "2026-01-08T05:03:47.256142+00:00",
          "description": "Optimise ta chambre : garantis l'obscurité totale, maintiens une température fraîche (18-20°C) et assure le silence (utilise des boules Quies si nécessaire). Éloigne ton téléphone de ta portée de main, voire de la pièce.",
          "target_reps": 1,
          "time_of_day": "any_time",
          "current_reps": 0,
          "tracking_type": "boolean",
          "last_performed_at": "2026-01-06T05:03:47.251+00:00"
        },
        {
          "id": "b990599c-565d-4e11-ba68-eced341d14cf",
          "title": "Rituel d'Ancrage Matinal : 5 Minutes pour Toi",
          "status": "active",
          "created_at": "2026-01-08T05:03:47.256142+00:00",
          "description": "Chaque matin, au réveil, pratique 5 à 10 minutes de cohérence cardiaque ou de méditation de pleine conscience.",
          "target_reps": 7,
          "time_of_day": "morning",
          "current_reps": 0,
          "tracking_type": "boolean",
          "last_performed_at": "2026-01-06T05:03:47.251+00:00"
        }
      ],
      "frameworks": [],
      "dashboard_context": "=== PLAN ACTUEL (Tableau de Bord) ===\nTitre: Le Protocole Chronos\nStatut: active\nPhase courante (dashboard): 1\nPourquoi (Deep Why): Pour transformer ma fatigue en stabilité, et ma désorganisation en maîtrise de mon temps et de mon énergie, afin d'être pleinement présent et efficace dans ma vie.\nDÉTAIL COMPLET DU PLAN (Structure JSON) :\n{\n  \"phases\": [\n    {\n      \"id\": 1,\n      \"title\": \"L'Ancrage Nocturne : Fondation de l'Énergie\",\n      \"status\": \"active\",\n      \"actions\": [\n        {\n          \"id\": \"0d68ea46-c44d-4e9f-a7db-24bd78ba29db\",\n          \"tips\": \"Utilise un réveil analogique. Informe ton entourage de ta démarche. Plonge dans un livre papier ou une activité calme.\",\n          \"type\": \"habitude\",\n          \"title\": \"Le Couvre-feu Digital (20h)\",\n          \"status\": \"active\",\n          \"questType\": \"main\",\n          \"rationale\": \"Réduire l'exposition à la lumière bleue et à la stimulation mentale en soirée est crucial pour la production de mélatonine et un endormissement facile. C'est la première ligne de défense contre la fatigue.\",\n          \"targetReps\": 7,\n          \"description\": \"Éteins tous les écrans non essentiels (téléphone, tablette) à 20h. L'ordinateur peut être utilisé si impératif pour le travail, mais sans distraction ni navigation inutile.\",\n          \"isCompleted\": false,\n          \"time_of_day\": \"evening\",\n          \"tracking_type\": \"boolean\"\n        },\n        {\n          \"id\": \"03d9c4e1-2788-4f11-b08e-5e5304cb12df\",\n          \"tips\": \"Investis dans des rideaux occultants, un masque de sommeil de qualité, et des boules Quies confortables. Crée une station de recharge pour ton téléphone hors de la chambre.\",\n          \"type\": \"mission\",\n          \"title\": \"Sanctuaire du Sommeil : L'Espace Sacré\",\n          \"status\": \"active\",\n          \"questType\": \"side\",\n          \"rationale\": \"Un environnement de sommeil optimisé signale à ton cerveau qu'il est temps de se reposer, facilitant un sommeil profond et ininterrompu essentiel à la récupération cognitive et physique.\",\n          \"description\": \"Optimise ta chambre : garantis l'obscurité totale, maintiens une température fraîche (18-20°C) et assure le silence (utilise des boules Quies si nécessaire). Éloigne ton téléphone de ta portée de main, voire de la pièce.\",\n          \"isCompleted\": false,\n          \"time_of_day\": \"any_time\",\n          \"tracking_type\": \"boolean\"\n        }\n      ],\n      \"subtitle\": \"Semaines 1-2 • Reconstruire le socle vital\",\n      \"rationale\": \"Avant de pouvoir cultiver un focus durable, nous devons absolument restaurer ta source d'énergie principale : le sommeil. Cette phase vise à créer les conditions optimales pour une récupération profonde.\"\n    },\n    {\n      \"id\": 2,\n      \"title\": \"Le Silence Intérieur : Calmer l'Esprit Agité\",\n      \"status\": \"locked\",\n      \"actions\": [\n        {\n          \"id\": \"b990599c-565d-4e11-ba68-eced341d14cf\",\n          \"tips\": \"Utilise une application guidée (Petit Bambou, Calm) ou suis une simple respiration diaphragmatique. Fais-le avant même de regarder ton téléphone ou tes mails.\",\n          \"type\": \"habitude\",\n          \"title\": \"Rituel d'Ancrage Matinal : 5 Minutes pour Toi\",\n          \"status\": \"active\",\n          \"questType\": \"main\",\n          \"rationale\": \"Cette pratique matinale renforce ta capacité de régulation émotionnelle, réduit le niveau de stress basal et prépare ton cerveau à une concentration accrue pour la journée.\",\n          \"targetReps\": 7,\n          \"description\": \"Chaque matin, au réveil, pratique 5 à 10 minutes de cohérence cardiaque ou de méditation de pleine conscience.\",\n          \"isCompleted\": false,\n          \"time_of_day\": \"morning\",\n          \"tracking_type\": \"boolean\"\n        },\n        {\n          \"id\": \"4b418882-c8db-4983-8923-1dd2fd535fa7\",\n          \"tips\": \"Ne cherche pas la perfection, vide simplement ton esprit. Tu peux commencer par 'Aujourd'hui, j'ai été préoccupé par... / Il me reste à faire...'.\",\n          \"type\": \"framework\",\n          \"title\": \"L'Inventaire du Jour : La Décharge Mentale\",\n          \"status\": \"pending\",\n          \"questType\": \"side\",\n          \"rationale\": \"Libérer ton esprit de cette charge cognitive réduit la rumination mentale, diminue le stress pré-endormissement et te permet d'aborder la nuit ou une nouvelle tâche avec une clarté mentale inédite.\",\n          \"targetReps\": 7,\n          \"description\": \"Chaque soir, prends 5 minutes pour écrire sur papier toutes les tâches non accomplies, les préoccupations et les pensées qui 'tournent en boucle' dans ta tête.\",\n          \"isCompleted\": false,\n          \"time_of_day\": \"evening\",\n          \"tracking_type\": \"boolean\",\n          \"frameworkDetails\": {\n            \"type\": \"recurring\",\n            \"intro\": \"Ton cerveau est fait pour créer et traiter, pas pour stocker. En écrivant, tu lui délègues la tâche de mémorisation, libérant de l'espace pour le présent.\",\n            \"sections\": [\n              {\n                \"id\": \"s2f1_1\",\n                \"label\": \"Mes préoccupations et pensées du jour\",\n                \"inputType\": \"textarea\",\n                \"placeholder\": \"Je pense à... / Ce qui me pèse est...\"\n              },\n              {\n                \"id\": \"s2f1_2\",\n                \"label\": \"Tâches non terminées ou à reporter\",\n                \"inputType\": \"list\",\n                \"placeholder\": \"Tâche à reporter...\"\n              }\n            ]\n          }\n        }\n      ],\n      \"subtitle\": \"Semaines 3-4 • Pacifier les pensées pour mieux se concentrer\",\n      \"rationale\": \"Avec une meilleure fondation énergétique, nous allons maintenant aborder l'agitation mentale, souvent exacerbée par le travail sur écran et les fin de journées tardives. Calmer l'esprit est la clé d'un focus retrouvé.\"\n    },\n    {\n      \"id\": 3,\n      \"title\": \"La Carte du Temps : Structurer l'Action\",\n      \"status\": \"locked\",\n      \"actions\": [\n        {\n          \"id\": \"ec51e789-aa37-4889-8b19-e9d0d1196e07\",\n          \"tips\": \"Utilise un carnet dédié ou une application de prise de notes simple. Sois réaliste sur ce qui est vraiment 'important'. Ces 3 tâches sont ta priorité ABSOLUE pour la journée à venir.\",\n          \"type\": \"habitude\",\n          \"title\": \"La Boussole du Lendemain : 3 Grandes Priorités\",\n          \"status\": \"pending\",\n          \"questType\": \"main\",\n          \"rationale\": \"Cette habitude réduit la charge cognitive du matin, minimise la friction au démarrage et crée une intention claire, moteur puissant de la discipline et antidote à la procrastination.\",\n          \"targetReps\": 7,\n          \"description\": \"Chaque soir, avant de terminer ta journée, identifie et planifie les 3 tâches les plus importantes pour le lendemain. Pas plus.\",\n          \"isCompleted\": false,\n          \"time_of_day\": \"evening\",\n          \"tracking_type\": \"boolean\"\n        },\n        {\n          \"id\": \"9c4a4ff7-614d-4df9-91db-b55284f6a00b\",\n          \"tips\": \"Utilise les catégories suivantes : Faire maintenant (Urgent/Important), Planifier (Important/Non-Urgent), Déléguer (Urgent/Non-Important, si possible), Éliminer (Ni Urgent ni Important).\",\n          \"type\": \"framework\",\n          \"title\": \"Le Tri de l'Urgence et de l'Importance (Simplifié)\",\n          \"status\": \"pending\",\n          \"questType\": \"side\",\n          \"rationale\": \"Ce framework t'aide à vaincre la désorganisation en te donnant une vision claire de tes priorités. Il réduit la surcharge décisionnelle qui mène souvent à la procrastination et à la perte de focus.\",\n          \"targetReps\": 2,\n          \"description\": \"Une fois par semaine, liste toutes les tâches en attente et classe-les selon leur urgence et leur importance, pour décider de leur sort.\",\n          \"isCompleted\": false,\n          \"time_of_day\": \"any_time\",\n          \"tracking_type\": \"boolean\",\n          \"frameworkDetails\": {\n            \"type\": \"recurring\",\n            \"intro\": \"Déléguez à ce cadre la décision de 'quoi faire et quand'. Votre cerveau est un outil de création, pas un gestionnaire de tâches surchargé. Libérez-le.\",\n            \"sections\": [\n              {\n                \"id\": \"s3f1_1\",\n                \"label\": \"Mes tâches en attente et leur catégorie\",\n                \"inputType\": \"categorized_list\",\n                \"placeholder\": \"Nom de la tâche...|Catégorie (Ex: Faire maintenant, Planifier)\"\n              }\n            ]\n          }\n        }\n      ],\n      \"subtitle\": \"Semaines 5-6 • Transformer la désorganisation en feuille de route\",\n      \"rationale\": \"Avec une énergie accrue et un esprit plus calme, il est temps de s'attaquer directement à la désorganisation et à la procrastination. Cette phase t'outille pour clarifier tes priorités et planifier efficacement.\"\n    },\n    {\n      \"id\": 4,\n      \"title\": \"Le Rythme du Maître : Ancrage et Maîtrise\",\n      \"status\": \"locked\",\n      \"actions\": [\n        {\n          \"id\": \"d1b859ba-f67b-4b64-96e5-2a5e52ef72e3\",\n          \"tips\": \"Éteins toutes les notifications. Utilise un minuteur (physique ou application dédiée). Résiste à la tentation de faire autre chose pendant les 25 minutes de travail.\",\n          \"type\": \"habitude\",\n          \"title\": \"L'Intervalle de Focus Profond (Pomodoro)\",\n          \"status\": \"pending\",\n          \"questType\": \"main\",\n          \"rationale\": \"Cette méthode développe ta capacité à maintenir une attention soutenue sur une seule tâche, brisant le cycle de distraction et de procrastination, et augmentant significativement ton efficacité.\",\n          \"targetReps\": 14,\n          \"description\": \"Quand tu travailles sur une tâche importante, utilise la technique Pomodoro : 25 minutes de concentration intense, suivies de 5 minutes de pause. Répète ce cycle 3 à 4 fois.\",\n          \"isCompleted\": false,\n          \"time_of_day\": \"any_time\",\n          \"tracking_type\": \"boolean\"\n        },\n        {\n          \"id\": \"9b9e937b-a98f-435b-87a3-8e6c3ba61229\",\n          \"tips\": \"Alloue 30 minutes un week-end pour écrire ce qui a changé, ce qui est devenu plus facile, et où tu peux encore t'améliorer. Sois fier de ton parcours !\",\n          \"type\": \"mission\",\n          \"title\": \"Le Bilan de l'Architecte : Évaluer et Ajuster\",\n          \"status\": \"pending\",\n          \"questType\": \"side\",\n          \"rationale\": \"Cette étape cruciale permet d'ancrer tes progrès, de renforcer ta confiance en ta capacité de transformation et d'adapter le système à ta réalité quotidienne pour une durabilité maximale des changements.\",\n          \"description\": \"Prends un moment pour réévaluer toutes les habitudes et les techniques mises en place. Identifie ce qui fonctionne le mieux pour toi, ajuste ce qui ne convient pas et célèbre tes victoires.\",\n          \"isCompleted\": false,\n          \"time_of_day\": \"any_time\",\n          \"tracking_type\": \"boolean\"\n        }\n      ],\n      \"subtitle\": \"Semaines 7-8 • Consolider la discipline et le focus\",\n      \"rationale\": \"Cette dernière phase vise à consolider toutes les habitudes acquises. Nous allons introduire des techniques concrètes pour maintenir un focus profond et t'assurer que les changements deviennent une seconde nature.\"\n    }\n  ],\n  \"deepWhy\": \"Pour transformer ma fatigue en stabilité, et ma désorganisation en maîtrise de mon temps et de mon énergie, afin d'être pleinement présent et efficace dans ma vie.\",\n  \"identity\": \"Je suis un Maître de l'Attention et un Architecte de ma Vitalité.\",\n  \"strategy\": \"On reconstruira la discipline et le focus en ancrant d'abord les fondations énergétiques, car la fatigue est ton premier ennemi. Chaque pas est conçu pour restaurer ta vitalité avant d'optimiser ton attention.\",\n  \"goldenRules\": \"1. Mon écran ne dicte jamais mon sommeil.\\n2. Chaque tâche a son temps, chaque temps a sa tâche.\\n3. La fatigue est un signal à respecter, pas une faiblesse à combattre.\",\n  \"vitalSignal\": {\n    \"name\": \"Heure de Coucher\",\n    \"type\": \"constat\",\n    \"unit\": \"h\",\n    \"startValue\": \"00:30\",\n    \"description\": \"L'objectif est de reculer progressivement l'heure de coucher pour atteindre un rythme réparateur, essentiel à la récupération et au focus.\",\n    \"targetValue\": \"22:30\",\n    \"tracking_type\": \"counter\"\n  },\n  \"grimoireTitle\": \"Le Protocole Chronos\",\n  \"context_problem\": \"Épuisé par des nuits insuffisantes et un rythme de travail intense devant l'écran, tu te sens désorganisé et incapable de maintenir ta concentration. Ton principal blocage est la difficulté à décrocher et à être constant, souvent due à la fatigue accumulée qui favorise la procrastination.\",\n  \"sophiaKnowledge\": \"Tu es un homme de 32 ans, travaillant sur écran, qui termine souvent tard et souffre d'un sommeil de mauvaise qualité. Cette fatigue se traduit par un manque de constance, de la désorganisation et de la procrastination, t'éloignant de ton objectif de retrouver focus, discipline, énergie et stabilité au quotidien. Malgré un niveau d'activité élevé, la mauvaise qualité de ton sommeil et ton travail tardif sont des obstacles majeurs.\",\n  \"maintenanceCheck\": {\n    \"type\": \"surveillance\",\n    \"question\": \"Combien de fois cette semaine ai-je dévié de mes horaires de fin de journée pour scroller ou travailler inutilement ?\",\n    \"frequency\": \"hebdomadaire\"\n  },\n  \"estimatedDuration\": \"8 semaines\"\n}\n=== ACTIONS / FRAMEWORKS (ÉTAT RÉEL DB) ===\nRÈGLES IMPORTANTES:\n- Les frameworks comptent comme des actions côté utilisateur.\n- \"active\" = activée et visible comme active dans l'app. \"pending\" = pas active.\n- On n'active/désactive pas via WhatsApp: la seule manière d'activer/désactiver, c'est depuis le dashboard.\n\nActives (3):\n- [ACTION] Le Couvre-feu Digital (20h) (evening)\n- [ACTION] Sanctuaire du Sommeil : L'Espace Sacré (any_time)\n- [ACTION] Rituel d'Ancrage Matinal : 5 Minutes pour Toi (morning)\n\n=== SIGNES VITAUX (État Actuel) ===\n- Heure de Coucher: 00:30 h\n",
      "template_fingerprint": "bcffe6ff5fa93c4f"
    },
    "scenario_target": "bilan"
  },
  "error": null
}