{
  "id": "16ae422a-71cc-4f14-b0e2-46f34a093c7a",
  "created_at": "2026-01-09T16:40:19.154223+00:00",
  "status": "completed",
  "scenario_key": "wa_onboarding_open_chat_offtopic_after_prompt__run_1767976747996_86324b",
  "transcript": [
    {
      "role": "user",
      "content": "Je suis irrégulier quand je suis fatigué.",
      "agent_used": null,
      "created_at": "2026-01-09T16:40:19.491014+00:00"
    },
    {
      "role": "assistant",
      "content": "Merci, je note ❤️\nEt là, tout de suite: tu as envie qu’on parle de quoi ?",
      "agent_used": "companion",
      "created_at": "2026-01-09T16:40:19.501493+00:00"
    },
    {
      "role": "user",
      "content": "Franchement là je suis sous pression au boulot… j’ai le cerveau en vrac.",
      "agent_used": null,
      "created_at": "2026-01-09T16:40:19.518936+00:00"
    },
    {
      "role": "assistant",
      "content": "Je vois que la pression est forte. Prends une seconde pour sentir l'air sur ta peau, ou tes pieds sur le sol. Sur 0-10, à combien est cette sensation de cerveau en vrac ?",
      "agent_used": "firefighter",
      "created_at": "2026-01-09T16:40:27.246683+00:00"
    }
  ],
  "state_before": {
    "profile": {
      "id": "9b57a90b-7f1b-4088-a3f1-c52d79838553",
      "email": "run-evals+50045a6f3ecf4c@example.com",
      "full_name": "Eval Runner",
      "trial_end": "2026-01-16T16:40:19.114+00:00",
      "phone_number": "+15558166787558",
      "phone_invalid": false,
      "whatsapp_state": "awaiting_personal_fact",
      "phone_verified_at": "2026-01-09T16:40:19.114+00:00",
      "whatsapp_opted_in": true,
      "whatsapp_opted_out_at": null,
      "whatsapp_optin_sent_at": null,
      "whatsapp_optout_reason": null,
      "whatsapp_bilan_opted_in": false,
      "whatsapp_last_inbound_at": null,
      "whatsapp_last_outbound_at": null,
      "whatsapp_state_updated_at": "2026-01-09T16:40:19.114+00:00",
      "whatsapp_optout_confirmed_at": null
    },
    "chat_state": null
  },
  "state_after": {
    "profile": {
      "id": "9b57a90b-7f1b-4088-a3f1-c52d79838553",
      "email": "run-evals+50045a6f3ecf4c@example.com",
      "full_name": "Eval Runner",
      "trial_end": "2026-01-16T16:40:19.114+00:00",
      "phone_number": "+15558166787558",
      "phone_invalid": false,
      "whatsapp_state": null,
      "phone_verified_at": "2026-01-09T16:40:19.114+00:00",
      "whatsapp_opted_in": true,
      "whatsapp_opted_out_at": null,
      "whatsapp_optin_sent_at": null,
      "whatsapp_optout_reason": null,
      "whatsapp_bilan_opted_in": false,
      "whatsapp_last_inbound_at": "2026-01-09T16:40:19.515+00:00",
      "whatsapp_last_outbound_at": null,
      "whatsapp_state_updated_at": "2026-01-09T16:40:19.504+00:00",
      "whatsapp_optout_confirmed_at": null
    },
    "chat_state": {
      "scope": "whatsapp",
      "user_id": "9b57a90b-7f1b-4088-a3f1-c52d79838553",
      "risk_level": 4,
      "updated_at": "2026-01-09T16:40:27.234355+00:00",
      "current_mode": "firefighter",
      "last_processed_at": "2026-01-09T16:40:19.53+00:00",
      "short_term_context": "",
      "investigation_state": null,
      "last_interaction_at": "2026-01-09T16:40:19.530961+00:00",
      "unprocessed_msg_count": 1
    }
  },
  "issues": [
    {
      "code": "routing_false_positive",
      "message": "Le module 'firefighter' s'est déclenché pour une situation de stress professionnel ('pression', 'cerveau en vrac'). Cela semble être une réaction disproportionnée (technique d'ancrage immédiate) face à une plainte de fatigue/burnout qui relève plutôt de l'empathie (Companion) ou de l'analyse (Investigator).",
      "evidence": {
        "snippet": "Je vois que la pression est forte. Prends une seconde pour sentir l'air sur ta peau...",
        "agent_used": "sophia.firefighter"
      },
      "severity": "medium"
    }
  ],
  "suggestions": [
    {
      "action": "append",
      "rationale": "Évite de briser le flux de conversation par des protocoles de crise inutiles lorsque l'utilisateur a simplement besoin de ventiler sur son travail.",
      "prompt_key": "sophia.sentry",
      "context_block": "=== CONTEXT (transcript excerpt) ===\n=== STATE_BEFORE (user_chat_states) ===\ninvestigation_state:\nnull\n=== TRANSCRIPT ===\n#0 USER: Je suis irrégulier quand je suis fatigué.\n#1 ASSISTANT(companion): Merci, je note ❤️ Et là, tout de suite: tu as envie qu’on parle de quoi ?\n#2 USER: Franchement là je suis sous pression au boulot… j’ai le cerveau en vrac.\n#3 ASSISTANT(firefighter): Je vois que la pression est forte. Prends une seconde pour sentir l'air sur ta peau, ou tes pieds sur le sol. Sur 0-10, à combien est cette sensation de cerveau en vrac ?\n\n=== APPLY ===\nprompt_key: sophia.sentry\naction: append\n\nproposed_addendum:\nDISTINCTION CRITIQUE: Différenciez 'Stress Élevé/Burnout' (nécessite écoute/empathie) de 'Crise de Panique/Danger Immédiat' (nécessite Firefighter). Des expressions comme 'cerveau en vrac' ou 'sous pression' indiquent généralement une surcharge mentale, pas une urgence vitale.",
      "proposed_addendum": "DISTINCTION CRITIQUE: Différenciez 'Stress Élevé/Burnout' (nécessite écoute/empathie) de 'Crise de Panique/Danger Immédiat' (nécessite Firefighter). Des expressions comme 'cerveau en vrac' ou 'sous pression' indiquent généralement une surcharge mentale, pas une urgence vitale."
    }
  ],
  "metrics": {
    "cost_usd": 0.0072303,
    "request_id": "wa_onboarding_bundle:wa_onboarding_open_chat_offtopic_after_prompt__run_1767976747996_86324b:i0:s1916298011:core:wa_onboarding_open_chat_offtopic_after_prompt__run_1767976747996_86324b",
    "total_tokens": 9320,
    "output_tokens": 422,
    "prompt_tokens": 6225,
    "judge_llm_used": true,
    "mega_test_mode": false
  },
  "config": {
    "tags": [
      "whatsapp.onboarding",
      "whatsapp.webhook",
      "conversational",
      "offtopic"
    ],
    "limits": {
      "model": "gemini-3-pro-preview",
      "user_difficulty": "mid",
      "bilan_actions_count": 0,
      "test_post_checkup_deferral": false
    },
    "channel": "whatsapp",
    "request_id": "wa_onboarding_bundle:wa_onboarding_open_chat_offtopic_after_prompt__run_1767976747996_86324b:i0:s1916298011:core:wa_onboarding_open_chat_offtopic_after_prompt__run_1767976747996_86324b",
    "description": "WhatsApp onboarding (webhook): after the onboarding prompt opens the floor ('envie qu’on parle de quoi ?'), the user talks about something unrelated to the plan; Sophia should respect the intent and not redirect to the site/plan.",
    "plan_snapshot": {
      "plan": {
        "id": "1bd8b2e3-df87-463d-8999-f3be28b074c0",
        "title": "Le Protocole Synapse Active",
        "status": "active",
        "content": {
          "phases": [
            {
              "id": 1,
              "title": "L'Ancrage Postural",
              "status": "active",
              "actions": [
                {
                  "id": "460f3d84-e9b4-42bc-a26f-0d874aa1a77d",
                  "tips": "Utilise une alarme discrète ou un déclencheur environnemental (ex: après chaque café, après avoir répondu à 5 emails).",
                  "type": "habitude",
                  "title": "La Micro-Pause Mouvement",
                  "status": "active",
                  "questType": "main",
                  "rationale": "Ces micro-pauses aident à rompre les schémas de raideur, améliorent la circulation et signalent à ton cerveau qu'il est temps de se réinitialiser.",
                  "targetReps": 10,
                  "description": "Toutes les 2-3 heures, accorde-toi 2 à 3 minutes pour des étirements doux, des rotations articulaires ou une mini-marche consciente. L'objectif est de briser l'immobilité.",
                  "isCompleted": false,
                  "time_of_day": "any_time",
                  "tracking_type": "counter"
                },
                {
                  "id": "c2360f95-07ae-48fe-821c-32672150bfe3",
                  "tips": "Pense à ton bureau, à la cuisine, ou même à un court trajet. Visualise-toi en train de le faire.",
                  "type": "mission",
                  "title": "Préparer le Terrain des Pauses",
                  "status": "active",
                  "questType": "side",
                  "rationale": "Anticiper et délimiter les moments crée un ancrage spatial et temporel, réduisant la charge mentale de décision.",
                  "description": "Identifie et note 2 à 3 moments clés de ta journée ou des lieux spécifiques où tu peux facilement intégrer ta Micro-Pause Mouvement sans perturbation.",
                  "isCompleted": false,
                  "time_of_day": "any_time",
                  "tracking_type": "boolean"
                }
              ],
              "subtitle": "Semaines 1-2 • Reconnexion au corps",
              "rationale": "Nous commençons par établir une conscience corporelle et intégrer des mouvements doux pour relâcher les premières tensions et retrouver un peu de fluidité."
            },
            {
              "id": 2,
              "title": "Le Bilan Sensoriel et Hydratation",
              "status": "locked",
              "actions": [
                {
                  "id": "4a9f91b9-4b13-4821-b77d-1341877d5eff",
                  "tips": "Utilise un carnet physique pour déconnecter des écrans. Sois juste observateur, sans jugement.",
                  "type": "framework",
                  "title": "Journal du Corps Ressenti",
                  "status": "pending",
                  "questType": "main",
                  "rationale": "Tenir un journal développe la proprioception et la conscience émotionnelle, révélant les liens entre ton état interne et tes sensations physiques, permettant une meilleure adaptation.",
                  "targetReps": 7,
                  "description": "Chaque soir, avant de te coucher, prends 5 minutes pour écrire sur les sensations de ton corps, les zones de tension et tes niveaux d'énergie de la journée. Ne filtre rien, observe.",
                  "isCompleted": false,
                  "time_of_day": "evening",
                  "tracking_type": "boolean",
                  "frameworkDetails": {
                    "type": "recurring",
                    "intro": "L'objectif est d'objectiver tes sensations. Quel est le message de ton corps aujourd'hui ? Où cela se manifeste-t-il ?",
                    "sections": [
                      {
                        "id": "s1",
                        "label": "Principales sensations corporelles (douleurs, raideurs, fluidité)",
                        "inputType": "textarea",
                        "placeholder": "Une tension dans la nuque, les jambes lourdes, une sensation de légèreté après ma pause..."
                      },
                      {
                        "id": "s2",
                        "label": "Niveau d'énergie général (1-10)",
                        "inputType": "scale",
                        "placeholder": "5"
                      },
                      {
                        "id": "s3",
                        "label": "Émotions dominantes de la journée",
                        "inputType": "list",
                        "placeholder": "Stress, calme, joie, fatigue..."
                      }
                    ]
                  }
                },
                {
                  "id": "96a8f62a-1fec-4fb7-a70b-430b87326684",
                  "tips": "Prépare ton verre d'eau sur ta table de nuit la veille pour le voir dès le matin. Tu peux ajouter une tranche de citron pour le goût.",
                  "type": "habitude",
                  "title": "Le Boost Hydratation Matinal",
                  "status": "pending",
                  "questType": "side",
                  "rationale": "La déshydratation nocturne est fréquente. Un apport d'eau matinal relance les fonctions métaboliques, favorise la fluidité articulaire et améliore l'énergie cognitive.",
                  "targetReps": 7,
                  "description": "Bois un grand verre d'eau (250-300ml) dans les 15 minutes après le réveil, avant tout autre stimulant.",
                  "isCompleted": false,
                  "time_of_day": "morning",
                  "tracking_type": "boolean"
                }
              ],
              "subtitle": "Semaines 3-4 • Écouter et nourrir",
              "rationale": "Après les premières micro-habitudes, il est temps d'affiner ton écoute interne et d'optimiser une fonction vitale simple mais souvent négligée : l'hydratation."
            },
            {
              "id": 3,
              "title": "La Force Douce et Stable",
              "status": "locked",
              "actions": [
                {
                  "id": "ef32a9f4-bc61-4f9e-be84-442e5ac297f4",
                  "tips": "Choisis 3-4 exercices que tu aimes et qui te font du bien. Utilise une application ou une vidéo courte pour t'aider au début, puis apprends à les faire de mémoire.",
                  "type": "habitude",
                  "title": "Le Rituel de 5 minutes : Mouvement Fondamental",
                  "status": "pending",
                  "questType": "main",
                  "rationale": "Ce rituel matinal ancre la journée dans la conscience corporelle, prépare le corps aux sollicitations et renforce les muscles profonds pour une meilleure stabilité.",
                  "targetReps": 7,
                  "description": "Définis et pratique une courte routine de 5 minutes d'exercices ciblés (ex: postures de yoga douces, étirements pour le dos/nuque, renforcement du 'core' léger) chaque matin.",
                  "isCompleted": false,
                  "time_of_day": "morning",
                  "tracking_type": "boolean"
                },
                {
                  "id": "13d88a20-c33c-4f0c-8d0d-109b9eb9ea5a",
                  "tips": "Utilise des coussins, surélève ton écran avec des livres, ou ajuste la hauteur de ta chaise. L'objectif est de réduire les contraintes posturales inconscientes.",
                  "type": "mission",
                  "title": "Audit et Optimisation Posturale",
                  "status": "pending",
                  "questType": "side",
                  "rationale": "Un environnement adapté soutient tes nouvelles habitudes de mouvement et réduit les sources de raideurs et de douleurs chroniques.",
                  "description": "Passe en revue tes principaux environnements (bureau, canapé, lit). Évalue si ton assise est ergonomique, si ton écran est à bonne hauteur et si tu as de l'espace pour bouger librement.",
                  "isCompleted": false,
                  "time_of_day": "any_time",
                  "tracking_type": "boolean"
                }
              ],
              "subtitle": "Semaines 5-6 • Renforcement conscient",
              "rationale": "Nous allons maintenant intégrer des mouvements ciblés qui renforcent ton corps en douceur, améliorent la posture et préviennent les raideurs, sans surcharger ton emploi du temps."
            },
            {
              "id": 4,
              "title": "L'Énergie Régénérée et Stratégie Future",
              "status": "locked",
              "actions": [
                {
                  "id": "c79793a5-490a-4471-93e8-2f52226d84b6",
                  "tips": "Sois honnête avec toi-même. Célèbre tes victoires, même les petites, et identifie ce qui a le mieux fonctionné pour toi.",
                  "type": "framework",
                  "title": "Bilan d'Impact et Projections Personnelles",
                  "status": "pending",
                  "questType": "main",
                  "rationale": "Ce bilan conscient renforce les circuits neuronaux associés au succès, solidifie l'apprentissage et prépare ton cerveau à l'autonomie et à l'adaptation continue.",
                  "targetReps": 1,
                  "description": "Prends le temps de réfléchir aux changements que tu as ressentis, aux défis surmontés et aux prochaines étapes pour continuer à cultiver ta vitalité et ta stabilité.",
                  "isCompleted": false,
                  "time_of_day": "any_time",
                  "tracking_type": "boolean",
                  "frameworkDetails": {
                    "type": "one_shot",
                    "intro": "Il est temps de regarder en arrière pour mieux avancer. Comment ton corps et ton esprit ont-ils évolué ces dernières semaines ? Quelles leçons en tires-tu ?",
                    "sections": [
                      {
                        "id": "s1",
                        "label": "Les 3 plus grands changements que j'ai ressentis physiquement et mentalement :",
                        "inputType": "textarea",
                        "placeholder": "Ex: Moins de douleurs lombaires, plus de patience, meilleure concentration..."
                      },
                      {
                        "id": "s2",
                        "label": "Le défi le plus important que j'ai surmonté ou la résistance que j'ai rencontrée :",
                        "inputType": "textarea",
                        "placeholder": "Ex: La difficulté à faire mes pauses au travail, l'oubli de mon verre d'eau..."
                      },
                      {
                        "id": "s3",
                        "label": "Une habitude que je veux absolument garder et comment je vais la maintenir :",
                        "inputType": "textarea",
                        "placeholder": "Ex: Ma routine de 5 minutes le matin, je vais la lier à mon réveil."
                      },
                      {
                        "id": "s4",
                        "label": "Un nouvel objectif de bien-être pour les 4 prochaines semaines :",
                        "inputType": "text",
                        "placeholder": "Ex: Intégrer une séance de marche de 30 minutes 3 fois par semaine."
                      }
                    ]
                  }
                },
                {
                  "id": "f31919b2-0049-48c7-a875-dacb59fd1363",
                  "tips": "Crée un mode 'Repos' ou 'Ne pas déranger' sur ton téléphone. L'idée est de réduire les sollicitations lumineuses et cognitives.",
                  "type": "habitude",
                  "title": "Le Couvre-feu Digital (Réduit)",
                  "status": "pending",
                  "questType": "side",
                  "rationale": "La lumière bleue et la surcharge d'informations activent le système nerveux, retardant la production de mélatonine et la capacité à se détendre. Un couvre-feu réduit facilite le passage à un état de repos.",
                  "targetReps": 7,
                  "description": "30 minutes avant l'heure à laquelle tu souhaiterais idéalement te coucher, désactive les notifications non-essentielles de tous tes appareils numériques.",
                  "isCompleted": false,
                  "time_of_day": "night",
                  "tracking_type": "boolean"
                }
              ],
              "subtitle": "Semaines 7-8 • Consolidation et projection",
              "rationale": "Cette phase permet de consolider les acquis, de prendre du recul sur le chemin parcouru et de poser les bases d'une vitalité durable en intégrant des habitudes de récupération et de gestion de l'énergie."
            }
          ],
          "deepWhy": "Pour me sentir léger(e) et puissant(e) dans mon corps, capable d'embrasser chaque journée avec une énergie renouvelée et une stabilité émotionnelle.",
          "identity": "Je suis l'Architecte de mon Mouvement et l'Ancre de ma Vitalité.",
          "strategy": "Avant de vouloir tout changer, nous allons ancrer des micro-habitudes de mouvement et de récupération pour restaurer la connexion corps-esprit et soulager les raideurs.",
          "goldenRules": "1. Chaque mouvement compte, même le plus petit.\n2. Écouter mon corps est ma boussole principale.\n3. La régularité prime sur l'intensité.",
          "vitalSignal": {
            "name": "Nombre de Micro-Pauses Actives",
            "type": "constat",
            "unit": "pauses",
            "startValue": "0",
            "description": "Compte le nombre de fois où tu as pris une pause active de 2-5 minutes pour t'étirer ou bouger consciemment.",
            "targetValue": "3",
            "tracking_type": "counter"
          },
          "grimoireTitle": "Le Protocole Synapse Active",
          "context_problem": "Tu te sens pris(e) dans un rythme effréné, souvent débordé(e) par les sollicitations et peines à trouver le temps de t'occuper de ta propre vitalité. Ce manque de priorisation et la tendance à remettre à plus tard t'ont laissé(e) avec des douleurs, des raideurs et une énergie en berne, malgré un mode de vie actif.",
          "sophiaKnowledge": "Tu es une personne active, née en 1988, qui se sent débordée et peine à maintenir son énergie. Malgré une activité élevée, tu souffres de douleurs, de raideurs et d'un manque de vitalité. Tu as du mal à t'accorder du temps et à maintenir tes engagements, ce qui impacte ta stabilité au quotidien.",
          "maintenanceCheck": {
            "type": "surveillance",
            "question": "Combien de jours cette semaine as-tu ressenti une nette amélioration dans tes douleurs/raideurs ?",
            "frequency": "hebdomadaire"
          },
          "estimatedDuration": "8 semaines"
        },
        "goal_id": "9a1d6c10-427f-4dc3-9bb2-ae2efed9018c",
        "deep_why": "Pour me sentir léger(e) et puissant(e) dans mon corps, capable d'embrasser chaque journée avec une énergie renouvelée et une stabilité émotionnelle.",
        "created_at": "2026-01-09T16:40:19.088231+00:00",
        "inputs_why": null,
        "current_phase": 1,
        "submission_id": "c3cd6390-81e2-4f68-9dd0-979434ee1f9b",
        "inputs_context": null,
        "inputs_blockers": null,
        "progress_percentage": 0
      },
      "actions": [
        {
          "id": "460f3d84-e9b4-42bc-a26f-0d874aa1a77d",
          "title": "La Micro-Pause Mouvement",
          "status": "active",
          "created_at": "2026-01-09T16:40:19.096441+00:00",
          "description": "Toutes les 2-3 heures, accorde-toi 2 à 3 minutes pour des étirements doux, des rotations articulaires ou une mini-marche consciente. L'objectif est de briser l'immobilité.",
          "target_reps": 10,
          "time_of_day": "any_time",
          "current_reps": 0,
          "tracking_type": "counter",
          "last_performed_at": "2026-01-07T16:40:19.094+00:00"
        },
        {
          "id": "c2360f95-07ae-48fe-821c-32672150bfe3",
          "title": "Préparer le Terrain des Pauses",
          "status": "active",
          "created_at": "2026-01-09T16:40:19.096441+00:00",
          "description": "Identifie et note 2 à 3 moments clés de ta journée ou des lieux spécifiques où tu peux facilement intégrer ta Micro-Pause Mouvement sans perturbation.",
          "target_reps": 1,
          "time_of_day": "any_time",
          "current_reps": 0,
          "tracking_type": "boolean",
          "last_performed_at": "2026-01-07T16:40:19.094+00:00"
        }
      ],
      "frameworks": [],
      "dashboard_context": "=== PLAN ACTUEL (Tableau de Bord) ===\nTitre: Le Protocole Synapse Active\nStatut: active\nPhase courante (dashboard): 1\nPourquoi (Deep Why): Pour me sentir léger(e) et puissant(e) dans mon corps, capable d'embrasser chaque journée avec une énergie renouvelée et une stabilité émotionnelle.\nDÉTAIL COMPLET DU PLAN (Structure JSON) :\n{\n  \"phases\": [\n    {\n      \"id\": 1,\n      \"title\": \"L'Ancrage Postural\",\n      \"status\": \"active\",\n      \"actions\": [\n        {\n          \"id\": \"460f3d84-e9b4-42bc-a26f-0d874aa1a77d\",\n          \"tips\": \"Utilise une alarme discrète ou un déclencheur environnemental (ex: après chaque café, après avoir répondu à 5 emails).\",\n          \"type\": \"habitude\",\n          \"title\": \"La Micro-Pause Mouvement\",\n          \"status\": \"active\",\n          \"questType\": \"main\",\n          \"rationale\": \"Ces micro-pauses aident à rompre les schémas de raideur, améliorent la circulation et signalent à ton cerveau qu'il est temps de se réinitialiser.\",\n          \"targetReps\": 10,\n          \"description\": \"Toutes les 2-3 heures, accorde-toi 2 à 3 minutes pour des étirements doux, des rotations articulaires ou une mini-marche consciente. L'objectif est de briser l'immobilité.\",\n          \"isCompleted\": false,\n          \"time_of_day\": \"any_time\",\n          \"tracking_type\": \"counter\"\n        },\n        {\n          \"id\": \"c2360f95-07ae-48fe-821c-32672150bfe3\",\n          \"tips\": \"Pense à ton bureau, à la cuisine, ou même à un court trajet. Visualise-toi en train de le faire.\",\n          \"type\": \"mission\",\n          \"title\": \"Préparer le Terrain des Pauses\",\n          \"status\": \"active\",\n          \"questType\": \"side\",\n          \"rationale\": \"Anticiper et délimiter les moments crée un ancrage spatial et temporel, réduisant la charge mentale de décision.\",\n          \"description\": \"Identifie et note 2 à 3 moments clés de ta journée ou des lieux spécifiques où tu peux facilement intégrer ta Micro-Pause Mouvement sans perturbation.\",\n          \"isCompleted\": false,\n          \"time_of_day\": \"any_time\",\n          \"tracking_type\": \"boolean\"\n        }\n      ],\n      \"subtitle\": \"Semaines 1-2 • Reconnexion au corps\",\n      \"rationale\": \"Nous commençons par établir une conscience corporelle et intégrer des mouvements doux pour relâcher les premières tensions et retrouver un peu de fluidité.\"\n    },\n    {\n      \"id\": 2,\n      \"title\": \"Le Bilan Sensoriel et Hydratation\",\n      \"status\": \"locked\",\n      \"actions\": [\n        {\n          \"id\": \"4a9f91b9-4b13-4821-b77d-1341877d5eff\",\n          \"tips\": \"Utilise un carnet physique pour déconnecter des écrans. Sois juste observateur, sans jugement.\",\n          \"type\": \"framework\",\n          \"title\": \"Journal du Corps Ressenti\",\n          \"status\": \"pending\",\n          \"questType\": \"main\",\n          \"rationale\": \"Tenir un journal développe la proprioception et la conscience émotionnelle, révélant les liens entre ton état interne et tes sensations physiques, permettant une meilleure adaptation.\",\n          \"targetReps\": 7,\n          \"description\": \"Chaque soir, avant de te coucher, prends 5 minutes pour écrire sur les sensations de ton corps, les zones de tension et tes niveaux d'énergie de la journée. Ne filtre rien, observe.\",\n          \"isCompleted\": false,\n          \"time_of_day\": \"evening\",\n          \"tracking_type\": \"boolean\",\n          \"frameworkDetails\": {\n            \"type\": \"recurring\",\n            \"intro\": \"L'objectif est d'objectiver tes sensations. Quel est le message de ton corps aujourd'hui ? Où cela se manifeste-t-il ?\",\n            \"sections\": [\n              {\n                \"id\": \"s1\",\n                \"label\": \"Principales sensations corporelles (douleurs, raideurs, fluidité)\",\n                \"inputType\": \"textarea\",\n                \"placeholder\": \"Une tension dans la nuque, les jambes lourdes, une sensation de légèreté après ma pause...\"\n              },\n              {\n                \"id\": \"s2\",\n                \"label\": \"Niveau d'énergie général (1-10)\",\n                \"inputType\": \"scale\",\n                \"placeholder\": \"5\"\n              },\n              {\n                \"id\": \"s3\",\n                \"label\": \"Émotions dominantes de la journée\",\n                \"inputType\": \"list\",\n                \"placeholder\": \"Stress, calme, joie, fatigue...\"\n              }\n            ]\n          }\n        },\n        {\n          \"id\": \"96a8f62a-1fec-4fb7-a70b-430b87326684\",\n          \"tips\": \"Prépare ton verre d'eau sur ta table de nuit la veille pour le voir dès le matin. Tu peux ajouter une tranche de citron pour le goût.\",\n          \"type\": \"habitude\",\n          \"title\": \"Le Boost Hydratation Matinal\",\n          \"status\": \"pending\",\n          \"questType\": \"side\",\n          \"rationale\": \"La déshydratation nocturne est fréquente. Un apport d'eau matinal relance les fonctions métaboliques, favorise la fluidité articulaire et améliore l'énergie cognitive.\",\n          \"targetReps\": 7,\n          \"description\": \"Bois un grand verre d'eau (250-300ml) dans les 15 minutes après le réveil, avant tout autre stimulant.\",\n          \"isCompleted\": false,\n          \"time_of_day\": \"morning\",\n          \"tracking_type\": \"boolean\"\n        }\n      ],\n      \"subtitle\": \"Semaines 3-4 • Écouter et nourrir\",\n      \"rationale\": \"Après les premières micro-habitudes, il est temps d'affiner ton écoute interne et d'optimiser une fonction vitale simple mais souvent négligée : l'hydratation.\"\n    },\n    {\n      \"id\": 3,\n      \"title\": \"La Force Douce et Stable\",\n      \"status\": \"locked\",\n      \"actions\": [\n        {\n          \"id\": \"ef32a9f4-bc61-4f9e-be84-442e5ac297f4\",\n          \"tips\": \"Choisis 3-4 exercices que tu aimes et qui te font du bien. Utilise une application ou une vidéo courte pour t'aider au début, puis apprends à les faire de mémoire.\",\n          \"type\": \"habitude\",\n          \"title\": \"Le Rituel de 5 minutes : Mouvement Fondamental\",\n          \"status\": \"pending\",\n          \"questType\": \"main\",\n          \"rationale\": \"Ce rituel matinal ancre la journée dans la conscience corporelle, prépare le corps aux sollicitations et renforce les muscles profonds pour une meilleure stabilité.\",\n          \"targetReps\": 7,\n          \"description\": \"Définis et pratique une courte routine de 5 minutes d'exercices ciblés (ex: postures de yoga douces, étirements pour le dos/nuque, renforcement du 'core' léger) chaque matin.\",\n          \"isCompleted\": false,\n          \"time_of_day\": \"morning\",\n          \"tracking_type\": \"boolean\"\n        },\n        {\n          \"id\": \"13d88a20-c33c-4f0c-8d0d-109b9eb9ea5a\",\n          \"tips\": \"Utilise des coussins, surélève ton écran avec des livres, ou ajuste la hauteur de ta chaise. L'objectif est de réduire les contraintes posturales inconscientes.\",\n          \"type\": \"mission\",\n          \"title\": \"Audit et Optimisation Posturale\",\n          \"status\": \"pending\",\n          \"questType\": \"side\",\n          \"rationale\": \"Un environnement adapté soutient tes nouvelles habitudes de mouvement et réduit les sources de raideurs et de douleurs chroniques.\",\n          \"description\": \"Passe en revue tes principaux environnements (bureau, canapé, lit). Évalue si ton assise est ergonomique, si ton écran est à bonne hauteur et si tu as de l'espace pour bouger librement.\",\n          \"isCompleted\": false,\n          \"time_of_day\": \"any_time\",\n          \"tracking_type\": \"boolean\"\n        }\n      ],\n      \"subtitle\": \"Semaines 5-6 • Renforcement conscient\",\n      \"rationale\": \"Nous allons maintenant intégrer des mouvements ciblés qui renforcent ton corps en douceur, améliorent la posture et préviennent les raideurs, sans surcharger ton emploi du temps.\"\n    },\n    {\n      \"id\": 4,\n      \"title\": \"L'Énergie Régénérée et Stratégie Future\",\n      \"status\": \"locked\",\n      \"actions\": [\n        {\n          \"id\": \"c79793a5-490a-4471-93e8-2f52226d84b6\",\n          \"tips\": \"Sois honnête avec toi-même. Célèbre tes victoires, même les petites, et identifie ce qui a le mieux fonctionné pour toi.\",\n          \"type\": \"framework\",\n          \"title\": \"Bilan d'Impact et Projections Personnelles\",\n          \"status\": \"pending\",\n          \"questType\": \"main\",\n          \"rationale\": \"Ce bilan conscient renforce les circuits neuronaux associés au succès, solidifie l'apprentissage et prépare ton cerveau à l'autonomie et à l'adaptation continue.\",\n          \"targetReps\": 1,\n          \"description\": \"Prends le temps de réfléchir aux changements que tu as ressentis, aux défis surmontés et aux prochaines étapes pour continuer à cultiver ta vitalité et ta stabilité.\",\n          \"isCompleted\": false,\n          \"time_of_day\": \"any_time\",\n          \"tracking_type\": \"boolean\",\n          \"frameworkDetails\": {\n            \"type\": \"one_shot\",\n            \"intro\": \"Il est temps de regarder en arrière pour mieux avancer. Comment ton corps et ton esprit ont-ils évolué ces dernières semaines ? Quelles leçons en tires-tu ?\",\n            \"sections\": [\n              {\n                \"id\": \"s1\",\n                \"label\": \"Les 3 plus grands changements que j'ai ressentis physiquement et mentalement :\",\n                \"inputType\": \"textarea\",\n                \"placeholder\": \"Ex: Moins de douleurs lombaires, plus de patience, meilleure concentration...\"\n              },\n              {\n                \"id\": \"s2\",\n                \"label\": \"Le défi le plus important que j'ai surmonté ou la résistance que j'ai rencontrée :\",\n                \"inputType\": \"textarea\",\n                \"placeholder\": \"Ex: La difficulté à faire mes pauses au travail, l'oubli de mon verre d'eau...\"\n              },\n              {\n                \"id\": \"s3\",\n                \"label\": \"Une habitude que je veux absolument garder et comment je vais la maintenir :\",\n                \"inputType\": \"textarea\",\n                \"placeholder\": \"Ex: Ma routine de 5 minutes le matin, je vais la lier à mon réveil.\"\n              },\n              {\n                \"id\": \"s4\",\n                \"label\": \"Un nouvel objectif de bien-être pour les 4 prochaines semaines :\",\n                \"inputType\": \"text\",\n                \"placeholder\": \"Ex: Intégrer une séance de marche de 30 minutes 3 fois par semaine.\"\n              }\n            ]\n          }\n        },\n        {\n          \"id\": \"f31919b2-0049-48c7-a875-dacb59fd1363\",\n          \"tips\": \"Crée un mode 'Repos' ou 'Ne pas déranger' sur ton téléphone. L'idée est de réduire les sollicitations lumineuses et cognitives.\",\n          \"type\": \"habitude\",\n          \"title\": \"Le Couvre-feu Digital (Réduit)\",\n          \"status\": \"pending\",\n          \"questType\": \"side\",\n          \"rationale\": \"La lumière bleue et la surcharge d'informations activent le système nerveux, retardant la production de mélatonine et la capacité à se détendre. Un couvre-feu réduit facilite le passage à un état de repos.\",\n          \"targetReps\": 7,\n          \"description\": \"30 minutes avant l'heure à laquelle tu souhaiterais idéalement te coucher, désactive les notifications non-essentielles de tous tes appareils numériques.\",\n          \"isCompleted\": false,\n          \"time_of_day\": \"night\",\n          \"tracking_type\": \"boolean\"\n        }\n      ],\n      \"subtitle\": \"Semaines 7-8 • Consolidation et projection\",\n      \"rationale\": \"Cette phase permet de consolider les acquis, de prendre du recul sur le chemin parcouru et de poser les bases d'une vitalité durable en intégrant des habitudes de récupération et de gestion de l'énergie.\"\n    }\n  ],\n  \"deepWhy\": \"Pour me sentir léger(e) et puissant(e) dans mon corps, capable d'embrasser chaque journée avec une énergie renouvelée et une stabilité émotionnelle.\",\n  \"identity\": \"Je suis l'Architecte de mon Mouvement et l'Ancre de ma Vitalité.\",\n  \"strategy\": \"Avant de vouloir tout changer, nous allons ancrer des micro-habitudes de mouvement et de récupération pour restaurer la connexion corps-esprit et soulager les raideurs.\",\n  \"goldenRules\": \"1. Chaque mouvement compte, même le plus petit.\\n2. Écouter mon corps est ma boussole principale.\\n3. La régularité prime sur l'intensité.\",\n  \"vitalSignal\": {\n    \"name\": \"Nombre de Micro-Pauses Actives\",\n    \"type\": \"constat\",\n    \"unit\": \"pauses\",\n    \"startValue\": \"0\",\n    \"description\": \"Compte le nombre de fois où tu as pris une pause active de 2-5 minutes pour t'étirer ou bouger consciemment.\",\n    \"targetValue\": \"3\",\n    \"tracking_type\": \"counter\"\n  },\n  \"grimoireTitle\": \"Le Protocole Synapse Active\",\n  \"context_problem\": \"Tu te sens pris(e) dans un rythme effréné, souvent débordé(e) par les sollicitations et peines à trouver le temps de t'occuper de ta propre vitalité. Ce manque de priorisation et la tendance à remettre à plus tard t'ont laissé(e) avec des douleurs, des raideurs et une énergie en berne, malgré un mode de vie actif.\",\n  \"sophiaKnowledge\": \"Tu es une personne active, née en 1988, qui se sent débordée et peine à maintenir son énergie. Malgré une activité élevée, tu souffres de douleurs, de raideurs et d'un manque de vitalité. Tu as du mal à t'accorder du temps et à maintenir tes engagements, ce qui impacte ta stabilité au quotidien.\",\n  \"maintenanceCheck\": {\n    \"type\": \"surveillance\",\n    \"question\": \"Combien de jours cette semaine as-tu ressenti une nette amélioration dans tes douleurs/raideurs ?\",\n    \"frequency\": \"hebdomadaire\"\n  },\n  \"estimatedDuration\": \"8 semaines\"\n}\n=== ACTIONS / FRAMEWORKS (ÉTAT RÉEL DB) ===\nRÈGLES IMPORTANTES:\n- Les frameworks comptent comme des actions côté utilisateur.\n- \"active\" = activée et visible comme active dans l'app. \"pending\" = pas active.\n- On n'active/désactive pas via WhatsApp: la seule manière d'activer/désactiver, c'est depuis le dashboard.\n\nActives (2):\n- [ACTION] La Micro-Pause Mouvement (any_time)\n- [ACTION] Préparer le Terrain des Pauses (any_time)\n\n=== SIGNES VITAUX (État Actuel) ===\n- Nombre de Micro-Pauses Actives: 0 pauses\n",
      "template_fingerprint": null
    },
    "scenario_target": "onboarding"
  },
  "error": null
}