{
  "id": "ea34e0c0-15d0-4acc-b4e4-7259d101e7ad",
  "created_at": "2026-01-09T22:41:16.272912+00:00",
  "status": "completed",
  "scenario_key": "wa_onboarding_personal_fact_ack_exit__run_1767998443472_3a9f65",
  "transcript": [
    {
      "role": "user",
      "content": "Je suis irrégulier quand je suis fatigué.",
      "agent_used": null,
      "created_at": "2026-01-09T22:41:16.580145+00:00"
    },
    {
      "role": "assistant",
      "content": "Ok, je note. C'est le piège classique : on attend d'avoir la pêche pour s'y mettre, alors que c'est justement quand on est à plat qu'on a le plus besoin de structure pour ne pas couler.\n\nOn va devoir trouver un truc pour que tes routines soient plus fortes que ton coup de barre. C'est là que le vrai changement se joue, quand c'est dur. ⚡\n\nEt là, tout de suite: tu as envie qu’on parle de quoi ?",
      "agent_used": "companion",
      "created_at": "2026-01-09T22:41:25.988525+00:00"
    }
  ],
  "state_before": {
    "profile": {
      "id": "f7707ff7-3f7f-4b71-bf27-59cb6be10954",
      "email": "run-evals+f58765273c3c46@example.com",
      "full_name": "Eval Runner",
      "trial_end": "2026-01-16T22:41:16.242+00:00",
      "phone_number": "+15553614285658",
      "phone_invalid": false,
      "whatsapp_state": "awaiting_personal_fact",
      "phone_verified_at": "2026-01-09T22:41:16.242+00:00",
      "whatsapp_opted_in": true,
      "whatsapp_opted_out_at": null,
      "whatsapp_optin_sent_at": null,
      "whatsapp_optout_reason": null,
      "whatsapp_bilan_opted_in": false,
      "whatsapp_last_inbound_at": null,
      "whatsapp_last_outbound_at": null,
      "whatsapp_state_updated_at": "2026-01-09T22:41:16.242+00:00",
      "whatsapp_optout_confirmed_at": null
    },
    "chat_state": null
  },
  "state_after": {
    "profile": {
      "id": "f7707ff7-3f7f-4b71-bf27-59cb6be10954",
      "email": "run-evals+f58765273c3c46@example.com",
      "full_name": "Eval Runner",
      "trial_end": "2026-01-16T22:41:16.242+00:00",
      "phone_number": "+15553614285658",
      "phone_invalid": false,
      "whatsapp_state": null,
      "phone_verified_at": "2026-01-09T22:41:16.242+00:00",
      "whatsapp_opted_in": true,
      "whatsapp_opted_out_at": null,
      "whatsapp_optin_sent_at": null,
      "whatsapp_optout_reason": null,
      "whatsapp_bilan_opted_in": false,
      "whatsapp_last_inbound_at": "2026-01-09T22:41:16.575+00:00",
      "whatsapp_last_outbound_at": null,
      "whatsapp_state_updated_at": "2026-01-09T22:41:25.992+00:00",
      "whatsapp_optout_confirmed_at": null
    },
    "chat_state": {
      "scope": "whatsapp",
      "user_id": "f7707ff7-3f7f-4b71-bf27-59cb6be10954",
      "risk_level": 0,
      "updated_at": "2026-01-09T22:41:25.983308+00:00",
      "temp_memory": {},
      "current_mode": "companion",
      "last_processed_at": "2026-01-09T22:41:16.589+00:00",
      "short_term_context": "",
      "investigation_state": null,
      "last_interaction_at": "2026-01-09T22:41:16.58978+00:00",
      "unprocessed_msg_count": 1
    }
  },
  "issues": [
    {
      "code": "conversational_coherence",
      "message": "The assistant formulates a specific future plan ('On va devoir trouver un truc...') implying immediate continuity on the 'fatigue' topic, but immediately pivots to a generic open floor question due to the state reset. This creates a disjointed experience where a promise of help is followed by a topic switch.",
      "evidence": {
        "snippet": "On va devoir trouver un truc... Et là, tout de suite: tu as envie qu’on parle de quoi ?",
        "agent_used": "sophia.companion"
      },
      "severity": "low"
    },
    {
      "kind": "mechanical_assertion_failed",
      "message": "assistant_must_match failed: /merci, je note/i",
      "severity": "high"
    }
  ],
  "suggestions": [
    {
      "action": "append",
      "rationale": "Prevents the user from feeling that a proposed plan/topic was immediately abandoned by the generic 'What do you want to talk about?' question.",
      "prompt_key": "sophia.companion",
      "context_block": "=== CONTEXT (transcript excerpt) ===\n=== STATE_BEFORE (user_chat_states) ===\ninvestigation_state:\nnull\n=== TRANSCRIPT ===\n#0 USER: Je suis irrégulier quand je suis fatigué.\n#1 ASSISTANT(companion): Ok, je note. C'est le piège classique : on attend d'avoir la pêche pour s'y mettre, alors que c'est justement quand on est à plat qu'on a le plus besoin de structure pour ne pas couler. On va devoir trouver un truc pour que tes routines soient plus fortes que ton coup de barre. C'est là que le vrai changement se joue, quand c'est dur. ⚡ Et là, tout de suite: tu as envie qu’on parle de quoi ?\n\n=== APPLY ===\nprompt_key: sophia.companion\naction: append\n\nproposed_addendum:\nWhen acknowledging a user fact that concludes a profiling step (e.g., 'Je note'), avoid proposing complex future plans or 'we must do X' statements if the conversation immediately transitions to an open floor question. Stick to validation and empathy to avoid conversational dissonance.",
      "proposed_addendum": "When acknowledging a user fact that concludes a profiling step (e.g., 'Je note'), avoid proposing complex future plans or 'we must do X' statements if the conversation immediately transitions to an open floor question. Stick to validation and empathy to avoid conversational dissonance."
    }
  ],
  "metrics": {
    "cost_usd": 0,
    "request_id": "wa_onboarding_bundle:wa_onboarding_personal_fact_ack_exit__run_1767998443472_3a9f65:i0:s2016963725:core:wa_onboarding_personal_fact_ack_exit__run_1767998443472_3a9f65",
    "total_tokens": 0,
    "output_tokens": 0,
    "prompt_tokens": 0,
    "judge_llm_used": true,
    "mega_test_mode": false,
    "mechanical_issues_count": 1
  },
  "config": {
    "tags": [
      "whatsapp.onboarding",
      "whatsapp.webhook",
      "mechanical"
    ],
    "limits": {
      "model": "gemini-3-pro-preview",
      "user_difficulty": "mid",
      "bilan_actions_count": 0,
      "test_post_checkup_deferral": false
    },
    "channel": "whatsapp",
    "request_id": "wa_onboarding_bundle:wa_onboarding_personal_fact_ack_exit__run_1767998443472_3a9f65:i0:s2016963725:core:wa_onboarding_personal_fact_ack_exit__run_1767998443472_3a9f65",
    "description": "WhatsApp onboarding (webhook): when awaiting_personal_fact, a user message should be stored as memory and state cleared with a friendly ack.",
    "plan_snapshot": {
      "plan": {
        "id": "536d640f-c062-469c-a3cd-3fb852620047",
        "title": "Le Sceptre du Calme",
        "status": "active",
        "content": {
          "phases": [
            {
              "id": 1,
              "title": "Phase 1 : L'Ancrage Radical",
              "status": "active",
              "actions": [
                {
                  "id": "dcaffee9-c096-4d0d-80d5-0a8d50cec4eb",
                  "tips": "Utilise un carnet dédié. Ne cherche pas la perfection, juste la décharge. Visualise tes pensées s'écoulant de ton esprit vers le papier.",
                  "type": "framework",
                  "title": "Le Grand Vide de Cerveau",
                  "status": "active",
                  "questType": "main",
                  "rationale": "Libère l'esprit des boucles de rumination, réduisant l'activation du système nerveux sympathique avant le repos.",
                  "targetReps": 7,
                  "description": "Chaque soir, écris tout ce qui tourne en boucle dans ta tête, tes préoccupations, tes tâches à faire, sans filtre. Vide ta 'RAM mentale' sur papier.",
                  "isCompleted": false,
                  "time_of_day": "evening",
                  "tracking_type": "counter",
                  "frameworkDetails": {
                    "type": "recurring",
                    "intro": "Transforme ta charge mentale en simple matière à vider. Écris tout ce qui te pèse, tes pensées récurrentes, tes peurs, tes listes de choses à faire. Le but n'est pas de résoudre, mais de décharger ton esprit.",
                    "sections": [
                      {
                        "id": "s1",
                        "label": "Mes pensées qui tournent en boucle",
                        "inputType": "textarea",
                        "placeholder": "Je pense à..."
                      },
                      {
                        "id": "s2",
                        "label": "Ce que j'ai en tête (à faire, à ne pas oublier)",
                        "inputType": "list",
                        "placeholder": "Tâche 1|Projet X"
                      },
                      {
                        "id": "s3",
                        "label": "Mon niveau de charge mentale avant d'écrire (1-10)",
                        "inputType": "scale",
                        "placeholder": "7"
                      }
                    ]
                  }
                },
                {
                  "id": "d224684f-e821-4861-8ab0-568f5cb96124",
                  "tips": "Mets une alarme douce. Concentre-toi sur le souffle, observe l'air qui entre et sort. C'est ton ancre du matin.",
                  "type": "habitude",
                  "title": "La Respiration du Guerrier",
                  "status": "active",
                  "questType": "side",
                  "rationale": "Active le système nerveux parasympathique, induisant un état de calme et de clarté dès le début de journée.",
                  "targetReps": 7,
                  "description": "Prends 2 minutes chaque matin pour pratiquer une respiration profonde et consciente (inspiration par le nez, expiration lente par la bouche).",
                  "isCompleted": false,
                  "time_of_day": "morning",
                  "tracking_type": "boolean"
                }
              ],
              "subtitle": "Semaine 1 • Le Grand Nettoyage Mental",
              "rationale": "Cette phase établit des fondations solides en désengorgeant votre esprit et en créant les premiers remparts contre la surcharge mentale. Il est temps de vider pour mieux remplir."
            },
            {
              "id": 2,
              "title": "Phase 2 : Le Silence Intérieur",
              "status": "locked",
              "actions": [
                {
                  "id": "bdeffc09-68f8-405a-8d10-72649890e905",
                  "tips": "Lis un livre papier, écoute de la musique douce ou médite. Laisse ton téléphone dans une autre pièce.",
                  "type": "habitude",
                  "title": "Zone Sans Bruit Numérique",
                  "status": "pending",
                  "questType": "main",
                  "rationale": "Réduit l'exposition à la lumière bleue et à la dopamine, favorisant la production de mélatonine et un esprit apaisé pour le sommeil.",
                  "targetReps": 7,
                  "description": "Instaure un couvre-feu numérique d'au moins 1 heure avant de dormir : pas d'écrans (téléphone, tablette, ordinateur, TV) dans la chambre ou avant le coucher.",
                  "isCompleted": false,
                  "time_of_day": "night",
                  "tracking_type": "boolean"
                },
                {
                  "id": "7d492c3e-7110-4a85-9c05-696875e2d6b4",
                  "tips": "Utilise un minuteur. L'objectif est de briser les cycles de concentration intense et de laisser l'esprit vagabonder librement.",
                  "type": "habitude",
                  "title": "La Pause Micro-Déconnexion",
                  "status": "pending",
                  "questType": "side",
                  "rationale": "Prévient la surcharge cognitive, augmente la résilience au stress et améliore la concentration sur le long terme en permettant au cerveau de se 'réinitialiser'.",
                  "targetReps": 14,
                  "description": "Intègre deux micro-pauses de 5 minutes dans ta journée de travail où tu déconnectes totalement : aucun écran, pas de tâche, juste un regard par la fenêtre ou quelques respirations.",
                  "isCompleted": false,
                  "time_of_day": "any_time",
                  "tracking_type": "boolean"
                }
              ],
              "subtitle": "Semaine 2 • Cultiver la Paix Mentale",
              "rationale": "Après avoir vidé l'esprit, cette phase crée des sanctuaires de calme, réduisant les sollicitations externes et les opportunités de rumination. Vous apprenez à protéger votre espace mental."
            },
            {
              "id": 3,
              "title": "Phase 3 : L'Action Ciblée",
              "status": "locked",
              "actions": [
                {
                  "id": "d1a3e1d4-3259-4d0f-8da7-3fd11859c4a9",
                  "tips": "Commence par le plus évident. Chaque notification désactivée est un micro-gain de paix mentale. Le désabonnement est un acte libérateur.",
                  "type": "mission",
                  "title": "Le Nettoyage Numérique Radical",
                  "status": "pending",
                  "questType": "main",
                  "rationale": "Réduit drastiquement les sollicitations externes et les 'voleurs d'attention', libérant de l'espace mental et réduisant les interruptions qui nourrissent la sensation de surcharge.",
                  "description": "Passe 30 minutes à te désabonner de toutes les newsletters inutiles, à désactiver les notifications non essentielles (e-mails, réseaux sociaux) et à faire le tri dans tes applications.",
                  "isCompleted": false,
                  "time_of_day": "any_time",
                  "tracking_type": "boolean"
                },
                {
                  "id": "bf46b78d-13e3-41d0-8fec-65f6453f6f48",
                  "tips": "Ces tâches doivent être alignées avec tes objectifs majeurs. Évite d'en mettre plus de trois pour ne pas te sentir submergée.",
                  "type": "habitude",
                  "title": "La Priorisation Quotidienne du Dragon",
                  "status": "pending",
                  "questType": "side",
                  "rationale": "Combat la dispersion et la perte de fil en offrant une direction claire. Le cerveau se sent moins submergé quand il sait quoi faire en premier.",
                  "targetReps": 7,
                  "description": "Chaque matin, identifie tes 3 tâches les plus importantes ('Dragon' à abattre) pour la journée. Concentre-toi sur celles-ci avant toute autre chose.",
                  "isCompleted": false,
                  "time_of_day": "morning",
                  "tracking_type": "boolean"
                },
                {
                  "id": "76cd350f-9278-49c3-a229-df3ae0be5681",
                  "tips": "Trouve un endroit paisible. Tu peux t'asseoir, t'allonger, ou même marcher lentement en pleine conscience. L'important est l'absence de stimulation externe.",
                  "type": "habitude",
                  "title": "Le Sanctuaire du Calme",
                  "status": "pending",
                  "questType": "side",
                  "rationale": "Entraîne le cerveau à se détendre et à se désengager des pensées incessantes, renforçant la capacité à revenir au calme en période de stress. C'est une application directe de votre KPI.",
                  "targetReps": 7,
                  "description": "Dédie un moment spécifique de 15 minutes chaque jour à pratiquer ton 'Temps de calme sans stimulation' (Vital Signal). Pas d'écrans, pas de livre, juste toi et le moment présent.",
                  "isCompleted": false,
                  "time_of_day": "any_time",
                  "tracking_type": "boolean"
                }
              ],
              "subtitle": "Semaine 3 • De la Surcharge au Contrôle",
              "rationale": "Il est temps de passer de la réactivité à la proactivité. Cette phase vous outille pour transformer la sensation d'être submergée en une gestion active et sereine de vos responsabilités."
            },
            {
              "id": 4,
              "title": "Phase 4 : Le Maître de l'Orchestre",
              "status": "locked",
              "actions": [
                {
                  "id": "3080e704-6751-4364-a4aa-8c89fb34f98c",
                  "tips": "Sois honnête avec toi-même. La reconnaissance est la première étape de la maîtrise. Pour chaque déclencheur, pense à une petite action immédiate que tu peux faire.",
                  "type": "framework",
                  "title": "L'Audit de mes Déclencheurs et Solutions",
                  "status": "pending",
                  "questType": "main",
                  "rationale": "Connaître ses déclencheurs permet de développer des stratégies proactives et de réduire l'impact des stresseurs avant qu'ils ne submergent, augmentant ainsi le sentiment de contrôle.",
                  "targetReps": 1,
                  "description": "Réalise un inventaire des situations, pensées ou personnes qui déclenchent le plus ton stress et ta rumination, puis identifie des stratégies concrètes pour y faire face.",
                  "isCompleted": false,
                  "time_of_day": "any_time",
                  "tracking_type": "boolean",
                  "frameworkDetails": {
                    "type": "one_shot",
                    "intro": "Pour reprendre le contrôle, tu dois connaître tes ennemis. Identifie les situations, les personnes, les pensées ou les environnements qui déclenchent le plus ton stress et ta sensation d'être submergée. Ensuite, brainstorme des solutions concrètes.",
                    "sections": [
                      {
                        "id": "s1",
                        "label": "Situations stressantes récurrentes",
                        "inputType": "list",
                        "placeholder": "Réunion difficile|Fin de journée chargée avec les enfants"
                      },
                      {
                        "id": "s2",
                        "label": "Pensées ou émotions qui amplifient le stress",
                        "inputType": "list",
                        "placeholder": "Perfectionnisme|Peur de décevoir|Anticipation négative"
                      },
                      {
                        "id": "s3",
                        "label": "Actions que je peux essayer pour gérer ces déclencheurs",
                        "inputType": "list",
                        "placeholder": "Prendre une pause de 2min|Dire non à une sollicitation|Préparer ma réponse"
                      }
                    ]
                  }
                },
                {
                  "id": "f8bdc475-178c-4209-aebd-f3e179632235",
                  "tips": "Commence petit si c'est difficile. L'idée est de s'entraîner à établir des limites saines. Chaque 'non' est un 'oui' à ton bien-être.",
                  "type": "mission",
                  "title": "Le Rempart Anti-Surcharge",
                  "status": "pending",
                  "questType": "side",
                  "rationale": "Renforce ta capacité à poser des limites, protégeant ton énergie et ton temps des demandes excessives, essentiel pour gérer la charge mentale sur le long terme.",
                  "description": "Identifie une tâche ou une sollicitation que tu peux déléguer, reporter ou refuser cette semaine. Fais-le activement pour t'alléger.",
                  "isCompleted": false,
                  "time_of_day": "any_time",
                  "tracking_type": "boolean"
                },
                {
                  "id": "77d701e6-ab68-4c95-ac3b-5e3182b0982e",
                  "tips": "Utilise une roue des émotions si besoin. L'objectif est de développer ton intelligence émotionnelle et de ne pas laisser les émotions s'accumuler sans être reconnues.",
                  "type": "habitude",
                  "title": "Le Baromètre Émotionnel Quotidien",
                  "status": "pending",
                  "questType": "side",
                  "rationale": "Améliore la conscience de soi et la régulation émotionnelle. En reconnaissant les émotions, on les désamorce et on réduit leur pouvoir de subversion et de rumination.",
                  "targetReps": 7,
                  "description": "Chaque soir, prends 2 minutes pour nommer et ressentir l'émotion dominante de ta journée. Pas de jugement, juste l'observation.",
                  "isCompleted": false,
                  "time_of_day": "evening",
                  "tracking_type": "boolean"
                }
              ],
              "subtitle": "Semaine 4 • Ancrer la Stabilité et la Clarté",
              "rationale": "Cette dernière phase consolide vos gains, vous transformant en un véritable chef d'orchestre de votre vie mentale. Vous apprenez à anticiper et à déjouer les pièges de la surcharge."
            }
          ],
          "deepWhy": "Pour retrouver une énergie inépuisable, être profondément stable et présente dans ma vie quotidienne, et vivre chaque instant avec clarté.",
          "identity": "Je suis la Maîtresse de mon Esprit.",
          "strategy": "Radicalement, nous allons reprendre le contrôle de votre espace mental pour transformer la surcharge en clarté et l'agitation en stabilité, en ancrant de nouvelles routines en un temps record.",
          "goldenRules": "1. Mon cerveau n'est pas une poubelle, je le vide chaque jour.\n2. Je ne procrastine jamais ma déconnexion.\n3. L'action précède la motivation, même minime.",
          "vitalSignal": {
            "name": "Temps de calme sans stimulation",
            "type": "constat",
            "unit": "min",
            "startValue": "0",
            "description": "Le temps que tu consacres chaque jour à ne rien faire délibérément, à juste respirer ou observer, sans écran, livre, ou musique.",
            "targetValue": "15",
            "tracking_type": "counter"
          },
          "grimoireTitle": "Le Sceptre du Calme",
          "context_problem": "Tu te sentais constamment submergée par une charge mentale intense et des ruminations incessantes, te privant de l'énergie et de la stabilité que tu désires. Les nombreuses sollicitations et le manque de temps pour toi te poussaient à te perdre facilement, amplifiant ton stress quotidien et t'empêchant d'être pleinement maîtresse de ton esprit.",
          "sophiaKnowledge": "Tu es une femme dynamique de 35-36 ans, au rythme de vie chargé, qui ressent une charge mentale élevée et rumine souvent. Malgré une bonne qualité de sommeil, ton niveau de stress est élevé, ce qui te submerge et te fait perdre le fil. Tu cherches à retrouver énergie et stabilité pour être plus présente et sereine au quotidien.",
          "maintenanceCheck": {
            "type": "surveillance",
            "question": "Combien de fois t'es-tu sentie submergée et as-tu 'perdu le fil' cette semaine ?",
            "frequency": "hebdomadaire"
          },
          "estimatedDuration": "4 semaines"
        },
        "goal_id": "fd454b97-4019-4f89-8914-3d248c6eb3c6",
        "deep_why": "Pour retrouver une énergie inépuisable, être profondément stable et présente dans ma vie quotidienne, et vivre chaque instant avec clarté.",
        "created_at": "2026-01-09T22:41:16.208669+00:00",
        "inputs_why": null,
        "current_phase": 1,
        "submission_id": "b7940bf5-bac2-4cf0-8758-9467b62bfdfb",
        "inputs_context": null,
        "inputs_blockers": null,
        "progress_percentage": 0
      },
      "actions": [
        {
          "id": "d224684f-e821-4861-8ab0-568f5cb96124",
          "title": "La Respiration du Guerrier",
          "status": "active",
          "created_at": "2026-01-09T22:41:16.221582+00:00",
          "description": "Prends 2 minutes chaque matin pour pratiquer une respiration profonde et consciente (inspiration par le nez, expiration lente par la bouche).",
          "target_reps": 7,
          "time_of_day": "morning",
          "current_reps": 0,
          "tracking_type": "boolean",
          "last_performed_at": "2026-01-07T22:41:16.218+00:00"
        },
        {
          "id": "04f27d1d-7482-461f-a8a2-b9fd565df74b",
          "_kind": "framework",
          "title": "Le Grand Vide de Cerveau",
          "status": "active",
          "created_at": "2026-01-09T22:41:16.228394+00:00",
          "description": "",
          "target_reps": 7,
          "time_of_day": null,
          "current_reps": 0,
          "tracking_type": "counter",
          "framework_type": "recurring",
          "last_performed_at": "2026-01-07T22:41:16.218+00:00"
        }
      ],
      "frameworks": [
        {
          "id": "04f27d1d-7482-461f-a8a2-b9fd565df74b",
          "type": "recurring",
          "title": "Le Grand Vide de Cerveau",
          "status": "active",
          "created_at": "2026-01-09T22:41:16.228394+00:00",
          "target_reps": 7,
          "current_reps": 0,
          "tracking_type": "counter",
          "last_performed_at": "2026-01-07T22:41:16.218+00:00"
        }
      ],
      "dashboard_context": "=== PLAN ACTUEL (Tableau de Bord) ===\nTitre: Le Sceptre du Calme\nStatut: active\nPhase courante (dashboard): 1\nPourquoi (Deep Why): Pour retrouver une énergie inépuisable, être profondément stable et présente dans ma vie quotidienne, et vivre chaque instant avec clarté.\nDÉTAIL COMPLET DU PLAN (Structure JSON) :\n{\n  \"phases\": [\n    {\n      \"id\": 1,\n      \"title\": \"Phase 1 : L'Ancrage Radical\",\n      \"status\": \"active\",\n      \"actions\": [\n        {\n          \"id\": \"dcaffee9-c096-4d0d-80d5-0a8d50cec4eb\",\n          \"tips\": \"Utilise un carnet dédié. Ne cherche pas la perfection, juste la décharge. Visualise tes pensées s'écoulant de ton esprit vers le papier.\",\n          \"type\": \"framework\",\n          \"title\": \"Le Grand Vide de Cerveau\",\n          \"status\": \"active\",\n          \"questType\": \"main\",\n          \"rationale\": \"Libère l'esprit des boucles de rumination, réduisant l'activation du système nerveux sympathique avant le repos.\",\n          \"targetReps\": 7,\n          \"description\": \"Chaque soir, écris tout ce qui tourne en boucle dans ta tête, tes préoccupations, tes tâches à faire, sans filtre. Vide ta 'RAM mentale' sur papier.\",\n          \"isCompleted\": false,\n          \"time_of_day\": \"evening\",\n          \"tracking_type\": \"counter\",\n          \"frameworkDetails\": {\n            \"type\": \"recurring\",\n            \"intro\": \"Transforme ta charge mentale en simple matière à vider. Écris tout ce qui te pèse, tes pensées récurrentes, tes peurs, tes listes de choses à faire. Le but n'est pas de résoudre, mais de décharger ton esprit.\",\n            \"sections\": [\n              {\n                \"id\": \"s1\",\n                \"label\": \"Mes pensées qui tournent en boucle\",\n                \"inputType\": \"textarea\",\n                \"placeholder\": \"Je pense à...\"\n              },\n              {\n                \"id\": \"s2\",\n                \"label\": \"Ce que j'ai en tête (à faire, à ne pas oublier)\",\n                \"inputType\": \"list\",\n                \"placeholder\": \"Tâche 1|Projet X\"\n              },\n              {\n                \"id\": \"s3\",\n                \"label\": \"Mon niveau de charge mentale avant d'écrire (1-10)\",\n                \"inputType\": \"scale\",\n                \"placeholder\": \"7\"\n              }\n            ]\n          }\n        },\n        {\n          \"id\": \"d224684f-e821-4861-8ab0-568f5cb96124\",\n          \"tips\": \"Mets une alarme douce. Concentre-toi sur le souffle, observe l'air qui entre et sort. C'est ton ancre du matin.\",\n          \"type\": \"habitude\",\n          \"title\": \"La Respiration du Guerrier\",\n          \"status\": \"active\",\n          \"questType\": \"side\",\n          \"rationale\": \"Active le système nerveux parasympathique, induisant un état de calme et de clarté dès le début de journée.\",\n          \"targetReps\": 7,\n          \"description\": \"Prends 2 minutes chaque matin pour pratiquer une respiration profonde et consciente (inspiration par le nez, expiration lente par la bouche).\",\n          \"isCompleted\": false,\n          \"time_of_day\": \"morning\",\n          \"tracking_type\": \"boolean\"\n        }\n      ],\n      \"subtitle\": \"Semaine 1 • Le Grand Nettoyage Mental\",\n      \"rationale\": \"Cette phase établit des fondations solides en désengorgeant votre esprit et en créant les premiers remparts contre la surcharge mentale. Il est temps de vider pour mieux remplir.\"\n    },\n    {\n      \"id\": 2,\n      \"title\": \"Phase 2 : Le Silence Intérieur\",\n      \"status\": \"locked\",\n      \"actions\": [\n        {\n          \"id\": \"bdeffc09-68f8-405a-8d10-72649890e905\",\n          \"tips\": \"Lis un livre papier, écoute de la musique douce ou médite. Laisse ton téléphone dans une autre pièce.\",\n          \"type\": \"habitude\",\n          \"title\": \"Zone Sans Bruit Numérique\",\n          \"status\": \"pending\",\n          \"questType\": \"main\",\n          \"rationale\": \"Réduit l'exposition à la lumière bleue et à la dopamine, favorisant la production de mélatonine et un esprit apaisé pour le sommeil.\",\n          \"targetReps\": 7,\n          \"description\": \"Instaure un couvre-feu numérique d'au moins 1 heure avant de dormir : pas d'écrans (téléphone, tablette, ordinateur, TV) dans la chambre ou avant le coucher.\",\n          \"isCompleted\": false,\n          \"time_of_day\": \"night\",\n          \"tracking_type\": \"boolean\"\n        },\n        {\n          \"id\": \"7d492c3e-7110-4a85-9c05-696875e2d6b4\",\n          \"tips\": \"Utilise un minuteur. L'objectif est de briser les cycles de concentration intense et de laisser l'esprit vagabonder librement.\",\n          \"type\": \"habitude\",\n          \"title\": \"La Pause Micro-Déconnexion\",\n          \"status\": \"pending\",\n          \"questType\": \"side\",\n          \"rationale\": \"Prévient la surcharge cognitive, augmente la résilience au stress et améliore la concentration sur le long terme en permettant au cerveau de se 'réinitialiser'.\",\n          \"targetReps\": 14,\n          \"description\": \"Intègre deux micro-pauses de 5 minutes dans ta journée de travail où tu déconnectes totalement : aucun écran, pas de tâche, juste un regard par la fenêtre ou quelques respirations.\",\n          \"isCompleted\": false,\n          \"time_of_day\": \"any_time\",\n          \"tracking_type\": \"boolean\"\n        }\n      ],\n      \"subtitle\": \"Semaine 2 • Cultiver la Paix Mentale\",\n      \"rationale\": \"Après avoir vidé l'esprit, cette phase crée des sanctuaires de calme, réduisant les sollicitations externes et les opportunités de rumination. Vous apprenez à protéger votre espace mental.\"\n    },\n    {\n      \"id\": 3,\n      \"title\": \"Phase 3 : L'Action Ciblée\",\n      \"status\": \"locked\",\n      \"actions\": [\n        {\n          \"id\": \"d1a3e1d4-3259-4d0f-8da7-3fd11859c4a9\",\n          \"tips\": \"Commence par le plus évident. Chaque notification désactivée est un micro-gain de paix mentale. Le désabonnement est un acte libérateur.\",\n          \"type\": \"mission\",\n          \"title\": \"Le Nettoyage Numérique Radical\",\n          \"status\": \"pending\",\n          \"questType\": \"main\",\n          \"rationale\": \"Réduit drastiquement les sollicitations externes et les 'voleurs d'attention', libérant de l'espace mental et réduisant les interruptions qui nourrissent la sensation de surcharge.\",\n          \"description\": \"Passe 30 minutes à te désabonner de toutes les newsletters inutiles, à désactiver les notifications non essentielles (e-mails, réseaux sociaux) et à faire le tri dans tes applications.\",\n          \"isCompleted\": false,\n          \"time_of_day\": \"any_time\",\n          \"tracking_type\": \"boolean\"\n        },\n        {\n          \"id\": \"bf46b78d-13e3-41d0-8fec-65f6453f6f48\",\n          \"tips\": \"Ces tâches doivent être alignées avec tes objectifs majeurs. Évite d'en mettre plus de trois pour ne pas te sentir submergée.\",\n          \"type\": \"habitude\",\n          \"title\": \"La Priorisation Quotidienne du Dragon\",\n          \"status\": \"pending\",\n          \"questType\": \"side\",\n          \"rationale\": \"Combat la dispersion et la perte de fil en offrant une direction claire. Le cerveau se sent moins submergé quand il sait quoi faire en premier.\",\n          \"targetReps\": 7,\n          \"description\": \"Chaque matin, identifie tes 3 tâches les plus importantes ('Dragon' à abattre) pour la journée. Concentre-toi sur celles-ci avant toute autre chose.\",\n          \"isCompleted\": false,\n          \"time_of_day\": \"morning\",\n          \"tracking_type\": \"boolean\"\n        },\n        {\n          \"id\": \"76cd350f-9278-49c3-a229-df3ae0be5681\",\n          \"tips\": \"Trouve un endroit paisible. Tu peux t'asseoir, t'allonger, ou même marcher lentement en pleine conscience. L'important est l'absence de stimulation externe.\",\n          \"type\": \"habitude\",\n          \"title\": \"Le Sanctuaire du Calme\",\n          \"status\": \"pending\",\n          \"questType\": \"side\",\n          \"rationale\": \"Entraîne le cerveau à se détendre et à se désengager des pensées incessantes, renforçant la capacité à revenir au calme en période de stress. C'est une application directe de votre KPI.\",\n          \"targetReps\": 7,\n          \"description\": \"Dédie un moment spécifique de 15 minutes chaque jour à pratiquer ton 'Temps de calme sans stimulation' (Vital Signal). Pas d'écrans, pas de livre, juste toi et le moment présent.\",\n          \"isCompleted\": false,\n          \"time_of_day\": \"any_time\",\n          \"tracking_type\": \"boolean\"\n        }\n      ],\n      \"subtitle\": \"Semaine 3 • De la Surcharge au Contrôle\",\n      \"rationale\": \"Il est temps de passer de la réactivité à la proactivité. Cette phase vous outille pour transformer la sensation d'être submergée en une gestion active et sereine de vos responsabilités.\"\n    },\n    {\n      \"id\": 4,\n      \"title\": \"Phase 4 : Le Maître de l'Orchestre\",\n      \"status\": \"locked\",\n      \"actions\": [\n        {\n          \"id\": \"3080e704-6751-4364-a4aa-8c89fb34f98c\",\n          \"tips\": \"Sois honnête avec toi-même. La reconnaissance est la première étape de la maîtrise. Pour chaque déclencheur, pense à une petite action immédiate que tu peux faire.\",\n          \"type\": \"framework\",\n          \"title\": \"L'Audit de mes Déclencheurs et Solutions\",\n          \"status\": \"pending\",\n          \"questType\": \"main\",\n          \"rationale\": \"Connaître ses déclencheurs permet de développer des stratégies proactives et de réduire l'impact des stresseurs avant qu'ils ne submergent, augmentant ainsi le sentiment de contrôle.\",\n          \"targetReps\": 1,\n          \"description\": \"Réalise un inventaire des situations, pensées ou personnes qui déclenchent le plus ton stress et ta rumination, puis identifie des stratégies concrètes pour y faire face.\",\n          \"isCompleted\": false,\n          \"time_of_day\": \"any_time\",\n          \"tracking_type\": \"boolean\",\n          \"frameworkDetails\": {\n            \"type\": \"one_shot\",\n            \"intro\": \"Pour reprendre le contrôle, tu dois connaître tes ennemis. Identifie les situations, les personnes, les pensées ou les environnements qui déclenchent le plus ton stress et ta sensation d'être submergée. Ensuite, brainstorme des solutions concrètes.\",\n            \"sections\": [\n              {\n                \"id\": \"s1\",\n                \"label\": \"Situations stressantes récurrentes\",\n                \"inputType\": \"list\",\n                \"placeholder\": \"Réunion difficile|Fin de journée chargée avec les enfants\"\n              },\n              {\n                \"id\": \"s2\",\n                \"label\": \"Pensées ou émotions qui amplifient le stress\",\n                \"inputType\": \"list\",\n                \"placeholder\": \"Perfectionnisme|Peur de décevoir|Anticipation négative\"\n              },\n              {\n                \"id\": \"s3\",\n                \"label\": \"Actions que je peux essayer pour gérer ces déclencheurs\",\n                \"inputType\": \"list\",\n                \"placeholder\": \"Prendre une pause de 2min|Dire non à une sollicitation|Préparer ma réponse\"\n              }\n            ]\n          }\n        },\n        {\n          \"id\": \"f8bdc475-178c-4209-aebd-f3e179632235\",\n          \"tips\": \"Commence petit si c'est difficile. L'idée est de s'entraîner à établir des limites saines. Chaque 'non' est un 'oui' à ton bien-être.\",\n          \"type\": \"mission\",\n          \"title\": \"Le Rempart Anti-Surcharge\",\n          \"status\": \"pending\",\n          \"questType\": \"side\",\n          \"rationale\": \"Renforce ta capacité à poser des limites, protégeant ton énergie et ton temps des demandes excessives, essentiel pour gérer la charge mentale sur le long terme.\",\n          \"description\": \"Identifie une tâche ou une sollicitation que tu peux déléguer, reporter ou refuser cette semaine. Fais-le activement pour t'alléger.\",\n          \"isCompleted\": false,\n          \"time_of_day\": \"any_time\",\n          \"tracking_type\": \"boolean\"\n        },\n        {\n          \"id\": \"77d701e6-ab68-4c95-ac3b-5e3182b0982e\",\n          \"tips\": \"Utilise une roue des émotions si besoin. L'objectif est de développer ton intelligence émotionnelle et de ne pas laisser les émotions s'accumuler sans être reconnues.\",\n          \"type\": \"habitude\",\n          \"title\": \"Le Baromètre Émotionnel Quotidien\",\n          \"status\": \"pending\",\n          \"questType\": \"side\",\n          \"rationale\": \"Améliore la conscience de soi et la régulation émotionnelle. En reconnaissant les émotions, on les désamorce et on réduit leur pouvoir de subversion et de rumination.\",\n          \"targetReps\": 7,\n          \"description\": \"Chaque soir, prends 2 minutes pour nommer et ressentir l'émotion dominante de ta journée. Pas de jugement, juste l'observation.\",\n          \"isCompleted\": false,\n          \"time_of_day\": \"evening\",\n          \"tracking_type\": \"boolean\"\n        }\n      ],\n      \"subtitle\": \"Semaine 4 • Ancrer la Stabilité et la Clarté\",\n      \"rationale\": \"Cette dernière phase consolide vos gains, vous transformant en un véritable chef d'orchestre de votre vie mentale. Vous apprenez à anticiper et à déjouer les pièges de la surcharge.\"\n    }\n  ],\n  \"deepWhy\": \"Pour retrouver une énergie inépuisable, être profondément stable et présente dans ma vie quotidienne, et vivre chaque instant avec clarté.\",\n  \"identity\": \"Je suis la Maîtresse de mon Esprit.\",\n  \"strategy\": \"Radicalement, nous allons reprendre le contrôle de votre espace mental pour transformer la surcharge en clarté et l'agitation en stabilité, en ancrant de nouvelles routines en un temps record.\",\n  \"goldenRules\": \"1. Mon cerveau n'est pas une poubelle, je le vide chaque jour.\\n2. Je ne procrastine jamais ma déconnexion.\\n3. L'action précède la motivation, même minime.\",\n  \"vitalSignal\": {\n    \"name\": \"Temps de calme sans stimulation\",\n    \"type\": \"constat\",\n    \"unit\": \"min\",\n    \"startValue\": \"0\",\n    \"description\": \"Le temps que tu consacres chaque jour à ne rien faire délibérément, à juste respirer ou observer, sans écran, livre, ou musique.\",\n    \"targetValue\": \"15\",\n    \"tracking_type\": \"counter\"\n  },\n  \"grimoireTitle\": \"Le Sceptre du Calme\",\n  \"context_problem\": \"Tu te sentais constamment submergée par une charge mentale intense et des ruminations incessantes, te privant de l'énergie et de la stabilité que tu désires. Les nombreuses sollicitations et le manque de temps pour toi te poussaient à te perdre facilement, amplifiant ton stress quotidien et t'empêchant d'être pleinement maîtresse de ton esprit.\",\n  \"sophiaKnowledge\": \"Tu es une femme dynamique de 35-36 ans, au rythme de vie chargé, qui ressent une charge mentale élevée et rumine souvent. Malgré une bonne qualité de sommeil, ton niveau de stress est élevé, ce qui te submerge et te fait perdre le fil. Tu cherches à retrouver énergie et stabilité pour être plus présente et sereine au quotidien.\",\n  \"maintenanceCheck\": {\n    \"type\": \"surveillance\",\n    \"question\": \"Combien de fois t'es-tu sentie submergée et as-tu 'perdu le fil' cette semaine ?\",\n    \"frequency\": \"hebdomadaire\"\n  },\n  \"estimatedDuration\": \"4 semaines\"\n}\n=== ACTIONS / FRAMEWORKS (ÉTAT RÉEL DB) ===\nRÈGLES IMPORTANTES:\n- Les frameworks comptent comme des actions côté utilisateur.\n- \"active\" = activée et visible comme active dans l'app. \"pending\" = pas active.\n- On n'active/désactive pas via WhatsApp: la seule manière d'activer/désactiver, c'est depuis le dashboard.\n\nActives (2):\n- [ACTION] La Respiration du Guerrier (morning)\n- [FRAMEWORK] Le Grand Vide de Cerveau\n\n=== SIGNES VITAUX (État Actuel) ===\n- Temps de calme sans stimulation: 0 min\n",
      "template_fingerprint": null
    },
    "scenario_target": "onboarding"
  },
  "error": null
}