{
  "id": "1c10c5e4-f7ac-4963-811b-639496d19373",
  "created_at": "2026-01-10T15:50:42.927985+00:00",
  "status": "completed",
  "scenario_key": "wa_onboarding_optin_yes_no_plan__run_1768060242394_a4ceed",
  "transcript": [
    {
      "role": "user",
      "content": "Oui",
      "agent_used": null,
      "created_at": "2026-01-10T15:50:43.193124+00:00"
    },
    {
      "role": "assistant",
      "content": "Top, on avance.\n\nMaintenant, file sur ton espace pour finaliser et activer ton plan, c'est l√† que les choses s√©rieuses commencent : https://sophia-coach.ai üòâ\n\nR√©ponds exactement : C'est bon quand c'est fait.",
      "agent_used": "companion",
      "created_at": "2026-01-10T15:50:49.946039+00:00"
    },
    {
      "role": "user",
      "content": "C'est bon",
      "agent_used": null,
      "created_at": "2026-01-10T15:51:20.379878+00:00"
    },
    {
      "role": "assistant",
      "content": "Impeccable. On est lanc√©s, l√†. Ton plan Le Sanctuaire du Repos est bien actif.\n\nTu veux qu‚Äôon parle du plan pour que je te guide sur la prochaine action, ou tu veux parler d‚Äôautre chose d‚Äôabord ? üòâ",
      "agent_used": "companion",
      "created_at": "2026-01-10T15:51:29.60303+00:00"
    },
    {
      "role": "user",
      "content": "Oui, parlons du plan.",
      "agent_used": null,
      "created_at": "2026-01-10T15:51:33.664096+00:00"
    },
    {
      "role": "assistant",
      "content": "On attaque la Phase 1 : Le D√©branchement C√©r√©bral. Ta premi√®re mission prioritaire est de transformer ta chambre en Zone Sans √âcran.\n\nL'objectif est de sortir tous les appareils (t√©l√©phone, tablette, PC) de ta chambre pour casser l'habitude du scroll tardif et prot√©ger ton sommeil.\n\nEst-ce que tu as d√©j√† identifi√© une autre pi√®ce o√π tu peux laisser tes √©crans charger ce soir ? üòâ",
      "agent_used": "architect",
      "created_at": "2026-01-10T15:51:43.803969+00:00"
    },
    {
      "role": "user",
      "content": "Je vais voir, s√ªrement le salon.",
      "agent_used": null,
      "created_at": "2026-01-10T15:51:47.663224+00:00"
    },
    {
      "role": "assistant",
      "content": "Le salon est l'option id√©ale. C'est une barri√®re physique simple et efficace entre ton repos et les stimuli num√©riques.\n\nPour que tu puisses laisser ton t√©l√©phone l√†-bas sans stresser pour demain matin, est-ce que tu as d√©j√† un r√©veil analogique ou une montre pour ton alarme ? üï∞Ô∏è",
      "agent_used": "architect",
      "created_at": "2026-01-10T15:51:55.114215+00:00"
    },
    {
      "role": "user",
      "content": "Oui, je dois en avoir un quelque part.",
      "agent_used": null,
      "created_at": "2026-01-10T15:51:57.482508+00:00"
    },
    {
      "role": "assistant",
      "content": "C'est l'√©l√©ment cl√© de ton infrastructure. Trouve-le maintenant pour √©viter de chercher au moment de te coucher et de c√©der √† la facilit√© du t√©l√©phone.\n\nUne fois que tu l'as, pose-le sur ta table de chevet et installe ton chargeur dans le salon. Ton syst√®me de d√©fense sera pr√™t avant que la fatigue n'arrive.\n\nEst-ce que tu peux aller le chercher et l'installer tout de suite ? üï∞Ô∏è",
      "agent_used": "architect",
      "created_at": "2026-01-10T15:52:06.156688+00:00"
    },
    {
      "role": "user",
      "content": "Je ferai √ßa tout √† l'heure.",
      "agent_used": null,
      "created_at": "2026-01-10T15:52:08.749617+00:00"
    },
    {
      "role": "assistant",
      "content": "Je le note. Sois vigilant : l'intention sans action imm√©diate est souvent le premier pas vers l'√©chec du syst√®me. Ton sanctuaire a besoin de cette barri√®re physique pour exister r√©ellement.\n\n√Ä quelle heure pr√©cise vas-tu placer ce r√©veil dans ta chambre pour que ce soit r√©gl√© avant ton d√Æner ? üï∞Ô∏è",
      "agent_used": "architect",
      "created_at": "2026-01-10T15:52:24.298057+00:00"
    },
    {
      "role": "user",
      "content": "Vers 19h je pense.",
      "agent_used": null,
      "created_at": "2026-01-10T15:52:26.46476+00:00"
    },
    {
      "role": "assistant",
      "content": "19h, c'est ton √©ch√©ance. Ne laisse pas l'inertie de la soir√©e saboter cette installation : c'est la fondation physique de ton nouveau syst√®me.\n\nPuisque ta chambre sera bient√¥t s√©curis√©e, pr√©parons ton autre action active : Le Bilan Rapide de la Journ√©e.\n\nAs-tu d√©j√† un carnet et un stylo pr√™ts sur une table hors de ta chambre pour vider ton cache mental ce soir ? üìù",
      "agent_used": "architect",
      "created_at": "2026-01-10T15:52:36.126108+00:00"
    },
    {
      "role": "user",
      "content": "Oui, j'ai un carnet et un stylo. Je peux les mettre dans le salon.",
      "agent_used": null,
      "created_at": "2026-01-10T15:52:39.085236+00:00"
    },
    {
      "role": "assistant",
      "content": "C'est un excellent choix d'emplacement. Le salon devient ta zone de d√©compression, une √©tape n√©cessaire avant d'entrer dans ton sanctuaire de sommeil. üõãÔ∏è\n\nPour que ce vidage de cache soit efficace, le moment doit √™tre fixe. Dans ton plan, c'est pr√©vu 30 minutes avant l'extinction totale des √©crans.\n\n√Ä quelle heure pr√©cise vas-tu ouvrir ce carnet pour la premi√®re fois ce soir ? üï∞Ô∏è",
      "agent_used": "architect",
      "created_at": "2026-01-10T15:52:47.029943+00:00"
    },
    {
      "role": "user",
      "content": "Vers 21h30 je dirais.",
      "agent_used": null,
      "created_at": "2026-01-10T15:52:49.951336+00:00"
    },
    {
      "role": "assistant",
      "content": "21h30 est un cr√©neau parfait. Cela te laisse exactement 30 minutes pour d√©charger ton esprit avant l'extinction des feux √† 22h00. C'est la structure id√©ale pour prot√©ger ton sommeil. üï∞Ô∏è\n\nMaintenant que ton architecture de soir√©e est claire, il ne reste plus qu'√† l'appliquer concr√®tement.\n\nEst-ce que tu as d√©j√† un r√©veil classique pour remplacer ton t√©l√©phone demain matin, ou dois-tu en trouver un d'ici ce soir ? ‚è∞",
      "agent_used": "architect",
      "created_at": "2026-01-10T15:53:02.603671+00:00"
    },
    {
      "role": "user",
      "content": "Oui, je t'ai dit que j'allais le chercher pour 19h.",
      "agent_used": null,
      "created_at": "2026-01-10T15:53:06.638716+00:00"
    },
    {
      "role": "assistant",
      "content": "C'est not√© pour 19h. C'est le dernier verrou technique n√©cessaire pour s√©curiser l'√©tanch√©it√© de ton sanctuaire de sommeil. ‚è∞\n\nUne fois le r√©veil install√©, quel endroit pr√©cis hors de la chambre as-tu choisi pour charger ton t√©l√©phone ce soir ? üì±",
      "agent_used": "architect",
      "created_at": "2026-01-10T15:53:18.776143+00:00"
    }
  ],
  "state_before": {
    "profile": {
      "id": "96dd6fb9-b4ae-4504-803d-d27056133a0f",
      "email": "run-evals+74f145f835354f@example.com",
      "full_name": "Eval Runner",
      "trial_end": "2026-01-17T15:50:42.891+00:00",
      "phone_number": "+15559814625304",
      "phone_invalid": false,
      "whatsapp_state": null,
      "phone_verified_at": "2026-01-10T15:50:42.893+00:00",
      "whatsapp_opted_in": false,
      "whatsapp_opted_out_at": null,
      "whatsapp_optin_sent_at": null,
      "whatsapp_optout_reason": null,
      "whatsapp_bilan_opted_in": false,
      "whatsapp_last_inbound_at": null,
      "whatsapp_last_outbound_at": null,
      "whatsapp_state_updated_at": null,
      "whatsapp_optout_confirmed_at": null
    },
    "chat_state": null
  },
  "state_after": {
    "profile": {
      "id": "96dd6fb9-b4ae-4504-803d-d27056133a0f",
      "email": "run-evals+74f145f835354f@example.com",
      "full_name": "Eval Runner",
      "trial_end": "2026-01-17T15:50:42.891+00:00",
      "phone_number": "+15559814625304",
      "phone_invalid": false,
      "whatsapp_state": null,
      "phone_verified_at": "2026-01-10T15:50:42.893+00:00",
      "whatsapp_opted_in": true,
      "whatsapp_opted_out_at": null,
      "whatsapp_optin_sent_at": null,
      "whatsapp_optout_reason": null,
      "whatsapp_bilan_opted_in": false,
      "whatsapp_last_inbound_at": "2026-01-10T15:53:06.632+00:00",
      "whatsapp_last_outbound_at": null,
      "whatsapp_state_updated_at": "2026-01-10T15:51:33.712+00:00",
      "whatsapp_optout_confirmed_at": null
    },
    "chat_state": {
      "scope": "whatsapp",
      "user_id": "96dd6fb9-b4ae-4504-803d-d27056133a0f",
      "risk_level": 0,
      "updated_at": "2026-01-10T15:53:18.768237+00:00",
      "temp_memory": {
        "architect": {
          "last_q_fps": [
            "tu veux qu on parle du plan pour que je te guide sur la prochaine action ou tu veux parler d autre chose d abord?",
            "est ce que tu as deja identifie une autre piece ou tu peux laisser tes ecrans charger ce soir?",
            "pour que tu puisses laisser ton telephone la bas sans stresser pour demain matin est ce que tu as deja un reveil analogi",
            "est ce que tu peux aller le chercher et l installer tout de suite?",
            "a quelle heure precise vas tu placer ce reveil dans ta chambre pour que ce soit regle avant ton diner?",
            "as tu deja un carnet et un stylo prets sur une table hors de ta chambre pour vider ton cache mental ce soir?",
            "a quelle heure precise vas tu ouvrir ce carnet pour la premiere fois ce soir?",
            "est ce que tu as deja un reveil classique pour remplacer ton telephone demain matin ou dois tu en trouver un d ici ce so"
          ],
          "loop_count": 4,
          "plan_focus": true,
          "last_updated_at": "2026-01-10T15:53:09.577Z",
          "current_objective": null
        }
      },
      "current_mode": "architect",
      "last_processed_at": "2026-01-10T15:50:43.205+00:00",
      "short_term_context": "",
      "investigation_state": null,
      "last_interaction_at": "2026-01-10T15:50:43.20691+00:00",
      "unprocessed_msg_count": 10
    }
  },
  "issues": [
    {
      "code": "context_amnesia",
      "message": "The Architect fails to retain information provided earlier in the conversation. It asks about the alarm clock availability (already confirmed for 19h) and the charging location (already confirmed as 'Salon'), causing user frustration.",
      "evidence": {
        "snippet": "ASSISTANT: Est-ce que tu as d√©j√† un r√©veil classique... ? / USER: Oui, je t'ai dit que j'allais le chercher pour 19h. / ASSISTANT: ...quel endroit pr√©cis hors de la chambre as-tu choisi pour charger ton t√©l√©phone ce soir ?",
        "agent_used": "sophia.architect"
      },
      "severity": "high"
    }
  ],
  "suggestions": [
    {
      "action": "append",
      "rationale": "Prevents the agent from looping through its internal checklist without acknowledging answers the user has already given, which breaks immersion and trust.",
      "prompt_key": "sophia.architect",
      "context_block": "=== CONTEXT (transcript excerpt) ===\n=== STATE_BEFORE (user_chat_states) ===\ninvestigation_state:\nnull\n=== TRANSCRIPT ===\n#0 USER: Oui\n#1 ASSISTANT(companion): Top, on avance. Maintenant, file sur ton espace pour finaliser et activer ton plan, c'est l√† que les choses s√©rieuses commencent : https://sophia-coach.ai üòâ R√©ponds exactement : C'est bon quand c'est fait.\n#2 USER: C'est bon\n#3 ASSISTANT(companion): Impeccable. On est lanc√©s, l√†. Ton plan Le Sanctuaire du Repos est bien actif. Tu veux qu‚Äôon parle du plan pour que je te guide sur la prochaine action, ou tu veux parler d‚Äôautre chose d‚Äôabord ? üòâ\n#4 USER: Oui, parlons du plan.\n#5 ASSISTANT(architect): On attaque la Phase 1 : Le D√©branchement C√©r√©bral. Ta premi√®re mission prioritaire est de transformer ta chambre en Zone Sans √âcran. L'objectif est de sortir tous les appareils (t√©l√©phone, tablette, PC) de ta chambre pour casser l'habitude du scroll tardif et prot√©ger ton sommeil. Est-ce que tu as d√©j√† identifi√© une autre pi√®ce o√π tu peux laisser tes √©crans charger ce soir ? üòâ\n\n=== APPLY ===\nprompt_key: sophia.architect\naction: append\n\nproposed_addendum:\nCRITICAL: Before asking a configuration question (time, location, tool), SCAN the conversation history. If the user has already defined this parameter (e.g., 'Salon' for charging, '19h' for the alarm), DO NOT ask again. Instead, validate the existing choice and move to the next distinct step.",
      "proposed_addendum": "CRITICAL: Before asking a configuration question (time, location, tool), SCAN the conversation history. If the user has already defined this parameter (e.g., 'Salon' for charging, '19h' for the alarm), DO NOT ask again. Instead, validate the existing choice and move to the next distinct step."
    }
  ],
  "metrics": {
    "cost_usd": 0,
    "request_id": "wa_onboarding_bundle:wa_onboarding_optin_yes_no_plan__run_1768060242394_a4ceed:i0:s1916298011:core:wa_onboarding_optin_yes_no_plan__run_1768060242394_a4ceed",
    "total_tokens": 0,
    "output_tokens": 0,
    "prompt_tokens": 0,
    "judge_llm_used": true,
    "mega_test_mode": false
  },
  "config": {
    "tags": [
      "whatsapp.onboarding",
      "whatsapp.webhook",
      "mechanical"
    ],
    "limits": {
      "model": "gemini-3-pro-preview",
      "user_difficulty": "mid",
      "bilan_actions_count": 0,
      "test_post_checkup_deferral": false
    },
    "channel": "whatsapp",
    "request_id": "wa_onboarding_bundle:wa_onboarding_optin_yes_no_plan__run_1768060242394_a4ceed:i0:s1916298011:core:wa_onboarding_optin_yes_no_plan__run_1768060242394_a4ceed",
    "description": "WhatsApp onboarding (webhook): user accepts opt-in via button but has no active plan -> ask to finalize plan on site, then reply 'C'est bon'.",
    "plan_snapshot": {
      "plan": {
        "id": "95d849c8-7cc3-4046-b574-6132ce11202f",
        "title": "Le Sanctuaire du Repos",
        "status": "active",
        "content": {
          "phases": [
            {
              "id": 1,
              "title": "Phase 1 : Le D√©branchement C√©r√©bral",
              "status": "active",
              "actions": [
                {
                  "id": "b0f4386d-fc8d-43e1-a71c-19b2649cf190",
                  "tips": "Fais de cette action un rituel solennel. Explique √† ton entourage ton engagement. L'argent d√©pens√© dans un r√©veil est un investissement dans ton sommeil.",
                  "type": "mission",
                  "title": "Zone Sans √âcran : Le Sanatorium de la Chambre",
                  "status": "active",
                  "questType": "main",
                  "rationale": "Le simple fait de voir un √©cran peut activer ton cerveau et lib√©rer de la dopamine, rendant l'endormissement difficile. Cette d√©connexion spatiale est essentielle pour r√©associer ta chambre au repos.",
                  "description": "Retire absolument tous les √©crans (t√©l√©phone, tablette, ordinateur, TV) de ta chambre. Place-les dans une pi√®ce √† part ou loin de ton lit. Ach√®te un r√©veil analogique si tu n'en as pas.",
                  "isCompleted": false,
                  "time_of_day": "any_time",
                  "tracking_type": "boolean"
                },
                {
                  "id": "8daf5bf4-3e77-415d-9429-b5ba6a4dfc18",
                  "tips": "Ne cherche pas la perfection. C'est un 'vidage de cache' rapide. Un petit carnet et un stylo suffisent.",
                  "type": "habitude",
                  "title": "Le Bilan Rapide de la Journ√©e",
                  "status": "active",
                  "questType": "side",
                  "rationale": "Cela permet de d√©charger les pens√©es parasites qui tournent en boucle et de pr√©parer ton esprit pour le lendemain, √©vitant ainsi la surcharge mentale au moment du coucher. C'est une ancre pour r√©duire l'oubli et la procrastination.",
                  "targetReps": 10,
                  "description": "Chaque soir, 30 minutes avant l'heure vis√©e pour l'extinction des √©crans (hors de ta chambre), prends 5 minutes pour √©crire sur papier trois choses marquantes de ta journ√©e (positives ou n√©gatives) et une action prioritaire pour le lendemain.",
                  "isCompleted": false,
                  "time_of_day": "evening",
                  "tracking_type": "boolean"
                }
              ],
              "subtitle": "Semaines 1-2 ‚Ä¢ Couper les ancres num√©riques",
              "rationale": "Avant de construire, il faut d√©blayer le terrain. Nous allons briser l'association neuronale entre votre espace de repos et les stimuli num√©riques, qui sont vos principales sources de difficult√© d'endormissement et de surcharge mentale."
            },
            {
              "id": 2,
              "title": "Phase 2 : L'Horloger Interne",
              "status": "locked",
              "actions": [
                {
                  "id": "3d4237d8-507b-42e2-9d6e-82ef69d192cc",
                  "tips": "Place ton r√©veil loin de ton lit pour t'obliger √† te lever. Ouvre tes rideaux d√®s que possible.",
                  "type": "habitude",
                  "title": "L'Ancre du R√©veil",
                  "status": "pending",
                  "questType": "main",
                  "rationale": "La r√©gularit√© de l'heure de r√©veil est le facteur le plus influent sur la synchronisation de ton horloge circadienne, plus encore que l'heure de coucher. Cela cr√©e une ancre stable pour toute ta journ√©e.",
                  "targetReps": 14,
                  "description": "Fixe une heure de r√©veil et respecte-la chaque jour, m√™me le weekend. Sors du lit d√®s que ton r√©veil sonne. L'exposition √† la lumi√®re du jour d√®s le lever est un puissant signal pour ton cerveau.",
                  "isCompleted": false,
                  "time_of_day": "morning",
                  "tracking_type": "boolean"
                },
                {
                  "id": "f2929cb3-f79b-46ed-b37a-6c427030e812",
                  "tips": "Sois honn√™te avec toi-m√™me. Il n'y a pas de bonne ou de mauvaise r√©ponse. Juste une observation de ton paysage int√©rieur.",
                  "type": "framework",
                  "title": "Le Carnet des Saisons Mentales",
                  "status": "pending",
                  "questType": "side",
                  "rationale": "M√™me avec un 'stress faible', le sentiment d'√™tre 'd√©bord√©' indique une charge cognitive importante. Ce framework t'aide √† externaliser et analyser ces blocages, r√©duisant l'oubli et la procrastination par une meilleure connaissance de soi.",
                  "targetReps": 4,
                  "description": "Deux fois par semaine, prends 15 minutes pour explorer tes sources de surcharge et tes moments de clart√©. Cela t'aidera √† identifier les patterns et √† mieux g√©rer ton √©nergie mentale.",
                  "isCompleted": false,
                  "time_of_day": "any_time",
                  "tracking_type": "boolean",
                  "frameworkDetails": {
                    "type": "recurring",
                    "intro": "L'objectif est de cartographier les moments o√π vous vous sentez le plus 'd√©bord√©' et ceux o√π votre esprit est le plus clair. Cela vous donnera des pistes pour optimiser votre journ√©e.",
                    "sections": [
                      {
                        "id": "s2f1",
                        "label": "Quand me suis-je senti le plus submerg√© aujourd'hui/cette semaine ? (moment, contexte)",
                        "inputType": "textarea",
                        "placeholder": "Mardi apr√®s-midi, apr√®s la r√©union, trop de mails en attente..."
                      },
                      {
                        "id": "s2f2",
                        "label": "Quelle a √©t√© ma plus grande distraction ou source d'oubli ?",
                        "inputType": "text",
                        "placeholder": "Mon t√©l√©phone, une t√¢che non not√©e, l'interruption d'un coll√®gue..."
                      },
                      {
                        "id": "s2f3",
                        "label": "Quand mon esprit √©tait-il le plus clair et efficace ?",
                        "inputType": "text",
                        "placeholder": "Le matin t√¥t, apr√®s ma promenade, quand personne ne m'interrompt..."
                      },
                      {
                        "id": "s2f4",
                        "label": "Une action concr√®te pour r√©duire la surcharge la prochaine fois :",
                        "inputType": "textarea",
                        "placeholder": "Bloquer 30 minutes sans notification, d√©l√©guer, dire non..."
                      }
                    ]
                  }
                }
              ],
              "subtitle": "Semaines 3-4 ‚Ä¢ Restaurer le rythme circadien",
              "rationale": "Maintenant que les interf√©rences sont r√©duites, nous allons reprogrammer votre horloge biologique pour qu'elle retrouve sa synchronisation naturelle. La r√©gularit√© est la cl√© de la stabilit√© que vous recherchez."
            },
            {
              "id": 3,
              "title": "Phase 3 : L'Architecture du Calme",
              "status": "locked",
              "actions": [
                {
                  "id": "8a36a728-6987-4d27-9c8d-59033bd4a520",
                  "tips": "Cr√©e une 'playlist sommeil'. Pr√©pare ton livre √† l'avance. Ce n'est pas une corv√©e, c'est un cadeau que tu te fais.",
                  "type": "habitude",
                  "title": "Rituel du Soir : La Douce Transition",
                  "status": "pending",
                  "questType": "main",
                  "rationale": "Ce rituel envoie des signaux clairs √† votre cerveau qu'il est temps de ralentir. Il favorise la production de m√©latonine et r√©duit l'activation mentale, facilitant ainsi l'endormissement.",
                  "targetReps": 10,
                  "description": "Chaque soir, 1h avant votre nouvelle heure cible de coucher, engagez-vous dans un rituel relaxant sans √©cran. Exemples : lire un livre papier, √©couter de la musique douce, faire un √©tirement l√©ger, prendre une douche ti√®de. Choisis 1 √† 2 activit√©s et sois r√©gulier.",
                  "isCompleted": false,
                  "time_of_day": "evening",
                  "tracking_type": "boolean"
                },
                {
                  "id": "0e0f2024-d7db-43bc-9101-7a446237eb27",
                  "tips": "Commence par le plus simple : obscurcis ta pi√®ce au maximum. Chaque d√©tail compte pour cr√©er une bulle de repos.",
                  "type": "mission",
                  "title": "L'Ambiance Sensorielle Optimale",
                  "status": "pending",
                  "questType": "side",
                  "rationale": "Les signaux externes (lumi√®re, bruit, temp√©rature) sont de puissants modulateurs du sommeil. En les ma√Ætrisant, vous cr√©ez un environnement propice √† un sommeil profond et ininterrompu, renfor√ßant l'efficacit√© de vos nouvelles habitudes.",
                  "description": "√âvalue et optimise activement l'environnement sensoriel de ta chambre pour le sommeil. Cela inclut : rideaux occultants, bouchons d'oreille/masque de sommeil, temp√©rature fra√Æche (18-20¬∞C), et r√©duction du bruit au maximum. Investis dans ces √©l√©ments si n√©cessaire.",
                  "isCompleted": false,
                  "time_of_day": "any_time",
                  "tracking_type": "boolean"
                }
              ],
              "subtitle": "Semaines 5-6 ‚Ä¢ Cultiver la pr√©-d√©tente",
              "rationale": "Avec un rythme stable, nous pouvons maintenant introduire des techniques actives pour favoriser la d√©tente et r√©duire la difficult√© d'endormissement. Votre corps et votre esprit apprendront √† se rel√¢cher avant le coucher."
            },
            {
              "id": 4,
              "title": "Phase 4 : La Citadelle Int√©rieure",
              "status": "locked",
              "actions": [
                {
                  "id": "1ab947df-231e-4ccf-8959-d4b338b000d6",
                  "tips": "Si ton esprit s'√©gare, ram√®ne doucement ton attention sur ta respiration. C'est un entra√Ænement, pas un examen.",
                  "type": "habitude",
                  "title": "La Respiration du Calme (2-4-6)",
                  "status": "pending",
                  "questType": "main",
                  "rationale": "Cette technique de respiration active le syst√®me nerveux parasympathique, responsable de la relaxation. C'est un outil direct pour calmer l'esprit et le corps, contrant la difficult√© d'endormissement et renfor√ßant la sensation de contr√¥le.",
                  "targetReps": 10,
                  "description": "Chaque soir, une fois allong√©(e) dans ton lit, pratique la respiration 2-4-6 : inspire 2 secondes, retiens 4 secondes, expire 6 secondes. Fais 5 √† 10 cycles, ou jusqu'√† ce que tu sentes un rel√¢chement. Concentre-toi sur le mouvement de ton ventre.",
                  "isCompleted": false,
                  "time_of_day": "night",
                  "tracking_type": "boolean"
                },
                {
                  "id": "c319656a-dfcf-4a58-be5f-cd5bc3a16563",
                  "tips": "Pense √† ce que tu dirais √† ton 'moi' du d√©but du programme. Quelles sont les 3 le√ßons cl√©s que tu as apprises ?",
                  "type": "framework",
                  "title": "L'√âvaluation Architecturale : Ma√Ætriser ma Stabilit√©",
                  "status": "pending",
                  "questType": "side",
                  "rationale": "Ce framework est crucial pour ancrer les changements. En r√©fl√©chissant activement √† votre progression, vous renforcez les chemins neuronaux des nouvelles habitudes et d√©veloppez une strat√©gie personnalis√©e pour √©viter de retomber dans les anciens sch√©mas d'oubli et de procrastination. C'est l'ultime √©tape vers la p√©rennisation de votre transformation.",
                  "targetReps": 1,
                  "description": "Prends 20 minutes pour √©valuer ton parcours. Qu'est-ce qui a le mieux fonctionn√© ? Quels ont √©t√© les d√©fis ? Comment maintenir cette nouvelle √©nergie et stabilit√© √† long terme ?",
                  "isCompleted": false,
                  "time_of_day": "any_time",
                  "tracking_type": "boolean",
                  "frameworkDetails": {
                    "type": "one_shot",
                    "intro": "Vous √™tes √† la fin de votre protocole. Prenez un moment pour reconna√Ætre le chemin parcouru et consolider votre apprentissage. Cette r√©flexion est votre boussole pour l'avenir.",
                    "sections": [
                      {
                        "id": "s4f1",
                        "label": "Quelles sont les 3 habitudes ou changements qui ont eu le plus grand impact sur mon sommeil et mon √©nergie ?",
                        "inputType": "list",
                        "placeholder": "Ex: La suppression des √©crans dans la chambre."
                      },
                      {
                        "id": "s4f2",
                        "label": "Quels ont √©t√© mes principaux d√©fis et comment les ai-je surmont√©s (ou pourrais-je les surmonter √† l'avenir) ?",
                        "inputType": "textarea",
                        "placeholder": "Ex: J'ai eu du mal avec la r√©gularit√© le weekend, mais la lumi√®re du matin m'a aid√©."
                      },
                      {
                        "id": "s4f3",
                        "label": "Comment d√©crirais-je mon niveau d'√©nergie et de stabilit√© au quotidien maintenant, compar√© au d√©but du programme (√©chelle 1-10) ?",
                        "inputType": "scale",
                        "placeholder": "7"
                      },
                      {
                        "id": "s4f4",
                        "label": "Mes 3 r√®gles d'or personnelles pour maintenir cette nouvelle qualit√© de sommeil √† long terme :",
                        "inputType": "list",
                        "placeholder": "Ex: Une heure sans √©cran avant de dormir."
                      },
                      {
                        "id": "s4f5",
                        "label": "Un message ou un conseil que je me donnerais pour les prochains mois :",
                        "inputType": "textarea",
                        "placeholder": "La discipline est la libert√©. Continue √† t'√©couter."
                      }
                    ]
                  }
                }
              ],
              "subtitle": "Semaines 7-8 ‚Ä¢ Ancrer la r√©silience",
              "rationale": "Les fondations sont pos√©es, le rythme est √©tabli. Cette derni√®re phase vise √† consolider vos acquis et √† vous outiller mentalement pour maintenir cette nouvelle stabilit√©, m√™me face aux in√©vitables 'sollicitations'."
            }
          ],
          "deepWhy": "Pour retrouver de l'√©nergie et √™tre plus stable au quotidien, afin de naviguer les sollicitations de la vie avec pr√©sence et efficacit√©.",
          "identity": "Je suis un Architecte de ma S√©r√©nit√© Nocturne, ma√Ætre de mon √©nergie et de ma stabilit√©.",
          "strategy": "Nous allons d√©sactiver les interf√©rences num√©riques et construire un rituel de fin de journ√©e pour retrouver la s√©r√©nit√©. La priorit√© est de restaurer votre √©nergie fondamentale avant d'adresser les d√©fis quotidiens.",
          "goldenRules": "1. Ma chambre est un sanctuaire sans √©cran.\n2. L'intention pr√©c√®de l'action : je pr√©pare mon sommeil.\n3. La r√©gularit√© est ma meilleure alli√©e.",
          "vitalSignal": {
            "name": "Heure d'extinction des √©crans",
            "type": "constat",
            "unit": "h",
            "startValue": "00:30",
            "description": "L'objectif est d'avancer progressivement l'heure de coucher les √©crans. Vise √† gagner 15 minutes tous les 4 jours sur les 2 premi√®res phases.",
            "targetValue": "22:00",
            "tracking_type": "counter"
          },
          "grimoireTitle": "Le Sanctuaire du Repos",
          "context_problem": "Tu te sentais souvent d√©bord√© et fatigu√©, ce qui impactait ta stabilit√© quotidienne. La difficult√© d'endormissement et le scroll tardif le soir √©taient tes principaux blocages, te privant du repos n√©cessaire et t'entra√Ænant dans un cycle d'oubli et de remise √† plus tard.",
          "sophiaKnowledge": "Tu es une personne avec un rythme de vie charg√©, qui ressent une baisse d'√©nergie et une instabilit√© au quotidien dues √† des difficult√©s d'endormissement et un usage tardif du t√©l√©phone. Malgr√© un stress per√ßu comme 'faible', ton sentiment d'√™tre 'd√©bord√©' et tes habitudes de procrastination sapent ta capacit√© √† mettre en place des changements. Tu cherches la stabilit√© via un meilleur sommeil.",
          "maintenanceCheck": {
            "type": "surveillance",
            "question": "Combien de soirs cette semaine as-tu utilis√© un √©cran (t√©l√©phone, tablette, PC) apr√®s 22h?",
            "frequency": "hebdomadaire"
          },
          "estimatedDuration": "8 semaines"
        },
        "goal_id": "cf87be11-746d-4682-9e58-ac18a67f21ab",
        "deep_why": "Pour retrouver de l'√©nergie et √™tre plus stable au quotidien, afin de naviguer les sollicitations de la vie avec pr√©sence et efficacit√©.",
        "created_at": "2026-01-10T15:51:20.329485+00:00",
        "inputs_why": null,
        "current_phase": 1,
        "submission_id": "98692df5-5d83-4992-86b4-0c47c34d8bdb",
        "inputs_context": null,
        "inputs_blockers": null,
        "progress_percentage": 0
      },
      "actions": [
        {
          "id": "b0f4386d-fc8d-43e1-a71c-19b2649cf190",
          "title": "Zone Sans √âcran : Le Sanatorium de la Chambre",
          "status": "active",
          "created_at": "2026-01-10T15:51:20.345333+00:00",
          "description": "Retire absolument tous les √©crans (t√©l√©phone, tablette, ordinateur, TV) de ta chambre. Place-les dans une pi√®ce √† part ou loin de ton lit. Ach√®te un r√©veil analogique si tu n'en as pas.",
          "target_reps": 1,
          "time_of_day": "any_time",
          "current_reps": 0,
          "tracking_type": "boolean",
          "last_performed_at": "2026-01-08T15:51:20.342+00:00"
        },
        {
          "id": "8daf5bf4-3e77-415d-9429-b5ba6a4dfc18",
          "title": "Le Bilan Rapide de la Journ√©e",
          "status": "active",
          "created_at": "2026-01-10T15:51:20.345333+00:00",
          "description": "Chaque soir, 30 minutes avant l'heure vis√©e pour l'extinction des √©crans (hors de ta chambre), prends 5 minutes pour √©crire sur papier trois choses marquantes de ta journ√©e (positives ou n√©gatives) et une action prioritaire pour le lendemain.",
          "target_reps": 10,
          "time_of_day": "evening",
          "current_reps": 0,
          "tracking_type": "boolean",
          "last_performed_at": "2026-01-08T15:51:20.342+00:00"
        }
      ],
      "frameworks": [],
      "dashboard_context": "=== PLAN ACTUEL (Tableau de Bord) ===\nTitre: Le Sanctuaire du Repos\nStatut: active\nPhase courante (dashboard): 1\nPourquoi (Deep Why): Pour retrouver de l'√©nergie et √™tre plus stable au quotidien, afin de naviguer les sollicitations de la vie avec pr√©sence et efficacit√©.\nD√âTAIL COMPLET DU PLAN (Structure JSON) :\n{\n  \"phases\": [\n    {\n      \"id\": 1,\n      \"title\": \"Phase 1 : Le D√©branchement C√©r√©bral\",\n      \"status\": \"active\",\n      \"actions\": [\n        {\n          \"id\": \"b0f4386d-fc8d-43e1-a71c-19b2649cf190\",\n          \"tips\": \"Fais de cette action un rituel solennel. Explique √† ton entourage ton engagement. L'argent d√©pens√© dans un r√©veil est un investissement dans ton sommeil.\",\n          \"type\": \"mission\",\n          \"title\": \"Zone Sans √âcran : Le Sanatorium de la Chambre\",\n          \"status\": \"active\",\n          \"questType\": \"main\",\n          \"rationale\": \"Le simple fait de voir un √©cran peut activer ton cerveau et lib√©rer de la dopamine, rendant l'endormissement difficile. Cette d√©connexion spatiale est essentielle pour r√©associer ta chambre au repos.\",\n          \"description\": \"Retire absolument tous les √©crans (t√©l√©phone, tablette, ordinateur, TV) de ta chambre. Place-les dans une pi√®ce √† part ou loin de ton lit. Ach√®te un r√©veil analogique si tu n'en as pas.\",\n          \"isCompleted\": false,\n          \"time_of_day\": \"any_time\",\n          \"tracking_type\": \"boolean\"\n        },\n        {\n          \"id\": \"8daf5bf4-3e77-415d-9429-b5ba6a4dfc18\",\n          \"tips\": \"Ne cherche pas la perfection. C'est un 'vidage de cache' rapide. Un petit carnet et un stylo suffisent.\",\n          \"type\": \"habitude\",\n          \"title\": \"Le Bilan Rapide de la Journ√©e\",\n          \"status\": \"active\",\n          \"questType\": \"side\",\n          \"rationale\": \"Cela permet de d√©charger les pens√©es parasites qui tournent en boucle et de pr√©parer ton esprit pour le lendemain, √©vitant ainsi la surcharge mentale au moment du coucher. C'est une ancre pour r√©duire l'oubli et la procrastination.\",\n          \"targetReps\": 10,\n          \"description\": \"Chaque soir, 30 minutes avant l'heure vis√©e pour l'extinction des √©crans (hors de ta chambre), prends 5 minutes pour √©crire sur papier trois choses marquantes de ta journ√©e (positives ou n√©gatives) et une action prioritaire pour le lendemain.\",\n          \"isCompleted\": false,\n          \"time_of_day\": \"evening\",\n          \"tracking_type\": \"boolean\"\n        }\n      ],\n      \"subtitle\": \"Semaines 1-2 ‚Ä¢ Couper les ancres num√©riques\",\n      \"rationale\": \"Avant de construire, il faut d√©blayer le terrain. Nous allons briser l'association neuronale entre votre espace de repos et les stimuli num√©riques, qui sont vos principales sources de difficult√© d'endormissement et de surcharge mentale.\"\n    },\n    {\n      \"id\": 2,\n      \"title\": \"Phase 2 : L'Horloger Interne\",\n      \"status\": \"locked\",\n      \"actions\": [\n        {\n          \"id\": \"3d4237d8-507b-42e2-9d6e-82ef69d192cc\",\n          \"tips\": \"Place ton r√©veil loin de ton lit pour t'obliger √† te lever. Ouvre tes rideaux d√®s que possible.\",\n          \"type\": \"habitude\",\n          \"title\": \"L'Ancre du R√©veil\",\n          \"status\": \"pending\",\n          \"questType\": \"main\",\n          \"rationale\": \"La r√©gularit√© de l'heure de r√©veil est le facteur le plus influent sur la synchronisation de ton horloge circadienne, plus encore que l'heure de coucher. Cela cr√©e une ancre stable pour toute ta journ√©e.\",\n          \"targetReps\": 14,\n          \"description\": \"Fixe une heure de r√©veil et respecte-la chaque jour, m√™me le weekend. Sors du lit d√®s que ton r√©veil sonne. L'exposition √† la lumi√®re du jour d√®s le lever est un puissant signal pour ton cerveau.\",\n          \"isCompleted\": false,\n          \"time_of_day\": \"morning\",\n          \"tracking_type\": \"boolean\"\n        },\n        {\n          \"id\": \"f2929cb3-f79b-46ed-b37a-6c427030e812\",\n          \"tips\": \"Sois honn√™te avec toi-m√™me. Il n'y a pas de bonne ou de mauvaise r√©ponse. Juste une observation de ton paysage int√©rieur.\",\n          \"type\": \"framework\",\n          \"title\": \"Le Carnet des Saisons Mentales\",\n          \"status\": \"pending\",\n          \"questType\": \"side\",\n          \"rationale\": \"M√™me avec un 'stress faible', le sentiment d'√™tre 'd√©bord√©' indique une charge cognitive importante. Ce framework t'aide √† externaliser et analyser ces blocages, r√©duisant l'oubli et la procrastination par une meilleure connaissance de soi.\",\n          \"targetReps\": 4,\n          \"description\": \"Deux fois par semaine, prends 15 minutes pour explorer tes sources de surcharge et tes moments de clart√©. Cela t'aidera √† identifier les patterns et √† mieux g√©rer ton √©nergie mentale.\",\n          \"isCompleted\": false,\n          \"time_of_day\": \"any_time\",\n          \"tracking_type\": \"boolean\",\n          \"frameworkDetails\": {\n            \"type\": \"recurring\",\n            \"intro\": \"L'objectif est de cartographier les moments o√π vous vous sentez le plus 'd√©bord√©' et ceux o√π votre esprit est le plus clair. Cela vous donnera des pistes pour optimiser votre journ√©e.\",\n            \"sections\": [\n              {\n                \"id\": \"s2f1\",\n                \"label\": \"Quand me suis-je senti le plus submerg√© aujourd'hui/cette semaine ? (moment, contexte)\",\n                \"inputType\": \"textarea\",\n                \"placeholder\": \"Mardi apr√®s-midi, apr√®s la r√©union, trop de mails en attente...\"\n              },\n              {\n                \"id\": \"s2f2\",\n                \"label\": \"Quelle a √©t√© ma plus grande distraction ou source d'oubli ?\",\n                \"inputType\": \"text\",\n                \"placeholder\": \"Mon t√©l√©phone, une t√¢che non not√©e, l'interruption d'un coll√®gue...\"\n              },\n              {\n                \"id\": \"s2f3\",\n                \"label\": \"Quand mon esprit √©tait-il le plus clair et efficace ?\",\n                \"inputType\": \"text\",\n                \"placeholder\": \"Le matin t√¥t, apr√®s ma promenade, quand personne ne m'interrompt...\"\n              },\n              {\n                \"id\": \"s2f4\",\n                \"label\": \"Une action concr√®te pour r√©duire la surcharge la prochaine fois :\",\n                \"inputType\": \"textarea\",\n                \"placeholder\": \"Bloquer 30 minutes sans notification, d√©l√©guer, dire non...\"\n              }\n            ]\n          }\n        }\n      ],\n      \"subtitle\": \"Semaines 3-4 ‚Ä¢ Restaurer le rythme circadien\",\n      \"rationale\": \"Maintenant que les interf√©rences sont r√©duites, nous allons reprogrammer votre horloge biologique pour qu'elle retrouve sa synchronisation naturelle. La r√©gularit√© est la cl√© de la stabilit√© que vous recherchez.\"\n    },\n    {\n      \"id\": 3,\n      \"title\": \"Phase 3 : L'Architecture du Calme\",\n      \"status\": \"locked\",\n      \"actions\": [\n        {\n          \"id\": \"8a36a728-6987-4d27-9c8d-59033bd4a520\",\n          \"tips\": \"Cr√©e une 'playlist sommeil'. Pr√©pare ton livre √† l'avance. Ce n'est pas une corv√©e, c'est un cadeau que tu te fais.\",\n          \"type\": \"habitude\",\n          \"title\": \"Rituel du Soir : La Douce Transition\",\n          \"status\": \"pending\",\n          \"questType\": \"main\",\n          \"rationale\": \"Ce rituel envoie des signaux clairs √† votre cerveau qu'il est temps de ralentir. Il favorise la production de m√©latonine et r√©duit l'activation mentale, facilitant ainsi l'endormissement.\",\n          \"targetReps\": 10,\n          \"description\": \"Chaque soir, 1h avant votre nouvelle heure cible de coucher, engagez-vous dans un rituel relaxant sans √©cran. Exemples : lire un livre papier, √©couter de la musique douce, faire un √©tirement l√©ger, prendre une douche ti√®de. Choisis 1 √† 2 activit√©s et sois r√©gulier.\",\n          \"isCompleted\": false,\n          \"time_of_day\": \"evening\",\n          \"tracking_type\": \"boolean\"\n        },\n        {\n          \"id\": \"0e0f2024-d7db-43bc-9101-7a446237eb27\",\n          \"tips\": \"Commence par le plus simple : obscurcis ta pi√®ce au maximum. Chaque d√©tail compte pour cr√©er une bulle de repos.\",\n          \"type\": \"mission\",\n          \"title\": \"L'Ambiance Sensorielle Optimale\",\n          \"status\": \"pending\",\n          \"questType\": \"side\",\n          \"rationale\": \"Les signaux externes (lumi√®re, bruit, temp√©rature) sont de puissants modulateurs du sommeil. En les ma√Ætrisant, vous cr√©ez un environnement propice √† un sommeil profond et ininterrompu, renfor√ßant l'efficacit√© de vos nouvelles habitudes.\",\n          \"description\": \"√âvalue et optimise activement l'environnement sensoriel de ta chambre pour le sommeil. Cela inclut : rideaux occultants, bouchons d'oreille/masque de sommeil, temp√©rature fra√Æche (18-20¬∞C), et r√©duction du bruit au maximum. Investis dans ces √©l√©ments si n√©cessaire.\",\n          \"isCompleted\": false,\n          \"time_of_day\": \"any_time\",\n          \"tracking_type\": \"boolean\"\n        }\n      ],\n      \"subtitle\": \"Semaines 5-6 ‚Ä¢ Cultiver la pr√©-d√©tente\",\n      \"rationale\": \"Avec un rythme stable, nous pouvons maintenant introduire des techniques actives pour favoriser la d√©tente et r√©duire la difficult√© d'endormissement. Votre corps et votre esprit apprendront √† se rel√¢cher avant le coucher.\"\n    },\n    {\n      \"id\": 4,\n      \"title\": \"Phase 4 : La Citadelle Int√©rieure\",\n      \"status\": \"locked\",\n      \"actions\": [\n        {\n          \"id\": \"1ab947df-231e-4ccf-8959-d4b338b000d6\",\n          \"tips\": \"Si ton esprit s'√©gare, ram√®ne doucement ton attention sur ta respiration. C'est un entra√Ænement, pas un examen.\",\n          \"type\": \"habitude\",\n          \"title\": \"La Respiration du Calme (2-4-6)\",\n          \"status\": \"pending\",\n          \"questType\": \"main\",\n          \"rationale\": \"Cette technique de respiration active le syst√®me nerveux parasympathique, responsable de la relaxation. C'est un outil direct pour calmer l'esprit et le corps, contrant la difficult√© d'endormissement et renfor√ßant la sensation de contr√¥le.\",\n          \"targetReps\": 10,\n          \"description\": \"Chaque soir, une fois allong√©(e) dans ton lit, pratique la respiration 2-4-6 : inspire 2 secondes, retiens 4 secondes, expire 6 secondes. Fais 5 √† 10 cycles, ou jusqu'√† ce que tu sentes un rel√¢chement. Concentre-toi sur le mouvement de ton ventre.\",\n          \"isCompleted\": false,\n          \"time_of_day\": \"night\",\n          \"tracking_type\": \"boolean\"\n        },\n        {\n          \"id\": \"c319656a-dfcf-4a58-be5f-cd5bc3a16563\",\n          \"tips\": \"Pense √† ce que tu dirais √† ton 'moi' du d√©but du programme. Quelles sont les 3 le√ßons cl√©s que tu as apprises ?\",\n          \"type\": \"framework\",\n          \"title\": \"L'√âvaluation Architecturale : Ma√Ætriser ma Stabilit√©\",\n          \"status\": \"pending\",\n          \"questType\": \"side\",\n          \"rationale\": \"Ce framework est crucial pour ancrer les changements. En r√©fl√©chissant activement √† votre progression, vous renforcez les chemins neuronaux des nouvelles habitudes et d√©veloppez une strat√©gie personnalis√©e pour √©viter de retomber dans les anciens sch√©mas d'oubli et de procrastination. C'est l'ultime √©tape vers la p√©rennisation de votre transformation.\",\n          \"targetReps\": 1,\n          \"description\": \"Prends 20 minutes pour √©valuer ton parcours. Qu'est-ce qui a le mieux fonctionn√© ? Quels ont √©t√© les d√©fis ? Comment maintenir cette nouvelle √©nergie et stabilit√© √† long terme ?\",\n          \"isCompleted\": false,\n          \"time_of_day\": \"any_time\",\n          \"tracking_type\": \"boolean\",\n          \"frameworkDetails\": {\n            \"type\": \"one_shot\",\n            \"intro\": \"Vous √™tes √† la fin de votre protocole. Prenez un moment pour reconna√Ætre le chemin parcouru et consolider votre apprentissage. Cette r√©flexion est votre boussole pour l'avenir.\",\n            \"sections\": [\n              {\n                \"id\": \"s4f1\",\n                \"label\": \"Quelles sont les 3 habitudes ou changements qui ont eu le plus grand impact sur mon sommeil et mon √©nergie ?\",\n                \"inputType\": \"list\",\n                \"placeholder\": \"Ex: La suppression des √©crans dans la chambre.\"\n              },\n              {\n                \"id\": \"s4f2\",\n                \"label\": \"Quels ont √©t√© mes principaux d√©fis et comment les ai-je surmont√©s (ou pourrais-je les surmonter √† l'avenir) ?\",\n                \"inputType\": \"textarea\",\n                \"placeholder\": \"Ex: J'ai eu du mal avec la r√©gularit√© le weekend, mais la lumi√®re du matin m'a aid√©.\"\n              },\n              {\n                \"id\": \"s4f3\",\n                \"label\": \"Comment d√©crirais-je mon niveau d'√©nergie et de stabilit√© au quotidien maintenant, compar√© au d√©but du programme (√©chelle 1-10) ?\",\n                \"inputType\": \"scale\",\n                \"placeholder\": \"7\"\n              },\n              {\n                \"id\": \"s4f4\",\n                \"label\": \"Mes 3 r√®gles d'or personnelles pour maintenir cette nouvelle qualit√© de sommeil √† long terme :\",\n                \"inputType\": \"list\",\n                \"placeholder\": \"Ex: Une heure sans √©cran avant de dormir.\"\n              },\n              {\n                \"id\": \"s4f5\",\n                \"label\": \"Un message ou un conseil que je me donnerais pour les prochains mois :\",\n                \"inputType\": \"textarea\",\n                \"placeholder\": \"La discipline est la libert√©. Continue √† t'√©couter.\"\n              }\n            ]\n          }\n        }\n      ],\n      \"subtitle\": \"Semaines 7-8 ‚Ä¢ Ancrer la r√©silience\",\n      \"rationale\": \"Les fondations sont pos√©es, le rythme est √©tabli. Cette derni√®re phase vise √† consolider vos acquis et √† vous outiller mentalement pour maintenir cette nouvelle stabilit√©, m√™me face aux in√©vitables 'sollicitations'.\"\n    }\n  ],\n  \"deepWhy\": \"Pour retrouver de l'√©nergie et √™tre plus stable au quotidien, afin de naviguer les sollicitations de la vie avec pr√©sence et efficacit√©.\",\n  \"identity\": \"Je suis un Architecte de ma S√©r√©nit√© Nocturne, ma√Ætre de mon √©nergie et de ma stabilit√©.\",\n  \"strategy\": \"Nous allons d√©sactiver les interf√©rences num√©riques et construire un rituel de fin de journ√©e pour retrouver la s√©r√©nit√©. La priorit√© est de restaurer votre √©nergie fondamentale avant d'adresser les d√©fis quotidiens.\",\n  \"goldenRules\": \"1. Ma chambre est un sanctuaire sans √©cran.\\n2. L'intention pr√©c√®de l'action : je pr√©pare mon sommeil.\\n3. La r√©gularit√© est ma meilleure alli√©e.\",\n  \"vitalSignal\": {\n    \"name\": \"Heure d'extinction des √©crans\",\n    \"type\": \"constat\",\n    \"unit\": \"h\",\n    \"startValue\": \"00:30\",\n    \"description\": \"L'objectif est d'avancer progressivement l'heure de coucher les √©crans. Vise √† gagner 15 minutes tous les 4 jours sur les 2 premi√®res phases.\",\n    \"targetValue\": \"22:00\",\n    \"tracking_type\": \"counter\"\n  },\n  \"grimoireTitle\": \"Le Sanctuaire du Repos\",\n  \"context_problem\": \"Tu te sentais souvent d√©bord√© et fatigu√©, ce qui impactait ta stabilit√© quotidienne. La difficult√© d'endormissement et le scroll tardif le soir √©taient tes principaux blocages, te privant du repos n√©cessaire et t'entra√Ænant dans un cycle d'oubli et de remise √† plus tard.\",\n  \"sophiaKnowledge\": \"Tu es une personne avec un rythme de vie charg√©, qui ressent une baisse d'√©nergie et une instabilit√© au quotidien dues √† des difficult√©s d'endormissement et un usage tardif du t√©l√©phone. Malgr√© un stress per√ßu comme 'faible', ton sentiment d'√™tre 'd√©bord√©' et tes habitudes de procrastination sapent ta capacit√© √† mettre en place des changements. Tu cherches la stabilit√© via un meilleur sommeil.\",\n  \"maintenanceCheck\": {\n    \"type\": \"surveillance\",\n    \"question\": \"Combien de soirs cette semaine as-tu utilis√© un √©cran (t√©l√©phone, tablette, PC) apr√®s 22h?\",\n    \"frequency\": \"hebdomadaire\"\n  },\n  \"estimatedDuration\": \"8 semaines\"\n}\n=== ACTIONS / FRAMEWORKS (√âTAT R√âEL DB) ===\nR√àGLES IMPORTANTES:\n- Les frameworks comptent comme des actions c√¥t√© utilisateur.\n- \"active\" = activ√©e et visible comme active dans l'app. \"pending\" = pas active.\n- On n'active/d√©sactive pas via WhatsApp: la seule mani√®re d'activer/d√©sactiver, c'est depuis le dashboard.\n\nActives (2):\n- [ACTION] Zone Sans √âcran : Le Sanatorium de la Chambre (any_time)\n- [ACTION] Le Bilan Rapide de la Journ√©e (evening)\n\n=== SIGNES VITAUX (√âtat Actuel) ===\n- Heure d'extinction des √©crans: 00:30 h\n",
      "template_fingerprint": "6aed59648572b8f3"
    },
    "scenario_target": "onboarding"
  },
  "error": null
}