{
  "id": "5d3e2b5f-dbc2-4273-815f-499ccfa5836d",
  "created_at": "2026-01-08T02:26:27.948873+00:00",
  "status": "completed",
  "dataset_key": "core",
  "scenario_key": "bilan_real_bundle__7e343cfdeb8e4b",
  "transcript": [
    {
      "role": "user",
      "content": "Oui",
      "agent_used": null,
      "created_at": "2026-01-08T02:25:32.63964+00:00"
    },
    {
      "role": "assistant",
      "content": "Super ! On commence avec ta Durée d'écran après 20h. Combien de minutes hier soir ?",
      "agent_used": "investigator",
      "created_at": "2026-01-08T02:25:40.1056+00:00"
    },
    {
      "role": "user",
      "content": "Hier soir, j'ai fait 45 minutes.",
      "agent_used": null,
      "created_at": "2026-01-08T02:25:42.397545+00:00"
    },
    {
      "role": "assistant",
      "content": "Ok, 45 minutes pour la durée d'écran hier soir.\n\nEt pour le Couvre-Feu Digital, as-tu mis tes écrans de côté ou en mode 'Ne pas déranger' 60 minutes avant de te coucher hier ?",
      "agent_used": "investigator",
      "created_at": "2026-01-08T02:25:53.401075+00:00"
    },
    {
      "role": "user",
      "content": "J'ai essayé, mais j'ai regardé un peu plus longtemps que prévu. Disons 30 minutes au lieu de 60.",
      "agent_used": null,
      "created_at": "2026-01-08T02:25:57.825017+00:00"
    },
    {
      "role": "assistant",
      "content": "Ok, 30 minutes c'est déjà un bon début pour le couvre-feu digital. L'idée c'est de réduire petit à petit.\n\nPour la Respiration Ancrante (5-5-5), tu as réussi à la pratiquer hier ?",
      "agent_used": "investigator",
      "created_at": "2026-01-08T02:26:06.332605+00:00"
    },
    {
      "role": "user",
      "content": "Oui, j'ai réussi à la faire deux fois sur les trois. J'ai oublié la dernière.",
      "agent_used": null,
      "created_at": "2026-01-08T02:26:09.083366+00:00"
    },
    {
      "role": "assistant",
      "content": "D'accord, c'est déjà bien deux fois sur trois pour la respiration.\n\nPassons au suivant : Le Vidage de Cerveau Quotidien. Tu l'as fait hier ?",
      "agent_used": "investigator",
      "created_at": "2026-01-08T02:26:14.859882+00:00"
    },
    {
      "role": "user",
      "content": "Oui, je l'ai fait. C'était un peu rapide hier soir, mais j'ai quand même vidé ce qui me préoccupait.",
      "agent_used": null,
      "created_at": "2026-01-08T02:26:17.601541+00:00"
    },
    {
      "role": "assistant",
      "content": "D'accord, c'est l'essentiel que tu aies réussi à vider ce qui te préoccupait, même si c'était rapide. C'est déjà ça de fait.\n\nLe bilan pour ces points est terminé. Est-ce que tu veux qu'on parle de quelque chose en particulier ?",
      "agent_used": "investigator",
      "created_at": "2026-01-08T02:26:27.113653+00:00"
    }
  ],
  "state_before": {
    "scope": "web",
    "user_id": "41c04790-714c-4d48-8346-1a6760cb8719",
    "risk_level": 0,
    "updated_at": "2026-01-08T02:25:32.61251+00:00",
    "current_mode": "investigator",
    "last_processed_at": "2026-01-08T02:25:32.61251+00:00",
    "short_term_context": null,
    "investigation_state": {
      "status": "checking",
      "temp_memory": {
        "opening_done": false
      },
      "pending_items": [
        {
          "id": "7da0a64a-395d-4ba9-a230-39fd1a8f7a05",
          "type": "vital",
          "unit": "min",
          "title": "Durée d'écran après 20h",
          "tracking_type": "counter"
        },
        {
          "id": "f96906ba-528f-4408-8901-7ad0cfd34ec0",
          "type": "action",
          "title": "Le Couvre-Feu Digital",
          "target": 14,
          "description": "Mettre tous les écrans en mode 'Ne pas déranger' ou hors de portée (hors de la chambre) 60 minutes avant l'heure de coucher souhaitée.",
          "tracking_type": "boolean"
        },
        {
          "id": "00085cdf-b097-4d11-84ca-065d7aaaac1f",
          "type": "action",
          "title": "La Respiration Ancrante (5-5-5)",
          "target": 14,
          "description": "Pratique la respiration carrée (inspiration 5s, rétention 5s, expiration 5s) 3 fois par jour pendant 2 minutes chacune, notamment avant de commencer une tâche stressante ou quand tu te sens submergé.",
          "tracking_type": "boolean"
        },
        {
          "id": "e8ba1281-06ec-4d1c-837e-cda5cfe827ef",
          "type": "framework",
          "title": "Le Vidage de Cerveau Quotidien",
          "tracking_type": "boolean"
        }
      ],
      "current_item_index": 0
    },
    "last_interaction_at": "2026-01-08T02:25:32.61251+00:00",
    "unprocessed_msg_count": 0
  },
  "state_after": {
    "scope": "web",
    "user_id": "41c04790-714c-4d48-8346-1a6760cb8719",
    "risk_level": 0,
    "updated_at": "2026-01-08T02:26:27.105956+00:00",
    "current_mode": "companion",
    "last_processed_at": "2026-01-08T02:25:32.61251+00:00",
    "short_term_context": null,
    "investigation_state": null,
    "last_interaction_at": "2026-01-08T02:25:32.61251+00:00",
    "unprocessed_msg_count": 5
  },
  "issues": [
    {
      "code": "BILAN_SUMMARY_MISSING",
      "message": "The investigator completes the 'bilan' (checkup) by stating it's finished and asking for the next topic, but it does not provide a concise summary of the collected data. A 'bilan' typically implies a review or synthesis of the discussed points, which is currently absent, diminishing the completeness of the interaction.",
      "evidence": {
        "snippet": "Le bilan pour ces points est terminé. Est-ce que tu veux qu'on parle de quelque chose en particulier ?",
        "agent_used": "investigator"
      },
      "severity": "low"
    }
  ],
  "suggestions": [
    {
      "action": "append",
      "rationale": "Enhances the 'bilan' experience by providing a clear summary of the user's performance, reinforcing their efforts and making the checkup feel more complete and actionable. This aligns better with the concept of a 'bilan' (summary/review).",
      "prompt_key": "sophia.investigator",
      "context_block": "=== CONTEXT (transcript excerpt) ===\n#6 USER: Oui, j'ai réussi à la faire deux fois sur les trois. J'ai oublié la dernière.\n#7 ASSISTANT(investigator): D'accord, c'est déjà bien deux fois sur trois pour la respiration. Passons au suivant : Le Vidage de Cerveau Quotidien. Tu l'as fait hier ?\n#8 USER: Oui, je l'ai fait. C'était un peu rapide hier soir, mais j'ai quand même vidé ce qui me préoccupait.\n#9 ASSISTANT(investigator): D'accord, c'est l'essentiel que tu aies réussi à vider ce qui te préoccupait, même si c'était rapide. C'est déjà ça de fait. Le bilan pour ces points est terminé. Est-ce que tu veux qu'on parle de quelque chose en particulier ?\n\n=== APPLY ===\nprompt_key: sophia.investigator\naction: append\n\nproposed_addendum:\nAprès avoir posé toutes les questions du bilan, résume brièvement les points clés et les progrès de l'utilisateur avant de proposer de passer à un autre sujet. Par exemple: 'Pour résumer, tu as [X] pour la durée d'écran, [Y] pour le couvre-feu digital, [Z] pour la respiration, et [W] pour le vidage de cerveau. C'est un bon point de départ !'",
      "proposed_addendum": "Après avoir posé toutes les questions du bilan, résume brièvement les points clés et les progrès de l'utilisateur avant de proposer de passer à un autre sujet. Par exemple: 'Pour résumer, tu as [X] pour la durée d'écran, [Y] pour le couvre-feu digital, [Z] pour la respiration, et [W] pour le vidage de cerveau. C'est un bon point de départ !'"
    }
  ],
  "metrics": {
    "cost_usd": 0.013828799999999999,
    "request_id": "4d709908-5530-4e7a-ba5c-ed0d48d28c07:core:bilan_real_bundle__7e343cfdeb8e4b:4068c7f4-93e9-4067-8fbc-aa5ee936cf7e",
    "total_tokens": 47572,
    "output_tokens": 1110,
    "prompt_tokens": 36846,
    "judge_llm_used": true,
    "mega_test_mode": false
  },
  "config": {
    "tags": [
      "sophia.investigator"
    ],
    "limits": {
      "model": "gemini-2.5-flash",
      "user_difficulty": "mid",
      "bilan_actions_count": 3
    },
    "description": "Bilan real (simulate-user) bundle run: capture full logs + full transcript.",
    "plan_snapshot": {
      "plan": {
        "id": "bd697d9b-d574-4710-b4af-afc64809446e",
        "title": "Le Scriptorium Intérieur",
        "status": "active",
        "content": {
          "phases": [
            {
              "id": 1,
              "title": "Phase 1 : Le Silence Numérique",
              "status": "active",
              "actions": [
                {
                  "id": "f96906ba-528f-4408-8901-7ad0cfd34ec0",
                  "tips": "Utilise un minuteur pour t'indiquer quand l'heure est venue. Trouve une activité de substitution apaisante (lecture papier, musique douce, discussion).",
                  "type": "habitude",
                  "title": "Le Couvre-Feu Digital",
                  "status": "active",
                  "questType": "main",
                  "rationale": "La lumière bleue et le contenu stimulant des écrans inhibent la production de mélatonine et maintiennent le cerveau en état d'alerte, augmentant l'anxiété nocturne et perturbant le sommeil.",
                  "targetReps": 14,
                  "description": "Mettre tous les écrans en mode 'Ne pas déranger' ou hors de portée (hors de la chambre) 60 minutes avant l'heure de coucher souhaitée.",
                  "isCompleted": false,
                  "time_of_day": "night",
                  "tracking_type": "boolean"
                },
                {
                  "id": "7839fc76-b885-491a-9df3-d4073c88e738",
                  "tips": "Ne juge pas ce que tu écris, l'objectif est simplement de vider ton esprit. Utilise une méthode comme le 'brain dump' ou l'écriture libre.",
                  "type": "framework",
                  "title": "Le Vidage de Cerveau Quotidien",
                  "status": "active",
                  "questType": "side",
                  "rationale": "Ce rituel aide à transférer les pensées anxieuses de ton esprit vers le papier, réduisant ainsi la rumination et facilitant l'endormissement. C'est une stratégie de régulation émotionnelle.",
                  "targetReps": 14,
                  "description": "Chaque soir, consacre 10-15 minutes à écrire tout ce qui te préoccupe, tes pensées, tes tâches non accomplies sur un carnet dédié. C'est ton espace pour 'déposer' ta charge mentale.",
                  "isCompleted": false,
                  "time_of_day": "evening",
                  "tracking_type": "boolean",
                  "frameworkDetails": {
                    "type": "recurring",
                    "intro": "Ton cerveau est un muscle qui travaille sans cesse. Le vider sur papier, c'est comme lui offrir une pause, un répit avant la nuit. L'objectif est de ne rien retenir mentalement, tout est mis à l'écrit.",
                    "sections": [
                      {
                        "id": "s1",
                        "label": "Ce qui me pèse ou m'inquiète aujourd'hui",
                        "inputType": "textarea",
                        "placeholder": "Liste tes pensées, soucis, tâches en suspens..."
                      },
                      {
                        "id": "s2",
                        "label": "Une chose que je peux faire demain pour avancer sur un point (si applicable)",
                        "inputType": "text",
                        "placeholder": "Ex: Envoyer ce mail, noter RDV..."
                      },
                      {
                        "id": "s3",
                        "label": "Niveau de clarté mentale après l'exercice (1-10)",
                        "inputType": "scale",
                        "placeholder": "7"
                      }
                    ]
                  }
                }
              ],
              "subtitle": "Semaines 1-2 • Reprendre le contrôle du temps d'écran et apaiser l'esprit",
              "rationale": "Avant de pouvoir gérer le stress, il est crucial de réduire les stimuli externes et la surcharge cognitive. Cette phase met l'accent sur la désintoxication numérique et la décharge mentale pour préparer un terrain propice au calme."
            },
            {
              "id": 2,
              "title": "Phase 2 : L'Art du Réalignement",
              "status": "locked",
              "actions": [
                {
                  "id": "00085cdf-b097-4d11-84ca-065d7aaaac1f",
                  "tips": "Télécharge une application de méditation guidée si besoin, ou mets un rappel sur ton téléphone. Trouve un endroit calme, même quelques instants.",
                  "type": "habitude",
                  "title": "La Respiration Ancrante (5-5-5)",
                  "status": "active",
                  "questType": "main",
                  "rationale": "La respiration consciente active le système nerveux parasympathique, ralentit le rythme cardiaque et réduit la production de cortisol, favorisant un état de calme et de clarté mentale.",
                  "targetReps": 14,
                  "description": "Pratique la respiration carrée (inspiration 5s, rétention 5s, expiration 5s) 3 fois par jour pendant 2 minutes chacune, notamment avant de commencer une tâche stressante ou quand tu te sens submergé.",
                  "isCompleted": false,
                  "time_of_day": "any_time",
                  "tracking_type": "boolean"
                },
                {
                  "id": "9aa3799f-d856-4f16-840e-0d7ca314e70f",
                  "tips": "Il n'a pas besoin d'être grand. L'important est sa symbolique et sa fonction : un lieu sans distractions où tu peux simplement 'être'.",
                  "type": "mission",
                  "title": "Créer ton Espace de Décompression",
                  "status": "pending",
                  "questType": "side",
                  "rationale": "Avoir un espace physique dédié à la relaxation crée une ancre mentale et comportementale, facilitant la déconnexion et la pratique des rituels de calme. Cela renforce l'association 'détente = ce lieu'.",
                  "description": "Aménage un petit coin chez toi (même une chaise confortable) dédié à la détente, sans écran, avec des éléments apaisants (plante, bougie, livre). C'est ton refuge personnel pour tes pauses et rituels.",
                  "isCompleted": false,
                  "time_of_day": "any_time",
                  "tracking_type": "boolean"
                }
              ],
              "subtitle": "Semaines 3-4 • Intégrer la pleine conscience et les pauses réparatrices",
              "rationale": "Après avoir réduit la surcharge, nous introduisons des pratiques actives de pleine conscience et des micro-pauses pour réapprendre à ton système nerveux à se réguler au quotidien, surtout en période de travail intense sur écran."
            },
            {
              "id": 3,
              "title": "Phase 3 : Le Bouclier Anti-Submersion",
              "status": "locked",
              "actions": [
                {
                  "id": "256c92fa-f42f-4de6-842f-342ad4aa9c37",
                  "tips": "Utilise un minuteur pour respecter ces pauses. L'idée est de 'sortir' de ton travail, même physiquement, pour laisser ton cerveau se reposer activement.",
                  "type": "habitude",
                  "title": "La Micro-Pause Consciente (Pomodoro inversé)",
                  "status": "pending",
                  "questType": "main",
                  "rationale": "Les micro-pauses régulières préviennent la fatigue cognitive et oculaire, maintiennent la concentration et réduisent l'accumulation de stress, évitant ainsi le sentiment d'être submergé en fin de journée.",
                  "targetReps": 10,
                  "description": "Toutes les 45-50 minutes de travail, lève-toi, étire-toi, regarde par la fenêtre (loin de ton écran) pendant 5 à 10 minutes. Bois de l'eau, respire, puis reprends.",
                  "isCompleted": false,
                  "time_of_day": "afternoon",
                  "tracking_type": "boolean"
                },
                {
                  "id": "4c3f3a0e-326d-4c09-941c-dc1534175568",
                  "tips": "Ne passe pas plus de 2 minutes par élément. L'objectif est la clarté, pas la perfection. Tu peux le faire mentalement après un peu de pratique.",
                  "type": "framework",
                  "title": "Matrice de Décision Rapide",
                  "status": "pending",
                  "questType": "side",
                  "rationale": "Ce framework t'aide à externaliser et à catégoriser tes problèmes, réduisant l'anxiété liée à l'incertitude et au sentiment d'être submergé par une liste de tâches désordonnée. Il favorise la prise de décision rapide.",
                  "targetReps": 1,
                  "description": "Face à une tâche ou une préoccupation, utilise cette matrice pour rapidement évaluer et décider de l'action à prendre. C'est ton outil anti-blocage et anti-surcharge.",
                  "isCompleted": false,
                  "time_of_day": "any_time",
                  "tracking_type": "boolean",
                  "frameworkDetails": {
                    "type": "one_shot",
                    "intro": "Quand tu te sens submergé, liste tout ce qui te préoccupe. Puis, pour chaque élément, pose-toi ces questions : Est-ce urgent ? Est-ce important ? Puis-je le déléguer ? Puis-je le supprimer ? C'est ta boussole pour la clarté.",
                    "sections": [
                      {
                        "id": "f1",
                        "label": "Charge mentale du moment",
                        "inputType": "categorized_list",
                        "placeholder": "Tâche/Préoccupation...|Urgent/Important/Déléguer/Supprimer"
                      },
                      {
                        "id": "f2",
                        "label": "Action prioritaire identifiée",
                        "inputType": "text",
                        "placeholder": "Commencer X, Planifier Y..."
                      }
                    ]
                  }
                }
              ],
              "subtitle": "Semaines 5-6 • Stratégies pour gérer la charge mentale au pic de l'activité",
              "rationale": "Maintenant que tu as des bases solides, cette phase t'équipe d'outils concrets pour prévenir la submersion pendant tes périodes de travail intense et t'aider à mieux structurer ton énergie."
            },
            {
              "id": 4,
              "title": "Phase 4 : L'Architecture du Calme Durable",
              "status": "locked",
              "actions": [
                {
                  "id": "083dbc72-0b1f-4fc9-9fc9-2cf9ab1099ad",
                  "tips": "Prépare la veille ce dont tu auras besoin (carnet, livre). L'idée est de prendre un temps pour toi avant que le monde extérieur ne s'impose.",
                  "type": "habitude",
                  "title": "Le Rituel de Reconnexion Matinale",
                  "status": "pending",
                  "questType": "main",
                  "rationale": "Commencer la journée avec un rituel calme et intentionnel prépare ton esprit à la journée, réduit la réactivité au stress et renforce ton sentiment de contrôle dès le matin.",
                  "targetReps": 7,
                  "description": "Chaque matin, avant de consulter tout écran, consacre 5 à 10 minutes à une activité calme (méditation courte, écriture de gratitudes, lecture inspirante) pour démarrer ta journée en pleine conscience.",
                  "isCompleted": false,
                  "time_of_day": "morning",
                  "tracking_type": "boolean"
                },
                {
                  "id": "b32759b3-0acd-4fe8-b29c-e207c1c7ad74",
                  "tips": "Visualise cette 'frontière' comme un portail. Quand tu la franchis, tu laisses les préoccupations du travail derrière toi. Sois créatif pour ton rituel.",
                  "type": "mission",
                  "title": "Définir la 'Frontière du Travail'",
                  "status": "pending",
                  "questType": "side",
                  "rationale": "Délimiter clairement le temps de travail du temps personnel réduit le risque de rumination professionnelle, aide à 'fermer la boucle' de la journée de travail et améliore la qualité de ton repos.",
                  "description": "Établis une routine claire de transition entre ton temps de travail (sur écran) et ton temps personnel. Cela peut être une courte promenade, un changement de vêtement, ou 15 minutes sans écran dans ton espace de décompression.",
                  "isCompleted": false,
                  "time_of_day": "evening",
                  "tracking_type": "boolean"
                }
              ],
              "subtitle": "Semaines 7-8 • Ancrer les habitudes et cultiver la résilience",
              "rationale": "Cette dernière phase vise à consolider les apprentissages et à transformer les comportements temporaires en habitudes profondément ancrées, assurant une gestion du stress proactive et durable."
            }
          ],
          "deepWhy": "Pour pouvoir naviguer les défis du quotidien avec sérénité, être pleinement présent dans ma vie et me sentir en contrôle, au lieu d'être emporté par le courant.",
          "identity": "Je suis un Gardien de Mon Calme Intérieur.",
          "strategy": "Nous allons progressivement désamorcer la surcharge mentale et l'anxiété en architecturant des rituels conscients, en reprenant le contrôle de ton temps d'écran et en réalignant tes priorités pour retrouver stabilité et énergie.",
          "goldenRules": "1. Je limite la surcharge, je privilégie la clarté.\n2. Mon écran est un outil, pas une prison.\n3. Je honore mon repos comme un pilier de ma force.",
          "vitalSignal": {
            "name": "Durée d'écran après 20h",
            "type": "constat",
            "unit": "min",
            "startValue": "90",
            "description": "Mesure le temps passé devant un écran (téléphone, tablette, ordinateur) après 20h. L'objectif est de réduire cette durée pour préparer le cerveau au repos.",
            "targetValue": "30",
            "tracking_type": "counter"
          },
          "grimoireTitle": "Le Scriptorium Intérieur",
          "context_problem": "Actuellement, tu te sens facilement submergé et tu perds le fil de tes pensées et de tes actions, souvent après une journée de travail prolongée devant un écran. Cette surcharge se manifeste par de l'anxiété et une mauvaise qualité de sommeil, t'empêchant de retrouver l'énergie et la stabilité que tu désires.",
          "sophiaKnowledge": "Tu es un homme, né en 1988, qui se sent submergé par une charge mentale importante et de l'anxiété, malgré un niveau de stress perçu comme 'faible' (ce qui peut indiquer une forme de déni ou d'habitude). Ton travail sur écran et tes horaires tardifs impactent négativement ton sommeil, et tu peines à maintenir le cap face à l'accablement. Tu cherches à retrouver de l'énergie et de la stabilité au quotidien.",
          "maintenanceCheck": {
            "type": "surveillance",
            "question": "Cette semaine, combien de fois te suis-tu senti(e) calme et en contrôle face à une situation stressante ?",
            "frequency": "hebdomadaire"
          },
          "estimatedDuration": "8 semaines"
        },
        "goal_id": "3da8aa8d-1651-4611-a6c7-2547b8db0de3",
        "deep_why": "Pour pouvoir naviguer les défis du quotidien avec sérénité, être pleinement présent dans ma vie et me sentir en contrôle, au lieu d'être emporté par le courant.",
        "created_at": "2026-01-08T02:25:32.552866+00:00",
        "inputs_why": null,
        "current_phase": 1,
        "submission_id": "1d3556cb-36dd-4a24-bb0a-8c21b0d4dec9",
        "inputs_context": null,
        "inputs_blockers": null,
        "progress_percentage": 0
      },
      "actions": [
        {
          "id": "f96906ba-528f-4408-8901-7ad0cfd34ec0",
          "title": "Le Couvre-Feu Digital",
          "status": "active",
          "created_at": "2026-01-08T02:25:32.575016+00:00",
          "description": "Mettre tous les écrans en mode 'Ne pas déranger' ou hors de portée (hors de la chambre) 60 minutes avant l'heure de coucher souhaitée.",
          "target_reps": 14,
          "time_of_day": "night",
          "current_reps": 0,
          "tracking_type": "boolean",
          "last_performed_at": "2026-01-06T02:25:32.561+00:00"
        },
        {
          "id": "00085cdf-b097-4d11-84ca-065d7aaaac1f",
          "title": "La Respiration Ancrante (5-5-5)",
          "status": "active",
          "created_at": "2026-01-08T02:25:32.575016+00:00",
          "description": "Pratique la respiration carrée (inspiration 5s, rétention 5s, expiration 5s) 3 fois par jour pendant 2 minutes chacune, notamment avant de commencer une tâche stressante ou quand tu te sens submergé.",
          "target_reps": 14,
          "time_of_day": "any_time",
          "current_reps": 0,
          "tracking_type": "boolean",
          "last_performed_at": "2026-01-06T02:25:32.561+00:00"
        },
        {
          "id": "e8ba1281-06ec-4d1c-837e-cda5cfe827ef",
          "_kind": "framework",
          "title": "Le Vidage de Cerveau Quotidien",
          "status": "active",
          "created_at": "2026-01-08T02:25:32.600392+00:00",
          "description": "",
          "target_reps": 14,
          "time_of_day": null,
          "current_reps": 0,
          "tracking_type": "boolean",
          "framework_type": "recurring",
          "last_performed_at": "2026-01-06T02:25:32.561+00:00"
        }
      ],
      "frameworks": [
        {
          "id": "e8ba1281-06ec-4d1c-837e-cda5cfe827ef",
          "type": "recurring",
          "title": "Le Vidage de Cerveau Quotidien",
          "status": "active",
          "created_at": "2026-01-08T02:25:32.600392+00:00",
          "target_reps": 14,
          "current_reps": 0,
          "tracking_type": "boolean",
          "last_performed_at": "2026-01-06T02:25:32.561+00:00"
        }
      ],
      "dashboard_context": "=== PLAN ACTUEL (Tableau de Bord) ===\nTitre: Le Scriptorium Intérieur\nStatut: active\nPhase courante (dashboard): 1\nPourquoi (Deep Why): Pour pouvoir naviguer les défis du quotidien avec sérénité, être pleinement présent dans ma vie et me sentir en contrôle, au lieu d'être emporté par le courant.\nDÉTAIL COMPLET DU PLAN (Structure JSON) :\n{\n  \"phases\": [\n    {\n      \"id\": 1,\n      \"title\": \"Phase 1 : Le Silence Numérique\",\n      \"status\": \"active\",\n      \"actions\": [\n        {\n          \"id\": \"f96906ba-528f-4408-8901-7ad0cfd34ec0\",\n          \"tips\": \"Utilise un minuteur pour t'indiquer quand l'heure est venue. Trouve une activité de substitution apaisante (lecture papier, musique douce, discussion).\",\n          \"type\": \"habitude\",\n          \"title\": \"Le Couvre-Feu Digital\",\n          \"status\": \"active\",\n          \"questType\": \"main\",\n          \"rationale\": \"La lumière bleue et le contenu stimulant des écrans inhibent la production de mélatonine et maintiennent le cerveau en état d'alerte, augmentant l'anxiété nocturne et perturbant le sommeil.\",\n          \"targetReps\": 14,\n          \"description\": \"Mettre tous les écrans en mode 'Ne pas déranger' ou hors de portée (hors de la chambre) 60 minutes avant l'heure de coucher souhaitée.\",\n          \"isCompleted\": false,\n          \"time_of_day\": \"night\",\n          \"tracking_type\": \"boolean\"\n        },\n        {\n          \"id\": \"7839fc76-b885-491a-9df3-d4073c88e738\",\n          \"tips\": \"Ne juge pas ce que tu écris, l'objectif est simplement de vider ton esprit. Utilise une méthode comme le 'brain dump' ou l'écriture libre.\",\n          \"type\": \"framework\",\n          \"title\": \"Le Vidage de Cerveau Quotidien\",\n          \"status\": \"active\",\n          \"questType\": \"side\",\n          \"rationale\": \"Ce rituel aide à transférer les pensées anxieuses de ton esprit vers le papier, réduisant ainsi la rumination et facilitant l'endormissement. C'est une stratégie de régulation émotionnelle.\",\n          \"targetReps\": 14,\n          \"description\": \"Chaque soir, consacre 10-15 minutes à écrire tout ce qui te préoccupe, tes pensées, tes tâches non accomplies sur un carnet dédié. C'est ton espace pour 'déposer' ta charge mentale.\",\n          \"isCompleted\": false,\n          \"time_of_day\": \"evening\",\n          \"tracking_type\": \"boolean\",\n          \"frameworkDetails\": {\n            \"type\": \"recurring\",\n            \"intro\": \"Ton cerveau est un muscle qui travaille sans cesse. Le vider sur papier, c'est comme lui offrir une pause, un répit avant la nuit. L'objectif est de ne rien retenir mentalement, tout est mis à l'écrit.\",\n            \"sections\": [\n              {\n                \"id\": \"s1\",\n                \"label\": \"Ce qui me pèse ou m'inquiète aujourd'hui\",\n                \"inputType\": \"textarea\",\n                \"placeholder\": \"Liste tes pensées, soucis, tâches en suspens...\"\n              },\n              {\n                \"id\": \"s2\",\n                \"label\": \"Une chose que je peux faire demain pour avancer sur un point (si applicable)\",\n                \"inputType\": \"text\",\n                \"placeholder\": \"Ex: Envoyer ce mail, noter RDV...\"\n              },\n              {\n                \"id\": \"s3\",\n                \"label\": \"Niveau de clarté mentale après l'exercice (1-10)\",\n                \"inputType\": \"scale\",\n                \"placeholder\": \"7\"\n              }\n            ]\n          }\n        }\n      ],\n      \"subtitle\": \"Semaines 1-2 • Reprendre le contrôle du temps d'écran et apaiser l'esprit\",\n      \"rationale\": \"Avant de pouvoir gérer le stress, il est crucial de réduire les stimuli externes et la surcharge cognitive. Cette phase met l'accent sur la désintoxication numérique et la décharge mentale pour préparer un terrain propice au calme.\"\n    },\n    {\n      \"id\": 2,\n      \"title\": \"Phase 2 : L'Art du Réalignement\",\n      \"status\": \"locked\",\n      \"actions\": [\n        {\n          \"id\": \"00085cdf-b097-4d11-84ca-065d7aaaac1f\",\n          \"tips\": \"Télécharge une application de méditation guidée si besoin, ou mets un rappel sur ton téléphone. Trouve un endroit calme, même quelques instants.\",\n          \"type\": \"habitude\",\n          \"title\": \"La Respiration Ancrante (5-5-5)\",\n          \"status\": \"active\",\n          \"questType\": \"main\",\n          \"rationale\": \"La respiration consciente active le système nerveux parasympathique, ralentit le rythme cardiaque et réduit la production de cortisol, favorisant un état de calme et de clarté mentale.\",\n          \"targetReps\": 14,\n          \"description\": \"Pratique la respiration carrée (inspiration 5s, rétention 5s, expiration 5s) 3 fois par jour pendant 2 minutes chacune, notamment avant de commencer une tâche stressante ou quand tu te sens submergé.\",\n          \"isCompleted\": false,\n          \"time_of_day\": \"any_time\",\n          \"tracking_type\": \"boolean\"\n        },\n        {\n          \"id\": \"9aa3799f-d856-4f16-840e-0d7ca314e70f\",\n          \"tips\": \"Il n'a pas besoin d'être grand. L'important est sa symbolique et sa fonction : un lieu sans distractions où tu peux simplement 'être'.\",\n          \"type\": \"mission\",\n          \"title\": \"Créer ton Espace de Décompression\",\n          \"status\": \"pending\",\n          \"questType\": \"side\",\n          \"rationale\": \"Avoir un espace physique dédié à la relaxation crée une ancre mentale et comportementale, facilitant la déconnexion et la pratique des rituels de calme. Cela renforce l'association 'détente = ce lieu'.\",\n          \"description\": \"Aménage un petit coin chez toi (même une chaise confortable) dédié à la détente, sans écran, avec des éléments apaisants (plante, bougie, livre). C'est ton refuge personnel pour tes pauses et rituels.\",\n          \"isCompleted\": false,\n          \"time_of_day\": \"any_time\",\n          \"tracking_type\": \"boolean\"\n        }\n      ],\n      \"subtitle\": \"Semaines 3-4 • Intégrer la pleine conscience et les pauses réparatrices\",\n      \"rationale\": \"Après avoir réduit la surcharge, nous introduisons des pratiques actives de pleine conscience et des micro-pauses pour réapprendre à ton système nerveux à se réguler au quotidien, surtout en période de travail intense sur écran.\"\n    },\n    {\n      \"id\": 3,\n      \"title\": \"Phase 3 : Le Bouclier Anti-Submersion\",\n      \"status\": \"locked\",\n      \"actions\": [\n        {\n          \"id\": \"256c92fa-f42f-4de6-842f-342ad4aa9c37\",\n          \"tips\": \"Utilise un minuteur pour respecter ces pauses. L'idée est de 'sortir' de ton travail, même physiquement, pour laisser ton cerveau se reposer activement.\",\n          \"type\": \"habitude\",\n          \"title\": \"La Micro-Pause Consciente (Pomodoro inversé)\",\n          \"status\": \"pending\",\n          \"questType\": \"main\",\n          \"rationale\": \"Les micro-pauses régulières préviennent la fatigue cognitive et oculaire, maintiennent la concentration et réduisent l'accumulation de stress, évitant ainsi le sentiment d'être submergé en fin de journée.\",\n          \"targetReps\": 10,\n          \"description\": \"Toutes les 45-50 minutes de travail, lève-toi, étire-toi, regarde par la fenêtre (loin de ton écran) pendant 5 à 10 minutes. Bois de l'eau, respire, puis reprends.\",\n          \"isCompleted\": false,\n          \"time_of_day\": \"afternoon\",\n          \"tracking_type\": \"boolean\"\n        },\n        {\n          \"id\": \"4c3f3a0e-326d-4c09-941c-dc1534175568\",\n          \"tips\": \"Ne passe pas plus de 2 minutes par élément. L'objectif est la clarté, pas la perfection. Tu peux le faire mentalement après un peu de pratique.\",\n          \"type\": \"framework\",\n          \"title\": \"Matrice de Décision Rapide\",\n          \"status\": \"pending\",\n          \"questType\": \"side\",\n          \"rationale\": \"Ce framework t'aide à externaliser et à catégoriser tes problèmes, réduisant l'anxiété liée à l'incertitude et au sentiment d'être submergé par une liste de tâches désordonnée. Il favorise la prise de décision rapide.\",\n          \"targetReps\": 1,\n          \"description\": \"Face à une tâche ou une préoccupation, utilise cette matrice pour rapidement évaluer et décider de l'action à prendre. C'est ton outil anti-blocage et anti-surcharge.\",\n          \"isCompleted\": false,\n          \"time_of_day\": \"any_time\",\n          \"tracking_type\": \"boolean\",\n          \"frameworkDetails\": {\n            \"type\": \"one_shot\",\n            \"intro\": \"Quand tu te sens submergé, liste tout ce qui te préoccupe. Puis, pour chaque élément, pose-toi ces questions : Est-ce urgent ? Est-ce important ? Puis-je le déléguer ? Puis-je le supprimer ? C'est ta boussole pour la clarté.\",\n            \"sections\": [\n              {\n                \"id\": \"f1\",\n                \"label\": \"Charge mentale du moment\",\n                \"inputType\": \"categorized_list\",\n                \"placeholder\": \"Tâche/Préoccupation...|Urgent/Important/Déléguer/Supprimer\"\n              },\n              {\n                \"id\": \"f2\",\n                \"label\": \"Action prioritaire identifiée\",\n                \"inputType\": \"text\",\n                \"placeholder\": \"Commencer X, Planifier Y...\"\n              }\n            ]\n          }\n        }\n      ],\n      \"subtitle\": \"Semaines 5-6 • Stratégies pour gérer la charge mentale au pic de l'activité\",\n      \"rationale\": \"Maintenant que tu as des bases solides, cette phase t'équipe d'outils concrets pour prévenir la submersion pendant tes périodes de travail intense et t'aider à mieux structurer ton énergie.\"\n    },\n    {\n      \"id\": 4,\n      \"title\": \"Phase 4 : L'Architecture du Calme Durable\",\n      \"status\": \"locked\",\n      \"actions\": [\n        {\n          \"id\": \"083dbc72-0b1f-4fc9-9fc9-2cf9ab1099ad\",\n          \"tips\": \"Prépare la veille ce dont tu auras besoin (carnet, livre). L'idée est de prendre un temps pour toi avant que le monde extérieur ne s'impose.\",\n          \"type\": \"habitude\",\n          \"title\": \"Le Rituel de Reconnexion Matinale\",\n          \"status\": \"pending\",\n          \"questType\": \"main\",\n          \"rationale\": \"Commencer la journée avec un rituel calme et intentionnel prépare ton esprit à la journée, réduit la réactivité au stress et renforce ton sentiment de contrôle dès le matin.\",\n          \"targetReps\": 7,\n          \"description\": \"Chaque matin, avant de consulter tout écran, consacre 5 à 10 minutes à une activité calme (méditation courte, écriture de gratitudes, lecture inspirante) pour démarrer ta journée en pleine conscience.\",\n          \"isCompleted\": false,\n          \"time_of_day\": \"morning\",\n          \"tracking_type\": \"boolean\"\n        },\n        {\n          \"id\": \"b32759b3-0acd-4fe8-b29c-e207c1c7ad74\",\n          \"tips\": \"Visualise cette 'frontière' comme un portail. Quand tu la franchis, tu laisses les préoccupations du travail derrière toi. Sois créatif pour ton rituel.\",\n          \"type\": \"mission\",\n          \"title\": \"Définir la 'Frontière du Travail'\",\n          \"status\": \"pending\",\n          \"questType\": \"side\",\n          \"rationale\": \"Délimiter clairement le temps de travail du temps personnel réduit le risque de rumination professionnelle, aide à 'fermer la boucle' de la journée de travail et améliore la qualité de ton repos.\",\n          \"description\": \"Établis une routine claire de transition entre ton temps de travail (sur écran) et ton temps personnel. Cela peut être une courte promenade, un changement de vêtement, ou 15 minutes sans écran dans ton espace de décompression.\",\n          \"isCompleted\": false,\n          \"time_of_day\": \"evening\",\n          \"tracking_type\": \"boolean\"\n        }\n      ],\n      \"subtitle\": \"Semaines 7-8 • Ancrer les habitudes et cultiver la résilience\",\n      \"rationale\": \"Cette dernière phase vise à consolider les apprentissages et à transformer les comportements temporaires en habitudes profondément ancrées, assurant une gestion du stress proactive et durable.\"\n    }\n  ],\n  \"deepWhy\": \"Pour pouvoir naviguer les défis du quotidien avec sérénité, être pleinement présent dans ma vie et me sentir en contrôle, au lieu d'être emporté par le courant.\",\n  \"identity\": \"Je suis un Gardien de Mon Calme Intérieur.\",\n  \"strategy\": \"Nous allons progressivement désamorcer la surcharge mentale et l'anxiété en architecturant des rituels conscients, en reprenant le contrôle de ton temps d'écran et en réalignant tes priorités pour retrouver stabilité et énergie.\",\n  \"goldenRules\": \"1. Je limite la surcharge, je privilégie la clarté.\\n2. Mon écran est un outil, pas une prison.\\n3. Je honore mon repos comme un pilier de ma force.\",\n  \"vitalSignal\": {\n    \"name\": \"Durée d'écran après 20h\",\n    \"type\": \"constat\",\n    \"unit\": \"min\",\n    \"startValue\": \"90\",\n    \"description\": \"Mesure le temps passé devant un écran (téléphone, tablette, ordinateur) après 20h. L'objectif est de réduire cette durée pour préparer le cerveau au repos.\",\n    \"targetValue\": \"30\",\n    \"tracking_type\": \"counter\"\n  },\n  \"grimoireTitle\": \"Le Scriptorium Intérieur\",\n  \"context_problem\": \"Actuellement, tu te sens facilement submergé et tu perds le fil de tes pensées et de tes actions, souvent après une journée de travail prolongée devant un écran. Cette surcharge se manifeste par de l'anxiété et une mauvaise qualité de sommeil, t'empêchant de retrouver l'énergie et la stabilité que tu désires.\",\n  \"sophiaKnowledge\": \"Tu es un homme, né en 1988, qui se sent submergé par une charge mentale importante et de l'anxiété, malgré un niveau de stress perçu comme 'faible' (ce qui peut indiquer une forme de déni ou d'habitude). Ton travail sur écran et tes horaires tardifs impactent négativement ton sommeil, et tu peines à maintenir le cap face à l'accablement. Tu cherches à retrouver de l'énergie et de la stabilité au quotidien.\",\n  \"maintenanceCheck\": {\n    \"type\": \"surveillance\",\n    \"question\": \"Cette semaine, combien de fois te suis-tu senti(e) calme et en contrôle face à une situation stressante ?\",\n    \"frequency\": \"hebdomadaire\"\n  },\n  \"estimatedDuration\": \"8 semaines\"\n}\n=== ACTIONS / FRAMEWORKS (ÉTAT RÉEL DB) ===\nRÈGLES IMPORTANTES:\n- Les frameworks comptent comme des actions côté utilisateur.\n- \"active\" = activée et visible comme active dans l'app. \"pending\" = pas active.\n- On n'active/désactive pas via WhatsApp: la seule manière d'activer/désactiver, c'est depuis le dashboard.\n\nActives (3):\n- [ACTION] Le Couvre-Feu Digital (night)\n- [ACTION] La Respiration Ancrante (5-5-5) (any_time)\n- [FRAMEWORK] Le Vidage de Cerveau Quotidien\n\n=== SIGNES VITAUX (État Actuel) ===\n- Durée d'écran après 20h: 90 min\n",
      "template_fingerprint": "55f4419bff6b3868"
    },
    "scenario_target": "bilan"
  },
  "error": null
}