{
  "id": "95bccc19-d7d7-4d91-b397-f58ebb1ec44a",
  "created_at": "2026-01-08T02:07:22.750895+00:00",
  "status": "completed",
  "scenario_key": "bilan_real_vitals__a7080d896c204f",
  "transcript": [
    {
      "role": "user",
      "content": "Oui",
      "agent_used": null,
      "created_at": "2026-01-08T02:06:23.653987+00:00"
    },
    {
      "role": "assistant",
      "content": "Ok, super. On va commencer avec le sommeil. C'est un point vraiment important.\n\nCombien d'heures tu as dormi la nuit dernière ?",
      "agent_used": "investigator",
      "created_at": "2026-01-08T02:06:28.555313+00:00"
    },
    {
      "role": "user",
      "content": "Environ 6h30, je crois.",
      "agent_used": null,
      "created_at": "2026-01-08T02:06:30.75766+00:00"
    },
    {
      "role": "assistant",
      "content": "D'accord, 6h30 de sommeil, c'est noté. Pour le Couvre-feu Digital Inviolable, est-ce que tu as réussi à éteindre tous tes écrans au moins une heure avant d'aller dormir hier soir ?",
      "agent_used": "investigator",
      "created_at": "2026-01-08T02:06:38.536182+00:00"
    },
    {
      "role": "user",
      "content": "Presque, j'ai eu un peu de mal avec la tablette hier soir.",
      "agent_used": null,
      "created_at": "2026-01-08T02:06:41.383797+00:00"
    },
    {
      "role": "assistant",
      "content": "Ah, la tablette, c'est souvent un piège ! Qu'est-ce qui a rendu ça difficile hier soir ?",
      "agent_used": "investigator",
      "created_at": "2026-01-08T02:06:46.216318+00:00"
    },
    {
      "role": "user",
      "content": "J'ai regardé une série, je me suis laissée emporter.",
      "agent_used": null,
      "created_at": "2026-01-08T02:06:48.753977+00:00"
    },
    {
      "role": "assistant",
      "content": "Je vois, la série t'a bien tenue en haleine hier soir. Ça explique le bilan pour le Couvre-feu Digital Inviolable.\n\nPour aujourd'hui, on passe à L'Épuration des Notifications Toxiques. Tu as pu désactiver les notifications push des applications non essentielles sur ton téléphone ?",
      "agent_used": "investigator",
      "created_at": "2026-01-08T02:06:58.8975+00:00"
    },
    {
      "role": "user",
      "content": "Oui, j'ai fait le tri sur la plupart, mais j'ai gardé quelques-unes pour le travail.",
      "agent_used": null,
      "created_at": "2026-01-08T02:07:01.344728+00:00"
    },
    {
      "role": "assistant",
      "content": "Super si tu as pu faire le tri, c'est l'essentiel. Pour la suite, on a la Vidange Cérébrale Quotidienne. Tu l'as faite hier ?",
      "agent_used": "investigator",
      "created_at": "2026-01-08T02:07:09.852023+00:00"
    },
    {
      "role": "user",
      "content": "J'ai essayé, j'ai noté deux ou trois choses, mais je n'ai pas eu le temps de tout vider, j'étais trop fatiguée.",
      "agent_used": null,
      "created_at": "2026-01-08T02:07:14.275807+00:00"
    },
    {
      "role": "assistant",
      "content": "Je comprends, la fatigue est une vraie voleuse de temps. C'est noté pour la Vidange Cérébrale Quotidienne.\n\nOn a fait le tour des points pour le bilan d'aujourd'hui. Est-ce que tu veux qu'on parle de quelque chose en particulier ?",
      "agent_used": "investigator",
      "created_at": "2026-01-08T02:07:22.299659+00:00"
    }
  ],
  "state_before": {
    "scope": "web",
    "user_id": "0ba83c82-7505-426b-9b70-fe8d39a557dc",
    "risk_level": 0,
    "updated_at": "2026-01-08T02:06:23.622953+00:00",
    "current_mode": "investigator",
    "last_processed_at": "2026-01-08T02:06:23.622953+00:00",
    "short_term_context": null,
    "investigation_state": {
      "status": "checking",
      "temp_memory": {
        "opening_done": false
      },
      "pending_items": [
        {
          "id": "4e2b8d56-19d9-45f3-b190-774dbbba6414",
          "type": "vital",
          "unit": "h",
          "title": "Sommeil",
          "tracking_type": "counter"
        },
        {
          "id": "f14cb24e-8cc7-475c-9884-673a1787af26",
          "type": "action",
          "title": "Le Couvre-feu Digital Inviolable",
          "target": 7,
          "description": "Éteindre tous les écrans (téléphone, tablette, ordinateur) au moins 60 minutes avant de dormir, et les laisser hors de la chambre.",
          "tracking_type": "boolean"
        },
        {
          "id": "39baa452-ed5e-4a31-a9e4-7004cf0f4eb4",
          "type": "action",
          "title": "L'Épuration des Notifications Toxiques",
          "target": 1,
          "description": "Désactiver toutes les notifications push des applications non essentielles (réseaux sociaux, jeux, actualités) sur ton téléphone. Garde seulement celles vraiment urgentes (appels, messages prioritaires).",
          "tracking_type": "boolean"
        },
        {
          "id": "dbd42abd-7520-4923-a327-972af99ba56b",
          "type": "framework",
          "title": "La Vidange Cérébrale Quotidienne",
          "tracking_type": "boolean"
        }
      ],
      "current_item_index": 0
    },
    "last_interaction_at": "2026-01-08T02:06:23.622953+00:00",
    "unprocessed_msg_count": 0
  },
  "state_after": {
    "scope": "web",
    "user_id": "0ba83c82-7505-426b-9b70-fe8d39a557dc",
    "risk_level": 0,
    "updated_at": "2026-01-08T02:07:22.295262+00:00",
    "current_mode": "companion",
    "last_processed_at": "2026-01-08T02:06:23.622953+00:00",
    "short_term_context": null,
    "investigation_state": null,
    "last_interaction_at": "2026-01-08T02:06:23.622953+00:00",
    "unprocessed_msg_count": 6
  },
  "issues": [
    {
      "code": "INVESTIGATOR_MISSED_MICRO_GUIDANCE",
      "message": "The investigator effectively gathers information and shows empathy, but it consistently misses opportunities to provide brief, non-prescriptive encouragement or micro-suggestions directly related to the user's reported struggles or partial successes during the checkup. This makes the interaction feel more like a data collection exercise than a supportive guidance session.",
      "evidence": {
        "snippet": "USER: J'ai regardé une série, je me suis laissée emporter. ASSISTANT(investigator): Je vois, la série t'a bien tenue en haleine hier soir. Ça explique le bilan pour le Couvre-feu Digital Inviolable.",
        "agent_used": "investigator"
      },
      "severity": "medium"
    }
  ],
  "suggestions": [
    {
      "action": "append",
      "rationale": "This addendum aims to enhance the supportive and guiding aspect of the 'bilan' by empowering the investigator to provide immediate, gentle feedback. It keeps the interaction focused on the current checkup item and adheres to the 'bilan' focus without introducing new modules or complex interactions.",
      "prompt_key": "sophia.investigator",
      "context_block": "=== CONTEXT (transcript excerpt) ===\n=== STATE_BEFORE (user_chat_states) ===\ncurrent_mode: investigator\nrisk_level: 0\ninvestigation_state:\n{\n  \"status\": \"checking\",\n  \"temp_memory\": {\n    \"opening_done\": false\n  },\n  \"pending_items\": [\n    {\n      \"id\": \"4e2b8d56-19d9-45f3-b190-774dbbba6414\",\n      \"type\": \"vital\",\n      \"unit\": \"h\",\n      \"title\": \"Sommeil\",\n      \"tracking_type\": \"counter\"\n    },\n    {\n      \"id\": \"f14cb24e-8cc7-475c-9884-673a1787af26\",\n      \"type\": \"action\",\n      \"title\": \"Le Couvre-feu Digital Inviolable\",\n      \"target\": 7,\n      \"description\": \"Éteindre tous les écrans (téléphone, tablette, ordinateur) au moins 60 minutes avant de dormir, et les laisser hors de la chambre.\",\n      \"tracking_type\": \"boolean\"\n    },\n    {\n      \"id\": \"39baa452-ed5e-4a31-a9e4-7004cf0f4eb4\",\n      \"type\": \"action\",\n      \"title\": \"L'Épuration des Notifications Toxiques\",\n      \"target\": 1,\n      \"description\": \"Désactiver toutes les notifications push des applications non essentielles (réseaux sociaux, jeux, actualités) sur ton téléphone. Garde seulement celles vraiment urgentes (appels, messages prioritaires).\",\n      \"tracking_type\": \"boolean\"\n    },\n    {\n      \"id\": \"dbd42abd-7520-4923-a327-972af99ba56b\",\n      \"type\": \"framework\",\n      \"title\": \"La Vidange Cérébrale Quotidienne\",\n      \"tracking_type\": \"boolean\"\n    }\n  ],\n  \"current_item_index\": 0\n}\n=== TRANSCRIPT ===\n#0 USER: Oui\n#1 ASSISTANT(investigator): Ok, super. On va commencer avec le sommeil. C'est un point vraiment important. Combien d'heures tu as dormi la nuit dernière ?\n#2 USER: Environ 6h30, je crois.\n#3 ASSISTANT(investigator): D'accord, 6h30 de sommeil, c'est noté. Pour le Couvre-feu Digital Inviolable, est-ce que tu as réussi à éteindre tous tes écrans au moins une heure avant d'aller dormir hier soir ?\n\n=== APPLY ===\nprompt_key: sophia.investigator\naction: append\n\nproposed_addendum:\nWhen a user reports a challenge or a partial success for a checkup item, offer a brief, non-prescriptive piece of encouragement or a very light, actionable tip related to that specific item before moving to the next. Frame partial efforts positively. Do not initiate a new discussion or complex solution flow.",
      "proposed_addendum": "When a user reports a challenge or a partial success for a checkup item, offer a brief, non-prescriptive piece of encouragement or a very light, actionable tip related to that specific item before moving to the next. Frame partial efforts positively. Do not initiate a new discussion or complex solution flow."
    }
  ],
  "metrics": {
    "cost_usd": 0.018314600000000004,
    "request_id": "ae9dff94-c1c6-48fb-a1b8-b4447351d54c:core:bilan_real_vitals__a7080d896c204f:c7e43dc7-15f1-48f2-a6fb-2c05afad8f92",
    "total_tokens": 61927,
    "output_tokens": 1286,
    "prompt_tokens": 50332,
    "judge_llm_used": true,
    "mega_test_mode": false
  },
  "config": {
    "tags": [
      "sophia.investigator",
      "bilan.vitals"
    ],
    "limits": {
      "model": "gemini-2.5-flash",
      "user_difficulty": "mid",
      "bilan_actions_count": 3
    },
    "description": "Bilan real (simulate-user) with vitals first + 3 actions to verify, 15 turns max.",
    "plan_snapshot": {
      "plan": {
        "id": "bbdfc8e5-1a5a-4269-a5a5-539fafc45ffd",
        "title": "Le Protocole du Flux Imperturbable",
        "status": "active",
        "content": {
          "phases": [
            {
              "id": 1,
              "title": "Phase 1 : L'Ancrage Rapide",
              "status": "active",
              "actions": [
                {
                  "id": "f14cb24e-8cc7-475c-9884-673a1787af26",
                  "tips": "Utilise un réveil analogique. Place ton téléphone dans une pièce différente, loin de ton lit.",
                  "type": "habitude",
                  "title": "Le Couvre-feu Digital Inviolable",
                  "status": "active",
                  "questType": "main",
                  "rationale": "Diminue l'exposition à la lumière bleue et aux stimuli cognitifs qui retardent l'endormissement et perturbent la qualité du sommeil. C'est le premier pas pour briser le cycle de fatigue et de compensation.",
                  "targetReps": 7,
                  "description": "Éteindre tous les écrans (téléphone, tablette, ordinateur) au moins 60 minutes avant de dormir, et les laisser hors de la chambre.",
                  "isCompleted": false,
                  "time_of_day": "night",
                  "tracking_type": "boolean"
                },
                {
                  "id": "74417276-82b6-4c18-90f6-8d464a0cc8f3",
                  "tips": "Ne cherche pas à résoudre, juste à décharger. Laisse tout sortir, sans jugement.",
                  "type": "framework",
                  "title": "La Vidange Cérébrale Quotidienne",
                  "status": "active",
                  "questType": "side",
                  "rationale": "Libère l'esprit de la charge mentale, réduisant l'activation du système nerveux sympathique et facilitant la transition vers le repos. C'est un précurseur essentiel à un sommeil réparateur et une diminution de l'irritabilité.",
                  "targetReps": 7,
                  "description": "Dédier 5-10 minutes chaque soir pour noter sur papier toutes les pensées, préoccupations, ou tâches non accomplies qui encombrent l'esprit.",
                  "isCompleted": false,
                  "time_of_day": "evening",
                  "tracking_type": "boolean",
                  "frameworkDetails": {
                    "type": "recurring",
                    "intro": "Ton cerveau est un formidable processeur, mais il n'est pas fait pour stocker toutes les boucles ouvertes. Vidange ta RAM mentale avant de te déconnecter.",
                    "sections": [
                      {
                        "id": "s1_a2p1",
                        "label": "Ce qui m'encombre (pensées, tâches, soucis)",
                        "inputType": "textarea",
                        "placeholder": "Liste de courses, réponse à l'email X, l'inquiétude pour Y..."
                      },
                      {
                        "id": "s2_a2p1",
                        "label": "Niveau de clarté ressenti après (1-10)",
                        "inputType": "scale",
                        "placeholder": "7"
                      }
                    ]
                  }
                },
                {
                  "id": "39baa452-ed5e-4a31-a9e4-7004cf0f4eb4",
                  "tips": "Fais un tour dans les réglages de ton téléphone, section 'Notifications'. Sois impitoyable.",
                  "type": "mission",
                  "title": "L'Épuration des Notifications Toxiques",
                  "status": "active",
                  "questType": "side",
                  "rationale": "Chaque notification est une micro-interruption qui sollicite ton attention et augmente ta charge cognitive, contribuant à l'irritabilité et à la perte de concentration. Reprends le contrôle de ton focus.",
                  "description": "Désactiver toutes les notifications push des applications non essentielles (réseaux sociaux, jeux, actualités) sur ton téléphone. Garde seulement celles vraiment urgentes (appels, messages prioritaires).",
                  "isCompleted": false,
                  "time_of_day": "any_time",
                  "tracking_type": "boolean"
                }
              ],
              "subtitle": "Semaine 1 • Couper les fuites d'énergie",
              "rationale": "Nous allons désamorcer les principales sources de distraction et de surstimulation, en créant une fondation pour la clarté mentale et un repos de qualité."
            },
            {
              "id": 2,
              "title": "Phase 2 : Le Déblayage Mental",
              "status": "locked",
              "actions": [
                {
                  "id": "0d7c0ca9-8b08-48d4-adfc-9dcb73294fd4",
                  "tips": "Règle un rappel discret. Fais-le avant de te sentir débordée, pas après.",
                  "type": "habitude",
                  "title": "La Bulle de Micro-Pause Consciente",
                  "status": "pending",
                  "questType": "main",
                  "rationale": "Ces micro-pauses agissent comme des resets neuronaux, activant le système nerveux parasympathique et prévenant l'accumulation de stress. Elles améliorent la capacité de régulation émotionnelle et de concentration.",
                  "targetReps": 14,
                  "description": "Deux fois par jour, prends une pause de 2-3 minutes pour te déconnecter totalement : ferme les yeux, respire profondément 5 fois en pleine conscience, et scanne ton corps pour identifier les tensions.",
                  "isCompleted": false,
                  "time_of_day": "any_time",
                  "tracking_type": "boolean"
                },
                {
                  "id": "2f3f96b0-9e75-43a7-ac0b-4df613990292",
                  "tips": "Utilise des catégories comme 'Urgent/Important', 'Délégable', 'Planifiable', 'À Éliminer'.",
                  "type": "framework",
                  "title": "L'Inventaire de la Charge Mentale",
                  "status": "pending",
                  "questType": "side",
                  "rationale": "Extérioriser ta charge mentale sur un support structuré permet de la rendre moins abstraite et donc moins accablante. Cela active le cortex préfrontal pour la planification, réduisant l'anxiété du 'tout à faire'.",
                  "targetReps": 1,
                  "description": "Une fois dans la semaine, prends 30 minutes pour lister et catégoriser toutes tes responsabilités, tâches et préoccupations actuelles, qu'elles soient personnelles ou professionnelles.",
                  "isCompleted": false,
                  "time_of_day": "morning",
                  "tracking_type": "boolean",
                  "frameworkDetails": {
                    "type": "one_shot",
                    "intro": "Le sentiment d'être submergé vient souvent d'une charge invisible. Rends-la visible pour mieux la gérer. Ce n'est pas une to-do list, mais une cartographie de ton univers mental.",
                    "sections": [
                      {
                        "id": "s1_a2p2",
                        "label": "Tâches / Projets / Préoccupations | Catégorie (pro, perso, admin, etc.)",
                        "inputType": "categorized_list",
                        "placeholder": "Rendez-vous dentiste enfant|Perso; Rapport X|Pro"
                      },
                      {
                        "id": "s2_a2p2",
                        "label": "Sentiment global d'écrasement avant/après (1-10)",
                        "inputType": "scale",
                        "placeholder": "8"
                      }
                    ]
                  }
                },
                {
                  "id": "45965e93-1b40-4849-8476-947e538bcea7",
                  "tips": "Ne cherche pas l'exhaustivité, juste l'essentiel. Cela clarifie l'intention et réduit le stress matinal.",
                  "type": "habitude",
                  "title": "La Routine de Planification du Lendemain",
                  "status": "pending",
                  "questType": "side",
                  "rationale": "Ce rituel réduit l'incertitude et l'anxiété liées au lendemain, permettant à ton cerveau de se reposer sans 'travailler' sur la planification nocturne. Cela optimise ton énergie et ton focus dès le réveil.",
                  "targetReps": 7,
                  "description": "Chaque soir, avant de te déconnecter, passe 5 minutes à esquisser les 3 tâches les plus importantes pour le lendemain. Note-les sur papier ou dans une application dédiée.",
                  "isCompleted": false,
                  "time_of_day": "evening",
                  "tracking_type": "boolean"
                }
              ],
              "subtitle": "Semaine 2 • Créer de l'espace et du focus",
              "rationale": "Maintenant que les interférences sont réduites, nous allons structurer ta pensée et intégrer des pauses réparatrices pour gérer la charge mentale avant qu'elle ne devienne submergeante."
            },
            {
              "id": 3,
              "title": "Phase 3 : Le Regain Énergétique",
              "status": "locked",
              "actions": [
                {
                  "id": "cbcfcfb2-a527-45bc-8c56-d2aa38d256f2",
                  "tips": "Utilise une application ou un guide en ligne. Fais-le au calme, assis(e) confortablement.",
                  "type": "habitude",
                  "title": "Le Protocole de Respiration Anti-Stress",
                  "status": "pending",
                  "questType": "main",
                  "rationale": "La cohérence cardiaque équilibre le système nerveux autonome, réduisant le cortisol (hormone du stress) et augmentant la variabilité cardiaque, signe de résilience au stress. C'est un outil puissant contre l'irritabilité.",
                  "targetReps": 14,
                  "description": "Pratiquer 2 fois par jour une séance de 3-5 minutes de respiration de cohérence cardiaque (5 secondes d'inspiration, 5 secondes d'expiration).",
                  "isCompleted": false,
                  "time_of_day": "any_time",
                  "tracking_type": "boolean"
                },
                {
                  "id": "2a6502c4-010b-474a-93aa-02fe415ab82b",
                  "tips": "Ajoute une tranche de citron ou de concombre pour rendre l'eau plus attrayante. Fixe-toi des mini-objectifs tout au long de la journée.",
                  "type": "habitude",
                  "title": "L'Hydratation Ciblée",
                  "status": "pending",
                  "questType": "side",
                  "rationale": "La déshydratation, même légère, impacte la fonction cognitive et le niveau d'énergie, pouvant exacerber la fatigue et l'irritabilité. Une hydratation optimale soutient le fonctionnement cérébral et corporel.",
                  "targetReps": 7,
                  "description": "Boire au moins 2 litres d'eau par jour, en portant une attention particulière aux moments où tu ressens de la fatigue ou de l'irritabilité, et en ayant toujours une gourde à portée de main.",
                  "isCompleted": false,
                  "time_of_day": "any_time",
                  "tracking_type": "counter"
                },
                {
                  "id": "169cd81d-c91b-46ae-ae9f-72dfa9ddb8e6",
                  "tips": "Ajoute un plaid, une bougie (sans flamme si tu préfères), une plante. Le but est un lieu visuellement apaisant.",
                  "type": "mission",
                  "title": "Créer un Espace de Sérénité",
                  "status": "pending",
                  "questType": "side",
                  "rationale": "Avoir un 'sanctuaire' physique crée un signal environnemental pour la relaxation, renforçant l'habitude des pauses et offrant un refuge sensoriel loin des déclencheurs de stress. Cela ancre un nouveau comportement d'apaisement.",
                  "description": "Aménager un petit coin chez toi (même une chaise confortable ou un rebord de fenêtre) dédié à la détente, sans écran, où tu peux te retirer pour tes micro-pauses ou pour lire quelques minutes.",
                  "isCompleted": false,
                  "time_of_day": "any_time",
                  "tracking_type": "boolean"
                }
              ],
              "subtitle": "Semaine 3 • Recharger et calibrer",
              "rationale": "Avec une charge mentale mieux gérée, nous allons activer des mécanismes physiologiques de récupération pour booster ton énergie et améliorer ta régulation émotionnelle."
            },
            {
              "id": 4,
              "title": "Phase 4 : La Synthèse Imperturbable",
              "status": "locked",
              "actions": [
                {
                  "id": "60361bb0-28e4-4edc-bac3-ff4cd75832a4",
                  "tips": "Sois honnête avec toi-même. Le but est d'apprendre de ton expérience des 3 dernières semaines.",
                  "type": "framework",
                  "title": "Bilan des Déclencheurs et Stratégies",
                  "status": "pending",
                  "questType": "main",
                  "rationale": "Comprendre tes déclencheurs et tes réponses est la clé de la maîtrise émotionnelle. Ce framework renforce ta métacognition et ta capacité à anticiper et à adapter tes réactions de manière proactive.",
                  "targetReps": 1,
                  "description": "Réfléchir aux situations ou pensées qui déclenchent ton stress et ton irritabilité, et identifier les stratégies efficaces que tu as utilisées ou celles que tu pourrais mettre en place.",
                  "isCompleted": false,
                  "time_of_day": "any_time",
                  "tracking_type": "boolean",
                  "frameworkDetails": {
                    "type": "one_shot",
                    "intro": "L'auto-observation est le premier pas vers l'auto-maîtrise. Cartographions tes schémas réactifs pour construire une nouvelle architecture de réponse.",
                    "sections": [
                      {
                        "id": "s1_a1p4",
                        "label": "Mes principaux déclencheurs de stress/irritabilité",
                        "inputType": "list",
                        "placeholder": "Le rush du matin; Les attentes irréalistes; Le bruit ambiant"
                      },
                      {
                        "id": "s2_a1p4",
                        "label": "Stratégies efficaces que j'ai utilisées (ou pourrais utiliser)",
                        "inputType": "list",
                        "placeholder": "Micro-pause; Respiration; Délégation; Dire non"
                      },
                      {
                        "id": "s3_a1p4",
                        "label": "Mon plan d'action pour le mois prochain",
                        "inputType": "textarea",
                        "placeholder": "Continuer la respiration quotidienne, planifier mes 3 priorités chaque soir, etc."
                      }
                    ]
                  }
                },
                {
                  "id": "0e776d13-f0c1-44e9-8305-6e33c25eaeeb",
                  "tips": "Crée un geste ou une phrase qui marque la transition. C'est un signal clair pour ton cerveau que le 'mode travail' est terminé.",
                  "type": "habitude",
                  "title": "Le Rituel de Déconnexion du Travail",
                  "status": "pending",
                  "questType": "side",
                  "rationale": "Ce rituel aide ton cerveau à créer une frontière nette entre le temps de travail et le temps personnel, réduisant la rumination post-travail et la charge mentale diffuse. Il soutient la régulation émotionnelle et la disponibilité pour le repos.",
                  "targetReps": 7,
                  "description": "À la fin de ta journée de travail, effectue un rituel symbolique de déconnexion (ex: ranger ton bureau, fermer ton ordinateur en disant 'fini pour aujourd'hui', faire une micro-pause spécifique).",
                  "isCompleted": false,
                  "time_of_day": "evening",
                  "tracking_type": "boolean"
                },
                {
                  "id": "7f597992-a46a-4ac8-8d01-96f64d1848ca",
                  "tips": "Commence par une petite tâche. L'objectif est de te prouver que tu peux alléger ta charge.",
                  "type": "mission",
                  "title": "Déléguer ou Éliminer une Tâche Hebdomadaire",
                  "status": "pending",
                  "questType": "side",
                  "rationale": "Apprendre à déléguer ou à éliminer est une compétence cruciale pour gérer la charge mentale. Cela réduit l'encombrement cognitif et libère des ressources mentales pour des activités plus importantes ou réparatrices, renforçant ton sentiment de contrôle.",
                  "description": "Identifier et réussir à déléguer (à un collègue, un partenaire, un prestataire) ou à éliminer (décider de ne pas faire) une tâche qui pèse particulièrement sur ta charge mentale cette semaine.",
                  "isCompleted": false,
                  "time_of_day": "any_time",
                  "tracking_type": "boolean"
                }
              ],
              "subtitle": "Semaine 4 • Consolider et autonomiser",
              "rationale": "Cette dernière phase vise à intégrer les changements dans ton identité, à identifier et anticiper les défis futurs, et à cultiver une résilience durable."
            }
          ],
          "deepWhy": "Pour ressentir une clarté mentale inébranlable et une énergie constante, me permettant de naviguer mes journées avec sérénité et présence.",
          "identity": "Je suis l'Architecte de mon Calme Intérieur.",
          "strategy": "Face à la surcharge et l'irritabilité, notre priorité est de désamorcer les déclencheurs immédiats et de reconstruire ta résilience nerveuse. Nous allons épurer l'environnement digital, organiser ta charge mentale et ancrer des rituels de rechargement profond.",
          "goldenRules": "1. Le téléphone est un outil, pas une béquille émotionnelle.\n2. Chaque pensée a sa place, mais pas toutes en même temps.\n3. Priorité absolue à ma ressource énergie.",
          "vitalSignal": {
            "name": "Temps d'écran récréatif",
            "type": "constat",
            "unit": "min",
            "startValue": "240",
            "description": "Réduire progressivement le temps passé sur des applications non essentielles, en visant 30 minutes de moins chaque semaine.",
            "targetValue": "60",
            "tracking_type": "counter"
          },
          "grimoireTitle": "Le Protocole du Flux Imperturbable",
          "context_problem": "Tu te sentais submergée par une charge mentale constante et une irritabilité qui te privait de ta stabilité. Tes journées irrégulières, associées à une fatigue sous-jacente, te poussaient à compenser par un usage excessif du téléphone, créant un cycle de surcharge et de perte de concentration.",
          "sophiaKnowledge": "Tu es une femme dynamique de 32 ans, avec un niveau d'activité élevé, mais qui se sent souvent submergée et irritable par une charge mentale intense. Tes journées irrégulières génèrent de la fatigue que tu compenses par un usage accru du téléphone, perturbant ta stabilité et ton énergie quotidienne.",
          "maintenanceCheck": {
            "type": "surveillance",
            "question": "Combien de fois cette semaine t'es-tu sentie submergée ou irritable sans pouvoir réagir calmement ?",
            "frequency": "hebdomadaire",
            "tracking_type": "counter"
          },
          "estimatedDuration": "4 semaines"
        },
        "goal_id": "064112ba-10b9-4656-9bfc-b38e5c5a91b2",
        "deep_why": "Pour ressentir une clarté mentale inébranlable et une énergie constante, me permettant de naviguer mes journées avec sérénité et présence.",
        "created_at": "2026-01-08T02:06:23.584884+00:00",
        "inputs_why": null,
        "current_phase": 1,
        "submission_id": "50cfbd51-a90e-4b4f-a5a0-0b721b19bd97",
        "inputs_context": null,
        "inputs_blockers": null,
        "progress_percentage": 0
      },
      "actions": [
        {
          "id": "f14cb24e-8cc7-475c-9884-673a1787af26",
          "title": "Le Couvre-feu Digital Inviolable",
          "status": "active",
          "created_at": "2026-01-08T02:06:23.595145+00:00",
          "description": "Éteindre tous les écrans (téléphone, tablette, ordinateur) au moins 60 minutes avant de dormir, et les laisser hors de la chambre.",
          "target_reps": 7,
          "time_of_day": "night",
          "current_reps": 0,
          "tracking_type": "boolean",
          "last_performed_at": "2026-01-06T02:06:23.591+00:00"
        },
        {
          "id": "39baa452-ed5e-4a31-a9e4-7004cf0f4eb4",
          "title": "L'Épuration des Notifications Toxiques",
          "status": "active",
          "created_at": "2026-01-08T02:06:23.595145+00:00",
          "description": "Désactiver toutes les notifications push des applications non essentielles (réseaux sociaux, jeux, actualités) sur ton téléphone. Garde seulement celles vraiment urgentes (appels, messages prioritaires).",
          "target_reps": 1,
          "time_of_day": "any_time",
          "current_reps": 0,
          "tracking_type": "boolean",
          "last_performed_at": "2026-01-06T02:06:23.591+00:00"
        },
        {
          "id": "dbd42abd-7520-4923-a327-972af99ba56b",
          "_kind": "framework",
          "title": "La Vidange Cérébrale Quotidienne",
          "status": "active",
          "created_at": "2026-01-08T02:06:23.605798+00:00",
          "description": "",
          "target_reps": 7,
          "time_of_day": null,
          "current_reps": 0,
          "tracking_type": "boolean",
          "framework_type": "recurring",
          "last_performed_at": "2026-01-06T02:06:23.591+00:00"
        }
      ],
      "frameworks": [
        {
          "id": "dbd42abd-7520-4923-a327-972af99ba56b",
          "type": "recurring",
          "title": "La Vidange Cérébrale Quotidienne",
          "status": "active",
          "created_at": "2026-01-08T02:06:23.605798+00:00",
          "target_reps": 7,
          "current_reps": 0,
          "tracking_type": "boolean",
          "last_performed_at": "2026-01-06T02:06:23.591+00:00"
        }
      ],
      "dashboard_context": "=== PLAN ACTUEL (Tableau de Bord) ===\nTitre: Le Protocole du Flux Imperturbable\nStatut: active\nPhase courante (dashboard): 1\nPourquoi (Deep Why): Pour ressentir une clarté mentale inébranlable et une énergie constante, me permettant de naviguer mes journées avec sérénité et présence.\nDÉTAIL COMPLET DU PLAN (Structure JSON) :\n{\n  \"phases\": [\n    {\n      \"id\": 1,\n      \"title\": \"Phase 1 : L'Ancrage Rapide\",\n      \"status\": \"active\",\n      \"actions\": [\n        {\n          \"id\": \"f14cb24e-8cc7-475c-9884-673a1787af26\",\n          \"tips\": \"Utilise un réveil analogique. Place ton téléphone dans une pièce différente, loin de ton lit.\",\n          \"type\": \"habitude\",\n          \"title\": \"Le Couvre-feu Digital Inviolable\",\n          \"status\": \"active\",\n          \"questType\": \"main\",\n          \"rationale\": \"Diminue l'exposition à la lumière bleue et aux stimuli cognitifs qui retardent l'endormissement et perturbent la qualité du sommeil. C'est le premier pas pour briser le cycle de fatigue et de compensation.\",\n          \"targetReps\": 7,\n          \"description\": \"Éteindre tous les écrans (téléphone, tablette, ordinateur) au moins 60 minutes avant de dormir, et les laisser hors de la chambre.\",\n          \"isCompleted\": false,\n          \"time_of_day\": \"night\",\n          \"tracking_type\": \"boolean\"\n        },\n        {\n          \"id\": \"74417276-82b6-4c18-90f6-8d464a0cc8f3\",\n          \"tips\": \"Ne cherche pas à résoudre, juste à décharger. Laisse tout sortir, sans jugement.\",\n          \"type\": \"framework\",\n          \"title\": \"La Vidange Cérébrale Quotidienne\",\n          \"status\": \"active\",\n          \"questType\": \"side\",\n          \"rationale\": \"Libère l'esprit de la charge mentale, réduisant l'activation du système nerveux sympathique et facilitant la transition vers le repos. C'est un précurseur essentiel à un sommeil réparateur et une diminution de l'irritabilité.\",\n          \"targetReps\": 7,\n          \"description\": \"Dédier 5-10 minutes chaque soir pour noter sur papier toutes les pensées, préoccupations, ou tâches non accomplies qui encombrent l'esprit.\",\n          \"isCompleted\": false,\n          \"time_of_day\": \"evening\",\n          \"tracking_type\": \"boolean\",\n          \"frameworkDetails\": {\n            \"type\": \"recurring\",\n            \"intro\": \"Ton cerveau est un formidable processeur, mais il n'est pas fait pour stocker toutes les boucles ouvertes. Vidange ta RAM mentale avant de te déconnecter.\",\n            \"sections\": [\n              {\n                \"id\": \"s1_a2p1\",\n                \"label\": \"Ce qui m'encombre (pensées, tâches, soucis)\",\n                \"inputType\": \"textarea\",\n                \"placeholder\": \"Liste de courses, réponse à l'email X, l'inquiétude pour Y...\"\n              },\n              {\n                \"id\": \"s2_a2p1\",\n                \"label\": \"Niveau de clarté ressenti après (1-10)\",\n                \"inputType\": \"scale\",\n                \"placeholder\": \"7\"\n              }\n            ]\n          }\n        },\n        {\n          \"id\": \"39baa452-ed5e-4a31-a9e4-7004cf0f4eb4\",\n          \"tips\": \"Fais un tour dans les réglages de ton téléphone, section 'Notifications'. Sois impitoyable.\",\n          \"type\": \"mission\",\n          \"title\": \"L'Épuration des Notifications Toxiques\",\n          \"status\": \"active\",\n          \"questType\": \"side\",\n          \"rationale\": \"Chaque notification est une micro-interruption qui sollicite ton attention et augmente ta charge cognitive, contribuant à l'irritabilité et à la perte de concentration. Reprends le contrôle de ton focus.\",\n          \"description\": \"Désactiver toutes les notifications push des applications non essentielles (réseaux sociaux, jeux, actualités) sur ton téléphone. Garde seulement celles vraiment urgentes (appels, messages prioritaires).\",\n          \"isCompleted\": false,\n          \"time_of_day\": \"any_time\",\n          \"tracking_type\": \"boolean\"\n        }\n      ],\n      \"subtitle\": \"Semaine 1 • Couper les fuites d'énergie\",\n      \"rationale\": \"Nous allons désamorcer les principales sources de distraction et de surstimulation, en créant une fondation pour la clarté mentale et un repos de qualité.\"\n    },\n    {\n      \"id\": 2,\n      \"title\": \"Phase 2 : Le Déblayage Mental\",\n      \"status\": \"locked\",\n      \"actions\": [\n        {\n          \"id\": \"0d7c0ca9-8b08-48d4-adfc-9dcb73294fd4\",\n          \"tips\": \"Règle un rappel discret. Fais-le avant de te sentir débordée, pas après.\",\n          \"type\": \"habitude\",\n          \"title\": \"La Bulle de Micro-Pause Consciente\",\n          \"status\": \"pending\",\n          \"questType\": \"main\",\n          \"rationale\": \"Ces micro-pauses agissent comme des resets neuronaux, activant le système nerveux parasympathique et prévenant l'accumulation de stress. Elles améliorent la capacité de régulation émotionnelle et de concentration.\",\n          \"targetReps\": 14,\n          \"description\": \"Deux fois par jour, prends une pause de 2-3 minutes pour te déconnecter totalement : ferme les yeux, respire profondément 5 fois en pleine conscience, et scanne ton corps pour identifier les tensions.\",\n          \"isCompleted\": false,\n          \"time_of_day\": \"any_time\",\n          \"tracking_type\": \"boolean\"\n        },\n        {\n          \"id\": \"2f3f96b0-9e75-43a7-ac0b-4df613990292\",\n          \"tips\": \"Utilise des catégories comme 'Urgent/Important', 'Délégable', 'Planifiable', 'À Éliminer'.\",\n          \"type\": \"framework\",\n          \"title\": \"L'Inventaire de la Charge Mentale\",\n          \"status\": \"pending\",\n          \"questType\": \"side\",\n          \"rationale\": \"Extérioriser ta charge mentale sur un support structuré permet de la rendre moins abstraite et donc moins accablante. Cela active le cortex préfrontal pour la planification, réduisant l'anxiété du 'tout à faire'.\",\n          \"targetReps\": 1,\n          \"description\": \"Une fois dans la semaine, prends 30 minutes pour lister et catégoriser toutes tes responsabilités, tâches et préoccupations actuelles, qu'elles soient personnelles ou professionnelles.\",\n          \"isCompleted\": false,\n          \"time_of_day\": \"morning\",\n          \"tracking_type\": \"boolean\",\n          \"frameworkDetails\": {\n            \"type\": \"one_shot\",\n            \"intro\": \"Le sentiment d'être submergé vient souvent d'une charge invisible. Rends-la visible pour mieux la gérer. Ce n'est pas une to-do list, mais une cartographie de ton univers mental.\",\n            \"sections\": [\n              {\n                \"id\": \"s1_a2p2\",\n                \"label\": \"Tâches / Projets / Préoccupations | Catégorie (pro, perso, admin, etc.)\",\n                \"inputType\": \"categorized_list\",\n                \"placeholder\": \"Rendez-vous dentiste enfant|Perso; Rapport X|Pro\"\n              },\n              {\n                \"id\": \"s2_a2p2\",\n                \"label\": \"Sentiment global d'écrasement avant/après (1-10)\",\n                \"inputType\": \"scale\",\n                \"placeholder\": \"8\"\n              }\n            ]\n          }\n        },\n        {\n          \"id\": \"45965e93-1b40-4849-8476-947e538bcea7\",\n          \"tips\": \"Ne cherche pas l'exhaustivité, juste l'essentiel. Cela clarifie l'intention et réduit le stress matinal.\",\n          \"type\": \"habitude\",\n          \"title\": \"La Routine de Planification du Lendemain\",\n          \"status\": \"pending\",\n          \"questType\": \"side\",\n          \"rationale\": \"Ce rituel réduit l'incertitude et l'anxiété liées au lendemain, permettant à ton cerveau de se reposer sans 'travailler' sur la planification nocturne. Cela optimise ton énergie et ton focus dès le réveil.\",\n          \"targetReps\": 7,\n          \"description\": \"Chaque soir, avant de te déconnecter, passe 5 minutes à esquisser les 3 tâches les plus importantes pour le lendemain. Note-les sur papier ou dans une application dédiée.\",\n          \"isCompleted\": false,\n          \"time_of_day\": \"evening\",\n          \"tracking_type\": \"boolean\"\n        }\n      ],\n      \"subtitle\": \"Semaine 2 • Créer de l'espace et du focus\",\n      \"rationale\": \"Maintenant que les interférences sont réduites, nous allons structurer ta pensée et intégrer des pauses réparatrices pour gérer la charge mentale avant qu'elle ne devienne submergeante.\"\n    },\n    {\n      \"id\": 3,\n      \"title\": \"Phase 3 : Le Regain Énergétique\",\n      \"status\": \"locked\",\n      \"actions\": [\n        {\n          \"id\": \"cbcfcfb2-a527-45bc-8c56-d2aa38d256f2\",\n          \"tips\": \"Utilise une application ou un guide en ligne. Fais-le au calme, assis(e) confortablement.\",\n          \"type\": \"habitude\",\n          \"title\": \"Le Protocole de Respiration Anti-Stress\",\n          \"status\": \"pending\",\n          \"questType\": \"main\",\n          \"rationale\": \"La cohérence cardiaque équilibre le système nerveux autonome, réduisant le cortisol (hormone du stress) et augmentant la variabilité cardiaque, signe de résilience au stress. C'est un outil puissant contre l'irritabilité.\",\n          \"targetReps\": 14,\n          \"description\": \"Pratiquer 2 fois par jour une séance de 3-5 minutes de respiration de cohérence cardiaque (5 secondes d'inspiration, 5 secondes d'expiration).\",\n          \"isCompleted\": false,\n          \"time_of_day\": \"any_time\",\n          \"tracking_type\": \"boolean\"\n        },\n        {\n          \"id\": \"2a6502c4-010b-474a-93aa-02fe415ab82b\",\n          \"tips\": \"Ajoute une tranche de citron ou de concombre pour rendre l'eau plus attrayante. Fixe-toi des mini-objectifs tout au long de la journée.\",\n          \"type\": \"habitude\",\n          \"title\": \"L'Hydratation Ciblée\",\n          \"status\": \"pending\",\n          \"questType\": \"side\",\n          \"rationale\": \"La déshydratation, même légère, impacte la fonction cognitive et le niveau d'énergie, pouvant exacerber la fatigue et l'irritabilité. Une hydratation optimale soutient le fonctionnement cérébral et corporel.\",\n          \"targetReps\": 7,\n          \"description\": \"Boire au moins 2 litres d'eau par jour, en portant une attention particulière aux moments où tu ressens de la fatigue ou de l'irritabilité, et en ayant toujours une gourde à portée de main.\",\n          \"isCompleted\": false,\n          \"time_of_day\": \"any_time\",\n          \"tracking_type\": \"counter\"\n        },\n        {\n          \"id\": \"169cd81d-c91b-46ae-ae9f-72dfa9ddb8e6\",\n          \"tips\": \"Ajoute un plaid, une bougie (sans flamme si tu préfères), une plante. Le but est un lieu visuellement apaisant.\",\n          \"type\": \"mission\",\n          \"title\": \"Créer un Espace de Sérénité\",\n          \"status\": \"pending\",\n          \"questType\": \"side\",\n          \"rationale\": \"Avoir un 'sanctuaire' physique crée un signal environnemental pour la relaxation, renforçant l'habitude des pauses et offrant un refuge sensoriel loin des déclencheurs de stress. Cela ancre un nouveau comportement d'apaisement.\",\n          \"description\": \"Aménager un petit coin chez toi (même une chaise confortable ou un rebord de fenêtre) dédié à la détente, sans écran, où tu peux te retirer pour tes micro-pauses ou pour lire quelques minutes.\",\n          \"isCompleted\": false,\n          \"time_of_day\": \"any_time\",\n          \"tracking_type\": \"boolean\"\n        }\n      ],\n      \"subtitle\": \"Semaine 3 • Recharger et calibrer\",\n      \"rationale\": \"Avec une charge mentale mieux gérée, nous allons activer des mécanismes physiologiques de récupération pour booster ton énergie et améliorer ta régulation émotionnelle.\"\n    },\n    {\n      \"id\": 4,\n      \"title\": \"Phase 4 : La Synthèse Imperturbable\",\n      \"status\": \"locked\",\n      \"actions\": [\n        {\n          \"id\": \"60361bb0-28e4-4edc-bac3-ff4cd75832a4\",\n          \"tips\": \"Sois honnête avec toi-même. Le but est d'apprendre de ton expérience des 3 dernières semaines.\",\n          \"type\": \"framework\",\n          \"title\": \"Bilan des Déclencheurs et Stratégies\",\n          \"status\": \"pending\",\n          \"questType\": \"main\",\n          \"rationale\": \"Comprendre tes déclencheurs et tes réponses est la clé de la maîtrise émotionnelle. Ce framework renforce ta métacognition et ta capacité à anticiper et à adapter tes réactions de manière proactive.\",\n          \"targetReps\": 1,\n          \"description\": \"Réfléchir aux situations ou pensées qui déclenchent ton stress et ton irritabilité, et identifier les stratégies efficaces que tu as utilisées ou celles que tu pourrais mettre en place.\",\n          \"isCompleted\": false,\n          \"time_of_day\": \"any_time\",\n          \"tracking_type\": \"boolean\",\n          \"frameworkDetails\": {\n            \"type\": \"one_shot\",\n            \"intro\": \"L'auto-observation est le premier pas vers l'auto-maîtrise. Cartographions tes schémas réactifs pour construire une nouvelle architecture de réponse.\",\n            \"sections\": [\n              {\n                \"id\": \"s1_a1p4\",\n                \"label\": \"Mes principaux déclencheurs de stress/irritabilité\",\n                \"inputType\": \"list\",\n                \"placeholder\": \"Le rush du matin; Les attentes irréalistes; Le bruit ambiant\"\n              },\n              {\n                \"id\": \"s2_a1p4\",\n                \"label\": \"Stratégies efficaces que j'ai utilisées (ou pourrais utiliser)\",\n                \"inputType\": \"list\",\n                \"placeholder\": \"Micro-pause; Respiration; Délégation; Dire non\"\n              },\n              {\n                \"id\": \"s3_a1p4\",\n                \"label\": \"Mon plan d'action pour le mois prochain\",\n                \"inputType\": \"textarea\",\n                \"placeholder\": \"Continuer la respiration quotidienne, planifier mes 3 priorités chaque soir, etc.\"\n              }\n            ]\n          }\n        },\n        {\n          \"id\": \"0e776d13-f0c1-44e9-8305-6e33c25eaeeb\",\n          \"tips\": \"Crée un geste ou une phrase qui marque la transition. C'est un signal clair pour ton cerveau que le 'mode travail' est terminé.\",\n          \"type\": \"habitude\",\n          \"title\": \"Le Rituel de Déconnexion du Travail\",\n          \"status\": \"pending\",\n          \"questType\": \"side\",\n          \"rationale\": \"Ce rituel aide ton cerveau à créer une frontière nette entre le temps de travail et le temps personnel, réduisant la rumination post-travail et la charge mentale diffuse. Il soutient la régulation émotionnelle et la disponibilité pour le repos.\",\n          \"targetReps\": 7,\n          \"description\": \"À la fin de ta journée de travail, effectue un rituel symbolique de déconnexion (ex: ranger ton bureau, fermer ton ordinateur en disant 'fini pour aujourd'hui', faire une micro-pause spécifique).\",\n          \"isCompleted\": false,\n          \"time_of_day\": \"evening\",\n          \"tracking_type\": \"boolean\"\n        },\n        {\n          \"id\": \"7f597992-a46a-4ac8-8d01-96f64d1848ca\",\n          \"tips\": \"Commence par une petite tâche. L'objectif est de te prouver que tu peux alléger ta charge.\",\n          \"type\": \"mission\",\n          \"title\": \"Déléguer ou Éliminer une Tâche Hebdomadaire\",\n          \"status\": \"pending\",\n          \"questType\": \"side\",\n          \"rationale\": \"Apprendre à déléguer ou à éliminer est une compétence cruciale pour gérer la charge mentale. Cela réduit l'encombrement cognitif et libère des ressources mentales pour des activités plus importantes ou réparatrices, renforçant ton sentiment de contrôle.\",\n          \"description\": \"Identifier et réussir à déléguer (à un collègue, un partenaire, un prestataire) ou à éliminer (décider de ne pas faire) une tâche qui pèse particulièrement sur ta charge mentale cette semaine.\",\n          \"isCompleted\": false,\n          \"time_of_day\": \"any_time\",\n          \"tracking_type\": \"boolean\"\n        }\n      ],\n      \"subtitle\": \"Semaine 4 • Consolider et autonomiser\",\n      \"rationale\": \"Cette dernière phase vise à intégrer les changements dans ton identité, à identifier et anticiper les défis futurs, et à cultiver une résilience durable.\"\n    }\n  ],\n  \"deepWhy\": \"Pour ressentir une clarté mentale inébranlable et une énergie constante, me permettant de naviguer mes journées avec sérénité et présence.\",\n  \"identity\": \"Je suis l'Architecte de mon Calme Intérieur.\",\n  \"strategy\": \"Face à la surcharge et l'irritabilité, notre priorité est de désamorcer les déclencheurs immédiats et de reconstruire ta résilience nerveuse. Nous allons épurer l'environnement digital, organiser ta charge mentale et ancrer des rituels de rechargement profond.\",\n  \"goldenRules\": \"1. Le téléphone est un outil, pas une béquille émotionnelle.\\n2. Chaque pensée a sa place, mais pas toutes en même temps.\\n3. Priorité absolue à ma ressource énergie.\",\n  \"vitalSignal\": {\n    \"name\": \"Temps d'écran récréatif\",\n    \"type\": \"constat\",\n    \"unit\": \"min\",\n    \"startValue\": \"240\",\n    \"description\": \"Réduire progressivement le temps passé sur des applications non essentielles, en visant 30 minutes de moins chaque semaine.\",\n    \"targetValue\": \"60\",\n    \"tracking_type\": \"counter\"\n  },\n  \"grimoireTitle\": \"Le Protocole du Flux Imperturbable\",\n  \"context_problem\": \"Tu te sentais submergée par une charge mentale constante et une irritabilité qui te privait de ta stabilité. Tes journées irrégulières, associées à une fatigue sous-jacente, te poussaient à compenser par un usage excessif du téléphone, créant un cycle de surcharge et de perte de concentration.\",\n  \"sophiaKnowledge\": \"Tu es une femme dynamique de 32 ans, avec un niveau d'activité élevé, mais qui se sent souvent submergée et irritable par une charge mentale intense. Tes journées irrégulières génèrent de la fatigue que tu compenses par un usage accru du téléphone, perturbant ta stabilité et ton énergie quotidienne.\",\n  \"maintenanceCheck\": {\n    \"type\": \"surveillance\",\n    \"question\": \"Combien de fois cette semaine t'es-tu sentie submergée ou irritable sans pouvoir réagir calmement ?\",\n    \"frequency\": \"hebdomadaire\",\n    \"tracking_type\": \"counter\"\n  },\n  \"estimatedDuration\": \"4 semaines\"\n}\n=== ACTIONS / FRAMEWORKS (ÉTAT RÉEL DB) ===\nRÈGLES IMPORTANTES:\n- Les frameworks comptent comme des actions côté utilisateur.\n- \"active\" = activée et visible comme active dans l'app. \"pending\" = pas active.\n- On n'active/désactive pas via WhatsApp: la seule manière d'activer/désactiver, c'est depuis le dashboard.\n\nActives (3):\n- [ACTION] Le Couvre-feu Digital Inviolable (night)\n- [ACTION] L'Épuration des Notifications Toxiques (any_time)\n- [FRAMEWORK] La Vidange Cérébrale Quotidienne\n\n=== SIGNES VITAUX (État Actuel) ===\n- Sommeil: ? h\n",
      "template_fingerprint": "a85fb1072c09c031"
    },
    "scenario_target": "bilan"
  },
  "error": null
}