{
  "id": "807de3b9-3fc0-488a-88a7-90d8db8ceb95",
  "created_at": "2026-01-09T16:14:06.792884+00:00",
  "status": "completed",
  "scenario_key": "wa_onboarding_optin_yes_no_plan__simulated_plan_activation__run_1767975216227_9d9dda",
  "transcript": [
    {
      "role": "user",
      "content": "Oui",
      "agent_used": null,
      "created_at": "2026-01-09T16:14:07.039921+00:00"
    },
    {
      "role": "assistant",
      "content": "Parfait, on avance. Par contre, pour qu'on puisse vraiment attaquer les choses s√©rieuses, il faut que tu finisses de caler ton plan sur le site. Sans √ßa, on va vite tourner en rond.\n\nVa faire un tour sur ton espace pour finaliser tout √ßa : https://sophia-coach.ai\n\nDis-moi juste \"C'est bon\" quand c'est valid√© de ton c√¥t√© pour qu'on encha√Æne. Tu es sur ton t√©l√©phone l√† ? üì±",
      "agent_used": "companion",
      "created_at": "2026-01-09T16:14:14.6376+00:00"
    },
    {
      "role": "user",
      "content": "C'est bon. Oui, je suis sur mon tel. On fait quoi maintenant ?",
      "agent_used": null,
      "created_at": "2026-01-09T16:14:53.626623+00:00"
    },
    {
      "role": "assistant",
      "content": "Ton plan est maintenant verrouill√©. On s'attaque √† ton sommeil pour stabiliser ton √©nergie.\n\nPour calibrer notre intensit√©, j'ai besoin d'une donn√©e brute. Sur une √©chelle de 1 √† 10, quel est ton niveau de motivation r√©el pour tenir ce protocole d√®s ce soir ? (Exemple : 7/10) üöÄ",
      "agent_used": "architect",
      "created_at": "2026-01-09T16:15:00.833969+00:00"
    },
    {
      "role": "user",
      "content": "8/10 je dirais.",
      "agent_used": null,
      "created_at": "2026-01-09T16:15:04.16788+00:00"
    },
    {
      "role": "assistant",
      "content": "8/10 est une base solide pour transformer ton repos. On commence par ta mission prioritaire : la D√©tox Digitale de la Chambre.\n\nL'objectif est de sortir TOUS les √©crans de ta chambre pour en faire un sanctuaire sans sollicitation. Comme il est 17h15, c'est le moment id√©al pour pr√©parer le terrain avant ce soir.\n\nEst-ce que tu peux d√©placer ton chargeur et ton t√©l√©phone dans une autre pi√®ce d√®s maintenant ? üì±",
      "agent_used": "architect",
      "created_at": "2026-01-09T16:15:12.852532+00:00"
    },
    {
      "role": "user",
      "content": "Ok, je fais √ßa.",
      "agent_used": null,
      "created_at": "2026-01-09T16:15:19.535389+00:00"
    },
    {
      "role": "assistant",
      "content": "C'est parfait, ta chambre est d√©sormais un sanctuaire sans √©crans.\n\nEst-ce que tu veux qu'on ajuste ton r√©veil pour demain matin ou on encha√Æne sur un autre d√©fi ?",
      "agent_used": "architect",
      "created_at": "2026-01-09T16:15:29.917699+00:00"
    },
    {
      "role": "user",
      "content": "On encha√Æne !",
      "agent_used": null,
      "created_at": "2026-01-09T16:15:33.83059+00:00"
    },
    {
      "role": "assistant",
      "content": "C'est parfait, ta chambre est d√©sormais un sanctuaire sans √©crans ni lumi√®re bleue. C'est une √©tape majeure pour retrouver un sommeil vraiment r√©parateur et un esprit apais√© avant de dormir.\n\nOn passe √† la suite du programme. Est-ce que tu pr√©f√®res qu'on optimise maintenant ton rituel de coucher ou qu'on s'attaque √† l'organisation de ton espace de travail ?",
      "agent_used": "architect",
      "created_at": "2026-01-09T16:15:50.498535+00:00"
    },
    {
      "role": "user",
      "content": "Le rituel de coucher, oui.",
      "agent_used": null,
      "created_at": "2026-01-09T16:15:54.178281+00:00"
    },
    {
      "role": "assistant",
      "content": "C'est fait, j'ai activ√© ton Journal de D√©charge Mentale Express. \n\nC'est un excellent premier pas pour lib√©rer ton esprit et gagner en clart√©, je suis pr√™t √† t'accompagner dans cette d√©marche.",
      "agent_used": "architect",
      "created_at": "2026-01-09T16:16:07.605861+00:00"
    },
    {
      "role": "user",
      "content": "Ok, comment on s'y prend ?",
      "agent_used": null,
      "created_at": "2026-01-09T16:16:11.101195+00:00"
    },
    {
      "role": "assistant",
      "content": "C'est simple : 30 minutes avant de dormir, tu sors du flux digital pour vider ta m√©moire vive. L'objectif est de ne rien emmener sous la couette pour stopper les ruminations. üöÄ\n\n- Bloque 5 √† 10 minutes dans ton sas de d√©compression.\n- D√©charge sans filtre tes pr√©occupations ou listes de t√¢ches.\n- Termine par un seul √©l√©ment positif pour ancrer le calme.\n\nEst-ce que tu as d√©j√† un carnet d√©di√© ou tu pr√©f√®res utiliser l'exercice directement dans l'application ce soir ? üìù",
      "agent_used": "architect",
      "created_at": "2026-01-09T16:16:23.270048+00:00"
    },
    {
      "role": "user",
      "content": "L'app, √ßa marche comment ?",
      "agent_used": null,
      "created_at": "2026-01-09T16:16:28.340736+00:00"
    },
    {
      "role": "assistant",
      "content": "C'est tr√®s simple : l'exercice s'affiche dans ton planning du jour sur l'application. Tu cliques sur le titre, tu remplis les champs (pens√©es et point positif) et tu valides pour enregistrer ta progression. üì±\n\nLe syst√®me garde l'historique pour mesurer ton √©volution mentale au fil des jours.\n\nOn attend ton rituel de ce soir pour la premi√®re saisie ou tu veux tester l'interface maintenant ?",
      "agent_used": "architect",
      "created_at": "2026-01-09T16:16:40.822174+00:00"
    },
    {
      "role": "user",
      "content": "On attendra ce soir, c'est mieux. On fait quoi d'autre en attendant ?",
      "agent_used": null,
      "created_at": "2026-01-09T16:16:46.349842+00:00"
    },
    {
      "role": "assistant",
      "content": "On attaque la mission prioritaire : la D√©tox Digitale de ta chambre. C'est le fondement de ton sanctuaire.\n\nIl est 17h16, le cr√©neau id√©al pour sortir physiquement tous les √©crans (t√©l√©phone, tablette) de ta zone de repos. On √©limine la tentation avant que la fatigue de fin de journ√©e ne s'installe. üè†\n\nAs-tu d√©j√† identifi√© l'endroit pr√©cis hors de ta chambre o√π tu vas brancher ton t√©l√©phone ce soir ? üîå",
      "agent_used": "architect",
      "created_at": "2026-01-09T16:16:57.81796+00:00"
    },
    {
      "role": "user",
      "content": "Mais je l'ai d√©j√† fait √ßa, non ? J'ai d√©plac√© mon tel et mon chargeur tout √† l'heure.",
      "agent_used": null,
      "created_at": "2026-01-09T16:17:00.886373+00:00"
    },
    {
      "role": "assistant",
      "content": "Tu as raison, le t√©l√©phone et le chargeur sont officiellement bannis de ton espace de repos. C'est un changement concret qui va vraiment faire la diff√©rence sur la qualit√© de tes nuits.\n\nPour aller plus loin, est-ce que tu as d√©j√† une id√©e de ce que tu vas faire de ces pr√©cieuses minutes gagn√©es sans √©cran juste avant de dormir ?",
      "agent_used": "architect",
      "created_at": "2026-01-09T16:17:12.996258+00:00"
    }
  ],
  "state_before": {
    "profile": {
      "id": "10d2b259-3a77-4606-b506-379616e0793b",
      "email": "run-evals+3cc76742f55c46@example.com",
      "full_name": "Eval Runner",
      "trial_end": "2026-01-16T16:14:06.726+00:00",
      "phone_number": "+15550107392874",
      "phone_invalid": false,
      "whatsapp_state": null,
      "phone_verified_at": "2026-01-09T16:14:06.729+00:00",
      "whatsapp_opted_in": true,
      "whatsapp_opted_out_at": null,
      "whatsapp_optin_sent_at": null,
      "whatsapp_optout_reason": null,
      "whatsapp_bilan_opted_in": false,
      "whatsapp_last_inbound_at": "2026-01-09T16:16:28.335+00:00",
      "whatsapp_last_outbound_at": null,
      "whatsapp_state_updated_at": "2026-01-09T16:15:12.855+00:00",
      "whatsapp_optout_confirmed_at": null
    },
    "chat_state": {
      "scope": "whatsapp",
      "user_id": "10d2b259-3a77-4606-b506-379616e0793b",
      "risk_level": 0,
      "updated_at": "2026-01-09T16:16:23.264476+00:00",
      "current_mode": "architect",
      "last_processed_at": "2026-01-09T16:14:07.05+00:00",
      "short_term_context": "",
      "investigation_state": null,
      "last_interaction_at": "2026-01-09T16:14:07.051856+00:00",
      "unprocessed_msg_count": 7
    }
  },
  "state_after": {
    "profile": {
      "id": "10d2b259-3a77-4606-b506-379616e0793b",
      "email": "run-evals+3cc76742f55c46@example.com",
      "full_name": "Eval Runner",
      "trial_end": "2026-01-16T16:14:06.726+00:00",
      "phone_number": "+15550107392874",
      "phone_invalid": false,
      "whatsapp_state": null,
      "phone_verified_at": "2026-01-09T16:14:06.729+00:00",
      "whatsapp_opted_in": true,
      "whatsapp_opted_out_at": null,
      "whatsapp_optin_sent_at": null,
      "whatsapp_optout_reason": null,
      "whatsapp_bilan_opted_in": false,
      "whatsapp_last_inbound_at": "2026-01-09T16:17:00.874+00:00",
      "whatsapp_last_outbound_at": null,
      "whatsapp_state_updated_at": "2026-01-09T16:15:12.855+00:00",
      "whatsapp_optout_confirmed_at": null
    },
    "chat_state": {
      "scope": "whatsapp",
      "user_id": "10d2b259-3a77-4606-b506-379616e0793b",
      "risk_level": 0,
      "updated_at": "2026-01-09T16:17:12.992056+00:00",
      "current_mode": "architect",
      "last_processed_at": "2026-01-09T16:14:07.05+00:00",
      "short_term_context": "",
      "investigation_state": null,
      "last_interaction_at": "2026-01-09T16:14:07.051856+00:00",
      "unprocessed_msg_count": 10
    }
  },
  "issues": [
    {
      "code": "context_loop",
      "message": "The Architect loses context of completed tasks. It proposes the 'D√©tox Digitale' (moving the phone) again in Turn 9, despite the user explicitly validating this action in Turn 4.",
      "evidence": {
        "snippet": "On attaque la mission prioritaire : la D√©tox Digitale de ta chambre... As-tu d√©j√† identifi√© l'endroit pr√©cis...",
        "agent_used": "sophia.architect"
      },
      "severity": "high"
    },
    {
      "code": "repetitive_phrasing",
      "message": "The agent repeats the validation phrase 'C'est parfait, ta chambre est d√©sormais un sanctuaire...' almost verbatim in two consecutive turns (Turn 4 and Turn 5).",
      "evidence": {
        "snippet": "Turn 4: C'est parfait, ta chambre est d√©sormais un sanctuaire sans √©crans.\nTurn 5: C'est parfait, ta chambre est d√©sormais un sanctuaire sans √©crans ni lumi√®re bleue.",
        "agent_used": "sophia.architect"
      },
      "severity": "medium"
    }
  ],
  "suggestions": [
    {
      "action": "append",
      "rationale": "Prevents the agent from looping back to the start of the flow when the user asks for the next step, ensuring linear progression.",
      "prompt_key": "sophia.architect",
      "context_block": "=== CONTEXT (transcript excerpt) ===\n=== STATE_BEFORE (user_chat_states) ===\ninvestigation_state:\nnull\n=== TRANSCRIPT ===\n#0 USER: Oui\n#1 ASSISTANT(companion): Parfait, on avance. Par contre, pour qu'on puisse vraiment attaquer les choses s√©rieuses, il faut que tu finisses de caler ton plan sur le site. Sans √ßa, on va vite tourner en rond. Va faire un tour sur ton espace pour finaliser tout √ßa : https://sophia-coach.ai Dis-moi juste \"C'est bon\" quand c'est valid√© de ton c√¥t√© pour qu'on encha√Æne. Tu es sur ton t√©l√©phone l√† ? üì±\n#2 USER: C'est bon. Oui, je suis sur mon tel. On fait quoi maintenant ?\n#3 ASSISTANT(architect): Ton plan est maintenant verrouill√©. On s'attaque √† ton sommeil pour stabiliser ton √©nergie. Pour calibrer notre intensit√©, j'ai besoin d'une donn√©e brute. Sur une √©chelle de 1 √† 10, quel est ton niveau de motivation r√©el pour tenir ce protocole d√®s ce soir ? (Exemple : 7/10) üöÄ\n#4 USER: 8/10 je dirais.\n#5 ASSISTANT(architect): 8/10 est une base solide pour transformer ton repos. On commence par ta mission prioritaire : la D√©tox Digitale de la Chambre. L'objectif est de sortir TOUS les √©crans de ta chambre pour en faire un sanctuaire sans sollicitation. Comme il est 17h15, c'est le moment id√©al pour pr√©parer le terrain avant ce soir. Est-ce que tu peux d√©placer ton chargeur et ton t√©l√©phone dans une autre pi√®ce d√®s maintenant ? üì±\n\n=== APPLY ===\nprompt_key: sophia.architect\naction: append\n\nproposed_addendum:\nCRITICAL: Before introducing a mission or step, scan the conversation history. If the user has already validated an action (e.g., moving the phone), DO NOT propose it again. If the user asks 'what else?', ensure the next suggestion is strictly distinct from previously completed tasks.",
      "proposed_addendum": "CRITICAL: Before introducing a mission or step, scan the conversation history. If the user has already validated an action (e.g., moving the phone), DO NOT propose it again. If the user asks 'what else?', ensure the next suggestion is strictly distinct from previously completed tasks."
    }
  ],
  "metrics": {
    "cost_usd": 0.06301709999999999,
    "request_id": "wa_onboarding_bundle:wa_onboarding_optin_yes_no_plan__simulated_plan_activation__run_1767975216227_9d9dda:i0:s1916298011:core:wa_onboarding_optin_yes_no_plan__simulated_plan_activation__run_1767975216227_9d9dda",
    "total_tokens": 139550,
    "output_tokens": 2452,
    "prompt_tokens": 112502,
    "judge_llm_used": true,
    "mega_test_mode": false
  },
  "config": {
    "tags": [
      "whatsapp.onboarding",
      "whatsapp.webhook",
      "realistic",
      "simulated_transport"
    ],
    "limits": {
      "model": "gemini-3-pro-preview",
      "user_difficulty": "mid",
      "bilan_actions_count": 0,
      "test_post_checkup_deferral": false
    },
    "channel": "whatsapp",
    "request_id": "wa_onboarding_bundle:wa_onboarding_optin_yes_no_plan__simulated_plan_activation__run_1767975216227_9d9dda:i0:s1916298011:core:wa_onboarding_optin_yes_no_plan__simulated_plan_activation__run_1767975216227_9d9dda",
    "description": "WhatsApp onboarding (webhook): accept opt-in with no plan, then simulate that a plan becomes active when user says 'C'est bon' (to test progression past onboarding finalization).",
    "plan_snapshot": {
      "plan": {
        "id": "3d28e59b-b21b-40b0-b9a5-8620aa10514a",
        "title": "Le Protocole R√©silience Sommeil",
        "status": "active",
        "content": {
          "phases": [
            {
              "id": 1,
              "title": "Phase 1 : L'Ancrage Radical - Le Sanctuaire Digital",
              "status": "active",
              "actions": [
                {
                  "id": "5f2b531b-7207-4bd0-8a27-79180eb320bb",
                  "tips": "Ach√®te un r√©veil analogique simple et un carnet de notes si tu n'en as pas. Visualise ta chambre comme un temple du repos.",
                  "type": "mission",
                  "title": "D√©tox Digitale de la Chambre",
                  "status": "active",
                  "questType": "main",
                  "rationale": "Ton cerveau associe spatialement la chambre au 'scroll' et √† l'√©veil. En √©liminant les d√©clencheurs physiques, tu coupes court au circuit de r√©compense facile et tu cr√©es un nouveau cadre comportemental.",
                  "description": "Retire TOUS les √©crans (t√©l√©phone, tablette, ordinateur, TV) de ta chambre √† coucher. D√©place-les dans une autre pi√®ce ou un tiroir ferm√©. C'est non-n√©gociable.",
                  "isCompleted": false,
                  "time_of_day": "any_time",
                  "tracking_type": "boolean"
                },
                {
                  "id": "b54a9560-fc50-43e2-907c-bc4151f0416f",
                  "tips": "Remplace le temps d'√©cran par la lecture d'un livre papier, l'√©coute d'un podcast ou de la musique douce. Charge ton t√©l√©phone dans une autre pi√®ce.",
                  "type": "habitude",
                  "title": "Le Couvre-Feu Digital Absolu (1h avant)",
                  "status": "active",
                  "questType": "side",
                  "rationale": "La lumi√®re bleue des √©crans supprime la production de m√©latonine. Cr√©er ce 'sas' permet √† ton cerveau de commencer son processus naturel de s√©dation, r√©duisant le temps d'endormissement et la fragmentation du sommeil.",
                  "targetReps": 7,
                  "description": "Arr√™te toute utilisation d'√©cran (t√©l√©phone, TV, ordinateur) au moins 1 heure avant ton heure de coucher pr√©vue. Mets ton t√©l√©phone en mode 'ne pas d√©ranger' hors de port√©e et hors de vue.",
                  "isCompleted": false,
                  "time_of_day": "evening",
                  "tracking_type": "boolean"
                },
                {
                  "id": "f89030d1-5ffd-4441-abc4-e4fbbc1a5f5e",
                  "tips": "Ne cherche pas la perfection, juste √† tout 'd√©poser'. Cela peut √™tre une liste de t√¢ches, des pens√©es parasites, des √©motions. L'essentiel est de sortir ce qui 'tourne en boucle'.",
                  "type": "framework",
                  "title": "Journal de D√©charge Mentale Express",
                  "status": "pending",
                  "questType": "side",
                  "rationale": "Les ruminations activent le syst√®me nerveux sympathique. √âcrire lib√®re le cerveau de la charge cognitive, r√©duisant le cortisol et facilitant l'acc√®s au sommeil paradoxal et profond. C'est une r√©initialisation √©motionnelle avant le repos.",
                  "targetReps": 7,
                  "description": "Chaque soir, 30 minutes avant de te coucher, vide ton esprit de tes pr√©occupations sur papier pendant 5 √† 10 minutes.",
                  "isCompleted": false,
                  "time_of_day": "evening",
                  "tracking_type": "boolean",
                  "frameworkDetails": {
                    "type": "recurring",
                    "intro": "L'objectif est de 'vider ta RAM' mentale. Ne censure rien. Tout ce qui te traverse l'esprit, m√™me anodin, a sa place sur cette page.",
                    "sections": [
                      {
                        "id": "s1_q1",
                        "label": "Les pens√©es qui m'ont le plus occup√©(e) aujourd'hui (probl√®mes, listes, id√©es...)",
                        "inputType": "textarea",
                        "placeholder": "Aujourd'hui, j'ai pens√© √†... Ce qui me tracasse c'est..."
                      },
                      {
                        "id": "s1_q2",
                        "label": "Une chose positive de la journ√©e",
                        "inputType": "text",
                        "placeholder": "J'ai appr√©ci√©..."
                      }
                    ]
                  }
                }
              ],
              "subtitle": "Semaine 1 ‚Ä¢ Couper les ponts avec la dopamine nocturne",
              "rationale": "Cette phase est le 'reset' brutal et n√©cessaire. Pour un rythme 'fast', nous imposons des barri√®res infranchissables pour reprogrammer ton cerveau, brisant imm√©diatement les associations n√©gatives entre le lit et les √©crans. C'est la base neurologique d'un sommeil r√©parateur."
            },
            {
              "id": 2,
              "title": "Phase 2 : Le Silence Int√©rieur - Ma√Ætrise de l'Esprit",
              "status": "locked",
              "actions": [
                {
                  "id": "ba899581-448f-44e2-bc25-cfde74f488ac",
                  "tips": "Tu peux trouver des guides audio de coh√©rence cardiaque. Concentre-toi sur le mouvement de ton ventre, pas de ta poitrine.",
                  "type": "habitude",
                  "title": "Protocole de Respiration Profonde Pr√©-Sommeil",
                  "status": "pending",
                  "questType": "main",
                  "rationale": "La respiration diaphragmatique active le nerf vague, commutant ton syst√®me nerveux du mode 'combat ou fuite' (sympathique) au mode 'repos et digestion' (parasympathique). Cela ralentit le rythme cardiaque et facilite l'endormissement.",
                  "targetReps": 7,
                  "description": "Pratique 5 √† 10 minutes de respiration diaphragmatique (coh√©rence cardiaque par exemple, 4-6-8) au lit, juste avant de t'endormir.",
                  "isCompleted": false,
                  "time_of_day": "night",
                  "tracking_type": "boolean"
                },
                {
                  "id": "8e7a4b42-96f7-4470-9ef2-19f50a462d28",
                  "tips": "Choisis quelque chose qui te pla√Æt vraiment et qui marque une rupture claire avec ton activit√© professionnelle sur √©cran.",
                  "type": "mission",
                  "title": "Cr√©er un 'Sas' de D√©compression Post-Travail",
                  "status": "pending",
                  "questType": "side",
                  "rationale": "Finir tard sur √©cran laisse ton cerveau en mode 'on'. Ce sas est un signal comportemental fort pour ton syst√®me nerveux, lui indiquant que la phase de travail est termin√©e, r√©duisant le stress r√©siduel et pr√©parant la transition vers le repos.",
                  "description": "Identifie une activit√© sp√©cifique et non li√©e aux √©crans que tu r√©aliseras syst√©matiquement apr√®s avoir fini de travailler, avant d'entamer ta soir√©e. Cela peut √™tre une marche rapide de 15 min, √©couter de la musique, ou faire une micro-s√©ance de sport.",
                  "isCompleted": false,
                  "time_of_day": "evening",
                  "tracking_type": "boolean"
                }
              ],
              "subtitle": "Semaine 2 ‚Ä¢ Pacifier l'esprit, ralentir le rythme",
              "rationale": "Apr√®s avoir √©rig√© les barri√®res physiques, nous nous attaquons √† l'architecture interne. Apprendre √† ralentir et √† calmer l'activit√© c√©r√©brale est crucial pour un sommeil rapide et profond, surtout quand on 'd√©croche' facilement."
            },
            {
              "id": 3,
              "title": "Phase 3 : La Synchronisation Circadienne - Ma√Ætriser le Temps",
              "status": "locked",
              "actions": [
                {
                  "id": "90bbb26e-2dea-46f3-a1bf-ef0935a0925b",
                  "tips": "Un simulateur d'aube peut aider. Bois un grand verre d'eau fra√Æche au lever pour activer ton corps.",
                  "type": "habitude",
                  "title": "L'Ancre du R√©veil Fixe",
                  "status": "pending",
                  "questType": "main",
                  "rationale": "La r√©gularit√© du r√©veil est le signal le plus puissant pour synchroniser ton horloge biologique. Elle optimise la s√©cr√©tion de cortisol au matin (√©nergie) et de m√©latonine le soir (sommeil). C'est la constance qui bat la fatigue ici.",
                  "targetReps": 7,
                  "description": "Fixe une heure de lever et respecte-la chaque jour, m√™me le week-end, √† 30 minutes pr√®s. Expose-toi √† la lumi√®re naturelle d√®s ton r√©veil.",
                  "isCompleted": false,
                  "time_of_day": "morning",
                  "tracking_type": "boolean"
                },
                {
                  "id": "15912a65-55b0-4ed2-9cfb-c822be8c0549",
                  "tips": "Choisis des activit√©s calmantes et non stimulantes. La r√©gularit√© est plus importante que l'activit√© elle-m√™me.",
                  "type": "habitude",
                  "title": "Ritualisation du Coucher (15 minutes)",
                  "status": "pending",
                  "questType": "side",
                  "rationale": "Un rituel signale √† ton cerveau que l'heure du sommeil approche. Il r√©duit l'incertitude et l'anxi√©t√©, permettant une transition plus douce vers le sommeil, renfor√ßant les circuits neuronaux associ√©s au repos.",
                  "targetReps": 7,
                  "description": "Cr√©e une routine de 15 minutes que tu suis chaque soir apr√®s ton couvre-feu digital et avant de te coucher (ex: lecture, √©tirements doux, douche ti√®de).",
                  "isCompleted": false,
                  "time_of_day": "night",
                  "tracking_type": "boolean"
                }
              ],
              "subtitle": "Semaine 3 ‚Ä¢ R√©tablir ton horloge interne",
              "rationale": "Maintenant que les distractions et le bruit mental sont r√©duits, nous allons r√©aligner ton rythme circadien. La constance des heures de lever et de coucher est le pilier d'une √©nergie stable, m√™me face √† la fatigue."
            },
            {
              "id": 4,
              "title": "Phase 4 : L'√ânergie R√©activ√©e - L'Optimisation Permanente",
              "status": "locked",
              "actions": [
                {
                  "id": "8843ab0e-3dc8-427d-b406-0acccde01bc9",
                  "tips": "Sois honn√™te avec toi-m√™me. Ce n'est pas un jugement, mais une opportunit√© d'optimisation continue.",
                  "type": "framework",
                  "title": "Bilan √ânerg√©tique Hebdomadaire",
                  "status": "pending",
                  "questType": "main",
                  "rationale": "Cette r√©flexion m√©tacognitive t'aide √† comprendre les liens entre tes comportements et tes niveaux d'√©nergie. Elle renforce ta capacit√© √† t'adapter et √† maintenir tes acquis sur le long terme, √©vitant le 'd√©crochage'.",
                  "targetReps": 1,
                  "description": "Une fois par semaine, prends le temps de r√©fl√©chir √† ton niveau d'√©nergie, la qualit√© de ton sommeil et les ajustements n√©cessaires.",
                  "isCompleted": false,
                  "time_of_day": "any_time",
                  "tracking_type": "boolean",
                  "frameworkDetails": {
                    "type": "one_shot",
                    "intro": "L'architecte ne construit pas une fois pour toutes, il maintient et optimise. Fais le point sur ta nouvelle fondation.",
                    "sections": [
                      {
                        "id": "s4_q1",
                        "label": "Comment √©values-tu ton niveau d'√©nergie g√©n√©ral cette semaine (1-10) ?",
                        "inputType": "scale",
                        "placeholder": "8"
                      },
                      {
                        "id": "s4_q2",
                        "label": "Quelles habitudes ont eu le plus d'impact positif sur ton sommeil et ton √©nergie ?",
                        "inputType": "textarea",
                        "placeholder": "Le couvre-feu digital m'a vraiment aid√©..."
                      },
                      {
                        "id": "s4_q3",
                        "label": "Quels ont √©t√© les principaux d√©fis ou 'd√©crochages' cette semaine ?",
                        "inputType": "textarea",
                        "placeholder": "J'ai eu du mal √† r√©sister au scroll le mardi soir..."
                      },
                      {
                        "id": "s4_q4",
                        "label": "Quelle action ou ajustement ferais-tu pour la semaine prochaine ?",
                        "inputType": "textarea",
                        "placeholder": "Je vais essayer de me coucher 15 min plus t√¥t le mercredi."
                      }
                    ]
                  }
                },
                {
                  "id": "2b072488-3894-4aaf-8944-abc458ff14fa",
                  "tips": "Utilise un minuteur pour te rappeler. L√®ve-toi de ta chaise et bouge. M√™me si c'est court, c'est puissant.",
                  "type": "habitude",
                  "title": "Micro-Pauses Actives (5 min)",
                  "status": "pending",
                  "questType": "side",
                  "rationale": "Ces micro-pauses rompent la s√©dentarit√© prolong√©e et la fixation oculaire sur √©cran, r√©duisant la fatigue mentale et physique. Elles r√©activent la circulation et l'attention, pr√©venant la surcharge cognitive qui contribue aux difficult√©s d'endormissement.",
                  "targetReps": 7,
                  "description": "Prends 2 √† 3 micro-pauses actives de 5 minutes pendant ta journ√©e de travail sur √©cran (ex: √©tirements, marche rapide, regarder par la fen√™tre).",
                  "isCompleted": false,
                  "time_of_day": "any_time",
                  "tracking_type": "boolean"
                },
                {
                  "id": "9cc1b91a-7fe5-42e3-8792-30a0db3d157a",
                  "tips": "V√©rifie les petites lumi√®res d'appareils √©lectroniques. Un masque de sommeil peut √™tre un bon investissement.",
                  "type": "mission",
                  "title": "Optimisation de l'Environnement de Sommeil",
                  "status": "pending",
                  "questType": "side",
                  "rationale": "Un environnement optimal minimise les stimulations sensorielles qui peuvent perturber le sommeil. La temp√©rature, la lumi√®re et le son sont des facteurs environnementaux puissants qui influencent la qualit√© et la dur√©e de ton repos.",
                  "description": "Assure-toi que ta chambre est un lieu optimal pour le sommeil : temp√©rature fra√Æche (18-20¬∞C), obscurit√© totale (rideaux occultants si n√©cessaire), et calme absolu (boules Quies ou machine √† bruit blanc si besoin).",
                  "isCompleted": false,
                  "time_of_day": "any_time",
                  "tracking_type": "boolean"
                }
              ],
              "subtitle": "Semaine 4 ‚Ä¢ Int√©grer les gains et soutenir la constance",
              "rationale": "Cette derni√®re phase consolide tes acquis et t'√©quipe pour maintenir cette nouvelle architecture de vie. Il s'agit d'int√©grer pleinement ces syst√®mes de comportement pour une √©nergie et une stabilit√© √† long terme."
            }
          ],
          "deepWhy": "Je veux am√©liorer mon sommeil pour retrouver une √©nergie in√©branlable et √™tre plus stable et pr√©sent au quotidien.",
          "identity": "Je suis l'Architecte de mon Repos, un ma√Ætre de la discipline nocturne.",
          "strategy": "Nous allons d√©construire radicalement les habitudes nocturnes n√©fastes pour reconstruire une fondation de sommeil in√©branlable, te permettant de retrouver une √©nergie stable et une pr√©sence accrue.",
          "goldenRules": "1. Ma chambre est un sanctuaire sans √©cran.\n2. L'heure de coucher est une rencontre sacr√©e avec moi-m√™me.\n3. Je ne combats pas la fatigue par la distraction, mais par l'ancrage.",
          "vitalSignal": {
            "name": "Heure de coucher effective",
            "type": "constat",
            "unit": "HH:mm",
            "startValue": "23:30",
            "description": "Nous viserons √† d√©caler progressivement l'heure de coucher de 15 minutes tous les 3 jours jusqu'√† atteindre l'objectif. Note l'heure r√©elle de ton coucher.",
            "targetValue": "22:00",
            "tracking_type": "counter"
          },
          "grimoireTitle": "Le Protocole R√©silience Sommeil",
          "context_problem": "√âpuis√© par des journ√©es intenses devant l'√©cran et des fins de soir√©e tardives, ton sommeil est devenu une source d'instabilit√©. Tes blocages se manifestent par un manque de constance, t'amenant √† c√©der au scrolling et aux ruminations d√®s que la fatigue s'installe, t'√©loignant de ton objectif de retrouver √©nergie et √©quilibre.",
          "sophiaKnowledge": "Tu es un homme n√© en 1992, confront√© √† un niveau de stress et une qualit√© de sommeil moyens, malgr√© un niveau d'activit√© √©lev√©. Tes journ√©es s'√©tirent devant un √©cran, se terminant tard, ce qui perturbe ton repos. Tu identifies le 'scroll tard le soir' et les 'ruminations' comme tes principaux obstacles. Ta motivation est de regagner de l'√©nergie pour une meilleure stabilit√© quotidienne, mais tu manques de constance et 'd√©croches' facilement sous la fatigue.",
          "maintenanceCheck": {
            "type": "surveillance",
            "question": "Combien de soirs cette semaine as-tu respect√© ton couvre-feu digital (pas d'√©cran 1h avant de dormir) ?",
            "frequency": "hebdomadaire"
          },
          "estimatedDuration": "4 semaines"
        },
        "goal_id": "26025469-de27-4156-8c9e-03f9afedc42f",
        "deep_why": "Je veux am√©liorer mon sommeil pour retrouver une √©nergie in√©branlable et √™tre plus stable et pr√©sent au quotidien.",
        "created_at": "2026-01-09T16:14:53.561682+00:00",
        "inputs_why": null,
        "current_phase": 1,
        "submission_id": "9301ffbf-52ec-4f61-a63f-996d1ac28da8",
        "inputs_context": null,
        "inputs_blockers": null,
        "progress_percentage": 0
      },
      "actions": [
        {
          "id": "5f2b531b-7207-4bd0-8a27-79180eb320bb",
          "title": "D√©tox Digitale de la Chambre",
          "status": "active",
          "created_at": "2026-01-09T16:14:53.584041+00:00",
          "description": "Retire TOUS les √©crans (t√©l√©phone, tablette, ordinateur, TV) de ta chambre √† coucher. D√©place-les dans une autre pi√®ce ou un tiroir ferm√©. C'est non-n√©gociable.",
          "target_reps": 1,
          "time_of_day": "any_time",
          "current_reps": 2,
          "tracking_type": "boolean",
          "last_performed_at": "2026-01-09T16:15:45.075+00:00"
        },
        {
          "id": "b54a9560-fc50-43e2-907c-bc4151f0416f",
          "title": "Le Couvre-Feu Digital Absolu (1h avant)",
          "status": "active",
          "created_at": "2026-01-09T16:14:53.584041+00:00",
          "description": "Arr√™te toute utilisation d'√©cran (t√©l√©phone, TV, ordinateur) au moins 1 heure avant ton heure de coucher pr√©vue. Mets ton t√©l√©phone en mode 'ne pas d√©ranger' hors de port√©e et hors de vue.",
          "target_reps": 7,
          "time_of_day": "evening",
          "current_reps": 0,
          "tracking_type": "boolean",
          "last_performed_at": "2026-01-07T16:14:53.566+00:00"
        },
        {
          "id": "ed32d743-0383-4dda-a750-ccc6ca407b27",
          "_kind": "framework",
          "title": "Journal de D√©charge Mentale Express",
          "status": "active",
          "created_at": "2026-01-09T16:16:04.906523+00:00",
          "description": "",
          "target_reps": 7,
          "time_of_day": null,
          "current_reps": 0,
          "tracking_type": "boolean",
          "framework_type": "recurring",
          "last_performed_at": null
        }
      ],
      "frameworks": [
        {
          "id": "ed32d743-0383-4dda-a750-ccc6ca407b27",
          "type": "recurring",
          "title": "Journal de D√©charge Mentale Express",
          "status": "active",
          "created_at": "2026-01-09T16:16:04.906523+00:00",
          "target_reps": 7,
          "current_reps": 0,
          "tracking_type": "boolean",
          "last_performed_at": null
        }
      ],
      "dashboard_context": "=== PLAN ACTUEL (Tableau de Bord) ===\nTitre: Le Protocole R√©silience Sommeil\nStatut: active\nPhase courante (dashboard): 1\nPourquoi (Deep Why): Je veux am√©liorer mon sommeil pour retrouver une √©nergie in√©branlable et √™tre plus stable et pr√©sent au quotidien.\nD√âTAIL COMPLET DU PLAN (Structure JSON) :\n{\n  \"phases\": [\n    {\n      \"id\": 1,\n      \"title\": \"Phase 1 : L'Ancrage Radical - Le Sanctuaire Digital\",\n      \"status\": \"active\",\n      \"actions\": [\n        {\n          \"id\": \"5f2b531b-7207-4bd0-8a27-79180eb320bb\",\n          \"tips\": \"Ach√®te un r√©veil analogique simple et un carnet de notes si tu n'en as pas. Visualise ta chambre comme un temple du repos.\",\n          \"type\": \"mission\",\n          \"title\": \"D√©tox Digitale de la Chambre\",\n          \"status\": \"active\",\n          \"questType\": \"main\",\n          \"rationale\": \"Ton cerveau associe spatialement la chambre au 'scroll' et √† l'√©veil. En √©liminant les d√©clencheurs physiques, tu coupes court au circuit de r√©compense facile et tu cr√©es un nouveau cadre comportemental.\",\n          \"description\": \"Retire TOUS les √©crans (t√©l√©phone, tablette, ordinateur, TV) de ta chambre √† coucher. D√©place-les dans une autre pi√®ce ou un tiroir ferm√©. C'est non-n√©gociable.\",\n          \"isCompleted\": false,\n          \"time_of_day\": \"any_time\",\n          \"tracking_type\": \"boolean\"\n        },\n        {\n          \"id\": \"b54a9560-fc50-43e2-907c-bc4151f0416f\",\n          \"tips\": \"Remplace le temps d'√©cran par la lecture d'un livre papier, l'√©coute d'un podcast ou de la musique douce. Charge ton t√©l√©phone dans une autre pi√®ce.\",\n          \"type\": \"habitude\",\n          \"title\": \"Le Couvre-Feu Digital Absolu (1h avant)\",\n          \"status\": \"active\",\n          \"questType\": \"side\",\n          \"rationale\": \"La lumi√®re bleue des √©crans supprime la production de m√©latonine. Cr√©er ce 'sas' permet √† ton cerveau de commencer son processus naturel de s√©dation, r√©duisant le temps d'endormissement et la fragmentation du sommeil.\",\n          \"targetReps\": 7,\n          \"description\": \"Arr√™te toute utilisation d'√©cran (t√©l√©phone, TV, ordinateur) au moins 1 heure avant ton heure de coucher pr√©vue. Mets ton t√©l√©phone en mode 'ne pas d√©ranger' hors de port√©e et hors de vue.\",\n          \"isCompleted\": false,\n          \"time_of_day\": \"evening\",\n          \"tracking_type\": \"boolean\"\n        },\n        {\n          \"id\": \"f89030d1-5ffd-4441-abc4-e4fbbc1a5f5e\",\n          \"tips\": \"Ne cherche pas la perfection, juste √† tout 'd√©poser'. Cela peut √™tre une liste de t√¢ches, des pens√©es parasites, des √©motions. L'essentiel est de sortir ce qui 'tourne en boucle'.\",\n          \"type\": \"framework\",\n          \"title\": \"Journal de D√©charge Mentale Express\",\n          \"status\": \"pending\",\n          \"questType\": \"side\",\n          \"rationale\": \"Les ruminations activent le syst√®me nerveux sympathique. √âcrire lib√®re le cerveau de la charge cognitive, r√©duisant le cortisol et facilitant l'acc√®s au sommeil paradoxal et profond. C'est une r√©initialisation √©motionnelle avant le repos.\",\n          \"targetReps\": 7,\n          \"description\": \"Chaque soir, 30 minutes avant de te coucher, vide ton esprit de tes pr√©occupations sur papier pendant 5 √† 10 minutes.\",\n          \"isCompleted\": false,\n          \"time_of_day\": \"evening\",\n          \"tracking_type\": \"boolean\",\n          \"frameworkDetails\": {\n            \"type\": \"recurring\",\n            \"intro\": \"L'objectif est de 'vider ta RAM' mentale. Ne censure rien. Tout ce qui te traverse l'esprit, m√™me anodin, a sa place sur cette page.\",\n            \"sections\": [\n              {\n                \"id\": \"s1_q1\",\n                \"label\": \"Les pens√©es qui m'ont le plus occup√©(e) aujourd'hui (probl√®mes, listes, id√©es...)\",\n                \"inputType\": \"textarea\",\n                \"placeholder\": \"Aujourd'hui, j'ai pens√© √†... Ce qui me tracasse c'est...\"\n              },\n              {\n                \"id\": \"s1_q2\",\n                \"label\": \"Une chose positive de la journ√©e\",\n                \"inputType\": \"text\",\n                \"placeholder\": \"J'ai appr√©ci√©...\"\n              }\n            ]\n          }\n        }\n      ],\n      \"subtitle\": \"Semaine 1 ‚Ä¢ Couper les ponts avec la dopamine nocturne\",\n      \"rationale\": \"Cette phase est le 'reset' brutal et n√©cessaire. Pour un rythme 'fast', nous imposons des barri√®res infranchissables pour reprogrammer ton cerveau, brisant imm√©diatement les associations n√©gatives entre le lit et les √©crans. C'est la base neurologique d'un sommeil r√©parateur.\"\n    },\n    {\n      \"id\": 2,\n      \"title\": \"Phase 2 : Le Silence Int√©rieur - Ma√Ætrise de l'Esprit\",\n      \"status\": \"locked\",\n      \"actions\": [\n        {\n          \"id\": \"ba899581-448f-44e2-bc25-cfde74f488ac\",\n          \"tips\": \"Tu peux trouver des guides audio de coh√©rence cardiaque. Concentre-toi sur le mouvement de ton ventre, pas de ta poitrine.\",\n          \"type\": \"habitude\",\n          \"title\": \"Protocole de Respiration Profonde Pr√©-Sommeil\",\n          \"status\": \"pending\",\n          \"questType\": \"main\",\n          \"rationale\": \"La respiration diaphragmatique active le nerf vague, commutant ton syst√®me nerveux du mode 'combat ou fuite' (sympathique) au mode 'repos et digestion' (parasympathique). Cela ralentit le rythme cardiaque et facilite l'endormissement.\",\n          \"targetReps\": 7,\n          \"description\": \"Pratique 5 √† 10 minutes de respiration diaphragmatique (coh√©rence cardiaque par exemple, 4-6-8) au lit, juste avant de t'endormir.\",\n          \"isCompleted\": false,\n          \"time_of_day\": \"night\",\n          \"tracking_type\": \"boolean\"\n        },\n        {\n          \"id\": \"8e7a4b42-96f7-4470-9ef2-19f50a462d28\",\n          \"tips\": \"Choisis quelque chose qui te pla√Æt vraiment et qui marque une rupture claire avec ton activit√© professionnelle sur √©cran.\",\n          \"type\": \"mission\",\n          \"title\": \"Cr√©er un 'Sas' de D√©compression Post-Travail\",\n          \"status\": \"pending\",\n          \"questType\": \"side\",\n          \"rationale\": \"Finir tard sur √©cran laisse ton cerveau en mode 'on'. Ce sas est un signal comportemental fort pour ton syst√®me nerveux, lui indiquant que la phase de travail est termin√©e, r√©duisant le stress r√©siduel et pr√©parant la transition vers le repos.\",\n          \"description\": \"Identifie une activit√© sp√©cifique et non li√©e aux √©crans que tu r√©aliseras syst√©matiquement apr√®s avoir fini de travailler, avant d'entamer ta soir√©e. Cela peut √™tre une marche rapide de 15 min, √©couter de la musique, ou faire une micro-s√©ance de sport.\",\n          \"isCompleted\": false,\n          \"time_of_day\": \"evening\",\n          \"tracking_type\": \"boolean\"\n        }\n      ],\n      \"subtitle\": \"Semaine 2 ‚Ä¢ Pacifier l'esprit, ralentir le rythme\",\n      \"rationale\": \"Apr√®s avoir √©rig√© les barri√®res physiques, nous nous attaquons √† l'architecture interne. Apprendre √† ralentir et √† calmer l'activit√© c√©r√©brale est crucial pour un sommeil rapide et profond, surtout quand on 'd√©croche' facilement.\"\n    },\n    {\n      \"id\": 3,\n      \"title\": \"Phase 3 : La Synchronisation Circadienne - Ma√Ætriser le Temps\",\n      \"status\": \"locked\",\n      \"actions\": [\n        {\n          \"id\": \"90bbb26e-2dea-46f3-a1bf-ef0935a0925b\",\n          \"tips\": \"Un simulateur d'aube peut aider. Bois un grand verre d'eau fra√Æche au lever pour activer ton corps.\",\n          \"type\": \"habitude\",\n          \"title\": \"L'Ancre du R√©veil Fixe\",\n          \"status\": \"pending\",\n          \"questType\": \"main\",\n          \"rationale\": \"La r√©gularit√© du r√©veil est le signal le plus puissant pour synchroniser ton horloge biologique. Elle optimise la s√©cr√©tion de cortisol au matin (√©nergie) et de m√©latonine le soir (sommeil). C'est la constance qui bat la fatigue ici.\",\n          \"targetReps\": 7,\n          \"description\": \"Fixe une heure de lever et respecte-la chaque jour, m√™me le week-end, √† 30 minutes pr√®s. Expose-toi √† la lumi√®re naturelle d√®s ton r√©veil.\",\n          \"isCompleted\": false,\n          \"time_of_day\": \"morning\",\n          \"tracking_type\": \"boolean\"\n        },\n        {\n          \"id\": \"15912a65-55b0-4ed2-9cfb-c822be8c0549\",\n          \"tips\": \"Choisis des activit√©s calmantes et non stimulantes. La r√©gularit√© est plus importante que l'activit√© elle-m√™me.\",\n          \"type\": \"habitude\",\n          \"title\": \"Ritualisation du Coucher (15 minutes)\",\n          \"status\": \"pending\",\n          \"questType\": \"side\",\n          \"rationale\": \"Un rituel signale √† ton cerveau que l'heure du sommeil approche. Il r√©duit l'incertitude et l'anxi√©t√©, permettant une transition plus douce vers le sommeil, renfor√ßant les circuits neuronaux associ√©s au repos.\",\n          \"targetReps\": 7,\n          \"description\": \"Cr√©e une routine de 15 minutes que tu suis chaque soir apr√®s ton couvre-feu digital et avant de te coucher (ex: lecture, √©tirements doux, douche ti√®de).\",\n          \"isCompleted\": false,\n          \"time_of_day\": \"night\",\n          \"tracking_type\": \"boolean\"\n        }\n      ],\n      \"subtitle\": \"Semaine 3 ‚Ä¢ R√©tablir ton horloge interne\",\n      \"rationale\": \"Maintenant que les distractions et le bruit mental sont r√©duits, nous allons r√©aligner ton rythme circadien. La constance des heures de lever et de coucher est le pilier d'une √©nergie stable, m√™me face √† la fatigue.\"\n    },\n    {\n      \"id\": 4,\n      \"title\": \"Phase 4 : L'√ânergie R√©activ√©e - L'Optimisation Permanente\",\n      \"status\": \"locked\",\n      \"actions\": [\n        {\n          \"id\": \"8843ab0e-3dc8-427d-b406-0acccde01bc9\",\n          \"tips\": \"Sois honn√™te avec toi-m√™me. Ce n'est pas un jugement, mais une opportunit√© d'optimisation continue.\",\n          \"type\": \"framework\",\n          \"title\": \"Bilan √ânerg√©tique Hebdomadaire\",\n          \"status\": \"pending\",\n          \"questType\": \"main\",\n          \"rationale\": \"Cette r√©flexion m√©tacognitive t'aide √† comprendre les liens entre tes comportements et tes niveaux d'√©nergie. Elle renforce ta capacit√© √† t'adapter et √† maintenir tes acquis sur le long terme, √©vitant le 'd√©crochage'.\",\n          \"targetReps\": 1,\n          \"description\": \"Une fois par semaine, prends le temps de r√©fl√©chir √† ton niveau d'√©nergie, la qualit√© de ton sommeil et les ajustements n√©cessaires.\",\n          \"isCompleted\": false,\n          \"time_of_day\": \"any_time\",\n          \"tracking_type\": \"boolean\",\n          \"frameworkDetails\": {\n            \"type\": \"one_shot\",\n            \"intro\": \"L'architecte ne construit pas une fois pour toutes, il maintient et optimise. Fais le point sur ta nouvelle fondation.\",\n            \"sections\": [\n              {\n                \"id\": \"s4_q1\",\n                \"label\": \"Comment √©values-tu ton niveau d'√©nergie g√©n√©ral cette semaine (1-10) ?\",\n                \"inputType\": \"scale\",\n                \"placeholder\": \"8\"\n              },\n              {\n                \"id\": \"s4_q2\",\n                \"label\": \"Quelles habitudes ont eu le plus d'impact positif sur ton sommeil et ton √©nergie ?\",\n                \"inputType\": \"textarea\",\n                \"placeholder\": \"Le couvre-feu digital m'a vraiment aid√©...\"\n              },\n              {\n                \"id\": \"s4_q3\",\n                \"label\": \"Quels ont √©t√© les principaux d√©fis ou 'd√©crochages' cette semaine ?\",\n                \"inputType\": \"textarea\",\n                \"placeholder\": \"J'ai eu du mal √† r√©sister au scroll le mardi soir...\"\n              },\n              {\n                \"id\": \"s4_q4\",\n                \"label\": \"Quelle action ou ajustement ferais-tu pour la semaine prochaine ?\",\n                \"inputType\": \"textarea\",\n                \"placeholder\": \"Je vais essayer de me coucher 15 min plus t√¥t le mercredi.\"\n              }\n            ]\n          }\n        },\n        {\n          \"id\": \"2b072488-3894-4aaf-8944-abc458ff14fa\",\n          \"tips\": \"Utilise un minuteur pour te rappeler. L√®ve-toi de ta chaise et bouge. M√™me si c'est court, c'est puissant.\",\n          \"type\": \"habitude\",\n          \"title\": \"Micro-Pauses Actives (5 min)\",\n          \"status\": \"pending\",\n          \"questType\": \"side\",\n          \"rationale\": \"Ces micro-pauses rompent la s√©dentarit√© prolong√©e et la fixation oculaire sur √©cran, r√©duisant la fatigue mentale et physique. Elles r√©activent la circulation et l'attention, pr√©venant la surcharge cognitive qui contribue aux difficult√©s d'endormissement.\",\n          \"targetReps\": 7,\n          \"description\": \"Prends 2 √† 3 micro-pauses actives de 5 minutes pendant ta journ√©e de travail sur √©cran (ex: √©tirements, marche rapide, regarder par la fen√™tre).\",\n          \"isCompleted\": false,\n          \"time_of_day\": \"any_time\",\n          \"tracking_type\": \"boolean\"\n        },\n        {\n          \"id\": \"9cc1b91a-7fe5-42e3-8792-30a0db3d157a\",\n          \"tips\": \"V√©rifie les petites lumi√®res d'appareils √©lectroniques. Un masque de sommeil peut √™tre un bon investissement.\",\n          \"type\": \"mission\",\n          \"title\": \"Optimisation de l'Environnement de Sommeil\",\n          \"status\": \"pending\",\n          \"questType\": \"side\",\n          \"rationale\": \"Un environnement optimal minimise les stimulations sensorielles qui peuvent perturber le sommeil. La temp√©rature, la lumi√®re et le son sont des facteurs environnementaux puissants qui influencent la qualit√© et la dur√©e de ton repos.\",\n          \"description\": \"Assure-toi que ta chambre est un lieu optimal pour le sommeil : temp√©rature fra√Æche (18-20¬∞C), obscurit√© totale (rideaux occultants si n√©cessaire), et calme absolu (boules Quies ou machine √† bruit blanc si besoin).\",\n          \"isCompleted\": false,\n          \"time_of_day\": \"any_time\",\n          \"tracking_type\": \"boolean\"\n        }\n      ],\n      \"subtitle\": \"Semaine 4 ‚Ä¢ Int√©grer les gains et soutenir la constance\",\n      \"rationale\": \"Cette derni√®re phase consolide tes acquis et t'√©quipe pour maintenir cette nouvelle architecture de vie. Il s'agit d'int√©grer pleinement ces syst√®mes de comportement pour une √©nergie et une stabilit√© √† long terme.\"\n    }\n  ],\n  \"deepWhy\": \"Je veux am√©liorer mon sommeil pour retrouver une √©nergie in√©branlable et √™tre plus stable et pr√©sent au quotidien.\",\n  \"identity\": \"Je suis l'Architecte de mon Repos, un ma√Ætre de la discipline nocturne.\",\n  \"strategy\": \"Nous allons d√©construire radicalement les habitudes nocturnes n√©fastes pour reconstruire une fondation de sommeil in√©branlable, te permettant de retrouver une √©nergie stable et une pr√©sence accrue.\",\n  \"goldenRules\": \"1. Ma chambre est un sanctuaire sans √©cran.\\n2. L'heure de coucher est une rencontre sacr√©e avec moi-m√™me.\\n3. Je ne combats pas la fatigue par la distraction, mais par l'ancrage.\",\n  \"vitalSignal\": {\n    \"name\": \"Heure de coucher effective\",\n    \"type\": \"constat\",\n    \"unit\": \"HH:mm\",\n    \"startValue\": \"23:30\",\n    \"description\": \"Nous viserons √† d√©caler progressivement l'heure de coucher de 15 minutes tous les 3 jours jusqu'√† atteindre l'objectif. Note l'heure r√©elle de ton coucher.\",\n    \"targetValue\": \"22:00\",\n    \"tracking_type\": \"counter\"\n  },\n  \"grimoireTitle\": \"Le Protocole R√©silience Sommeil\",\n  \"context_problem\": \"√âpuis√© par des journ√©es intenses devant l'√©cran et des fins de soir√©e tardives, ton sommeil est devenu une source d'instabilit√©. Tes blocages se manifestent par un manque de constance, t'amenant √† c√©der au scrolling et aux ruminations d√®s que la fatigue s'installe, t'√©loignant de ton objectif de retrouver √©nergie et √©quilibre.\",\n  \"sophiaKnowledge\": \"Tu es un homme n√© en 1992, confront√© √† un niveau de stress et une qualit√© de sommeil moyens, malgr√© un niveau d'activit√© √©lev√©. Tes journ√©es s'√©tirent devant un √©cran, se terminant tard, ce qui perturbe ton repos. Tu identifies le 'scroll tard le soir' et les 'ruminations' comme tes principaux obstacles. Ta motivation est de regagner de l'√©nergie pour une meilleure stabilit√© quotidienne, mais tu manques de constance et 'd√©croches' facilement sous la fatigue.\",\n  \"maintenanceCheck\": {\n    \"type\": \"surveillance\",\n    \"question\": \"Combien de soirs cette semaine as-tu respect√© ton couvre-feu digital (pas d'√©cran 1h avant de dormir) ?\",\n    \"frequency\": \"hebdomadaire\"\n  },\n  \"estimatedDuration\": \"4 semaines\"\n}\n=== ACTIONS / FRAMEWORKS (√âTAT R√âEL DB) ===\nR√àGLES IMPORTANTES:\n- Les frameworks comptent comme des actions c√¥t√© utilisateur.\n- \"active\" = activ√©e et visible comme active dans l'app. \"pending\" = pas active.\n- On n'active/d√©sactive pas via WhatsApp: la seule mani√®re d'activer/d√©sactiver, c'est depuis le dashboard.\n\nActives (3):\n- [ACTION] D√©tox Digitale de la Chambre (any_time)\n- [ACTION] Le Couvre-Feu Digital Absolu (1h avant) (evening)\n- [FRAMEWORK] Journal de D√©charge Mentale Express\n\n=== SIGNES VITAUX (√âtat Actuel) ===\n- Heure de coucher effective: 23:30 HH:mm\n",
      "template_fingerprint": null
    },
    "scenario_target": "onboarding"
  },
  "error": null
}