{
  "id": "f62e2ef4-b49e-4a2d-a24b-ead9809df126",
  "created_at": "2026-01-09T17:05:10.665183+00:00",
  "status": "completed",
  "scenario_key": "wa_onboarding_open_chat_offtopic_after_prompt__run_1767978222847_0b9631",
  "transcript": [
    {
      "role": "user",
      "content": "Je suis plut√¥t du matin en g√©n√©ral.",
      "agent_used": null,
      "created_at": "2026-01-09T17:05:10.932699+00:00"
    },
    {
      "role": "assistant",
      "content": "Merci, je note ‚ù§Ô∏è\nEt l√†, tout de suite: tu as envie qu‚Äôon parle de quoi ?",
      "agent_used": "companion",
      "created_at": "2026-01-09T17:05:10.942247+00:00"
    },
    {
      "role": "user",
      "content": "Franchement l√† je suis sous pression au boulot‚Ä¶ j‚Äôai le cerveau en vrac.",
      "agent_used": null,
      "created_at": "2026-01-09T17:05:10.960054+00:00"
    },
    {
      "role": "assistant",
      "content": "Ah merde... C'est l'essoreuse l√†. On encaisse, mais on ne va pas te laisser le cerveau en vrac toute la soir√©e.\n\nOn a deux options : soit tu vides ton sac ici sur ce qui te met la pression, soit on cherche un micro-truc pour d√©brancher direct.\n\nTu pr√©f√®res qu'on reste sur ton boulot ou tu veux qu'on jette un ≈ìil √† ton plan pour voir si √ßa peut t'aider ? üå™Ô∏è",
      "agent_used": "companion",
      "created_at": "2026-01-09T17:05:20.103947+00:00"
    }
  ],
  "state_before": {
    "profile": {
      "id": "66829abb-4cca-4b01-8448-79ceddbd2dbd",
      "email": "run-evals+895a8621c3954d@example.com",
      "full_name": "Eval Runner",
      "trial_end": "2026-01-16T17:05:10.622+00:00",
      "phone_number": "+15552726809069",
      "phone_invalid": false,
      "whatsapp_state": "awaiting_personal_fact",
      "phone_verified_at": "2026-01-09T17:05:10.622+00:00",
      "whatsapp_opted_in": true,
      "whatsapp_opted_out_at": null,
      "whatsapp_optin_sent_at": null,
      "whatsapp_optout_reason": null,
      "whatsapp_bilan_opted_in": false,
      "whatsapp_last_inbound_at": null,
      "whatsapp_last_outbound_at": null,
      "whatsapp_state_updated_at": "2026-01-09T17:05:10.622+00:00",
      "whatsapp_optout_confirmed_at": null
    },
    "chat_state": null
  },
  "state_after": {
    "profile": {
      "id": "66829abb-4cca-4b01-8448-79ceddbd2dbd",
      "email": "run-evals+895a8621c3954d@example.com",
      "full_name": "Eval Runner",
      "trial_end": "2026-01-16T17:05:10.622+00:00",
      "phone_number": "+15552726809069",
      "phone_invalid": false,
      "whatsapp_state": null,
      "phone_verified_at": "2026-01-09T17:05:10.622+00:00",
      "whatsapp_opted_in": true,
      "whatsapp_opted_out_at": null,
      "whatsapp_optin_sent_at": null,
      "whatsapp_optout_reason": null,
      "whatsapp_bilan_opted_in": false,
      "whatsapp_last_inbound_at": "2026-01-09T17:05:10.956+00:00",
      "whatsapp_last_outbound_at": null,
      "whatsapp_state_updated_at": "2026-01-09T17:05:10.943+00:00",
      "whatsapp_optout_confirmed_at": null
    },
    "chat_state": {
      "scope": "whatsapp",
      "user_id": "66829abb-4cca-4b01-8448-79ceddbd2dbd",
      "risk_level": 4,
      "updated_at": "2026-01-09T17:05:20.099761+00:00",
      "current_mode": "companion",
      "last_processed_at": "2026-01-09T17:05:10.973+00:00",
      "short_term_context": "",
      "investigation_state": null,
      "last_interaction_at": "2026-01-09T17:05:10.974007+00:00",
      "unprocessed_msg_count": 1
    }
  },
  "issues": [
    {
      "code": "hallucination_premature_artifact",
      "message": "The assistant references 'ton plan' immediately after the onboarding personal fact step. In this specific WhatsApp onboarding context, the 'Plan' artifact likely does not exist yet.",
      "evidence": {
        "snippet": "tu veux qu'on jette un ≈ìil √† ton plan pour voir si √ßa peut t'aider ?",
        "agent_used": "sophia.companion"
      },
      "severity": "medium"
    }
  ],
  "suggestions": [
    {
      "action": "append",
      "rationale": "Prevents the assistant from hallucinating artifacts (The Plan) during the early onboarding/rapport-building phase.",
      "prompt_key": "sophia.companion",
      "context_block": "=== CONTEXT (transcript excerpt) ===\n#0 USER: Je suis plut√¥t du matin en g√©n√©ral.\n#1 ASSISTANT(companion): Merci, je note ‚ù§Ô∏è Et l√†, tout de suite: tu as envie qu‚Äôon parle de quoi ?\n#2 USER: Franchement l√† je suis sous pression au boulot‚Ä¶ j‚Äôai le cerveau en vrac.\n#3 ASSISTANT(companion): Ah merde... C'est l'essoreuse l√†. On encaisse, mais on ne va pas te laisser le cerveau en vrac toute la soir√©e. On a deux options : soit tu vides ton sac ici sur ce qui te met la pression, soit on cherche un micro-truc pour d√©brancher direct. Tu pr√©f√®res qu'on reste sur ton boulot ou tu veux qu'on jette un ≈ìil √† ton plan pour voir si √ßa peut t'aider ? üå™Ô∏è\n\n=== APPLY ===\nprompt_key: sophia.companion\naction: append\n\nproposed_addendum:\nCRITICAL CONTEXT CHECK: Do not offer to 'review' or 'look at' the Plan/Roadmap if the user is in the onboarding phase or if the Plan has not been created yet. If the user is stressed and has no Plan, offer to START a checkup (investigation) to build one, rather than consulting a non-existent document.",
      "proposed_addendum": "CRITICAL CONTEXT CHECK: Do not offer to 'review' or 'look at' the Plan/Roadmap if the user is in the onboarding phase or if the Plan has not been created yet. If the user is stressed and has no Plan, offer to START a checkup (investigation) to build one, rather than consulting a non-existent document."
    }
  ],
  "metrics": {
    "cost_usd": 0.009540700000000001,
    "request_id": "wa_onboarding_bundle:wa_onboarding_open_chat_offtopic_after_prompt__run_1767978222847_0b9631:i0:s1916298011:core:wa_onboarding_open_chat_offtopic_after_prompt__run_1767978222847_0b9631",
    "total_tokens": 12573,
    "output_tokens": 405,
    "prompt_tokens": 9545,
    "judge_llm_used": true,
    "mega_test_mode": false
  },
  "config": {
    "tags": [
      "whatsapp.onboarding",
      "whatsapp.webhook",
      "conversational",
      "offtopic"
    ],
    "limits": {
      "model": "gemini-3-pro-preview",
      "user_difficulty": "mid",
      "bilan_actions_count": 0,
      "test_post_checkup_deferral": false
    },
    "channel": "whatsapp",
    "request_id": "wa_onboarding_bundle:wa_onboarding_open_chat_offtopic_after_prompt__run_1767978222847_0b9631:i0:s1916298011:core:wa_onboarding_open_chat_offtopic_after_prompt__run_1767978222847_0b9631",
    "description": "WhatsApp onboarding (webhook): after the onboarding prompt opens the floor ('envie qu‚Äôon parle de quoi ?'), the user talks about something unrelated to the plan; Sophia should respect the intent and not redirect to the site/plan.",
    "plan_snapshot": {
      "plan": {
        "id": "3426a76c-4255-4103-b1ec-4b282065b1aa",
        "title": "Le Scriptorium de la Ma√Ætrise",
        "status": "active",
        "content": {
          "phases": [
            {
              "id": 1,
              "title": "Phase 1 : L'√âveil de la Pr√©sence",
              "status": "active",
              "actions": [
                {
                  "id": "d8ccd1bc-1d02-470c-92e3-9f6df0504918",
                  "tips": "Utilise un minuteur. Tiens un journal de bord rapide (1 phrase) pour noter cette priorit√©.",
                  "type": "habitude",
                  "title": "Le Moment 'Reset' Matinal",
                  "status": "active",
                  "questType": "main",
                  "rationale": "Ancre une intention positive et un bref moment de calme avant les sollicitations de la journ√©e.",
                  "targetReps": 7,
                  "description": "D√©marrer la journ√©e avec 5 minutes sans √©cran, juste pour respirer et visualiser ta seule priorit√© majeure du jour.",
                  "isCompleted": false,
                  "time_of_day": "morning",
                  "tracking_type": "boolean"
                },
                {
                  "id": "4184bf88-284b-4ef0-b47b-6b6bed2f3a47",
                  "tips": "Pas de jugement, juste l'observation. Un carnet et un stylo suffisent.",
                  "type": "mission",
                  "title": "Cartographie des Distractions",
                  "status": "active",
                  "questType": "side",
                  "rationale": "Prendre conscience des voleurs de temps est la premi√®re √©tape pour les neutraliser et reprendre le contr√¥le de ton attention.",
                  "description": "Pendant 2 jours, note toutes les fois o√π tu es interrompue ou o√π tu te laisses distraire (t√©l√©phone, email, pens√©es intrusives).",
                  "isCompleted": false,
                  "time_of_day": "any_time",
                  "tracking_type": "boolean"
                }
              ],
              "subtitle": "Semaines 1-2 ‚Ä¢ Calmer le tumulte int√©rieur",
              "rationale": "Avant de structurer l'ext√©rieur, il faut apaiser le mental et prendre conscience de la situation actuelle pour mieux ancrer les futures habitudes."
            },
            {
              "id": 2,
              "title": "Phase 2 : Le Silence des Notifications",
              "status": "locked",
              "actions": [
                {
                  "id": "32ba5c2d-a904-4f61-bdb8-24e3a74dcc61",
                  "tips": "Explique ta d√©marche √† tes proches si besoin. Utilise les modes de concentration de ton t√©l√©phone.",
                  "type": "habitude",
                  "title": "Le Couvre-feu des Notifications",
                  "status": "pending",
                  "questType": "main",
                  "rationale": "R√©duit les interruptions et permet √† ton attention de s'ancrer plus profond√©ment, augmentant ainsi ton temps de focus.",
                  "targetReps": 14,
                  "description": "Mettre toutes les notifications de ton t√©l√©phone en mode silencieux, sauf les appels urgents, de 9h √† 12h et de 14h √† 17h.",
                  "isCompleted": false,
                  "time_of_day": "any_time",
                  "tracking_type": "boolean"
                },
                {
                  "id": "e738fc91-d0c4-454d-82c1-72c1fb0b9461",
                  "tips": "Sois honn√™te avec toi-m√™me. Pense aux r√©seaux sociaux, aux t√¢ches routini√®res non essentielles, aux conversations improductives.",
                  "type": "framework",
                  "title": "L'Inventaire des Siphon-Temps",
                  "status": "pending",
                  "questType": "side",
                  "rationale": "Formaliser les sources de d√©perdition pour mieux les contourner ou les √©liminer, lib√©rant ainsi du temps pr√©cieux.",
                  "targetReps": 1,
                  "description": "Identifie les 3 principales activit√©s ou situations qui te volent le plus de temps et d'√©nergie sans valeur ajout√©e, en d√©taillant pourquoi.",
                  "isCompleted": false,
                  "time_of_day": "any_time",
                  "tracking_type": "boolean",
                  "frameworkDetails": {
                    "type": "one_shot",
                    "intro": "Listez les activit√©s qui, une fois commenc√©es, vous absorbent sans r√©el b√©n√©fice. Comprendre leur attrait et leur impact est la cl√© pour s'en lib√©rer.",
                    "sections": [
                      {
                        "id": "siphon1_name",
                        "label": "Siphon de temps #1 (Nom)",
                        "inputType": "text",
                        "placeholder": "Ex: Instagram"
                      },
                      {
                        "id": "siphon1_why",
                        "label": "Pourquoi m'absorbe-t-il ?",
                        "inputType": "textarea",
                        "placeholder": "J'y vais par habitude, pour m'√©vader..."
                      },
                      {
                        "id": "siphon2_name",
                        "label": "Siphon de temps #2 (Nom)",
                        "inputType": "text",
                        "placeholder": "Ex: V√©rifier mes emails toutes les 10 minutes"
                      },
                      {
                        "id": "siphon2_why",
                        "label": "Pourquoi m'absorbe-t-il ?",
                        "inputType": "textarea",
                        "placeholder": "Peur de rater quelque chose, besoin de contr√¥le..."
                      },
                      {
                        "id": "siphon3_name",
                        "label": "Siphon de temps #3 (Nom)",
                        "inputType": "text",
                        "placeholder": "Ex: Multit√¢ches constant"
                      },
                      {
                        "id": "siphon3_why",
                        "label": "Pourquoi m'absorbe-t-il ?",
                        "inputType": "textarea",
                        "placeholder": "Impression d'√™tre plus productive, mais en r√©alit√© dispersion..."
                      }
                    ]
                  }
                }
              ],
              "subtitle": "Semaines 3-4 ‚Ä¢ Reprendre le contr√¥le de ton attention",
              "rationale": "Les notifications sont des interrupteurs constants pour le cerveau, brisant le focus avant m√™me qu'il ne s'installe. Il est temps de les dompter."
            },
            {
              "id": 3,
              "title": "Phase 3 : La Feuille de Route Minimaliste",
              "status": "locked",
              "actions": [
                {
                  "id": "ac968e3f-dfdc-4d1d-a366-18cab71512b9",
                  "tips": "√âcris-les sur un post-it visible ou utilise une application simple. Ne sous-estime pas la puissance du 'pas plus de 3'.",
                  "type": "habitude",
                  "title": "La R√®gle des 3 Priorit√©s",
                  "status": "pending",
                  "questType": "main",
                  "rationale": "R√©duit la charge cognitive et focalise l'√©nergie sur l'essentiel, luttant efficacement contre le sentiment d'√™tre d√©bord√©e.",
                  "targetReps": 7,
                  "description": "Chaque matin, avant de commencer ta journ√©e, choisis 3 t√¢ches MAXIMUM √† accomplir. Une fois faites, tu peux en ajouter d'autres.",
                  "isCompleted": false,
                  "time_of_day": "morning",
                  "tracking_type": "boolean"
                },
                {
                  "id": "d48d7b89-702c-4270-bb70-ed4c67465644",
                  "tips": "Pr√©vois 30 minutes d√©di√©es. Commence par le plus visible (le bureau de ton ordinateur).",
                  "type": "mission",
                  "title": "Nettoyage du Bureau Num√©rique",
                  "status": "pending",
                  "questType": "side",
                  "rationale": "Un environnement num√©rique clair est un esprit plus clair. Moins de friction pour retrouver l'information et d√©marrer une t√¢che.",
                  "description": "Organiser tes fichiers sur l'ordinateur et le t√©l√©phone. Cr√©er des dossiers clairs, supprimer l'inutile. Vider le bureau de tes √©crans.",
                  "isCompleted": false,
                  "time_of_day": "any_time",
                  "tracking_type": "boolean"
                }
              ],
              "subtitle": "Semaines 5-6 ‚Ä¢ Simplifier pour agir",
              "rationale": "Trop de t√¢ches tuent la t√¢che. Apprendre √† hi√©rarchiser et √† d√©couper les objectifs pour √©viter le d√©bordement et l'oubli."
            },
            {
              "id": 4,
              "title": "Phase 4 : Le Protocole d'Ancrage",
              "status": "locked",
              "actions": [
                {
                  "id": "ddc0a0d0-3cc9-4477-a8ab-5d2895b8b16e",
                  "tips": "L'objectif n'est pas de finir, mais de d√©marrer. Rend-le si petit qu'il est ridicule de ne pas le faire.",
                  "type": "habitude",
                  "title": "La Technique du 'D√©marreur L√©ger'",
                  "status": "pending",
                  "questType": "main",
                  "rationale": "R√©duit la barri√®re mentale au d√©marrage, la plus grande cause de procrastination, et construit l'√©lan.",
                  "targetReps": 14,
                  "description": "Pour toute t√¢che que tu as tendance √† procrastiner, identifie la premi√®re micro-action et engage-toi √† ne faire QUE cette micro-action (ex: ouvrir le document, √©crire le titre).",
                  "isCompleted": false,
                  "time_of_day": "any_time",
                  "tracking_type": "boolean"
                },
                {
                  "id": "252da7ca-70c6-4424-8296-3a7873e851e7",
                  "tips": "M√™me 'j'ai bu un verre d'eau' ou 'j'ai r√©sist√© √† une notification' compte si c'est en lien avec ton objectif.",
                  "type": "framework",
                  "title": "Le Journal de la Victoire Minimum",
                  "status": "pending",
                  "questType": "side",
                  "rationale": "Renforce le circuit de la r√©compense dans le cerveau pour les comportements souhait√©s, augmentant la motivation intrins√®que et la r√©silience.",
                  "targetReps": 14,
                  "description": "Chaque soir, note une chose que tu as bien faite aujourd'hui, m√™me minuscule, qui a contribu√© √† ton focus ou ta discipline.",
                  "isCompleted": false,
                  "time_of_day": "evening",
                  "tracking_type": "boolean",
                  "frameworkDetails": {
                    "type": "recurring",
                    "intro": "Concentrez-vous sur le positif. Chaque petite victoire est un pas vers une plus grande ma√Ætrise. Ne sous-estimez jamais le pouvoir du renforcement positif.",
                    "sections": [
                      {
                        "id": "victoire_du_jour",
                        "label": "Ma micro-victoire du jour pour le focus/discipline :",
                        "inputType": "textarea",
                        "placeholder": "J'ai r√©ussi √† travailler 15 minutes sans regarder mon t√©l√©phone."
                      },
                      {
                        "id": "sensation",
                        "label": "Comment me suis-je sentie apr√®s ?",
                        "inputType": "text",
                        "placeholder": "Fi√®re, soulag√©e, efficace."
                      }
                    ]
                  }
                }
              ],
              "subtitle": "Semaines 7-8 ‚Ä¢ Passer de l'intention √† l'action concr√®te",
              "rationale": "La procrastination est souvent un manque d'ancrage. Cette phase vise √† cr√©er des liens solides entre l'intention et le d√©but de l'action, rendant chaque pas plus facile."
            },
            {
              "id": 5,
              "title": "Phase 5 : L'√âlan R√©cup√©rateur",
              "status": "locked",
              "actions": [
                {
                  "id": "8c4e34e5-ae36-495d-b273-1ec73175ccfa",
                  "tips": "Utilise une application de timer ou ton Vital Signal pour te rappeler. La cl√© est de changer d'environnement et d'activit√© sans solliciter l'√©cran.",
                  "type": "habitude",
                  "title": "La Pause Intentionnelle de 5 minutes",
                  "status": "pending",
                  "questType": "main",
                  "rationale": "Optimise la r√©cup√©ration mentale et pr√©vient la fatigue cognitive, am√©liorant le focus des sessions suivantes et l'√©nergie g√©n√©rale.",
                  "targetReps": 14,
                  "description": "Toutes les 60-90 minutes de travail, l√®ve-toi, √©tire-toi, bois de l'eau, regarde par la fen√™tre. Interdiction de prendre ton t√©l√©phone.",
                  "isCompleted": false,
                  "time_of_day": "any_time",
                  "tracking_type": "boolean"
                },
                {
                  "id": "d7503e46-81a3-42fe-b84e-5aa447b4a497",
                  "tips": "N'h√©site pas √† bloquer des cr√©neaux 'temps pour moi' ou 'flexibilit√©'. Anticiper, c'est d√©samorcer le stress et la d√©sorganisation.",
                  "type": "mission",
                  "title": "Le Plan Anti-Surcharge Hebdomadaire",
                  "status": "pending",
                  "questType": "side",
                  "rationale": "Transforme le sentiment de d√©bordement en un contr√¥le proactif sur ta semaine, augmentant la sensation de stabilit√© et de pr√©paration.",
                  "description": "D√©dier 30 minutes chaque dimanche soir √† planifier ta semaine √† venir, en identifiant les moments potentiels de surcharge et en pr√©voyant des 'buffers' de temps.",
                  "isCompleted": false,
                  "time_of_day": "evening",
                  "tracking_type": "boolean"
                }
              ],
              "subtitle": "Semaines 9-10 ‚Ä¢ Recharger l'√©nergie pour mieux la diriger",
              "rationale": "La discipline n'est pas une course sans fin. Elle n√©cessite des pauses intelligentes pour maintenir un niveau d'√©nergie optimal et √©viter le burnout, consolidant ainsi la stabilit√©."
            },
            {
              "id": 6,
              "title": "Phase 6 : Le Manifeste de la Ma√Ætrise",
              "status": "locked",
              "actions": [
                {
                  "id": "0520c9b0-1adb-48bc-a3c7-aa0024940c1d",
                  "tips": "Garde-le simple, puissant et inspirant. Affiche-le si possible pour te rappeler de tes engagements.",
                  "type": "framework",
                  "title": "Mon Manifeste du Focus et de la Discipline",
                  "status": "pending",
                  "questType": "main",
                  "rationale": "Solidifie la nouvelle identit√© comportementale et fournit une ancre mentale pour les moments de doute ou de surcharge future.",
                  "targetReps": 1,
                  "description": "√âcris un document court (1 page) qui r√©sume tes nouvelles r√®gles d'or, tes strat√©gies anti-procrastination, et ta vision de toi-m√™me comme une personne concentr√©e et disciplin√©e.",
                  "isCompleted": false,
                  "time_of_day": "any_time",
                  "tracking_type": "boolean",
                  "frameworkDetails": {
                    "type": "one_shot",
                    "intro": "Ce manifeste est votre d√©claration personnelle d'intention. Il cristallise votre transformation et vous servira de guide pour l'avenir. Exprimez-y votre nouvelle identit√© et vos principes directeurs.",
                    "sections": [
                      {
                        "id": "new_identity",
                        "label": "Ma nouvelle identit√© et mes valeurs cl√©s :",
                        "inputType": "textarea",
                        "placeholder": "Je suis l'architecte de ma concentration, guid√©e par la clart√© et la pr√©sence."
                      },
                      {
                        "id": "golden_rules_personnelles",
                        "label": "Mes r√®gles d'or personnelles pour le focus et la discipline :",
                        "inputType": "list",
                        "placeholder": "Ex: 1. Un √©cran = une t√¢che."
                      },
                      {
                        "id": "strategies_maintenance",
                        "label": "Comment je maintiendrai mes acquis √† long terme (mes alertes et mes rem√®des) :",
                        "inputType": "textarea",
                        "placeholder": "Si je me sens d√©bord√©e, je reviens √† la r√®gle des 3 priorit√©s et au 'd√©marreur l√©ger'."
                      }
                    ]
                  }
                },
                {
                  "id": "c1f5686d-b7b3-496f-a8b0-7150b2671ce7",
                  "tips": "C√©l√®bre tes succ√®s, aussi petits soient-ils. Le point d'am√©lioration n'est pas une critique, mais une opportunit√© de croissance.",
                  "type": "habitude",
                  "title": "La R√©trospective Positive",
                  "status": "pending",
                  "questType": "side",
                  "rationale": "Ancre le progr√®s, maintient la motivation et affine continuellement les strat√©gies d'adaptation pour une autonomie durable.",
                  "targetReps": 1,
                  "description": "Chaque fin de semaine, prends 10 minutes pour relire ton Manifeste, puis liste 3 succ√®s et 1 point d'am√©lioration pour la semaine √† venir.",
                  "isCompleted": false,
                  "time_of_day": "evening",
                  "tracking_type": "boolean"
                }
              ],
              "subtitle": "Semaines 11-12 ‚Ä¢ Int√©grer et c√©l√©brer les nouveaux piliers",
              "rationale": "Consolider les acquis en cr√©ant un document personnel qui formalise la nouvelle identit√© et les strat√©gies de maintenance, assurant une transformation durable."
            }
          ],
          "deepWhy": "Pour retrouver une √©nergie sereine, √™tre pleinement pr√©sente dans mon quotidien et accomplir mes objectifs sans le poids du d√©bordement.",
          "identity": "Je suis l'Architecte de ma concentration.",
          "strategy": "Nous allons construire une structure invisible, ancr√©e dans de micro-habitudes quotidiennes, pour transformer la procrastination en proactivit√© durable et retrouver une stabilit√© pr√©cieuse.",
          "goldenRules": "1. Chaque grand projet commence par une seule petite action.\n2. Ma planification est mon bouclier contre le chaos.\n3. Quand le doute surgit, je respire et je r√©√©value ma priorit√© unique.",
          "vitalSignal": {
            "name": "Minutes de Focus Profond",
            "type": "constat",
            "unit": "min",
            "startValue": "0",
            "description": "Le temps pass√© sur une seule t√¢che importante sans interruption ni distraction, mesur√© chaque jour.",
            "targetValue": "30",
            "time_of_day": "any_time",
            "tracking_type": "counter"
          },
          "grimoireTitle": "Le Scriptorium de la Ma√Ætrise",
          "context_problem": "Tu te sens souvent submerg√©e par un rythme de vie charg√© et un flot continu de sollicitations, ce qui se traduit par de la procrastination et un sentiment de d√©sorganisation. Ces blocages t'emp√™chent de retrouver l'√©nergie et la stabilit√© souhait√©es pour ton quotidien, te laissant avec l'impression de toujours courir apr√®s le temps et les t√¢ches oubli√©es.",
          "sophiaKnowledge": "Tu es une femme dynamique, n√©e en 1988, qui aspire √† un meilleur focus et √† plus de discipline. Tu te sens souvent d√©bord√©e par un rythme de vie charg√© et des sollicitations constantes, ce qui m√®ne √† la procrastination et √† la d√©sorganisation. Malgr√© une bonne qualit√© de sommeil et un stress mod√©r√©, tu manques d'√©nergie et de stabilit√© au quotidien. Mon approche sera douce mais r√©solue, en te guidant pas √† pas vers une ma√Ætrise de ton temps et de ton attention.",
          "maintenanceCheck": {
            "type": "surveillance",
            "question": "Combien de fois t'es-tu senti(e) d√©bord√©(e) ou d√©sorganis√©(e) cette semaine ?",
            "frequency": "hebdomadaire"
          },
          "estimatedDuration": "12 semaines"
        },
        "goal_id": "24143348-44ac-47b0-be37-d8dd141a5eca",
        "deep_why": "Pour retrouver une √©nergie sereine, √™tre pleinement pr√©sente dans mon quotidien et accomplir mes objectifs sans le poids du d√©bordement.",
        "created_at": "2026-01-09T17:05:10.594047+00:00",
        "inputs_why": null,
        "current_phase": 1,
        "submission_id": "4068b295-7f94-49c9-a137-701f87ddafd4",
        "inputs_context": null,
        "inputs_blockers": null,
        "progress_percentage": 0
      },
      "actions": [
        {
          "id": "d8ccd1bc-1d02-470c-92e3-9f6df0504918",
          "title": "Le Moment 'Reset' Matinal",
          "status": "active",
          "created_at": "2026-01-09T17:05:10.606756+00:00",
          "description": "D√©marrer la journ√©e avec 5 minutes sans √©cran, juste pour respirer et visualiser ta seule priorit√© majeure du jour.",
          "target_reps": 7,
          "time_of_day": "morning",
          "current_reps": 0,
          "tracking_type": "boolean",
          "last_performed_at": "2026-01-07T17:05:10.604+00:00"
        },
        {
          "id": "4184bf88-284b-4ef0-b47b-6b6bed2f3a47",
          "title": "Cartographie des Distractions",
          "status": "active",
          "created_at": "2026-01-09T17:05:10.606756+00:00",
          "description": "Pendant 2 jours, note toutes les fois o√π tu es interrompue ou o√π tu te laisses distraire (t√©l√©phone, email, pens√©es intrusives).",
          "target_reps": 1,
          "time_of_day": "any_time",
          "current_reps": 0,
          "tracking_type": "boolean",
          "last_performed_at": "2026-01-07T17:05:10.604+00:00"
        }
      ],
      "frameworks": [],
      "dashboard_context": "=== PLAN ACTUEL (Tableau de Bord) ===\nTitre: Le Scriptorium de la Ma√Ætrise\nStatut: active\nPhase courante (dashboard): 1\nPourquoi (Deep Why): Pour retrouver une √©nergie sereine, √™tre pleinement pr√©sente dans mon quotidien et accomplir mes objectifs sans le poids du d√©bordement.\nD√âTAIL COMPLET DU PLAN (Structure JSON) :\n{\n  \"phases\": [\n    {\n      \"id\": 1,\n      \"title\": \"Phase 1 : L'√âveil de la Pr√©sence\",\n      \"status\": \"active\",\n      \"actions\": [\n        {\n          \"id\": \"d8ccd1bc-1d02-470c-92e3-9f6df0504918\",\n          \"tips\": \"Utilise un minuteur. Tiens un journal de bord rapide (1 phrase) pour noter cette priorit√©.\",\n          \"type\": \"habitude\",\n          \"title\": \"Le Moment 'Reset' Matinal\",\n          \"status\": \"active\",\n          \"questType\": \"main\",\n          \"rationale\": \"Ancre une intention positive et un bref moment de calme avant les sollicitations de la journ√©e.\",\n          \"targetReps\": 7,\n          \"description\": \"D√©marrer la journ√©e avec 5 minutes sans √©cran, juste pour respirer et visualiser ta seule priorit√© majeure du jour.\",\n          \"isCompleted\": false,\n          \"time_of_day\": \"morning\",\n          \"tracking_type\": \"boolean\"\n        },\n        {\n          \"id\": \"4184bf88-284b-4ef0-b47b-6b6bed2f3a47\",\n          \"tips\": \"Pas de jugement, juste l'observation. Un carnet et un stylo suffisent.\",\n          \"type\": \"mission\",\n          \"title\": \"Cartographie des Distractions\",\n          \"status\": \"active\",\n          \"questType\": \"side\",\n          \"rationale\": \"Prendre conscience des voleurs de temps est la premi√®re √©tape pour les neutraliser et reprendre le contr√¥le de ton attention.\",\n          \"description\": \"Pendant 2 jours, note toutes les fois o√π tu es interrompue ou o√π tu te laisses distraire (t√©l√©phone, email, pens√©es intrusives).\",\n          \"isCompleted\": false,\n          \"time_of_day\": \"any_time\",\n          \"tracking_type\": \"boolean\"\n        }\n      ],\n      \"subtitle\": \"Semaines 1-2 ‚Ä¢ Calmer le tumulte int√©rieur\",\n      \"rationale\": \"Avant de structurer l'ext√©rieur, il faut apaiser le mental et prendre conscience de la situation actuelle pour mieux ancrer les futures habitudes.\"\n    },\n    {\n      \"id\": 2,\n      \"title\": \"Phase 2 : Le Silence des Notifications\",\n      \"status\": \"locked\",\n      \"actions\": [\n        {\n          \"id\": \"32ba5c2d-a904-4f61-bdb8-24e3a74dcc61\",\n          \"tips\": \"Explique ta d√©marche √† tes proches si besoin. Utilise les modes de concentration de ton t√©l√©phone.\",\n          \"type\": \"habitude\",\n          \"title\": \"Le Couvre-feu des Notifications\",\n          \"status\": \"pending\",\n          \"questType\": \"main\",\n          \"rationale\": \"R√©duit les interruptions et permet √† ton attention de s'ancrer plus profond√©ment, augmentant ainsi ton temps de focus.\",\n          \"targetReps\": 14,\n          \"description\": \"Mettre toutes les notifications de ton t√©l√©phone en mode silencieux, sauf les appels urgents, de 9h √† 12h et de 14h √† 17h.\",\n          \"isCompleted\": false,\n          \"time_of_day\": \"any_time\",\n          \"tracking_type\": \"boolean\"\n        },\n        {\n          \"id\": \"e738fc91-d0c4-454d-82c1-72c1fb0b9461\",\n          \"tips\": \"Sois honn√™te avec toi-m√™me. Pense aux r√©seaux sociaux, aux t√¢ches routini√®res non essentielles, aux conversations improductives.\",\n          \"type\": \"framework\",\n          \"title\": \"L'Inventaire des Siphon-Temps\",\n          \"status\": \"pending\",\n          \"questType\": \"side\",\n          \"rationale\": \"Formaliser les sources de d√©perdition pour mieux les contourner ou les √©liminer, lib√©rant ainsi du temps pr√©cieux.\",\n          \"targetReps\": 1,\n          \"description\": \"Identifie les 3 principales activit√©s ou situations qui te volent le plus de temps et d'√©nergie sans valeur ajout√©e, en d√©taillant pourquoi.\",\n          \"isCompleted\": false,\n          \"time_of_day\": \"any_time\",\n          \"tracking_type\": \"boolean\",\n          \"frameworkDetails\": {\n            \"type\": \"one_shot\",\n            \"intro\": \"Listez les activit√©s qui, une fois commenc√©es, vous absorbent sans r√©el b√©n√©fice. Comprendre leur attrait et leur impact est la cl√© pour s'en lib√©rer.\",\n            \"sections\": [\n              {\n                \"id\": \"siphon1_name\",\n                \"label\": \"Siphon de temps #1 (Nom)\",\n                \"inputType\": \"text\",\n                \"placeholder\": \"Ex: Instagram\"\n              },\n              {\n                \"id\": \"siphon1_why\",\n                \"label\": \"Pourquoi m'absorbe-t-il ?\",\n                \"inputType\": \"textarea\",\n                \"placeholder\": \"J'y vais par habitude, pour m'√©vader...\"\n              },\n              {\n                \"id\": \"siphon2_name\",\n                \"label\": \"Siphon de temps #2 (Nom)\",\n                \"inputType\": \"text\",\n                \"placeholder\": \"Ex: V√©rifier mes emails toutes les 10 minutes\"\n              },\n              {\n                \"id\": \"siphon2_why\",\n                \"label\": \"Pourquoi m'absorbe-t-il ?\",\n                \"inputType\": \"textarea\",\n                \"placeholder\": \"Peur de rater quelque chose, besoin de contr√¥le...\"\n              },\n              {\n                \"id\": \"siphon3_name\",\n                \"label\": \"Siphon de temps #3 (Nom)\",\n                \"inputType\": \"text\",\n                \"placeholder\": \"Ex: Multit√¢ches constant\"\n              },\n              {\n                \"id\": \"siphon3_why\",\n                \"label\": \"Pourquoi m'absorbe-t-il ?\",\n                \"inputType\": \"textarea\",\n                \"placeholder\": \"Impression d'√™tre plus productive, mais en r√©alit√© dispersion...\"\n              }\n            ]\n          }\n        }\n      ],\n      \"subtitle\": \"Semaines 3-4 ‚Ä¢ Reprendre le contr√¥le de ton attention\",\n      \"rationale\": \"Les notifications sont des interrupteurs constants pour le cerveau, brisant le focus avant m√™me qu'il ne s'installe. Il est temps de les dompter.\"\n    },\n    {\n      \"id\": 3,\n      \"title\": \"Phase 3 : La Feuille de Route Minimaliste\",\n      \"status\": \"locked\",\n      \"actions\": [\n        {\n          \"id\": \"ac968e3f-dfdc-4d1d-a366-18cab71512b9\",\n          \"tips\": \"√âcris-les sur un post-it visible ou utilise une application simple. Ne sous-estime pas la puissance du 'pas plus de 3'.\",\n          \"type\": \"habitude\",\n          \"title\": \"La R√®gle des 3 Priorit√©s\",\n          \"status\": \"pending\",\n          \"questType\": \"main\",\n          \"rationale\": \"R√©duit la charge cognitive et focalise l'√©nergie sur l'essentiel, luttant efficacement contre le sentiment d'√™tre d√©bord√©e.\",\n          \"targetReps\": 7,\n          \"description\": \"Chaque matin, avant de commencer ta journ√©e, choisis 3 t√¢ches MAXIMUM √† accomplir. Une fois faites, tu peux en ajouter d'autres.\",\n          \"isCompleted\": false,\n          \"time_of_day\": \"morning\",\n          \"tracking_type\": \"boolean\"\n        },\n        {\n          \"id\": \"d48d7b89-702c-4270-bb70-ed4c67465644\",\n          \"tips\": \"Pr√©vois 30 minutes d√©di√©es. Commence par le plus visible (le bureau de ton ordinateur).\",\n          \"type\": \"mission\",\n          \"title\": \"Nettoyage du Bureau Num√©rique\",\n          \"status\": \"pending\",\n          \"questType\": \"side\",\n          \"rationale\": \"Un environnement num√©rique clair est un esprit plus clair. Moins de friction pour retrouver l'information et d√©marrer une t√¢che.\",\n          \"description\": \"Organiser tes fichiers sur l'ordinateur et le t√©l√©phone. Cr√©er des dossiers clairs, supprimer l'inutile. Vider le bureau de tes √©crans.\",\n          \"isCompleted\": false,\n          \"time_of_day\": \"any_time\",\n          \"tracking_type\": \"boolean\"\n        }\n      ],\n      \"subtitle\": \"Semaines 5-6 ‚Ä¢ Simplifier pour agir\",\n      \"rationale\": \"Trop de t√¢ches tuent la t√¢che. Apprendre √† hi√©rarchiser et √† d√©couper les objectifs pour √©viter le d√©bordement et l'oubli.\"\n    },\n    {\n      \"id\": 4,\n      \"title\": \"Phase 4 : Le Protocole d'Ancrage\",\n      \"status\": \"locked\",\n      \"actions\": [\n        {\n          \"id\": \"ddc0a0d0-3cc9-4477-a8ab-5d2895b8b16e\",\n          \"tips\": \"L'objectif n'est pas de finir, mais de d√©marrer. Rend-le si petit qu'il est ridicule de ne pas le faire.\",\n          \"type\": \"habitude\",\n          \"title\": \"La Technique du 'D√©marreur L√©ger'\",\n          \"status\": \"pending\",\n          \"questType\": \"main\",\n          \"rationale\": \"R√©duit la barri√®re mentale au d√©marrage, la plus grande cause de procrastination, et construit l'√©lan.\",\n          \"targetReps\": 14,\n          \"description\": \"Pour toute t√¢che que tu as tendance √† procrastiner, identifie la premi√®re micro-action et engage-toi √† ne faire QUE cette micro-action (ex: ouvrir le document, √©crire le titre).\",\n          \"isCompleted\": false,\n          \"time_of_day\": \"any_time\",\n          \"tracking_type\": \"boolean\"\n        },\n        {\n          \"id\": \"252da7ca-70c6-4424-8296-3a7873e851e7\",\n          \"tips\": \"M√™me 'j'ai bu un verre d'eau' ou 'j'ai r√©sist√© √† une notification' compte si c'est en lien avec ton objectif.\",\n          \"type\": \"framework\",\n          \"title\": \"Le Journal de la Victoire Minimum\",\n          \"status\": \"pending\",\n          \"questType\": \"side\",\n          \"rationale\": \"Renforce le circuit de la r√©compense dans le cerveau pour les comportements souhait√©s, augmentant la motivation intrins√®que et la r√©silience.\",\n          \"targetReps\": 14,\n          \"description\": \"Chaque soir, note une chose que tu as bien faite aujourd'hui, m√™me minuscule, qui a contribu√© √† ton focus ou ta discipline.\",\n          \"isCompleted\": false,\n          \"time_of_day\": \"evening\",\n          \"tracking_type\": \"boolean\",\n          \"frameworkDetails\": {\n            \"type\": \"recurring\",\n            \"intro\": \"Concentrez-vous sur le positif. Chaque petite victoire est un pas vers une plus grande ma√Ætrise. Ne sous-estimez jamais le pouvoir du renforcement positif.\",\n            \"sections\": [\n              {\n                \"id\": \"victoire_du_jour\",\n                \"label\": \"Ma micro-victoire du jour pour le focus/discipline :\",\n                \"inputType\": \"textarea\",\n                \"placeholder\": \"J'ai r√©ussi √† travailler 15 minutes sans regarder mon t√©l√©phone.\"\n              },\n              {\n                \"id\": \"sensation\",\n                \"label\": \"Comment me suis-je sentie apr√®s ?\",\n                \"inputType\": \"text\",\n                \"placeholder\": \"Fi√®re, soulag√©e, efficace.\"\n              }\n            ]\n          }\n        }\n      ],\n      \"subtitle\": \"Semaines 7-8 ‚Ä¢ Passer de l'intention √† l'action concr√®te\",\n      \"rationale\": \"La procrastination est souvent un manque d'ancrage. Cette phase vise √† cr√©er des liens solides entre l'intention et le d√©but de l'action, rendant chaque pas plus facile.\"\n    },\n    {\n      \"id\": 5,\n      \"title\": \"Phase 5 : L'√âlan R√©cup√©rateur\",\n      \"status\": \"locked\",\n      \"actions\": [\n        {\n          \"id\": \"8c4e34e5-ae36-495d-b273-1ec73175ccfa\",\n          \"tips\": \"Utilise une application de timer ou ton Vital Signal pour te rappeler. La cl√© est de changer d'environnement et d'activit√© sans solliciter l'√©cran.\",\n          \"type\": \"habitude\",\n          \"title\": \"La Pause Intentionnelle de 5 minutes\",\n          \"status\": \"pending\",\n          \"questType\": \"main\",\n          \"rationale\": \"Optimise la r√©cup√©ration mentale et pr√©vient la fatigue cognitive, am√©liorant le focus des sessions suivantes et l'√©nergie g√©n√©rale.\",\n          \"targetReps\": 14,\n          \"description\": \"Toutes les 60-90 minutes de travail, l√®ve-toi, √©tire-toi, bois de l'eau, regarde par la fen√™tre. Interdiction de prendre ton t√©l√©phone.\",\n          \"isCompleted\": false,\n          \"time_of_day\": \"any_time\",\n          \"tracking_type\": \"boolean\"\n        },\n        {\n          \"id\": \"d7503e46-81a3-42fe-b84e-5aa447b4a497\",\n          \"tips\": \"N'h√©site pas √† bloquer des cr√©neaux 'temps pour moi' ou 'flexibilit√©'. Anticiper, c'est d√©samorcer le stress et la d√©sorganisation.\",\n          \"type\": \"mission\",\n          \"title\": \"Le Plan Anti-Surcharge Hebdomadaire\",\n          \"status\": \"pending\",\n          \"questType\": \"side\",\n          \"rationale\": \"Transforme le sentiment de d√©bordement en un contr√¥le proactif sur ta semaine, augmentant la sensation de stabilit√© et de pr√©paration.\",\n          \"description\": \"D√©dier 30 minutes chaque dimanche soir √† planifier ta semaine √† venir, en identifiant les moments potentiels de surcharge et en pr√©voyant des 'buffers' de temps.\",\n          \"isCompleted\": false,\n          \"time_of_day\": \"evening\",\n          \"tracking_type\": \"boolean\"\n        }\n      ],\n      \"subtitle\": \"Semaines 9-10 ‚Ä¢ Recharger l'√©nergie pour mieux la diriger\",\n      \"rationale\": \"La discipline n'est pas une course sans fin. Elle n√©cessite des pauses intelligentes pour maintenir un niveau d'√©nergie optimal et √©viter le burnout, consolidant ainsi la stabilit√©.\"\n    },\n    {\n      \"id\": 6,\n      \"title\": \"Phase 6 : Le Manifeste de la Ma√Ætrise\",\n      \"status\": \"locked\",\n      \"actions\": [\n        {\n          \"id\": \"0520c9b0-1adb-48bc-a3c7-aa0024940c1d\",\n          \"tips\": \"Garde-le simple, puissant et inspirant. Affiche-le si possible pour te rappeler de tes engagements.\",\n          \"type\": \"framework\",\n          \"title\": \"Mon Manifeste du Focus et de la Discipline\",\n          \"status\": \"pending\",\n          \"questType\": \"main\",\n          \"rationale\": \"Solidifie la nouvelle identit√© comportementale et fournit une ancre mentale pour les moments de doute ou de surcharge future.\",\n          \"targetReps\": 1,\n          \"description\": \"√âcris un document court (1 page) qui r√©sume tes nouvelles r√®gles d'or, tes strat√©gies anti-procrastination, et ta vision de toi-m√™me comme une personne concentr√©e et disciplin√©e.\",\n          \"isCompleted\": false,\n          \"time_of_day\": \"any_time\",\n          \"tracking_type\": \"boolean\",\n          \"frameworkDetails\": {\n            \"type\": \"one_shot\",\n            \"intro\": \"Ce manifeste est votre d√©claration personnelle d'intention. Il cristallise votre transformation et vous servira de guide pour l'avenir. Exprimez-y votre nouvelle identit√© et vos principes directeurs.\",\n            \"sections\": [\n              {\n                \"id\": \"new_identity\",\n                \"label\": \"Ma nouvelle identit√© et mes valeurs cl√©s :\",\n                \"inputType\": \"textarea\",\n                \"placeholder\": \"Je suis l'architecte de ma concentration, guid√©e par la clart√© et la pr√©sence.\"\n              },\n              {\n                \"id\": \"golden_rules_personnelles\",\n                \"label\": \"Mes r√®gles d'or personnelles pour le focus et la discipline :\",\n                \"inputType\": \"list\",\n                \"placeholder\": \"Ex: 1. Un √©cran = une t√¢che.\"\n              },\n              {\n                \"id\": \"strategies_maintenance\",\n                \"label\": \"Comment je maintiendrai mes acquis √† long terme (mes alertes et mes rem√®des) :\",\n                \"inputType\": \"textarea\",\n                \"placeholder\": \"Si je me sens d√©bord√©e, je reviens √† la r√®gle des 3 priorit√©s et au 'd√©marreur l√©ger'.\"\n              }\n            ]\n          }\n        },\n        {\n          \"id\": \"c1f5686d-b7b3-496f-a8b0-7150b2671ce7\",\n          \"tips\": \"C√©l√®bre tes succ√®s, aussi petits soient-ils. Le point d'am√©lioration n'est pas une critique, mais une opportunit√© de croissance.\",\n          \"type\": \"habitude\",\n          \"title\": \"La R√©trospective Positive\",\n          \"status\": \"pending\",\n          \"questType\": \"side\",\n          \"rationale\": \"Ancre le progr√®s, maintient la motivation et affine continuellement les strat√©gies d'adaptation pour une autonomie durable.\",\n          \"targetReps\": 1,\n          \"description\": \"Chaque fin de semaine, prends 10 minutes pour relire ton Manifeste, puis liste 3 succ√®s et 1 point d'am√©lioration pour la semaine √† venir.\",\n          \"isCompleted\": false,\n          \"time_of_day\": \"evening\",\n          \"tracking_type\": \"boolean\"\n        }\n      ],\n      \"subtitle\": \"Semaines 11-12 ‚Ä¢ Int√©grer et c√©l√©brer les nouveaux piliers\",\n      \"rationale\": \"Consolider les acquis en cr√©ant un document personnel qui formalise la nouvelle identit√© et les strat√©gies de maintenance, assurant une transformation durable.\"\n    }\n  ],\n  \"deepWhy\": \"Pour retrouver une √©nergie sereine, √™tre pleinement pr√©sente dans mon quotidien et accomplir mes objectifs sans le poids du d√©bordement.\",\n  \"identity\": \"Je suis l'Architecte de ma concentration.\",\n  \"strategy\": \"Nous allons construire une structure invisible, ancr√©e dans de micro-habitudes quotidiennes, pour transformer la procrastination en proactivit√© durable et retrouver une stabilit√© pr√©cieuse.\",\n  \"goldenRules\": \"1. Chaque grand projet commence par une seule petite action.\\n2. Ma planification est mon bouclier contre le chaos.\\n3. Quand le doute surgit, je respire et je r√©√©value ma priorit√© unique.\",\n  \"vitalSignal\": {\n    \"name\": \"Minutes de Focus Profond\",\n    \"type\": \"constat\",\n    \"unit\": \"min\",\n    \"startValue\": \"0\",\n    \"description\": \"Le temps pass√© sur une seule t√¢che importante sans interruption ni distraction, mesur√© chaque jour.\",\n    \"targetValue\": \"30\",\n    \"time_of_day\": \"any_time\",\n    \"tracking_type\": \"counter\"\n  },\n  \"grimoireTitle\": \"Le Scriptorium de la Ma√Ætrise\",\n  \"context_problem\": \"Tu te sens souvent submerg√©e par un rythme de vie charg√© et un flot continu de sollicitations, ce qui se traduit par de la procrastination et un sentiment de d√©sorganisation. Ces blocages t'emp√™chent de retrouver l'√©nergie et la stabilit√© souhait√©es pour ton quotidien, te laissant avec l'impression de toujours courir apr√®s le temps et les t√¢ches oubli√©es.\",\n  \"sophiaKnowledge\": \"Tu es une femme dynamique, n√©e en 1988, qui aspire √† un meilleur focus et √† plus de discipline. Tu te sens souvent d√©bord√©e par un rythme de vie charg√© et des sollicitations constantes, ce qui m√®ne √† la procrastination et √† la d√©sorganisation. Malgr√© une bonne qualit√© de sommeil et un stress mod√©r√©, tu manques d'√©nergie et de stabilit√© au quotidien. Mon approche sera douce mais r√©solue, en te guidant pas √† pas vers une ma√Ætrise de ton temps et de ton attention.\",\n  \"maintenanceCheck\": {\n    \"type\": \"surveillance\",\n    \"question\": \"Combien de fois t'es-tu senti(e) d√©bord√©(e) ou d√©sorganis√©(e) cette semaine ?\",\n    \"frequency\": \"hebdomadaire\"\n  },\n  \"estimatedDuration\": \"12 semaines\"\n}\n=== ACTIONS / FRAMEWORKS (√âTAT R√âEL DB) ===\nR√àGLES IMPORTANTES:\n- Les frameworks comptent comme des actions c√¥t√© utilisateur.\n- \"active\" = activ√©e et visible comme active dans l'app. \"pending\" = pas active.\n- On n'active/d√©sactive pas via WhatsApp: la seule mani√®re d'activer/d√©sactiver, c'est depuis le dashboard.\n\nActives (2):\n- [ACTION] Le Moment 'Reset' Matinal (morning)\n- [ACTION] Cartographie des Distractions (any_time)\n\n=== SIGNES VITAUX (√âtat Actuel) ===\n- Minutes de Focus Profond: 0 min\n",
      "template_fingerprint": null
    },
    "scenario_target": "conversation"
  },
  "error": null
}