{
  "id": "ca8498b8-b397-4e7f-98e4-58737b5d2fe5",
  "created_at": "2026-01-08T02:17:32.082266+00:00",
  "status": "completed",
  "dataset_key": "core",
  "scenario_key": "bilan_real_bundle__b71ef50e683140",
  "transcript": [
    {
      "role": "user",
      "content": "Oui",
      "agent_used": null,
      "created_at": "2026-01-08T02:16:22.837333+00:00"
    },
    {
      "role": "assistant",
      "content": "Super, on y va alors. Pour commencer le bilan d'aujourd'hui, parlons de tes pas. Combien en as-tu fait ?",
      "agent_used": "investigator",
      "created_at": "2026-01-08T02:16:27.545725+00:00"
    },
    {
      "role": "user",
      "content": "J'ai d√ª faire autour de 5500 pas. J'ai essay√© de marcher un peu plus.",
      "agent_used": null,
      "created_at": "2026-01-08T02:16:29.770371+00:00"
    },
    {
      "role": "assistant",
      "content": "5500 pas, c'est not√©. C'est une bonne initiative d'avoir essay√© de marcher plus !\n\nPour continuer sur le bilan d'hier, on a la Micro-Pause Active. C'est l'action qui te propose de faire 2-3 minutes d'√©tirements ou de marche rapide toutes les 90 minutes.\n\nAs-tu r√©ussi √† en faire hier ?",
      "agent_used": "investigator",
      "created_at": "2026-01-08T02:16:37.852421+00:00"
    },
    {
      "role": "user",
      "content": "Oui, j'ai r√©ussi √† en faire quelques-unes, mais pas toutes les 90 minutes. J'ai un peu oubli√© parfois.",
      "agent_used": null,
      "created_at": "2026-01-08T02:16:40.1753+00:00"
    },
    {
      "role": "assistant",
      "content": "C'est d√©j√† un bon d√©but d'avoir r√©ussi √† int√©grer quelques micro-pauses, m√™me si l'oubli est fr√©quent au d√©but. On va noter √ßa.\n\nPassons maintenant √† la \"D√©tox Digitale Nocturne\". Est-ce que tu as pu installer une station de recharge pour ton t√©l√©phone hors de ta chambre et utiliser un r√©veil analogique hier ?",
      "agent_used": "investigator",
      "created_at": "2026-01-08T02:16:50.41628+00:00"
    },
    {
      "role": "user",
      "content": "Pas encore compl√®tement, j'ai mis le t√©l√©phone plus loin mais je n'ai pas encore le r√©veil analogique.",
      "agent_used": null,
      "created_at": "2026-01-08T02:16:52.780055+00:00"
    },
    {
      "role": "assistant",
      "content": "Compris pour le t√©l√©phone, c'est d√©j√† un bon pas ! Le r√©veil analogique, √ßa se mettra en place tranquillement.\n\nPour continuer notre bilan d'hier, as-tu pu faire Le Bilan √ânerg√©tique Rapide ?",
      "agent_used": "investigator",
      "created_at": "2026-01-08T02:17:03.40124+00:00"
    },
    {
      "role": "user",
      "content": "J'ai commenc√© √† y r√©fl√©chir un peu, mais je n'ai pas eu le temps de tout noter en d√©tail hier soir.",
      "agent_used": null,
      "created_at": "2026-01-08T02:17:06.553263+00:00"
    },
    {
      "role": "assistant",
      "content": "C'est d√©j√† un bon d√©but d'y avoir r√©fl√©chi ! Le temps file vite, je comprends que ce ne soit pas toujours facile de tout noter en d√©tail. On va le noter pour aujourd'hui.",
      "agent_used": "investigator",
      "created_at": "2026-01-08T02:17:22.17541+00:00"
    },
    {
      "role": "user",
      "content": "Oui, je vais essayer de le faire ce soir.",
      "agent_used": null,
      "created_at": "2026-01-08T02:17:28.610829+00:00"
    },
    {
      "role": "assistant",
      "content": "Alors, as-tu pu faire Le Bilan √ânerg√©tique Rapide hier soir comme tu le souhaitais ? üòä",
      "agent_used": "investigator",
      "created_at": "2026-01-08T02:17:31.639352+00:00"
    }
  ],
  "state_before": {
    "scope": "web",
    "user_id": "c4adcc11-df17-4dea-af73-2e667e55ef27",
    "risk_level": 0,
    "updated_at": "2026-01-08T02:16:22.810123+00:00",
    "current_mode": "investigator",
    "last_processed_at": "2026-01-08T02:16:22.810123+00:00",
    "short_term_context": null,
    "investigation_state": {
      "status": "checking",
      "temp_memory": {
        "opening_done": false
      },
      "pending_items": [
        {
          "id": "224b9189-550d-4f83-81d2-dc4c699ab011",
          "type": "vital",
          "unit": "pas",
          "title": "Nombre de pas quotidiens",
          "tracking_type": "counter"
        },
        {
          "id": "5477990a-daa5-4303-89d4-da498969d3b8",
          "type": "action",
          "title": "Micro-Pause Active",
          "target": 7,
          "description": "Toutes les 90 minutes (ou apr√®s chaque longue p√©riode assise), fais 2-3 minutes d'√©tirements doux ou de marche rapide. Programme un rappel !",
          "tracking_type": "boolean"
        },
        {
          "id": "225a93b0-fee0-4cb0-b7e8-c1f0fd4892df",
          "type": "action",
          "title": "D√©tox Digitale Nocturne",
          "target": 1,
          "description": "Installe une station de recharge pour ton t√©l√©phone HORS de ta chambre. Ach√®te un r√©veil analogique et fais de ta chambre un sanctuaire sans √©cran.",
          "tracking_type": "boolean"
        },
        {
          "id": "c69ac6e9-a9d2-42d4-b9ac-88a611503e56",
          "type": "framework",
          "title": "Le Bilan √ânerg√©tique Rapide",
          "tracking_type": "boolean"
        }
      ],
      "current_item_index": 0
    },
    "last_interaction_at": "2026-01-08T02:16:22.810123+00:00",
    "unprocessed_msg_count": 0
  },
  "state_after": {
    "scope": "web",
    "user_id": "c4adcc11-df17-4dea-af73-2e667e55ef27",
    "risk_level": 0,
    "updated_at": "2026-01-08T02:17:31.634354+00:00",
    "current_mode": "investigator",
    "last_processed_at": "2026-01-08T02:16:22.810123+00:00",
    "short_term_context": null,
    "investigation_state": {
      "status": "checking",
      "temp_memory": {
        "opening_done": true
      },
      "pending_items": [
        {
          "id": "224b9189-550d-4f83-81d2-dc4c699ab011",
          "type": "vital",
          "unit": "pas",
          "title": "Nombre de pas quotidiens",
          "tracking_type": "counter"
        },
        {
          "id": "5477990a-daa5-4303-89d4-da498969d3b8",
          "type": "action",
          "title": "Micro-Pause Active",
          "target": 7,
          "description": "Toutes les 90 minutes (ou apr√®s chaque longue p√©riode assise), fais 2-3 minutes d'√©tirements doux ou de marche rapide. Programme un rappel !",
          "tracking_type": "boolean"
        },
        {
          "id": "225a93b0-fee0-4cb0-b7e8-c1f0fd4892df",
          "type": "action",
          "title": "D√©tox Digitale Nocturne",
          "target": 1,
          "description": "Installe une station de recharge pour ton t√©l√©phone HORS de ta chambre. Ach√®te un r√©veil analogique et fais de ta chambre un sanctuaire sans √©cran.",
          "tracking_type": "boolean"
        },
        {
          "id": "c69ac6e9-a9d2-42d4-b9ac-88a611503e56",
          "type": "framework",
          "title": "Le Bilan √ânerg√©tique Rapide",
          "tracking_type": "boolean"
        }
      ],
      "current_item_index": 3
    },
    "last_interaction_at": "2026-01-08T02:16:22.810123+00:00",
    "unprocessed_msg_count": 6
  },
  "issues": [
    {
      "code": "incoherence_memory_loop",
      "message": "The assistant exhibits a critical short-term memory lapse. After acknowledging the user's intention to complete an action ('Le Bilan √ânerg√©tique Rapide') 'ce soir' (tonight/today) and explicitly stating 'On va le noter pour aujourd'hui', it immediately asks about the completion of the same action 'hier soir' (yesterday evening). This creates a confusing and illogical conversational loop.",
      "evidence": {
        "snippet": "ASSISTANT(investigator): C'est d√©j√† un bon d√©but d'y avoir r√©fl√©chi ! Le temps file vite, je comprends que ce ne soit pas toujours facile de tout noter en d√©tail. On va le noter pour aujourd'hui.\nUSER: Oui, je vais essayer de le faire ce soir.\nASSISTANT(investigator): Alors, as-tu pu faire Le Bilan √ânerg√©tique Rapide hier soir comme tu le souhaitais ? üòä",
        "agent_used": "investigator"
      },
      "severity": "high"
    }
  ],
  "suggestions": [
    {
      "action": "append",
      "rationale": "This addendum aims to prevent the investigator from falling into a memory loop where it asks about past completion of an action that was just explicitly deferred to the present or near future. It reinforces the need for the investigator to track the current status and agreed-upon timeframe for each checkup item.",
      "prompt_key": "sophia.investigator",
      "context_block": "=== CONTEXT (transcript excerpt) ===\n=== STATE_BEFORE (user_chat_states) ===\ncurrent_mode: investigator\nrisk_level: 0\ninvestigation_state:\n{\n  \"status\": \"checking\",\n  \"temp_memory\": {\n    \"opening_done\": false\n  },\n  \"pending_items\": [\n    {\n      \"id\": \"224b9189-550d-4f83-81d2-dc4c699ab011\",\n      \"type\": \"vital\",\n      \"unit\": \"pas\",\n      \"title\": \"Nombre de pas quotidiens\",\n      \"tracking_type\": \"counter\"\n    },\n    {\n      \"id\": \"5477990a-daa5-4303-89d4-da498969d3b8\",\n      \"type\": \"action\",\n      \"title\": \"Micro-Pause Active\",\n      \"target\": 7,\n      \"description\": \"Toutes les 90 minutes (ou apr√®s chaque longue p√©riode assise), fais 2-3 minutes d'√©tirements doux ou de marche rapide. Programme un rappel !\",\n      \"tracking_type\": \"boolean\"\n    },\n    {\n      \"id\": \"225a93b0-fee0-4cb0-b7e8-c1f0fd4892df\",\n      \"type\": \"action\",\n      \"title\": \"D√©tox Digitale Nocturne\",\n      \"target\": 1,\n      \"description\": \"Installe une station de recharge pour ton t√©l√©phone HORS de ta chambre. Ach√®te un r√©veil analogique et fais de ta chambre un sanctuaire sans √©cran.\",\n      \"tracking_type\": \"boolean\"\n    },\n    {\n      \"id\": \"c69ac6e9-a9d2-42d4-b9ac-88a611503e56\",\n      \"type\": \"framework\",\n      \"title\": \"Le Bilan √ânerg√©tique Rapide\",\n      \"tracking_type\": \"boolean\"\n    }\n  ],\n  \"current_item_index\": 0\n}\n=== TRANSCRIPT ===\n#0 USER: Oui\n#1 ASSISTANT(investigator): Super, on y va alors. Pour commencer le bilan d'aujourd'hui, parlons de tes pas. Combien en as-tu fait ?\n#2 USER: J'ai d√ª faire autour de 5500 pas. J'ai essay√© de marcher un peu plus.\n#3 ASSISTANT(investigator): 5500 pas, c'est not√©. C'est une bonne initiative d'avoir essay√© de marcher plus ! Pour continuer sur le bilan d'hier, on a la Micro-Pause Active. C'est l'action qui te propose de faire 2-3 minutes d'√©tirements ou de marche rapide toutes les 90 minutes. As-tu r√©ussi √† en faire hier ?\n\n=== APPLY ===\nprompt_key: sophia.investigator\naction: append\n\nproposed_addendum:\nWhen discussing the completion of an action during a checkup, always prioritize the most recent agreed-upon timeframe. If an action was just deferred to 'today' or 'tonight' in the immediate preceding turns, do not ask about its completion 'yesterday'. Maintain strict conversational coherence regarding the timing of actions.",
      "proposed_addendum": "When discussing the completion of an action during a checkup, always prioritize the most recent agreed-upon timeframe. If an action was just deferred to 'today' or 'tonight' in the immediate preceding turns, do not ask about its completion 'yesterday'. Maintain strict conversational coherence regarding the timing of actions."
    }
  ],
  "metrics": {
    "cost_usd": 0.018863400000000002,
    "request_id": "bdf0a506-c419-4ca1-b3ed-d9c41d7637c0:core:bilan_real_bundle__b71ef50e683140:6dc12c6a-f2bc-443f-bcb6-fe5cb439760f",
    "total_tokens": 66104,
    "output_tokens": 1308,
    "prompt_tokens": 51978,
    "judge_llm_used": true,
    "mega_test_mode": false
  },
  "config": {
    "tags": [
      "sophia.investigator"
    ],
    "limits": {
      "model": "gemini-2.5-flash",
      "user_difficulty": "mid",
      "bilan_actions_count": 3
    },
    "description": "Bilan real (simulate-user) bundle run: capture full logs + full transcript.",
    "plan_snapshot": {
      "plan": {
        "id": "2dc51240-852d-47ff-b9dd-84880324e560",
        "title": "L'Architecture du Corps Libre",
        "status": "active",
        "content": {
          "phases": [
            {
              "id": 1,
              "title": "Phase 1 : L'√âveil √ânerg√©tique - Briser les Cha√Ænes Invisibles",
              "status": "active",
              "actions": [
                {
                  "id": "5477990a-daa5-4303-89d4-da498969d3b8",
                  "tips": "Utilise un minuteur Pomodoro ou une application de rappel. Concentre-toi sur des mouvements qui ciblent tes zones de raideurs habituelles (√©paules, hanches, dos).",
                  "type": "habitude",
                  "title": "Micro-Pause Active",
                  "status": "active",
                  "questType": "main",
                  "rationale": "Briser l'immobilit√© r√©duit les douleurs et am√©liore la circulation, envoyant un signal de mouvement √† ton cerveau. C'est une micro-habitude qui combat la procrastination.",
                  "targetReps": 7,
                  "description": "Toutes les 90 minutes (ou apr√®s chaque longue p√©riode assise), fais 2-3 minutes d'√©tirements doux ou de marche rapide. Programme un rappel !",
                  "isCompleted": false,
                  "time_of_day": "any_time",
                  "tracking_type": "boolean"
                },
                {
                  "id": "225a93b0-fee0-4cb0-b7e8-c1f0fd4892df",
                  "tips": "Choisis un endroit bien visible mais inaccessible depuis ton lit. Le but est d'√©liminer la tentation du scroll au coucher et au r√©veil. Implique ton entourage si besoin.",
                  "type": "mission",
                  "title": "D√©tox Digitale Nocturne",
                  "status": "active",
                  "questType": "side",
                  "rationale": "L'usage du t√©l√©phone la nuit perturbe le sommeil, m√™me inconsciemment. Cette action lib√®re ton esprit du cycle de dopamine et de distraction, cl√© pour regagner de l'√©nergie.",
                  "description": "Installe une station de recharge pour ton t√©l√©phone HORS de ta chambre. Ach√®te un r√©veil analogique et fais de ta chambre un sanctuaire sans √©cran.",
                  "isCompleted": false,
                  "time_of_day": "night",
                  "tracking_type": "boolean"
                },
                {
                  "id": "08972692-a938-4a13-ae8e-b93dae732b57",
                  "tips": "Pense aux interactions, aux t√¢ches, √† l'usage des √©crans. Quand te sens-tu le plus vid√©(e) ? Quand as-tu un pic d'√©nergie ?",
                  "type": "framework",
                  "title": "Le Bilan √ânerg√©tique Rapide",
                  "status": "active",
                  "questType": "side",
                  "rationale": "Prendre conscience des 'voleurs d'√©nergie' est la premi√®re √©tape pour les neutraliser et pour cr√©er plus d'opportunit√©s de vitalit√©. Cela t'aide √† comprendre tes journ√©es irr√©guli√®res.",
                  "targetReps": 1,
                  "description": "R√©fl√©chis et note les moments et activit√©s qui te drainent ou te donnent de l'√©nergie au quotidien. Sois honn√™te avec toi-m√™me.",
                  "isCompleted": false,
                  "time_of_day": "evening",
                  "tracking_type": "boolean",
                  "frameworkDetails": {
                    "type": "one_shot",
                    "intro": "Ton corps et ton esprit r√©agissent constamment aux stimuli. Identifier ce qui te dynamise et ce qui t'√©puise est crucial pour reprendre le contr√¥le de ta vitalit√©. Sois juste observateur, sans jugement.",
                    "sections": [
                      {
                        "id": "p1a3s1",
                        "label": "Activit√©s / Situations qui me drainent (et pourquoi)",
                        "inputType": "list",
                        "placeholder": "Scroll compulsif : sensation de vide apr√®s coup"
                      },
                      {
                        "id": "p1a3s2",
                        "label": "Activit√©s / Situations qui me rechargent (et pourquoi)",
                        "inputType": "list",
                        "placeholder": "Marche rapide de 15 min : oxyg√®ne et √©claircit l'esprit"
                      }
                    ]
                  }
                }
              ],
              "subtitle": "Semaine 1 ‚Ä¢ R√©initialiser les fondations",
              "rationale": "Avant de construire, nous allons lib√©rer de l'√©nergie en coupant les sources de fatigue insidieuses et en posant les bases du mouvement. C'est le grand nettoyage pour un nouveau d√©part."
            },
            {
              "id": 2,
              "title": "Phase 2 : L'Impulsion du Mouvement - Ancrer la Fluidit√©",
              "status": "locked",
              "actions": [
                {
                  "id": "287001ba-800f-4278-b871-77721a41f698",
                  "tips": "Choisis une routine que tu aimes et qui dure moins de 15 minutes. Mets tes v√™tements de sport la veille pour faciliter le processus. Visualise le soulagement des raideurs.",
                  "type": "habitude",
                  "title": "La Routine \"Corps Libre\" (10 min)",
                  "status": "pending",
                  "questType": "main",
                  "rationale": "Un r√©veil corporel structur√© aide √† r√©duire les douleurs chroniques, augmente la souplesse et pr√©pare ton corps aux d√©fis de la journ√©e, combattant l'inertie du 'manque d'activit√©'.",
                  "targetReps": 7,
                  "description": "Chaque matin, r√©alise une courte s√©quence de mouvements doux et d'√©tirements cibl√©s pour r√©veiller ton corps. Trouve une routine de yoga/stretching d√©butant sur YouTube ou une appli.",
                  "isCompleted": false,
                  "time_of_day": "morning",
                  "tracking_type": "boolean"
                },
                {
                  "id": "86ef0a2d-72b6-442c-8bc8-fe8dfd768338",
                  "tips": "Il ne s'agit pas d'une salle de sport, mais d'un espace o√π tu te sens √† l'aise pour bouger. L'ordre physique aide √† l'ordre mental. Un tapis est un signal pour ton cerveau.",
                  "type": "mission",
                  "title": "Espace de Mouvement Sacr√©",
                  "status": "pending",
                  "questType": "side",
                  "rationale": "Cr√©er un environnement propice rend l'action plus facile √† d√©marrer. Moins d'obstacles physiques = moins de r√©sistance mentale et moins de procrastination.",
                  "description": "Identifie et pr√©pare un petit coin dans ta maison d√©di√© √† ton mouvement. Lib√®re-le de tout d√©sordre, ajoute un tapis de sol si tu n'en as pas.",
                  "isCompleted": false,
                  "time_of_day": "any_time",
                  "tracking_type": "boolean"
                },
                {
                  "id": "b52b808f-0e30-4f25-a0e4-c98c6c54b6cf",
                  "tips": "Mets ton t√©l√©phone en mode avion. Cet espace est pour toi, pour 'respirer'. Ce n'est pas du temps perdu, c'est un investissement dans ton √©nergie et ta stabilit√©.",
                  "type": "habitude",
                  "title": "Le Rendez-vous du Silence (15 min)",
                  "status": "pending",
                  "questType": "side",
                  "rationale": "Ces pauses conscientes r√©duisent le stress √©lev√© et la fatigue li√©e √† des journ√©es irr√©guli√®res, recalibrant ton syst√®me nerveux et √©vitant la compensation par le t√©l√©phone.",
                  "targetReps": 7,
                  "description": "Prends 15 minutes chaque apr√®s-midi pour te d√©connecter de tout √©cran, m√™me si tu es d√©bord√©e. Assieds-toi calmement, bois de l'eau, ou fais une courte m√©ditation.",
                  "isCompleted": false,
                  "time_of_day": "afternoon",
                  "tracking_type": "boolean"
                }
              ],
              "subtitle": "Semaine 2 ‚Ä¢ Activer le corps au quotidien",
              "rationale": "Maintenant que l'√©nergie est moins gaspill√©e, nous allons introduire des routines de mouvement sp√©cifiques pour cibler les douleurs, am√©liorer la souplesse et transformer le corps en douceur mais fermement. La consistance est cl√©."
            },
            {
              "id": 3,
              "title": "Phase 3 : La Discipline Douce - G√©rer le Chaos",
              "status": "locked",
              "actions": [
                {
                  "id": "433f5866-31f2-4305-9224-05834d56b351",
                  "tips": "La cl√© est l'imm√©diatet√©. Ne te donne pas le temps de 'r√©fl√©chir' ou de 'remettre √† plus tard'. Choisis un mouvement qui te pla√Æt ou qui cible tes douleurs actuelles.",
                  "type": "habitude",
                  "title": "Le \"Micro-D√©fi\" Post-T√¢che",
                  "status": "pending",
                  "questType": "main",
                  "rationale": "Cela cr√©e une ancre comportementale positive qui lie l'ach√®vement d'une t√¢che √† l'activation physique, brisant le cycle de la procrastination et augmentant l'activit√©.",
                  "targetReps": 7,
                  "description": "Apr√®s chaque t√¢che majeure ou r√©union, engage-toi √† un 'micro-d√©fi' de mouvement : monter 3 √©tages, faire 10 squats, ou une marche rapide de 5 minutes. Varie les plaisirs !",
                  "isCompleted": false,
                  "time_of_day": "any_time",
                  "tracking_type": "boolean"
                },
                {
                  "id": "27c69f1e-95f8-4387-a04e-c00aa10a8281",
                  "tips": "Cette matrice t'aide √† voir quelles t√¢ches te donnent de l'√©nergie (ou sont essentielles √† ta vitalit√©) et lesquelles t'en prennent, m√™me si elles semblent urgentes. L'objectif est de r√©aligner tes actions avec tes objectifs de vitalit√©.",
                  "type": "framework",
                  "title": "La Matrice d'Urgence et de Vitalit√©",
                  "status": "pending",
                  "questType": "side",
                  "rationale": "Face √† des journ√©es irr√©guli√®res et un sentiment d'√™tre d√©bord√©e, cette matrice te donne une clart√© imm√©diate sur ce qui SERT ta vitalit√© et ce qui la nuit, te permettant de prendre des d√©cisions plus align√©es.",
                  "targetReps": 1,
                  "description": "Utilise une matrice simple pour trier tes t√¢ches quotidiennes non pas par urgence/importance, mais par 'urgence' et 'impact sur ma vitalit√©'.",
                  "isCompleted": false,
                  "time_of_day": "morning",
                  "tracking_type": "boolean",
                  "frameworkDetails": {
                    "type": "one_shot",
                    "intro": "La perception d'√™tre 'd√©bord√©e' vient souvent d'une mauvaise priorisation. Cette matrice t'invite √† consid√©rer tes t√¢ches sous l'angle de ton √©nergie et de ta stabilit√©, plut√¥t que juste l'urgence externe.",
                    "sections": [
                      {
                        "id": "p3a2s1",
                        "label": "T√¢ches √† haute urgence et haute vitalit√© (√† faire en priorit√©)",
                        "inputType": "categorized_list",
                        "placeholder": "R√©union client|Travail"
                      },
                      {
                        "id": "p3a2s2",
                        "label": "T√¢ches √† faible urgence mais haute vitalit√© (√† planifier)",
                        "inputType": "categorized_list",
                        "placeholder": "M√©ditation de 15 min|Bien-√™tre"
                      },
                      {
                        "id": "p3a2s3",
                        "label": "T√¢ches √† haute urgence mais faible vitalit√© (√† d√©l√©guer/minimiser)",
                        "inputType": "categorized_list",
                        "placeholder": "R√©pondre √† email non essentiel|Administration"
                      },
                      {
                        "id": "p3a2s4",
                        "label": "T√¢ches √† faible urgence et faible vitalit√© (√† √©liminer)",
                        "inputType": "categorized_list",
                        "placeholder": "Scroll r√©seaux sociaux|Perte de temps"
                      }
                    ]
                  }
                },
                {
                  "id": "e75f5a07-de45-4cd3-a0d8-2c17c7596016",
                  "tips": "Cette r√®gle est un puissant antidote √† la procrastination. L'action est lanc√©e avant que ton cerveau n'ait le temps d'inventer des excuses. C√©l√®bre chaque petite victoire !",
                  "type": "habitude",
                  "title": "La R√®gle des 2 Minutes (pour le mouvement)",
                  "status": "pending",
                  "questType": "side",
                  "rationale": "Brise la barri√®re de l'inertie en rendant le d√©marrage d'une action insignifiant, et renforce l'identit√© de 'personne en mouvement' en accumulant les petites victoires.",
                  "targetReps": 14,
                  "description": "Si une activit√© physique prend moins de 2 minutes, fais-la IMM√âDIATEMENT. Ne r√©fl√©chis pas. Ex: monter les escaliers, faire 10 jumping jacks, ranger tes affaires en t'√©tirant.",
                  "isCompleted": false,
                  "time_of_day": "any_time",
                  "tracking_type": "boolean"
                }
              ],
              "subtitle": "Semaine 3 ‚Ä¢ Int√©grer et ma√Ætriser la procrastination",
              "rationale": "Nous allons transformer tes 'journ√©es irr√©guli√®res' en opportunit√©s structur√©es pour le mouvement et l'√©nergie, en attaquant directement la procrastination et le sentiment d'√™tre 'd√©bord√©e'."
            },
            {
              "id": 4,
              "title": "Phase 4 : L'Ancrage Profond - Mon Nouveau Rythme",
              "status": "locked",
              "actions": [
                {
                  "id": "7ece0042-8a8b-4c77-b6a6-78b4fc91fc1d",
                  "tips": "C'est le moment de te faire plaisir ! Le mouvement n'est pas une corv√©e. La vari√©t√© aide √† maintenir la motivation. Planifie ces moments dans ton agenda comme des rendez-vous importants.",
                  "type": "habitude",
                  "title": "L'Exploration Active (20 min)",
                  "status": "pending",
                  "questType": "main",
                  "rationale": "Introduire le mouvement plaisir renforce l'engagement √† long terme et aide √† maintenir ta vitalit√© au-del√† de la discipline, tout en explorant de nouvelles fa√ßons de g√©rer tes raideurs.",
                  "targetReps": 4,
                  "description": "Quatre fois par semaine, d√©die 20 minutes √† une activit√© physique que tu aimes vraiment ou que tu as toujours voulu essayer : marche rapide en pleine nature, danse, natation, v√©lo, etc. Au-del√† des routines, explore le mouvement plaisir.",
                  "isCompleted": false,
                  "time_of_day": "any_time",
                  "tracking_type": "boolean"
                },
                {
                  "id": "c7c05e82-05dc-425e-9355-726397271ca5",
                  "tips": "Relis tes notes du Bilan √ânerg√©tique. Mesure tes progr√®s par rapport √† tes objectifs initiaux. Sois fier(e) de ce chemin parcouru !",
                  "type": "mission",
                  "title": "Le Bilan du Ph√©nix",
                  "status": "pending",
                  "questType": "side",
                  "rationale": "Le bilan permet de solidifier les acquis, d'identifier les prochaines √©tapes et de renforcer le sentiment de comp√©tence et d'autonomie. C'est un point d'√©tape crucial.",
                  "description": "Prends le temps de revoir tes progr√®s des 4 derni√®res semaines. Qu'est-ce qui a march√© ? Qu'est-ce qui a √©t√© difficile ? Comment te sens-tu maintenant compar√© au d√©but ?",
                  "isCompleted": false,
                  "time_of_day": "any_time",
                  "tracking_type": "boolean"
                },
                {
                  "id": "35f9b55b-bad2-47fa-a7fb-ac4fa17f12ef",
                  "tips": "Ce manifeste est une d√©claration de ton engagement envers toi-m√™me. Affiche-le quelque part o√π tu le verras chaque jour. Il peut inclure des r√®gles d'or personnalis√©es ou des rappels de ton 'deepWhy'.",
                  "type": "framework",
                  "title": "Mon Manifeste de Vitalit√©",
                  "status": "pending",
                  "questType": "side",
                  "rationale": "Ce framework ancre la transformation dans ton identit√©. En d√©finissant tes propres principes, tu passes d'un √©tat d'ex√©cution √† un √©tat de cr√©ation de ta propre vie, avec une vitalit√© durable.",
                  "targetReps": 1,
                  "description": "√âcris ton propre manifeste personnel. Quelles sont les 3-5 valeurs ou principes qui guideront ta vitalit√© et ton mouvement √† partir de maintenant ?",
                  "isCompleted": false,
                  "time_of_day": "evening",
                  "tracking_type": "boolean",
                  "frameworkDetails": {
                    "type": "one_shot",
                    "intro": "Tu as travers√© ce protocole rapide et intense. Il est temps de cristalliser cette nouvelle version de toi-m√™me. Ce manifeste est ton serment personnel, un rappel puissant de qui tu es devenue et de la vie que tu choisis de vivre.",
                    "sections": [
                      {
                        "id": "p4a3s1",
                        "label": "Mon identit√© de vitalit√© (comment je me d√©cris maintenant)",
                        "inputType": "text",
                        "placeholder": "Je suis une personne qui honore son corps par le mouvement et l'√©coute."
                      },
                      {
                        "id": "p4a3s2",
                        "label": "Mes 3-5 principes pour maintenir ma vitalit√©",
                        "inputType": "list",
                        "placeholder": "1. L'activit√© physique n'est pas n√©gociable. 2. J'√©coute les signaux de mon corps."
                      },
                      {
                        "id": "p4a3s3",
                        "label": "Ce que je ne tol√®re plus qui draine mon √©nergie",
                        "inputType": "list",
                        "placeholder": "Le scroll sans fin, la procrastination sur mon bien-√™tre."
                      }
                    ]
                  }
                }
              ],
              "subtitle": "Semaine 4 ‚Ä¢ Consolider la vitalit√© et l'autonomie",
              "rationale": "Cette derni√®re phase vise √† cimenter toutes les habitudes acquises, √† renforcer ton autonomie et √† t'√©quiper mentalement pour maintenir cette nouvelle vitalit√© sur le long terme. Tu es d√©sormais l'architecte de ton corps libre."
            }
          ],
          "deepWhy": "Pour retrouver une √©nergie d√©bordante, soulager mes douleurs et raideurs, et ancrer une stabilit√© qui me permettra de vivre pleinement chaque jour, sans √™tre d√©bord√©e ou frein√©e par mon corps.",
          "identity": "Je suis une force en mouvement, stable et pleine d'√©nergie.",
          "strategy": "Nous allons r√©initialiser ton √©nergie en ciblant les blocages num√©riques et la procrastination, puis ancrer le mouvement pour d√©bloquer ton corps et ton esprit. C'est un sprint pour retrouver ta vitalit√©.",
          "goldenRules": "1. Chaque mouvement compte, m√™me le plus petit.\n2. Mon corps est mon temple, je l'√©coute et le respecte.\n3. Je ne laisse plus le digital voler mon √©nergie ni ma pr√©sence.",
          "vitalSignal": {
            "name": "Nombre de pas quotidiens",
            "type": "constat",
            "unit": "pas",
            "startValue": "3000",
            "description": "Augmenter progressivement le nombre de pas pour retrouver une activit√© physique saine et r√©duire les raideurs. Vise une progression quotidienne.",
            "targetValue": "8000",
            "tracking_type": "counter"
          },
          "grimoireTitle": "L'Architecture du Corps Libre",
          "context_problem": "Fatigu√©e par des journ√©es irr√©guli√®res et un stress √©lev√©, tu te retrouves coinc√©e dans un cycle o√π le manque d'activit√© physique et les douleurs sont amplifi√©s par la procrastination et une compensation digitale excessive. Tes blocages principaux sont le manque de temps per√ßu, la difficult√© √† maintenir de nouvelles habitudes, et une √©nergie fluctuante.",
          "sophiaKnowledge": "Tu es une femme (n√©e en 1988) qui se sent fatigu√©e et souffre de douleurs/raideurs, malgr√© une bonne qualit√© de sommeil. Ton niveau d'activit√© est faible et ton stress √©lev√©. Tes journ√©es irr√©guli√®res te m√®nent √† la procrastination et √† compenser par l'usage du t√©l√©phone, t'emp√™chant de retrouver l'√©nergie et la stabilit√© que tu d√©sires.",
          "maintenanceCheck": {
            "type": "surveillance",
            "question": "Combien de jours cette semaine as-tu ressenti des douleurs persistantes ou une raideur significative te limitant dans tes activit√©s ?",
            "frequency": "hebdomadaire"
          },
          "estimatedDuration": "4 semaines"
        },
        "goal_id": "b2e5dba9-57df-4d72-88a4-0a549e851e18",
        "deep_why": "Pour retrouver une √©nergie d√©bordante, soulager mes douleurs et raideurs, et ancrer une stabilit√© qui me permettra de vivre pleinement chaque jour, sans √™tre d√©bord√©e ou frein√©e par mon corps.",
        "created_at": "2026-01-08T02:16:22.754903+00:00",
        "inputs_why": null,
        "current_phase": 1,
        "submission_id": "92e9cb41-aa6d-440a-bc45-8b2bf2bf2e57",
        "inputs_context": null,
        "inputs_blockers": null,
        "progress_percentage": 0
      },
      "actions": [
        {
          "id": "5477990a-daa5-4303-89d4-da498969d3b8",
          "title": "Micro-Pause Active",
          "status": "active",
          "created_at": "2026-01-08T02:16:22.778369+00:00",
          "description": "Toutes les 90 minutes (ou apr√®s chaque longue p√©riode assise), fais 2-3 minutes d'√©tirements doux ou de marche rapide. Programme un rappel !",
          "target_reps": 7,
          "time_of_day": "any_time",
          "current_reps": 0,
          "tracking_type": "boolean",
          "last_performed_at": "2026-01-06T02:16:22.76+00:00"
        },
        {
          "id": "225a93b0-fee0-4cb0-b7e8-c1f0fd4892df",
          "title": "D√©tox Digitale Nocturne",
          "status": "active",
          "created_at": "2026-01-08T02:16:22.778369+00:00",
          "description": "Installe une station de recharge pour ton t√©l√©phone HORS de ta chambre. Ach√®te un r√©veil analogique et fais de ta chambre un sanctuaire sans √©cran.",
          "target_reps": 1,
          "time_of_day": "night",
          "current_reps": 0,
          "tracking_type": "boolean",
          "last_performed_at": "2026-01-06T02:16:22.76+00:00"
        },
        {
          "id": "c69ac6e9-a9d2-42d4-b9ac-88a611503e56",
          "_kind": "framework",
          "title": "Le Bilan √ânerg√©tique Rapide",
          "status": "active",
          "created_at": "2026-01-08T02:16:22.790593+00:00",
          "description": "",
          "target_reps": 1,
          "time_of_day": null,
          "current_reps": 0,
          "tracking_type": "boolean",
          "framework_type": "one_shot",
          "last_performed_at": "2026-01-06T02:16:22.76+00:00"
        }
      ],
      "frameworks": [
        {
          "id": "c69ac6e9-a9d2-42d4-b9ac-88a611503e56",
          "type": "one_shot",
          "title": "Le Bilan √ânerg√©tique Rapide",
          "status": "active",
          "created_at": "2026-01-08T02:16:22.790593+00:00",
          "target_reps": 1,
          "current_reps": 0,
          "tracking_type": "boolean",
          "last_performed_at": "2026-01-06T02:16:22.76+00:00"
        }
      ],
      "dashboard_context": "=== PLAN ACTUEL (Tableau de Bord) ===\nTitre: L'Architecture du Corps Libre\nStatut: active\nPhase courante (dashboard): 1\nPourquoi (Deep Why): Pour retrouver une √©nergie d√©bordante, soulager mes douleurs et raideurs, et ancrer une stabilit√© qui me permettra de vivre pleinement chaque jour, sans √™tre d√©bord√©e ou frein√©e par mon corps.\nD√âTAIL COMPLET DU PLAN (Structure JSON) :\n{\n  \"phases\": [\n    {\n      \"id\": 1,\n      \"title\": \"Phase 1 : L'√âveil √ânerg√©tique - Briser les Cha√Ænes Invisibles\",\n      \"status\": \"active\",\n      \"actions\": [\n        {\n          \"id\": \"5477990a-daa5-4303-89d4-da498969d3b8\",\n          \"tips\": \"Utilise un minuteur Pomodoro ou une application de rappel. Concentre-toi sur des mouvements qui ciblent tes zones de raideurs habituelles (√©paules, hanches, dos).\",\n          \"type\": \"habitude\",\n          \"title\": \"Micro-Pause Active\",\n          \"status\": \"active\",\n          \"questType\": \"main\",\n          \"rationale\": \"Briser l'immobilit√© r√©duit les douleurs et am√©liore la circulation, envoyant un signal de mouvement √† ton cerveau. C'est une micro-habitude qui combat la procrastination.\",\n          \"targetReps\": 7,\n          \"description\": \"Toutes les 90 minutes (ou apr√®s chaque longue p√©riode assise), fais 2-3 minutes d'√©tirements doux ou de marche rapide. Programme un rappel !\",\n          \"isCompleted\": false,\n          \"time_of_day\": \"any_time\",\n          \"tracking_type\": \"boolean\"\n        },\n        {\n          \"id\": \"225a93b0-fee0-4cb0-b7e8-c1f0fd4892df\",\n          \"tips\": \"Choisis un endroit bien visible mais inaccessible depuis ton lit. Le but est d'√©liminer la tentation du scroll au coucher et au r√©veil. Implique ton entourage si besoin.\",\n          \"type\": \"mission\",\n          \"title\": \"D√©tox Digitale Nocturne\",\n          \"status\": \"active\",\n          \"questType\": \"side\",\n          \"rationale\": \"L'usage du t√©l√©phone la nuit perturbe le sommeil, m√™me inconsciemment. Cette action lib√®re ton esprit du cycle de dopamine et de distraction, cl√© pour regagner de l'√©nergie.\",\n          \"description\": \"Installe une station de recharge pour ton t√©l√©phone HORS de ta chambre. Ach√®te un r√©veil analogique et fais de ta chambre un sanctuaire sans √©cran.\",\n          \"isCompleted\": false,\n          \"time_of_day\": \"night\",\n          \"tracking_type\": \"boolean\"\n        },\n        {\n          \"id\": \"08972692-a938-4a13-ae8e-b93dae732b57\",\n          \"tips\": \"Pense aux interactions, aux t√¢ches, √† l'usage des √©crans. Quand te sens-tu le plus vid√©(e) ? Quand as-tu un pic d'√©nergie ?\",\n          \"type\": \"framework\",\n          \"title\": \"Le Bilan √ânerg√©tique Rapide\",\n          \"status\": \"active\",\n          \"questType\": \"side\",\n          \"rationale\": \"Prendre conscience des 'voleurs d'√©nergie' est la premi√®re √©tape pour les neutraliser et pour cr√©er plus d'opportunit√©s de vitalit√©. Cela t'aide √† comprendre tes journ√©es irr√©guli√®res.\",\n          \"targetReps\": 1,\n          \"description\": \"R√©fl√©chis et note les moments et activit√©s qui te drainent ou te donnent de l'√©nergie au quotidien. Sois honn√™te avec toi-m√™me.\",\n          \"isCompleted\": false,\n          \"time_of_day\": \"evening\",\n          \"tracking_type\": \"boolean\",\n          \"frameworkDetails\": {\n            \"type\": \"one_shot\",\n            \"intro\": \"Ton corps et ton esprit r√©agissent constamment aux stimuli. Identifier ce qui te dynamise et ce qui t'√©puise est crucial pour reprendre le contr√¥le de ta vitalit√©. Sois juste observateur, sans jugement.\",\n            \"sections\": [\n              {\n                \"id\": \"p1a3s1\",\n                \"label\": \"Activit√©s / Situations qui me drainent (et pourquoi)\",\n                \"inputType\": \"list\",\n                \"placeholder\": \"Scroll compulsif : sensation de vide apr√®s coup\"\n              },\n              {\n                \"id\": \"p1a3s2\",\n                \"label\": \"Activit√©s / Situations qui me rechargent (et pourquoi)\",\n                \"inputType\": \"list\",\n                \"placeholder\": \"Marche rapide de 15 min : oxyg√®ne et √©claircit l'esprit\"\n              }\n            ]\n          }\n        }\n      ],\n      \"subtitle\": \"Semaine 1 ‚Ä¢ R√©initialiser les fondations\",\n      \"rationale\": \"Avant de construire, nous allons lib√©rer de l'√©nergie en coupant les sources de fatigue insidieuses et en posant les bases du mouvement. C'est le grand nettoyage pour un nouveau d√©part.\"\n    },\n    {\n      \"id\": 2,\n      \"title\": \"Phase 2 : L'Impulsion du Mouvement - Ancrer la Fluidit√©\",\n      \"status\": \"locked\",\n      \"actions\": [\n        {\n          \"id\": \"287001ba-800f-4278-b871-77721a41f698\",\n          \"tips\": \"Choisis une routine que tu aimes et qui dure moins de 15 minutes. Mets tes v√™tements de sport la veille pour faciliter le processus. Visualise le soulagement des raideurs.\",\n          \"type\": \"habitude\",\n          \"title\": \"La Routine \\\"Corps Libre\\\" (10 min)\",\n          \"status\": \"pending\",\n          \"questType\": \"main\",\n          \"rationale\": \"Un r√©veil corporel structur√© aide √† r√©duire les douleurs chroniques, augmente la souplesse et pr√©pare ton corps aux d√©fis de la journ√©e, combattant l'inertie du 'manque d'activit√©'.\",\n          \"targetReps\": 7,\n          \"description\": \"Chaque matin, r√©alise une courte s√©quence de mouvements doux et d'√©tirements cibl√©s pour r√©veiller ton corps. Trouve une routine de yoga/stretching d√©butant sur YouTube ou une appli.\",\n          \"isCompleted\": false,\n          \"time_of_day\": \"morning\",\n          \"tracking_type\": \"boolean\"\n        },\n        {\n          \"id\": \"86ef0a2d-72b6-442c-8bc8-fe8dfd768338\",\n          \"tips\": \"Il ne s'agit pas d'une salle de sport, mais d'un espace o√π tu te sens √† l'aise pour bouger. L'ordre physique aide √† l'ordre mental. Un tapis est un signal pour ton cerveau.\",\n          \"type\": \"mission\",\n          \"title\": \"Espace de Mouvement Sacr√©\",\n          \"status\": \"pending\",\n          \"questType\": \"side\",\n          \"rationale\": \"Cr√©er un environnement propice rend l'action plus facile √† d√©marrer. Moins d'obstacles physiques = moins de r√©sistance mentale et moins de procrastination.\",\n          \"description\": \"Identifie et pr√©pare un petit coin dans ta maison d√©di√© √† ton mouvement. Lib√®re-le de tout d√©sordre, ajoute un tapis de sol si tu n'en as pas.\",\n          \"isCompleted\": false,\n          \"time_of_day\": \"any_time\",\n          \"tracking_type\": \"boolean\"\n        },\n        {\n          \"id\": \"b52b808f-0e30-4f25-a0e4-c98c6c54b6cf\",\n          \"tips\": \"Mets ton t√©l√©phone en mode avion. Cet espace est pour toi, pour 'respirer'. Ce n'est pas du temps perdu, c'est un investissement dans ton √©nergie et ta stabilit√©.\",\n          \"type\": \"habitude\",\n          \"title\": \"Le Rendez-vous du Silence (15 min)\",\n          \"status\": \"pending\",\n          \"questType\": \"side\",\n          \"rationale\": \"Ces pauses conscientes r√©duisent le stress √©lev√© et la fatigue li√©e √† des journ√©es irr√©guli√®res, recalibrant ton syst√®me nerveux et √©vitant la compensation par le t√©l√©phone.\",\n          \"targetReps\": 7,\n          \"description\": \"Prends 15 minutes chaque apr√®s-midi pour te d√©connecter de tout √©cran, m√™me si tu es d√©bord√©e. Assieds-toi calmement, bois de l'eau, ou fais une courte m√©ditation.\",\n          \"isCompleted\": false,\n          \"time_of_day\": \"afternoon\",\n          \"tracking_type\": \"boolean\"\n        }\n      ],\n      \"subtitle\": \"Semaine 2 ‚Ä¢ Activer le corps au quotidien\",\n      \"rationale\": \"Maintenant que l'√©nergie est moins gaspill√©e, nous allons introduire des routines de mouvement sp√©cifiques pour cibler les douleurs, am√©liorer la souplesse et transformer le corps en douceur mais fermement. La consistance est cl√©.\"\n    },\n    {\n      \"id\": 3,\n      \"title\": \"Phase 3 : La Discipline Douce - G√©rer le Chaos\",\n      \"status\": \"locked\",\n      \"actions\": [\n        {\n          \"id\": \"433f5866-31f2-4305-9224-05834d56b351\",\n          \"tips\": \"La cl√© est l'imm√©diatet√©. Ne te donne pas le temps de 'r√©fl√©chir' ou de 'remettre √† plus tard'. Choisis un mouvement qui te pla√Æt ou qui cible tes douleurs actuelles.\",\n          \"type\": \"habitude\",\n          \"title\": \"Le \\\"Micro-D√©fi\\\" Post-T√¢che\",\n          \"status\": \"pending\",\n          \"questType\": \"main\",\n          \"rationale\": \"Cela cr√©e une ancre comportementale positive qui lie l'ach√®vement d'une t√¢che √† l'activation physique, brisant le cycle de la procrastination et augmentant l'activit√©.\",\n          \"targetReps\": 7,\n          \"description\": \"Apr√®s chaque t√¢che majeure ou r√©union, engage-toi √† un 'micro-d√©fi' de mouvement : monter 3 √©tages, faire 10 squats, ou une marche rapide de 5 minutes. Varie les plaisirs !\",\n          \"isCompleted\": false,\n          \"time_of_day\": \"any_time\",\n          \"tracking_type\": \"boolean\"\n        },\n        {\n          \"id\": \"27c69f1e-95f8-4387-a04e-c00aa10a8281\",\n          \"tips\": \"Cette matrice t'aide √† voir quelles t√¢ches te donnent de l'√©nergie (ou sont essentielles √† ta vitalit√©) et lesquelles t'en prennent, m√™me si elles semblent urgentes. L'objectif est de r√©aligner tes actions avec tes objectifs de vitalit√©.\",\n          \"type\": \"framework\",\n          \"title\": \"La Matrice d'Urgence et de Vitalit√©\",\n          \"status\": \"pending\",\n          \"questType\": \"side\",\n          \"rationale\": \"Face √† des journ√©es irr√©guli√®res et un sentiment d'√™tre d√©bord√©e, cette matrice te donne une clart√© imm√©diate sur ce qui SERT ta vitalit√© et ce qui la nuit, te permettant de prendre des d√©cisions plus align√©es.\",\n          \"targetReps\": 1,\n          \"description\": \"Utilise une matrice simple pour trier tes t√¢ches quotidiennes non pas par urgence/importance, mais par 'urgence' et 'impact sur ma vitalit√©'.\",\n          \"isCompleted\": false,\n          \"time_of_day\": \"morning\",\n          \"tracking_type\": \"boolean\",\n          \"frameworkDetails\": {\n            \"type\": \"one_shot\",\n            \"intro\": \"La perception d'√™tre 'd√©bord√©e' vient souvent d'une mauvaise priorisation. Cette matrice t'invite √† consid√©rer tes t√¢ches sous l'angle de ton √©nergie et de ta stabilit√©, plut√¥t que juste l'urgence externe.\",\n            \"sections\": [\n              {\n                \"id\": \"p3a2s1\",\n                \"label\": \"T√¢ches √† haute urgence et haute vitalit√© (√† faire en priorit√©)\",\n                \"inputType\": \"categorized_list\",\n                \"placeholder\": \"R√©union client|Travail\"\n              },\n              {\n                \"id\": \"p3a2s2\",\n                \"label\": \"T√¢ches √† faible urgence mais haute vitalit√© (√† planifier)\",\n                \"inputType\": \"categorized_list\",\n                \"placeholder\": \"M√©ditation de 15 min|Bien-√™tre\"\n              },\n              {\n                \"id\": \"p3a2s3\",\n                \"label\": \"T√¢ches √† haute urgence mais faible vitalit√© (√† d√©l√©guer/minimiser)\",\n                \"inputType\": \"categorized_list\",\n                \"placeholder\": \"R√©pondre √† email non essentiel|Administration\"\n              },\n              {\n                \"id\": \"p3a2s4\",\n                \"label\": \"T√¢ches √† faible urgence et faible vitalit√© (√† √©liminer)\",\n                \"inputType\": \"categorized_list\",\n                \"placeholder\": \"Scroll r√©seaux sociaux|Perte de temps\"\n              }\n            ]\n          }\n        },\n        {\n          \"id\": \"e75f5a07-de45-4cd3-a0d8-2c17c7596016\",\n          \"tips\": \"Cette r√®gle est un puissant antidote √† la procrastination. L'action est lanc√©e avant que ton cerveau n'ait le temps d'inventer des excuses. C√©l√®bre chaque petite victoire !\",\n          \"type\": \"habitude\",\n          \"title\": \"La R√®gle des 2 Minutes (pour le mouvement)\",\n          \"status\": \"pending\",\n          \"questType\": \"side\",\n          \"rationale\": \"Brise la barri√®re de l'inertie en rendant le d√©marrage d'une action insignifiant, et renforce l'identit√© de 'personne en mouvement' en accumulant les petites victoires.\",\n          \"targetReps\": 14,\n          \"description\": \"Si une activit√© physique prend moins de 2 minutes, fais-la IMM√âDIATEMENT. Ne r√©fl√©chis pas. Ex: monter les escaliers, faire 10 jumping jacks, ranger tes affaires en t'√©tirant.\",\n          \"isCompleted\": false,\n          \"time_of_day\": \"any_time\",\n          \"tracking_type\": \"boolean\"\n        }\n      ],\n      \"subtitle\": \"Semaine 3 ‚Ä¢ Int√©grer et ma√Ætriser la procrastination\",\n      \"rationale\": \"Nous allons transformer tes 'journ√©es irr√©guli√®res' en opportunit√©s structur√©es pour le mouvement et l'√©nergie, en attaquant directement la procrastination et le sentiment d'√™tre 'd√©bord√©e'.\"\n    },\n    {\n      \"id\": 4,\n      \"title\": \"Phase 4 : L'Ancrage Profond - Mon Nouveau Rythme\",\n      \"status\": \"locked\",\n      \"actions\": [\n        {\n          \"id\": \"7ece0042-8a8b-4c77-b6a6-78b4fc91fc1d\",\n          \"tips\": \"C'est le moment de te faire plaisir ! Le mouvement n'est pas une corv√©e. La vari√©t√© aide √† maintenir la motivation. Planifie ces moments dans ton agenda comme des rendez-vous importants.\",\n          \"type\": \"habitude\",\n          \"title\": \"L'Exploration Active (20 min)\",\n          \"status\": \"pending\",\n          \"questType\": \"main\",\n          \"rationale\": \"Introduire le mouvement plaisir renforce l'engagement √† long terme et aide √† maintenir ta vitalit√© au-del√† de la discipline, tout en explorant de nouvelles fa√ßons de g√©rer tes raideurs.\",\n          \"targetReps\": 4,\n          \"description\": \"Quatre fois par semaine, d√©die 20 minutes √† une activit√© physique que tu aimes vraiment ou que tu as toujours voulu essayer : marche rapide en pleine nature, danse, natation, v√©lo, etc. Au-del√† des routines, explore le mouvement plaisir.\",\n          \"isCompleted\": false,\n          \"time_of_day\": \"any_time\",\n          \"tracking_type\": \"boolean\"\n        },\n        {\n          \"id\": \"c7c05e82-05dc-425e-9355-726397271ca5\",\n          \"tips\": \"Relis tes notes du Bilan √ânerg√©tique. Mesure tes progr√®s par rapport √† tes objectifs initiaux. Sois fier(e) de ce chemin parcouru !\",\n          \"type\": \"mission\",\n          \"title\": \"Le Bilan du Ph√©nix\",\n          \"status\": \"pending\",\n          \"questType\": \"side\",\n          \"rationale\": \"Le bilan permet de solidifier les acquis, d'identifier les prochaines √©tapes et de renforcer le sentiment de comp√©tence et d'autonomie. C'est un point d'√©tape crucial.\",\n          \"description\": \"Prends le temps de revoir tes progr√®s des 4 derni√®res semaines. Qu'est-ce qui a march√© ? Qu'est-ce qui a √©t√© difficile ? Comment te sens-tu maintenant compar√© au d√©but ?\",\n          \"isCompleted\": false,\n          \"time_of_day\": \"any_time\",\n          \"tracking_type\": \"boolean\"\n        },\n        {\n          \"id\": \"35f9b55b-bad2-47fa-a7fb-ac4fa17f12ef\",\n          \"tips\": \"Ce manifeste est une d√©claration de ton engagement envers toi-m√™me. Affiche-le quelque part o√π tu le verras chaque jour. Il peut inclure des r√®gles d'or personnalis√©es ou des rappels de ton 'deepWhy'.\",\n          \"type\": \"framework\",\n          \"title\": \"Mon Manifeste de Vitalit√©\",\n          \"status\": \"pending\",\n          \"questType\": \"side\",\n          \"rationale\": \"Ce framework ancre la transformation dans ton identit√©. En d√©finissant tes propres principes, tu passes d'un √©tat d'ex√©cution √† un √©tat de cr√©ation de ta propre vie, avec une vitalit√© durable.\",\n          \"targetReps\": 1,\n          \"description\": \"√âcris ton propre manifeste personnel. Quelles sont les 3-5 valeurs ou principes qui guideront ta vitalit√© et ton mouvement √† partir de maintenant ?\",\n          \"isCompleted\": false,\n          \"time_of_day\": \"evening\",\n          \"tracking_type\": \"boolean\",\n          \"frameworkDetails\": {\n            \"type\": \"one_shot\",\n            \"intro\": \"Tu as travers√© ce protocole rapide et intense. Il est temps de cristalliser cette nouvelle version de toi-m√™me. Ce manifeste est ton serment personnel, un rappel puissant de qui tu es devenue et de la vie que tu choisis de vivre.\",\n            \"sections\": [\n              {\n                \"id\": \"p4a3s1\",\n                \"label\": \"Mon identit√© de vitalit√© (comment je me d√©cris maintenant)\",\n                \"inputType\": \"text\",\n                \"placeholder\": \"Je suis une personne qui honore son corps par le mouvement et l'√©coute.\"\n              },\n              {\n                \"id\": \"p4a3s2\",\n                \"label\": \"Mes 3-5 principes pour maintenir ma vitalit√©\",\n                \"inputType\": \"list\",\n                \"placeholder\": \"1. L'activit√© physique n'est pas n√©gociable. 2. J'√©coute les signaux de mon corps.\"\n              },\n              {\n                \"id\": \"p4a3s3\",\n                \"label\": \"Ce que je ne tol√®re plus qui draine mon √©nergie\",\n                \"inputType\": \"list\",\n                \"placeholder\": \"Le scroll sans fin, la procrastination sur mon bien-√™tre.\"\n              }\n            ]\n          }\n        }\n      ],\n      \"subtitle\": \"Semaine 4 ‚Ä¢ Consolider la vitalit√© et l'autonomie\",\n      \"rationale\": \"Cette derni√®re phase vise √† cimenter toutes les habitudes acquises, √† renforcer ton autonomie et √† t'√©quiper mentalement pour maintenir cette nouvelle vitalit√© sur le long terme. Tu es d√©sormais l'architecte de ton corps libre.\"\n    }\n  ],\n  \"deepWhy\": \"Pour retrouver une √©nergie d√©bordante, soulager mes douleurs et raideurs, et ancrer une stabilit√© qui me permettra de vivre pleinement chaque jour, sans √™tre d√©bord√©e ou frein√©e par mon corps.\",\n  \"identity\": \"Je suis une force en mouvement, stable et pleine d'√©nergie.\",\n  \"strategy\": \"Nous allons r√©initialiser ton √©nergie en ciblant les blocages num√©riques et la procrastination, puis ancrer le mouvement pour d√©bloquer ton corps et ton esprit. C'est un sprint pour retrouver ta vitalit√©.\",\n  \"goldenRules\": \"1. Chaque mouvement compte, m√™me le plus petit.\\n2. Mon corps est mon temple, je l'√©coute et le respecte.\\n3. Je ne laisse plus le digital voler mon √©nergie ni ma pr√©sence.\",\n  \"vitalSignal\": {\n    \"name\": \"Nombre de pas quotidiens\",\n    \"type\": \"constat\",\n    \"unit\": \"pas\",\n    \"startValue\": \"3000\",\n    \"description\": \"Augmenter progressivement le nombre de pas pour retrouver une activit√© physique saine et r√©duire les raideurs. Vise une progression quotidienne.\",\n    \"targetValue\": \"8000\",\n    \"tracking_type\": \"counter\"\n  },\n  \"grimoireTitle\": \"L'Architecture du Corps Libre\",\n  \"context_problem\": \"Fatigu√©e par des journ√©es irr√©guli√®res et un stress √©lev√©, tu te retrouves coinc√©e dans un cycle o√π le manque d'activit√© physique et les douleurs sont amplifi√©s par la procrastination et une compensation digitale excessive. Tes blocages principaux sont le manque de temps per√ßu, la difficult√© √† maintenir de nouvelles habitudes, et une √©nergie fluctuante.\",\n  \"sophiaKnowledge\": \"Tu es une femme (n√©e en 1988) qui se sent fatigu√©e et souffre de douleurs/raideurs, malgr√© une bonne qualit√© de sommeil. Ton niveau d'activit√© est faible et ton stress √©lev√©. Tes journ√©es irr√©guli√®res te m√®nent √† la procrastination et √† compenser par l'usage du t√©l√©phone, t'emp√™chant de retrouver l'√©nergie et la stabilit√© que tu d√©sires.\",\n  \"maintenanceCheck\": {\n    \"type\": \"surveillance\",\n    \"question\": \"Combien de jours cette semaine as-tu ressenti des douleurs persistantes ou une raideur significative te limitant dans tes activit√©s ?\",\n    \"frequency\": \"hebdomadaire\"\n  },\n  \"estimatedDuration\": \"4 semaines\"\n}\n=== ACTIONS / FRAMEWORKS (√âTAT R√âEL DB) ===\nR√àGLES IMPORTANTES:\n- Les frameworks comptent comme des actions c√¥t√© utilisateur.\n- \"active\" = activ√©e et visible comme active dans l'app. \"pending\" = pas active.\n- On n'active/d√©sactive pas via WhatsApp: la seule mani√®re d'activer/d√©sactiver, c'est depuis le dashboard.\n\nActives (3):\n- [ACTION] Micro-Pause Active (any_time)\n- [ACTION] D√©tox Digitale Nocturne (night)\n- [FRAMEWORK] Le Bilan √ânerg√©tique Rapide\n\n=== SIGNES VITAUX (√âtat Actuel) ===\n- Nombre de pas quotidiens: 3000 pas\n",
      "template_fingerprint": "05eaf03ea92859a0"
    },
    "scenario_target": "bilan"
  },
  "error": null
}